"0807.0803","Anatoly Kolomeisky","K. Tsekouras and A. B. Kolomeisky","Parallel Coupling of Symmetric and Asymmetric Exclusion Processes","16 pages",,"10.1088/1751-8113/41/46/465001",,"cond-mat.stat-mech cond-mat.soft","http://arxiv.org/licenses/nonexclusive-distrib/1.0/","  A system consisting of two parallel coupled channels where particles in one
of them follow the rules of totally asymmetric exclusion processes (TASEP) and
in another one move as in symmetric simple exclusion processes (SSEP) is
investigated theoretically. Particles interact with each other via hard-core
exclusion potential, and in the asymmetric channel they can only hop in one
direction, while on the symmetric lattice particles jump in both directions
with equal probabilities. Inter-channel transitions are also allowed at every
site of both lattices. Stationary state properties of the system are solved
exactly in the limit of strong couplings between the channels. It is shown that
strong symmetric couplings between totally asymmetric and symmetric channels
lead to an effective partially asymmetric simple exclusion process (PASEP) and
properties of both channels become almost identical. However, strong asymmetric
couplings between symmetric and asymmetric channels yield an effective TASEP
with nonzero particle flux in the asymmetric channel and zero flux on the
symmetric lattice. For intermediate strength of couplings between the lattices
a vertical cluster mean-field method is developed. This approximate approach
treats exactly particle dynamics during the vertical transitions between the
channels and it neglects the correlations along the channels. Our calculations
show that in all cases there are three stationary phases defined by particle
dynamics at entrances, at exits or in the bulk of the system, while phase
boundaries depend on the strength and symmetry of couplings between the
channels. Extensive Monte Carlo computer simulations strongly support our
theoretical predictions.
","[{""version"":""v1"",""created"":""Fri, 4 Jul 2008 17:56:19 GMT""}]","2009-11-13"
"0807.0805","Aleksey Zinger","A. Zinger","A Comparison Theorem for Gromov-Witten Invariants in the Symplectic
  Category","29 pages",,,,"math.SG math.AG","http://arxiv.org/licenses/nonexclusive-distrib/1.0/","  In this paper we exploit the geometric approach to the virtual fundamental
class, due to Fukaya-Ono and Li-Tian, to compare the virtual fundamental
classes of stable maps to a symplectic manifold and a symplectic submanifold
whenever all constrained stable maps to the former are contained in the latter
to first order. This extends versions of a statement well-known in the
algebraic category to the symplectic category, where it appears to be less
familiar. The latter's inherent flexibility then leads to a confirmation of
Pandharipande's Gopakumar-Vafa prediction for GW-invariants of Fano classes in
6-dimensional symplectic manifolds. In a forthcoming paper, we use a similar
approach to relative Gromov-Witten invariants and the absolute/relative
correspondence in genus~0.
","[{""version"":""v1"",""created"":""Fri, 4 Jul 2008 18:19:31 GMT""},{""version"":""v2"",""created"":""Tue, 23 Sep 2008 00:00:27 GMT""},{""version"":""v3"",""created"":""Mon, 19 Apr 2010 21:17:25 GMT""}]","2010-04-21"
"0807.0806","Z.  Gamba","Z. Gamba","Effective potentials and electrostatic interactions in self-assembled
  molecular bilayers II: the case of biological membranes",,,"10.1063/1.3026662",,"cond-mat.soft cond-mat.stat-mech","http://arxiv.org/licenses/nonexclusive-distrib/1.0/","  We propose a very simple but realistic enough model which allows to include a
large number of molecules in molecular dynamics MD simulations of these
bilayers, but nevertheless taking into account molecular charge distributions,
flexible amphiphilic molecules and a reliable model of water. All these
parameters are essential in a nanoscopic scale study of intermolecular and long
range electrostatic interactions. This model was previously used by us to
simulate a Newton black film and in this paper we extend our investigation to
bilayers of the biological membrane type. The electrostatic interactions are
calculated using Ewald sums and, for the macroscopic long range electrostatic
interactions, we use our previously proposed coarsed fit of the (perpendicular
to the bilayer plane) molecular charge distributions with gaussian
distributions. To study an unique biological membrane (not an stack of
bilayers), we propose a simple effective external potential that takes into
account the microscopic pair distribution functions of water and is used to
simulate the interaction with the surrounding water. The method of effective
macroscopic and external potentials is extremely simple to implement in
numerical simulations, and the spatial and temporal charge inhomogeneities are
then roughly taken into account. Molecular dynamics simulations of several
models of a single biological membrane, of neutral or charged polar
amphiphilics, with or without water (using the TIP5P intermolecular potential
for water) are included.
","[{""version"":""v1"",""created"":""Fri, 4 Jul 2008 18:32:14 GMT""}]","2009-11-13"
"0807.0807","Mustaq Ahmed","Mustaq Ahmed, Anna Lubiw","Shortest Paths Avoiding Forbidden Subpaths","12 pages, 2 figures. Fixed a few typos, rephrased a few sentences,
  and used the STACS style","Proceedings of the 26th International Symposium on Theoretical
  Aspects of Computer Science (STACS), Freiburg, Germany, 2009, pp. 63-74",,,"cs.DM cs.DS","http://arxiv.org/licenses/nonexclusive-distrib/1.0/","  In this paper we study a variant of the shortest path problem in graphs:
given a weighted graph G and vertices s and t, and given a set X of forbidden
paths in G, find a shortest s-t path P such that no path in X is a subpath of
P. Path P is allowed to repeat vertices and edges. We call each path in X an
exception, and our desired path a shortest exception-avoiding path. We
formulate a new version of the problem where the algorithm has no a priori
knowledge of X, and finds out about an exception x in X only when a path
containing x fails. This situation arises in computing shortest paths in
optical networks. We give an algorithm that finds a shortest exception avoiding
path in time polynomial in |G| and |X|. The main idea is to run Dijkstra's
algorithm incrementally after replicating vertices when an exception is
discovered.
","[{""version"":""v1"",""created"":""Fri, 4 Jul 2008 19:30:30 GMT""},{""version"":""v2"",""created"":""Wed, 11 Feb 2009 16:49:43 GMT""}]","2009-02-11"
"0807.0808","Christian Saemann","Sergey Cherkis and Christian Saemann","Multiple M2-branes and Generalized 3-Lie algebras","1+19 pages, version published in Phys. Rev. D","Phys.Rev.D78:066019,2008","10.1103/PhysRevD.78.066019",,"hep-th","http://arxiv.org/licenses/nonexclusive-distrib/1.0/","  We propose a generalization of the Bagger-Lambert-Gustavsson action as a
candidate for the description of an arbitrary number of M2-branes. The action
is formulated in terms of N=2 superfields in three dimensions and corresponds
to an extension of the usual superfield formulation of Chern-Simons matter
theories. Demanding gauge invariance of the resulting theory does not imply the
total antisymmetry of the underlying 3-Lie algebra structure constants. We
relax this condition and propose a class of examples for these generalized
3-Lie algebras. We also discuss how to associate various ordinary Lie algebras.
","[{""version"":""v1"",""created"":""Fri, 4 Jul 2008 19:34:28 GMT""},{""version"":""v2"",""created"":""Sun, 28 Sep 2008 21:38:54 GMT""}]","2008-11-26"
"0807.0809","Yong-Zhong Qian","Y.-Z. Qian, G. J. Wasserburg","Abundances of Sr, Y, and Zr in Metal-Poor Stars and Implications for
  Chemical Evolution in the Early Galaxy","42 pages, 8 figures, to appear in ApJ",,"10.1086/591545",,"astro-ph","http://arxiv.org/licenses/nonexclusive-distrib/1.0/","  Studies of nucleosynthesis in neutrino-driven winds from nascent neutron
stars show that the elements from Sr through Ag with mass numbers A~88-110 are
produced by charged-particle reactions (CPR) during the alpha-process in the
winds. Accordingly, we have attributed all these elements in stars of low
metallicities ([Fe/H]<-1.5) to low-mass and normal supernovae (SNe) from
progenitors of ~8-11M_sun and ~12-25M_sun, respectively, which leave behind
neutron stars. Using this rule and attributing all Fe production to normal SNe,
we previously developed a phenomenological two-component model, which predicts
that [Sr/Fe]>-0.32 for all metal-poor stars. The high-resolution data now
available on Sr abundances in Galactic halo stars show that there is a great
shortfall of Sr relative to Fe in many stars with [Fe/H]<-3. This is in direct
conflict with the above prediction. The same conflict also exists for two other
CPR elements Y and Zr. The very low abundances of Sr, Y, and Zr observed in
stars with [Fe/H]<-3 thus require a stellar source that cannot be low-mass or
normal SNe. We show that this observation requires a stellar source leaving
behind black holes and that hypernovae (HNe) from progenitors of ~25-50M_sun
are the most plausible candidates. (Abridged)
","[{""version"":""v1"",""created"":""Fri, 4 Jul 2008 19:34:57 GMT""}]","2009-11-13"
"0807.0811","Roland Kothes","R. Kothes, T.L. Landecker, W. Reich, S. Safi-Harb, Z. Arzoumanian","DA495 - an aging pulsar wind nebula","25 pages, accepted by ApJ",,"10.1086/591653",,"astro-ph","http://arxiv.org/licenses/nonexclusive-distrib/1.0/","  We present a radio continuum study of the pulsar wind nebula (PWN) DA 495
(G65.7+1.2), including images of total intensity and linear polarization from
408 to 10550 MHz based on the Canadian Galactic Plane Survey and observations
with the Effelsberg 100-m Radio Telescope. Removal of flux density
contributions from a superimposed \ion{H}{2} region and from compact
extragalactic sources reveals a break in the spectrum of DA 495 at 1.3 GHz,
with a spectral index ${\alpha}={-0.45 \pm 0.20}$ below the break and
${\alpha}={-0.87 \pm 0.10}$ above it (${S}_\nu \propto{\nu^{\alpha}}$). The
spectral break is more than three times lower in frequency than the lowest
break detected in any other PWN. The break in the spectrum is likely the result
of synchrotron cooling, and DA 495, at an age of $\sim$20,000 yr, may have
evolved from an object similar to the Vela X nebula, with a similarly energetic
pulsar. We find a magnetic field of $\sim$1.3 mG inside the nebula. After
correcting for the resulting high internal rotation measure, the magnetic field
structure is quite simple, resembling the inner part of a dipole field
projected onto the plane of the sky, although a toroidal component is likely
also present. The dipole field axis, which should be parallel to the spin axis
of the putative pulsar, lies at an angle of ${\sim}50\degr$ east of the North
Celestial Pole and is pointing away from us towards the south-west. The upper
limit for the radio surface brightness of any shell-type supernova remnant
emission around DA 495 is $\Sigma_{1 GHz} \sim 5.4 \times 10^{-23}$ OAWatt
m$^{-2}$ Hz$^{-1}$ sr$^{-1}$ (assuming a radio spectral index of $\alpha =
-0.5$), lower than the faintest shell-type remnant known to date.
","[{""version"":""v1"",""created"":""Fri, 4 Jul 2008 19:59:47 GMT""},{""version"":""v2"",""created"":""Tue, 8 Jul 2008 17:31:33 GMT""}]","2009-11-13"
"0807.0813","Rafael Le\~ao","Marcos Jardim Rafael F. Le\~ao","On the eigenvalues of the twisted Dirac operator",,,,,"math.DG math-ph math.MP","http://arxiv.org/licenses/nonexclusive-distrib/1.0/","  Given a compact Riemannian spin manifold with positive scalar curvature, we
find a family of connections $\nabla^{A_t}$ for $t\in[0,1]$ on a trivial vector
bundle of sufficiently high rank, such that the first eigenvalue of the twisted
Dirac operator $D_{A_t}$ is nonzero and becomes arbitrarily small as $t\to1$.
However, if one restricts the class of twisting connections considered, then
nonzero lower bounds do exist. We illustrate this fact by establishing a
nonzero lower bound for the Dirac operator twisted by Hermitian-Einstein
connections over Riemann surfaces.
","[{""version"":""v1"",""created"":""Fri, 4 Jul 2008 20:07:37 GMT""}]","2008-07-08"
"0807.0814","Yong-Zhong Qian","Yong-Zhong Qian","Chemical Evolution of Heavy Elements in the Early Galaxy: Implications
  for Stellar Sources","9 pages, 6 figures","Pub. Astron. Soc. Australia 25 (2008) 36-43","10.1071/AS07042",,"astro-ph","http://arxiv.org/licenses/nonexclusive-distrib/1.0/","  An overview of the sources for heavy elements in the early Galaxy is given.
It is shown that observations of abundances in metal-poor stars can be used
along with a basic understanding of stellar models to guide the search for the
source of the heavy r-process nuclei (r-nuclei). Observations show that this
source produces very little of the elements from C through Zn including Fe.
This strongly suggests that O-Ne-Mg core-collapse supernovae (SNe) from
progenitors of ~8-11M_sun are the source for the heavy r-nuclei. It is shown
that a two-component model based on the abundances of Fe (from Fe core-collapse
SNe) and Eu (from O-Ne-Mg core-collapse SNe) gives very good quantitative
predictions for the abundances of all the other elements in metal-poor stars.
","[{""version"":""v1"",""created"":""Fri, 4 Jul 2008 20:09:54 GMT""}]","2009-11-13"
"0807.0816","Patricio Gaete","Patricio Gaete and Iv\'an Schmidt","Confinement effects from massive photons","4 pages",,,"USM-TH-235","hep-th","http://arxiv.org/licenses/nonexclusive-distrib/1.0/","  This paper has been withdrawn by the author due to an error in equations 39
and 41.
","[{""version"":""v1"",""created"":""Fri, 4 Jul 2008 20:20:44 GMT""},{""version"":""v2"",""created"":""Fri, 9 Apr 2010 16:06:51 GMT""}]","2010-04-12"
"0807.0817","Gaywalee Yamskulna","Gaywalee Yamskulna","Classification of irreducible modules of the vertex algebra $V_L^+$ when
  $L$ is a nondegenerate even lattice of an arbitrary rank","To appear in J. of Algebra",,,,"math.QA","http://arxiv.org/licenses/nonexclusive-distrib/1.0/","  In this paper, we first classify all irreducible modules of the vertex
algebra $V_L^+$ when $L$ is a negative definite even lattice of arbitrary rank.
In particular, we show that any irreducible $V_L^+$-module is isomorphic to a
submodule of an irreducible twisted $V_L$-module. We then extend this result to
a vertex algebra $V_L^+$ when $L$ is a nondegenerate even lattice of finite
rank.
","[{""version"":""v1"",""created"":""Fri, 4 Jul 2008 20:26:36 GMT""}]","2008-07-08"
"0807.0818","Yong-Zhong Qian","Yong-Zhong Qian","Nucleosynthesis in Metal-Free and Metal-Poor Stars","8 pages, no figures, published in ""Proceedings of First Stars III,""
  Eds. Brian W. O'Shea, Alexander Heger & Tom Abel",,"10.1063/1.2905564",,"astro-ph","http://arxiv.org/licenses/nonexclusive-distrib/1.0/","  There have been a number of important recent developments in theoretical and
observational studies of nucleosynthesis, especially regarding nucleosynthetic
sources at low metallicities. Those selected for discussion here include the
origin of Li6, the primary production of N, the s-process, and the supernova
sources for three groups of metals: (1) C to Zn with mass numbers A<70, (2) Sr
to Ag with A~90-110, and (3) r-process nuclei with A~130 and above.
","[{""version"":""v1"",""created"":""Fri, 4 Jul 2008 20:32:18 GMT""}]","2009-11-13"
"0807.0819","Mya Warren","Mya Warren and Joerg Rottler","Mechanical rejuvenation and over-aging in the soft glassy rheology model","8 pages, 9 figures",,"10.1103/PhysRevE.78.041502",,"cond-mat.soft","http://arxiv.org/licenses/nonexclusive-distrib/1.0/","  Mechanical rejuvenation and over-aging of glasses is investigated through
stochastic simulations of the soft glassy rheology (SGR) model. Strain- and
stress-controlled deformation cycles for a wide range of loading conditions are
analyzed and compared to molecular dynamics simulations of a model polymer
glass. Results indicate that deformation causes predominantly rejuvenation,
whereas over-aging occurs only at very low temperature, small strains, and for
high initial energy states. Although the creep compliance in the SGR model
exhibits full aging independent of applied load, large stresses in the
nonlinear creep regime cause configurational changes leading to rejuvenation of
the relaxation time spectrum probed after a stress cycle. During recovery,
however, the rejuvenated state rapidly returns to the original aging trajectory
due to collective relaxations of the internal strain.
","[{""version"":""v1"",""created"":""Fri, 4 Jul 2008 22:05:40 GMT""}]","2009-11-13"
"0807.0820","Lo\""ic Markley","Loic Markley, Alex M. H. Wong, Yan Wang, and George V. Eleftheriades","A spatially shifted beam approach to subwavelength focusing","5 pages, 7 figures. Content updated following reviewer comments to
  match final published paper","L. Markley, A. M. H. Wong, Y. Wang, G. V. Eleftheriades,
  ""Spatially shifted beam approach to subwavelength focusing,"" Physical Review
  Letters, vol. 101, pp. 113901, Sept. 2008","10.1103/PhysRevLett.101.113901",,"physics.optics","http://arxiv.org/licenses/nonexclusive-distrib/1.0/","  Although negative-refractive-index metamaterials have successfully achieved
subwavelength focusing, image resolution is limited by the presence of losses.
In this Letter, a metal transmission screen with subwavelength spaced slots is
proposed that focuses the near-field beyond the diffraction limit and
furthermore, is easily scaled from microwave frequencies to the optical regime.
An analytical model based on the superposition of shifted beam patterns is
developed that agrees very well with full-wave simulations and is corroborated
by experimental results at microwave frequencies.
","[{""version"":""v1"",""created"":""Fri, 4 Jul 2008 21:06:42 GMT""},{""version"":""v2"",""created"":""Thu, 25 Sep 2008 09:52:59 GMT""}]","2008-09-25"
"0807.0821","Salim El Rouayheb","Salim El Rouayheb, Emina Soljanin","On Wiretap Networks II",,,,,"cs.IT math.IT","http://arxiv.org/licenses/nonexclusive-distrib/1.0/","  We consider the problem of securing a multicast network against a wiretapper
that can intercept the packets on a limited number of arbitrary network links
of his choice. We assume that the network implements network coding techniques
to simultaneously deliver all the packets available at the source to all the
destinations. We show how this problem can be looked at as a network
generalization of the Ozarow-Wyner Wiretap Channel of type II. In particular,
we show that network security can be achieved by using the Ozarow-Wyner
approach of coset coding at the source on top of the implemented network code.
This way, we quickly and transparently recover some of the results available in
the literature on secure network coding for wiretapped networks. We also derive
new bounds on the required secure code alphabet size and an algorithm for code
construction.
","[{""version"":""v1"",""created"":""Fri, 4 Jul 2008 21:20:43 GMT""}]","2008-07-08"
"0807.0822","Arif Akhundov A.","Arif A. Akhundov, Dmitri Yu. Bardin, L. Kalinovskaya and T. Riemann","TERAD91: A Program package for the calculation of the cross sections of
  deep inelastic NC and CC scattering at HERA","9 pages, Talk given at the DESY Workshop ""PHYSICS at HERA"", Hamburg,
  Germany, 29-30 October, 1991","Proceedings of the Workshop PHYSICS at HERA, DESY - Hamburg,
  Editors: W. Buchmueller and G. Ingelman (1992), vol. 3, p. 1285-1293",,,"hep-ph","http://arxiv.org/licenses/nonexclusive-distrib/1.0/","  We present a brief description of the recently developed Fortran code TERAD91
for semi-analytical calculations of the double differential cross sections of
NC and CC deep inelastic electron-proton scattering and of some related
observables. The code is mainly intended for the calculations at HERA or other
ep-colliders but may be also used for similar processes like muon-proton
scattering in fixed-target experiments.
","[{""version"":""v1"",""created"":""Fri, 4 Jul 2008 21:39:24 GMT""}]","2008-07-08"
"0807.0823","Athena Sefat S.","Athena S. Sefat, Ashfia Huq, Michael A. McGuire, Rongying Jin, Brian
  C. Sales, David Mandrus","Superconductivity in Co-doped LaFeAsO","19 pages, 9 figures","Phys. Rev. B 78, 104505 (2008)","10.1103/PhysRevB.78.104505",,"cond-mat.supr-con cond-mat.str-el","http://arxiv.org/licenses/nonexclusive-distrib/1.0/","  Here we report the synthesis and basic characterization of LaFe1-xCoxAsO for
several values of x. The parent phase LaFeAsO orders antiferromagnetically (TN
~ 145 K). Replacing Fe with Co is expected to both electron dope the system and
introduce disorder in the FeAs layer. For x = 0.05 antiferromagnetic order is
destroyed and superconductivity is observed at Tconset = 11.2 K. For x = 0.11
superconductivity is observed at Tc(onset) = 14.3 K, and for x = 0.15 Tc = 6.0
K. Superconductivity is not observed for x = 0.2 and 0.5, but for x = 1, the
material appears to be ferromagnetic (Tc ~ 56 K) as judged by magnetization
measurements. We conclude that Co is an effective dopant to induce
superconductivity. Somewhat surprisingly, the system appears to tolerate
considerable disorder in the FeAs planes.
","[{""version"":""v1"",""created"":""Fri, 4 Jul 2008 21:41:15 GMT""}]","2009-11-13"
"0807.0825","Shao-Feng Wu","Shao-Feng Wu, Shaoyu Yin, Guo-Hong Yang, Peng-Ming Zhang","Energy and entropy radiated by a black hole embedded in the de-Sitter
  braneworld","17 pages, 12 figures, 5 tables, reinterpret the reason of R<1","Phys.Rev.D78:084010,2008","10.1103/PhysRevD.78.084010",,"hep-th","http://arxiv.org/licenses/nonexclusive-distrib/1.0/","  We study the Hawking radiation of (4+n)-dimensional Schwarzschild black hole
imbedded in the space-time with positive cosmological constant. The greybody
and energy emission rates of scalars, fermions, bosons, and gravitons are
calculated in the full range of energy. The valuable information on the
dimensions and curvature of space-time is revealed. Furthermore, we investigate
the entropy radiated and lost by black hole. We find their ratio near unit in
favor of the Bekenstein's conjecture.
","[{""version"":""v1"",""created"":""Fri, 4 Jul 2008 21:55:55 GMT""},{""version"":""v2"",""created"":""Sat, 9 Aug 2008 23:59:23 GMT""}]","2008-11-26"
"0807.0826","Jiannis Pachos","Paolo Maraner and Jiannis K. Pachos","Yang-Mills gauge theories from fermionic lattice models","10 pages, 1 figure, to appear in Phys. Lett. A","Phys.Lett.A373:2542-2545,2009","10.1016/j.physleta.2009.05.029",,"cond-mat.str-el cond-mat.mes-hall hep-lat hep-th quant-ph","http://arxiv.org/licenses/nonexclusive-distrib/1.0/","  A doublet of three-dimensional Dirac fermions can effectively describe the
low energy spectrum of a fermionic cubic lattice. We employ this fermion
doubling to encode a non-Abelian SU(2) charge in the fundamental
representation. We explicitly demonstrate that suitable distortion of the
tunnelling couplings can introduce a scalar and a Yang-Mills field in the
effective low energy description, both coupled to the Dirac fermions. As an
application we simulate Yang-Mills monopoles that give rise to localized
zero-modes and fermion fractionalization. The generation of the non-Abelian
field in the two-dimensional case is also presented.
","[{""version"":""v1"",""created"":""Sat, 5 Jul 2008 12:54:16 GMT""},{""version"":""v2"",""created"":""Thu, 28 May 2009 03:56:50 GMT""}]","2009-08-18"
"0807.0827","Li-Sheng Tseng","Melanie Becker, Li-Sheng Tseng, Shing-Tung Yau","New Heterotic Non-Kahler Geometries","33 pages, harvmac; v2: references added, published version","Adv. Theor. Math. Phys. 13 (2009) 1815-1845",,,"hep-th","http://arxiv.org/licenses/nonexclusive-distrib/1.0/","  New heterotic torsional geometries are constructed as orbifolds of T^2
bundles over K3. The discrete symmetries considered can be freely-acting or
have fixed points and/or fixed curves. We give explicit constructions when the
base K3 is Kummer or algebraic. The orbifold geometries can preserve N=1,2
supersymmetry in four dimensions or be non-supersymmetric.
","[{""version"":""v1"",""created"":""Fri, 4 Jul 2008 22:03:14 GMT""},{""version"":""v2"",""created"":""Thu, 31 Dec 2009 17:33:33 GMT""}]","2014-02-10"
"0807.0828","Richard J. Gonsalves","Richard J. Gonsalves","Perturbative QCD at High Energy Colliders","18 pages, 12 figures, contribution to the Symposium: 50+ Years of
  High Energy Physics at UB, University at Buffalo, October 20-21, 2006. Added
  references in section 4","Int.J.Mod.Phys.E17:870-890,2008","10.1142/S0218301308010210","UB-HET-08-02","hep-ph","http://arxiv.org/licenses/nonexclusive-distrib/1.0/","  Selected applications of perturbative Quantumchromodynamics (QCD) to
predictions of the Standard Model for processes at high energy colliders are
reviewed with emphasis on past successes and future problems. This is a
personal retrospective is not intended to be a comprehensive review of the
field.
","[{""version"":""v1"",""created"":""Fri, 4 Jul 2008 22:05:39 GMT""},{""version"":""v2"",""created"":""Fri, 18 Jul 2008 21:18:04 GMT""},{""version"":""v3"",""created"":""Mon, 28 Jul 2008 20:15:12 GMT""}]","2008-11-26"
