"0807.0829","Alfredo Raya","Alfredo Raya and Edward D. Reyes","Massive Dirac fermions and the zero field quantum Hall effect","15 pages. Accepted in Jour. Phys. A","J.Phys.A41:355401,2008","10.1088/1751-8113/41/35/355401","UMSNH-IFM-F-2008-26","hep-th cond-mat.mes-hall","http://arxiv.org/licenses/nonexclusive-distrib/1.0/","  Through an explicit calculation for a Lagrangian in quantum electrodynamics
in (2+1)-space--time dimensions (QED$_3$), making use of the relativistic Kubo
formula, we demonstrate that the filling factor accompanying the quantized
electrical conductivity for massive Dirac fermions of a single species in two
spatial dimensions is a half (in natural units) when time reversal and parity
symmetries of the Lagrangian are explicitly broken by the fermion mass term. We
then discuss the most general form of the QED$_3$ Lagrangian, both for
irreducible and reducible representations of the Dirac matrices in the plane,
with emphasis on the appearance of a Chern-Simons term. We also identify the
value of the filling factor with a zero field quantum Hall effect (QHE).
","[{""version"":""v1"",""created"":""Fri, 4 Jul 2008 22:42:19 GMT""}]","2008-11-26"
"0807.0830","Qijin Chen","Qijin Chen, and K. Levin","Probing the Spectral Function Using Momentum Resolved Radio Frequency
  Spectroscopy in Trapped Fermi Gases","5 pages, 4 figures","Phys. Rev. Lett. 102, 190402 (2009)","10.1103/PhysRevLett.102.190402",,"cond-mat.str-el cond-mat.quant-gas cond-mat.supr-con","http://arxiv.org/licenses/nonexclusive-distrib/1.0/","  We address recent momentum resolved radio frequency (RF) experiments on
ultracold trapped Fermi gases of $^{40}$K. We show that momentum resolved RF
probes provide measurements of the centrally important fermionic spectral
function. They also serve to remove ambiguity plaguing the interpretation of
momentum integrated RF experiments by establishing a clear dispersion signature
of pairing. We find that the temperature dependence of the spectral function is
dramatic at unitarity, and, importantly, smooth from above to below $T_c$
throughout BCS-BEC crossover. This should be tested experimentally, given
widespread predictions of first order behavior.
","[{""version"":""v1"",""created"":""Fri, 4 Jul 2008 22:48:56 GMT""}]","2011-09-13"
"0807.0831","Rena Ciftci","R. Ciftci, A. K. Ciftci, S. Sultansoy","Possible impact of the fourth generation quarks on production of a
  charged Higgs boson at the LHC","10 pages, 5 figures, 2 tables",,,,"hep-ph","http://arxiv.org/licenses/nonexclusive-distrib/1.0/","  We investigate the impact of the fourth generation quarks on production and
decays of the charged Higgs boson at CERN Large Hadron Collider (LHC) with
triple $b$-tagging. The signal is the process $gg\to \bar{u_4}u_4$, followed by
$\bar{u_4}\to W^{-} \bar{b}$ and $u_4\to h^{+} b$ decays with subsequent
$h^{+}\to t \bar{b}$ and corresponding hermitic conjugates. It is shown that,
if $m_{u_{4}}= 400$ GeV, considered process will provide unique opportunity to
discover charged Higgs boson with mass range of 200 to 350 GeV at the first
years of the LHC run.
","[{""version"":""v1"",""created"":""Fri, 4 Jul 2008 23:00:50 GMT""}]","2008-07-08"
"0807.0832","Igor Bulyzhenkov","I.E. Bulyzhenkov","Astroelectrons as Non-Dual Field Solutions","4 pages",,,,"physics.gen-ph physics.class-ph","http://arxiv.org/licenses/nonexclusive-distrib/1.0/","  The continuous charge density of the r^{-4} radial astroelectron is found
analytically from the Maxwell-Lorentz equations. The electric charge is not a
basic concept, but is the nonlinear field distribution associated with the
elementary self-energy density. The Poisson equation for the unified field
carrier in non-dual electrodynamics locally relates the post-Coulomb potential
with the energy-charge density. The local Maxwell equations maintain the global
overlap of nonlocal electric energy-charges in the undivided Universe.
","[{""version"":""v1"",""created"":""Fri, 4 Jul 2008 23:10:58 GMT""}]","2008-07-08"
"0807.0833","S. -L. Drechsler","J. Malek, S.-L. Drechsler, U. Nitzsche, H. Rosner, and H. Eschrig","Temperature dependent optical conductivity of undoped cuprates with weak
  exchange","5 pages, 3 figures",,"10.1103/PhysRevB.78.060508",,"cond-mat.str-el","http://arxiv.org/licenses/nonexclusive-distrib/1.0/","  The optical conductivity sigma(omega) is calculated at finite temperature T
for CuO_2 chain clusters within a pd-Hubbard model. Data at T = 300 K for
Li_2CuO_2 are reanalyzed within this approach. The relative weights of
Zhang-Rice singlet and triplet charge excitations near 2.5 and 4 eV,
respectively, depend strongly on T, and a rather dramatic dependence of
sigma(omega) on the ratio of the first to second neighbor exchange integrals is
predicted. On the basis of these results, information about exchange
interactionsfor frustrated edge-shared cuprates can be obtained from
T-dependent optical spectra. Our results are also relevant for magnetically
weakly coupled wide-gap insulators in general.
","[{""version"":""v1"",""created"":""Sat, 5 Jul 2008 02:06:48 GMT""}]","2009-11-13"
"0807.0834","Joaquin E. Drut","Joaqu\'in E. Drut, Timo A. L\""ahde","Is graphene in vacuum an insulator?","4 pages, 3 figures, published version","Phys. Rev. Lett. 102, 026802 (2009)","10.1103/PhysRevLett.102.026802","NT@UW-08-26","cond-mat.str-el hep-lat","http://arxiv.org/licenses/nonexclusive-distrib/1.0/","  We present evidence, from Lattice Monte Carlo simulations of the phase
diagram of graphene as a function of the Coulomb coupling between
quasiparticles, that graphene in vacuum is likely to be an insulator. We find a
semimetal-insulator transition at $\alpha_g^\text{crit} = 1.11 \pm 0.06$, where
$\alpha_g^{} \simeq 2.16$ in vacuum, and $\alpha_g^{} \simeq 0.79$ on a
SiO$_2^{}$ substrate. Our analysis uses the logarithmic derivative of the order
parameter, supplemented by an equation of state. The insulating phase
disappears above a critical number of four-component fermion flavors $4 <
N_f^{\text{crit}} < 6$. Our data are consistent with a second-order transition.
","[{""version"":""v1"",""created"":""Sat, 5 Jul 2008 02:02:38 GMT""},{""version"":""v2"",""created"":""Thu, 15 Jan 2009 16:13:43 GMT""}]","2009-01-15"
"0807.0836","David Galvin","David Galvin","A threshold phenomenon for random independent sets in the discrete
  hypercube","32 pages. To appear in {\em Combinatorics, Probability \& Computing}.
  This revision corrects minor errors, expands proof of main technical lemma
  and removes discussion of independent sets of a fixed size",,,,"math.CO","http://arxiv.org/licenses/nonexclusive-distrib/1.0/","  Let $I$ be an independent set drawn from the discrete $d$-dimensional
hypercube $Q_d=\{0,1\}^d$ according to the hard-core distribution with
parameter $\lambda>0$ (that is, the distribution in which each independent set
$I$ is chosen with probability proportional to $\lambda^{|I|}$). We show a
sharp transition around $\lambda=1$ in the appearance of $I$: for $\lambda>1$,
$\min\{|I \cap {\cal E}|, |I \cap {\cal O}|\}=0$ asymptotically almost surely,
where ${\cal E}$ and ${\cal O}$ are the bipartition classes of $Q_d$, whereas
for $\lambda<1$, $\min\{|I \cap {\cal E}|, |I \cap {\cal O}|\}$ is
asymptotically almost surely exponential in $d$. The transition occurs in an
interval whose length is of order $1/d$.
  A key step in the proof is an estimation of $Z_\lambda(Q_d)$, the sum over
independent sets in $Q_d$ with each set $I$ given weight $\lambda^{|I|}$
(a.k.a. the hard-core partition function). We obtain the asymptotics of
$Z_\lambda(Q_d)$ for $\lambda>\sqrt{2}-1$, and nearly matching upper and lower
bounds for $\lambda \leq \sqrt{2}-1$, extending work of Korshunov and
Sapozhenko. These bounds allow us to read off some very specific information
about the structure of an independent set drawn according to the hard-core
distribution.
  We also derive a long-range influence result. For all fixed $\lambda>0$, if
$I$ is chosen from the independent sets of $Q_d$ according to the hard-core
distribution with parameter $\lambda$, conditioned on a particular $v \in {\cal
E}$ being in $I$, then the probability that another vertex $w$ is in $I$ is
$o(1)$ for $w \in {\cal O}$ but $\Omega(1)$ for $w \in {\cal E}$.
","[{""version"":""v1"",""created"":""Sat, 5 Jul 2008 02:25:23 GMT""},{""version"":""v2"",""created"":""Wed, 12 May 2010 15:29:54 GMT""}]","2010-05-13"
"0807.0837","Mustafa Kalafat","Selman Akbulut, Mustafa Kalafat","A class of locally conformally flat 4-manifolds","29 pages, 30 figures. Computation of the sign of the scalar curvature
  is improved. Title changed","New York J. Math. 18 (2012) 733-763",,,"math.DG math.GT","http://arxiv.org/licenses/nonexclusive-distrib/1.0/","  We construct infinite families of non-simply connected locally conformally
flat (LCF) 4-manifolds realizing rich topological types. These manifolds have
strictly negative scalar curvature and the underlying topological 4-manifolds
do not admit any Einstein metrics. Such 4-manifolds are of particular interest
as examples of Bach-flat but non-Einstein spaces in the non-simply connected
case. Besides that the underlying smooth manifolds are examples of spaces that
admit open book decomposition in dimension 4.
","[{""version"":""v1"",""created"":""Sat, 5 Jul 2008 02:56:44 GMT""},{""version"":""v2"",""created"":""Mon, 27 Sep 2010 20:49:20 GMT""},{""version"":""v3"",""created"":""Sun, 17 Jun 2012 19:22:06 GMT""},{""version"":""v4"",""created"":""Mon, 16 Jul 2012 22:12:01 GMT""},{""version"":""v5"",""created"":""Sun, 27 Jan 2013 17:36:54 GMT""}]","2013-01-29"
"0807.0838","Tindjong Rodrigue","D.G. Luchinsky, R. Tindjong, I. Kaufman, P.V.E. McClintock and R.S.
  Eisenberg","Charge fluctuations and their effect on conduction in biological ion
  channels","Conference, UPON2008, 14 pages",,"10.1088/1742-5468/2009/01/P01010",,"physics.bio-ph physics.comp-ph","http://arxiv.org/licenses/nonexclusive-distrib/1.0/","  The effect of fluctuations on the conductivity of ion channels is
investigated. It is shown that modulation of the potential barrier at the
selectivity site due to electrostatic amplification of charge fluctuations at
the channel mouth exerts a leading-order effect on the channel conductivity. A
Brownian dynamical model of ion motion in a channel is derived that takes into
account both fluctuations at the channel mouth and vibrational modes of the
wall. The charge fluctuations are modeled as a short noise flipping the height
of the potential barrier. The wall fluctuations are introduced as a slow
vibrational mode of protein motion that modulates ion conductance both
stochastically and periodically. The model is used to estimate the contribution
of the electrostatic amplification of charge fluctuations to the conductivity
of ion channels.
","[{""version"":""v1"",""created"":""Sat, 5 Jul 2008 02:44:24 GMT""}]","2009-11-13"
"0807.0839","Xian-Yuan Wu","Xian-Yuan Wu, Ping Feng","On a Lower Bound for the Time Constant of First-Passage Percolation","7 pages",,,,"math.PR math-ph math.MP","http://arxiv.org/licenses/nonexclusive-distrib/1.0/","  We consider the Bernoulli first-passage percolation on $\mathbb Z^d (d\ge
2)$. That is, the edge passage time is taken independently to be 1 with
probability $1-p$ and 0 otherwise. Let ${\mu(p)}$ be the time constant. We
prove in this paper that \[ \mu(p_1)-\mu({p_2})\ge
\frac{\mu(p_2)}{1-p_2}(p_2-p_1)\] for all $ 0\leq p_1<p_2< 1$ by using Russo's
formula.
","[{""version"":""v1"",""created"":""Sat, 5 Jul 2008 02:47:39 GMT""},{""version"":""v2"",""created"":""Sun, 13 Jul 2008 08:16:59 GMT""}]","2008-07-13"
"0807.0840","Manish Shrimali","Swarup Poria, Manish Dev Shrimali, Sudeshna Sinha","Enhancement of spatiotemporal regularity in an optimal window of random
  coupling","10 pages, 6 figures",,"10.1103/PhysRevE.78.035201",,"nlin.CD","http://arxiv.org/licenses/nonexclusive-distrib/1.0/","  We investigate the spatiotemporal dynamics of a lattice of coupled chaotic
maps whose coupling connections are dynamically rewired to random sites with
probability p, namely at any instance of time, with probability p a regular
link is switched to a random one. In a range of weak coupling, where
spatiotemporal chaos exists for regular lattices (i.e. for p = 0), we find that
p > 0 yields synchronized periodic orbits. Further we observe that this
regularity occurs over a window of p values, beyond which the basin of
attraction of the synchronized cycle shrinks to zero. Thus we have evidence of
an optimal range of randomness in coupling connections, where spatiotemporal
regularity is efficiently obtained. This is in contrast to the commonly
observed monotonic increase of synchronization with increasing p, as seen for
instance, in the strong coupling regime of the very same system.
","[{""version"":""v1"",""created"":""Sat, 5 Jul 2008 03:46:56 GMT""}]","2009-11-13"
"0807.0841","S. Dhara SKD","C. R. Das, S. Dhara, H. C. Hsu, L. C. Chen, Y. R. Jeng, A. K. Bhaduri,
  Baldev Raj, K. H. Chen, S. K. Albert","Mechanism of recrystallization process in epitaxial GaN under dynamic
  stress field - Atomistic origin of planar defect formation","17 pages, 5 figures including Supplements, Accecepted in J. Raman
  Spectroscopy",,"10.1002/jrs.2336",,"cond-mat.mtrl-sci cond-mat.other","http://arxiv.org/licenses/nonexclusive-distrib/1.0/","  The mechanism of recrystallization in epitaxial (1000) GaN film, introduced
by indentation technique, is probed by lattice dynamic studies using Raman
spectroscopy. The recrystallized region is identified by Micro-Raman area
mapping. Pop-in bursts in loading lines indicate nucleation of dislocations and
climb of dislocations. These processes set in plastic motion of lattice atoms
under stress field at the center of indentation for the initiation of
recrystallization process. A planar defect migration mechanism is evolved. A
pivotal role of vacancy migration is pointed out, for the first time, as the
rate limiting factor for the dislocation dynamics initiating the
recrystallization process in GaN.
","[{""version"":""v1"",""created"":""Sat, 5 Jul 2008 03:55:44 GMT""},{""version"":""v2"",""created"":""Mon, 14 Jul 2008 02:18:31 GMT""},{""version"":""v3"",""created"":""Sat, 2 May 2009 09:33:08 GMT""}]","2015-05-13"
"0807.0842","Manish Shrimali","Manish Dev Shrimali, Swarup Poria, Sudeshna Sinha","Under what kind of parametric fluctuations is spatiotemporal regularity
  the most robust?","12 pages, 5 figures",,,,"nlin.CD","http://arxiv.org/licenses/nonexclusive-distrib/1.0/","  It was observed that the spatiotemporal chaos in lattices of coupled chaotic
maps was suppressed to a spatiotemporal fixed point when some fraction of the
regular coupling connections were replaced by random links. Here we investigate
the effects of different kinds of parametric fluctuations on the robustness of
this spatiotemporal fixed point regime. In particular we study the
spatiotemporal dynamics of the network with noisy interaction parameters,
namely fluctuating fraction of random links and fluctuating coupling strengths.
We consider three types of fluctuations: (i) noisy in time, but homogeneous in
space; (ii) noisy in space, but fixed in time; (iii) noisy in both space and
time. We find that the effect of different kinds of parameteric noise on the
dy- namics is quite distinct: quenched spatial fluctuations are the most
detrimental to spatiotemporal regularity; spatiotemporal fluctuations yield
phenomena similar to that observed when parameters are held constant at the
mean-value; and interestingly, spatiotemporal regularity is most robust under
spatially uniform temporal fluctuations, which in fact yields a larger fixed
point range than that obtained under constant mean-value parameters.
","[{""version"":""v1"",""created"":""Sat, 5 Jul 2008 03:55:55 GMT""}]","2008-07-08"
"0807.0843","S. Dhara SKD","C. R. Das, H. C. Hsu, S. Dhara, A. K. Bhaduri, B. Raj, L. C. Chen, K.
  H. Chen, S. K. Albert, A. Ray and Y. Tzeng","A complete Raman mapping of phase transitions in Si under indentation","12 pages, 6 figures, Submitted in Journal",,,,"cond-mat.mtrl-sci cond-mat.other","http://arxiv.org/licenses/nonexclusive-distrib/1.0/","  Crystalline Si substrates are studied for pressure induced phase
transformation under indentation at room temperature using Berkovich tip. Raman
scattering study is used for the identification of the transformed phases.
Raman line as well as area mapping are used for locating the phases in the
indented region. Calculation of pressure contours in the indented region is
used for understanding the phase distribution. We report here a comprehensive
study of all the phases of Si, reported so far, leading to possible
understanding of material properties useful for possible electromechanical
applications. As a major finding, distribution of amorphous phase in the
indented region deviates from the conventional wisdom of being in the central
region alone. We present phase mapping results for both Si(100) and Si(111)
substrates.
","[{""version"":""v1"",""created"":""Sat, 5 Jul 2008 04:04:37 GMT""},{""version"":""v2"",""created"":""Mon, 14 Jul 2008 02:28:47 GMT""}]","2008-07-14"
"0807.0844","S. Dhara SKD","Satyaprakash Sahoo, M. S. Hu, C. W. Hsu, C. T. Wu, K. H. Chen, L. C.
  Chen, A. K. Arora, and S. Dhara","Surface optical Raman modes in InN nanostructures","13 pages, 4 figures, Submitted in Journal",,"10.1063/1.3040681",,"cond-mat.mtrl-sci","http://arxiv.org/licenses/nonexclusive-distrib/1.0/","  Raman spectroscopic investigations are carried out on one-dimensional
nanostructures of InN,such as nanowires and nanobelts synthesized by chemical
vapor deposition. In addition to the optical phonons allowed by symmetry; A1,
E1 and E2(high) modes, two additional Raman peaks are observed around 528 cm-1
and 560 cm-1 for these nanostructures. Calculations for the frequencies of
surface optical (SO) phonon modes in InN nanostructures yield values close to
those of the new Raman modes. A possible reason for large intensities for SO
modes in these nanostructures is also discussed.
","[{""version"":""v1"",""created"":""Sat, 5 Jul 2008 04:20:28 GMT""}]","2009-11-13"
"0807.0845","Mehdi Nadjafikhah","Mehdi Nadjafikhah, Ali Mahdipour-Shirayeh","Symmetry of Quadratic Homogeneous Differential Systems","10 pages",,,,"math.DG","http://arxiv.org/licenses/nonexclusive-distrib/1.0/","  In this paper, the symmetry group of a differential system of n quadratic
homogeneous first order ODEs of n variables is studied. For this purpose, we
consider the action of both point and contact transformations to signify the
corresponding Lie algebras. We also find the independent differential
invariants of these actions.
","[{""version"":""v1"",""created"":""Sat, 5 Jul 2008 05:52:13 GMT""}]","2008-07-08"
"0807.0846","Mehdi Nadjafikhah","Mehdi Nadjafikhah, Seyed-Reza Hejazi","Symmetries of 2nd order ODE: y'' + G(x)y' + H(x)y = 0","7 pages",,,,"math.DG","http://arxiv.org/licenses/nonexclusive-distrib/1.0/","  This paper is devoted to study the Lie algebra of linear symmetries of a
homogenous 2nd order ODE, by the method of Kushner, Lychagin and Robstov.
","[{""version"":""v1"",""created"":""Sat, 5 Jul 2008 05:55:12 GMT""}]","2008-07-08"
"0807.0847","Yoshiro Kakehashi","Y. Kakehashi, T. Shimabukuro, T Tamashiro, and T. Nakamura","Dynamical CPA and Tight-Binding LMTO Approach to Correlated Electron
  System","To be published in J. Phys. Soc. Jpn. 77 No.9 (2008)",,,,"cond-mat.str-el cond-mat.mtrl-sci","http://arxiv.org/licenses/nonexclusive-distrib/1.0/","  Dynamical Coherent-Potential Approximation (CPA) to correlated electrons has
been extended to a system with realistic Hamiltonian which consists of the
first-principles tight-binding Linear Muffintin Orbital (LMTO) bands and
intraatomic Coulomb interactions. Thermodynamic potential and self-consistent
equations for Green function are obtained on the basis of the functional
integral method and the harmonic approximation which neglects the mode-mode
couplings between the dynamical potentials with different frequency. Numerical
calculations have been performed for Fe and Ni within the 2nd-order dynamical
corrections to the static approximation. The band narrowing of the
quasiparticle states and the 6 eV satellite are obtained for Ni at finite
temperatures. The theory leads to the Curie-Weiss law for both Fe and Ni.
Calculated effective Bohr magneton numbers are 3.0 $\mu_{\rm B}$ for Fe and 1.2
$\mu_{\rm B}$ for Ni, explaining the experimental data. But calculated Curie
temperatures are 2020 K for Fe and 1260 K for Ni, being still overestimated by
a factor of two as compared with the experimental ones. Dynamical effects on
electronic and magnetic properties are discussed by comparing with those in the
static approximations.
","[{""version"":""v1"",""created"":""Sat, 5 Jul 2008 06:34:04 GMT""}]","2008-07-08"
"0807.0848","Giovanni Alessandrini","Giovanni Alessandrini and Romina Gaburro","The local Calderon problem and the determination at the boundary of the
  conductivity","16 pages, submitted","Comm. Partial Differential Equations 34, (8) 2009","10.1080/03605300903017397",,"math.AP","http://arxiv.org/licenses/nonexclusive-distrib/1.0/","  We discuss the inverse problem of determining the, possibly anisotropic,
conductivity of a body $\Omega\subset\mathbb{R}^{n}$ when the so--called
Dirichlet-to-Neumann map is locally given on a non empty portion $\Gamma$ of
the boundary $\partial\Omega$. We extend results of uniqueness and stability at
the boundary, obtained by the same authors in SIAM J. Math. Anal. 33 (2001),
no. 1, 153--171, where the Dirichlet-to-Neumann map was given on all of
$\partial\Omega$ instead. We also obtain a pointwise stability result at the
boundary among the class of conductivities which are continuous at some point
$y\in\Gamma$. Our arguments also apply when the local Neumann-to-Dirichlet map
is available.
","[{""version"":""v1"",""created"":""Sat, 5 Jul 2008 08:15:18 GMT""}]","2012-02-27"
"0807.0849","Samanta Piano","Samanta Piano","Electrical and magnetic properties of nano-scale Pi-junctions","30 pages, 27 figures. To be published as an invited research chapter
  in the book ""Spintronics: Materials, Applications and Devices"", G. C.
  Lombardi et al. (eds.), Nova Science Publishers (2008, in press)",,,,"cond-mat.mtrl-sci cond-mat.supr-con","http://arxiv.org/licenses/nonexclusive-distrib/1.0/","  The physics of the ""Pi"" phase shift in ferromagnetic Josephson junctions
enables a range of applications for spin-electronic devices and quantum
computing. In this respect our research is devoted to the evaluation of the
best materials for the development and the realization of the quantum devices
based on superconductors and at the same point towards the reduction of the
size of the employed heterostructures towards and below nano-scale. In this
chapter we report our investigation of transitions from ""0"" to ""Pi"" states in
Nb Josephson junctions with strongly ferromagnetic barriers of Co, Ni,
Ni$_{80}$Fe$_{20}$ (Py) and Fe. We show that it is possible to fabricate
nanostructured Nb/ Ni(Co, Py, Fe)/Nb $\pi$-junctions with a nano-scale magnetic
dead layer and with a high level of control over the ferromagnetic barrier
thickness variation. In agreement with the theoretical model we estimate, from
the oscillations of the critical current as function of the ferromagnetic
barrier thickness, the exchange energy of the ferromagnetic material and we
obtain that it is close to bulk ferromagnetic materials implying that the
ferromagnet is clean and S/F roughness is minimal. We conclude that S/F/S
Josephson junctions are viable structures in the development of
superconductor-based quantum electronic devices; in particular Nb/Co/Nb and
Nb/Fe/Nb multilayers with their low value of the magnetic dead layer and high
value of the exchange energy can readily be used in controllable two-level
quantum information systems. In this respect, we discuss applications of our
nano-junctions to engineering magnetoresistive devices such as programmable
pseudo-spin-valve Josephson structures.
","[{""version"":""v1"",""created"":""Sat, 5 Jul 2008 08:44:54 GMT""}]","2008-07-08"
"0807.0850","Benni Reznik","O. Morgenshtern, B. Reznik, and I. Zalzberg","Quantum information with single fermions: teleportation and
  fermion-boson entanglement conversion","5 pages, 1 figure",,,,"quant-ph","http://arxiv.org/licenses/nonexclusive-distrib/1.0/","  While single boson entanglement is known to be equivalent to standard
non-identical particle entanglement, the use of fermionic entanglement is
constrained by a parity superselection rule. Nevertheless we show that within
the framework of second quantization, where local modes play the role of
qubits, the analogy with ordinary entanglement holds: two entangled spinless
fermion modes can be used to teleport a single local fermion mode and to
perform standard dense coding. Entanglement concentration and dilution are
possible for fermions. We clarify the meaning of our results by discussing the
connection with quantum reference frames and conversion between spinless
fermion entanglement and spinless boson entanglement.
","[{""version"":""v1"",""created"":""Sat, 5 Jul 2008 08:57:59 GMT""}]","2008-07-08"
