"0807.2243","Joshua Younger","Joshua D. Younger, Giovanni G. Fazio, David J. Wilner, Matthew L. N.
  Ashby, Raymond Blundell, Mark A. Gurwell, Jia-Sheng Huang, Daisuke Iono,
  Alison B. Peck, Glen R. Petitpas, Kimberly S. Scott, Grant W. Wilson, Min S.
  Yun","The Physical Scale of the Far-Infrared Emission in the Most Luminous
  Submillimeter Galaxies","8 pages, 3 tables, 5 figures; accepted to ApJ",,"10.1086/591931",,"astro-ph","http://arxiv.org/licenses/nonexclusive-distrib/1.0/","  We present high resolution submillimeter interferometric imaging of two of
the brightest high-redshift submillimeter galaxies known: GN20 and AzTEC1 at
0.8 and 0.3 arcsec resolution respectively. Our data - the highest resolution
submillimeter imaging of high redshift sources accomplished to date - was
collected in three different array configurations: compact, extended, and very
extended. We derive angular sizes of 0.6 and 1.0 arcsec for GN20 and 0.3 and
0.4 arcsec for AzTEC1 from modeling their visibility functions as a Gaussian
and elliptical disk respectively. Because both sources are B-band dropouts,
they likely lie within a relatively narrow redshift window around z~4, which
indicates their angular extent corresponds to physical scales of 4-8 and 1.5-3
kpc respectively for the starburst region. By way of a series of simple
assumptions, we find preliminary evidence that these hyperluminous starbursts -
with star formation rates >1000 $M_\odot$ yr$^{-1}$ - are radiating at or close
to their Eddington limit. Should future high resolution observations indicate
that these two objects are typical of a population of high redshift
Eddington-limited starbursts, this could have important consequences for models
of star formation and feedback in extreme environments.
","[{""version"":""v1"",""created"":""Tue, 15 Jul 2008 17:19:12 GMT""},{""version"":""v2"",""created"":""Tue, 9 Sep 2008 15:06:11 GMT""}]","2009-11-13"
"0807.2250","Spencer Chang","Spencer Chang, Graham D. Kribs, David Tucker-Smith, and Neal Weiner","Inelastic Dark Matter in Light of DAMA/LIBRA","27 pages, 17 figures, minor revisions","Phys.Rev.D79:043513,2009","10.1103/PhysRevD.79.043513",,"hep-ph astro-ph hep-ex","http://arxiv.org/licenses/nonexclusive-distrib/1.0/","  Inelastic dark matter, in which WIMP-nucleus scatterings occur through a
transition to an excited WIMP state ~ 100 keV above the ground state, provides
a compelling explanation of the DAMA annual modulation signal. We demonstrate
that the relative sensitivities of various dark matter direct detection
experiments are modified such that the DAMA annual modulation signal can be
reconciled with the absence of a reported signal at CDMS-Soudan, XENON10,
ZEPLIN, CRESST, and KIMS for inelastic WIMPs with masses O(100 GeV). We review
the status of these experiments, and make predictions for upcoming ones. In
particular, we note that inelastic dark matter leads to highly suppressed
signals at low energy, with most events typically occurring between 20 to 45
keV (unquenched) at xenon and iodine experiments, and generally no events at
low (~ 10 keV) energies. Suppressing the background in this high energy region
is essential to testing this scenario. The recent CRESST data suggest seven
observed tungsten events, which is consistent with expectations from this
model. If the tungsten signal persists at future CRESST runs, it would provide
compelling evidence for inelastic dark matter, while its absence should exclude
it.
","[{""version"":""v1"",""created"":""Tue, 15 Jul 2008 19:59:10 GMT""},{""version"":""v2"",""created"":""Fri, 31 Oct 2008 17:54:55 GMT""}]","2009-05-22"
"0807.2272","Alain Pham Ngoc Dinh","Phan Thanh Nam (UNS-HCMC), Alain Pham Ngoc Dinh (MAPMO), Pham Hoang
  Quan (UNS-HCMC), Dang Duc Trong (UNS-HCMC)","Ice formation in the Arctic during summer: false-bottoms","22 pages","Applied Mathematics and Computation 227 (2014) 857-870","10.1016/j.amc.2013.11.003",,"math.AP","http://arxiv.org/licenses/nonexclusive-distrib/1.0/","  The only source of ice formation in the Arctic during summer is a layer of
ice called false-bottoms between an under-ice melt pond and the underlying
ocean. Of interest is to give a mathematical model in order to determine the
simultaneous growth and ablation of false-bottoms, which is governed by both of
heat fluxes and salt fluxes. In one dimension, this problem may be considered
mathematically as a two-phase Stefan problem with two free boundaries. Our main
result is to prove the existence and uniqueness of the solution from the
initial condition.
","[{""version"":""v1"",""created"":""Tue, 15 Jul 2008 19:57:53 GMT""},{""version"":""v2"",""created"":""Thu, 24 Nov 2011 10:57:12 GMT""}]","2013-12-17"
"0807.2274","Bernd Lorenz","Joshua H. Tapp, Zhongjia Tang, Bing Lv, Kalyan Sasmal, Bernd Lorenz,
  Paul C.W. Chu and Arnold M. Guloy","LiFeAs: An Intrinsic FeAs-based Superconductor with Tc = 18K","4 pages, 5 figures","Phys. Rev. B 78, 060505(R) (2008)","10.1103/PhysRevB.78.060505",,"cond-mat.supr-con cond-mat.str-el","http://arxiv.org/licenses/nonexclusive-distrib/1.0/","  The synthesis and properties of LiFeAs, a high-Tc Fe-based superconducting
stoichiometric compound, are reported. Single crystal x-ray studies reveal that
it crystallizes in the tetragonal PbFCl type (P4/nmm) with a=3.7914(7) A and
c=6.364(2) A. Unlike the known isoelectronic undoped intrinsic FeAs compounds,
LiFeAs does not show any spin-density wave behavior but exhibits
superconductivity at ambient pressures without chemical doping. It exhibits a
respectable transition temperature of Tc=18 K with electronlike carriers and a
very high critical field, Hc2(0)>80 T. LiFeAs appears to be the chemical
equivalent of the infinite layered compound of the high-Tc cuprates.
","[{""version"":""v1"",""created"":""Tue, 15 Jul 2008 17:05:42 GMT""},{""version"":""v2"",""created"":""Mon, 25 Aug 2008 20:34:16 GMT""}]","2008-08-25"
"0807.2287","Michael Greenblatt","Michael Greenblatt","Adapted coordinates in two dimensions and a proof of Puiseux's theorem","9 pages, v4 expanded to include results on adapted coordinates",,,,"math.CA math.AG","http://arxiv.org/licenses/nonexclusive-distrib/1.0/","  A method for finding Puiseux series goes back to Isaac Newton, which gives
the terms of Puiseux series through an infinite recursive process; an
additional argument is then used to show that the resulting Puiseux series are
convergent. This paper provides an argument based on Newton's method and some
ideas from resolution of singularities that gives a quick proof of both the
existence and convergence of Puiseux series. It is then shown that similar
ideas can be used to give a short proof of the existence of smooth adapted
coordinates for oscillatory integrals in two dimensions, a result first proved
in the real-analytic case by Varchenko [V] and then recently for the general
smooth case by Ikromov-Muller [IM]. The arguments of this paper are entirely
elementary.
","[{""version"":""v1"",""created"":""Tue, 15 Jul 2008 19:21:09 GMT""},{""version"":""v2"",""created"":""Wed, 16 Jul 2008 03:34:06 GMT""},{""version"":""v3"",""created"":""Fri, 25 Jul 2008 03:49:40 GMT""},{""version"":""v4"",""created"":""Sun, 21 Sep 2008 17:19:22 GMT""}]","2008-09-21"
"0807.2308","Yuri Litvinov","Yu.A. Litvinov, F. Bosch, N. Winckler, D. Boutin, H.G. Essel, T.
  Faestermann, H. Geissel, S. Hess, P. Kienle, R. Kn\""obel, C. Kozhuharov, J.
  Kurcewicz, L. Maier, K. Beckert, C. Brandau, L. Chen, C. Dimopoulou, B.
  Fabian, A. Fragner, E. Haettner, M. Hausmann, S.A. Litvinov, M. Mazzocco, F.
  Montes, A. Musumarra, C. Nociforo, F. Nolden, W.R. Plass, A. Prochazka, R.
  Reda, R. Reuschl, C. Scheidenberger, M. Steck, T. St\""ohlker, S. Torilov, M.
  Trassinelli, B. Sun, H. Weick, M. Winkler","Comment on the paper ""Search for oscillation of the electron-capture
  decay probability of $^{142}$Pm"" at arXiv:0807.0649v1","2 p. comment on arXiv:0807.0649v1",,,,"nucl-ex","http://arxiv.org/licenses/nonexclusive-distrib/1.0/","  It is argued that orbital electron-capture decays of neutral $^{142}$Pm atoms
implanted into the lattice of a solid (LBNL experiment) do not fulfil the
constraints of true two-body beta decays, since momentum as well as energy of
the final state are distributed among three objects, namely the electron
neutrino, the recoiling daughter atom and the lattice phonons. To our
understanding, this could be a reason for the non-observation of a periodic
time modulation in the number of electron-capture decays of implanted neutral
$^{142}$Pm atoms.
","[{""version"":""v1"",""created"":""Tue, 15 Jul 2008 18:29:20 GMT""}]","2008-07-16"
"0807.2317","Ronidkumar Chingangbam","R. Chingangbam, A. Deshamukhya","A note on dark energy induced by D-brane motion","5 pages, 4 figures","Int.J.Mod.Phys.D17:2577-2583,2009","10.1142/S0218271808014199",,"gr-qc","http://arxiv.org/licenses/nonexclusive-distrib/1.0/","  In this note we study the possibility of obtaining dark energy solution in a
D-brane scenario in a warped background that includes brane-position dependent
corrections for the non-perturbative superpotential. The volume modulus is
stabilized at instantaneous minima of the potential. Though the model can
account for the existence of dark energy within present observational bound -
fine-tuning of the model parameters becomes unavoidable. Moreover, the model
does not posses a tracker solution.
","[{""version"":""v1"",""created"":""Tue, 15 Jul 2008 18:55:06 GMT""}]","2009-03-20"
"0807.2360","Vlad Gheorghiu","Vlad Gheorghiu and Robert B. Griffiths","Separable Operations on Pure States","Typo corrected in the abstract","Phys. Rev. A 78, 020304 (R) (2008)","10.1103/PhysRevA.78.020304",,"quant-ph","http://arxiv.org/licenses/nonexclusive-distrib/1.0/","  We show that the possible ensembles produced when a separable operation acts
on a single pure bipartite entangled state are completely characterized by a
majorization condition, a collection of inequalities for Schmidt coefficients,
which is identical to that already known for the particular case of local
operations and classical communication (LOCC). As a consequence, various known
results for LOCC, including some involving monotonicity of entanglement, can be
extended to the class of all separable operations.
","[{""version"":""v1"",""created"":""Tue, 15 Jul 2008 18:17:55 GMT""},{""version"":""v2"",""created"":""Mon, 1 Sep 2008 17:06:45 GMT""},{""version"":""v3"",""created"":""Mon, 16 Feb 2009 23:08:01 GMT""}]","2009-02-17"
"0807.2400","Manuel Tessmer","Sukanta Bose, Achamveedu Gopakumar, Manuel Tessmer","Gravitational wave data analysis implications of TaylorEt inspiral
  approximants for ground-based detectors: the non-spinning case","3 figures, 5 tables",,,,"gr-qc","http://arxiv.org/licenses/nonexclusive-distrib/1.0/","  A new family of restricted post-Newtonian-accurate waveforms, termed TaylorEt
approximants, was recently proposed for searching gravitational wave (GW)
signals from inspiraling non-spinning compact binaries having arbitrary
mass-ratios. We perform detailed fitting factor (FF) studies to probe if the
TaylorEt (3.5PN) signals for non-spinning comparable mass compact binaries can
be effectually and faithfully searched with TaylorT1, TaylorT4, and TaylorF2
(3.5PN) templates in LIGO, Advanced LIGO, and Virgo interferometers. We observe
that a good fraction of the templates, which by choice are from TaylorT1,
TaylorT4, and TaylorF2 (3.5PN) families, have FF <~ 0.97 and substantial biases
for the estimated total-mass against the fiducial TaylorEt (3.5PN) signals for
equal-mass systems. Both these observations can bear on the detectability of a
signal. TaylorEt (3.5PN) signals with mass-ratios of a third or a quarter yield
high FFs against those same template banks, but at the expense of inviting
large systematic errors in the estimated values of their total mass and
symmetric mass-ratio. In general, the aforementioned templates are found to be
increasingly {\it unfaithful} with respect to a TaylorEt signal as one
increases the total mass of the inspiraling system. We also observe that the
amount of bias in the estimated mass varies with the (noise power spectral
density of the) detector. This can be of some concern for multi-detector
searches, which check for consistency in the estimated masses of concurrent
triggers in their data. (Abridged)
","[{""version"":""v1"",""created"":""Tue, 15 Jul 2008 16:15:59 GMT""},{""version"":""v2"",""created"":""Tue, 28 Feb 2012 11:30:42 GMT""}]","2012-02-29"
"0807.2405","Leszek Motyka","A. Kulesza and L. Motyka","Threshold resummation for squark-antisquark and gluino-pair production
  at the LHC","10 pages, 2 figures","Phys.Rev.Lett.102:111802,2009","10.1103/PhysRevLett.102.111802","DESY 08-096","hep-ph","http://arxiv.org/licenses/nonexclusive-distrib/1.0/","  We study the effect of soft gluon emission in the hadroproduction of
squark-antisquark and gluino-gluino pairs at the next-to-leading logarithmic
(NLL) accuracy within the framework of the minimal supersymmetric model. The
one-loop soft anomalous dimension matrices controlling the colour evolution of
the underlying hard-scattering processes are calculated. We present the
resummed total cross sections and show numerical results for proton-proton
collisions at 14 TeV. The size of the NLL contribution to the cross section and
the reduction of the scale dependence of the theoretical predictions due to
including soft gluon effects are discussed.
","[{""version"":""v1"",""created"":""Tue, 15 Jul 2008 16:07:05 GMT""}]","2009-04-09"
"0807.2406","Fernando Fantino","Nicol\'as Andruskiewitsch, Fernando Fantino and Shouchuan Zhang","On pointed Hopf algebras associated with the symmetric groups","14 pages; typos added in abstract","Manuscripta Math., Vol. 128, N. 3 (March 2009). Pages 359-371",,,"math.QA","http://arxiv.org/licenses/nonexclusive-distrib/1.0/","  It is an important open problem whether the dimension of the Nichols algebra
B(O,\rho) is finite when O is the class of the transpositions and \rho is the
sign representation, with m>= 6. In the present paper, we discard most of the
other conjugacy classes showing that very few pairs (O,\rho) might give rise to
finite-dimensional Nichols algebras.
","[{""version"":""v1"",""created"":""Tue, 15 Jul 2008 16:03:15 GMT""},{""version"":""v2"",""created"":""Thu, 24 Jul 2008 14:48:14 GMT""}]","2010-06-29"
"0807.2407","Quan Wang","Quan Wang","First Result of Net-Charge Jet-Correlations from STAR",,"Indian J.Phys.85:1181-1184,2011","10.1007/s12648-011-0122-7",,"hep-ex","http://creativecommons.org/licenses/by/3.0/","  We presented results on azimuthal correlation of net-charge with high $p_T$
trigger particles. It is found that the net-charge correlation shape is similar
to that of total-charge. On the near-side, the net-charge and total-charge
$p_T$ spectra have similar shape and both are harder than the inclusives. On
the away-side, the correlated spectra are not much harder than the inclusives,
and the net-charge/total-charge ratio increases with $p_T$ and is similar to
the inclusive ratio.
","[{""version"":""v1"",""created"":""Tue, 15 Jul 2008 16:04:54 GMT""}]","2011-08-11"
"0807.2408","Emmanuel Latour","The BABAR Collaboration: B.Aubert, et al","Measurement of Ratios of Branching Fractions and CP-Violating
  Asymmetries of B -> D*K Decays","12 pages, 2 postscript figures","Phys.Rev.D78:092002,2008","10.1103/PhysRevD.78.092002","BABAR-PUB-08/017, SLAC-PUB-13305","hep-ex","http://arxiv.org/licenses/nonexclusive-distrib/1.0/","  We report a study of B -> D*K decays with D* decaying to D pi0 or D gamma,
using 383 * 10**6 B Bbar pairs collected at the Upsilon(4S) resonance with the
BaBar detector at the SLAC PEP-II B-Factory. The D meson decays under study
include a non-CP mode (Kpi), CP-even modes (K+K-, pi^+pi^-) and CP-odd modes
(KS pi0, KS phi, KS omega). We measure ratios (R*_{CP+-}) of branching
fractions of decays to CP eigenmode states and to flavor-specific states as
well as CP asymmetries (A*_{CP+-}). These measurements are sensitive to the
unitarity triangle angle gamma. We obtain A*_{CP+} = -0.11 pm 0.09 pm 0.01,
R*_{CP+} = ~1.31 pm 0.13 pm 0.04, and A*_{CP-} = 0.06 pm 0.10 pm 0.02, R*_{CP-}
= ~1.10 pm 0.12 pm 0.04, where the first error is statistical and the second
error is systematic. Translating our results into an alternative
parametrization, widely used for related measurements, we obtain x*_{+}=0.11 pm
0.06 pm 0.02 and x*_{-} = 0.00 pm 0.06 pm 0.02. No significant CP-violating
charge asymmetry is found in either the flavor-specific mode D -> K pi or in B
-> D* pi decays.
","[{""version"":""v1"",""created"":""Tue, 15 Jul 2008 16:10:01 GMT""},{""version"":""v2"",""created"":""Fri, 3 Oct 2008 12:51:56 GMT""}]","2010-04-12"
"0807.2409","Antonio Moro","E.V. Ferapontov, A. Moro","Dispersive deformations of hydrodynamic reductions of 2D dispersionless
  integrable systems","18 pages, section added","J. Phys. A: Math. Theor, 42 No 3, pp. 035211 (1-15), 2009","10.1088/1751-8113/42/3/035211",,"nlin.SI","http://arxiv.org/licenses/nonexclusive-distrib/1.0/","  We demonstrate that hydrodynamic reductions of dispersionless integrable
systems in 2+1 dimensions, such as the dispersionless Kadomtsev-Petviashvili
(dKP) and dispersionless Toda lattice (dTl) equations, can be deformed into
reductions of the corresponding dispersive counterparts. Modulo the Miura
group, such deformations are unique. The requirement that any hydrodynamic
reduction possesses a deformation of this kind imposes strong constraints on
the structure of dispersive terms, suggesting an alternative approach to the
integrability in 2+1 dimensions.
","[{""version"":""v1"",""created"":""Tue, 15 Jul 2008 16:18:03 GMT""},{""version"":""v2"",""created"":""Fri, 19 Sep 2008 15:03:40 GMT""},{""version"":""v3"",""created"":""Tue, 23 Sep 2008 09:40:51 GMT""}]","2012-10-01"
"0807.2410","Ioannis Remediakis","Ioannis N. Remediakis, Georgios Kopidakis and Pantelis C. Kelires","Softening of ultra-nanocrystalline diamond at low grain sizes","5 pages, 3 figures, to be published in Acta Materialia",,,,"cond-mat.mtrl-sci","http://arxiv.org/licenses/nonexclusive-distrib/1.0/","  Ultra-nanocrystalline diamond is a polycrystalline material, having
crystalline diamond grains of sizes in the nanometer regime. We study the
structure and mechanical properties of this material as a function of the
average grain size, employing atomistic simulations. From the calculated
elastic constants and the estimated hardness, we observe softening of the
material as the size of its grains decreases. We attribute the observed
softening to the enhanced fraction of interfacial atoms as the average grain
size becomes smaller. We provide a fitting formula for the scaling of the
cohesive energy and bulk modulus with respect to the average grain size. We
find that they both scale as quadratic polynomials of the inverse grain size.
Our formulae yield correct values for bulk diamond in the limit of large grain
sizes.
","[{""version"":""v1"",""created"":""Tue, 15 Jul 2008 16:37:47 GMT""}]","2008-07-16"
"0807.2411","Sergio Coutinho","P. H. Figueir\^edo, S. Coutinho and R. M. Zorzenon dos Santos","Robustness of a Cellular Automata Model for the HIV Infection","14 pages, 6 figures, 21 references, Latex style Elsart",,"10.1016/j.physa.2008.07.011",,"physics.bio-ph physics.med-ph q-bio.CB q-bio.PE","http://arxiv.org/licenses/nonexclusive-distrib/1.0/","  An investigation was conducted to study the robustness of the results
obtained from the cellular automata model which describes the spread of the HIV
infection within lymphoid tissues [R. M. Zorzenon dos Santos and S. Coutinho,
Phys. Rev. Lett. 87, 168102 (2001)]. The analysis focussed on the dynamic
behavior of the model when defined in lattices with different symmetries and
dimensionalities. The results illustrated that the three-phase dynamics of the
planar models suffered minor changes in relation to lattice symmetry variations
and, while differences were observed regarding dimensionality changes,
qualitative behavior was preserved. A further investigation was conducted into
primary infection and sensitiveness of the latency period to variations of the
model's stochastic parameters over wide ranging values. The variables
characterizing primary infection and the latency period exhibited power-law
behavior when the stochastic parameters varied over a few orders of magnitude.
The power-law exponents were approximately the same when lattice symmetry
varied, but there was a significant variation when dimensionality changed from
two to three. The dynamics of the three-dimensional model was also shown to be
insensitive to variations of the deterministic parameters related to cell
resistance to the infection, and the necessary time lag to mount the specific
immune response to HIV variants. The robustness of the model demonstrated in
this work reinforce that its basic hypothesis are consistent with the
three-stage dynamic of the HIV infection observed in patients.
","[{""version"":""v1"",""created"":""Tue, 15 Jul 2008 16:48:23 GMT""}]","2008-07-21"
"0807.2412","Jos\'e Lorenzana","J. Lorenzana, G. Seibold, C. Ortix and M. Grilli","Competing orders in FeAs layers","5 pages, 2 figures","Phys. Rev. Lett. 101, 186402 (2008)","10.1103/PhysRevLett.101.186402",,"cond-mat.supr-con cond-mat.str-el","http://arxiv.org/licenses/nonexclusive-distrib/1.0/","  Using the unrestricted Hartree-Fock approximation and Landau theory we
identify possible phases competing with superconductivity in FeAs layers. We
find that close to half-filling the transition from the paramagnet to the
magnetically ordered phase is first-order making anharmonicities relevant and
leading to a rich phase diagram. Between the already known one dimensionally
modulated magnetic stripe phase and the paramagnet we find a new phase which
has the same structure factor as the former but in which magnetic moments at
nearest-neighbor sites are at right angles making electrons to acquire a non
trivial phase when circulating a plaquette at strong coupling. Another
competing phase has magnetic and charge order and may be stabilized by charged
impurities.
","[{""version"":""v1"",""created"":""Tue, 15 Jul 2008 16:49:55 GMT""}]","2009-11-13"
"0807.2413","Francisco De Zela","F. De Zela","A non-local hidden-variable model that violates Leggett-type
  inequalities","14 pages, no figures. Section 2.2 modified by generalizing the model
  to arbitrary initial states","J. Phys. A: Math. Theor. 41 (2008) 505301","10.1088/1751-8113/41/50/505301",,"quant-ph","http://arxiv.org/licenses/nonexclusive-distrib/1.0/","  Recent experiments of Groeblacher et al. proved the violation of a
Leggett-type inequality that was claimed to be valid for a broad class of
non-local hidden-variable theories. The impossibility of constructing a
non-local and realistic theory, unless it entails highly counterintuitive
features, seems thus to have been experimentally proved. This would bring us
close to a definite refutation of realism. Indeed, realism was proved to be
also incompatible with locality, according to a series of experiments testing
Bell inequalities. The present paper addresses the said experiments of
Groeblacher et al. and presents an explicit, contextual and realistic, model
that reproduces the predictions of quantum mechanics. It thus violates the
Leggett-type inequality that was established with the aim of ruling out a
supposedly broad class of non-local models. We can thus conclude that plausible
contextual, realistic, models are still tenable. This restates the possibility
of a future completion of quantum mechanics by a realistic and contextual
theory which is not in a class containing only highly counterintuitive models.
The class that was ruled out by the experiments of Groeblacher et al. is thus
proved to be a limited one, arbitrarily separating models that physically
belong in the same class.
","[{""version"":""v1"",""created"":""Tue, 15 Jul 2008 16:58:49 GMT""},{""version"":""v2"",""created"":""Mon, 10 Nov 2008 21:43:25 GMT""}]","2008-11-10"
"0807.2414","Christophe Ringeval","Larissa Lorenz, Jerome Martin and Christophe Ringeval","Constraints on Kinetically Modified Inflation from WMAP5","7 pages, 6 figures, uses RevTeX","Phys.Rev.D78:063543,2008","10.1103/PhysRevD.78.063543",,"astro-ph gr-qc hep-ph hep-th","http://arxiv.org/licenses/nonexclusive-distrib/1.0/","  Single field inflationary models with a non-minimal kinetic term (also called
k-inflationary models) can be characterised by the so-called sound flow
functions, which complete the usual Hubble flow hierarchy. These parameters
appear in the primordial power spectra of cosmological perturbations at leading
order and, therefore, affect the resulting Cosmic Microwave Background (CMB)
anisotropies. Using the fifth year Wilkinson Microwave Anisotropy Probe (WMAP5)
data, we derive the marginalised posterior probability distributions for both
the sound and Hubble flow parameters. In contrast to the standard situation,
these parameters remain separately unbounded, and notably there is no longer
any upper limit on epsilon_1, the first Hubble flow function. Only special
combinations of these parameters, corresponding to the spectral index and
tensor-to-scalar ratio observables, are actually constrained by the data. The
energy scale of k-inflation is nevertheless limited from above to Hinf/mpl <
6x10^(-6) at two-sigma level. Moreover, for the sub-class of Dirac-Born-Infeld
models, by considering the non-gaussianity bounds on the sound speed, we find a
weak limit epsilon_1 < 0.08 at 95% confidence level.
","[{""version"":""v1"",""created"":""Tue, 15 Jul 2008 17:27:41 GMT""}]","2008-11-26"
