"0807.2494","Xiaojie Lou","X.J. Lou","Statistical switching kinetics in ferroelectrics",,"J. Phys.: Condens. Matter 21 (2009) 012207","10.1088/0953-8984/21/1/012207",,"physics.data-an cond-mat.mtrl-sci","http://arxiv.org/licenses/nonexclusive-distrib/1.0/","  By assuming a more realistic nucleation and polarization reversal scenario we
build a new statistical switching model for ferroelectrics, which is different
from either the Kolmogorov-Avrami-Ishibashi (KAI) model or the
Nucleation-Limited-Switching (NLS) model. After incorporating a time-dependent
depolarization field this model gives a good description about the retardation
behavior in polycrystalline thin films at medium or low fields, which can not
be described by the traditional KAI model. This model predicts correctly n=1
for polycrystalline thin films at high Eappl or ceramic bulks in the ideal
case.
","[{""version"":""v1"",""created"":""Wed, 16 Jul 2008 03:36:28 GMT""}]","2008-12-05"
"0807.2495","Cheng-Wei Qiu","Jiaguang Han, Akhlesh Lakhtakia, and Cheng-Wei Qiu","Terahertz Metamaterials with Semiconductor Split-Ring Resonators for
  Magnetostatic Tunability","7 pages, 5 figures","Optics Express, Vol. 16, pp. 14390-14396 (2008)","10.1364/OE.16.014390",,"cond-mat.mtrl-sci cond-mat.other physics.optics","http://arxiv.org/licenses/nonexclusive-distrib/1.0/","  We studied a metasurface constituted as a periodic array of semiconductor
split-ring resonators. The resonance frequencies of the metasurface excited by
normally incident light were found to be continuously tunable in the terahertz
regime through an external magnetostatic field of suitable orientation. As such
metasurfaces can be assembled into 3D metamaterials, the foregoing conclusion
also applies to metamaterials comprising semiconductor split-ring resonators.
","[{""version"":""v1"",""created"":""Wed, 16 Jul 2008 03:45:06 GMT""},{""version"":""v2"",""created"":""Sun, 20 Jul 2008 14:22:26 GMT""}]","2009-05-02"
"0807.2496","Ashish Goel","Ashish Goel and Kamesh Munagala","Hybrid Keyword Search Auctions",,,,,"cs.GT cs.DS cs.IR","http://arxiv.org/licenses/nonexclusive-distrib/1.0/","  Search auctions have become a dominant source of revenue generation on the
Internet. Such auctions have typically used per-click bidding and pricing. We
propose the use of hybrid auctions where an advertiser can make a
per-impression as well as a per-click bid, and the auctioneer then chooses one
of the two as the pricing mechanism. We assume that the advertiser and the
auctioneer both have separate beliefs (called priors) on the click-probability
of an advertisement. We first prove that the hybrid auction is truthful,
assuming that the advertisers are risk-neutral. We then show that this auction
is superior to the existing per-click auction in multiple ways: 1) It takes
into account the risk characteristics of the advertisers. 2) For obscure
keywords, the auctioneer is unlikely to have a very sharp prior on the
click-probabilities. In such situations, the hybrid auction can result in
significantly higher revenue. 3) An advertiser who believes that its
click-probability is much higher than the auctioneer's estimate can use
per-impression bids to correct the auctioneer's prior without incurring any
extra cost. 4) The hybrid auction can allow the advertiser and auctioneer to
implement complex dynamic programming strategies. As Internet commerce matures,
we need more sophisticated pricing models to exploit all the information held
by each of the participants. We believe that hybrid auctions could be an
important step in this direction.
","[{""version"":""v1"",""created"":""Wed, 16 Jul 2008 04:04:32 GMT""},{""version"":""v2"",""created"":""Mon, 26 Jan 2009 01:00:16 GMT""}]","2009-01-26"
"0807.2497","Alexey Ovchinnikov","Alexey Ovchinnikov","Differential Tannakian Categories","24 pages; better structured Definition 2 and other statements of the
  paper; more examples; more detailed proof of Theorem 14","Journal of Algebra, Volume 321, Issue 10, 2009, pp 3043-3062","10.1016/j.jalgebra.2009.02.008",,"math.RT math.AC","http://arxiv.org/licenses/nonexclusive-distrib/1.0/","  We define a differential Tannakian category and show that under a natural
assumption it has a fibre functor. If in addition this category is neutral,
that is, the target category for the fibre functor are finite dimensional
vector spaces over the base field, then it is equivalent to the category of
representations of a (pro-)linear differential algebraic group. Our treatment
of the problem is via differential Hopf algebras and Deligne's fibre functor
construction.
","[{""version"":""v1"",""created"":""Wed, 16 Jul 2008 04:28:37 GMT""},{""version"":""v2"",""created"":""Thu, 2 Oct 2008 04:46:47 GMT""},{""version"":""v3"",""created"":""Tue, 24 Feb 2009 23:43:55 GMT""}]","2013-03-05"
"0807.2498","Tao Xiang","T. Xiang, H. G. Luo, D. H. Lu, K. M. Shen, Z. X. Shen","Doping dependent charge transfer gap and realistic electronic model of
  n-type cuprate superconductors","4 pages 3 figures",,"10.1103/PhysRevB.79.014524",,"cond-mat.supr-con cond-mat.str-el","http://arxiv.org/licenses/nonexclusive-distrib/1.0/","  Based on the analysis of the measurement data of angle-resolved photoemission
spectroscopy (ARPES) and optics, we show that the charge transfer gap is
significantly smaller than the optical one and is reduced by doping in electron
doped cuprate superconductors. This leads to a strong charge fluctuation
between the Zhang-Rice singlet and the upper Hubbard bands. The basic model for
describing this system is a hybridized two-band $t$-$J$ model. In the symmetric
limit where the corresponding intra- and inter-band hopping integrals are equal
to each other, this two-band model is equivalent to the Hubbard model with an
antiferromagnetic exchange interaction (i.e. the $t$-$U$-$J$ model). The
mean-field result of the $t$-$U$-$J$ model gives a good account for the doping
evolution of the Fermi surface and the staggered magnetization.
","[{""version"":""v1"",""created"":""Wed, 16 Jul 2008 05:18:25 GMT""}]","2013-05-29"
"0807.2499","Valentina Klochkova","V.G.Klochkova, E.L.Chentsov","Detection of the spectral binary (SB2) nature of BD-6^o1178","13 pages, 1 table, 4 figures",,"10.1134/S1990341308030073",,"astro-ph","http://arxiv.org/licenses/nonexclusive-distrib/1.0/","  BD-6^o1178 identified with the infrared source IRAS05238-0626 is shown for
the first time to be a spectroscopic binary (SB2) by analyzing the
high-resolution spectra taken with the NES echelle spectrograph of the 6-m
telescope. The components of the binary have close spectral types and
luminosity classes: F5IV-III and F3V. The heliocentric radial velocities are
measured for both components at four observing moments in 2004-2005. Both stars
have close rotation velocities, which are equal to 24 and 19km/s. We do not
confirm the classification of BD-6^o1178 as a supergiant in the transition
stage of becoming a planetary nebula. BD-6^o1178 probably is a young pre-MS
stars. It is possibly a member of the 1c subgroup of the OriOB1 association.
","[{""version"":""v1"",""created"":""Wed, 16 Jul 2008 05:46:16 GMT""}]","2009-11-13"
"0807.2500","Yeow Meng Chee","Yeow Meng Chee, Alan C. H. Ling, Hao Shen","The fine intersection problem for Steiner triple systems","9 pages",,"10.1007/s00373-006-0690-z",,"math.CO","http://arxiv.org/licenses/nonexclusive-distrib/1.0/","  The intersection of two Steiner triple systems (X,A) and (X,B) is the set A
intersect B. The fine intersection problem for Steiner triple systems is to
determine for each v, the set I(v), consisting of all possible pairs (m,n) such
that there exist two Steiner triple systems of order v whose intersection has n
blocks over m points. We show that for v = 1 or 3 (mod 6), |I(v)| = Omega(v^3),
where previous results only imply that |I(v)| = Omega(v^2).
","[{""version"":""v1"",""created"":""Wed, 16 Jul 2008 05:51:08 GMT""}]","2008-07-17"
"0807.2501","Muhammad Ramzan","M. Ramzan, Ahmad Nawaz, A. H. Toor, M. K. Khan","The effect of quantum memory on quantum games","26 pages, 7 ps figures","J. Phys. A: Math. Theor. 41 (2008) 055307","10.1088/1751-8113/41/5/055307",,"quant-ph","http://arxiv.org/licenses/nonexclusive-distrib/1.0/","  We study quantum games with correlated noise through a generalized
quantization scheme. We investigate the effects of memory on quantum games,
such as Prisoner's Dilemma, Battle of the Sexes and Chicken, through three
prototype quantum-correlated channels. It is shown that the quantum player
enjoys an advantage over the classical player for all nine cases considered in
this paper for the maximally entangled case. However, the quantum player can
also outperform the classical player for subsequent cases that can be noted in
the case of the Battle of the Sexes game. It can be seen that the Nash
equilibria do not change for all the three games under the effect of memory.
","[{""version"":""v1"",""created"":""Wed, 16 Jul 2008 06:28:22 GMT""},{""version"":""v2"",""created"":""Fri, 18 Jul 2008 16:30:56 GMT""},{""version"":""v3"",""created"":""Sat, 19 Jul 2008 09:22:10 GMT""},{""version"":""v4"",""created"":""Mon, 28 Jul 2008 13:40:11 GMT""}]","2008-07-28"
"0807.2502","Joel F. Corney","Joel F. Corney, Joel Heersink, Ruifang Dong, Vincent Josse, Peter D.
  Drummond, Gerd Leuchs and Ulrik L. Andersen","Simulations and Experiments on Polarisation Squeezing in Optical Fibre","19 pages, lots of figures",,"10.1103/PhysRevA.78.023831",,"quant-ph","http://arxiv.org/licenses/nonexclusive-distrib/1.0/","  We investigate polarisation squeezing of ultrashort pulses in optical fibre,
over a wide range of input energies and fibre lengths. Comparisons are made
between experimental data and quantum dynamical simulations, to find good
quantitative agreement. The numerical calculations, performed using both
truncated Wigner and exact $+P$ phase-space methods, include nonlinear and
stochastic Raman effects, through coupling to phonons variables. The
simulations reveal that excess phase noise, such as from depolarising GAWBS,
affects squeezing at low input energies, while Raman effects cause a marked
deterioration of squeezing at higher energies and longer fibre lengths. The
optimum fibre length for maximum squeezing is also calculated.
","[{""version"":""v1"",""created"":""Wed, 16 Jul 2008 07:01:12 GMT""}]","2009-11-13"
"0807.2503","Tsutomu Kobayashi","Tsutomu Kobayashi, Kei-ichi Maeda","Relativistic stars in f(R) gravity, and absence thereof","9 pages, 7 figures, v2: references added, minor corrections, version
  accepted for publication in PRD","Phys.Rev.D78:064019,2008","10.1103/PhysRevD.78.064019","WU-AP/289/08","astro-ph gr-qc hep-th","http://arxiv.org/licenses/nonexclusive-distrib/1.0/","  Several f(R) modified gravity models have been proposed which realize the
correct cosmological evolution and satisfy solar system and laboratory tests.
Although nonrelativistic stellar configurations can be constructed, we argue
that relativistic stars cannot be present in such f(R) theories. This problem
appears due to the dynamics of the effective scalar degree of freedom in the
strong gravity regime. Our claim thus raises doubts on the viability of f(R)
models.
","[{""version"":""v1"",""created"":""Wed, 16 Jul 2008 07:03:39 GMT""},{""version"":""v2"",""created"":""Thu, 28 Aug 2008 05:44:07 GMT""}]","2009-02-20"
"0807.2504","Aurora Sicilia-Aguilar","Aurora Sicilia-Aguilar, Thomas Henning, Attila Juh\'asz, Jeroen
  Bouwman, Gordon Garmire, Audrey Garmire","Very Low-Mass Objects in the Coronet Cluster: The Realm of the
  Transition Disks","51 pages, 13 figures, 10 tables",,"10.1086/591932",,"astro-ph","http://arxiv.org/licenses/nonexclusive-distrib/1.0/","  We present optical and IR spectra of a set of low-mass stars and brown dwarfs
in the Coronet cluster (aged ~1Myr), obtained with the multifiber spectrograph
FLAMES/VLT and IRS/Spitzer. The optical spectra reveal spectral types between
M1 and M7.5, confirm the youth of the objects (via Li 6708 A absorption), and
show the presence of accretion (via Halpha) and shocks (via forbidden line
emission). The IRS spectra, together with IR photometry from the IRAC/MIPS
instruments on Spitzer and 2MASS, confirm the presence of IR excesses
characteristic of disks around ~70% of the objects. Half of the disks do not
exhibit any silicate emission, or present flat features characteristic of large
grains. The rest of the disks show silicate emission typical of amorphous and
crystalline silicate grains a few microns in size. About 50% of the objects
with disks do not show near-IR excess emission, having ""transitional"" disks,
according to their classical definition. This is a very high fraction for such
a young cluster. The large number of ""transitional"" disks suggests lifetimes
comparable to the lifetimes of typical optically thick disks. Therefore, these
disks may not be in a short-lived phase, intermediate between Class II and
Class III objects. The median spectral energy distribution of the disks in the
Coronet cluster is also closer to a flat disk than observed for the disks
around solar-type stars in regions with similar age. The differences in the
disk morphology and evolution in the Coronet cluster could be related to fact
that these objects have very late spectral types compared to the solar-type
stars in other cluster studies. Finally, the optical spectroscopy reveals that
one of the X-ray sources is produced by a Herbig Haro object in the cloud.
","[{""version"":""v1"",""created"":""Wed, 16 Jul 2008 07:08:46 GMT""}]","2009-11-13"
"0807.2505","Didier Henrion","Didier Henrion (LAAS, FEL-CVUT), Jean Bernard Lasserre (LAAS, IMT),
  Carlo Savorgnan (KUL)","Approximate volume and integration for basic semi-algebraic sets",,,"10.1137/080730287","Rapport LAAS 08391","math.OC","http://arxiv.org/licenses/nonexclusive-distrib/1.0/","  Given a basic compact semi-algebraic set $\K\subset\R^n$, we introduce a
methodology that generates a sequence converging to the volume of $\K$. This
sequence is obtained from optimal values of a hierarchy of either semidefinite
or linear programs. Not only the volume but also every finite vector of moments
of the probability measure that is uniformly distributed on $\K$ can be
approximated as closely as desired, and so permits to approximate the integral
on $\K$ of any given polynomial; extension to integration against some weight
functions is also provided. Finally, some numerical issues associated with the
algorithms involved are briefly discussed.
","[{""version"":""v1"",""created"":""Wed, 16 Jul 2008 07:09:01 GMT""},{""version"":""v2"",""created"":""Tue, 1 Sep 2009 06:39:40 GMT""}]","2015-05-13"
"0807.2506","Vasumathi Velachi","M. Daniel and V. Vasumathi","Nonlinear molecular excitations in a completely inhomogeneous DNA chain",,"Phys. Lett. A 372 (2008) 5144-5151","10.1016/j.physleta.2008.05.063",,"nlin.PS cond-mat.soft","http://creativecommons.org/licenses/by/3.0/","  We study the nonlinear dynamics of a completely inhomogeneous DNA chain which
is governed by a perturbed sine-Gordon equation. A multiple scale perturbation
analysis provides perturbed kink-antikink solitons to represent open state
configuration with small fluctuation. The perturbation due to inhomogeneities
changes the velocity of the soliton. However, the width of the soliton remains
constant.
","[{""version"":""v1"",""created"":""Wed, 16 Jul 2008 07:22:43 GMT""}]","2008-07-17"
"0807.2507","Juan A. Valiente-Kroon","JA Valiente Kroon","Regularity conditions at spatial infinity revisited","41 pages",,,,"gr-qc","http://arxiv.org/licenses/nonexclusive-distrib/1.0/","  The regular finite initial value problem at infinity is used to obtain
regularity conditions on the freely specifiable parts of initial data for the
vacuum Einstein equations with non-vanishing second fundamental form. These
conditions ensure that the solutions of the propagation equations implied by
the conformal Einstein equations at the cylinder at spatial infinity extend
smoothly (and in fact analytically) through the critical sets where spatial
infinity touches null infinity. In order to ease the analysis the conformal
metric is assumed to be analytic, although the results presented here could be
generalised to a setting where the conformal metric is only smooth. The
analysis given here is a generalisation of the analysis on the regular finite
initial value problem first carried out by Friedrich, for initial data sets
with non-vanishing second fundamental form.
","[{""version"":""v1"",""created"":""Wed, 16 Jul 2008 07:29:36 GMT""}]","2008-07-17"
"0807.2508","Marcos Rosenbaum","Marcos Rosenbaum, J. David Vergara and L. Roman Juarez","Space-Time Diffeomorphisms in Noncommutative Gauge Theories","This is a contribution to the Special Issue on Deformation
  Quantization, published in SIGMA (Symmetry, Integrability and Geometry:
  Methods and Applications) at http://www.emis.de/journals/SIGMA/","SIGMA 4 (2008), 055, 21 pages","10.3842/SIGMA.2008.055",,"hep-th math-ph math.MP","http://creativecommons.org/licenses/by-nc-sa/3.0/","  In previous work [Rosenbaum M. et al., J. Phys. A: Math. Theor. 40 (2007),
10367-10382, hep-th/0611160] we have shown how for canonical parametrized field
theories, where space-time is placed on the same footing as the other fields in
the theory, the representation of space-time diffeomorphisms provides a very
convenient scheme for analyzing the induced twisted deformation of these
diffeomorphisms, as a result of the space-time noncommutativity. However, for
gauge field theories (and of course also for canonical geometrodynamics) where
the Poisson brackets of the constraints explicitely depend on the embedding
variables, this Poisson algebra cannot be connected directly with a
representation of the complete Lie algebra of space-time diffeomorphisms,
because not all the field variables turn out to have a dynamical character
[Isham C.J., Kuchar K.V., Ann. Physics 164 (1985), 288-315, 316-333].
Nonetheless, such an homomorphic mapping can be recuperated by first modifying
the original action and then adding additional constraints in the formalism in
order to retrieve the original theory, as shown by Kuchar and Stone for the
case of the parametrized Maxwell field in [Kuchar K.V., Stone S.L., Classical
Quantum Gravity 4 (1987), 319-328]. Making use of a combination of all of these
ideas, we are therefore able to apply our canonical reparametrization approach
in order to derive the deformed Lie algebra of the noncommutative space-time
diffeomorphisms as well as to consider how gauge transformations act on the
twisted algebras of gauge and particle fields. Thus, hopefully, adding
clarification on some outstanding issues in the literature concerning the
symmetries for gauge theories in noncommutative space-times.
","[{""version"":""v1"",""created"":""Wed, 16 Jul 2008 07:38:33 GMT""}]","2008-07-17"
"0807.2509","Baohua Sun","Sun Baohua and Meng Jie","Challenge on the Astrophysical R-process Calculation with Nuclear Mass
  Models","3 pages, 3 figures","Chin. Phys. Lett. 25 (2008) 2429","10.1088/0256-307X/25/7/027",,"nucl-th","http://creativecommons.org/licenses/by/3.0/","  Our understanding of the rapid neutron capture nucleosynthesis process in
universe depends on the reliability of nuclear mass predictions. Initiated by
the newly developed mass table in the relativistic mean field theory (RMF), in
this paper the influence of mass models on the $r$-process calculations is
investigated assuming the same astrophysical conditions. The different model
predictions on the so far unreachable nuclei lead to significant deviations in
the calculated r-process abundances.
","[{""version"":""v1"",""created"":""Wed, 16 Jul 2008 07:42:07 GMT""}]","2017-05-12"
"0807.2510","Antonio Maria Scarfone","A.M. Scarfone and P. Narayana Swamy","Interacting particles system revisited in the framework of the
  q-deformed algebra","13 pages, no figures, accepted on JPA","J.Phys.A41:275211,2008","10.1088/1751-8113/41/27/275211",,"cond-mat.stat-mech hep-th math-ph math.MP math.QA","http://arxiv.org/licenses/nonexclusive-distrib/1.0/","  We discuss the possibility of interpreting a q-deformed non-interacting
system as incorporating the effects of interactions among its particles. This
can be accomplished, for instance, in an ensemble of $q$-Bosons by means of the
virial expansion of a real gas in powers of the deformed parameter. The lowest
order virial coefficient reduces to the case of the standard, non-interacting
Bose gas, while the higher order virial coefficients contain effects arising
from the interaction. The same picture can be drawn in a quantum mechanical
system where it is shown that the q-deformed momentum can be expanded in a
series contains high-order powers of the standard quantum phase-space
variables. Motivated by this result, we introduce, in the classical framework,
a transformation relating the momentum of a free system with the momentum of an
interacting system. It is shown that the canonical quantization applied to the
interacting system imply a q-deformed quantization for the free system.
","[{""version"":""v1"",""created"":""Wed, 16 Jul 2008 07:46:20 GMT""}]","2008-11-26"
"0807.2511","Isabelle Cherchneff","Isabelle Cherchneff and Simon Lilly","Primordial massive supernovae as the first molecular factories in the
  early universe","Accepted to the ApJ Letters","Astrophys.J. 683 (2008) L123-L126","10.1086/591906",,"astro-ph","http://arxiv.org/licenses/nonexclusive-distrib/1.0/","  We study the ejecta chemistry of a zero-metallicity progenitor, massive,
supernova using a novel approach based on chemical kinetics. Species considered
span the range of simple, di-atomic molecules such as CO or SiO to more complex
species involved in dust nucleation processes. We describe their formation from
the gas phase including all possible relevant chemical processes and apply it
to the ejecta of a primordial 170 Msun supernova. Two ejecta cases are
explored: full mixing of the heavy elements, and a stratified ejecta reflecting
the progenitor nucleosynthesis. Penetration of hydrogen from the progenitor
envelope is considered. We show that molecules form very efficiently in the
ejecta of primordial supernovae whatever the level of mixing and account for 13
to 34% of the total progenitor mass, equivalent to 21 to 57 Msun of the ejecta
material in molecular form. The chemical nature of molecules depends on mixing
of heavy elements and hydrogen in the ejecta. Species produced include O2, CO,
CO2, SiS, SO, SiO and H2. Consequently, molecules can be used as observational
tracers of supernova mixing after explosion. We conclude that primordial
massive supernovae are the first molecule providers to the early universe.
","[{""version"":""v1"",""created"":""Wed, 16 Jul 2008 07:45:32 GMT""}]","2008-09-01"
"0807.2512","Martin Rivas","Martin Rivas","On the kinematics of the centre of charge of a spinning particle","12 pages, 4 figures",,"10.1063/1.3215640",,"physics.gen-ph physics.class-ph","http://arxiv.org/licenses/nonexclusive-distrib/1.0/","  In particle physics, most of the classical models consider that the centre of
mass and centre of charge of an elementary particle, are the same point. This
presumes some particular relationship between the charge and mass distribution,
a feature which cannot be checked experimentally. In this paper we give three
different kinds of arguments suggesting that, if assumed different points, the
centre of charge of an elementary spinning particle moves in a helical motion
at the speed of light, and it thus satisfies, in general, a fourth order
differential equation. If assumed a kind of rigid body structure, it is
sufficient the description of the centre of charge to describe also the
evolution of the centre of mass and the rotation of the body. This assumption
of a separation betwen the centre of mass and centre of charge gives a
contribution to the spin of the system and also justifies the existence of a
magnetic moment produced by the relative motion of the centre of charge. This
corresponds to an improved model of a charged elementary particle, than the
point particle case. This means that a Lagrangian formalism for describing
elementary spinning particles has to depend, at least, up to the acceleration
of the position of the charge, to properly obtain fourth order dynamical
equations. This result is compared with the description of a classical Dirac
particle obtained from a general Lagrangian formalism for describing spinning
particles.
","[{""version"":""v1"",""created"":""Wed, 16 Jul 2008 08:04:01 GMT""}]","2015-05-13"
