"0807.2436","S. Andrew Gifford","S. Andrew Gifford and Gordon Baym","Dislocation-Mediated Melting in Superfluid Vortex Lattices","9 pages, 2 figures","Phys. Rev. A 78, 043607 (2008)","10.1103/PhysRevA.78.043607",,"cond-mat.stat-mech cond-mat.mes-hall","http://arxiv.org/licenses/nonexclusive-distrib/1.0/","  We describe thermal melting of the two-dimensional vortex lattice in a
rotating superfluid by generalizing the Halperin and Nelson theory of
dislocation-mediated melting. and derive a melting temperature proportional to
the renormalized shear modulus of the vortex lattice. The rigid-body rotation
of the superfluid attenuates the effects of lattice compression on the energy
of dislocations and hence the melting temperature, while not affecting the
shearing. Finally, we discuss dislocations and thermal melting in inhomogeneous
rapidly rotating Bose-Einstein condensates; we delineate a phase diagram in the
temperature -- rotation rate plane, and infer that the thermal melting
temperature should lie below the Bose-Einstein transition temperature.
","[{""version"":""v1"",""created"":""Tue, 15 Jul 2008 19:48:26 GMT""}]","2008-11-22"
"0807.2437","Glenn van de Ven","Glenn van de Ven (Institute for Advanced Study), Philip Chang
  (University of California, Berkeley)","Migration of Star Clusters and Nuclear Rings","12 pages, 6 figures, referee comments incorporated; published in ApJ,
  2009, 697, 619","Astrophys.J.697:619-629,2009","10.1088/0004-637X/697/1/619",,"astro-ph","http://arxiv.org/licenses/nonexclusive-distrib/1.0/","  Star clusters that form in nuclear rings appear to be at slightly larger
radii than the gas. We argue that the star clusters move out from the gas in
which they are formed because of satellite-disk tidal interactions. In
calculating the dynamics of this star cluster and gas ring system, we include
the effects of dynamical friction of the background stars in the host galaxy on
the star cluster, and inflowing gas along the bar onto the nuclear ring at the
two contact points. We show that the final separation is of the order of the
Hill radius of the nuclear ring, which is typically 20-30% of its radius.
Massive star clusters can reach half of this separation very quickly and
produce a factor of a few enhancement in the gas surface density. If this leads
to star formation in addition to the (ongoing) formation of star clusters near
the contact points, a possible (initial) azimuthal age gradient may become
diluted or even disappear. Finally, if the star cluster are massive and/or
numerous enough, we expect the nuclear ring to migrate inward, away from the
(possibly) associated (inner) Lindblad resonance. We discuss how these
predictions may be tested observationally.
","[{""version"":""v1"",""created"":""Tue, 15 Jul 2008 19:48:40 GMT""},{""version"":""v2"",""created"":""Fri, 22 May 2009 17:58:23 GMT""}]","2011-02-11"
"0807.2438","M. Romero-Bastida","M. Romero-Bastida and E. Braun","Lyapunov modes in three-dimensional Lennard-Jones fluids","28 Pages, 13 b&w Figures","J. Phys. A: Math. Theor. 41, 375101 (2008) [21pp]","10.1088/1751-8113/41/37/375101",,"nlin.CD","http://arxiv.org/licenses/nonexclusive-distrib/1.0/","  Recent studies on the phase-space dynamics of a one-dimensional Lennard-Jones
fluid reveal the existence of regular collective perturbations associated with
the smallest positive Lyapunov exponents of the system, called hydrodynamic
Lyapunov modes, which previously could only be identified in hard-core fluids.
In this work we present a systematic study of the Lyapunov exponents and
Lyapunov vectors, i.e. perturbations along each direction of phase space, of a
three-dimensional Lennard-Jones fluid. By performing the Fourier transform of
the spatial density of the coordinate part of the Lyapunov vector components
and then time-averaging this result we find convincing signatures of
longitudinal modes, with inconclusive evidence of transverse modes for all
studied densities. Furthermore, the longitudinal modes can be more clearly
identified for the higher density values. Thus, according to our results, the
mixing of modes induced both by the dynamics and the dimensionality induce a
hitherto unknown type of order in the tangent space of the model herein studied
at high density values.
","[{""version"":""v1"",""created"":""Tue, 15 Jul 2008 19:54:56 GMT""}]","2008-08-10"
"0807.2439","Merab Gogberashvili Dr","Merab Gogberashvili","'Universal' FitzGerald Contractions","The version accepted by Eur. Phys. J. C",,"10.1140/epjc/s10052-009-1108-x",,"gr-qc","http://arxiv.org/licenses/nonexclusive-distrib/1.0/","  The model of a universe with a preferred frame, which nevertheless shares the
main properties with traditional special and general relativity theories, is
considered. We adopt Mach's interpretation of inertia and show that the energy
balance equation, which includes the Machian energy of gravitational
interactions with the universe, can imitate standard relativistic formulas.
","[{""version"":""v1"",""created"":""Tue, 15 Jul 2008 19:56:33 GMT""},{""version"":""v2"",""created"":""Fri, 17 Jul 2009 04:58:28 GMT""}]","2015-05-13"
"0807.2440","Natalia Silberstein","Tuvi Etzion, Natalia Silberstein","Construction of Error-Correcting Codes for Random Network Coding",,,,,"cs.IT math.IT","http://arxiv.org/licenses/nonexclusive-distrib/1.0/","  In this work we present error-correcting codes for random network coding
based on rank- metric codes, Ferrers diagrams, and puncturing. For most
parameters, the constructed codes are larger than all previously known codes.
","[{""version"":""v1"",""created"":""Tue, 15 Jul 2008 19:57:23 GMT""}]","2008-07-16"
"0807.2441","Maitere Aguerrea","Maitere Aguerrea and Gabriel Valenzuela","On the minimal speed of traveling waves for a non-local delayed
  reaction-diffusion equation","6 pages, 2 figures",,,,"math.AP math.CA","http://arxiv.org/licenses/nonexclusive-distrib/1.0/","  In this note, we give constructive upper and lower bounds for the minimal
speed of propagation of traveling waves for non-local delayed
reaction-diffusion equation.
","[{""version"":""v1"",""created"":""Tue, 15 Jul 2008 19:57:33 GMT""}]","2008-07-16"
"0807.2442","Spalek","Jan Kurzyk, W{\l}odzimierz W\'ojcik and Jozef Spa{\l}ek","Extended Hubbard model with renormalized Wannier wave functions in the
  correlated state: beyond the parametrized models","19 pages, 15 figure, 4 tables","Eur. Phys. J. B 66, 385-398 (2008)","10.1140/epjb/e2008-00433-1",,"cond-mat.str-el","http://arxiv.org/licenses/nonexclusive-distrib/1.0/","  The method used earlier for analysis of correlated nanoscopic systems is
extended to infinite (periodic) s-band like systems described by the Hubbard
model and its extensions. The optimized single-particle wave functions
contained in the parameters of the Hubbard model (the hopping \textit{t} and
the magnitude of the intraatomic interaction \textit{U}) are determined
explicitly in the correlated state for the electronic systems of various
symmetries and dimensions: Hubbard chain, square and triangular planar
lattices, and the three cubic lattices (SC, BCC, FCC). In effect, the evolution
of the electronic properties as a function of interatomic distance $R$ is
obtained. The model parameters in most cases do not scale linearly with the
lattice spacing and hence, their solution as a function of microscopic
parameters reflects only qualitatively the system evolution. Also, the atomic
energy changes with $R$ and therefore should be included in the model analysis.
The solutions in one dimension (\textit{D} = 1) can be analyzed both rigorously
(by making use of the Lieb--Wu solution) and compared with the approximate
Gutzwiller treatment. In higher dimensions (\textit{D} = 2, 3) only the latter
approach is possible to implement within the scheme. The renormalized single
particle wave functions are almost independent of the choice of the scheme
selected to diagonalize the Hamiltonian in the Fock space in D=1 case. The
method can be extended to other approximation schemes as stressed at the end.
","[{""version"":""v1"",""created"":""Tue, 15 Jul 2008 21:43:28 GMT""}]","2009-02-18"
"0807.2443","Marcelo J. Reboucas","J. Santos, M.J. Reboucas, J.S. Alcaniz","Energy conditions constraints on a class of f(R)-gravity","6 pages. To appear in Int. J. Mod. Phys. D. Talk delivered at the 3rd
  International Workshop on Astronomy and Relativistic Astrophysics. V2:
  references added","Int.J.Mod.Phys.D19:1315-1321,2010","10.1142/S0218271810017639",,"astro-ph gr-qc hep-th","http://arxiv.org/licenses/nonexclusive-distrib/1.0/","  We present and discuss the bounds from the energy conditions on a general
f(R) functional form in the framework of metric variational approach. As a
concrete application of the energy conditions to locally homogeneous and
isotropic f(R)-cosmology, the recent estimated values of the deceleration and
jerk parameters are used to examine the bounds from the weak energy condition
on the free parameter of the family of f(R)=\sqrt{R^2 - R_0^2} gravity theory.
","[{""version"":""v1"",""created"":""Tue, 15 Jul 2008 20:05:16 GMT""},{""version"":""v2"",""created"":""Tue, 29 Jul 2008 21:00:13 GMT""}]","2010-09-15"
"0807.2444","Jens Eisert","J.S. Lundeen, A. Feito, H. Coldenstrodt-Ronge, K.L. Pregnell, Ch.
  Silberhorn, T.C. Ralph, J. Eisert, M.B. Plenio, I.A. Walmsley","Measuring measurement","6 pages, 4 figures,see video abstract at
  http://www.quantiki.org/video_abstracts/08072444","Nature Physics 5, 27 (2009)","10.1038/nphys1133",,"quant-ph","http://arxiv.org/licenses/nonexclusive-distrib/1.0/","  Measurement connects the world of quantum phenomena to the world of classical
events. It plays both a passive role, observing quantum systems, and an active
one, preparing quantum states and controlling them. Surprisingly - in the light
of the central status of measurement in quantum mechanics - there is no general
recipe for designing a detector that measures a given observable. Compounding
this, the characterization of existing detectors is typically based on partial
calibrations or elaborate models. Thus, experimental specification (i.e.
tomography) of a detector is of fundamental and practical importance. Here, we
present the realization of quantum detector tomography: we identify the optimal
positive-operator-valued measure describing the detector, with no ancillary
assumptions. This result completes the triad, state, process, and detector
tomography, required to fully specify an experiment. We characterize an
avalanche photodiode and a photon number resolving detector capable of
detecting up to eight photons. This creates a new set of tools for accurately
detecting and preparing non-classical light.
","[{""version"":""v1"",""created"":""Tue, 15 Jul 2008 21:10:54 GMT""}]","2009-11-13"
"0807.2445","Mkhitaryan Vagharsh","V. V. Mkhitaryan and M. E. Raikh","Disorder-induced tail states in a gapped bilayer graphene","7 pages, 4 figures","Phys. Rev. B 78, 195409 (2008)","10.1103/PhysRevB.78.195409",,"cond-mat.mes-hall","http://arxiv.org/licenses/nonexclusive-distrib/1.0/","  The instanton approach to the in-gap fluctuation states is applied to the
spectrum of biased bilayer graphene. It is shown that the density of states
falls off with energy measured from the band-edge as $\nu(\epsilon)\propto
\exp(-|\epsilon/\epsilon_t|^{3/2})$, where the characteristic tail energy,
$\epsilon_t$, scales with the concentration of impurities, $n_i$, as
$n_i^{2/3}$. While the bare energy spectrum is characterized by two energies:
the bias-induced gap, $V$, and interlayer tunneling, $t_{\perp}$, the tail,
$\epsilon_t$, contains a {\it single} combination $V^{1/3}t_{\perp}^{2/3}$. We
show that the above expression for $\nu(\epsilon)$ in the tail actually applies
all the way down to the mid-gap.
","[{""version"":""v1"",""created"":""Tue, 15 Jul 2008 20:00:05 GMT""}]","2009-11-13"
"0807.2446","Patrizia Romano","P. Romano (1,2), S. Campana (1), R.P. Mignani (3), A. Moretti (1), M.
  Mottini (4), M.R. Panzera (1), G. Tagliaferri (1) ((1) OAB, (2) INAF-IASF
  Palermo, (3) MSSL, (4) ESO)","The Brera Multi-scale Wavelet Chandra Survey. I. Serendipitous source
  catalogue","Accepted by A&A, Higher res. Figs 4 and 5 at
  http://www.ifc.inaf.it/~romano/BMC/Docs/aapaper/9601f4.eps
  http://www.ifc.inaf.it/~romano/BMC/Docs/aapaper/9601f5.eps, Catalog Web
  pages: http://www.brera.inaf.it/BMC/bmc_home.html
  http://www.ifc.inaf.it/~romano/BMC/bmc_home.html (Mirror)","PoS Integral08:136,2008","10.1051/0004-6361:200809601",,"astro-ph","http://arxiv.org/licenses/nonexclusive-distrib/1.0/","  We present the BMW-Chandra source catalogue drawn from essentially all
Chandra ACIS-I pointed observations with an exposure time in excess of 10ks
public as of March 2003 (136 observations). Using the wavelet detection
algorithm developed by Lazzati et al. (1999) and Campana et al. (1999), which
can characterise both point-like and extended sources, we identified 21325
sources. Among them, 16758 are serendipitous, i.e. not associated with the
targets of the pointings, and do not require a non-automated analysis. This
makes our catalogue the largest compilation of Chandra sources to date. The
0.5--10 keV absorption corrected fluxes of these sources range from ~3E-16 to
9E-12 erg cm^-2 s^-1 with a median of 7E-15 erg cm^-2 s^-1. The catalogue
consists of count rates and relative errors in three energy bands (total,
0.5-7keV; soft, 0.5-2keV; and hard, 2-7keV), and source positions relative to
the highest signal-to-noise detection among the three bands. The wavelet
algorithm also provides an estimate of the extension of the source. We include
information drawn from the headers of the original files, as well, and
extracted source counts in four additional energy bands, SB1 (0.5-1keV), SB2
(1-2keV), HB1 (2-4keV), and HB2 (4-7keV). We computed the sky coverage for the
full catalogue and for a subset at high Galactic latitude (|b|> 20deg). The
complete catalogue provides a sky coverage in the soft band (0.5-2keV, S/N =3)
of ~8 deg^2 at a limiting flux of 1E-13 erg cm^-2 s^-1, and ~2 deg^2 at a
limiting flux of ~1E-15 erg cm^-2 s^-1.
","[{""version"":""v1"",""created"":""Tue, 15 Jul 2008 20:00:11 GMT""}]","2010-04-30"
"0807.2447","James Bolton","James S. Bolton (MPA), S. Peng Oh (UCSB), Steven R. Furlanetto (UCLA)","Photo-heating and the fate of hard photons during the reionisation of
  HeII by quasars","20 pages, 6 figures, accepted by MNRAS",,"10.1111/j.1365-2966.2009.14597.x",,"astro-ph","http://arxiv.org/licenses/nonexclusive-distrib/1.0/","  We use a combination of analytic and numerical arguments to consider the
impact of quasar photo-heating during HeII reionisation on the thermal
evolution of the intergalactic medium (IGM). We demonstrate that rapid (\Delta
z< 0.1-0.2), strong (\Delta T > 10^4 K) photo-heating is difficult to achieve
across the entire IGM unless quasar spectra are significantly harder than
implied by current observational constraints. Although filtering of intrinsic
quasar radiation through dense regions in the IGM does increase the mean excess
energy per HeII photo-ionisation, it also weakens the radiation intensity and
lowers the photo-ionisation rate, preventing rapid heating over time intervals
shorter than the local photo-ionisation timescale. Moreover, the hard photons
responsible for the strongest heating are more likely to deposit their energy
inside dense clumps. The abundance of such clumps is, however, uncertain and
model-dependent, leading to a fairly large uncertainty in the photo-heating
rates. Nevertheless, although some of the IGM may be exposed to a hardened and
weakened ionising background for long periods, most of the IGM must instead be
reionised by the more abundant, softer photons and with accordingly modest
heating rates (\Delta T < 10^4 K). The repeated ionisation of fossil quasar
HeIII regions does not increase the net heating because the recombination times
in these regions typically exceed the IGM cooling times and the average time
lag between successive rounds of quasar activity. Detailed line-of-sight
radiative transfer simulations confirm these expectations and predict a rich
thermal structure in the IGM during HeII reionisation. [Abridged]
","[{""version"":""v1"",""created"":""Wed, 16 Jul 2008 13:44:38 GMT""},{""version"":""v2"",""created"":""Fri, 9 Jan 2009 14:39:55 GMT""},{""version"":""v3"",""created"":""Mon, 16 Mar 2009 11:25:30 GMT""}]","2009-11-13"
"0807.2449","Hiroaki Oyaizu","Hiroaki Oyaizu (KICP, University of Chicago)","Non-linear evolution of f(R) cosmologies I: methodology","15 pages, 11 figures","Phys.Rev.D78:123523,2008","10.1103/PhysRevD.78.123523",,"astro-ph","http://arxiv.org/licenses/nonexclusive-distrib/1.0/","  We introduce the method and the implementation of a cosmological simulation
of a class of metric-variation f(R) models that accelerate the cosmological
expansion without a cosmological constant and evade solar-system bounds of
small-field deviations to general relativity. Such simulations are shown to
reduce to solving a non-linear Poisson equation for the scalar degree of
freedom introduced by the f(R) modifications. We detail the method to
efficiently solve the non-linear Poisson equation by using a
Newton-Gauss-Seidel relaxation scheme coupled with multigrid method to
accelerate the convergence. The simulations are shown to satisfy tests
comparing the simulated outcome to analytical solutions for simple situations,
and the dynamics of the simulations are tested with orbital and Zeldovich
collapse tests. Finally, we present several static and dynamical simulations
using realistic cosmological parameters to highlight the differences between
standard physics and f(R) physics. In general, we find that the f(R)
modifications result in stronger gravitational attraction that enhances the
dark matter power spectrum by ~20% for large but observationally allowed f(R)
modifications. More detailed study of the non-linear f(R) effects on the power
spectrum are presented in a companion paper.
","[{""version"":""v1"",""created"":""Tue, 15 Jul 2008 22:12:09 GMT""}]","2008-12-30"
"0807.2450","Michael C. Liu","Trent J. Dupuy, Michael C. Liu (IfA/Hawaii), Michael J. Ireland
  (Sydney)","Dynamical Mass of the Substellar Benchmark Binary HD 130948BC","ApJ, accepted. Note that astro-ph posting date coincides with the
  periastron passage for this binary","Astrophys.J.692:729-752,2009","10.1088/0004-637X/692/1/729",,"astro-ph","http://arxiv.org/licenses/nonexclusive-distrib/1.0/","  (Abridged) We present Keck, HST, and Gemini-North observations of the L4+L4
binary HD 130948BC which together span ~70% of the binary's orbital period. We
determine a total dynamical mass of 0.109+/-0.002 Msun (114+/-2 Mjup). The flux
ratio is near unity, so both components are unambiguously substellar for any
plausible mass ratio. An independent constraint on the age of the system is
available from the G2V primary HD 130948A. The available indicators suggest an
age comparable to the Hyades, with the most precise age being 0.79 Gyr based on
gyrochronology. Therefore, HD 130948BC is now a unique benchmark among field L
and T dwarfs, with a well-determined mass, luminosity, and age. We find that
substellar theoretical models disagree with our observations. Both components
of HD 130948BC appear to be overluminous by a factor of ~2-3x compared to
evolutionary models. The age of the system would have to be notably younger
than the gyro age to ameliorate the luminosity disagreement. However,
regardless of the adopted age, evolutionary and atmospheric models give
inconsistent results, indicating systematic errors in at least one class of
models, possibly both. The masses of HD 130948BC happen to be very near the
theoretical mass limit for lithium burning, and thus measuring the differential
lithium depletion between B and C will provide a uniquely discriminating test
of theoretical models. The potential underestimate of luminosities by
evolutionary models would have wide-ranging implications; therefore, a more
refined age estimate for HD 130948A is critically needed.
","[{""version"":""v1"",""created"":""Wed, 16 Jul 2008 02:57:50 GMT""},{""version"":""v2"",""created"":""Sat, 19 Jul 2008 12:21:41 GMT""}]","2011-02-11"
"0807.2451","Patricia Ar\'evalo","P. Ar\'evalo (1), P. Uttley (1), S. Kaspi (2), E. Breedt (1), P. Lira
  (3), I. M. McHardy (1) ((1) University of Southampton, (2) Tel Aviv
  University and Technion, (3) Universidad de Chile)","Correlated X-ray/Optical Variability in the Quasar MR2251-178","accepted for publication in MNRAS",,"10.1111/j.1365-2966.2008.13719.x",,"astro-ph","http://arxiv.org/licenses/nonexclusive-distrib/1.0/","  Emission from Active Galactic Nuclei is known to vary strongly over time over
a wide energy band, but the origin of the variability and especially of the
inter-band correlations is still not well established. Here we present the
results of our X-ray and optical monitoring campaign of the quasar MR2251-178,
covering a period of 2.5 years. The X-ray 2-10 keV flux is remarkably well
correlated with the optical B, V and R bands, their fluctuations are almost
simultaneous with a delay consistent with 0 days and not larger than 4 days in
either direction. The amplitude of variations shows an intriguing behaviour:
rapid, large amplitude fluctuations over tens of days in the X-rays have only
small counterparts in the optical bands, while the long-term trends over
hundreds of days are stronger in the B band than in X-rays. We show that simple
reprocessing models, where all the optical variability arises from the variable
X-ray heating, cannot simultaneously explain the discrepant variability
amplitudes on different time-scales and the short delays between X-ray and
optical bands. We interpret the variability and correlations, in the
optically-thick accretion disc plus corona scenario, as the result of intrinsic
accretion rate variations modulating both X-ray and optical emission, together
with reprocessing of X-rays by the accretion disc.
","[{""version"":""v1"",""created"":""Wed, 16 Jul 2008 12:16:40 GMT""}]","2009-11-13"
"0807.2452","Kevin Covey","Kevin R. Covey, Suzanne L. Hawley, John J. Bochanski, Andrew A. West,
  I. Neill Reid, David A. Golimowski, James R. A. Davenport, Todd Henry, Alan
  Uomoto","The Luminosity and Mass Functions of Low-Mass Stars in the Galactic
  Disk: I. The Calibration Region","Accepted for publication in the Astronomical Journal. 21 pages,
  emulateapj format, 12 figures. Figures 1, 4, 11 and 12 degraded for astroph;
  full resolution version available for download at
  http://www.cfa.harvard.edu/~kcovey/","Astron.J.136:1778-1798,2008","10.1088/0004-6256/136/5/1778",,"astro-ph","http://arxiv.org/licenses/nonexclusive-distrib/1.0/","  We present measurements of the luminosity and mass functions of low-mass
stars constructed from a catalog of matched Sloan Digital Sky Survey (SDSS) and
2 Micron All Sky Survey (2MASS) detections. This photometric catalog contains
more than 25,000 matched SDSS and 2MASS point sources spanning ~30 square
degrees on the sky. We have obtained follow-up spectroscopy, complete to J=16,
of more than 500 low mass dwarf candidates within a 1 square degree sub-sample,
and thousands of additional dwarf candidates in the remaining 29 square
degrees. This spectroscopic sample verifies that the photometric sample is
complete, uncontaminated, and unbiased at the 99% level globally, and at the
95% level in each color range. We use this sample to derive the luminosity and
mass functions of low-mass stars over nearly a decade in mass (0.7 M_sun > M_*
> 0.1 M_sun). We find that the logarithmically binned mass function is best fit
with an M_c=0.29 log-normal distribution, with a 90% confidence interval of
M_c=0.20--0.50. These 90% confidence intervals correspond to linearly binned
mass functions peaking between 0.27 M_sun and 0.12 M_sun, where the best fit MF
turns over at 0.17 M_sun. A power law fit to the entire mass range sampled
here, however, returns a best fit of alpha=1.1 (where the Salpeter slope is
alpha = 2.35). These results agree well with most previous investigations,
though differences in the analytic formalisms adopted to describe those mass
functions can give the false impression of disagreement. Given the richness of
modern-day astronomical datasets, we are entering the regime whereby stronger
conclusions can be drawn by comparing the actual datapoints measured in
different mass functions, rather than the results of analytic analyses that
impose structure on the data a priori. (abridged)
","[{""version"":""v1"",""created"":""Tue, 15 Jul 2008 20:02:04 GMT""}]","2008-12-18"
