"0807.2551","Christian Di Fidio","C. Di Fidio and W. Vogel","Entanglement in a Raman-driven cascaded system","10 pages, 5 figures","Phys. Rev. A 78, 032334 (2008)","10.1103/PhysRevA.78.032334",,"quant-ph","http://arxiv.org/licenses/nonexclusive-distrib/1.0/","  The dynamics of a cascaded system that consists of two atom-cavity subsystems
is studied by using the quantum trajectory method. Considering the two
atom-cavity subsystems driven by a Raman interaction, analytical solutions are
obtained. Subsequently, the entanglement evolution between the two atoms is
studied, and it is shown that the entanglement can be stored by switching off
the Raman coupling. By monitoring the radiation field, the entanglement between
the two atoms can be enhanced.
","[{""version"":""v1"",""created"":""Wed, 16 Jul 2008 12:43:35 GMT""},{""version"":""v2"",""created"":""Sat, 27 Sep 2008 10:39:57 GMT""}]","2008-09-27"
"0807.2552","Takuro Abe","Takuro Abe","A generalized logarithmic module and duality of Coxeter
  multiarrangements","17 pages",,,,"math.AC math.AG","http://arxiv.org/licenses/nonexclusive-distrib/1.0/","  We introduce a new definition of a generalized logarithmic module of
multiarrangements by uniting those of the logarithmic derivation and the
differential modules. This module is realized as a logarithmic derivation
module of an arrangement of hyperplanes with a multiplicity consisting of both
positive and negative integers. We consider several properties of this module
including Saito's criterion and reflexivity. As applications, we prove a shift
isomorphism and duality of some Coxeter multiarrangements by using the
primitive derivation.
","[{""version"":""v1"",""created"":""Wed, 16 Jul 2008 12:45:06 GMT""}]","2008-07-17"
"0807.2553","Francesco Zamponi","Florent Krzakala, Alberto Rosso, Guilhem Semerjian, Francesco Zamponi","On the path integral representation for quantum spin models and its
  application to the quantum cavity method and to Monte Carlo simulations","25 pages, 15 figures, typos corrected","Phys. Rev. B 78, 134428 (2008)","10.1103/PhysRevB.78.134428",,"cond-mat.stat-mech cond-mat.dis-nn quant-ph","http://arxiv.org/licenses/nonexclusive-distrib/1.0/","  The cavity method is a well established technique for solving classical spin
models on sparse random graphs (mean-field models with finite connectivity).
Laumann et al. [arXiv:0706.4391] proposed recently an extension of this method
to quantum spin-1/2 models in a transverse field, using a discretized
Suzuki-Trotter imaginary time formalism. Here we show how to take analytically
the continuous imaginary time limit. Our main technical contribution is an
explicit procedure to generate the spin trajectories in a path integral
representation of the imaginary time dynamics. As a side result we also show
how this procedure can be used in simple heat-bath like Monte Carlo simulations
of generic quantum spin models. The replica symmetric continuous time quantum
cavity method is formulated for a wide class of models, and applied as a simple
example on the Bethe lattice ferromagnet in a transverse field. The results of
the methods are confronted with various approximation schemes in this
particular case. On this system we performed quantum Monte Carlo simulations
that confirm the exactness of the cavity method in the thermodynamic limit.
","[{""version"":""v1"",""created"":""Wed, 16 Jul 2008 12:49:52 GMT""},{""version"":""v2"",""created"":""Tue, 21 Oct 2008 10:17:51 GMT""}]","2009-11-13"
"0807.2554","Alexander Lerchl","Alexander Lerchl and Adalbert FX Wilhelm","Statistical tools used to identify scientific misconduct in mobile phone
  research (REFLEX program)","This paper has been withdrawn by the authors due to concerns with
  referenced data sets. No further revisions.","Mutation Research 697: 60-65 (2010)","10.1016/j.mrgentox.2010.01.010.",,"stat.AP","http://arxiv.org/licenses/nonexclusive-distrib/1.0/","  A severe case of scientific misconduct was discovered in a paper from 2005
allegedly showing harmful effects (DNA breakage) of non-thermal mobile phone
electromagnetic field exposure on human and rat cells. Here we describe the way
how the fraudulent data were identified. The low variations of the reported
biological data are shown to be below theoretical lower limits (multinomial
distributions). Another reason for doubts was highly significant non-equal
distributions of last digits, a known hint towards data fabrication. The
Medical University Vienna, where the research was conducted, was informed about
these findings and came to the conclusion that the data in this and another,
related paper by the same group were fabricated, and that both papers should be
retracted.
","[{""version"":""v1"",""created"":""Wed, 16 Jul 2008 12:50:34 GMT""},{""version"":""v2"",""created"":""Mon, 25 May 2015 12:33:02 GMT""}]","2015-05-26"
"0807.2555","Roland Doll","Roland Doll, Peter Hanggi, Sigmund Kohler, and Martijn Wubs","Qubit coherence decay down to threshold: influence of substrate
  dimensions","4 pages, 4 figures","Eur. Phys. J. B 68, 523 (2009)","10.1140/epjb/e2009-00115-6",,"cond-mat.mes-hall cond-mat.stat-mech quant-ph","http://arxiv.org/licenses/nonexclusive-distrib/1.0/","  Keeping single-qubit quantum coherence above some threshold value not far
below unity is a prerequisite for fault-tolerant quantum error correction
(QEC). We study the initial dephasing of solid-state qubits in the
independent-boson model, which describes well recent experiments on quantum dot
(QD) excitons both in bulk and in substrates of reduced geometry such as
nanotubes. Using explicit expressions for the exact coherence dynamics, a
minimal QEC rate is identified in terms of the error threshold, temperature,
and qubit-environment coupling strength. This allows us to systematically study
the benefit of a current trend towards substrates with reduced dimensions.
","[{""version"":""v1"",""created"":""Wed, 16 Jul 2008 12:50:54 GMT""}]","2011-01-11"
"0807.2556","Mauro Paternostro","M. Paternostro, H. Jeong, T. C. Ralph","Violations of Bell's inequality for Gaussian states with homodyne
  detection and nonlinear interactions","6 pages, 5 figures, RevTeX4; to appear in Phys. Rev. A","Phys. Rev. A 79, 012101 (2009)","10.1103/PhysRevA.79.012101",,"quant-ph","http://arxiv.org/licenses/nonexclusive-distrib/1.0/","  We show that homodyne measurements can be used to demonstrate violations of
Bell's inequality with Gaussian states, when the local rotations used for these
types of tests are implemented using nonlinear unitary operations. We reveal
that the local structure of the Gaussian state under scrutiny is crucial in the
performance of the test. The effects of finite detection efficiency is
thoroughly studied and shown to only mildly affect the revelation of Bell
violations. We speculate that our approach may be extended to other
applications such as entanglement distillation where local operations are
necessary elements besides quantum entanglement.
","[{""version"":""v1"",""created"":""Wed, 16 Jul 2008 12:56:27 GMT""},{""version"":""v2"",""created"":""Mon, 15 Dec 2008 17:27:41 GMT""}]","2009-11-13"
"0807.2557","Allan Pierce","Allan D. Pierce","Derivation of Maxwell's equations via the covariance requirements of the
  special theory of relativity, starting with Newton's laws",,,,,"physics.class-ph physics.hist-ph","http://arxiv.org/licenses/nonexclusive-distrib/1.0/","  A connection between Maxwell's equations, Newton's laws, and the special
theory of relativity is established with a derivation that begins with Newton's
verbal enunciation of his first two laws. Derived equations are required to be
covariant, and a simplicity criterion requires that the four-vector force on a
charged particle be linearly related to the four-vector velocity. The
connecting tensor has derivable symmetry properties and contains the electric
and magnetic field vectors. The Lorentz force law emerges, and Maxwell's
equations for free space emerge with the assumption that the tensor and its
dual must both satisfy first order partial differential equations. The
inhomogeneous extension yields a charge density and a current density as being
the source of the field, and yields the law of conservation of charge. Newton's
third law is reinterpreted as a reciprocity statement, which requires that the
charge in the source term can be taken as the same physical entity as that of
the test particle and that both can be assigned the same units. Requiring
covariance under either spatial inversions or time reversals precludes magnetic
charge being a source of electromagnetic fields that exert forces on electric
charges.
","[{""version"":""v1"",""created"":""Wed, 16 Jul 2008 12:56:51 GMT""}]","2008-07-17"
"0807.2558","Gerhard Schmid","P.S. Burada, G. Schmid, D. Reguera, M.H. Vainstein, J.M. Rubi, and P.
  Hanggi","Entropic Stochastic Resonance","4 pages, 3 figures","Phys. Rev. Lett. 101, 130602 (2008)","10.1103/PhysRevLett.101.130602",,"cond-mat.stat-mech cond-mat.other nlin.SI","http://arxiv.org/licenses/nonexclusive-distrib/1.0/","  We present a novel scheme for the appearance of Stochastic Resonance when the
dynamics of a Brownian particle takes place in a confined medium. The presence
of uneven boundaries, giving rise to an entropic contribution to the potential,
may upon application of a periodic driving force result in an increase of the
spectral amplification at an optimum value of the ambient noise level. This
Entropic Stochastic Resonance (ESR), characteristic of small-scale systems, may
constitute a useful mechanism for the manipulation and control of
single-molecules and nano-devices.
","[{""version"":""v1"",""created"":""Wed, 16 Jul 2008 12:56:56 GMT""}]","2009-11-13"
"0807.2559","Chanyong Park","Bum-Hoon Lee, Kamal L. Panigrahi and Chanyong Park","Spiky Strings on AdS(4) X CP**3","14 pages, version to appear in JHEP","JHEP 0811:066,2008","10.1088/1126-6708/2008/11/066",,"hep-th","http://arxiv.org/licenses/nonexclusive-distrib/1.0/","  We study a giant magnon and a spike solution for the string rotating on
AdS(4) X CP**3 geometry. We consider rigid rotating fundamental string in the
SU(2) X SU(2) sector inside the CP**3 and find out the general form of all the
conserved charges. We find out the dispersion relation corresponding to both
the known giant magnon and the new spike solutions. We further study the finite
size correction in both cases.
","[{""version"":""v1"",""created"":""Wed, 16 Jul 2008 14:33:27 GMT""},{""version"":""v2"",""created"":""Mon, 21 Jul 2008 08:25:25 GMT""},{""version"":""v3"",""created"":""Fri, 7 Nov 2008 07:44:18 GMT""}]","2011-08-03"
"0807.2560","Jerome Cayssol","F. Konschelle, J. Cayssol, and A. Buzdin","Nonsinusoidal current-phase relation in strongly ferromagnetic and
  moderately disordered SFS junctions","10 pages, 7 figures","Phys. Rev. B 78, 134505 (2008)","10.1103/PhysRevB.78.134505",,"cond-mat.mes-hall","http://arxiv.org/licenses/nonexclusive-distrib/1.0/","  We study the Josephson current in a junction comprising two superconductors
linked by a strong ferromagnet in presence of impurities. We focus on a regime
where the electron (and hole) motion is ballistic over the exchange length and
diffusive on the scale of the weak link length. The current-phase relation is
obtained for both two- and three dimensional ferromagnetic weak links. In the
clean limit, the possibility of temperature-induced 0- transitions is
demonstrated while the corresponding critical current versus temperature
dependences are also studied.
","[{""version"":""v1"",""created"":""Wed, 16 Jul 2008 13:05:45 GMT""}]","2009-11-13"
"0807.2561","Emil Tafra","E. Tafra, B. Korin-Hamzic, M. Basletic, A. Hamzic, M. Dressel, J.
  Akimitsu","Influence of doping on the Hall coefficient in Sr_{14-x}Ca_xCu_24O_41","8 pages, 7 figures, revised version","Phys. Rev. B 78, 155122 (2008)","10.1103/PhysRevB.78.155122",,"cond-mat.str-el cond-mat.supr-con","http://arxiv.org/licenses/nonexclusive-distrib/1.0/","  We present Hall-effect measurements of two-leg ladder compounds
Sr_{14-x}Ca_xCu_24O_41 (0 <= x <= 11.5) with the aim to determine the number of
carriers participating in dc transport. Distribution of holes between the
ladder and chain subsystems is one of the crucial questions important for
understanding the physics of these compounds. Our Hall effect and resistivity
measurements show typical semiconducting behavior for x < 11.5. However, for
x=11.5, the results are completely different, and the Hall coefficient and
resistivity behavior is qualitatively similar to that of high temperature
copper-oxide superconductors. We have determined the effective number of
carriers at room temperature and compared it to the number of holes in the
ladders obtained by other experimental techniques. We propose that going from
x=0 to x=11.5 less than 1 hole per formula unit is added to the ladders and is
responsible for a pronounced change in resistivity with Ca doping.
","[{""version"":""v1"",""created"":""Wed, 16 Jul 2008 13:07:20 GMT""},{""version"":""v2"",""created"":""Thu, 23 Oct 2008 10:54:21 GMT""}]","2008-10-23"
"0807.2562","Thierry Pradier","Thierry Pradier","Coincidences between Gravitational Wave Interferometers and High Energy
  Neutrino Telescopes","8 pages, 11 figures, Proceedings of the ""International Workshop on a
  Very Large Volume Neutrino Telescope for the Mediterranean Sea"" VLVnT08 -
  Toulon, Var, France, 22-24 April 2008",,"10.1016/j.nima.2008.12.055",,"astro-ph","http://arxiv.org/licenses/nonexclusive-distrib/1.0/","  Sources of gravitational waves (GW) and emitters of high energy (HE)
neutrinos both involve compact objects and matter moving at relativistic
speeds. GW emission requires a departure from spherical symmetry, which is the
case if clumps of matter are accreted around black holes or neutron stars, and
ejected in relativistic jets, where neutrinos are believed to be produced. Both
messengers interact weakly with the surrounding matter, hence point directly to
the heart of the engines that power these emissions. Coincidences between GW
interferometers (e.g. Virgo) and HE neutrino telescopes (e.g. Antares) would
then give a unique insight on the physics of the most powerful objects in the
Universe. The possibility, observability and detectability for such GW/HE
neutrino coincidences are analysed.
","[{""version"":""v1"",""created"":""Wed, 16 Jul 2008 13:24:07 GMT""}]","2009-11-13"
"0807.2563","Konstantinos Fokianos","Konstantinos Fokianos","Comparing two samples by penalized logistic regression","Published in at http://dx.doi.org/10.1214/07-EJS078 the Electronic
  Journal of Statistics (http://www.i-journals.org/ejs/) by the Institute of
  Mathematical Statistics (http://www.imstat.org)","Electronic Journal of Statistics 2008, Vol. 2, 564-580","10.1214/07-EJS078","IMS-EJS-EJS_2007_78","math.ST stat.TH","http://arxiv.org/licenses/nonexclusive-distrib/1.0/","  Inference based on the penalized density ratio model is proposed and studied.
The model under consideration is specified by assuming that the log--likelihood
function of two unknown densities is of some parametric form. The model has
been extended to cover multiple samples problems while its theoretical
properties have been investigated using large sample theory. A main application
of the density ratio model is testing whether two, or more, distributions are
equal. We extend these results by arguing that the penalized maximum empirical
likelihood estimator has less mean square error than that of the ordinary
maximum likelihood estimator, especially for small samples. In fact,
penalization resolves any existence problems of estimators and a modified Wald
type test statistic can be employed for testing equality of the two
distributions. A limited simulation study supports further the theory.
","[{""version"":""v1"",""created"":""Wed, 16 Jul 2008 14:02:33 GMT""}]","2008-07-17"
"0807.2564","Markus Rauscher","Markus Rauscher, Ralf Blossey, Andreas M\""unch and Barbara Wagner","Spinodal dewetting of thin films with large interfacial slip:
  implications from the dispersion relation","12 pages, 3 figure, submitted",,,,"cond-mat.soft","http://arxiv.org/licenses/nonexclusive-distrib/1.0/","  We compare the dispersion relations for spinodally dewetting thin liquid
films for increasing magnitude of interfacial slip length in the lubrication
limit. While the shape of the dispersion relation, in particular the position
of the maximum, are equal for no-slip up to moderate slip lengths, the position
of the maximum shifts to much larger wavelengths for large slip lengths. Here,
we discuss the implications of this fact for recently developed methods to
assess the disjoining pressure in spinodally unstable thin films by measuring
the shape of the roughness power spectrum. For PS films on OTS covered Si
wafers (with slip length b approx. 1 mum) we predict a 20% shift of the
position of the maximum of the power spectrum which should be detectable in
experiments.
","[{""version"":""v1"",""created"":""Wed, 16 Jul 2008 13:21:41 GMT""}]","2008-07-17"
"0807.2565","Marco Donatelli","Marco Donatelli","A note on grid transfer operators for multigrid methods",,,,,"math.NA","http://arxiv.org/licenses/nonexclusive-distrib/1.0/","  The Local Fourier analysis (LFA) is a classic tool to prove convergence
theorems for multigrid methods (MGMs). In particular, we are interested in
optimality that is a convergence speed independent of the size of the involved
matrices. For elliptic partial differential equations (PDEs), a well known
optimality result requires that the sum of the orders of the grid transfer
operators is not lower than the order of the PDE to solve. Analogously, when
dealing with MGMs for Toeplitz matrices in the literature an optimality
condition on the position and on the order of the zeros of the symbols of the
grid transfer operators has been found. In this work we show that in the case
of elliptic PDEs with constant coefficients, the two different approaches lead
to an equivalent condition. We argue that the analysis for Toeplitz matrices is
an algebraic generalization of the LFA, which allows to deal not only with
differential problems but also for instance with integral problems. The
equivalence of the two approaches gives the possibility of using grid transfer
operators with different orders also for MGMs for Toeplitz matrices. We give
also a class of grid transfer operators related to the B-spline's refinement
equation and we study their geometric properties. This analysis suggests
further links between wavelets and multigrid methods. A numerical
experimentation confirms the correctness of the proposed analysis.
","[{""version"":""v1"",""created"":""Wed, 16 Jul 2008 13:20:34 GMT""}]","2008-07-17"
"0807.2566","Ivan Agudo","J. L. Gomez (1), I. Agudo (1), A. P. Marscher (2), S. G. Jorstad (2),
  M. Roca-Sogorb (1) ((1) IAA (CSIC), Granada (Spain); (2) BU, Boston (USA))","Stratification in polarization and Faraday rotation in the jet of 3C 120","To be published by the Memorie della Societa Astronomica Italiana,
  Vol. 79, in the Proceedings of the Workshop: ""The Central Kiloparsec: Active
  Galactic Nuclei and Their Hosts"", eds. A.Lobanov, E.Angelakis, M.Perucho, and
  A.Zensus. 4 pages (including 4 figures)",,,,"astro-ph","http://arxiv.org/licenses/nonexclusive-distrib/1.0/","  Very long baseline interferometric observations of the radio galaxy 3C 120
show a systematic presence of gradients in Faraday rotation and degree of
polarization across and along the jet. These are revealed by the passage of
multiple superluminal components throughout the jet as they move out from the
core in a sequence of 12 monthly polarimetric observations taken with the VLBA
at 15, 22, and 43 GHz. The degree of polarization has an asymmetric profile in
which the northern side of the jet is more highly polarized. The Faraday
rotation measure is also stratified across the jet width, with larger values
for the southern side. Superposed on this structure we find a localized region
of high Faraday rotation measure (about 6000 rad/m^2) between approximately 3
and 4 mas from the core. This region of enhanced Faraday rotation may result
from the interaction of the jet with the ambient medium, which may also explain
the stratification in degree of polarization. The data are also consistent with
a helical magnetic field in a two-fluid jet model, consisting of an inner
emitting jet and a sheath of nonrelativistic electrons.
","[{""version"":""v1"",""created"":""Wed, 16 Jul 2008 13:25:26 GMT""}]","2008-07-17"
"0807.2567","Thierry Pradier","Thierry Pradier","Antares/Virgo Coincidences : a feasibility study","4 pages, 3 figures, Proceedings of the ""XXth RENCONTRES DE BLOIS -
  Challenges in Particle Astrophysics"", 18th - 23rd May 2008, Blois (France)",,,,"astro-ph","http://arxiv.org/licenses/nonexclusive-distrib/1.0/","  Sources of gravitational waves (GW) and emitters of high energy (HE)
neutrinos both involve compact objects and matter moving at relativistic
speeds. Coincidences between Virgo and Antares would give a unique insight on
the physics of the most powerful objects in the Universe. The feasibility of
such GW/HE neutrino coincidences is analysed.
","[{""version"":""v1"",""created"":""Wed, 16 Jul 2008 13:30:01 GMT""}]","2008-07-17"
"0807.2568","Philip Lucas","P.W.Lucas (1), J.H.Hough (1), J.A.Bailey (2), M.Tamura (3), E.Hirst
  (1), D.Harrison (1) ((1) Centre for Astrophysics Research, University of
  Hertfordshire (2) School of Physics, University of New South Wales (3) NAOJ,
  Japan)","Planetpol polarimetry of the exoplanet systems 55 Cnc and tau Boo","Accepted by MNRAS. 18 pages, 9 figures. The definitive version will
  be available at www.blackwell-synergy.com",,"10.1111/j.1365-2966.2008.14182.x",,"astro-ph","http://arxiv.org/licenses/nonexclusive-distrib/1.0/","  We present very sensitive polarimetry of 55 Cnc and tau Boo in an attempt to
detect the partially polarised reflected light from the planets orbiting these
two stars. 55 Cnc is orbited by a hot Neptune planet (55 Cnc e) at 0.038 AU, a
hot Jupiter planet (55 Cnc b) at 0.11 AU, and at least 3 more distant planets.
The polarisation of this system is very stable, showing no sign of the periodic
variations that would be expected if a short period planet were detected. The
measured standard deviation of the night averaged Stokes Q/I and U/I parameters
is 2.2x10^{-6}. We derive upper limits on the geometric albedo, A_G and
planetary radius using Monte Carlo multiple scattering simulations of a simple
model atmosphere. We assume Rayleigh-like scattering (scaled by the maximum
polarisation, p_m at 90 degrees) and pressure insensitive extinction.
Atmospheres in which multiple scattering plays only a small role have an almost
linear relation between polarisation and A_G. In this case, the 4 sigma upper
limits is A_G<0.13(R/1.2 R_{Jup})^{-2}p_m^{-1} for 55 Cnc e. This suggests that
55 Cnc e is relatively small and not a pure H-He planet. The data do not give a
useful upper limit for 55 Cnc b. tau Boo is orbited by an unusually massive hot
Jupiter planet. The standard deviation in the night averaged Stokes Q/I and U/I
polarisation parameters is 5.1x10^{-6}. The 4 sigma upper limit is
A_G<0.37(R/1.2 R_{Jup})^{-2}p_m^{-1} for tau Boo b. This extends the similar
upper limits reported previously for this planet to longer wavelengths. The
larger scatter in the tau Boo data may be due to the spot activity detected
photometrically by the MOST satellite. These results contrast markedly with the
recent claim of a 3 sigma detection of a periodic polarisation signal from
HD189733 with amplitude P=2x10^{-4}, attributed to the planet HD189733 b.
","[{""version"":""v1"",""created"":""Wed, 16 Jul 2008 13:46:06 GMT""},{""version"":""v2"",""created"":""Tue, 4 Nov 2008 18:04:27 GMT""}]","2009-11-13"
"0807.2569","Jeffrey Solka","Jeffrey Solka","Text Data Mining: Theory and Methods","Published in at http://dx.doi.org/10.1214/07-SS016 the Statistics
  Surveys (http://www.i-journals.org/ss/) by the Institute of Mathematical
  Statistics (http://www.imstat.org)","Statistics Surveys 2008, Vol. 2, 94-112","10.1214/07-SS016","IMS-SS-SS_2007_16","stat.ML cs.IR stat.CO","http://arxiv.org/licenses/nonexclusive-distrib/1.0/","  This paper provides the reader with a very brief introduction to some of the
theory and methods of text data mining. The intent of this article is to
introduce the reader to some of the current methodologies that are employed
within this discipline area while at the same time making the reader aware of
some of the interesting challenges that remain to be solved within the area.
Finally, the articles serves as a very rudimentary tutorial on some of
techniques while also providing the reader with a list of references for
additional study.
","[{""version"":""v1"",""created"":""Wed, 16 Jul 2008 13:39:32 GMT""}]","2008-07-17"
"0807.2570","Anupam Mazumdar","A. Mazumdar, H. Stoica","Exciting gauge field and gravitons in a brane-anti-brane annihilation","4 pages 8 figs","Phys.Rev.Lett.102:091601,2009","10.1103/PhysRevLett.102.091601",,"hep-th","http://arxiv.org/licenses/nonexclusive-distrib/1.0/","  In this paper we point out the inevitability of an explosive production of
gauge field and gravity wave during an open string tachyon condensation in a
cosmological setting. We will be particularly studying an example of
brane-anti-brane inflation in a warped throat where inflation ends via tachyon
condensation. We point out that a tachyonic instability helps fragmenting the
homogeneous tachyon and excites gauge field and contributes to the stress
energy tensor which also feeds into the gravity waves.
","[{""version"":""v1"",""created"":""Wed, 16 Jul 2008 13:40:07 GMT""},{""version"":""v2"",""created"":""Thu, 26 Mar 2009 15:04:25 GMT""}]","2009-04-08"
