"0812.3478","Wilson Wong","Wilson Wong, Wei Liu, Saujoe Liaw, Nicoletta Balliu, Hongwei Wu, Moses
  Tade","Automatic Construction of Lightweight Domain Ontologies for Chemical
  Engineering Risk Management","In the Proceedings of the 11th Conference on Process Integration,
  Modelling and Optimisation for Energy Saving and Pollution Reduction (PRES),
  Prague, Czech Rep., August, 2008",,,,"cs.AI","http://arxiv.org/licenses/nonexclusive-distrib/1.0/","  The need for domain ontologies in mission critical applications such as risk
management and hazard identification is becoming more and more pressing. Most
research on ontology learning conducted in the academia remains unrealistic for
real-world applications. One of the main problems is the dependence on
non-incremental, rare knowledge and textual resources, and manually-crafted
patterns and rules. This paper reports work in progress aiming to address such
undesirable dependencies during ontology construction. Initial experiments
using a working prototype of the system revealed promising potentials in
automatically constructing high-quality domain ontologies using real-world
texts.
","[{""version"":""v1"",""created"":""Thu, 18 Dec 2008 08:58:52 GMT""}]","2008-12-19"
"0812.3479","Edmond Orignac","Xiaolong Deng (LPM2C), Roberta Citro (Salerno), Anna Minguzzi (LPM2C),
  Edmond Orignac (ENS-Lyon)","Superfluidity and Anderson localisation for a weakly interacting Bose
  gas in a quasiperiodic potential","12 pages, 9 figures, RevTeX 4","Eur. Phys. J. B 68, 435 (2009)","10.1140/epjb/e2009-00069-7",,"cond-mat.mes-hall cond-mat.other","http://arxiv.org/licenses/nonexclusive-distrib/1.0/","  Using exact diagonalisation and Density Matrix Renormalisation group (DMRG)
approach, we analyse the transition to a localised state of a weakly
interacting quasi-1D Bose gas subjected to a quasiperiodic potential. The
analysis is performed by calculating the superfluid fraction, density profile,
momentum distribution and visibility for different periodicities of the second
lattice and in the presence (or not) of a weak repulsive interaction. It is
shown that the transition is sharper towards the maximally incommensurate ratio
between the two lattice periodicities, and shifted to higher values of the
second lattice strength by weak repulsive interactions. We also relate our
results to recent experiments.
","[{""version"":""v1"",""created"":""Thu, 18 Dec 2008 08:51:10 GMT""}]","2010-01-20"
"0812.3480","Sen-Yue Lou","Yuan Gao and S. Y. Lou","Nonsensitive nonlinear homotopy approach","4 pages with 3 figures",,"10.1088/0256-307X/26/11/110201",,"physics.comp-ph","http://arxiv.org/licenses/nonexclusive-distrib/1.0/","  Generally, natural scientific problems are so complicated that one has to
establish some effective perturbation or nonperturbation theories with respect
to some associated ideal models. In this Letter, a new theory that combines
perturbation and nonperturbation is constructed. An artificial nonlinear
homotopy parameter plays the role of a perturbation parameter, while other
artificial nonlinear parameters, of which the original problems are
independent, introduced in the nonlinear homotopy models are nonperturbatively
determined by means of a principle minimal sensitivity. The method is
demonstrated through several quantum anharmonic oscillators and a non-hermitian
parity-time symmetric Hamiltonian system. In fact, the framework of the theory
is rather general that can be applied to a broad range of natural phenomena.
Possible applications to condensed matter physics, matter wave systems, and
nonlinear optics are briefly discussed.
","[{""version"":""v1"",""created"":""Thu, 18 Dec 2008 08:56:47 GMT""},{""version"":""v2"",""created"":""Thu, 29 Jan 2009 01:55:06 GMT""}]","2015-05-13"
"0812.3481","Alexander Tsukanov","A. V. Tsukanov","Resonant optical electron transfer in one-dimensional multiwell
  structures","25 pages,16 figures","J. Phys.: Condens. Matter 20, 315204 (2008)","10.1088/0953-8984/20/31/315204",,"cond-mat.mes-hall","http://arxiv.org/licenses/nonexclusive-distrib/1.0/","  We consider coherent single-electron dynamics in the one-dimensional
nanostructure under resonant electromagnetic pulse. The structure is composed
of two deep quantum wells positioned at the edges of structure and separated by
a sequence of shallow internal wells. We show that complete electron transfer
between the states localized in the edge wells through one of excited
delocalized states can take place at discrete set of times provided that the
pulse frequency matches one of resonant transition frequencies. The transfer
time varies from several tens to several hundreds of picoseconds and depends on
the structure and pulse parameters. The results obtained in this paper can be
applied to the developments of the quantum networks used in quantum
communications and/or quantum information processing.
","[{""version"":""v1"",""created"":""Thu, 18 Dec 2008 09:00:27 GMT""}]","2009-11-13"
"0812.3482","Toshimitsu Takaesu","Toshimitsu Takaesu","On the Spectral Analysis of Quantum Electrodynamics with Spatial
  Cutoffs. I",,,"10.1063/1.3133885",,"math-ph math.FA math.MP","http://arxiv.org/licenses/nonexclusive-distrib/1.0/","  In this paper, we consider the spectrum of a model in quantum electrodynamics
with a spatial cutoff. It is proven that (1) the Hamiltonian is self-adjoint;
  (2) under the infrared regularity condition, the Hamiltonian has a unique
ground state for sufficiently small values of coupling constants. The spectral
scattering theory is studied as well and it is shown that asymptotic fields
exist and the spectral gap is closed.
","[{""version"":""v1"",""created"":""Thu, 18 Dec 2008 09:03:32 GMT""}]","2015-05-13"
"0812.3483","Krzysztof Szajowski","Krzysztof Szajowski","A rank-based selection with cardinal payoffs and a cost of choice","11 pages","Scientiae Mathematicae Japonicae 69(2), 285-293, 2009: e2009,
  69-77","10.32219/isms.69.2_285",,"math.OC math.PR","http://arxiv.org/licenses/nonexclusive-distrib/1.0/","  A version of the secretary problem is considered. The ranks of items, whose
values are independent, identically distributed random variables
$X_1,X_2,...,X_n$ from a uniform distribution on $[0; 1]$, are observed
sequentially by the grader. He has to select exactly one item, when it appears,
and receives a payoff which is a function of the unobserved realization of
random variable assigned to the item diminished by some cost. The methods of
analysis are based on the existence of an embedded Markov chain and use the
technique of backward induction. The result is a generalization of the
selection model considered by Bearden(2006). The asymptotic behaviour of the
solution is also investigated.
","[{""version"":""v1"",""created"":""Thu, 18 Dec 2008 09:05:13 GMT""}]","2020-11-23"
"0812.3484","Alexander Tsukanov","A. V. Tsukanov","Charge qubit entanglement via conditional single-electron transfer in an
  array of quantum dots",,"J. Phys.: Condens. Matter 21, 055501 (2009)","10.1088/0953-8984/21/5/055501",,"cond-mat.mes-hall","http://arxiv.org/licenses/nonexclusive-distrib/1.0/","  We propose a novel scheme to generate entanglement among quantum-dot-based
charge qubits via sequential electron transfer in an auxiliary quantum dot
structure whose transport properties are conditioned by qubit states. The
transfer protocol requires the utilization of resonant optical pulses combined
with an appropriate voltage gate pattern. As an example illustrating the
application of this scheme, we examine the nine-qubit Shor code state
preparation together with the error syndrome measurement.
","[{""version"":""v1"",""created"":""Thu, 18 Dec 2008 09:14:42 GMT""}]","2009-11-13"
"0812.3485","Johan Segers","John H. J. Einmahl, Johan Segers","Maximum empirical likelihood estimation of the spectral measure of an
  extreme-value distribution","Published in at http://dx.doi.org/10.1214/08-AOS677 the Annals of
  Statistics (http://www.imstat.org/aos/) by the Institute of Mathematical
  Statistics (http://www.imstat.org)","Annals of Statistics 2009, Vol. 37, No. 5B, 2953-2989","10.1214/08-AOS677","IMS-AOS-AOS677","math.ST math.PR stat.TH","http://arxiv.org/licenses/nonexclusive-distrib/1.0/","  Consider a random sample from a bivariate distribution function $F$ in the
max-domain of attraction of an extreme-value distribution function $G$. This
$G$ is characterized by two extreme-value indices and a spectral measure, the
latter determining the tail dependence structure of $F$. A major issue in
multivariate extreme-value theory is the estimation of the spectral measure
$\Phi_p$ with respect to the $L_p$ norm. For every $p\in[1,\infty]$, a
nonparametric maximum empirical likelihood estimator is proposed for $\Phi_p$.
The main novelty is that these estimators are guaranteed to satisfy the moment
constraints by which spectral measures are characterized. Asymptotic normality
of the estimators is proved under conditions that allow for tail independence.
Moreover, the conditions are easily verifiable as we demonstrate through a
number of theoretical examples. A simulation study shows a substantially
improved performance of the new estimators. Two case studies illustrate how to
implement the methods in practice.
","[{""version"":""v1"",""created"":""Thu, 18 Dec 2008 09:43:48 GMT""},{""version"":""v2"",""created"":""Tue, 1 Sep 2009 07:55:58 GMT""}]","2009-09-01"
"0812.3486","Marco Delmastro","Marco Delmastro","Quality factor analysis and optimization of digital filtering signal
  reconstruction for liquid ionization calorimeters","Accepted for publication in Nuclear Inst. and Methods in Physics
  Research, A","Nucl.Instrum.Meth.A600:545-554,2009","10.1016/j.nima.2008.12.064",,"physics.ins-det","http://arxiv.org/licenses/nonexclusive-distrib/1.0/","  The Optimal Filtering (OF) reconstruction of the sampled signals from a
particle detector such as a liquid ionization calorimeter relies on the
knowledge of the normalized pulse shapes. This knowledge is always imprecise,
since there are residual differences between the true ionization pulse shapes
and the predicted ones, whatever the method used to model or fit the
particle--induced signals. The systematic error introduced by the residuals on
the signal amplitude estimate is analyzed, as well as the effect on the quality
factor provided by the OF reconstruction. An analysis method to evaluate the
residuals from a sample of signals is developed and tested with a simulation
tool. The correction obtained is showed to preserve the original amplitude
normalization, while restoring the expected $\chi^2 $--like behavior of the
quality factor.
","[{""version"":""v1"",""created"":""Thu, 18 Dec 2008 09:18:01 GMT""}]","2010-12-13"
"0812.3487","Petter Holme","Petter Holme","Signatures of currency vertices","to appear in Journal of the Physical Society of Japan","J. Phys. Soc. Jpn. 78, (2009) 034801","10.1143/JPSJ.78.034801",,"physics.soc-ph cond-mat.dis-nn","http://arxiv.org/licenses/nonexclusive-distrib/1.0/","  Many real-world networks have broad degree distributions. For some systems,
this means that the functional significance of the vertices is also broadly
distributed, in other cases the vertices are equally significant, but in
different ways. One example of the latter case is metabolic networks, where the
high-degree vertices -- the currency metabolites -- supply the molecular groups
to the low-degree metabolites, and the latter are responsible for the
higher-order biological function, of vital importance to the organism. In this
paper, we propose a generalization of currency metabolites to currency
vertices. We investigate the network structural characteristics of such
systems, both in model networks and in some empirical systems. In addition to
metabolic networks, we find that a network of music collaborations and a
network of e-mail exchange could be described by a division of the vertices
into currency vertices and others.
","[{""version"":""v1"",""created"":""Thu, 18 Dec 2008 09:24:02 GMT""}]","2009-02-25"
"0812.3488","Catarina Bastos","C. Bastos, O. Bertolami, N. Dias and J. Prata","Noncommutative Quantum Cosmology","Proceedings of DICE2008, Castiglioncello, 22nd-26th September 2008,
  Italy","J.Phys.Conf.Ser.174:012053,2009","10.1088/1742-6596/174/1/012053",,"hep-th","http://arxiv.org/licenses/nonexclusive-distrib/1.0/","  One presents a phase-space noncommutative extension of Quantum Cosmology in
the context of a Kantowski-Sachs (KS) minisuperspace model. We obtain the
Wheeler-DeWitt (WDW) equation for the noncommutative system through the ADM
formalism and a suitable Seiberg-Witten map. The resulting WDW equation
explicitly depends on the phase-space noncommutative parameters, $\theta$ and
$\eta$. Numerical solutions of the noncommutative WDW equation are found and,
interestingly, also bounds on the values of the noncommutative parameters.
Moreover, we conclude that the noncommutativity in the momenta sector leads to
a damped wave function implying that this type of noncommutativity can be
relevant for a selection of possible initial states for the universe.
","[{""version"":""v1"",""created"":""Thu, 18 Dec 2008 09:21:53 GMT""}]","2009-07-24"
"0812.3489","Domenico Zambella","Domenico Zambella","Krull dimension of types in a class of first-order theories","Major revision, new title",,,,"math.LO","http://arxiv.org/licenses/nonexclusive-distrib/1.0/","  We study a class of first-order theories whose complete quantifier-free types
with one free variable either have a trivial positive part or are isolated by a
positive quantifier-free formula--plus a few other technical requirements. The
theory of vector spaces and the theory fields are examples. We prove the
amalgamation property and the existence of a model-companion. We show that the
model-companion is strongly minimal. We also prove that the length of any
increasing sequence of prime types is bounded, so every formula has finite
Krull dimension.
","[{""version"":""v1"",""created"":""Thu, 18 Dec 2008 10:10:27 GMT""},{""version"":""v2"",""created"":""Sun, 31 May 2009 03:38:06 GMT""}]","2009-06-01"
"0812.3490","Fabien Alet","Jesper Lykke Jacobsen and Fabien Alet","The semiflexible fully-packed loop model and interacting rhombus tilings","4 pages, 4 figures, v2: corrected typo, v3: minor modifications,
  published version","Phys. Rev. Lett. 102, 145702 (2009)","10.1103/PhysRevLett.102.145702",,"cond-mat.stat-mech","http://arxiv.org/licenses/nonexclusive-distrib/1.0/","  Motivated by a recent adsorption experiment [M.O. Blunt et al., Science 322,
1077 (2008)], we study tilings of the plane with three different types of
rhombi. An interaction disfavors pairs of adjacent rhombi of the same type.
This is shown to be a special case of a model of fully-packed loops with
interactions between monomers at distance two along a loop. We solve the latter
model using Coulomb gas techniques and show that its critical exponents vary
continuously with the interaction strenght. At low temperature it undergoes a
Kosterlitz-Thouless transition to an ordered phase, which is predicted from
numerics to occur at a temperature T \sim 110K in the experiments.
","[{""version"":""v1"",""created"":""Thu, 18 Dec 2008 09:33:06 GMT""},{""version"":""v2"",""created"":""Fri, 19 Dec 2008 07:21:24 GMT""},{""version"":""v3"",""created"":""Fri, 17 Apr 2009 10:17:51 GMT""}]","2013-05-29"
"0812.3491","Peter Englmaier","Peter Englmaier, Martin Pohl, Nicolai Bissantz","The Milky Way Spiral Arm Pattern","6 pages, 4 figures. To appear in ""Tumbling, Twisting, and Winding
  Galaxies: Pattern Speeds along the Hubble Sequence"", E. M. Corsini and V. P.
  Debattista (eds.), Memorie della Societa Astronomica Italiana",,,,"astro-ph","http://arxiv.org/licenses/nonexclusive-distrib/1.0/","  A complete map of the 3D distribution of molecular (CO) gas was constructed
using a realistic dynamical model of the gas flow in the barred potential of
the Milky Way. The map shows two prominent spiral arms starting at the bar ends
connecting smoothly to the 4-armed spiral pattern observed in the atomic
hydrogen gas in the outer Galaxy. Unlike previous attempts, our new map
uncovers the gas distribution in the bar region of the Galaxy and the far side
of the disk. For the first time, we can follow spiral arms in gas as they pass
behind the galactic centre.
","[{""version"":""v1"",""created"":""Thu, 18 Dec 2008 09:43:45 GMT""}]","2008-12-19"
"0812.3492","Eelco Eggen","Eelco Eggen, Marjolein Dijkstra, Ren\'e van Roij","Effective shape and phase behaviour of short charged rods","17 pages, 8 figures",,"10.1103/PhysRevE.79.041401","ITP-UU-08/76","cond-mat.soft","http://arxiv.org/licenses/nonexclusive-distrib/1.0/","  We explicitly calculate the orientation-dependent second virial coefficient
of short charged rods in an electrolytic solvent, assuming the rod-rod
interactions to be a pairwise sum of hard-core and segmental screened-Coulomb
repulsions. From the parallel and isotropically averaged second virial
coefficient, we calculate the effective length and diameter of the rods, for
charges and screening lengths that vary over several orders of magnitude. Using
these effective dimensions, we determine the phase diagram, where we
distinguish a low-charge and strong-screening regime with a liquid crystalline
nematic and smectic phase, and a high-charge and weak-screening regime with a
plastic crystal phase in the phase diagram.
","[{""version"":""v1"",""created"":""Thu, 18 Dec 2008 10:49:39 GMT""}]","2009-11-13"
"0812.3494","Javier Trujillo Bueno","J. Trujillo Bueno and N. Shchukina","Three-dimensional Radiative Transfer Modeling of the Polarization of the
  Sun's Continuous Spectrum","Accepted for publication in The Astrophysical Journal","Astrophys.J.694:1364-1378,2009","10.1088/0004-637X/694/2/1364",,"astro-ph","http://arxiv.org/licenses/nonexclusive-distrib/1.0/","  Here we formulate and solve the 3D radiative transfer problem of the
polarization of the solar continuous radiation. Our approach takes into account
not only the anisotropy of the continuum radiation, but also the
symmetry-breaking effects caused by the horizontal atmospheric inhomogeneities
produced by the solar surface convection. Interestingly, our radiative transfer
modeling in a well-known 3D hydrodynamical model of the solar photosphere shows
remarkable agreement with the empirical data, significantly better than that
obtained via the use of 1D atmospheric models. Although this result confirms
that the above-mentioned 3D model was indeed a suitable choice for our
Hanle-effect estimation of the substantial amount of ""hidden"" magnetic energy
that is stored in the quiet solar photosphere, we have found however some small
discrepancies whose origin may be due to uncertainties in the empirical data
and/or in the thermal and density structure of the 3D model. For this reason,
we have paid some attention also to other (more familiar) observables, like the
center-limb variation of the continuum intensity, which we have calculated
taking into account the scattering contribution to the continuum source
function. The overall agreement with the observed center-limb variation turns
out to be impressive, but we find a hint that the model's temperature gradients
in the continuum forming layers could be slightly too steep, perhaps because
all current simulations of solar surface convection and magnetoconvection
compute the radiative flux divergence ignoring the fact that the effective
polarizability is not completely negligible, especially in the downward-moving
intergranular lane plasma.
","[{""version"":""v1"",""created"":""Thu, 18 Dec 2008 09:52:42 GMT""}]","2011-02-11"
"0812.3495","Klaus Ehret","K. Ehret","Status of the ALPS Experiment","6 pages, 5 figures, contribution to 4th Patras Workshop on Axions,
  WIMPs and WISPs at DESY June 2008",,,"DESY 08-192","hep-ex","http://arxiv.org/licenses/nonexclusive-distrib/1.0/","  The ALPS experiment at DESY searches for light particles which are coupling
very weakly to photons. Primary physics goal is the search for axion like
particles in a photon regeneration experiment. Central part of the experimental
setup is a five Tesla strong superconducting HERA dipole magnet. During two
operation periods in the years 2007 and 2008 we have collected first data and
explored the sensitivity of the setup. A Fabry Perot laser cavity is being set
up in order to increase the sensitivity by more than one order of magnitude.
","[{""version"":""v1"",""created"":""Thu, 18 Dec 2008 13:02:27 GMT""},{""version"":""v2"",""created"":""Fri, 19 Dec 2008 11:32:08 GMT""}]","2008-12-19"
"0812.3496","Alexander Guterman E.","Marianne Akian, Stephane Gaubert, Alexander Guterman","Linear independence over tropical semirings and beyond",,"Proceedings of the International Conference on Tropical and
  Idempotent Mathematics, G.L. Litvinov and S.N. Sergeev Eds, volume 495 in
  Contemporary Mathematics, pp 1--38, 2009, AMS",,,"math.AC math.CO","http://arxiv.org/licenses/nonexclusive-distrib/1.0/","  We investigate different notions of linear independence and of matrix rank
that are relevant for max-plus or tropical semirings. The factor rank and
tropical rank have already received attention, we compare them with the ranks
defined in terms of signed tropical determinants or arising from a notion of
linear independence introduced by Gondran and Minoux. To do this, we revisit
the symmetrization of the max-plus algebra, establishing properties of linear
spaces, linear systems, and matrices over the symmetrized max-plus algebra. In
parallel we develop some general technique to prove combinatorial and
polynomial identities for matrices over semirings that we illustrate by a
number of examples.
","[{""version"":""v1"",""created"":""Thu, 18 Dec 2008 10:01:34 GMT""}]","2009-12-13"
"0812.3497","Markus Dahlem","Felix M. Schneider, Eckehard Schoell, Markus A. Dahlem","Controlling the onset of traveling pulses in excitable media by nonlocal
  spatial coupling and time-delayed feedback",,,"10.1063/1.3096411",,"nlin.PS","http://arxiv.org/licenses/nonexclusive-distrib/1.0/","  The onset of pulse propagation is studied in a reaction-diffusion (RD) model
with control by augmented transmission capability that is provided either along
nonlocal spatial coupling or by time-delayed feedback. We show that traveling
pulses occur primarily as solutions to the RD equations while augmented
transmission changes excitability. For certain ranges of the parameter
settings, defined as weak susceptibility and moderate control, respectively,
the hybrid model can be mapped to the original RD model. This results in an
effective change of RD parameters controlled by augmented transmission. Outside
moderate control parameter settings new patterns are obtained, for example
step-wise propagation due to delay-induced oscillations. Augmented transmission
constitutes a signaling system complementary to the classical RD mechanism of
pattern formation. Our hybrid model combines the two major signaling systems in
the brain, namely volume transmission and synaptic transmission. Our results
provide insights into the spread and control of pathological pulses in the
brain.
","[{""version"":""v1"",""created"":""Thu, 18 Dec 2008 10:06:22 GMT""}]","2009-11-13"
"0812.3498","Alexander Rubass","T. A. Fadeyeva, A. F. Rubass, A. V. Volyar","The transverse shift of a high order paraxial vortex-beam induced by a
  homogeneous anisotropic medium","14 pages, 19 figures",,"10.1103/PhysRevA.79.053815",,"physics.optics","http://arxiv.org/licenses/nonexclusive-distrib/1.0/","  We consider the propagation of a tilted high order paraxial vortex-beam
through a homogeneous anisotropic medium of a uniaxial crystal. We found that
the initially circularly polarized beam bearing the l-order optical vortex
splits into ordinary and extraordinary beams with a complex vortex structure.
After a series of dislocation reactions the vortices gather together at the
axis of the partial beam with the initial circular polarization shaping the
l-order optical vortex. However, only l-1 vortices gather together on the axis
of the partial beam with the orthogonal circular polarization. One optical
vortex is shifted along the direction perpendicular to the inclination plane of
the beam. Such a vortex displacement induces the transverse shift of the
partial beam. In fact, we deal with the beam quadrefringence in a uniaxial,
homogeneous anisotropic medium. The first two beams is a result of the
splitting of the initial tilted beam into the ordinary and extraordinary once.
","[{""version"":""v1"",""created"":""Thu, 18 Dec 2008 10:11:37 GMT""},{""version"":""v2"",""created"":""Mon, 22 Dec 2008 12:36:36 GMT""}]","2013-05-29"
"0812.3499","Benjamin Steinberg","Karsten Henckell, John Rhodes and Benjamin Steinberg","An Effective Lower Bound for Group Complexity of Finite Semigroups and
  Automata",,,,,"math.GR math.CO","http://arxiv.org/licenses/nonexclusive-distrib/1.0/","  The question of computing the group complexity of finite semigroups and
automata was first posed in K. Krohn and J. Rhodes, \textit{Complexity of
finite semigroups}, Annals of Mathematics (2) \textbf{88} (1968), 128--160,
motivated by the Prime Decomposition Theorem of K. Krohn and J. Rhodes,
\textit{Algebraic theory of machines, {I}: {P}rime decomposition theorem for
finite semigroups and machines}, Transactions of the American Mathematical
Society \textbf{116} (1965), 450--464. Here we provide an effective lower bound
for group complexity.
","[{""version"":""v1"",""created"":""Thu, 18 Dec 2008 10:14:34 GMT""}]","2008-12-19"
