"0812.3433","Roozbeh Hazrat","R. Hazrat, A. R. Wadsworth","SK1 for graded division algebras","35 pages",,,,"math.RA","http://arxiv.org/licenses/nonexclusive-distrib/1.0/","  The reduced Whitehead group $\SK$ of a graded division algebra graded by a
torsion-free abelian group is studied. It is observed that the computations
here are much more straightforward than in the non-graded setting. Bridges to
the ungraded case are then established by the following two theorems: It is
proved that $\SK$ of a tame valued division algebra over a henselian field
coincides with $\SK$ of its associated graded division algebra. Furthermore, it
is shown that $\SK$ of a graded division algebra is isomorphic to $\SK$ of its
quotient division algebra. The first theorem gives the established formulas for
the reduced Whitehead group of certain valued division algebras in a unified
manner, whereas the latter theorem covers the stability of reduced Whitehead
groups, and also describes $\SK$ for generic abelian crossed products.
","[{""version"":""v1"",""created"":""Wed, 17 Dec 2008 23:22:50 GMT""}]","2008-12-19"
"0812.3434","Henry Towsner","Henry Towsner","Priority Arguments and Epsilon Substitutions",,,,,"math.LO","http://arxiv.org/licenses/nonexclusive-distrib/1.0/","  Kreisel has observed that the termination proof for Hilbert's
epsilon-substitution method bears a resemblance to the priority arguments used
in recursion theory. We make this precise by proving the termination using a
framework for priority arguments due to Lerman and Lempp.
","[{""version"":""v1"",""created"":""Thu, 18 Dec 2008 02:16:42 GMT""}]","2008-12-19"
"0812.3435","Roozbeh Hazrat","R. Hazrat, A. R. Wadsworth","On maximal Subgroups of the multiplicative group of a division algebra","18 pages",,,,"math.RA","http://arxiv.org/licenses/nonexclusive-distrib/1.0/","  The question of existence of a maximal subgroup in the multiplicative group
D* of a division algebra D finite dimensional over its center F is
investigated. We prove that if D* has no maximal subgroup, then deg(D) is not a
power of 2, F^{*2} is divisible, and for each odd prime p dividing deg(D),
there exist noncyclic division algebras of degree p over F.
","[{""version"":""v1"",""created"":""Wed, 17 Dec 2008 23:32:18 GMT""}]","2008-12-19"
"0812.3436","Tomas Liko","Tomas Liko","Extending the isolated horizon phase space to string-inspired gravity
  models","Ph.D dissertation; Memorial University of Newfoundland; 63 pages; 1
  figure; v2: typos corrected",,,,"gr-qc hep-th","http://arxiv.org/licenses/nonexclusive-distrib/1.0/","  An isolated horizon (IH) is a null hypersurface at which the geometry is held
fixed. This generalizes the notion of an event horizon so that the black hole
is an object that is in local equilibrium with its (possibly) dynamic
environment. The first law of IH mechanics that arises from the framework
relates quantities that are all defined at the horizon.
  IHs have been extensively studied in Einstein gravity with various matter
couplings and rotation, and in asymptotically flat and asymptotically anti-de
Sitter (ADS) spacetimes in all dimensions $D\geq3$. Motivated by the
nonuniqueness of black holes in higher dimensions and by the black-hole/string
correspondence principle, we devote this thesis to the extension of the
framework to include IHs in string-inspired gravity models, specifically to
Einstein-Maxwell-Chern-Simons (EMCS) theory and to Einstein-Gauss-Bonnet (EGB)
theory in higher dimensions.
  The focus is on determining the generic features of black holes that are
solutions to the field equations of the theories under consideration. We obtain
various results for non-extremal, extremal and supersymmetric IHs in EM-CS
theory, and for non-rotating IHs in EGB theory.
  (An extended abstract is given in the PDF file.)
","[{""version"":""v1"",""created"":""Thu, 18 Dec 2008 04:55:14 GMT""},{""version"":""v2"",""created"":""Mon, 22 Dec 2008 02:00:37 GMT""}]","2008-12-22"
"0812.3437","Michael J. Longo","Michael J. Longo","Does the Universe Have a Handedness?",,,,"12/18/2008","astro-ph","http://arxiv.org/licenses/nonexclusive-distrib/1.0/","  In this article I extend an earlier study of spiral galaxies in the Sloan
Digital Sky Survey (SDSS) to investigate whether the universe has an overall
handedness. A preference for spiral galaxies in one sector of the sky to be
left-handed or right-handed spirals would indicate a parity-violating asymmetry
in the overall universe and a preferred axis. The previous study used 2616
spiral galaxies with redshifts <0.04 and identified handedness. The new study
uses 15872 with redshifts <0.085 and obtains very similar results to the first
with a signal exceeding 5 sigma, corresponding to a probability of 2.5x10-7 for
occurring by chance. The axis of the dipole asymmetry lies at approx. (l, b)
=(32d,69d), roughly along that of our Galaxy and close to the so-called ""Axis
of Evil"".
","[{""version"":""v1"",""created"":""Thu, 18 Dec 2008 15:08:06 GMT""}]","2008-12-19"
"0812.3438","R. Aldrovandi","R. Aldrovandi and J. G. Pereira","De Sitter Special Relativity: Effects on Cosmology","12 pages","Grav.Cosmol.15:287-294,2009","10.1134/S020228930904001X",,"gr-qc","http://arxiv.org/licenses/nonexclusive-distrib/1.0/","  The main consequences of de Sitter Special Relativity to the Standard
Cosmological Model of Physical Cosmology are examined. The cosmological
constant Lambda appears, in this theory, as a manifestation of the proper
conformal current, which must be added to the usual energy-momentum density. As
that conformal current itself vanishes in absence of sources, Lambda is
ultimately dependent on the matter content, and can in principle be calculated.
A present-day value very close to that given by the crossed supernova/BBR data
is obtained through simple and reasonable approximations. Also a primeval
inflation of polynomial type is found, and the usual notion of co-moving
observer is slightly modified.
","[{""version"":""v1"",""created"":""Thu, 18 Dec 2008 00:31:51 GMT""}]","2010-01-08"
"0812.3439","Kody Law","Kody J.H. Law, P. G. Kevrekidis, Tristram J. Alexander, Wieslaw
  Krolikowski, and Yuri S. Kivshar","Stable higher-charge discrete vortices in hexagonal optical lattices",,,"10.1103/PhysRevA.79.025801",,"physics.optics","http://arxiv.org/licenses/nonexclusive-distrib/1.0/","  We show that double-charge discrete optical vortices may be completely stable
in hexagonal photonic lattices where single-charge vortices always exhibit
dynamical instabilities. Even when unstable the double-charge vortices
typically have a much weaker instability than the single-charge vortices, and
thus their breakup occurs at longer propagation distances.
","[{""version"":""v1"",""created"":""Thu, 18 Dec 2008 00:38:22 GMT""}]","2009-11-13"
"0812.3440","Scott Carnahan","Scott Carnahan","Generalized Moonshine I: Genus zero functions","23 pages, (v3) all schemes removed, published","Algebra and Number Theory 4:6 (2010) 649-679","10.2140/ant.2010.4.649",,"math.RT math.NT","http://arxiv.org/licenses/nonexclusive-distrib/1.0/","  We introduce a notion of Hecke-monicity for functions on certain moduli
spaces associated to torsors of finite groups over elliptic curves, and show
that it implies strong invariance properties under linear fractional
transformations. Specifically, if a weakly Hecke-monic function has algebraic
integer coefficients and a pole at infinity, then it is either a holomorphic
genus-zero function invariant under a congruence group or of a certain
degenerate type. As a special case, we prove the same conclusion for replicable
functions of finite order, which were introduced by Conway and Norton in the
context of monstrous moonshine. As an application, we introduce a class of Lie
algebras with group actions, and show that the characters derived from them are
weakly Hecke-monic. When the Lie algebras come from chiral conformal field
theory in a certain sense, then the characters form holomorphic genus-zero
functions invariant under a congruence group.
","[{""version"":""v1"",""created"":""Thu, 18 Dec 2008 05:51:12 GMT""},{""version"":""v2"",""created"":""Sun, 28 Dec 2008 19:44:03 GMT""},{""version"":""v3"",""created"":""Thu, 14 Oct 2010 13:32:22 GMT""}]","2010-10-15"
"0812.3441","Anna Skripka","Ken Dykema, Anna Skripka","Higher order spectral shift","37 pages","J. Funct. Anal., 257 (2009), 1092 - 1132",,,"math.SP math-ph math.MP math.OA","http://arxiv.org/licenses/nonexclusive-distrib/1.0/","  We construct higher order spectral shift functions, extending the
perturbation theory results of M. G. Krein and L. S. Koplienko on
representations for the remainders of the first and second order Taylor-type
approximations of operator functions. The higher order spectral shift functions
represent the remainders of higher order Taylor-type approximations; they can
be expressed recursively via the lower order (in particular, Krein's and
Koplienko's) ones. We also obtain higher order spectral averaging formulas
generalizing the Birman-Solomyak spectral averaging formula. The results are
obtained in the semi-finite von Neumann algebra setting, with the perturbation
taken in the Hilbert-Schmidt class of the algebra.
","[{""version"":""v1"",""created"":""Thu, 18 Dec 2008 00:56:10 GMT""},{""version"":""v2"",""created"":""Wed, 1 Jul 2009 22:23:56 GMT""}]","2009-07-02"
"0812.3443","Roozbeh Hazrat","R. Hazrat","SK1 of Azumaya algebras over hensel pairs","7 pages",,,,"math.RA","http://arxiv.org/licenses/nonexclusive-distrib/1.0/","  Let A be an Azumaya algebra of constant rank n^2 over a Hensel pair (R,I)
where R is a semilocal ring with n invertible in R. Then the reduced Whitehead
group SK(A) coincides with its reduction SK(A/IA).
","[{""version"":""v1"",""created"":""Thu, 18 Dec 2008 01:51:28 GMT""}]","2008-12-19"
"0812.3444","Ya-Wen  Tang","Ya-Wen Tang, Paul T. P. Ho, Josep Miquel Girart, Ramprasad Rao,
  Patrick Koch, Shih-Ping Lai","Evolution of Magnetic Fields in High Mass Star Formation: SMA dust
  polarization image of the UCHII region G5.89-0.39","35 pages, 8 figures. Accepted by ApJ","Astrophys.J.695:1399-1412,2009","10.1088/0004-637X/695/2/1399",,"astro-ph","http://arxiv.org/licenses/nonexclusive-distrib/1.0/","  We report high angular resolution (3"") Submillimeter Array (SMA) observations
of the molecular cloud associated with the Ultra-Compact HII region G5.89-0.39.
Imaged dust continuum emission at 870 micron reveals significant linear
polarization. The position angles (PAs) of the polarization vary enormously but
smoothly in a region of 2x10^4 AU. Based on the distribution of the PAs and the
associated structures, the polarized emission can be separated roughly into two
components. The component ""x"" is associated with a well defined dust ridge at
870 micron, and is likely tracing a compressed B field. The component ""o"" is
located at the periphery of the dust ridge and is probably from the original B
field associated with a pre-existing extended structure. The global B field
morphology in G5.89, as inferred from the PAs, is clearly disturbed by the
expansion of the HII region and the molecular outflows. Using the
Chandrasekhar-Fermi method, we estimate from the smoothness of the field
structures that the B field strength in the plane of sky can be no more than
2-3 mG. We then compare the energy densities in the radiation, the B field, and
the mechanical motions as deduced from the C^17O 3-2 line emission. We conclude
that the B field structures are already overwhelmed and dominated by the
radiation, outflows, and turbulence from the newly formed massive stars.
","[{""version"":""v1"",""created"":""Thu, 18 Dec 2008 02:04:19 GMT""}]","2011-02-11"
"0812.3445","Mitsuhiro Arikawa","Mitsuhiro Arikawa, Shou Tanaya, Isao Maruyama, Yasuhiro Hatsugai","Edge states of Spin-1/2 Two-Leg Ladder with Four-Spin Ring Exchange","6 pages, 10 figures","Phys. Rev. B 79, 205107 (2009)","10.1103/PhysRevB.79.205107",,"cond-mat.str-el","http://arxiv.org/licenses/nonexclusive-distrib/1.0/","  A topological insulator and its spin analogue as a gapped spin liquid have
characteristic low energy excitations (edge states) within the gap when the
systems have boundaries. This is the bulk-edge correspondence, which implies
that the edge states themselves characterize the gapped bulk spin liquid. Based
on the general principle, we analyzed the vector chirality phase of the
spin-1/2 ladder with ring exchange by using the edge states and the
entanglement entropy.
","[{""version"":""v1"",""created"":""Thu, 18 Dec 2008 02:21:35 GMT""},{""version"":""v2"",""created"":""Fri, 19 Dec 2008 08:23:57 GMT""},{""version"":""v3"",""created"":""Tue, 12 May 2009 06:26:51 GMT""}]","2009-05-12"
"0812.3446","Eduardo de la Fuente Acosta Ph. D.","E. de la Fuente, A. Porras, J. M. C. Grave, M. S. N. Kumar, M. A.
  Trinidad, S. Kurtz, S. Kemp, J. Franco, G. Quevedo","Spitzer--IRAC Imagery and Photometry of Ultracompact HII Regions With
  Extended Emission","9 pages, 5 Figures, To be published in ""A Long Walk Through
  Astronomy: A Celebration of Luis Carrasco's 60th Birthday"", proceedings, Rev,
  Mex. AA SC. Work based in de la Fuente Ph. D. Thesis, 2007, University of
  Guadalajara, M\'exico",,,,"astro-ph","http://arxiv.org/licenses/nonexclusive-distrib/1.0/","  We present the results of a morphological study performed to a sample of
Ultracompact (UC) HII regions with Extended Emission (EE) using Spitzer--IRAC
imagery and 3.6 cm VLA conf. D radio-continuum (RC) maps. Some examples of the
comparison between maps and images are presented. Usually there is an IR point
source counterpart to the peak(s) of RC emission, at the position of the UC
source. We find that the predominant EE morphology is the cometary, and in most
cases is coincident with IR emission at 8.0 $\mu$m. Preliminary results of
Spitzer--IRAC photometry of a sub-sample of 13 UC HII regions with EE based on
GLIMPSE legacy data are also presented. Besides, individual IRAC photometry was
performed to 19 UC sources within these 13 regions. We show that UC sources lie
on specific locus, both in IRAC color-color and AM-product diagnostic diagrams.
Counts of young stellar sources are presented for each region, and we conclude
that a proportion of ~ 2%, ~10%, and ~88% of sources in the UC HII regions with
EE are, in average, Class I, II, and III, respectively.
","[{""version"":""v1"",""created"":""Thu, 18 Dec 2008 02:17:05 GMT""}]","2008-12-19"
"0812.3447","Chris Ng","Chris T. K. Ng, Muriel Medard, Asuman Ozdaglar","Completion Time Minimization and Robust Power Control in Wireless Packet
  Networks","16 pages, 7 figures",,,,"cs.IT math.IT","http://arxiv.org/licenses/nonexclusive-distrib/1.0/","  A wireless packet network is considered in which each user transmits a stream
of packets to its destination. The transmit power of each user interferes with
the transmission of all other users. A convex cost function of the completion
times of the user packets is minimized by optimally allocating the users'
transmission power subject to their respective power constraints. At all ranges
of SINR, completion time minimization can be formulated as a convex
optimization problem and hence can be efficiently solved. In particular,
although the feasible rate region of the wireless network is non-convex, its
corresponding completion time region is shown to be convex. When channel
knowledge is imperfect, robust power control is considered based on the channel
fading distribution subject to outage probability constraints. The problem is
shown to be convex when the fading distribution is log-concave in exponentiated
channel power gains; e.g., when each user is under independent Rayleigh,
Nakagami, or log-normal fading. Applying the optimization frameworks in a
wireless cellular network, the average completion time is significantly reduced
as compared to full power transmission.
","[{""version"":""v1"",""created"":""Thu, 18 Dec 2008 02:30:56 GMT""},{""version"":""v2"",""created"":""Tue, 5 Apr 2011 05:38:49 GMT""}]","2011-04-06"
"0812.3448","Andrew Norris","W{\l}odzimierz Doma\'nski and Andrew N. Norris","Degenerate weakly nonlinear elastic plane waves","18 pages, no figures","Int. J. Non-Linear Mech. 44, 486-493, 2009.","10.1016/j.ijnonlinmec.2008.12.009",,"math-ph math.MP","http://arxiv.org/licenses/nonexclusive-distrib/1.0/","  Weakly nonlinear plane waves are considered in hyperelastic crystals.
Evolution equations are derived at a quadratically nonlinear level for the
amplitudes of quasi-longitudinal and quasi-transverse waves propagating in
arbitrary anisotropic media. The form of the equations obtained depends upon
the direction of propagation relative to the crystal axes. A single equation is
found for all propagation directions for quasi-longitudinal waves, but a pair
of coupled equations occurs for quasi-transverse waves propagating along
directions of degeneracy, or acoustic axes. The coupled equations involve four
material parameters but they simplify if the wave propagates along an axis of
material symmetry. Thus, only two parameters arise for propagation along an
axis of two-fold symmetry, and one for a three-fold axis. The transverse wave
equations decouple if the axis is four-fold or higher. In the absence of a
symmetry axis it is possible that the evolution equations of the
quasi-transverse waves decouple if the third order elastic moduli satisfy a
certain identity. The theoretical results are illustrated with explicit
examples.
","[{""version"":""v1"",""created"":""Thu, 18 Dec 2008 02:45:33 GMT""}]","2009-04-30"
"0812.3449","Ari Hietanen","Richard Galvez, Ari Hietanen and Rajamani Narayanan","Large N QCD in two dimensions with a baryonic chemical potential","12 pages, 4 figures; Published version, typos corrected","Phys.Lett.B672:376-381,2009","10.1016/j.physletb.2009.01.043",,"hep-lat hep-th","http://arxiv.org/licenses/nonexclusive-distrib/1.0/","  We consider large N gauge theory on a two dimensional lattice in the presence
of a baryonic chemical potential. We work with one copy of naive fermion and
argue that reduction holds even in the presence of a chemical potential.
Analytical arguments supported by numerical studies show that there is no phase
transition as a function of the baryonic chemical potential.
","[{""version"":""v1"",""created"":""Thu, 18 Dec 2008 02:47:16 GMT""},{""version"":""v2"",""created"":""Wed, 21 Jan 2009 00:40:16 GMT""}]","2009-11-18"
"0812.3450","Michael Hilke","M. Hilke","Seeing Anderson Localization","5 pages, 4 figures",,"10.1103/PhysRevA.80.063820",,"cond-mat.dis-nn cond-mat.mtrl-sci","http://arxiv.org/licenses/nonexclusive-distrib/1.0/","  Anderson localization was discovered 50 years ago to describe the propagation
of electrons in the presence of disorder. The main prediction back then, was
the existence of disorder induced localized states, which do not conduct
electricity. Many years later it turns out, that the concept of Anderson
localization is much more general and applies to almost any type of propagation
in time or space, when more than one parameter is relevant (like phase and
amplitude). Here we propose a new optical scheme to literally see Anderson
localization by varying the optical wavelength or angle of incidence to tune
between localized and delocalized states. The occurrence of Anderson
localization in the propagation of light, in particular, has become the focus
of tremendous interest due to the emergence of new optical technologies and
media, such as low dimensional and disordered optical lattices. While several
experiments have reported the measurement of Anderson localization of light,
many of the observations remain controversial because the effects of absorption
and localization have a similar signature, i.e., exponential decrease of the
transmission with the system size. In this work, we discuss a system, where we
can clearly differentiate between absorption and localization effects because
this system is equivalent to a perfect filter, only in the absence of any
absorption. Indeed, only one wavelength is perfectly transmitted and all others
are fully localized. These results were obtained by developing a new
theoretical framework for the average optical transmission through disordered
media.
","[{""version"":""v1"",""created"":""Thu, 18 Dec 2008 02:51:52 GMT""}]","2015-05-13"
"0812.3451","Hiroyuki Hirashita","Hiroyuki Hirashita (1), Huirong Yan (2) ((1) ASIAA, (2) University of
  Arizona)","Shattering and coagulation of dust grains in interstellar turbulence","15 pages, 10 figures, accepted for publication in MNRAS",,"10.1111/j.1365-2966.2009.14405.x",,"astro-ph","http://arxiv.org/licenses/nonexclusive-distrib/1.0/","  We investigate shattering and coagulation of dust grains in turbulent
interstellar medium (ISM). The typical velocity of dust grain as a function of
grain size has been calculated for various ISM phases based on a theory of
grain dynamics in compressible magnetohydrodynamic turbulence. In this paper,
we develop a scheme of grain shattering and coagulation and apply it to
turbulent ISM by using the grain velocities predicted by the above turbulence
theory. Since large grains tend to acquire large velocity dispersions as shown
by earlier studies, large grains tend to be shattered. Large shattering effects
are indeed seen in warm ionized medium (WIM) within a few Myr for grains with
radius $a\ga 10^{-6}$ cm. We also show that shattering in warm neutral medium
(WNM) can limit the largest grain size in ISM ($a\sim 2\times 10^{-5}
\mathrm{cm}$). On the other hand, coagulation tends to modify small grains
since it only occurs when the grain velocity is small enough. Coagulation
significantly modifies the grain size distribution in dense clouds (DC), where
a large fraction of the grains with $a<10^{-6}$ cm coagulate in 10 Myr. In
fact, the correlation among $R_V$, the carbon bump strength, and the
ultraviolet slope in the observed Milky Way extinction curves can be explained
by the coagulation in DC. It is possible that the grain size distribution in
the Milky Way is determined by a combination of all the above effects of
shattering and coagulation. Considering that shattering and coagulation in
turbulence are effective if dust-to-gas ratio is typically more than $\sim
1/10$ of the Galactic value, the regulation mechanism of grain size
distribution should be different between metal-poor and metal-rich
environments.
","[{""version"":""v1"",""created"":""Thu, 18 Dec 2008 02:53:18 GMT""}]","2009-11-13"
"0812.3452","Xinping Xu","Xinping Xu","Coherent exciton transport and trapping on long-range interacting cycles","8 pages, 7 figures. Submitted to Phys. Rev. E","Phys. Rev. E 79, 011117 (2009)","10.1103/PhysRevE.79.011117",,"quant-ph","http://arxiv.org/licenses/nonexclusive-distrib/1.0/","  We consider coherent exciton transport modeled by continuous-time quantum
walks (CTQWs) on long-range interacting cycles (LRICs), which are constructed
by connecting all the two nodes of distance $m$ in the cycle graph. LRIC has a
symmetric structure and can be regarded as the extensions of the cycle graph
(nearest-neighboring lattice). For small values of $m$, the classical and
quantum return probabilities show power law behavior $p(t)\sim t^{-0.5}$ and
$\pi(t)\sim t^{-1}$, respectively. However, for large values of $m$, the
classical and quantum efficiency scales as $p(t)\sim t^{-1}$ and $\pi(t)\sim
t^{-2}$. We give a theoretical explanation of this transition using the method
of stationary phase approximation (SPA). In the long time limit, depending on
the network size $N$ and parameter $m$, the limiting probability distributions
of quantum transport show various patterns. When the network size $N$ is an
even number, we find an asymmetric transition probability of quantum transport
between the initial node and its opposite node. This asymmetry depends on the
precise values of $N$ and $m$. Finally, we study the transport processes in the
presence of traps and find that the survival probability decays faster on
networks of large $m$.
","[{""version"":""v1"",""created"":""Thu, 18 Dec 2008 03:17:49 GMT""}]","2009-11-13"
"0812.3453","M.J. Luo","M.J.Luo and Q.Y.Liu","Small Neutrino Masses From Structural cancellation In Left-Right
  Symmetric Model","RevTeX 10 pages, no figures","JHEP 0812:061,2008","10.1088/1126-6708/2008/12/061",,"hep-ph","http://arxiv.org/licenses/nonexclusive-distrib/1.0/","  The Type I, II and hybrid (I+II) seesaw mechanism, which explain why
neutrinos are especially light, are consequences of the left-right symmetric
model (LRSM). They can be classified by the ranges of parameters of LRSM. We
show that a nearly cancellation in general Type-(I+II) seesaw is more natural
than other types of seesaw in the LRSM if we consider their stability against
radiative correction. In this scenario the small neutrino masses are due to the
structure cancellation, and the masses of the right handed neutrino can be of
order of O(10)TeV. The realistic model for non-zero neutrino masses, charged
lepton masses and lepton tribimaximal mixing can be implemented by embedding
$A_4$ flavor symmetry in the model with perturbations to the textures.
","[{""version"":""v1"",""created"":""Thu, 18 Dec 2008 03:39:54 GMT""}]","2009-03-04"
