"0812.3375","Dinh-V.-Trung","Dinh-V-Trung and Jeremy Lim","The shaping effect of collimated fast outflows in the Egg nebula","22 pages, 6 figures, submitted to the Astrophysical Journal","Astrophys.J.698:439-444,2009","10.1088/0004-637X/698/1/439",,"astro-ph","http://arxiv.org/licenses/nonexclusive-distrib/1.0/","  We present high angular resolution observations of the HC$_3$N J=5--4 line
from the Egg nebula, which is the archetype of protoplanetary nebulae. We find
that the HC$_{\rm 3}$N emission in the approaching and receding portion of the
envelope traces a clumpy hollow shell, similar to that seen in normal carbon
rich envelopes. Near the systemic velocity, the hollow shell is fragmented into
several large blobs or arcs with missing portions correspond spatially to
locations of previously reported high--velocity outlows in the Egg nebula. This
provides direct evidence for the disruption of the slowly--expanding envelope
ejected during the AGB phase by the collimated fast outflows initiated during
the transition to the protoplanetary nebula phase. We also find that the
intersection of fast molecular outflows previously suggested as the location of
the central post-AGB star is significantly offset from the center of the hollow
shell. From modelling the HC$_3$N distribution we could reproduce qualitatively
the spatial kinematics of the HC$_3$N J=5--4 emission using a HC$_3$N shell
with two pairs of cavities cleared by the collimated high velocity outflows
along the polar direction and in the equatorial plane. We infer a relatively
high abundance of HC$_3$N/H$_2$ $\sim$3x10$^{-6}$ for an estimated mass--loss
rate of 3x10$^{-5}$ M$_\odot$ yr$^{-1}$ in the HC$_3$N shell. The high
abundance of HC$_3$N and the presence of some weaker J=5--4 emission in the
vicinity of the central post-AGB star suggest an unusually efficient formation
of this molecule in the Egg nebula.
","[{""version"":""v1"",""created"":""Wed, 17 Dec 2008 19:13:01 GMT""}]","2011-02-11"
"0812.3376","Bernd Kniehl","B.A. Kniehl, A.V. Shipilova, V.A. Saleev","Open charm production at high energies and the quark Reggeization
  hypothesis","14 pages, 3 figures","Phys.Rev.D79:034007,2009","10.1103/PhysRevD.79.034007","DESY 08-194","hep-ph","http://arxiv.org/licenses/nonexclusive-distrib/1.0/","  We study open charm production at high energies in the framework of the
quasi-multi-Regge-kinematics approach applying the quark-Reggeization
hypothesis implemented with Reggeon-Reggeon-particle and
Reggeon-particle-particle effective vertices. Adopting the Kimber-Martin-Ryskin
unintegrated quark and gluon distribution functions of the proton and photon,
we thus nicely describe the proton structure function F_{2,c} measured at DESY
HERA as well as the transverse-momentum distributions of D mesons created by
photoproduction at HERA and by hadroproduction at the Fermilab Tevatron.
","[{""version"":""v1"",""created"":""Wed, 17 Dec 2008 19:36:55 GMT""}]","2009-11-13"
"0812.3377","Steffen Stern","Steffen Stern","Dynamical dark energy and variation of fundamental ""constants""","PhD thesis (University of Heidelberg, November 2008), 131 pages",,,,"hep-ph astro-ph gr-qc nucl-th","http://arxiv.org/licenses/nonexclusive-distrib/1.0/","  In this thesis we study the influence of a possible variation of fundamental
""constants"" on the process of Big Bang Nucleosynthesis (BBN). Our findings are
combined with further studies on variations of constants in other physical
processes to constrain models of grand unification (GUT) and quintessence. We
will find that the 7Li problem of BBN can be ameliorated if one allows for
varying constants, where especially varying light quark masses show a strong
influence. Furthermore, we show that recent studies of varying constants are in
contradiction with each other and BBN in the framework of six exemplary GUT
scenarios, if one assumes monotonic variation with time. We conclude that there
is strong tension between recent claims of varying constants, hence either some
claims have to be revised, or there are much more sophisticated GUT relations
(and/or non-monotonic variations) realized in nature. The methods introduced in
this thesis prove to be powerful tools to probe regimes well beyond the
Standard Model of particle physics or the concordance model of cosmology, which
are currently inaccessible by experiments. Once the first irrefutable proofs of
varying constants are available, our method will allow for probing the
consistency of models beyond the standard theories like GUT or quintessence and
also the compatibility between these models.
","[{""version"":""v1"",""created"":""Wed, 17 Dec 2008 19:38:57 GMT""}]","2008-12-18"
"0812.3378","Uwe Krey","U. Krey (Inst. fuer Physik II der Universitaet Regensburg)","On the Financial Crisis 2008 from a Physicist's viewpoint: A Spin-Glass
  Interpretation","Internal report, not to be published, four pages. Updated version
  (AT-line!) as of 14 Jan., 2009",,,,"cond-mat.dis-nn q-fin.GN","http://arxiv.org/licenses/nonexclusive-distrib/1.0/","  In an informal way, a number of thoughts on the financial crisis 2008 are
presented from a physicist's viewpoint, considering the problem as a
nonergodicity transition of a spin-glass type of system. Some tentative
suggestions concerning the way out of the crisis are also discussed, concerning
Keynesian ""deficit spending"" methods, tax reductions, and finally the method
""ruin and recreate"" known from optimization theory. Also the de
Almeida-Thouless instability line of spin-glass theory is given a financial
interpretation.
","[{""version"":""v1"",""created"":""Wed, 17 Dec 2008 20:11:56 GMT""},{""version"":""v2"",""created"":""Thu, 18 Dec 2008 09:05:02 GMT""},{""version"":""v3"",""created"":""Wed, 14 Jan 2009 13:47:04 GMT""}]","2009-01-14"
"0812.3379","Sophia Vassiliadou","Nils Ovrelid and Sophia Vassiliadou","Hartogs' extension theorems on Stein spaces","References added; improved proofs in section 5; section 6 in the
  previous version moved to preprint arxiv:0903.3922",,,,"math.CV","http://arxiv.org/licenses/nonexclusive-distrib/1.0/","  We discuss various known generalizations of the classical Hartogs' extension
theorem on Stein spaces with arbitrary singularities and present an analytic
proof based on d-bar methods.
","[{""version"":""v1"",""created"":""Wed, 17 Dec 2008 19:49:49 GMT""},{""version"":""v2"",""created"":""Tue, 24 Mar 2009 14:46:17 GMT""}]","2009-03-24"
"0812.3380","Romain Dubessy","Romain Dubessy (MPQ), Thomas Coudreau (MPQ), Luca Guidoni (MPQ)","Electric field noise above surfaces: a model for heating rate scaling
  law in ion traps",,"Physical Review A: Atomic, Molecular and Optical Physics 80, 3
  (2009) 031402","10.1103/PhysRevA.80.031402",,"quant-ph","http://arxiv.org/licenses/nonexclusive-distrib/1.0/","  We present a model for the scaling laws of the electric field noise spectral
density as a function of the distance, $d$, above a conducting surface. Our
analytical approach models the patch potentials by introducing a correlation
length, $\zeta$, of the electric potential on the surface. The predicted
scaling laws are in excellent agreement with two different classes of
experiments (cold trapped ions and cantilevers), that span at least four orders
of magnitude of $d$. According to this model, heating rate in miniature ion
traps could be greatly reduced by proper material engineering.
","[{""version"":""v1"",""created"":""Wed, 17 Dec 2008 20:00:11 GMT""}]","2010-04-05"
"0812.3381","Noufel Frikha","Olivier Aj Bardou (PMA, GDF-RDD), Noufel Frikha (PMA, GDF-RDD), G.
  Pag\`es (PMA)","Computation of VaR and CVaR using stochastic approximations and
  unconstrained importance sampling",,,,,"q-fin.CP math.PR q-fin.RM","http://arxiv.org/licenses/nonexclusive-distrib/1.0/","  Value-at-Risk (VaR) and Conditional Value-at-Risk (CVaR) are two risk
measures which are widely used in the practice of risk management. This paper
deals with the problem of computing both VaR and CVaR using stochastic
approximation (with decreasing steps): we propose a first Robbins-Monro
procedure based on Rockaffelar-Uryasev's identity for the CVaR. The convergence
rate of this algorithm to its target satisfies a Gaussian Central Limit
Theorem. As a second step, in order to speed up the initial procedure, we
propose a recursive importance sampling (I.S.) procedure which induces a
significant variance reduction of both VaR and CVaR procedures. This idea,
which goes back to the seminal paper of B. Arouna, follows a new approach
introduced by V. Lemaire and G. Pag\`es. Finally, we consider a deterministic
moving risk level to speed up the initialization phase of the algorithm. We
prove that the convergence rate of the resulting procedure is ruled by a
Central Limit Theorem with minimal variance and its efficiency is illustrated
by considering several typical energy portfolios.
","[{""version"":""v1"",""created"":""Wed, 17 Dec 2008 20:02:40 GMT""},{""version"":""v2"",""created"":""Fri, 23 Jan 2009 16:22:07 GMT""},{""version"":""v3"",""created"":""Fri, 27 Feb 2009 15:14:44 GMT""},{""version"":""v4"",""created"":""Sat, 7 Nov 2009 05:54:26 GMT""},{""version"":""v5"",""created"":""Fri, 3 Dec 2010 11:26:07 GMT""}]","2010-12-06"
"0812.3382","R\'egis Blache F.","R\'egis Blache","p-Density, exponential sums and Artin-Schreier curves","12 pages","J. Number Theory 132, pp 2336-2352, 2012",,,"math.NT math.AG","http://arxiv.org/licenses/nonexclusive-distrib/1.0/","  In this paper we define the $p$-density of a finite subset
$D\subset\ma{N}^r$, and show that it gives a good lower bound for the $p$-adic
valuation of exponential sums over finite fields of characteristic $p$. We also
give an application: when $r=1$, the $p$-density is the first slope of the
generic Newton polygon of the family of Artin-Schreier curves associated to
polynomials with their exponents in $D$.
","[{""version"":""v1"",""created"":""Wed, 17 Dec 2008 20:04:45 GMT""}]","2012-10-16"
"0812.3383","Thierry Guillet","Fran\c{c}ois M\'edard (LASMEA), Jes\'us Z\'u\~niga-P\'erez (CRHEA),
  Pierre Disseix (LASMEA), Martine Mihailovic (LASMEA), Joel Leymarie (LASMEA),
  A. Vasson (LASMEA), Fabrice Semond (CRHEA), Eric Frayssinet (CRHEA),
  Jean-Christophe Moreno (CRHEA), Mathieu Leroux (CRHEA), St\'ephane Faure
  (GES), Thierry Guillet (GES)","Experimental observation of strong light-matter coupling in ZnO
  microcavities: influence of large excitonic absorption",,,"10.1103/PhysRevB.79.125302",,"cond-mat.other","http://arxiv.org/licenses/nonexclusive-distrib/1.0/","  We present experimental observation of the strong light-matter coupling
regime in ZnO bulk microcavities grown on silicon. Angle resolved reflectivity
measurements, corroborated by transfer-matrix simulations, show that Rabi
splittings in the order of 70 meV are achieved even for low finesse cavities.
The impact of the large excitonic absorption, which enables a ZnO bulk-like
behavior to be observed even in the strong coupling regime, is illustrated both
experimentally and theoretically by considering cavities with increasing
thickness.
","[{""version"":""v1"",""created"":""Wed, 17 Dec 2008 20:05:32 GMT""}]","2009-11-13"
"0812.3384","Miguel Navascues","Miguel Navascu\'es (BIO), Zafeiro Vaxevanidou, Santiago C
  Gonz\'alez-Mart\'inez, Jos\'e Climent, Luis Gil, Brent C Emerson (BIO)","Chloroplast microsatellites reveal colonization and metapopulation
  dynamics in the Canary Island pine",,"Molecular Ecology 15, 10 (2006) 2691-8","10.1111/j.1365-294X.2006.02960.x",,"q-bio.PE","http://arxiv.org/licenses/nonexclusive-distrib/1.0/","  Chloroplast microsatellites are becoming increasingly popular markers for
population genetic studies in plants, but there has been little focus on their
potential for demographic inference. In this work the utility of chloroplast
microsatellites for the study of population expansions was explored. First, we
investigated the power of mismatch distribution analysis and the F(S) test with
coalescent simulations of different demographic scenarios. We then applied
these methods to empirical data obtained for the Canary Island pine (Pinus
canariensis). The results of the simulations showed that chloroplast
microsatellites are sensitive to sudden population growth. The power of the
F(S) test and accuracy of demographic parameter estimates, such as the time of
expansion, were reduced proportionally to the level of homoplasy within the
data. The analysis of Canary Island pine chloroplast microsatellite data
indicated population expansions for almost all sample localities. Demographic
expansions at the island level can be explained by the colonization of the
archipelago by the pine, while population expansions of different ages in
different localities within an island could be the result of local extinctions
and recolonization dynamics. Comparable mitochondrial DNA sequence data from a
parasite of P. canariensis, the weevil Brachyderes rugatus, supports this
scenario, suggesting a key role for volcanism in the evolution of pine forest
communities in the Canary Islands.
","[{""version"":""v1"",""created"":""Wed, 17 Dec 2008 20:07:54 GMT""}]","2008-12-18"
"0812.3385","Orlando Merino","Sukanya Basu and Orlando Merino","Global Behavior of Solutions to Two Classes of Second Order Rational
  Difference Equations","23 pages",,,,"math.DS","http://arxiv.org/licenses/nonexclusive-distrib/1.0/","  For nonnegative real numbers $\alpha$, $\beta$, $\gamma$, $A$, $B$ and $C$
such that $B+C>0$ and $\alpha+\beta+\gamma >0$, the difference equation
  \begin{equation*} x_{n+1}=\displaystyle\frac{\alpha +\beta x_{n}+\gamma
x_{n-1}}{A+B x_{n}+C x_{n-1}}, \quad n=0,1,2,... %, \quad x_{-1},x_{0}\in
[0,\infty) \end{equation*} has a unique positive equilibrium. A proof is given
here for the following statements: \medskip
  \noindent Theorem 1. {\it For every choice of positive parameters $\alpha$,
$\beta$, $\gamma$, $A$, $B$ and $C$, all solutions to the difference equation
  \begin{equation*} x_{n+1}=\displaystyle\frac{\alpha +\beta x_{n}+\gamma
x_{n-1}}{A+B x_{n}+C x_{n-1}}, \quad n=0,1,2,..., \quad x_{-1},x_{0}\in
[0,\infty) \end{equation*} converge to the positive equilibrium or to a prime
period-two solution.} \medskip
  \noindent Theorem 2. {\it For every choice of positive parameters $\alpha$,
$\beta$, $\gamma$, $A$, $B$ and $C$, all solutions to the difference equation
\begin{equation*} x_{n+1}= \displaystyle\frac{\alpha +\beta x_{n}+\gamma
x_{n-1}}{B x_{n}+C x_{n-1}}, \quad n=0,1,2,..., \quad x_{-1},x_{0}\in
(0,\infty) \end{equation*} converge to the positive equilibrium or to a prime
period-two solution.}
","[{""version"":""v1"",""created"":""Wed, 17 Dec 2008 20:09:08 GMT""}]","2008-12-18"
"0812.3386","Aviv Ofir","Aviv Ofir","Two pairs of interacting EBs towards the LMC in the OGLE database","2 pages, 1 figure. IBVS accepted (IBVS no. 5868)",,,,"astro-ph","http://arxiv.org/licenses/nonexclusive-distrib/1.0/","  A single point source on the OGLE LMC database shows the characteristics of
two superimposed eclipsing binaries (EBs). The two EBs happen to have periods
very close to the 3:2 resonance. The telescope's small PSF and the apparent
resonance between the two EBs raises the suspicion that this is not chance
alignment but rather a compact hierarchical system of two pairs of interacting
EBs in 3:2 resonance.
","[{""version"":""v1"",""created"":""Wed, 17 Dec 2008 20:30:32 GMT""}]","2008-12-18"
"0812.3387","Nigel Cooper","N.R. Cooper and Ady Stern","Observable Bulk Signatures of Non-Abelian Quantum Hall States","Minor changes","Phys. Rev. Lett. 102, 176807 (2009)","10.1103/PhysRevLett.102.176807",,"cond-mat.mes-hall cond-mat.str-el","http://arxiv.org/licenses/nonexclusive-distrib/1.0/","  We show that non-abelian quantum Hall states can be identified by
experimental measurements of the temperature-dependence of either the
electrochemical potential or the orbital magnetization. The predicted signals
of non-abelian statistics are within experimental resolution, and can be
clearly distinguished from other contributions under realistic circumstances.
The proposed measurement technique also has the potential to resolve
spin-ordering transitions in low density electronic systems in the Wigner
crystal and strongly-interacting Luttinger liquid regimes.
","[{""version"":""v1"",""created"":""Wed, 17 Dec 2008 20:34:10 GMT""},{""version"":""v2"",""created"":""Sun, 21 Dec 2008 09:17:34 GMT""},{""version"":""v3"",""created"":""Tue, 19 May 2009 15:35:52 GMT""}]","2009-05-19"
"0812.3388","Jean-Luc Lehners","Jean-Luc Lehners and Paul J. Steinhardt","Dark Energy and the Return of the Phoenix Universe","5 pages, 3 figures","Phys.Rev.D79:063503,2009","10.1103/PhysRevD.79.063503",,"hep-th astro-ph gr-qc","http://arxiv.org/licenses/nonexclusive-distrib/1.0/","  In cyclic universe models based on a single scalar field (e.g., the radion
determining the distance between branes in M-theory), virtually the entire
universe makes it through the ekpyrotic smoothing and flattening phase,
bounces, and enters a new epoch of expansion and cooling. This stable evolution
cannot occur, however, if scale-invariant curvature perturbations are produced
by the entropic mechanism because it requires two scalar fields (e.g., the
radion and the Calabi-Yau dilaton) evolving along an unstable classical
trajectory. In fact, we show here that an overwhelming fraction of the universe
fails to make it through the ekpyrotic phase; nevertheless, a sufficient volume
survives and cycling continues forever provided the dark energy phase of the
cycle lasts long enough, of order a trillion years. Two consequences are a new
role for dark energy and a global structure of the universe radically different
from that of eternal inflation.
","[{""version"":""v1"",""created"":""Wed, 17 Dec 2008 20:56:24 GMT""}]","2009-11-13"
"0812.3389","Philippe Rukimbira","Hamidou Dathe and Philippe Rukimbira","Contact deformations of closed 1-forms on Torus bundles over the circle","8 pages",,,,"math.DG","http://arxiv.org/licenses/nonexclusive-distrib/1.0/","  If a closed 3-manifold M supports a closed, nonsingular, irrational 1-form
which linearly deforms into contact forms, then M supports a K-contact form. On
the 3-torus, a closed nonsingular 1-form deforms linearly into contact forms if
and only if it is a fibration 1-form. on any other 2-torus bundle over the
circle, every closed, nonsingular 1-form deforms linearly into contact forms.
","[{""version"":""v1"",""created"":""Wed, 17 Dec 2008 20:41:05 GMT""}]","2008-12-18"
"0812.3390","Adam Hopkins","Adam B. Hopkins, Frank H. Stillinger, Salvatore Torquato","Dense sphere packings from optimized correlation functions","26 pages, 9 figures, 1 table; added references, fixed typos,
  simplified argument and discussion in Section IV B",,"10.1103/PhysRevE.79.031123",,"cond-mat.stat-mech cond-mat.soft","http://arxiv.org/licenses/nonexclusive-distrib/1.0/","  Elementary smooth functions (beyond contact) are employed to construct pair
correlation functions that mimic jammed disordered sphere packings. Using the
g2-invariant optimization method of Torquato and Stillinger [J. Phys. Chem. B
106, 8354, 2002], parameters in these functions are optimized under necessary
realizability conditions to maximize the packing fraction phi and average
number of contacts per sphere Z. A pair correlation function that incorporates
the salient features of a disordered packing and that is smooth beyond contact
is shown to permit a phi of 0.6850: this value represents a 45% reduction in
the difference between the maximum for congruent hard spheres in three
dimensions, pi/sqrt{18} ~ 0.7405, and 0.64, the approximate fraction associated
with maximally random jammed (MRJ) packings in three dimensions. We show that,
surprisingly, the continued addition of elementary functions consisting of
smooth sinusoids decaying as r^{-4} permits packing fractions approaching
pi/sqrt{18}. A translational order metric is used to discriminate between
degrees of order in the packings presented. We find that to achieve higher
packing fractions, the degree of order must increase, which is consistent with
the results of a previous study [Torquato et al., Phys. Rev. Lett. 84, 2064,
2000].
","[{""version"":""v1"",""created"":""Wed, 17 Dec 2008 20:42:29 GMT""},{""version"":""v2"",""created"":""Sun, 18 Jan 2009 23:05:57 GMT""}]","2009-11-13"
"0812.3391","Dan Israel","Luca Carlevaro, Dan Israel, Marios Petropoulos","Double-Scaling Limit of Heterotic Bundles and Dynamical Deformation in
  CFT","45 pages, no figures; ver2: typos corrected, references added, an
  extra tadpole-free model covered","Nucl.Phys.B827:503-544,2010","10.1016/j.nuclphysb.2009.10.027",,"hep-th","http://arxiv.org/licenses/nonexclusive-distrib/1.0/","  We consider heterotic string theory on Eguchi-Hanson space, as a local model
of a resolved A_1 singularity in a six-dimensional flux compactification, with
an Abelian gauge bundle turned on and non-zero torsion. We show that in a
suitable double scaling limit, that isolates the physics near the non-vanishing
two-cycle, a worldsheet conformal field theory description can be found. It
contains a heterotic coset whose target space is conformal to Eguchi-Hanson.
Starting from the blow-down limit of the singularity, it can be viewed as a
dynamical deformation of the near-horizon fivebrane background. We analyze in
detail the spectrum of the theory in particular examples, as well as the
important role of worldsheet non-perturbative effects.
","[{""version"":""v1"",""created"":""Wed, 17 Dec 2008 20:47:44 GMT""},{""version"":""v2"",""created"":""Sat, 24 Oct 2009 19:28:00 GMT""}]","2009-12-15"
"0812.3392","Roland Kothes","Roland Kothes Jo-Anne Brown","Probing ISM Magnetic Fields With SNRs","6 pages, IAU 259 Conference Proceedings, in press",,"10.1017/S1743921309030087",,"astro-ph","http://arxiv.org/licenses/nonexclusive-distrib/1.0/","  As supernova remnants expand, their shock waves are freezing in and
compressing the magnetic field lines they encounter; consequently we can use
supernova remnants as magnifying glasses for their ambient magnetic fields. We
will describe a simple model to determine emission, polarization, and rotation
measure characteristics of adiabatically expanding supernova remnants and how
we can exploit this model to gain information about the large scale magnetic
field in our Galaxy. We will give two examples: The SNR DA530, which is located
high above the Galactic plane, reveals information about the magnetic field in
the halo of our Galaxy. The SNR G182.4+4.3 is located close to the anti-centre
of our Galaxy and reveals the most probable direction where the large-scale
magnetic field is perpendicular to the line of sight. This may help to decide
on the large-scale magnetic field configuration of our Galaxy.
","[{""version"":""v1"",""created"":""Wed, 17 Dec 2008 20:49:54 GMT""}]","2009-11-13"
"0812.3393","Wojciech Broniowski","Wojciech Broniowski, Wojciech Florkowski, Mikolaj Chojnacki, Adam
  Kisiel","Free-streaming approximation in early dynamics of relativistic heavy-ion
  collisions","10 pages, 12 figures","Phys.Rev.C80:034902,2009","10.1103/PhysRevC.80.034902",,"nucl-th hep-ph nucl-ex","http://arxiv.org/licenses/nonexclusive-distrib/1.0/","  We investigate an approximation to early dynamics in relativistic heavy-ion
collisions, where after formation the partons are free streaming and around the
proper time of 1 fm/c undergo a sudden equilibration described in terms of the
Landau matching condition. We discuss physical and formal aspects of this
approach. In particular, we show that initial azimuthally asymmetric transverse
flow develops for non-central collisions as a consequence of the sudden
equilibration. Moreover, the energy-momentum tensor from the free-streaming
stage matches very smoothly to the form used in the transverse hydrodynamics,
whereas matching to isotropic hydrodynamics requires a more pronounced change
in the energy-momentum tensor. After the hydrodynamic phase statistical
hadronization is carried out with the help of THERMINATOR. The physical results
for the transverse-momentum spectra, the elliptic-flow, and the
Hanbury-Brown--Twiss correlation radii, including the ratio R_out/R_side as
well as the dependence of the radii on the azimuthal angle (azHBT), are
properly described within our approach. The agreement is equally good for a
purely hydrodynamic evolution started at an early proper time of 0.25 fm/c, or
for the free streaming started at that time, followed by the sudden
equilibration at tau ~1 fm/c and then by perfect hydrodynamics. Thus, the
inclusion of free streaming allows us to delay the start of hydrodynamics to
more realistic times of the order of 1 fm/c.
","[{""version"":""v1"",""created"":""Wed, 17 Dec 2008 21:22:18 GMT""}]","2009-09-11"
