"0804.0329","Daniel Krefl","Daniel Krefl","Brane Tilings for Orientifolds","6 pages, 4 figures; typos corrected and reference added; contribution
  to the proceedings of the 3rd workshop of the RTN project 'Constituents,
  Fundamental Forces and Symmetries of the Universe', Valencia","Fortsch.Phys.56:869-875,2008","10.1002/prop.200810554","CERN-PH-TH/2008-064, LMU-ASC 20/08","hep-th","http://arxiv.org/licenses/nonexclusive-distrib/1.0/","  We give an elementary introduction to the recent derivation of the effective
low-energy gauge theories of D3-branes probing orientifolds of toric Calabi-Yau
3-fold singularities via brane tiling techniques.
","[{""version"":""v1"",""created"":""Wed, 2 Apr 2008 11:11:32 GMT""},{""version"":""v2"",""created"":""Sun, 6 Apr 2008 10:28:09 GMT""}]","2008-11-26"
"0804.0330","Tetsuya Hattori","Kumiko Hattori, Tetsuya Hattori","Equation of motion for incompressible mixed fluid driven by evaporation
  and its application to online rankings","13 pages, LaTeX; Main theorem refined (uniqueness proved)","Funkcialaj Ekvacioj 52 (2009) 301-319",,,"math-ph math.MP","http://arxiv.org/licenses/nonexclusive-distrib/1.0/","  We give a unique classical solution to initial value problem for a system of
partial differential equations for the densities of components of one
dimensional incompressible fluid mixture driven by evaporation. Motivated by
the known fact that the solution appears as an infinite particle limit of
stochastic ranking processes, which is a simple stochastic model of time
evolutions of e.g., Amazon Sales Ranks, we collected data from the web and
performed statistical fits to our formula. The results suggest that the fluid
equations and solutions may have an application in the analysis of online
rankings.
","[{""version"":""v1"",""created"":""Wed, 2 Apr 2008 11:16:29 GMT""},{""version"":""v2"",""created"":""Sat, 17 May 2008 14:14:18 GMT""}]","2009-10-31"
"0804.0331","Fulvio Baldovin","Attilio L. Stella and Fulvio Baldovin","Role of scaling in the statistical modeling of finance","Based on the Key Note lecture by A.L. Stella at the Conference on
  ``Statistical Physics Approaches to Multi-Disciplinary Problems'', IIT
  Guwahati, India, 7-13 January 2008","Pramana - Journal of Physics 71, 341 (2008)","10.1007/s12043-008-0167-0",,"q-fin.ST cond-mat.stat-mech physics.soc-ph","http://arxiv.org/licenses/nonexclusive-distrib/1.0/","  Modeling the evolution of a financial index as a stochastic process is a
problem awaiting a full, satisfactory solution since it was first formulated by
Bachelier in 1900. Here it is shown that the scaling with time of the return
probability density function sampled from the historical series suggests a
successful model. The resulting stochastic process is a heteroskedastic,
non-Markovian martingale, which can be used to simulate index evolution on the
basis of an auto-regressive strategy. Results are fully consistent with
volatility clustering and with the multi-scaling properties of the return
distribution. The idea of basing the process construction on scaling, and the
construction itself, are closely inspired by the probabilistic renormalization
group approach of statistical mechanics and by a recent formulation of the
central limit theorem for sums of strongly correlated random variables.
","[{""version"":""v1"",""created"":""Wed, 2 Apr 2008 11:23:42 GMT""}]","2009-11-13"
"0804.0332","Edward Porter","Edward K. Porter, Neil J. Cornish","The Effect of Higher Harmonic Corrections on the Detection of massive
  black hole binaries with LISA","15 pages, 8 figures, submitted to PRD","Phys.Rev.D78:064005,2008","10.1103/PhysRevD.78.064005",,"gr-qc","http://arxiv.org/licenses/nonexclusive-distrib/1.0/","  Massive black hole binaries are key targets for the space based gravitational
wave interferometer LISA. Several studies have investigated how LISA
observations could be used to constrain the parameters of these systems. Until
recently, most of these studies have ignored the higher harmonic corrections to
the waveforms. Here we analyze the effects of the higher harmonics in more
detail by performing extensive Monte Carlo simulations. We pay particular
attention to how the higher harmonics impact parameter correlations, and show
that the additional harmonics help mitigate the impact of having two laser
links fail, by allowing for an instantaneous measurement of the gravitational
wave polarization with a single interferometer channel. By looking at parameter
correlations we are able to explain why certain mass ratios provide dramatic
improvements in certain parameter estimations, and illustrate how the improved
polarization measurement improves the prospects for single interferometer
operation.
","[{""version"":""v1"",""created"":""Wed, 2 Apr 2008 11:24:19 GMT""}]","2009-02-20"
"0804.0333","Vasiliy Neznamov P.","V.P.Neznamov","The Necessary and Sufficient Conditions for Transformation from Dirac
  Representation to Foldy-Wouthuysen Representation","18 pages",,,,"math-ph math.MP","http://arxiv.org/licenses/nonexclusive-distrib/1.0/","  The paper describes conditions for transformation from the Dirac
representation to the Foldy-Wouthuysen representation. The necessary condition
is the block-diagonal transformation of Hamiltonian relative to the upper and
lower components of the wave function. The sufficient condition is the wave
function transformation law described by relation (6). It has been demonstrated
that the unitary transformations offered by the authors of the papers [14],
[15], [16], [17] do not satisfy the sufficiency condition (6) and, hence, they
are not the Foldy-Wouthuysen transformations. In applications, the matrix
elements of any operator in the FW representation can be calculated, according
to (6), using the normalized two-component wave functions in the Dirac
representation known for the given problem.
","[{""version"":""v1"",""created"":""Wed, 2 Apr 2008 11:38:24 GMT""},{""version"":""v2"",""created"":""Mon, 21 Apr 2008 04:07:13 GMT""}]","2009-01-16"
"0804.0334","Mattias Marklund","M. Marklund and G. Brodin","Spin quantum plasmas - new aspects of collective dynamics","17 pages, short review concerning quantum plasmas, to appear in the
  Proceedings of the 2007 ICTP Summer College on Plasma Physics, Trieste 30
  July - 24 August, 2007",,"10.1142/9789812799784_0003",,"physics.plasm-ph","http://arxiv.org/licenses/nonexclusive-distrib/1.0/","  Quantum plasmas is a rapidly expanding field of research, with applications
ranging from nanoelectronics, nanoscale devices and ultracold plasmas, to
inertial confinement fusion and astrophysics. Here we give a short systematic
overview of quantum plasmas. In particular, we analyze the collective effects
due to spin using fluid models. The introduction of an intrinsic magnetization
due to the plasma electron (or positron) spin properties in the
magnetohydrodynamic limit is discussed. Finally, a discussion of the theory and
examples of applications is given.
","[{""version"":""v1"",""created"":""Wed, 2 Apr 2008 11:40:21 GMT""}]","2017-08-23"
"0804.0335","Mattias Marklund","G. Brodin and M. Marklund","Quantum, spin and QED effects in plasmas","9 pages, short review, to appear in appear in the Proceedings of the
  2007 ICTP Summer College on Plasma Physics, Trieste 30 July - 24 August, 2007",,"10.1142/9789812799784_0002",,"physics.plasm-ph","http://arxiv.org/licenses/nonexclusive-distrib/1.0/","  Plasmas are usually described using classical equations. While this is often
a good approximation, where are situations when a quantum description is
motivated. In this paper we will include several quantum effects, ranging from
particle dispersion, which give raise to the so called Bohm potential, to spin
effects, and to quantum electrodynamical effects. The later effects appears
when the field strength approaches the Schwinger critical field, which may
occur in for example astrophysical systems. Examples of how to model such
quantum effects will be presented, and the phenomena resulting from these
models will be discussed.
","[{""version"":""v1"",""created"":""Wed, 2 Apr 2008 11:45:19 GMT""}]","2017-08-23"
"0804.0336","Osamu Seto","Shaaban Khalil and Osamu Seto","Sterile neutrino dark matter in $B-L$ extension of the standard model
  and galactic 511 keV line","10 pages, 1 figure, references added, final version appeared in JCAP","JCAP 0810:024,2008","10.1088/1475-7516/2008/10/024","IFT-UAM/CSIC08-19","hep-ph astro-ph","http://arxiv.org/licenses/nonexclusive-distrib/1.0/","  Sterile right-handed neutrinos can be naturally embedded in a low scale
gauged $U(1)_{B-L}$ extension of the standard model. We show that, within a low
reheating scenario, such a neutrino is an interesting candidate for dark
matter. We emphasize that if the neutrino mass is of order of MeV, then it
accounts for the measured dark matter relic density and also accommodates the
observed flux of 511 keV photons from the galactic bulge.
","[{""version"":""v1"",""created"":""Wed, 2 Apr 2008 11:46:25 GMT""},{""version"":""v2"",""created"":""Mon, 22 Dec 2008 17:59:58 GMT""}]","2009-02-09"
"0804.0337","Raphael Hunger","Raphael Hunger, Michael Joham","On the Convexity of the MSE Region of Single-Antenna Users","submitted to Globecom 2008; fixed definition of matrix S, added 2 KKT
  conditions, and few minor changes",,,,"cs.IT math.IT","http://arxiv.org/licenses/nonexclusive-distrib/1.0/","  We prove convexity of the sum-power constrained mean square error (MSE)
region in case of two single-antenna users communicating with a multi-antenna
base station. Due to the MSE duality this holds both for the vector broadcast
channel and the dual multiple access channel. Increasing the number of users to
more than two, we show by means of a simple counter-example that the resulting
MSE region is not necessarily convex any longer, even under the assumption of
single-antenna users. In conjunction with our former observation that the two
user MSE region is not necessarily convex for two multi-antenna users, this
extends and corrects the hitherto existing notion of the MSE region geometry.
","[{""version"":""v1"",""created"":""Wed, 2 Apr 2008 11:57:56 GMT""},{""version"":""v2"",""created"":""Tue, 29 Jul 2008 11:26:03 GMT""}]","2008-07-29"
"0804.0338","Henri Gouin","Henri Gouin (LMMT, MSNMGP)","Dynamics effects in gradient theory for fluid mixtures","revisited version, 13 pages, 3 figures","IMA Volumes in Mathematics and its Applications 52 (1993) 111-121",,,"physics.flu-dyn math-ph math.MP","http://arxiv.org/licenses/nonexclusive-distrib/1.0/","  We propose a new method to study motions of mixtures in fluid interfaces. We
extend the equations of equilibrium in interfaces and the results associated
with travelling waves for van der Waals like fluids. Maxwell rule is extended
to interfaces of fluid mixtures out of equilibrium. Formulae like Clapeyron
relation are obtained for isothermal layers.
","[{""version"":""v1"",""created"":""Wed, 2 Apr 2008 12:08:38 GMT""}]","2008-12-18"
"0804.0339","Martin Pan\'ak","Martin Panak, Vojtech Zadnik","Remarks on special symplectic connections",,,,,"math.DG math.AG","http://arxiv.org/licenses/nonexclusive-distrib/1.0/","  The notion of special symplectic connections is closely related to contact
parabolic geometries due to the work of M. Cahen and L. Schwachh\""ofer. We
remind their characterization and reinterpret the result in terms of
generalized Weyl connections. The aim of this paper is to provide an
alternative and more explicit construction of special symplectic connections of
three types from the list. This is done by pulling back an ambient linear
connection from the total space of a natural scale bundle over the homogeneous
model of the corresponding contact parabolic structure.
","[{""version"":""v1"",""created"":""Wed, 2 Apr 2008 12:10:56 GMT""},{""version"":""v2"",""created"":""Fri, 3 Oct 2008 08:30:13 GMT""}]","2008-10-03"
"0804.0340","Isabelle Gallagher","Hajer Bahouri (FST), Isabelle Gallagher (IMJ)","The heat kernel and frequency localized functions on the Heisenberg
  group",,,,,"math.AP","http://arxiv.org/licenses/nonexclusive-distrib/1.0/","  The goal of this paper is to study the action of the heat operator on the
Heisenberg group H^d, and in particular to characterize Besov spaces of
negative index on H^d in terms of the heat kernel. That characterization can be
extended to positive indexes using Bernstein inequalities. As a corollary we
obtain a proof of refined Sobolev inequalities in W^{s,p} spaces.
","[{""version"":""v1"",""created"":""Wed, 2 Apr 2008 12:27:21 GMT""}]","2009-09-29"
"0804.0341","Francesco de Martini","Francesco De Martini, Fabio Sciarrino, and Chiara Vitelli","Entanglement and Non-locality in a Micro-Macroscopic system","12 pages, 11 figures",,,,"quant-ph","http://arxiv.org/licenses/nonexclusive-distrib/1.0/","  In recent years two fundamental aspects of quantum mechanics have attracted a
great deal of interest, namely the investigation on the irreducible nonlocal
properties of Nature implied by quantum entanglement and the physical
realization of the 'Schroedinger Cat'. In the present work a macro - state
consisting of about 3.5 x 10^4 photons in a quantum superposition and entangled
with a far apart single - photon state is generated. Then, the non-separability
of the overall micro-macro system is demonstrated and the corresponding Bell's
inequalities are found to be violated. Precisely, an entangled photon pair is
created by a nonlinear optical process, then one photon of the pair is injected
into an optical parametric amplifier operating for any input polarization
state, i.e. into a phase-covariant cloning machine. Such transformation
establishes a connection between the single photon and the multi particle
fields. We then demonstrate the non-separability of the bipartite system by
adopting a local filtering technique within a positive operator valued
measurement.
","[{""version"":""v1"",""created"":""Wed, 2 Apr 2008 13:50:58 GMT""}]","2008-04-03"
"0804.0342","Sergey Ganichev","W. Weber, L. E.Golub, S. N. Danilov, J. Karch, C. Reitmaier, B.
  Wittmann, V. V. Bel'kov, E. L. Ivchenko, Z. D. Kvon, N. Q. Vinh, A. F. G. van
  der Meer, B. Murdin, and S. D. Ganichev","Quantum ratchet effects induced by terahertz radiation in GaN-based
  two-dimensional structures","technical reasons",,"10.1103/PhysRevB.77.245304",,"cond-mat.mes-hall","http://arxiv.org/licenses/nonexclusive-distrib/1.0/","  Photogalvanic effects are observed and investigated in wurtzite
(0001)-oriented GaN/AlGaN low-dimensional structures excited by terahertz
radiation. The structures are shown to represent linear quantum ratchets.
Experimental and theoretical analysis exhibits that the observed photocurrents
are related to the lack of an inversion center in the GaN-based
heterojunctions.
","[{""version"":""v1"",""created"":""Wed, 2 Apr 2008 13:06:42 GMT""},{""version"":""v2"",""created"":""Wed, 7 May 2008 07:41:46 GMT""}]","2009-11-13"
"0804.0343","John Lott","John Lott","Optimal transport and Perelman's reduced volume","final version",,,,"math.DG","http://arxiv.org/licenses/nonexclusive-distrib/1.0/","  We show that a certain entropy-like function is convex, under an optimal
transport problem that is adapted to Ricci flow. We use this to reprove the
monotonicity of Perelman's reduced volume.
","[{""version"":""v1"",""created"":""Wed, 2 Apr 2008 13:08:39 GMT""},{""version"":""v2"",""created"":""Thu, 8 Jan 2009 23:02:32 GMT""}]","2009-01-09"
"0804.0344","Sera Markoff","S. Markoff, M. Nowak, A. Young, H.L. Marshall, C.R. Canizares, A.
  Peck, M. Krips, G. Petitpas, R. Schoedel, G.C. Bower, P. Chandra, A. Ray, M.
  Muno, S. Gallagher, S. Hornstein, C.C. Cheung","Results from an extensive simultaneous broadband campaign on the
  underluminous active nucleus M81*: further evidence for mass-scaling
  accretion in black holes","58 pages (preprint version), 22 figures, accepted for publication in
  the Astrophysical Journal",,"10.1086/588718",,"astro-ph","http://arxiv.org/licenses/nonexclusive-distrib/1.0/","  We present the results of a broadband simultaneous campaign on the nearby
low-luminosity active galactic nucleus M81*. From February through August 2005,
we observed M81* five times using the Chandra X-ray Observatory with the
High-Energy Transmission Grating Spectrometer, complemented by ground-based
observations with the Giant Meterwave Radio Telescope, the Very Large Array and
Very Large Baseline Array, the Plateau de Bure Interferometer at IRAM, the
Submillimeter Array and Lick Observatory. We discuss how the resulting spectra
vary over short and longer timescales compared to previous results, especially
in the X-rays where this is the first ever longer-term campaign at spatial
resolution high enough to nearly isolate the nucleus (17pc). We compare the
spectrum to our Galactic center weakly active nucleus Sgr A*, which has
undergone similar campaigns, as well as to weakly accreting X-ray binaries in
the context of outflow-dominated models. In agreement with recent results
suggesting that the physics of weakly-accreting black holes scales predictably
with mass, we find that the exact same model which successfully describes hard
state X-ray binaries applies to M81*, with very similar physical parameters.
","[{""version"":""v1"",""created"":""Wed, 2 Apr 2008 13:13:04 GMT""}]","2009-11-13"
"0804.0345","Thomas Gastine","T. Gastine, B. Dintrans","Direct numerical simulations of the kappa-mechanism II. The nonlinear
  saturation and Hertzsprung's progression","11 pages, 9 figures, 1 table, accepted for publication in A&A",,"10.1051/0004-6361:200809891",,"astro-ph","http://arxiv.org/licenses/nonexclusive-distrib/1.0/","  Context: We study the kappa-mechanism that excites radial oscillations in
Cepheid variables.
  Aims: We address the mode couplings that manages the nonlinear saturation of
the instability in direct numerical simulations (DNS).
  Methods: We project the DNS fields onto an acoustic subspace built from the
regular and adjoint eigenvectors that are solutions to the linear-oscillations
equations.
  Results: We determine the time evolution of both the amplitude and kinetic
energy of each mode that propagates in the DNS. More than 98% of the total
kinetic energy is contained in two modes that correspond to the
linearly-unstable fundamental mode and the linearly-stable second overtone.
Because the eigenperiods ratio is close to 1/2, we discover that the nonlinear
saturation is due to a 2:1 resonance between these two modes. An interesting
application of this result concerns the reproduction of Hertzsprung's
progression observed in Bump Cepheids.
","[{""version"":""v1"",""created"":""Wed, 2 Apr 2008 13:31:17 GMT""},{""version"":""v2"",""created"":""Wed, 10 Sep 2008 14:41:43 GMT""}]","2009-11-13"
"0804.0346","Thomas Speck","Jakob Mehl, Thomas Speck, Udo Seifert","Large deviation function for entropy production in driven
  one-dimensional systems",,"Phys. Rev. E 78, 011123 (2008)","10.1103/PhysRevE.78.011123",,"cond-mat.stat-mech","http://arxiv.org/licenses/nonexclusive-distrib/1.0/","  The large deviation function for entropy production is calculated for a
particle driven along a periodic potential by solving a time-independent
eigenvalue problem. In an intermediate force regime, the large deviation
function shows pronounced deviations from a Gaussian behavior with a
characteristic ``kink'' at zero entropy production. Such a feature can also be
extracted from the analytical solution of the asymmetric random walk to which
the driven particle can be mapped in a certain parameter range.
","[{""version"":""v1"",""created"":""Wed, 2 Apr 2008 13:23:40 GMT""}]","2009-01-15"
"0804.0347","Grzegorz Pietrzynski","G. Pietrzynski, W. Gieren, O. Szewczyk, A. Walker, L. Rizzi, F.
  Bresolin, R.-P. Kudritzki, K. Nalewajko, J. Storm, M. Dall'Ora, V. Ivanov","The Araucaria Project. The Distance to the Sculptor dwarf spheroidal
  galaxy from infrared photometry of RR Lyrae stars","AJ in press",,"10.1088/0004-6256/135/6/1993",,"astro-ph","http://arxiv.org/licenses/nonexclusive-distrib/1.0/","  We have obtained single-phase near-infrared magnitudes in the J and K bands
for a sample of 78 RR Lyrae stars in the Sculptor dSph galaxy. Applying
different theoretical and empirical calibrations of the
period-luminosity-metallicity relation for RR Lyrae stars in the infrared, we
find consistent results and obtain a true, reddening-corrected distance modulus
of 19.67 $\pm$ 0.02 (statistical) $\pm$ 0.12 (systematic) mag for Sculptor from
our data. This distance value is consistent with the value of 19.68 $\pm$ 0.08
mag which we obtain from earlier V-band data of RR Lyrae stars in Sculptor, and
the V magnitude-metallicity calibration of Sandage (1993). It is also in a very
good agreement with the results obtain by Rizzi (2002) based on tip of the red
giant branch (TRGB, 19.64 $\pm$ 0.08 mag) and horizontal branch (HB, 19.66
$\pm$ 0.15 mag).
","[{""version"":""v1"",""created"":""Wed, 2 Apr 2008 13:42:25 GMT""}]","2009-11-13"
"0804.0348","Vladimir Azarin Prof.","Vladimir Azarin","Limit sets and a problem in dynamical systems","8 pages; typeset and typos fixed",,,,"math.DS","http://arxiv.org/licenses/nonexclusive-distrib/1.0/","  We approximate a chain recurrent dynamical system by periodic dynamical
systems. This is similar to the well known Bohr theorem on approximation of
almost periodic functions by periodic functions.
","[{""version"":""v1"",""created"":""Wed, 2 Apr 2008 13:32:02 GMT""},{""version"":""v2"",""created"":""Sat, 5 Apr 2008 15:31:08 GMT""}]","2008-04-05"
"0804.0349","Mun Dae Kim","Tae-Wan Noh, Mun Dae Kim, H.-S. Sim","Superconductor-ferromagnet junction phase qubit","3 pages, 3 figures","J. Korean Phys. Soc. 60, 72 (2012)","10.3938/jkps.60.72",,"cond-mat.supr-con","http://arxiv.org/licenses/nonexclusive-distrib/1.0/","  We propose a scheme for a phase qubit in an SIFIS junction, consisting of
bulk superconductors (S), a proximity-induced ferromagnet (F), and insulating
barriers (I). The qubit state is constituted by 0 and $\pi$ phase states of the
junction, in which the charging energy of the junction leads to the
superposition of the two states. The qubit is operated by the gate voltage
applied to the ferromagnet, and insensitive to the decoherence sources existing
in other superconducting qubits. We discuss a scalable scheme for qubit
measurement and tunable two-qubit coupling.
","[{""version"":""v1"",""created"":""Wed, 2 Apr 2008 13:36:47 GMT""},{""version"":""v2"",""created"":""Wed, 6 May 2009 04:13:54 GMT""}]","2015-05-13"
"0804.0350","Giovanni Ossola","T. Binoth, G. Ossola, C. G. Papadopoulos, and R. Pittau","NLO QCD corrections to tri-boson production",,"JHEP 0806:082,2008","10.1088/1126-6708/2008/06/082",,"hep-ph","http://arxiv.org/licenses/nonexclusive-distrib/1.0/","  We present a calculation of the NLO QCD corrections for the production of
three vector bosons at the LHC, namely Z Z Z, W+ W- Z, W+ Z Z, and W+ W- W+
production. The virtual corrections are computed using the recently proposed
method of reduction at the integrand level (OPP reduction). Concerning the
contributions coming from real emission we used the dipole subtraction to treat
the soft and collinear divergences. We find that the QCD corrections for these
electroweak processes are in the range between 70 and 100 percent. As such they
have to be considered in experimental studies of triple vector boson production
at the LHC.
","[{""version"":""v1"",""created"":""Wed, 2 Apr 2008 13:37:35 GMT""}]","2009-01-21"
"0804.0351","Ginevra Trinchieri","G. Trinchieri (INAF-OABrera, Italy), A. Iovino (INAF-OABrera, Italy),
  E. Pompei (ESO, Chile), M. Dahlem (CSIRO/ATNF, Australia), J. Reeves (Keele
  University, UK), R. Coziol (Universidad de Guanajuato, Mexico) S. Temporin
  (CEA, France)","Detection of a hot intergalactic medium in the spiral-only compact group
  SCG0018-4854","Accepted for publication in A&A",,"10.1051/0004-6361:200809487",,"astro-ph","http://arxiv.org/licenses/nonexclusive-distrib/1.0/","  AIMS: Compact groups of galaxies are excellent laboratories for studying
galaxy interactions and their effects on the evolution of galaxies. In
particular, dynamically young systems, with a large fraction of interacting,
late type galaxies, have so far escaped proper studies in the X-ray band and
their hot intergalactic medium properties are virtually unknown. Motivated by
this lack of knowledge, we present a detailed investigation here of the X-ray
properties of such a dynamically young system. METHODS: We obtained XMM-Newton
observations of one spiral-only system in the new southern compact group
catalogue: SCG0018-4854. We present here the results of the data analysis and
discuss them in comparison with the few other similar systems also studied in
the X-ray band. RESULTS: The 4 members of SCG0018-4854 emit at a level
comparable to what is expected based on their optical properties. We detect the
low level diffuse emission between galaxies, which is most likely due to the
presence of the intergalactic medium. Compared to other spiral--only groups,
this could be the coolest system detected so far, although the measurements
have large uncertainties. These results indicate that high quality deep X-ray
observations are needed to allow a proper study of the properties of the
potential well of dynamically young systems, before more general conclusions
can be drawn on their average characteristics.
","[{""version"":""v1"",""created"":""Wed, 2 Apr 2008 13:42:02 GMT""}]","2009-11-13"
