"0804.0267","Yi-Fang Chang","Yi-Fang Chang","Some New Unifications in Supersymmetry and Higher Dimensional Complex
  Space","6 pages",,,,"physics.gen-ph","http://arxiv.org/licenses/nonexclusive-distrib/1.0/","  Some new representations of the supersymmetric transformations are derived,
and the supermultiplets are introduced. Based on these representations, various
formulations (equations, commutation relations, propagators, Jacobi identities,
etc.) of bosons and fermions may be unified. On the one hand, the mathematical
characteristic of particles is proposed: bosons correspond to real number, and
fermions correspond to imaginary number, respectively. Such fermions of even
(or odd) number form bosons (or fermions), which is just consistent with a
relation between imaginary and real number. The imaginary number is only
included in the equations, forms, and matrixes of fermions. It is connected
with relativity. On the other hand, the unified forms of supersymmetry are also
connected with the statistics unifying Bose-Einstein and Fermi-Dirac
statistics, and with the possible violation of Pauli exclusion principle; and a
unified partition function is obtained. Therefore, one of the possible
developments is the higher dimensional complex space.
","[{""version"":""v1"",""created"":""Tue, 1 Apr 2008 23:03:59 GMT""}]","2008-04-03"
"0804.0268","Yue Zhang","Yue Zhang (1 and 2), Haipeng An (2), Xiangdong Ji (2 and 1), Rabindra
  N. Mohapatra (2) ((1) Peking University, (2) University of Maryland)","Light Higgs Mass Bound in SUSY Left-Right Models","5 pages, 2 figures. Accepted for publication in Phys. Rev. D","Phys.Rev.D78:011302,2008","10.1103/PhysRevD.78.011302","UMD-PP-08-007","hep-ph hep-ex","http://arxiv.org/licenses/nonexclusive-distrib/1.0/","  We show that in supersymmetric left-right models (SUSYLR), the upper bound on
the lightest neutral Higgs mass can be appreciably higher than that in minimal
supersymmetric standard model (MSSM). The exact magnitude of the bound depends
on the scale of parity restoration and can be 10-20 GeV above the MSSM bound if
mass of the right-handed gauge boson $W_R$ is in the TeV range. An important
implication of our result is that since SUSYLR models provide a simple
realization of seesaw mechanism for neutrino masses, measurement of the Higgs
boson mass could provide an independent probe of a low seesaw scale.
","[{""version"":""v1"",""created"":""Wed, 2 Apr 2008 00:47:05 GMT""},{""version"":""v2"",""created"":""Tue, 8 Apr 2008 15:18:37 GMT""},{""version"":""v3"",""created"":""Mon, 30 Jun 2008 21:25:32 GMT""}]","2008-11-26"
"0804.0269","Matthew Mewes","Matthew Mewes","Lorentz Violation, Electrodynamics, and the Cosmic Microwave Background","Presented at 4th Meeting on CPT and Lorentz Symmetry, Bloomington,
  Indiana, 8-11 Aug 2007",,"10.1142/9789812779519_0004",,"hep-ph","http://arxiv.org/licenses/nonexclusive-distrib/1.0/","  Vacuum birefringence is a signature of Lorentz-symmetry violation. Here we
report on a recent search for birefringence in the cosmic microwave background.
Polarization data is used to place constraints on certain forms of Lorentz
violation.
","[{""version"":""v1"",""created"":""Tue, 1 Apr 2008 23:57:57 GMT""}]","2016-11-09"
"0804.0270","Ostrover Yaron","Yaron Ostrover and Ilya Tyomkin","On the quantum homology algebra of toric Fano manifolds","Revised version. Two corollaries have been added",,,,"math.SG math.AG","http://arxiv.org/licenses/nonexclusive-distrib/1.0/","  In this paper we study certain algebraic properties of the quantum homology
algebra for the class of symplectic toric Fano manifolds. In particular, we
examine the semi-simplicity of the quantum homology algebra, and the more
general property of containing a field as a direct summand. Our main result
provides an easily-verified sufficient condition for these properties which is
independent of the symplectic form. Moreover, we answer two questions of Entov
and Polterovich negatively by providing examples of toric Fano manifolds with
non semi-simple quantum homology algebra, and others in which the Calabi
quasi-morphism is non-unique.
","[{""version"":""v1"",""created"":""Wed, 2 Apr 2008 00:01:56 GMT""},{""version"":""v2"",""created"":""Sun, 15 Jun 2008 09:46:07 GMT""}]","2008-06-15"
"0804.0271","Steven Verpoort","Steven Verpoort","On the Inner Curvature of the Second Fundamental Form of a Surface in
  the Hyperbolic Space","13 pages","Revue Roumaine de Math'ematiques Pures et Appliqu'ees 54 (2009) 2,
  171--180. Published version available here:
  http://www.csm.ro/reviste/Revue_Mathematique/pdfs/2009/2/Verpoort.pdf",,,"math.DG","http://arxiv.org/licenses/nonexclusive-distrib/1.0/","  The object of study of this article is compact surfaces in the
three-dimensional hyperbolic space with a positive-definite second fundamental
form. It is shown that several conditions on the Gaussian curvature of the
second fundamental form can be satisfied only by extrinsic spheres.
","[{""version"":""v1"",""created"":""Wed, 2 Apr 2008 00:02:09 GMT""}]","2009-09-18"
"0804.0272","Ben Lanyon","B. P. Lanyon, M. Barbieri, M. P. Almeida, T. Jennewein, T. C. Ralph,
  K. J. Resch, G. J. Pryde, J. L. O'Brien, A. Gilchrist and A. G. White","Quantum computing using shortcuts through higher dimensions","7 pages, 6 figures","Nature Physics 5, 134 (2009)","10.1038/nphys1150.",,"quant-ph","http://arxiv.org/licenses/nonexclusive-distrib/1.0/","  Quantum computation offers the potential to solve fundamental yet otherwise
intractable problems across a range of active fields of research. Recently,
universal quantum-logic gate sets - the building blocks for a quantum computer
- have been demonstrated in several physical architectures. A serious obstacle
to a full-scale implementation is the sheer number of these gates required to
implement even small quantum algorithms. Here we present and demonstrate a
general technique that harnesses higher dimensions of quantum systems to
significantly reduce this number, allowing the construction of key quantum
circuits with existing technology. We are thereby able to present the first
implementation of two key quantum circuits: the three-qubit Toffoli and the
two-qubit controlled-unitary. The gates are realised in a linear optical
architecture, which would otherwise be absolutely infeasible with current
technology.
","[{""version"":""v1"",""created"":""Wed, 2 Apr 2008 00:16:03 GMT""}]","2011-12-06"
"0804.0273","Alwen Tiu","Alwen Tiu and Rajeev Gore","A proof theoretic analysis of intruder theories","This is an extended version of a conference paper accepted to RTA
  2009",,,,"cs.LO cs.CR","http://arxiv.org/licenses/nonexclusive-distrib/1.0/","  We consider the problem of intruder deduction in security protocol analysis:
that is, deciding whether a given message $M$ can be deduced from a set of
messages $\Gamma$ under the theory of blind signatures and arbitrary convergent
equational theories modulo associativity and commutativity (AC) of certain
binary operators. The traditional formulations of intruder deduction are
usually given in natural-deduction-like systems and proving decidability
requires significant effort in showing that the rules are ""local"" in some
sense. By using the well-known translation between natural deduction and
sequent calculus, we recast the intruder deduction problem as proof search in
sequent calculus, in which locality is immediate. Using standard proof
theoretic methods, such as permutability of rules and cut elimination, we show
that the intruder deduction problem can be reduced, in polynomial time, to the
elementary deduction problems, which amounts to solving certain equations in
the underlying individual equational theories. We further show that this result
extends to combinations of disjoint AC-convergent theories whereby the
decidability of intruder deduction under the combined theory reduces to the
decidability of elementary deduction in each constituent theory. Although
various researchers have reported similar results for individual cases, our
work shows that these results can be obtained using a systematic and uniform
methodology based on the sequent calculus.
","[{""version"":""v1"",""created"":""Wed, 2 Apr 2008 00:21:27 GMT""},{""version"":""v2"",""created"":""Mon, 6 Apr 2009 06:52:58 GMT""}]","2009-04-06"
"0804.0274","Igor Krichever","I.Krichever and T.Shiota","Abelian solutions of the KP equation","21 pages, no figures",,,,"hep-th math.AG","http://arxiv.org/licenses/nonexclusive-distrib/1.0/","  We introduce the notion of abelian solutions of KP equations and show that
all of them are algebro-geometric.
","[{""version"":""v1"",""created"":""Wed, 2 Apr 2008 00:23:47 GMT""}]","2008-04-04"
"0804.0275","Stanislaw Mrowczynski","Stanislaw Mrowczynski","Unstable Quark-Gluon Plasma at LHC","Presented at Cracow Epiphany Conference on LHC Physics, Cracow,
  Poland, January 4-6, 2008; 8 pages, minor corrections","Acta Phys.Polon.B39:1665-1674,2008",,,"nucl-th hep-ph","http://arxiv.org/licenses/nonexclusive-distrib/1.0/","  Coupling of the quark-gluon plasma from the early stage of heavy-ion
collisions is argued to be weaker at LHC than at RHIC. For this reason, the
role of instabilities - the pre-equilibrium plasma is unstable with respect to
chromomagnetic modes - will be enhanced. The instabilities isotropize the
system and speed up the process of equilibration. A possibility to observe
direct signals of the instabilities is considered.
","[{""version"":""v1"",""created"":""Wed, 2 Apr 2008 01:00:49 GMT""},{""version"":""v2"",""created"":""Sat, 5 Apr 2008 01:27:03 GMT""},{""version"":""v3"",""created"":""Fri, 2 May 2008 22:13:05 GMT""}]","2008-12-19"
"0804.0276","Levan N. Tsintsadze","Nodar L.Tsintsadze and Levan N.Tsintsadze","On Dust Charging Equation","Invited Talk National Symposium on Plasma Physics Jan 28, 2008
  Islamabad","Europhys.Lett.83:15005,2008","10.1209/0295-5075/83/15005",,"physics.plasm-ph astro-ph","http://arxiv.org/licenses/nonexclusive-distrib/1.0/","  A general derivation of the charging equation of a dust grain is presented,
and indicated where and when it can be used. A problem of linear fluctuations
of charges on the surface of the dust grain is discussed.
","[{""version"":""v1"",""created"":""Wed, 2 Apr 2008 01:12:38 GMT""}]","2008-11-26"
"0804.0277","Marko A. Rodriguez","Marko A. Rodriguez","Mapping Semantic Networks to Undirected Networks",,"International Journal of Applied Mathematics and Computer
  Sciences, volume 5, issue 1, pages 39-42, ISSN:2070-3902, LA-UR-07-5287, 2009",,"LAUR-07-5287","cs.DS","http://creativecommons.org/licenses/publicdomain/","  There exists an injective, information-preserving function that maps a
semantic network (i.e a directed labeled network) to a directed network (i.e. a
directed unlabeled network). The edge label in the semantic network is
represented as a topological feature of the directed network. Also, there
exists an injective function that maps a directed network to an undirected
network (i.e. an undirected unlabeled network). The edge directionality in the
directed network is represented as a topological feature of the undirected
network. Through function composition, there exists an injective function that
maps a semantic network to an undirected network. Thus, aside from space
constraints, the semantic network construct does not have any modeling
functionality that is not possible with either a directed or undirected network
representation. Two proofs of this idea will be presented. The first is a proof
of the aforementioned function composition concept. The second is a simpler
proof involving an undirected binary encoding of a semantic network.
","[{""version"":""v1"",""created"":""Wed, 2 Apr 2008 01:19:55 GMT""}]","2008-12-02"
"0804.0278","Loris P. L. Colombo","Loris P.L. Colombo and Elena Pierpaoli","Model independent approaches to reionization in the analysis of upcoming
  CMB data","15 pages, 6 figures, submitted to A&A","New Astron.14:269-276,2009","10.1016/j.newast.2008.07.002",,"astro-ph","http://arxiv.org/licenses/nonexclusive-distrib/1.0/","  On large angular scales, CMB polarization depends mostly on the evolution of
the ionization level of the IGM during reionization. In order to avoid biasing
parameter estimates, an accurate and model independent approach to reionization
is needed when analyzing high precision data, like those expected from the
Planck experiment. In this paper we consider two recently proposed methods of
fitting for reionization and we discuss their respective advantages. We test
both methods by performing a MonteCarlo Markov Chain analysis of simulated
Planck data, assuming different fiducial reionization histories. We take into
account both temperature and polarization data up to high multipoles, and we
fit for both reionization and non reionization parameters. We find that while a
wrong assumption on reionization may bias \tau_e, A_s and r by 1-3 standard
deviations, other parameters, in particular n_s, are not significantly biased.
The additional reionization parameters introduced by considering the model
independent methods do not affect the accuracy of the estimates of the main
cosmological parameters, the biggest degradation being of order ~ 15% for
\tau_e. Finally, we show that neglecting Helium contribution in the analysis
increases the bias on \tau_e, r and A_s even when a general fitting approach to
reionization is assumed.
","[{""version"":""v1"",""created"":""Wed, 2 Apr 2008 01:41:17 GMT""}]","2009-06-23"
"0804.0280","Yi-Xin Chen","Chao Cao, Yi-Xin Chen, Jian-Long Li","Black hole hair in higher dimensions","8 pages","Commun.Theor.Phys.53:285-290,2010","10.1088/0253-6102/53/2/16",,"hep-th","http://arxiv.org/licenses/nonexclusive-distrib/1.0/","  We study the property of matter in equilibrium with a static, spherically
symmetric black hole in D-dimensional spacetime. It requires this kind of
matter has an equation of state (\omega\equiv p_r/\rho=-1/(1+2kn), k,n\in
\mathbb{N}), which seems to be independent of D. However, when we associate
this with specific models, some interesting limits on space could be found:
(i)(D=2+2kn) while the black hole is surrounded by cosmic strings;
  (ii)the black hole can be surrounded by linear dilaton field only in
4-dimensional spacetime. In both cases, D=4 is special.
","[{""version"":""v1"",""created"":""Wed, 2 Apr 2008 01:56:27 GMT""}]","2010-02-18"
"0804.0281","Ping Wang","Ping Wang, Chaoming Song, Christopher Briscoe, and Hernan A. Makse","Particle dynamics and effective temperature of jammed granular matter in
  a slowly sheared 3D Couette cell","17 pages, 19 figures","PRE 77, 6 (2008)","10.1103/PhysRevE.77.061309",,"cond-mat.soft","http://creativecommons.org/licenses/by/3.0/","  We report experimental measurements of particle dynamics on slowly sheared
granular matter in a three-dimensional (3D) Couette cell. A closely-packed
ensemble of transparent spherical beads is confined by an external pressure and
filled with fluid to match both the density and refractive index of the beads.
This allows us to track tracer particles embedded in the system and obtain
three-dimensional trajectories as a function of time. We study the PDF of the
vertical and radial displacements, finding Gaussian and exponential
distributions, respectively. For slow shear rates, the mean-square fluctuations
in all three directions are found to be dependent only on the angular
displacement of the Couette cell. Both the diffusivity and mobility of tracer
particles are proportional to the shear rate, giving rise to a constant
effective temperature, characteristic of the jammed system.
","[{""version"":""v1"",""created"":""Wed, 2 Apr 2008 02:07:36 GMT""},{""version"":""v2"",""created"":""Mon, 30 Jun 2008 20:44:44 GMT""}]","2009-11-13"
"0804.0282","Masashi Chiba","Masashi Chiba, Takeo Minezaki, Kaiki T. Inoue, Nobunari Kashikawa,
  Hirokazu Kataza, Hajime Sugai","Dark Matter Substructure in Lensing Galaxies","4 pages, 3 figures, to appear in the proceedings of ""Panoramic Views
  of Galaxy Formation and Evolution"", 1st Subaru International Conference held
  in Hayama, Japan 11-16 December 2007",,,,"astro-ph","http://arxiv.org/licenses/nonexclusive-distrib/1.0/","  To set useful limits on the abundance of small-scale dark matter halos
(subhalos) in a galaxy scale, we have carried out mid-infrared imaging and
integral-field spectroscopy for a sample of quadruple lens systems showing
anomalous flux ratios. These observations using Subaru have been successful for
distinguishing millilensing by subhalos from microlensing by stars. Current
status for our lensing analysis of dark matter substructure is reported.
","[{""version"":""v1"",""created"":""Wed, 2 Apr 2008 02:13:56 GMT""}]","2008-04-03"
"0804.0283","Corey Hoelscher","Corey A. Hoelscher","Nonnegative Curvature on Low Dimensional Cohomogeneity One Manifolds","This paper has been withdrawn by the author",,,,"math.DG","http://arxiv.org/licenses/nonexclusive-distrib/1.0/","  This paper has been withdrawn by the author due to a critical error in the
proof of Theorem A pointed out by Burkhard Wilking.
","[{""version"":""v1"",""created"":""Wed, 2 Apr 2008 02:29:52 GMT""},{""version"":""v2"",""created"":""Fri, 4 Apr 2008 06:15:37 GMT""}]","2008-04-04"
"0804.0284","Fusun Akman","Fusun Akman","Partial Chromatic Polynomials and Diagonally Distinct Sudoku Squares","5 pages. Expanded by adding a new proof of a theorem on partial
  colorings. We also acknowledge an earlier proof of the diagonally distinct
  Sudoku square theorem",,,,"math.CO math.GM","http://arxiv.org/licenses/nonexclusive-distrib/1.0/","  Sudoku grids can be thought of as graphs where the vertices are the squares
of the grid, and edges join vertices in the same row, column, or sub-grid. A
Sudoku puzzle corresponds to a partial proper coloring of the Sudoku graph. We
provide a new and simpler proof of the theorem which states that the number of
completions of partial colorings of a graph is a polynomial in the number of
colors (originally due to Herzberg and Murty). Moreover, we construct Sudoku
squares of arbitrary size with distinct entries on both diagonals (a similar
proof was first published by Keedwell, unknown to the author).
","[{""version"":""v1"",""created"":""Wed, 2 Apr 2008 03:27:41 GMT""},{""version"":""v2"",""created"":""Wed, 2 Jul 2008 16:20:20 GMT""}]","2008-07-02"
"0804.0285","Loris P. L. Colombo","Giuseppe La Vacca, Loris P.L. Colombo, Luca Vergani, Silvio A.
  Bonometto","Dark Matter - Dark Energy coupling biasing parameter estimates from CMB
  data","submitted to ApJ, replaced with revised version","Astrophys.J.697:1946-1955,2009","10.1088/0004-637X/697/2/1946",,"astro-ph","http://arxiv.org/licenses/nonexclusive-distrib/1.0/","  When CMB data are used to derive cosmological parameters, their very choice
does matter: some parameter values can be biased if the parameter space does
not cover the ""true"" model. This is a problem, because of the difficulty to
parametrize Dark Energy (DE) physics. We test this risk through numerical
experiments. We create artificial data for dynamical or coupled DE models and
then use MCMC techniques to recover model parameters, by assuming a constant DE
state parameter w and no DM--DE coupling. For the DE potential considered, no
serious bias arises when coupling is absent. On the contrary, \omega_{o,c}, and
thence H_o and \Omega_{o,m}, suffer a serious bias when the ""true"" cosmology
includes even just a mild DM--DE coupling. Until the dark components keep an
unknown nature, therefore, it can be important to allow for a degree of freedom
accounting for DM--DE coupling, even more than increasing the number of
parameters accounting for the w(a) behavior.
","[{""version"":""v1"",""created"":""Wed, 2 Apr 2008 03:51:06 GMT""},{""version"":""v2"",""created"":""Mon, 17 Nov 2008 19:46:25 GMT""}]","2009-06-23"
"0804.0286","Russell Bisset","R.N. Bisset, M.J. Davis, T.P. Simula, and P.B. Blakie","Quasicondensation and coherence in the quasi-two-dimensional trapped
  Bose gas","9 pages, 7 figures","Phys. Rev. A 79, 033626 (2009)","10.1103/PhysRevA.79.033626",,"cond-mat.other cond-mat.quant-gas","http://arxiv.org/licenses/nonexclusive-distrib/1.0/","  We simulate a trapped quasi-two-dimensional Bose gas using a classical field
method. To interpret our results we identify the uniform
Berezinskii-Kosterlitz-Thouless (BKT) temperature $T_{BKT}$ as where the system
phase space density satisfies a critical value. We observe that density
fluctuations are suppressed in the system well above $T_{BKT}$ when a
quasi-condensate forms as the first occurrence of degeneracy. At lower
temperatures, but still above $T_{BKT}$, we observe the development of
appreciable coherence as a prominent finite-size effect, which manifests as
bimodality in the momentum distribution of the system.
  At $T_{BKT}$ algebraic decay of off-diagonal correlations occurs near the
trap center with an exponent of 0.25, as expected for the uniform system.
  Our results characterize the low temperature phase diagram for a trapped
quasi-2D Bose gas and are consistent with observations made in recent
experiments.
","[{""version"":""v1"",""created"":""Wed, 2 Apr 2008 04:19:11 GMT""},{""version"":""v2"",""created"":""Thu, 26 Mar 2009 07:48:06 GMT""},{""version"":""v3"",""created"":""Tue, 30 Aug 2011 01:04:25 GMT""}]","2011-08-31"
"0804.0287","Sanjay M. Wagh","Sanjay M. Wagh","Concept of momentum-less bodies and a suggestion for its experimental
  verification using ultra-cold atoms","4 pages, No figures",,,,"physics.gen-ph","http://arxiv.org/licenses/nonexclusive-distrib/1.0/","  General Principle of Relativity unequivocally supports the notion of
momentum-less energy for bodies (energy-quanta) moving at the {\em same} or
{\em constant} speed relative to all the reference systems. In this
communication, we point out that whether energy-quantum is a momentum-less body
or not is verifiable using ultra-cold atoms trapped in an optical lattice,
perhaps with some minor modifications to the existing such experimental setups.
","[{""version"":""v1"",""created"":""Wed, 2 Apr 2008 04:40:04 GMT""}]","2008-04-03"
"0804.0288","Narutaka Ozawa","Narutaka Ozawa","An example of a solid von Neumann algebra","4 pages",,,,"math.OA math.FA","http://arxiv.org/licenses/nonexclusive-distrib/1.0/","  We prove that the group-measure-space von Neumann algebra $L^\infty(T^2)
\rtimes SL(2,Z)$ is solid. The proof uses topological amenability of the action
of $SL(2,Z)$ on the Higson corona of $Z^2$.
","[{""version"":""v1"",""created"":""Wed, 2 Apr 2008 05:35:23 GMT""}]","2008-04-03"
"0804.0289","Ryuji Ukai","Mitsuyoshi Yukawa, Ryuji Ukai, Peter van Loock, and Akira Furusawa","Experimental generation of four-mode continuous-variable cluster states","5 pages, 4 figures","Phys. Rev. A 78,012301 (2008)","10.1103/PhysRevA.78.012301",,"quant-ph","http://arxiv.org/licenses/nonexclusive-distrib/1.0/","  Continuous-variable Gaussian cluster states are a potential resource for
universal quantum computation. They can be efficiently and unconditionally
built from sources of squeezed light using beam splitters. Here we report on
the generation of three different kinds of continuous-variable four-mode
cluster states. In our realization, the resulting cluster-type correlations are
such that no corrections other than simple phase-space displacements would be
needed when quantum information propagates through these states. At the same
time, the inevitable imperfections from the finitely squeezed resource states
and from additional thermal noise are minimized, as no antisqueezing components
are left in the cluster states.
","[{""version"":""v1"",""created"":""Wed, 2 Apr 2008 05:27:57 GMT""},{""version"":""v2"",""created"":""Wed, 28 May 2008 09:33:14 GMT""}]","2008-07-04"
"0804.0290","Malay Bandyopadhyay","Malay Bandyopadhyay","Charged oscillator in a heat bath in the presence of a magnetic field &
  third law of thermodynamics","7 Pages & No Figure",,,,"cond-mat.stat-mech cond-mat.other","http://arxiv.org/licenses/nonexclusive-distrib/1.0/","  The quantum thermodynamic behaviour of a charged oscillator in the presence
of a magnetic field and coupled to a heat bath through different coupling
schemes is obtained analytically. It is shown that finite dissipation
substitutes the zero-coupling result of exponential decay of entropy by a power
law behaviour at low temperature. For the coordinate-coordinates coupling
scheme the low temperature explicit results for the case of Ohmic,
exponentially correlated and more generalized heat bath models are derived. In
all the above mentioned cases free energy and entropy vanish linearly with
temperature ($T$) as $T\to 0$ in conformity with Nernst's theorem. It is seen
that coordinate (velocity)-velocities (coordinates) coupling is much more
beneficial than the coordinate-coordinates coupling to ensure third law of
thermodynamics. The case of radiation heat bath shows $T^3$ decay behaviour for
entropy as $T\to 0$. It is observed that at low temperature free energy and
entropy decay faster for the velocity-velocities scheme than any other coupling
schemes. This implies velocity-velocities coupling scheme is the most
advantageous coupling scheme in restoring the third law of thermodynamics. It
is shown that the low temperature thermodynamic functions are independent of
magnetic field for all the above mentioned cases except the without dissipation
case.
","[{""version"":""v1"",""created"":""Wed, 2 Apr 2008 05:29:22 GMT""}]","2008-04-03"
