"0804.0227","Richard Lieu","Richard Lieu","Hubble redshift and the Heisenberg frequency uncertainty: on a coherence
  (or pulse) time signature in extragalactic light","9 pages, 18 equations, 1 figure. Paper overhauled. A much simpler
  interpretation of the CMB Fourier transform in terms of the Uncertainty
  Principle is available",,,,"astro-ph","http://arxiv.org/licenses/nonexclusive-distrib/1.0/","  In any Big Bang cosmology, the frequency $\omega$ of light detected from a
distant source is continuously and linearly changing (usually redshifting) with
elapsed observer's time $\delta t$, because of the expanding Universe. For
small $\delta t$, however, the resulting $\delta\omega$ shift lies beneath the
Heisenberg frequency uncertainty. And since there {\it is} a way of telling
whether such short term shifts really exist, if the answer is affirmative we
will have a means of monitoring radiation to an accuracy level that surpasses
fundamental limitations. More elaborately, had $\omega$ been `frozen' for a
minimum threshold interval before any redshift could take place, i.e. the light
propagated as a smooth but {\it periodic} sequence of wave packets or pulses,
and $\omega$ decreased only from one pulse to the next, one would then be
denied the above forbiddingly precise information about frequency behavior. Yet
because this threshold period is {\it observable}, being $\Delta t \approx
1/\sqrt{\omega_0 H_0} \sim$ 5 -- 15 minute for the cosmic microwave background
(CMB), we can indeed perform a check for consistency between the Hubble Law and
the Uncertainty Principle. If, as most would assume to be the case, the former
either takes effect without violating the latter or not take effect at all, the
presence of this characteristic time signature (periodicity) $\Delta t$ would
represent direct verification of the redshift phenomenon.
","[{""version"":""v1"",""created"":""Tue, 1 Apr 2008 19:44:47 GMT""},{""version"":""v2"",""created"":""Tue, 8 Apr 2008 04:02:48 GMT""},{""version"":""v3"",""created"":""Mon, 19 May 2008 04:47:50 GMT""}]","2008-05-19"
"0804.0228","Tatiana Khabarova","L. A. Maksimov, T. V. Khabarova","Thermal Hall-Senftleben Effect","5 pages, 0 figures",,"10.1134/S1063783408100089",,"cond-mat.other","http://arxiv.org/licenses/nonexclusive-distrib/1.0/","  This paper is devoted to a prediction of new effect - the occurrence of a
heat flow perpendicular both to temperature gradient and magnetic field in
molecular dielectric where rotary degrees of freedom of molecules are defrozen.
The method of the moments considering processes of phonon scattering on
molecules with their rotary condition changing is developed.
","[{""version"":""v1"",""created"":""Tue, 1 Apr 2008 19:50:26 GMT""}]","2009-11-13"
"0804.0229","Stefano Bolognesi","R. Auzzi, S. Bolognesi and M. Shifman","Skyrmions in Yang--Mills Theories with Massless Adjoint Quarks","31 pages, 3 figures","Phys.Rev.D77:125029,2008","10.1103/PhysRevD.77.125029","FTPI-MINN-08/06, UMN-TH-2638/08","hep-th","http://arxiv.org/licenses/nonexclusive-distrib/1.0/","  Dynamics of SU(N_c) Yang--Mills theories with N_f adjoint Weyl fermions is
quite different from that of SU(N_c) gauge theories with fundamental quarks.
The symmetry breaking pattern is SU(N_f) --> SO(N_f). The corresponding sigma
model supports Skyrmions whose microscopic identification is not immediately
clear. We address this issue as well as the issue of the Skyrmion stability.
The case of N_f=2 had been considered previously. Here we discuss N_f >= 3. We
discuss the coupling between the massless Goldstone bosons and massive
composite fermions (with mass O(N_c^0)) from the standpoint of the low-energy
chiral sigma model. We derive the Wess--Zumino--Novikov--Witten term and then
determine Skyrmion statistics. We also determine their fermion number (mod 2)
and observe an abnormal relation between the statistics and the fermion number.
This explains the Skyrmion stability. In addition, we consider another
microscopic theory -- SO(N_c) Yang--Mills with N_f Weyl fermions in the
vectorial representation -- which has the same chiral symmetry breaking pattern
and the same chiral Lagrangian. We discuss distinctive features of these two
scenarios.
","[{""version"":""v1"",""created"":""Tue, 1 Apr 2008 19:50:48 GMT""}]","2008-11-26"
"0804.0230","Danny Fan","Nassif Ghoussoub","A variational theory for monotone vector fields","22 pages. Updated versions --if any-- of this author's papers can be
  downloaded at http://www.birs.ca/~nassif",,,,"math.AP","http://arxiv.org/licenses/nonexclusive-distrib/1.0/","  Monotone vector fields were introduced almost 40 years ago as nonlinear
extensions of positive definite linear operators, but also as natural
extensions of gradients of convex potentials. These vector fields are not
always derived from potentials in the classical sense, and as such they are not
always amenable to the standard methods of the calculus of variations. We
describe here how the selfdual variational calculus developed recently by the
author, provides a variational approach to PDEs and evolution equations driven
by maximal monotone operators. To any such a vector field T on a reflexive
Banach space X, one can associate a convex selfdual Lagrangian L_T on phase
space X x X* that can be seen as a ""potential"" for T, in the sense that the
problem of inverting T reduces to minimizing the convex energy L_T. This
variational approach to maximal monotone operators allows their theory to be
analyzed with the full range of methods --computational or not-- that are
available for variational settings. Standard convex analysis (on phase space)
can then be used to establish many old and new results concerned with the
identification, superposition, and resolution of such vector fields.
","[{""version"":""v1"",""created"":""Tue, 1 Apr 2008 19:54:26 GMT""}]","2008-04-02"
"0804.0231","Maulik K. Parikh","Maulik K. Parikh, Jan Pieter van der Schaar","Not One Bit of de Sitter Information","9 pages, 2 figures, LaTeX, corrected equation 11","JHEP0809:041,2008","10.1088/1126-6708/2008/09/041","IUCAA-09/2008, ITFA-2008-11","hep-th astro-ph gr-qc","http://arxiv.org/licenses/nonexclusive-distrib/1.0/","  We formulate the information paradox in de Sitter space in terms of the
no-cloning principle of quantum mechanics. We show that energy conservation
puts an upper bound on the maximum entropy available to any de Sitter observer.
Combined with a general result on the average information in a quantum
subsystem, this guarantees that an observer in de Sitter space cannot obtain
even a single bit of information from the de Sitter horizon, thereby preventing
any observable violations of the quantum no-cloning principle, in support of
observer complementarity.
","[{""version"":""v1"",""created"":""Wed, 2 Apr 2008 15:50:48 GMT""},{""version"":""v2"",""created"":""Thu, 10 Apr 2008 12:54:24 GMT""}]","2008-11-26"
"0804.0233","Ariel G. Sanchez","Ariel G. Sanchez (1), Carlton M. Baugh (2), Raul Angulo (2) ((1) MPE,
  Garching, Germany, (2) ICC, Durham, UK)","What is the best way to measure baryonic acoustic oscillations?","25 pages, 18 figures; replaced with version accepted for publication
  in MNRAS. Extended analysis by including a model of the correlation function
  based on renormalized perturbation theory","Mon.Not.Roy.Astron.Soc.390:1470-1490,2008","10.1111/j.1365-2966.2008.13769.x",,"astro-ph","http://arxiv.org/licenses/nonexclusive-distrib/1.0/","  Oscillations in the baryon-photon fluid prior to recombination imprint
different signatures on the power spectrum and correlation function of matter
fluctuations. The measurement of these features using galaxy surveys has been
proposed as means to determine the equation of state of the dark energy. The
accuracy required to achieve competitive constraints demands an extremely good
understanding of systematic effects which change the baryonic acoustic
oscillation (BAO) imprint. We use 50 very large volume N-body simulations to
investigate the BAO signature in the two-point correlation function. The
location of the BAO bump does not correspond to the sound horizon scale at the
level of accuracy required by future measurements, even before any dynamical or
statistical effects are considered. Careful modelling of the correlation
function is therefore required to extract the cosmological information encoded
on large scales. We find that the correlation function is less affected by
scale dependent effects than the power spectrum. We show that a model for the
correlation function proposed by Crocce & Scoccimarro (2008), based on
renormalised perturbation theory, gives an essentially unbiased measurement of
the dark energy equation of state. This means that information from the large
scale shape of the correlation function, in addition to the form of the BAO
peak, can be used to provide robust constraints on cosmological parameters. The
correlation function therefore provides a better constraint on the distance
scale (~50% smaller errors with no systematic bias) than the more conservative
approach required when using the power spectrum (i.e. which requires amplitude
and long wavelength shape information to be discarded).
","[{""version"":""v1"",""created"":""Wed, 2 Apr 2008 10:22:51 GMT""},{""version"":""v2"",""created"":""Wed, 30 Jul 2008 08:46:26 GMT""}]","2009-11-13"
"0804.0234","Valery Shchesnovich","V. S. Shchesnovich and M. Trippenbach","Fock-space quantum particle approach for the two-mode boson model
  describing BEC trapped in a double-well potential","14 pages, 13 figures",,,,"cond-mat.other nlin.CD quant-ph","http://arxiv.org/licenses/nonexclusive-distrib/1.0/","  We develop the Fock-space many-body quantum approach for large number of
bosons, when the bosons occupy significantly only few modes. The approach is
based on an analogy with the dynamics of a single particle of either positive
or negative mass in a quantum potential, where the inverse number of bosons
plays the role of Planck constant. As application of the method we consider the
Bose-Einstein condensate in a double-well trap. The ground state of positive
mass particle corresponds to the mean-field fixed point of lower energy, while
that of negative mass to the excited fixed point. In the case of attractive BEC
above the threshold for symmetry breaking, the ground state is a cat state and
we relate this fact to the double-well shape of the quantum potential for the
positive mass quantum particle. The tunneling energy splitting between the
local Fock states of the cat state is shown to be extremely small for the
nonlinearity parameter just above the critical value and exponentially
decreasing with the number of atoms. In the repulsive case, the phase locked
($\pi$-phase) macroscopic quantum self-trapping of BEC is related to the
double-well structure of the potential for the negative mass quantum particle.
We also analyze the running phase macroscopic quantum self-trapping state and
show that it is subject to quantum collapses and revivals. Moreover, the
quantum dynamics just before the first collapse of the running phase shows
exponential growth of dispersion of the quantum phase distribution which may
explain the growth of the phase fluctuations seen in the experiment on the
macroscopic quantum self-trapping.
","[{""version"":""v1"",""created"":""Tue, 1 Apr 2008 20:02:33 GMT""}]","2008-10-08"
"0804.0235","Jong-Hak Woo","J.-H. Woo, T. Treu, M. A. Malkan, R. Blandford","Cosmic Evolution of Black Holes and Spheroids. III. The M-sigma relation
  in the last six billion years","ApJ in press, 5 pages, 3 figures",,"10.1086/588804",,"astro-ph","http://arxiv.org/licenses/nonexclusive-distrib/1.0/","  We measure the evolution of the correlation between black hole mass and host
spheroid velocity dispersion over the last 6 billion years, by studying three
carefully selected samples of active galaxies at z=0.57, z=0.36 and z<0.1. For
all three samples, virial black hole masses are consistently estimated using
the line dispersion of H$\beta$ and the continuum luminosity at 5100A or Halpha
line luminosity, based on our cross calibration of the broad line region
size-luminosity relation. For the z=0.57 sample, new stellar velocity
dispersions are measured from high signal-to-noise ratio spectra obtained at
the Keck Telescope, while for the two lower redshift samples they are compiled
from previous works. Extending our previous result at z=0.36, we find an offset
from the local relation, suggesting that for fixed M_{BH}, distant spheroids
have on average smaller velocity dispersions than local ones. The measured
offset at z=0.57 is d log sigma_{*}=0.12 \pm 0.05\pm 0.06 (or d log M_{BH}=0.50
\pm 0.22\pm 0.25), i.e. d log M_{BH} = (3.1\pm1.5)\log (1+z) + 0.05\pm0.21.
This is inconsistent with a tight and non-evolving universal M-sigma relation
at the 95%CL
","[{""version"":""v1"",""created"":""Tue, 1 Apr 2008 20:02:58 GMT""},{""version"":""v2"",""created"":""Thu, 3 Apr 2008 03:01:57 GMT""}]","2009-11-13"
"0804.0236","Sebastian H\""onig","Sebastian F. Hoenig, M. Almudena Prieto, Thomas Beckert","High-Spatial Resolution SED of NGC 1068 from Near-IR to Radio.
  Disentangling the thermal and non-thermal contributions","8 pages, 3 figures; accepted by A&A",,"10.1051/0004-6361:200809606",,"astro-ph","http://arxiv.org/licenses/nonexclusive-distrib/1.0/","  We investigate the ideas that a sizable fraction of the interferometrically
unresolved infrared emission of the nucleus of NGC 1068 might originate from
other processes than thermal dust emission from the torus. We examine the
contribution of free-free or synchrotron emissions to the central mid- and
near-IR parsec-scale emitting region of NGC 1068. Each mechanism is constrained
with parsec scale radio data available for NGC 1068 in the 10^9 - 10^11 Hz
regime, and compared to the highest-resolution interferometric data available
in the mid-infrared. It is shown that the unresolved emission in the
interferometric observation (<~1pc) is still dominatedd by dust emission and
not by contributions from synchrotron or free-free emission. As recent studies
suggest, the interferometric observations prefer a clumpy structure of the dust
distribution. Extrapolation of the radio free-free or synchrotron emission to
the IR indicates that their contribution is <20% even for the unresolved
fraction of the interferometric flux. The slope of the available radio data is
consistent with a power law exponent alpha = 0.29 +/- 0.07 which we interprete
in terms of either free-free emission or synchrotron radiation from
quasi-monochromatic electrons. We apply emission models for both mechanisms in
order to obtain physical parameters. (abridged)
","[{""version"":""v1"",""created"":""Tue, 1 Apr 2008 20:07:20 GMT""}]","2008-05-26"
"0804.0237","Jay Farihi","J. Farihi, E. E. Becklin, B. Zuckerman","Spitzer IRAC Observations of White Dwarfs. II. Massive Planetary and
  Cold Brown Dwarf Companions to Young and Old Degenerates","41 pages, accepted to ApJ",,"10.1086/588726",,"astro-ph","http://arxiv.org/licenses/nonexclusive-distrib/1.0/","  This paper presents a sensitive and comprehensive IRAC 3-8 $\mu$m photometric
survey of white dwarfs for companions in the planetary mass regime with
temperatures cooler than the known T dwarfs. The search focuses on descendents
of intermediate mass stars with $M\ga3$ $M_{\odot}$ whose inner, few hundred AU
regions cannot be probed effectively for massive planets and brown dwarfs by
any alternative existing method. Furthermore, examination for mid-infrared
excess explores an extensive range of orbital semimajor axes, including the
intermediate 5-50 AU range poorly covered and incompletely accessible by other
techniques at main sequence or evolved stars. Three samples of white dwarfs are
chosen which together represent relatively young as well as older populations
of stars: 9 open cluster white dwarfs, 22 high mass field white dwarfs, and 17
metal-rich field white dwarfs. In particular, these targets include: 7 Hyads
and 4 field white dwarfs of similar age; 1 Pleiad and 19 field white dwarfs of
similar age; van Maanen 2 and 16 similarly metal-rich white dwarfs with ages
between 1 and 7 Gyr. No substellar companion candidates were identified at any
star. By demanding a 15% minimum photometric excess at 4.5 $\mu$m to indicate a
companion detection, upper limits in the planetary mass regime are established
at 34 of the sample white dwarfs, 20 of which have limits below 10 $M_{\rm J}$
according to substellar cooling models. Specifically, limits below the minimum
mass for deuterium burning are established at all Pleiades and Hyadeswhite
dwarfs, as well as similarly young field white dwarfs, half a dozen of which
receive limits at or below 5 $M_{\rm J}$. Two IRAC epochs at vMa 2 rule out
$T\ga200$ K proper motion companions within 1200 AU.
","[{""version"":""v1"",""created"":""Tue, 1 Apr 2008 20:03:24 GMT""},{""version"":""v2"",""created"":""Fri, 18 Apr 2008 12:38:49 GMT""},{""version"":""v3"",""created"":""Tue, 13 May 2008 14:23:22 GMT""}]","2009-11-13"
"0804.0238","Rubens Reis","R.C. Reis, A.C. Fabian, R. Ross, G. Miniutti, J.M. Miller and C.
  Reynolds","A systematic look at the Very High and Low/Hard state of GX 339-4:
  Constraining the black hole spin with a new reflection model","10 pages, 10 figures, accepted for publication in MNRAS 17/04/08",,"10.1111/j.1365-2966.2008.13358.x",,"astro-ph","http://arxiv.org/licenses/nonexclusive-distrib/1.0/","  We present a systematic study of GX 339-4 in both its very high and low hard
states from simultaneous observations made with XMM-Newton and RXTE in 2002 and
2004. The X-ray spectra of both these extreme states exhibit strong reflection
signatures, with a broad, skewed Fe-Kalpha line clearly visible above the
continuum. Using a newly developed, self-consistent reflection model which
implicitly includes the blackbody radiation of the disc as well as the effect
of Comptonisation, blurred with a relativistic line function, we were able to
infer the spin parameter of GX 339-4 to be 0.935 +/- 0.01 (statistical) +/-
0.01 (systematic) at 90 per cent confidence. We find that both states are
consistent with an ionised thin accretion disc extending to the innermost
stable circular orbit around the rapidly spinning black hole.
","[{""version"":""v1"",""created"":""Tue, 1 Apr 2008 20:04:55 GMT""},{""version"":""v2"",""created"":""Tue, 22 Apr 2008 17:02:10 GMT""}]","2009-11-13"
"0804.0239","Christian D. Ott","Christian D. Ott (1), Adam Burrows (2,1), Luc Dessart (2,1), Eli Livne
  (3) ((1) Steward Observatory, The University of Arizona, (2) Department of
  Astrophysical Sciences, Princeton University, (3) Racah Institute of Physics,
  Hebrew University)","2D Multi-Angle, Multi-Group Neutrino Radiation-Hydrodynamic Simulations
  of Postbounce Supernova Cores","20 pages, 21 figures. Minor revisions. Accepted for publication in
  ApJ. A version with high-resolution figures may be obtained from
  http://www.stellarcollapse.org/papers/Ott_et_al2008_multi_angle.pdf","Astrophys.J.685:1069-1088,2008","10.1086/591440",,"astro-ph","http://arxiv.org/licenses/nonexclusive-distrib/1.0/","  We perform axisymmetric (2D) multi-angle, multi-group neutrino
radiation-hydrodynamic calculations of the postbounce phase of core-collapse
supernovae using a genuinely 2D discrete-ordinate (S_n) method. We follow the
long-term postbounce evolution of the cores of one nonrotating and one
rapidly-rotating 20-solar-mass stellar model for ~400 milliseconds from 160 ms
to ~550 ms after bounce. We present a multi-D analysis of the multi-angle
neutrino radiation fields and compare in detail with counterpart simulations
carried out in the 2D multi-group flux-limited diffusion (MGFLD) approximation
to neutrino transport. We find that 2D multi-angle transport is superior in
capturing the global and local radiation-field variations associated with
rotation-induced and SASI-induced aspherical hydrodynamic configurations. In
the rotating model, multi-angle transport predicts much larger asymptotic
neutrino flux asymmetries with pole to equator ratios of up to ~2.5, while
MGFLD tends to sphericize the radiation fields already in the optically
semi-transparent postshock regions. Along the poles, the multi-angle
calculation predicts a dramatic enhancement of the neutrino heating by up to a
factor of 3, which alters the postbounce evolution and results in greater polar
shock radii and an earlier onset of the initially rotationally weakened SASI.
In the nonrotating model, differences between multi-angle and MGFLD
calculations remain small at early times when the postshock region does not
depart significantly from spherical symmetry. At later times, however, the
growing SASI leads to large-scale asymmetries and the multi-angle calculation
predicts up to 30% higher average integral neutrino energy deposition rates
than MGFLD.
","[{""version"":""v1"",""created"":""Tue, 1 Apr 2008 20:07:14 GMT""},{""version"":""v2"",""created"":""Wed, 25 Jun 2008 08:50:08 GMT""}]","2010-11-11"
"0804.0241","Cecilia Cormick","Cecilia Cormick, Juan Pablo Paz","Decoherence of Bell states by local interactions with a dynamic spin
  environment","Replaced with published version (minor changes). 8 pages, 7 figures.
  Continues work of arXiv:0709.2643","Phys. Rev. A 78, 012357 (2008)","10.1103/PhysRevA.78.012357",,"quant-ph","http://arxiv.org/licenses/nonexclusive-distrib/1.0/","  We study the evolution of a system of two qubits, each of which interacts
locally with a spin chain with nontrivial internal Hamiltonian. We present an
exact solution to this problem and analyze the dependence of decoherence on the
distance between the interaction sites. In the strong coupling regime we find
that decoherence increases with increasing distance. In the weak coupling
regime the dependence of decoherence with distance is not generic (i.e., it
varies according to the initial state). Decoherence becomes independent of
distance when the latter is over a saturation length $l$. Numerical results for
the Ising chain suggest that the saturation scale is related to the correlation
length $\xi$. For strong coupling we display evidence of the existence of
non--Markovian effects (such as environment--induced interactions between the
qubits). As a consequence the system can undergo a quasiperiodic sequence of
``sudden deaths and revivals'' of entanglement, with a time scale related to
the distance between qubits.
","[{""version"":""v1"",""created"":""Tue, 1 Apr 2008 20:27:53 GMT""},{""version"":""v2"",""created"":""Mon, 15 Sep 2008 13:29:10 GMT""}]","2009-11-13"
"0804.0242","Sergey Natanzon","S.M. Natanzon","Disk single Hurwitz numbers","9 pages",,,,"math.GT math.AG math.CO","http://arxiv.org/licenses/nonexclusive-distrib/1.0/","  It is investigated Hurwitz numbers, that correspond to covering of disk with
single non-simple boundary critical value. It is found differential equations,
that describe a generating function for these numbers.
","[{""version"":""v1"",""created"":""Tue, 1 Apr 2008 20:19:45 GMT""},{""version"":""v2"",""created"":""Sun, 25 Oct 2009 13:26:57 GMT""}]","2009-10-25"
"0804.0243","Marco Merkli","M. Merkli, G.P. Berman, I.M. Sigal","Dynamics of Collective Decoherence and Thermalization",,,"10.1016/j.aop.2008.07.004",,"math-ph math.MP quant-ph","http://arxiv.org/licenses/nonexclusive-distrib/1.0/","  We analyze the dynamics of N interacting spins (quantum register)
collectively coupled to a thermal environment. Each spin experiences the same
environment interaction, consisting of an energy conserving and an energy
exchange part.
  We find the decay rates of the reduced density matrix elements in the energy
basis. We show that if the spins do not interact among each other, then the
fastest decay rates of off-diagonal matrix elements induced by the energy
conserving interaction is of order N^2, while that one induced by the energy
exchange interaction is of the order N only. Moreover, the diagonal matrix
elements approach their limiting values at a rate independent of N.
  For a general spin system the decay rates depend in a rather complicated (but
explicit) way on the size N and the interaction between the spins.
  Our method is based on a dynamical quantum resonance theory valid for small,
fixed values of the couplings. We do not make Markov-, Born- or weak coupling
(van Hove) approximations.
","[{""version"":""v1"",""created"":""Tue, 1 Apr 2008 20:21:03 GMT""}]","2009-11-13"
