"0804.0011","Matthew Hastings","M. B. Hastings, A. W. Harrow","Classical and Quantum Tensor Product Expanders","18 pages. v2 fixed proof and slightly changed statement of Lemma 1.
  v3 clarified discussion of state randomization, non-Hermitian expanders, and
  various proof details. Journal version","QIC 9, 336 (2009).",,,"quant-ph","http://arxiv.org/licenses/nonexclusive-distrib/1.0/","  We introduce the concept of quantum tensor product expanders. These are
expanders that act on several copies of a given system, where the Kraus
operators are tensor products of the Kraus operator on a single system. We
begin with the classical case, and show that a classical two-copy expander can
be used to produce a quantum expander. We then discuss the quantum case and
give applications to the Solovay-Kitaev problem. We give probabilistic
constructions in both classical and quantum cases, giving tight bounds on the
expectation value of the largest nontrivial eigenvalue in the quantum case.
","[{""version"":""v1"",""created"":""Tue, 1 Apr 2008 17:08:24 GMT""},{""version"":""v2"",""created"":""Thu, 13 Nov 2008 21:04:47 GMT""},{""version"":""v3"",""created"":""Tue, 16 Dec 2008 21:00:41 GMT""}]","2009-04-14"
"0804.0015","Ivo de Medeiros Varzielas","I. de Medeiros Varzielas","Neutrino tri-bi-maximal mixing through sequential dominance","6 pages, 3 diagrams",,,,"hep-ph","http://arxiv.org/licenses/nonexclusive-distrib/1.0/","  We consider an existing framework of models where the neutrino Dirac and
Majorana mass terms are related, and clarify how the mass structures interact
through the type I seesaw mechanism, producing exact tri-bi-maximal mixing for
the effective neutrinos in the limit of strong Majorana mass hierarchy
(sequential dominance). In order to better illustrate this, we draw the seesaw
diagrams expanded to show the relevant details, discuss an underlying symmetry
that must be preserved by the neutrino mass terms, and diagonalise the
effective neutrino mass matrix corresponding to the sequential dominance limit.
","[{""version"":""v1"",""created"":""Tue, 1 Apr 2008 17:09:25 GMT""}]","2008-04-02"
"0804.0016","Max Tegmark","Flora Lopis (MIT), Max Tegmark (MIT)","Relativity Revisited","References corrected. 1 figure, 7 equations; YouTube version
  available at http://www.youtube.com/watch?v=5PkLLXhONvQ",,,,"astro-ph gr-qc","http://arxiv.org/licenses/nonexclusive-distrib/1.0/","  Was Einstein wrong? This paper provides a detailed technical review of
Einstein's special and general relativity from an astrophysical perspective,
including the historical development of the theories, experimental tests,
modern applications to black holes, cosmology and parallel universes, and last
but not least, novel ways of expressing their seven most important equations.
","[{""version"":""v1"",""created"":""Tue, 1 Apr 2008 17:41:34 GMT""},{""version"":""v2"",""created"":""Wed, 2 Apr 2008 05:48:36 GMT""},{""version"":""v3"",""created"":""Mon, 11 May 2009 14:10:22 GMT""}]","2009-05-11"
"0804.0028","David P. Blecher","David P. Blecher and Benton L. Duncan","Nuclearity-related properties for nonselfadjoint algebras","19 pages",,,,"math.OA math.FA","http://arxiv.org/licenses/nonexclusive-distrib/1.0/","  In analogy with the C*-algebra theory, we study variants appropriate to
nonselfadjoint algebras of nuclearity, the local lifting property, exactness,
and the weak expectation property. In addition, we study the relationships
between these notions, and how they are connected with the classical C*-algebra
theory through the use of C*-algebras generated by the algebra.
","[{""version"":""v1"",""created"":""Tue, 1 Apr 2008 16:16:49 GMT""}]","2008-04-02"
"0804.0037","Jonathan Hackett","Sundance Bilson-Thompson, Jonathan Hackett, Lou Kauffman and Lee
  Smolin","Particle Identifications from Symmetries of Braided Ribbon Network
  Invariants","9 pages, 7 figures",,,,"hep-th","http://arxiv.org/licenses/nonexclusive-distrib/1.0/","  We develop the idea that the particles of the standard model may arise from
excitations of quantum geometry. A previously proposed topological model of
preons is developed so that it incorporates an unbounded number of generations.
A condition is also found on quantum gravity dynamics necessary for the
interactions of the standard model to emerge.
","[{""version"":""v1"",""created"":""Tue, 1 Apr 2008 16:46:20 GMT""}]","2008-04-02"
"0804.0044","Wei Liu","Wei Liu","Numerical Study of the Magnetorotational Instability in Princeton MRI
  Experiment","22 pages, 12 figures, ApJ 684, 515 (2008). Minor changes according to
  referee's report",,"10.1086/590366",,"astro-ph","http://creativecommons.org/licenses/by-nc-sa/3.0/","  In preparation for an experimental study of magnetorotational instability
(MRI) in liquid metal, we present non-ideal axisymmetric magnetohydrodynamic
simulations of the nonlinear evolution of MRI in the experimental geometry. The
simulations adopt fully insulating boundary conditions. No-slip conditions are
imposed at the cylinders. A clear linear phase is observed with reduced linear
growth rate. MRI results in an inflowing ""jet"" near the midplane and enhances
the angular momentum transport at saturation.
","[{""version"":""v1"",""created"":""Tue, 1 Apr 2008 19:10:09 GMT""},{""version"":""v2"",""created"":""Fri, 22 Aug 2008 17:42:37 GMT""}]","2009-11-13"
"0804.0048","Albet\~a Mafra","A. C. Mafra, B. Scardua","Transversely Lie holomorphic foliations on projective spaces",,,,,"math.CV math.DS","http://arxiv.org/licenses/nonexclusive-distrib/1.0/","  We prove that a one-dimensional foliation with generic singularities on a
projective space, exhibiting a Lie group transverse structure in the complement
of some codimension one algebraic subset is logarithmic, i.e., it is the
intersection of codimension one foliations given by closed one-forms with
simple poles. If there is only one singularity in a suitable affine space, then
the foliation is induced by a linear diagonal vector field.
","[{""version"":""v1"",""created"":""Tue, 1 Apr 2008 19:28:11 GMT""}]","2008-04-02"
"0804.0060","Cheng Chin","Chen-Lung Hung, Xibo Zhang, Nathan Gemelke, Cheng Chin","Fast, Runaway Evaporative Cooling to Bose-Einstein Condensation in
  Optical Traps",,"Physical Review A 78, 011604(R) (2008)","10.1103/PhysRevA.78.011604",,"cond-mat.other","http://arxiv.org/licenses/nonexclusive-distrib/1.0/","  We demonstrate a simple scheme to achieve fast, runaway evaporative cooling
of optically trapped atoms by tilting the optical potential with a magnetic
field gradient. Runaway evaporation is possible in this trap geometry due to
the weak dependence of vibration frequencies on trap depth, which preserves
atomic density during the evaporation process. Using this scheme, we show that
Bose-Einstein condensation with ~10^5 cesium atoms can be realized in 2~4 s of
forced evaporation. The evaporation speed and energetics are consistent with
the three-dimensional evaporation picture, despite the fact that atoms can only
leave the trap in the direction of tilt.
","[{""version"":""v1"",""created"":""Tue, 1 Apr 2008 18:16:25 GMT""}]","2009-05-15"
"0804.0075","Viktor Begun","V. V. Begun, M. Ga\'zdzicki, M. I. Gorenstein","Power Law in Micro-Canonical Ensemble with Scaling Volume Fluctuations",,"Phys.Rev.C78:024904,2008","10.1103/PhysRevC.78.024904",,"hep-ph","http://arxiv.org/licenses/nonexclusive-distrib/1.0/","  Volume fluctuations are introduced in a statistical modelling of relativistic
particle collisions. The micro-canonical ensemble is used, and the volume
fluctuations are assumed to have the specific scaling properties. This leads to
the KNO scaling of the particle multiplicity distributions as measured in p+p
interactions. A striking prediction of the model is a power law form of the
single particle momentum spectrum at high momenta. Moreover, the mean
multiplicity of heavy particles also decreases as a function of the particle
mass according to a power law. Finally, it is shown that the dependence of the
momentum spectrum on the particle mass and momentum reduces to the dependence
on the particle energy. These results resemble the properties of particle
production in collisions of high energy particles.
","[{""version"":""v1"",""created"":""Tue, 1 Apr 2008 18:38:58 GMT""},{""version"":""v2"",""created"":""Wed, 16 Apr 2008 15:13:06 GMT""},{""version"":""v3"",""created"":""Mon, 11 Aug 2008 09:45:52 GMT""}]","2008-11-26"
"0804.0081","Thomas G. Rizzo","Thomas G. Rizzo","Z' Coupling Information from the LHeC","16 pages, 9 figs, minor modifications","Phys.Rev.D77:115016,2008","10.1103/PhysRevD.77.115016","SLAC-PUB-13187","hep-ph","http://arxiv.org/licenses/nonexclusive-distrib/1.0/","  If the LHC discovers a $Z'$-like state the extraction of its couplings to the
particles of the Standard Model becomes mandatory in order to determine the
nature of the underlying new physics theory. It has been well-known for some
time that the direct measurements performed at the LHC in the Drell-Yan channel
cannot determine these parameters uniquely in a model-independent manner even
if large integrated luminosities, $\sim 100 fb^{-1}$, become available and the
$Z'$ is relatively light $\lsim 1.5$ TeV. Here we examine the possibility that
a proposed $e_{L,R}^\pm p$ collider upgrade at the LHC, the LHeC, with $\sqrt
s=1.5-2$ TeV could be helpful with such coupling determinations in the years
before a Linear Collider is constructed. We show that the polarization and
charge asymmetries constructed from the cross sections for these processes can
be useful in this regard depending upon the specific values of the particular
$Z'$ model parameters.
","[{""version"":""v1"",""created"":""Tue, 1 Apr 2008 18:21:27 GMT""},{""version"":""v2"",""created"":""Thu, 10 Apr 2008 19:00:34 GMT""}]","2008-11-26"
"0804.0112","Melissa Macasieb L","Melissa L. Macasieb and Thomas W. Mattman","Commensurability classes of (-2,3,n) pretzel knot complements","15 pages, 1 figure","Algebr. Geom. Topol. 8 (2008) 1833-1853","10.2140/agt.2008.8.1833",,"math.GT","http://arxiv.org/licenses/nonexclusive-distrib/1.0/","  Let K be a hyperbolic (-2,3,n) pretzel knot and M = S^3 K its complement. For
these knots, we verify a conjecture of Reid and Walsh: there are at most three
knot complements in the commensurability class of M. Indeed, if n \neq 7, we
show that M is the unique knot complement in its class. We include examples to
illustrate how our methods apply to a broad class of Montesinos knots.
","[{""version"":""v1"",""created"":""Tue, 1 Apr 2008 18:25:40 GMT""}]","2014-10-01"
"0804.0125","Hans-Reinhard Mueller","H.-R. M\""uller, V. Florinski, J. Heerikhuisen, V.V. Izmodenov, K.
  Scherer, D. Alexashov, H.-J. Fahr","Comparing various multi-component global heliosphere models","10 pages, 4 figures, submitted to a special section at A&A of an ISSI
  team ""Determination of the physical Hydrogen parameters of the LIC from
  within the Heliosphere""","Astr. Astrophys. 491, 43-51 (2008)","10.1051/0004-6361:20078708",,"astro-ph physics.space-ph","http://arxiv.org/licenses/nonexclusive-distrib/1.0/","  Modeling of the global heliosphere seeks to investigate the interaction of
the solar wind with the partially ionized local interstellar medium. Models
that treat neutral hydrogen self-consistently and in great detail, together
with the plasma, but that neglect magnetic fields, constitute a sub-category
within global heliospheric models. There are several different modeling
strategies used for this sub-category in the literature. Differences and
commonalities in the modeling results from different strategies are pointed
out. Plasma-only models and fully self-consistent models from four research
groups, for which the neutral species is modeled with either one, three, or
four fluids, or else kinetically, are run with the same boundary parameters and
equations. They are compared to each other with respect to the locations of key
heliospheric boundary locations and with respect to the neutral hydrogen
content throughout the heliosphere. In many respects, the models' predictions
are similar. In particular, the locations of the termination shock agree to
within 7% in the nose direction and to within 14% in the downwind direction.
The nose locations of the heliopause agree to within 5%. The filtration of
neutral hydrogen from the interstellar medium into the inner heliosphere,
however, is model dependent, as are other neutral results including the
hydrogen wall. These differences are closely linked to the strength of the
interstellar bow shock. The comparison also underlines that it is critical to
include neutral hydrogen into global heliospheric models.
","[{""version"":""v1"",""created"":""Tue, 1 Apr 2008 17:56:18 GMT""}]","2008-11-01"
"0804.0146","Alex Koshelev","A. E. Koshelev","Alternating dynamic state in intrinsic Josephson-junction stacks
  self-generated by internal resonance","4 pages, 3 figures","Phys. Rev. B 78, 174509 (2008)","10.1103/PhysRevB.78.174509",,"cond-mat.supr-con cond-mat.mes-hall cond-mat.mtrl-sci","http://arxiv.org/licenses/nonexclusive-distrib/1.0/","  Intrinsic Josephson-junction stacks realized in high-temperature
superconductors provide a very attractive base for developing coherent sources
of electromagnetic radiation in the terahertz frequency range. A promising way
to synchronize phase oscillations in all the junctions is to excite an internal
cavity resonance. We demonstrate that this resonance promotes the formation of
an alternating coherent state, in which the system spontaneously splits into
two subsystems with different phase-oscillation patterns. There is a static
phase shift between the oscillations in the two subsystems which changes from 0
to $2\pi$ in a narrow region near the stack center. The oscillating electric
and magnetic fields are almost homogeneous in all the junctions. The formation
of this state promotes efficient pumping of the energy into the cavity
resonance leading to strong resonance features in the current-voltage
dependence.
","[{""version"":""v1"",""created"":""Tue, 1 Apr 2008 19:33:59 GMT""}]","2011-04-05"
"0804.0148","Robert Dunn","R. J. H. Dunn, R. P. Fender, E. G. Koerding, C. Cabanac (University of
  Southampton), T. Belloni (INAF - Osservatorio Astronomico di Brera)","Studying the X-ray hysteresis in GX 339-4: the disc and iron line over
  one decade","Accepted for publication in MNRAS, 20 pages, 17 figures. For high-res
  version see http://www.astro.soton.ac.uk/~r.j.dunn/publications.html",,"10.1111/j.1365-2966.2008.13258.x",,"astro-ph","http://arxiv.org/licenses/nonexclusive-distrib/1.0/","  We report on a comprehensive and consistent investigation into the X-ray
emission from GX 339-4. All public observations in the 11 year RXTE archive
were analysed. Three different types of model - single powerlaw, broken
powerlaw and a disc + powerlaw - were fitted to investigate the evolution of
the disc, along with a fixed gaussian component at 6.4 keV to investigate any
iron line in the spectrum. We show that the relative variation in flux and
X-ray colour between the two best sampled outbursts are very similar. The decay
of the disc temperature during the outburst is clearly seen in the soft state.
The expected decay is S_Disc \propto T^4; we measure T^4.75\pm0.23. This
implies that the inner disc radius is approximately constant in the soft state.
We also show a significant anti-correlation between the iron line significant
width and the X-ray flux in the soft state while in the hard state the EW is
independent of the flux. This results in hysteresis in the relation between
X-ray flux and both line flux and EW. To compare the X-ray binary outburst to
the behaviour seen in AGN, we construct a Disc Fraction Luminosity Diagram for
GX 339-4, the first for an X-ray binary. The shape qualitatively matches that
produced for AGN. Linking this with the radio emission from GX 339-4 the change
in radio spectrum between the disc and power-law dominated states is clearly
visible.
","[{""version"":""v1"",""created"":""Tue, 1 Apr 2008 17:10:52 GMT""}]","2009-11-13"
"0804.0157","Peter G. Doyle","Peter G. Doyle and Dan Rockmore","Riffles, ruffles, and the turning algebra","Version dated 13 November 1995; GNU FDL",,,,"math.CO","http://arxiv.org/licenses/nonexclusive-distrib/1.0/","  The rising algebra is a subalgebra of the group algebra of the symmetric
group S_n, gotten by lumping together permutations having the same number of
rising sequences. This well-known algebra arises naturally when studying riffle
shuffles. Here we introduce a number of other subalgebras that arise naturally
when studying `ruffles', which are like riffles except that after cutting the
deck you turn over the bunch of cards that were on the bottom.
  This orphaned draft offers no context or motivation, and uses idiosyncratic
notation and terminology that `seemed like a good idea at the time'. We're
making it available because it has been cited in this form.
","[{""version"":""v1"",""created"":""Tue, 1 Apr 2008 17:28:10 GMT""}]","2008-04-02"
"0804.0165","Jim Hague","George A. Baker and James P. Hague","Rise of the centrist: from binary to continuous opinion dynamics",,"International Journal of Modern Physics C (2008) vol. 19,
  pp1459-1475","10.1142/S0129183108013023",,"physics.soc-ph","http://arxiv.org/licenses/nonexclusive-distrib/1.0/","  We propose a model that extends the binary ``united we stand, divided we
fall'' opinion dynamics of Sznajd-Weron to handle continuous and multi-state
discrete opinions. Disagreement dynamics are often ignored in continuous
extensions of the binary rules, so we make the most symmetric continuum
extension of the binary model that can treat the consequences of agreement
(debate) and disagreement (confrontation) within a population of agents. We use
the continuum extension as an opportunity to develop rules for persistence of
opinion (memory). Rules governing the propagation of centrist views are also
examined. Monte Carlo simulations are carried out. We find that both memory
effects and the type of centrist significantly modify the variance of average
opinions in the large timescale limits of the models. Finally, we describe the
limit of applicability for Sznajd-Weron's model of binary opinions as the
continuum limit is approached. By comparing Monte Carlo results and long
time-step limits, we find that the opinion dynamics of binary models are
significantly different to those where agents are permitted more than 3
opinions.
","[{""version"":""v1"",""created"":""Tue, 1 Apr 2008 16:50:04 GMT""}]","2008-11-12"
"0804.0192","Sylvestre Lacour","S. Lacour, S. Meimon, E. Thiebaut, G. Perrin, T. Verhoelst, E.
  Pedretti, P. A. Schuller, L. Mugnier, J. Monnier, J.P. Berger, X. Haubois, A.
  Poncelet, G. Le Besnerais, K. Eriksson, R. Millan-Gabet, M. Lacasse, W. Traub","The limb-darkened Arcturus; Imaging with the IOTA/IONIC interferometer","12 pages, 12 figures, accepted in A&A",,"10.1051/0004-6361:200809611",,"astro-ph","http://arxiv.org/licenses/nonexclusive-distrib/1.0/","  This paper is an H band interferometric examination of Arcturus, a star
frequently used as a spatial and spectral calibrator. Using the IOTA 3
telescope interferometer, we performed spectro-interferometric observation
(R~35) of Arcturus. Atmospheric models and prescriptions were fitted to the
data to derive the brightness distribution of the photosphere. Image
reconstruction was also obtained using two software algorithms: Wisard and
Mira. An achromatic power law proved to be a good model of the brightness
distribution, with a limb darkening compatible with the one derived from
atmospheric model simulations using our Marcs model. A Rosseland diameter of
21.05+/-0.21 was derived, corresponding to an effective temperature of
T_eff=4295+/-26 K. No companion was detected from the closure phases, with an
upper limit on the brightness ratio of 8e-4 at 1AU. Dynamic range at such
distance from the photosphere was established at 1.5e-4 (1sigma rms). An upper
limit of 1.7e-3 was also derived for the level of brightness asymmetries
present on the photosphere.
","[{""version"":""v1"",""created"":""Tue, 1 Apr 2008 17:09:39 GMT""}]","2009-11-13"
"0804.0203","S. Descotes-Genon","S\'ebastien Descotes-Genon and Alain Le Yaouanc (Orsay, LPT)","Parametrisations of the D -> K l nu form factor and the determination of
  \hat{g}","16 pages, 2 figures. A few references added. Accepted for publication
  in JoPG","J.Phys.G35:115005,2008","10.1088/0954-3899/35/11/115005","LPT-ORSAY/08-19","hep-ph hep-ex","http://arxiv.org/licenses/nonexclusive-distrib/1.0/","  The vector form factor f_+(t) of the semileptonic decay D -> K l nu, measured
recently with a high accuracy, can be used to determine the strong coupling
constant g_{D_s^* D K}. The latter is related to the normalised coupling
\hat{g} releveant in heavy-meson chiral perturbation theory. This determination
relies on the estimation of the residue of the form factor at the D_s^* pole
and thus on an extrapolation of the form factor in the unphysical region
(m_D-m_K)^2<t<(m_D+m_K)^2. We test this extrapolation for several
parametrisations of the form factors by determining the value of \hat{g}, whose
value can be compared to other (experimental and theoretical) estimates.
Several unsophisticated parametrisations, differing by the amount of physical
information that they embed, are shown to pass this test. An apparently more
elaborated parametrisation of form factors, the so-called z-expansion, is at
variance with the other models, and we point out some significant shortcomings
of this parametrisation for the problem under consideration.
","[{""version"":""v1"",""created"":""Tue, 1 Apr 2008 16:07:27 GMT""},{""version"":""v2"",""created"":""Mon, 25 Aug 2008 10:27:43 GMT""}]","2008-11-26"
"0804.0204","Ewa L. Lokas","Ewa L. Lokas, Jaroslaw Klimentowski, Stelios Kazantzidis, Lucio Mayer","The anatomy of Leo I: how tidal tails affect the kinematics","10 pages, 10 figures, revised version accepted for publication in
  MNRAS","Mon.Not.Roy.Astron.Soc. 390 (2008) 625-634","10.1111/j.1365-2966.2008.13661.x",,"astro-ph","http://arxiv.org/licenses/nonexclusive-distrib/1.0/","  We model the recently published kinematic data set for Leo I dSph galaxy by
fitting the solutions of the Jeans equations to the velocity dispersion and
kurtosis profiles measured from the data. We demonstrate that when the sample
is cleaned of interlopers the data are consistent with the assumption that mass
follows light and isotropic stellar orbits with no need for an extended dark
matter halo. Our interloper removal scheme does not clean the data of
contamination completely, as demonstrated by the rotation curve of Leo I. When
moving away from the centre of the dwarf, the rotation appears to be reversed.
We interpret this behaviour using the results of an N-body simulation of a
dwarf galaxy possessing some intrinsic rotation, orbiting in the Milky Way
potential and show that it can be reproduced if the galaxy is viewed almost
along the tidal tails so that the leading (background) tail contaminates the
western part of Leo I while the trailing (foreground) tail the eastern one. We
show that this configuration leads to a symmetric and Gaussian distribution of
line-of-sight velocities. The simulation is also applied to test our modelling
method on mock data sets. We demonstrate that when the data are cleaned of
interlopers and the fourth velocity moment is used the true parameters of the
dwarf are typically within 1 \sigma errors of the best-fitting parameters.
Restricting the fitting to the inner part of Leo I our best estimate for the
anisotropy is \beta = -0.2^{+0.3}_{-0.4} and the total mass M = (4.5 +/- 0.7) x
10^7 M_sun. The mass-to-light ratio including the errors in mass, brightness
and distance is M/L_V = 8.2 +/- 4.5 solar units.
","[{""version"":""v1"",""created"":""Tue, 1 Apr 2008 16:14:35 GMT""},{""version"":""v2"",""created"":""Mon, 30 Jun 2008 14:50:45 GMT""}]","2009-11-13"
"0804.0205","Michela D'Agostino","M.Bruno, F.Gulminelli, F.Cannata, M.D'Agostino, F.Gramegna, G.Vannini","Signals of bimodality in the fragmentation of Au quasi-projectiles","17 pages, 8 figures, submitted to Nuclear Physics A","Nucl.Phys.A807:48-60,2008","10.1016/j.nuclphysa.2008.03.019",,"nucl-ex","http://arxiv.org/licenses/nonexclusive-distrib/1.0/","  Signals of bimodality have been investigated in experimental data of
quasi-projectile decay produced in Au+Au collisions at 35 AMeV. This same data
set was already shown to provide several signals characteristic of a first
order, liquid-gas-like phase transition. Different event sortings proposed in
the recent literature are analyzed. A sudden change in the fragmentation
pattern is revealed by the distribution of the charge of the largest fragment,
compatible with a bimodal behavior.
","[{""version"":""v1"",""created"":""Tue, 1 Apr 2008 16:27:48 GMT""}]","2008-11-26"
"0804.0206","Zhong Chao Wu","Zhong Chao Wu","A Proposal of Testing Imaginary Time in a Total Reflection","5 pages, exactly the same as that published 10 years ago","Journal of University of Science and Technology of China, No. 5,
  4-7 (1998)",,,"quant-ph gr-qc physics.optics","http://arxiv.org/licenses/nonexclusive-distrib/1.0/","  All paradoxes concerning faster-than-light signal propagation reported in
recent experiments can be dispelled by using imaginary time in a quantum
framework. I present a proposal of testing imaginary time in a total
reflection.
","[{""version"":""v1"",""created"":""Tue, 1 Apr 2008 16:52:08 GMT""}]","2008-04-02"
