"0804.0790","Siavash Ekbatani","Siavash Ekbatani, Farzad Etemadi, and Hamid Jafarkhani","Outage behavior of slow fading channels with power control using noisy
  quantized CSIT","Submitted to IEEE Transactions on Information Theory, April 2008",,,,"cs.IT math.IT","http://arxiv.org/licenses/nonexclusive-distrib/1.0/","  The topic of this study is the outage behavior of multiple-antenna slow
fading channels with quantized feedback and partial power control. A fixed-rate
communication system is considered. It is known from the literature that with
error-free feedback, the outage-optimal quantizer for power control has a
circular structure. Moreover, the diversity gain of the system increases
polynomially with the cardinality of the power control codebook. Here, a
similar system is studied, but when the feedback link is error-prone. We prove
that in the high-SNR regime, the optimal quantizer structure with noisy
feedback is still circular and the optimal Voronoi regions are contiguous
non-zero probability intervals. Furthermore, the optimal power control codebook
resembles a channel optimized scalar quantizer (COSQ), i.e., the Voronoi
regions merge with erroneous feedback information. Using a COSQ, the outage
performance of the system is superior to that of a no-feedback scheme. However,
asymptotic analysis shows that the diversity gain of the system is the same as
a no-CSIT scheme if there is a non-zero and non-vanishing feedback error
probability.
","[{""version"":""v1"",""created"":""Fri, 4 Apr 2008 17:53:17 GMT""}]","2008-04-07"
"0804.0791","Marcelo Gleiser","Marcelo Gleiser and David Sicilia","Analytical Characterization of Oscillon Energy and Lifetime","4 pages,2 figures, version published in Physical Review Letters; a
  few typos fixed","Phys.Rev.Lett.101:011602,2008","10.1103/PhysRevLett.101.011602",,"hep-th cond-mat.soft nlin.PS","http://arxiv.org/licenses/nonexclusive-distrib/1.0/","  We develop an analytical procedure to compute all relevant physical
properties of scalar field oscillons in models with quartic polynomial
potentials: energy, radius, frequency, core-amplitude, and lifetime. We compare
our predictions to numerical simulations of models with symmetric and
asymmetric double well potentials in three spatial dimensions, obtaining
excellent agreement. We also explain why oscillons have not been seen to decay
in two spatial dimensions.
","[{""version"":""v1"",""created"":""Fri, 4 Apr 2008 17:55:51 GMT""},{""version"":""v2"",""created"":""Mon, 7 Jul 2008 14:40:42 GMT""}]","2008-11-26"
"0804.0792","Viatcheslav V. Dobrovitski","D. W. Boukhvalov, L. I. Vergara, V. V. Dobrovitski, M. I. Katsnelson,
  A. I. Lichtenstein, P. K\""ogerler, J. L. Musfeldt, B. N. Harmon","Correlation effects in the electronic structure of Mn$_4$ molecular
  magnet","5 RevTeX pages, 2 EPS figures","Phys. Rev. B 77, 180402 (2008)","10.1103/PhysRevB.77.180402",,"cond-mat.mtrl-sci cond-mat.mes-hall","http://arxiv.org/licenses/nonexclusive-distrib/1.0/","  We present joint theoretical-experimental study of the correlation effects in
the electronic structure of (pyH)$_3$[Mn$_4$O$_3$Cl$_7$(OAc)$_3$]$\cdot$2MeCN
molecular magnet (Mn$_4$). Describing the many-body effects by cluster
dynamical mean-field theory, we find that Mn$_4$ is predominantly Hubbard
insulator with strong electron correlations. The calculated electron gap (1.8
eV) agrees well with the results of optical conductivity measurements, while
other methods, which neglect many-body effects or treat them in a simplified
manner, do not provide such an agreement. Strong electron correlations in
Mn$_4$ may have important implications for possible future applications.
","[{""version"":""v1"",""created"":""Fri, 4 Apr 2008 18:02:44 GMT""}]","2011-01-14"
"0804.0793","Eyo Ita III","Eyo Eyo Ita III","Quantum algebra of the Hamiltonian constraint in reduced
  four-dimensional gravity","8 pages","Hadronic Journal. Vol 34, No. 3 (2011) p.325",,,"gr-qc","http://arxiv.org/licenses/nonexclusive-distrib/1.0/","  In this paper we demonstrate closure of the quantum algebra of Hamiltonian
constraints in a theory directly related to a certain sector of general
relativity reduced to diagonal variables.
","[{""version"":""v1"",""created"":""Fri, 4 Apr 2008 18:26:55 GMT""},{""version"":""v2"",""created"":""Mon, 7 Apr 2008 08:23:21 GMT""},{""version"":""v3"",""created"":""Tue, 27 May 2008 21:11:42 GMT""},{""version"":""v4"",""created"":""Thu, 22 Apr 2010 19:39:52 GMT""},{""version"":""v5"",""created"":""Thu, 30 Dec 2010 14:18:30 GMT""},{""version"":""v6"",""created"":""Fri, 11 Feb 2011 18:21:10 GMT""},{""version"":""v7"",""created"":""Fri, 17 Feb 2012 11:47:42 GMT""}]","2012-02-20"
"0804.0794","Igor Krichever","I. Krichever, T. Shiota","Abelian solutions of the soliton equations and geometry of abelian
  varieties","27 pages, no figures",,,,"math.AG","http://arxiv.org/licenses/nonexclusive-distrib/1.0/","  We introduce the notion of abelian solutions of the 2D Toda lattice equations
and the bilinear discrete Hirota equation and show that all of them are
algebro-geometric.
","[{""version"":""v1"",""created"":""Fri, 4 Apr 2008 18:34:28 GMT""}]","2008-04-07"
"0804.0795","Pengcheng Dai","Clarina de la Cruz, Q. Huang, J. W. Lynn, Jiying Li, W. Ratcliff II,
  J. L. Zarestky, H. A. Mook, G. F. Chen, J. L. Luo, N. L. Wang, and Pengcheng
  Dai","Magnetic Order versus superconductivity in the Iron-based layered
  La(O1-xFx)FeAs systems","15 pages, 4 figures, and 3 tables","Nature 453, 899 (2008).","10.1038/nature07057",,"cond-mat.supr-con","http://arxiv.org/licenses/nonexclusive-distrib/1.0/","  In high-transition temperature (high-Tc) copper oxides, it is generally
believed that antiferromagnetism plays a fundamental role in the
superconducting mechanism because superconductivity occurs when mobile
electrons or holes are doped into the antiferromagnetic parent compounds. The
recent discovery of superconductivity in the rare-earth (R) iron-based oxide
systems [RO1-xFxFeAs] has generated enormous interest because these materials
are the first noncopper oxide superconductors with Tc exceeding 50 K. The
parent (nonsuperconducting) LaOFeAs material is metallic but shows anomalies
near 150 K in both resistivity and dc magnetic susceptibility. While optical
conductivity and theoretical calculations suggest that LaOFeAs exhibits a
spin-density-wave (SDW) instability that is suppressed with doping electrons to
form superconductivity, there has been no direct evidence of the SDW order.
Here we use neutron scattering to demonstrate that LaOFeAs undergoes an abrupt
structural distortion below ~150 K, changing the symmetry from tetragonal
(space group P4/nmm) to monoclinic (space group P112/n) at low temperatures,
and then followed with the development of long range SDW-type antiferromagnetic
order at ~134 K with a small moment but simple magnetic structure. Doping the
system with flourine suppresses both the magnetic order and structural
distortion in favor of superconductivity. Therefore, much like high-Tc copper
oxides, the superconducting regime in these Fe-based materials occurs in close
proximity to a long-range ordered antiferromagnetic ground state. Since the
discovery of long
","[{""version"":""v1"",""created"":""Fri, 4 Apr 2008 19:11:01 GMT""}]","2009-09-29"
"0804.0796","Michael McGuire","M. A. McGuire, A. D. Christianson, A. S. Sefat, R. Jin, E. A. Payzant,
  B. C. Sales, M. D. Lumsden, and D. Mandrus","Evidence for the Spin Density Wave in LaFeAsO","This paper has been withdrawn by the authors due to errors in the
  X-ray diffraction data","Most results from this paper are published in PHYSICAL REVIEW B
  78, 094517 (2008). See also arXiv:0806.3878",,,"cond-mat.supr-con cond-mat.str-el","http://arxiv.org/licenses/nonexclusive-distrib/1.0/","  This paper has been withdrawn by the authors due to errors in the X-ray
diffraction data. Other measured data are not affected; however, the errors
significantly change the interpretation and conclusions, and thus warrant
withdrawal and later resubmission.
","[{""version"":""v1"",""created"":""Fri, 4 Apr 2008 19:56:45 GMT""},{""version"":""v2"",""created"":""Mon, 12 May 2008 18:10:13 GMT""}]","2008-09-25"
"0804.0798","Kirsten Howley","K. M. Howley, M. Geha, P. Guhathakurta, R. M. Montgomery, G. Laughlin,
  and K. V. Johnston","Darwin Tames an Andromeda Dwarf: Unraveling the Orbit of NGC 205 Using a
  Genetic Algorithm","34 pages, 20 figures, accepted for publication in the Astrophysical
  Journal, A pdf version with high-resolution figures may be obtained from
  http://www.ucolick.org/~kirsten/ms.pdf",,"10.1086/589632",,"astro-ph","http://arxiv.org/licenses/nonexclusive-distrib/1.0/","  NGC 205, a close satellite of the M31 galaxy, is our nearest example of a
dwarf elliptical galaxy. Photometric and kinematic observations suggest that
NGC 205 is undergoing tidal distortion from its interaction with M31. Despite
earlier attempts, the orbit and progenitor properties of NGC 205 are not well
known. We perform an optimized search for these unknowns by combining a genetic
algorithm with restricted N-body simulations of the interaction. This approach,
coupled with photometric and kinematic observations as constraints, allows for
an effective exploration of the parameter space. We represent NGC 205 as a
static Hernquist potential with embedded massless test particles that serve as
tracers of surface brightness. We explore 3 distinct, initially stable
configurations of test particles: cold rotating disk, warm rotating disk, and
hot, pressure-supported spheroid. Each model reproduces some, but not all, of
the observed features of NGC 205, leading us to speculate that a rotating
progenitor with substantial pressure support could match all of the
observables. Furthermore, plausible combinations of mass and scale length for
the pressure-supported spheroid progenitor model reproduce the observed
velocity dispersion profile. For all 3 models, orbits that best match the
observables place the satellite 11+/-9 kpc behind M31 moving at very large
velocities: 300-500 km/s on primarily radial orbits. Given that the observed
radial component is only 54 km/s, this implies a large tangential motion for
NGC 205, moving from the NW to the SE. These results suggest NGC 205 is not
associated with the stellar arc observed to the NE of NGC 205. Furthermore, NGC
205's velocity appears to be near or greater than its escape velocity,
signifying that the satellite is likely on its first M31 passage.
","[{""version"":""v1"",""created"":""Fri, 4 Apr 2008 20:00:03 GMT""}]","2009-11-13"
"0804.0799","Nikhil Padmanabhan","Nikhil Padmanabhan, Martin White","Constraining Anisotropic Baryon Oscillations","4 pages, 2 figs","Phys.Rev.D77:123540,2008","10.1103/PhysRevD.77.123540",,"astro-ph","http://arxiv.org/licenses/nonexclusive-distrib/1.0/","  We present an analysis of anisotropic baryon acoustic oscillations and
elucidate how a mis-estimation of the cosmology, which leads to incorrect
values of the angular diameter distance, d_A, and Hubble parameter, H, manifest
themselves in changes to the monopole and quadrupole power spectrum of biased
tracers of the density field. Previous work has focused on the monopole power
spectrum, and shown that the isotropic ""dilation"" combination d_A^2/H is
robustly constrained by an overall shift in the scale of the baryon feature. We
extend this by demonstrating that the quadrupole power spectrum is sensitive to
an anisotropic ""warping"" mode d_A H, allowing one to break the degeneracy
between d_A and H. We describe a method for measuring this warping, explicitly
marginalizing over the form of redshift space distortions. We verify this
method on N-body simulations and estimate that d_A H can be measured with a
fractional accuracy of ~ 3/sqrt(V) % where the survey volume is estimated in
(Gpc/h)^3.
","[{""version"":""v1"",""created"":""Sat, 5 Apr 2008 02:27:17 GMT""}]","2008-11-26"
"0804.0800","Shantanu Desai","L. Blackburn, L. Cadonati, S. Caride, S. Caudill, S. Chatterji, N.
  Christensen, J. Dalrymple, S. Desai, A. Di Credico, G. Ely, J. Garofoli, L.
  Goggin, G. Gonz\'alez, R. Gouaty, C. Gray, A. Gretarsson, D. Hoak, T. Isogai,
  E. Katsavounidis, J. Kissel, S. Klimenko, R.A. Mercer, S. Mohapatra, S.
  Mukherjee, F. Raab, K. Riles, P. Saulson, R. Schofield, P. Shawhan, J.
  Slutsky, J.R. Smith, R. Stone, C. Vorvick, M. Zanolin, N. Zotov, J. Zweizig","The LSC Glitch Group : Monitoring Noise Transients during the fifth LIGO
  Science Run","9 pages, 8 figures, Contribution to 12th Gravitational Wave Data
  Analysis Workshop. Changes in response to referee comments. Accepted for
  publication in CQG","Class.Quant.Grav.25:184004,2008","10.1088/0264-9381/25/18/184004","LIGO-P080016-01","gr-qc astro-ph.IM","http://arxiv.org/licenses/nonexclusive-distrib/1.0/","  The LIGO Scientific Collaboration (LSC) glitch group is part of the LIGO
detector characterization effort. It consists of data analysts and detector
experts who, during and after science runs, collaborate for a better
understanding of noise transients in the detectors. Goals of the glitch group
during the fifth LIGO science run (S5) included (1) offline assessment of the
detector data quality, with focus on noise transients, (2) veto recommendations
for astrophysical analysis and (3) feedback to the commissioning team on
anomalies seen in gravitational wave and auxiliary data channels. Other
activities included the study of auto-correlation of triggers from burst
searches, stationarity of the detector noise and veto studies. The group
identified causes for several noise transients that triggered false alarms in
the gravitational wave searches; the times of such transients were identified
and vetoed from the data generating the LSC astrophysical results.
","[{""version"":""v1"",""created"":""Fri, 4 Apr 2008 20:00:35 GMT""},{""version"":""v2"",""created"":""Mon, 14 Jul 2008 22:14:20 GMT""}]","2016-02-11"
"0804.0802","Scott Aaronson","Scott Aaronson, Salman Beigi, Andrew Drucker, Bill Fefferman, and
  Peter Shor","The Power of Unentanglement","Several errors fixed; based amplification result on ""Weak Additivity
  Conjecture"" rather than now-falsified Additivity Conjecture; added some new
  observations due to F. Brandao. To appear in Theory of Computing",,,,"quant-ph","http://arxiv.org/licenses/nonexclusive-distrib/1.0/","  The class QMA(k), introduced by Kobayashi et al., consists of all languages
that can be verified using k unentangled quantum proofs. Many of the simplest
questions about this class have remained embarrassingly open: for example, can
we give any evidence that k quantum proofs are more powerful than one? Does
QMA(k)=QMA(2) for k>=2? Can QMA(k) protocols be amplified to exponentially
small error? In this paper, we make progress on all of the above questions.
First, we give a protocol by which a verifier can be convinced that a 3SAT
formula of size n is satisfiable, with constant soundness, given ~O(sqrt(n))
unentangled quantum witnesses with O(log n) qubits each. Our protocol relies on
the existence of very short PCPs. Second, we show that assuming a weak version
of the Additivity Conjecture from quantum information theory, any QMA(2)
protocol can be amplified to exponentially small error, and QMA(k)=QMA(2) for
all k>=2. Third, we prove the nonexistence of ""perfect disentanglers"" for
simulating multiple Merlins with one.
","[{""version"":""v1"",""created"":""Fri, 4 Apr 2008 21:50:06 GMT""},{""version"":""v2"",""created"":""Sun, 16 Nov 2008 22:03:04 GMT""}]","2008-11-17"
"0804.0803","Ohad Shemmer","Ohad Shemmer (1), W.N. Brandt (1), Hagai Netzer (2), Roberto Maiolino
  (3), Shai Kaspi (2,4) ((1) PSU, (2) Tel Aviv U., (3) INAF - Roma, (4)
  Technion)","The Hard X-ray Spectrum as a Probe for Black-Hole Growth in Radio-Quiet
  Active Galactic Nuclei","13 pages (emulateapj), 6 figures. Accepted for publication in ApJ",,"10.1086/588776",,"astro-ph","http://arxiv.org/licenses/nonexclusive-distrib/1.0/","  We study the hard-X-ray spectral properties of ten highly luminous
radio-quiet (RQ) active galactic nuclei (AGNs) at z=1.3-3.2, including new
XMM-Newton observations of four of these sources. We find a significant
correlation between the normalized accretion rate (L/L_Edd) and the hard-X-ray
photon index (Gamma) for 35 moderate-high luminosity RQ AGNs including our ten
highly luminous sources. Within the limits of our sample, we show that a
measurement of Gamma and L_X can provide an estimate of L/L_Edd and black-hole
(BH) mass (M_BH) with a mean uncertainty of a factor of <~3 on the predicted
values of these properties. This may provide a useful probe for tracing the
history of BH growth in the Universe, utilizing samples of X-ray-selected AGNs
for which L/L_Edd and M_BH have not yet been determined systematically. It may
prove to be a useful way to probe BH growth in distant Compton-thin type 2
AGNs. We also find that the optical-X-ray spectral slope (a_ox) depends
primarily on optical-UV luminosity rather than on L/L_Edd in a sample of RQ
AGNs spanning five orders of magnitude in luminosity and over two orders of
magnitude in L/L_Edd. We detect a significant Compton-reflection continuum in
two of our highly luminous sources, and in the stacked X-ray spectrum of seven
other sources with similar luminosities, we obtain a mean relative Compton
reflection of R=0.9^{+0.6}_{-0.5} and an upper limit on the rest-frame
equivalent width of a neutral Fe Ka line of 105 eV. We do not detect a
significant steepening of the X-ray power-law spectrum below rest-frame 2 keV
in any of our highly luminous sources, suggesting that a soft-excess feature,
commonly observed in local AGNs, either does not depend strongly on L/L_Edd, or
is not accessible at high redshifts using current X-ray detectors. [Abridged]
","[{""version"":""v1"",""created"":""Fri, 4 Apr 2008 20:04:07 GMT""}]","2009-11-13"
"0804.0804","Meng-Chwan Tan","Meng-Chwan Tan","Gauging Spacetime Symmetries On The Worldsheet And The Geometric
  Langlands Program -- II","47 pages. Typos corrected. Published version","JHEP 0809:074,2008","10.1088/1126-6708/2008/09/074",,"hep-th math.AG math.QA","http://arxiv.org/licenses/nonexclusive-distrib/1.0/","  We generalise the analysis carried out in [arXiv:0710.5796], and find that
our previous results can be extended beyond the case of SL(N,C). In particular,
we show that an equivalence--at the level of the holomorphic chiral
algebra--between a bosonic string on a smooth coset manifold G/B and a B-gauged
version of itself on G, will imply an isomorphism of classical W-algebras and a
level relation which underlie a geometric Langlands correspondence for the
simply-laced, complex ADE-groups. In addition, as opposed to line operators and
branes of an open topological sigma-model, the Hecke operators and Hecke
eigensheaves, can, instead, be physically interpreted in terms of the
correlation functions of local operators in the holomorphic chiral algebra of a
closed, quasi-topological sigma-model. Our present results thus serve as an
alternative physical interpretation--to that of an electric-magnetic duality of
four-dimensional gauge theory demonstrated earlier by Kapustin and Witten in
[arXiv:hep-th/0604151]--of the geometric Langlands correspondence for complex
ADE-groups. The cases with tame and mild ""ramifications"" are also discussed.
","[{""version"":""v1"",""created"":""Fri, 4 Apr 2008 20:04:35 GMT""},{""version"":""v2"",""created"":""Tue, 16 Sep 2008 17:21:08 GMT""}]","2009-12-04"
"0804.0805","Luis Gregorio Dias da Silva","Luis G. Dias da Silva, Kevin Ingersent, Nancy Sandler, Sergio Ulloa","Finite-temperature conductance signatures of quantum criticality in
  double quantum dots","4 pages, 3 figures, published in PRB","Phys. Rev. B 78, 153304 (2008)","10.1103/PhysRevB.78.153304",,"cond-mat.mes-hall cond-mat.str-el","http://arxiv.org/licenses/nonexclusive-distrib/1.0/","  We study the linear conductance through a double-quantum-dot system
consisting of an interacting dot in its Kondo regime and an effectively
noninteracting dot, connected in parallel to metallic leads. Signatures in the
zero-bias conductance at temperatures $T>0$ mark a pair of quantum (T=0) phase
transitions between a Kondo-screened many-body ground state and non-Kondo
ground states. Notably, the conductance features become more prominent with
increasing $T$, which enhances the experimental prospects for accessing the
quantum-critical region through tuning of gate voltages in a single device.
","[{""version"":""v1"",""created"":""Fri, 4 Apr 2008 20:09:08 GMT""},{""version"":""v2"",""created"":""Sun, 12 Oct 2008 15:47:09 GMT""}]","2008-10-13"
"0804.0806","Gopal Sarma","Gopal Sarma, Andrew Silberfarb, and Hideo Mabuchi","A quantum stochastic calculus approach to modeling double-pass
  atom-field coupling","Minor corrections to Section III",,"10.1103/PhysRevA.78.025801",,"quant-ph","http://arxiv.org/licenses/nonexclusive-distrib/1.0/","  We examine a proposal by Sherson and Moelmer to generate
polarization-squeezed light in terms of the quantum stochastic calculus (QSC).
We investigate the statistics of the output field and confirm their results
using the QSC formalism. In addition, we study the atomic dynamics of the
system and find that this setup can produce up to 3 dB of atomic spin
squeezing.
","[{""version"":""v1"",""created"":""Fri, 4 Apr 2008 21:00:30 GMT""},{""version"":""v2"",""created"":""Wed, 25 Jun 2008 16:40:26 GMT""},{""version"":""v3"",""created"":""Tue, 22 Jul 2008 04:53:33 GMT""}]","2009-11-13"
"0804.0808","Par M. Kurlberg","P. Kurlberg, Z. Rudnick","The fluctuations in the number of points on a hyperelliptic curve over a
  finite field","10 pages. Final version",,,,"math.NT","http://arxiv.org/licenses/nonexclusive-distrib/1.0/","  The number of points on a hyperelliptic curve over a field of $q$ elements
may be expressed as $q+1+S$ where $S$ is a certain character sum. We study
fluctuations of $S$ as the curve varies over a large family of hyperelliptic
curves of genus $g$. For fixed genus and growing $q$, Katz and Sarnak showed
that $S/\sqrt{q}$ is distributed as the trace of a random $2g\times 2g$ unitary
symplectic matrix. When the finite field is fixed and the genus grows, we find
that the the limiting distribution of $S$ is that of a sum of $q$ independent
trinomial random variables taking the values $\pm 1$ with probabilities
$1/2(1+q^{-1})$ and the value 0 with probability $1/(q+1)$. When both the genus
and the finite field grow, we find that $S/\sqrt{q}$ has a standard Gaussian
distribution.
","[{""version"":""v1"",""created"":""Fri, 4 Apr 2008 20:39:04 GMT""},{""version"":""v2"",""created"":""Tue, 7 Oct 2008 20:18:45 GMT""}]","2008-10-07"
"0804.0809","F. J. Castro-Jimenez","M.C. Fern\'andez-Fern\'andez and F.J. Castro-Jim\'enez (University of
  Seville, Spain)","Gevrey solutions for irregular hypergeometric systems I","Changed content. Reference added. Corrected typos. 41 pages",,,,"math.AG","http://arxiv.org/licenses/nonexclusive-distrib/1.0/","  We describe the Gevrey solutions at singular points of irregular
hypergeometric systems (GKZ systems) associated with affine monomial curves.
","[{""version"":""v1"",""created"":""Fri, 4 Apr 2008 21:02:09 GMT""},{""version"":""v2"",""created"":""Tue, 27 May 2008 14:54:16 GMT""}]","2008-05-27"
"0804.0811","Andrea Melandri","A.Melandri, C.G.Mundell, S.Kobayashi, C.Guidorzi, A.Gomboc,
  I.A.Steele, R.J.Smith, D.Bersier, C.J.Mottram, D.Carter, M.F.Bode,
  P.T.O'Brien, N.R.Tanvir, E.Rol, R.Chapman","The Early-time Optical Properties of Gamma-Ray Burst Afterglows","51 pages, 9 figures, 4 tables, submitted to ApJ",,"10.1086/591243",,"astro-ph","http://arxiv.org/licenses/nonexclusive-distrib/1.0/","  We present a multiwavelength analysis of 63 Gamma-Ray Bursts observed with
the world's three largest robotic optical telescopes, the Liverpool and Faulkes
Telescopes (North and South). Optical emission was detected for 24 GRBs with
brightnesses ranging from R = 10 to 22 mag in the first 10 minutes after the
burst. By comparing optical and X-ray light curves from t = 100 to about 10^6
seconds, we introduce four main classes, defined by the presence or absence of
temporal breaks at optical and/or X-ray wavelengths. While 15/24 GRBs can be
modelled with the forward-shock model, explanation of the remaining nine is
very challenging in the standard framework even with the introduction of energy
injection or an ambient density gradient. Early X-ray afterglows, even segments
of light curves described by a power-law, may be due to additional emission
from the central engine. 39 GRBs in our sample were not detected and have deep
upper limits (R < 22 mag) at early time. Of these, only ten were identified by
other facilities, primarily at near infrared wavelengths, resulting in a dark
burst fraction of about 50%. Additional emission in the early time X-ray
afterglow due to late-time central engine activity may also explain some dark
bursts by making the bursts brighter than expected in the X-ray band compared
to the optical band.
","[{""version"":""v1"",""created"":""Fri, 4 Apr 2008 21:26:02 GMT""}]","2009-11-13"
