"0804.0836","Andrey Shirokov","J. P. Vary, A. M. Shirokov, P. Maris","Light nuclei without a core","To be published in the Proceedings of the XXX Reuniao de Fisica
  Nuclear no Brasil, August, 2007. 6 pages, 7 figures",,,,"nucl-th","http://arxiv.org/licenses/nonexclusive-distrib/1.0/","  We introduce the no-core full configuration (NCFC) approach and present
results for $^4$He, $^{12}$C and $^{14}$F with the realistic NN interaction,
JISP16. We obtain ground state energies and their uncertainties through
exponential extrapolations that we demonstrate are reliable in $^4$He where
fully converged results are obtained. We find $^{12}$C is overbound by 1.7 MeV
and we predict the yet-to-be-measured binding energy of $^{14}$F to be $68.1
\pm 2.7$ MeV. The extrapolated spectrum of $^{14}$F is in reasonable agreement
with known features of the $^{14}$B spectrum.
","[{""version"":""v1"",""created"":""Sat, 5 Apr 2008 03:49:45 GMT""},{""version"":""v2"",""created"":""Sat, 2 Aug 2008 04:13:06 GMT""}]","2008-08-04"
"0804.0837","Ratbay Myrzakulov","N.S.Serikbaev, Zh.M.Bitibaeva, K.K.Yerzhanov, R.Myrzakulov","Integrable Isotropic Geometrical Flows and Heisenberg Ferromagnets","9 pages, Invited talk at the ""Second Workshop on Nonlinearity and
  Geometry. Darboux Days"", Bedlewo, Poland, April 13-19, 2008",,,,"math.DG","http://arxiv.org/licenses/nonexclusive-distrib/1.0/","  Geometrical flows (GF) play an important role in modern mathematics and
physics. In this letter we have considered some integrable isotropic GF --
Ricci flows (RF) and mean curvature flows (MCF) -- which are related with
integrable Heisenberg ferromagnets. In 2+1 dimensions, these GF have a
singularity at $t=t_{0}$.
","[{""version"":""v1"",""created"":""Sat, 5 Apr 2008 04:21:41 GMT""}]","2008-04-08"
"0804.0838","Dmitry Tsigankov","Dmitry Tsigankov and Alexei Koulakov","Optimal axonal and dendritic branching strategies during the development
  of neural circuitry","13 pages",,,,"q-bio.NC","http://arxiv.org/licenses/nonexclusive-distrib/1.0/","  In developing brain, axons and dendrites are capable of connecting to each
other with high precision. Recent advances in imaging have allowed for the
monitoring of axonal, dendritic, and synapse dynamics in vivo. It is observed
that the majority of axonal and dendritic branches are formed 'in error', only
to be retracted later. The functional significance of the overproduction of
branches is not clear. In this study, we use a computational model to
investigate the speed and efficiency of different branching strategies. We show
that branching itself allows for substantial acceleration in the identification
of appropriate targets through the use of a parallel search. We also show that
the formation of new branches in the vicinity of existing synapses leads to the
formation of target connectivity with a decreased number of erroneous branches.
This finding allows us to explain the high correlation between the branch
points and synapses observed in the Xenopus laevis retinotectal system. We also
suggest that the most efficient branching rule is different for axons and
dendrites. The optimal axonal strategy is to form new branches in the vicinity
of existing synapses, whereas the optimal rule for dendrites is to form new
branches preferentially in the vicinity of synapses with correlated pre- and
postsynaptic electric activity. Thus, our studies suggest that the developing
neural system employs a set of sophisticated computational strategies that
facilitate the formation of required circuitry, so that it may proceed in the
fastest and most frugal way.
","[{""version"":""v1"",""created"":""Sat, 5 Apr 2008 05:02:29 GMT""}]","2008-04-08"
"0804.0839","Ronald Mennickent","R.E. Mennickent, Z. Kolaczkowski, G. Michalska, G. Pietrzy'nski, R.
  Gallardo, L. Cidale, A. Granada, W. Gieren","The eclipsing LMC star OGLE05155332--6925581: a clue for Double Periodic
  Variables","submitted to MNRAS",,"10.1111/j.1365-2966.2008.13696.x",,"astro-ph","http://arxiv.org/licenses/nonexclusive-distrib/1.0/","  We investigate the nature of OGLE05155332-6925581, one of the brightest
members of the enigmatic group of Double Periodic Variables (DPVs) recently
found in the Magellanic Clouds. The modeling of archival orbital light curves
(LCs), along with the analysis of the radial velocities suggest that this
object is a semi--detached binary with the less massive star transferring
matter to the more massive and less evolved star, in an Algol--like
configuration. We find evidence for additional orbital variability and
H$\alpha$ emission, likely caused by an accretion disc around the primary star.
As in the case of $\beta Lyr$ the circumprimary disc seems to be more luminous
than the primary, but we do not detect orbital period changes. We find that the
LC follows a loop in the color--magnitude diagram during the long cycle; the
system is redder when brighter and the rising phase is bluer than during
decline. Infrared excess is also present. The source of the long--term
periodicity is not eclipsed, indicating its circumbinary origin. Strong
asymmetries, discrete absorption components (DACs) and a $\gamma$ shift are new
and essential observational properties in the infrared H I lines. The DACs
strength and RV follow a saw--teeth pattern during the orbital cycle. We
suggest that the system experiences supercycles of mass outflow feeding a
circumbinary disc. Mass exchange and mass loss could produce comparable but
opposite effects in the orbital period on a long time scale, resulting in a
quasi--constancy of this parameter.
","[{""version"":""v1"",""created"":""Sat, 5 Apr 2008 06:09:34 GMT""},{""version"":""v2"",""created"":""Tue, 29 Jul 2008 16:19:58 GMT""}]","2009-11-13"
"0804.0840","Hao Pan","Hongze Li and Hao Pan","A Schur-type addition theorem for primes","10 pages",,,,"math.NT math.CO","http://creativecommons.org/licenses/by/3.0/","  Suppose that all primes are colored with k colors. Then there exist
monochromatic primes p1, p2, p3 such that p1+p2=p3+1.
","[{""version"":""v1"",""created"":""Sat, 5 Apr 2008 06:16:20 GMT""},{""version"":""v2"",""created"":""Thu, 8 May 2008 12:29:45 GMT""}]","2008-05-08"
"0804.0841","Lev Leinson","L. B. Leinson","BCS approximation to the effective vector vertex of superfluid fermions","19 pages, no figures","Phys.Rev.C78:015502,2008","10.1103/PhysRevC.78.015502",,"astro-ph hep-ph nucl-th","http://arxiv.org/licenses/nonexclusive-distrib/1.0/","  We examine the effective interaction of nonrelativistic fermions with an
external vector field in superfluid systems. In contrast to the complicated
vertex equation, usually used in this case, we apply the approach which does
not employ an explicit form of the pairing interaction. This allows to obtain a
simple analytic expression for the vertex function only in terms of the order
parameter and other macroscopic parameters of the system. We use this effective
vertex to analyze the linear response function of the superfluid medium at
finite temperatures. At the time-like momentum transfer, the imaginary part of
the response function is found to be proportional to the fourth power of small
Fermi velocity, i.e. the energy losses through vector currents are strongly
suppressed. As an application, we calculate the neutrino energy losses through
neutral weak currents caused by the pair recombination in the superfluid
neutron matter at temperatures lower than the critical one for S-wave pairing.
This approach confirms a strong suppression of the neutrino energy losses as
predicted in Ref.[4].
","[{""version"":""v1"",""created"":""Sat, 5 Apr 2008 07:09:24 GMT""}]","2008-11-26"
"0804.0842","Kazuaki Ohnishi","Su Houng Lee, Kenji Morita, and Kazuaki Ohnishi","Sigma meson in QCD sum rules using a two quark current with derivatives","4 pages, 2 figures",,"10.1103/PhysRevD.79.074025",,"hep-ph","http://arxiv.org/licenses/nonexclusive-distrib/1.0/","  We study the $\sigma$ meson in QCD sum rules using a two quark interpolating
field with derivatives. In the constituent quark model, the $\sigma$ meson is
composed of a quark and an antiquark in the relative p-wave state and is thus
expected to have a larger overlap with an interpolating field that measures the
derivative of the relative quark wave-function. While the sum rule with a
current without derivatives gives a pole mass of around 1 GeV, the present sum
rule with a derivative current gives a mass of around 550 MeV and a width of
400 MeV, that could be identified with the $\sigma$ meson.
","[{""version"":""v1"",""created"":""Sat, 5 Apr 2008 07:35:09 GMT""},{""version"":""v2"",""created"":""Fri, 16 Jan 2009 09:02:43 GMT""},{""version"":""v3"",""created"":""Mon, 6 Apr 2009 09:47:47 GMT""}]","2015-05-13"
"0804.0843","Sumio Ishihara","J. Nasu, A. Nagano, M. Naka and S. Ishihara","Doubly degenerate orbital system in honeycomb lattice: implication of
  orbital state in layered iron oxide","12 pages, 22 figures",,"10.1103/PhysRevB.78.024416",,"cond-mat.str-el cond-mat.mtrl-sci","http://arxiv.org/licenses/nonexclusive-distrib/1.0/","  We study a doubly-degenerate orbital model on a honeycomb attice. This is a
model for orbital states in multiferroic layered iron oxides. The classical and
quantum models are analyzed by spin-wave approximation, Monte-Carlo simulation
and Lanczos method. A macroscopic number of degeneracy exists in the classical
ground state. In the classical model, a peak in the specific heat appears at a
temperature which is much lower than the mean-field ordering one. Below this
temperature, angle of orbital pseudo-spin is fixed, but conventional orbital
orders are not suggested. The degeneracy in the ground state is partially
lifted by thermal fluctuation. We suggest a role of zero-dimensional
fluctuation in hexagons on a low-temperature orbital structure. Lifting of the
degeneracy also occurs at zero temperature due to the quantum zero-point
fluctuation. We show that the ground-state wave function is well represented by
a linear combination of the states where a honeycomb lattice is covered by
nearest-neighboring pairs of orbitals with the minimum bond energy.
","[{""version"":""v1"",""created"":""Sat, 5 Apr 2008 09:58:52 GMT""}]","2009-11-13"
"0804.0844","Gorsky Eugeny","E. Gorsky","Symmetries of some motivic integrals","12 pages","Russian Math. Surveys 63 (2008), no. 4, 780-781","10.1070/RM2008v063n04ABEH004554",,"math.AG","http://arxiv.org/licenses/nonexclusive-distrib/1.0/","  We give an explicit formula for the motivic integrals related to the Milnor
number over spaces of parametrised arcs on the plane with fixed tangency orders
with the axis. These integrals are rational functions of the parameters and the
class of the affine line. Using a set of natural recurrence relations between
them, we prove an unexpected invariance property with respect to the
simultaneous inversion of the parameters and the class of the affine line. We
also discuss a generalization of this system of recurrence relations whose
solutions are also symmetric and satisfy additional differential equations.
","[{""version"":""v1"",""created"":""Sat, 5 Apr 2008 08:54:57 GMT""}]","2015-05-13"
"0804.0845","Jean-Christophe Bourin","Jean-Christophe Bourin and Eun-Young Lee","Concave functions of positive operators, sums and congruences","to appear in JOT",,,,"math.FA math.OA","http://arxiv.org/licenses/nonexclusive-distrib/1.0/","  Subaddivity type matrix inequalities for concave funcions and symetric norms
are given.
","[{""version"":""v1"",""created"":""Sat, 5 Apr 2008 09:23:07 GMT""}]","2008-04-08"
"0804.0846","Motomu Tsuda","Kazunari Shima and Motomu Tsuda","Systematics of linearization of N = 2 nonlinear SUSY in superfield
  formulation","10 pages","Mod.Phys.Lett.A23:3149-3157,2008","10.1142/S0217732308028508",,"hep-th","http://arxiv.org/licenses/nonexclusive-distrib/1.0/","  The relation between a N = 2 nonlinear supersymmetric (SUSY) model and a
linear SUSY (free) theory for $N = 2$ vector supermultiplet accompanying the
spontaneous SUSY breaking is systematically worked out in two-dimensional
superfield formulation.
","[{""version"":""v1"",""created"":""Sat, 5 Apr 2008 10:14:34 GMT""}]","2009-02-11"
"0804.0847","George Savvidy K","Spyros Konitopoulos and George Savvidy","Production of Spin-Two Gauge Bosons","9 pages, 3 figures, LaTex file",,,"NRCPS-HE-03-08","hep-th","http://arxiv.org/licenses/nonexclusive-distrib/1.0/","  We considered spin-two gauge boson production in the fermion pair
annihilation process and calculated the polarized cross sections for each set
of helicity orientations of initial and final particles. The angular dependence
of these cross sections is compared with the similar annihilation cross
sections in QED with two photons in the final state, with two gluons in QCD and
W-pair in Electroweak theory.
","[{""version"":""v1"",""created"":""Sat, 5 Apr 2008 10:55:19 GMT""}]","2008-04-08"
"0804.0848","Nedzad Limic","Nedzad Limi\'c","Markov Jump Processes Approximating a Nonsymmetric Generalized
  Diffusion: numerics explained to probabilists","21 pages, 1 figure this is an extended version including detailed
  arguments and additional explanations of the analysis background, intended
  for a typical probabilist",,,,"math.PR math.FA","http://creativecommons.org/licenses/by/3.0/","  Consider a non-symmetric generalized diffusion $X(\cdot)$ in ${\bbR}^d$
determined by the differential operator $A(\msx)=-\sum_{ij}
\partial_ia_{ij}(\msx)\partial_j +\sum_i b_i(\msx)\partial_i$. In this paper
the diffusion process is approximated by Markov jump processes $X_n(\cdot)$, in
homogeneous and isotropic grids $G_n \subset {\bbR}^d$, which converge in
distribution to the diffusion $X(\cdot)$. The generators of $X_n(\cdot)$ are
constructed explicitly. Due to the homogeneity and isotropy of grids, the
proposed method for $d\geq3$ can be applied to processes for which the
diffusion tensor $\{a_{ij}(\msx)\}_{11}^{dd}$ fulfills an additional condition.
The proposed construction offers a simple method for simulation of sample paths
of non-symmetric generalized diffusion. Simulations are carried out in terms of
jump processes $X_n(\cdot)$. For $d=2$ the construction can be easily
implemented into a computer code.
","[{""version"":""v1"",""created"":""Sat, 5 Apr 2008 11:45:16 GMT""},{""version"":""v2"",""created"":""Sun, 22 Mar 2009 19:12:32 GMT""},{""version"":""v3"",""created"":""Mon, 7 Dec 2009 18:35:08 GMT""},{""version"":""v4"",""created"":""Sun, 14 Mar 2010 13:02:19 GMT""}]","2010-03-16"
"0804.0849","Anita Richards","W. M. Goss (1), A. M. S. Richards (2), T. W. B. Muxlow (3), P.
  Thomasson (3) ((1) National Radio Astronomy Observatory, Socorro, NM, U.S.A.,
  (2) Jodrell Bank Centre for Astrophysics, Alan Turing Building, University of
  Manchester, UK, (3) MERLIN/VLBI National Facility, Jodrell Bank Observatory,
  The University of Manchester, Macclesfield, Cheshire, UK)","Galactic HI on the 50-AU scale in the direction of three extra-galactic
  sources observed with MERLIN","23 pages, 16 figures Accepted by MNRAS 2008 April 2",,"10.1111/j.1365-2966.2008.13300.x",,"astro-ph","http://arxiv.org/licenses/nonexclusive-distrib/1.0/","  We present MERLIN observations of Galactic 21-cm HI absorption at an angular
resolution of c. 0.1-0.2 arcsec and a velocity resolution of 0.5 km/s, in the
direction of three moderately low latitude (-8< b <-12 deg) extragalactic radio
sources, 3C111, 3C123 and 3C161, all of which are heavily reddened. HI
absorption is observed against resolved background emission sources up to c. 2
arcsec in extent and we distinguish details of the opacity distribution within
1-1.5 arcsec regions towards 3C~123 and 3C~161. This study is the second MERLIN
investigation of small scale structure in interstellar HI (earlier work probed
Galactic HI in the directions of the compact sources 3C138 and 3C147). The
0.1-arcsec scale is intermediate between HI absorption studies made with other
fixed element interferometers with resolution of 1 to 10 arcsec and VLBI
studies with resolutions of 10-20 milli-arcsec. At a scale of 1 arcsec (about
500 AU), prominent changes in Galactic HI opacity in excess of 1-1.5 are
determined in the direction of 3C161 with a signal-to-noise ratio of at least
10 sigma. Possible fluctuations in the HI opacity at the level of about 1 are
detected at the 2.5-3 sigma level in the direction of 3C123.
","[{""version"":""v1"",""created"":""Sat, 5 Apr 2008 12:12:58 GMT""}]","2009-11-13"
"0804.0850","Roberto Di Leonardo","R. Di Leonardo, S. Keen, F. Ianni, J. Leach, M. Padgett, G. Ruocco","Hydrodynamic Interactions in Two Dimensions","5 pages, 3 figures",,"10.1103/PhysRevE.78.031406",,"cond-mat.soft cond-mat.stat-mech","http://arxiv.org/licenses/nonexclusive-distrib/1.0/","  We measure hydrodynamic interactions between colloidal particles confined in
a thin sheet of fluid. The reduced dimensionality, compared to a bulk fluid,
increases dramatically the range of couplings. Using optical tweezers we force
a two body system along the eigenmodes of the mobility tensor and find that
eigen-mobilities change logarithmically with particle separation. At a hundred
radii distance, the mobilities for correlated and anti-correlated motions
differ by a factor of two, whereas in bulk fluids, they would be practically
indistinguishable. We derive the two dimensional counterpart of the Oseen
hydrodynamic tensor which quantitatively reproduces the observed behavior.
These results highlight the importance of dimensionality for transport and
interactions in colloidal systems and proteins in biological membranes.
","[{""version"":""v1"",""created"":""Sat, 5 Apr 2008 12:06:08 GMT""}]","2009-11-13"
"0804.0852","Sebastien Verel","David Simoncini (I3S), Philippe Collard (I3S), S\'ebastien Verel
  (I3S), Manuel Clergue (I3S)","On the Influence of Selection Operators on Performances in Cellular
  Genetic Algorithms",,"Dans Proceedings of the IEEE Congress on Evolutionary Computation
  CEC2007 - IEEE Congress on Evolutionary Computation CEC2007, singapore :
  Singapour (2007)",,,"cs.AI","http://arxiv.org/licenses/nonexclusive-distrib/1.0/","  In this paper, we study the influence of the selective pressure on the
performance of cellular genetic algorithms. Cellular genetic algorithms are
genetic algorithms where the population is embedded on a toroidal grid. This
structure makes the propagation of the best so far individual slow down, and
allows to keep in the population potentially good solutions. We present two
selective pressure reducing strategies in order to slow down even more the best
solution propagation. We experiment these strategies on a hard optimization
problem, the quadratic assignment problem, and we show that there is a value
for of the control parameter for both which gives the best performance. This
optimal value does not find explanation on only the selective pressure,
measured either by take over time and diversity evolution. This study makes us
conclude that we need other tools than the sole selective pressure measures to
explain the performances of cellular genetic algorithms.
","[{""version"":""v1"",""created"":""Sat, 5 Apr 2008 13:27:51 GMT""}]","2008-12-18"
"0804.0853","Vincent Bansaye","Vincent Bansaye (PMA)","Surviving particles for subcritical branching processes in random
  environment",,,,,"math.PR","http://arxiv.org/licenses/nonexclusive-distrib/1.0/","  The asymptotic behavior of a subcritical Branching Process in Random
Environment (BPRE) starting with several particles depends on whether the BPRE
is strongly subcritical (SS), intermediate subcritical (IS) or weakly
subcritical (WS). %Descendances of particles for BPRE are not independent. In
the (SS+IS) case, the asymptotic probability of survival is proportional to the
initial number of particles, and conditionally on the survival of the
population, only one initial particle survives $a.s.$ These two properties do
not hold in the (WS) case and different asymptotics are established, which
require new results on random walks with negative drift. We provide an
interpretation of these results by characterizing the sequence of environments
selected when we condition on the survival of particles. This also raises the
problem of the dependence of the Yaglom quasistationary distributions on the
initial number of particles and the asymptotic behavior of the Q-process
associated with a subcritical BPRE.
","[{""version"":""v1"",""created"":""Sat, 5 Apr 2008 13:28:20 GMT""},{""version"":""v2"",""created"":""Tue, 15 Apr 2008 17:07:21 GMT""},{""version"":""v3"",""created"":""Wed, 10 Dec 2008 09:20:31 GMT""}]","2008-12-10"
"0804.0854","James Servantie","J. Servantie and M. M\""uller","Temperature dependence of the slip length in polymer melts at attractive
  surfaces","submitted to Phys. Rev. Lett","Phys. Rev. Lett. 101, 026101 (2008)","10.1103/PhysRevLett.101.026101",,"cond-mat.soft","http://arxiv.org/licenses/nonexclusive-distrib/1.0/","  Using Couette and Poiseuille flow, we extract the temperature dependence of
the slip length, $\delta$, from molecular dynamics simulations of a
coarse-grained polymer model in contact with an attractive, corrugated surface.
$\delta$ is dictated by the ratio of bulk viscosity and surface mobility. At
weakly attractive surfaces, a lubrication layer forms, $\delta$ is large and
increases upon cooling. Close to the glass transition temperature, $T_ g$, very
large slip lengths are observed. At a more attractive surface, a``stick y
surface layer"" is build up, which gives rise to a small slip length. Upon cool
ing, $\delta$ decreases at high temperatures, passes through a minimum and
grows upon approaching $T_g$. At strongly attractive surfaces, the Navier-slip
condit ion fails to describe Couette and Poiseuille flow simultaneously. The
simulation results are corroborated by a schematic, two-layer model suggesting
that the ob servations do not depend on the details of the computational model.
","[{""version"":""v1"",""created"":""Sat, 5 Apr 2008 13:42:57 GMT""}]","2009-11-13"
"0804.0855","Mariusz Dabrowski P.","Adam Balcerzak and Mariusz P. Dabrowski","Gibbons-Hawking Boundary Terms and Junction Conditions for Higher-Order
  Brane Gravity Models","REVTEX4, 6 pages, no figures, version to match a JCAP accepted paper","JCAP 0901:018,2009","10.1088/1475-7516/2009/01/018",,"hep-th astro-ph gr-qc","http://arxiv.org/licenses/nonexclusive-distrib/1.0/","  We derive the most general junction conditions for the fourth-order brane
gravity constructed of arbitrary functions of curvature invariants. We reduce
these fourth-order theories to second order theories at the expense of
introducing new scalar and tensor fields - the scalaron and the tensoron. In
order to obtain junction conditions we apply the method of generalized
Gibbons-Hawking boundary terms which are appended to the appropriate actions.
After assuming the continuity of the scalaron and the tensoron on the brane, we
recover junction conditions for such general brane universe models previously
obtained by different methods. The derived junction conditions can serve
studying the cosmological implications of the higher-order brane gravity
models.
","[{""version"":""v1"",""created"":""Sat, 5 Apr 2008 14:28:00 GMT""},{""version"":""v2"",""created"":""Sun, 13 Apr 2008 17:48:58 GMT""},{""version"":""v3"",""created"":""Wed, 16 Jul 2008 04:21:46 GMT""},{""version"":""v4"",""created"":""Wed, 7 Jan 2009 22:27:43 GMT""}]","2010-12-09"
"0804.0856","Bayarto Lubsandorzhiev","N.M.Budnev, O.B.Chvalaev, O.A.Gress, N.N.Kalmykov, V.A.Kozhin,
  E.E.Korosteleva, L.A.Kuzmichev, B.K.Lubsandorzhiev, R.R.Mirgazov, G.Navarra,
  M.I.Panasyuk, L.V.Pankov, V.V.Prosin, V.S.Ptuskin, Y.A.Semeney,
  A.V.Skurikhin, B.A.Shaibonov (Junior), Ch.Spiering, R.Wischnewski,
  I.V.Yashin, A.Z.Zablotsky, A.V.Zagorodnikov","Data acquisition system for the TUNKA-133 array","5 pages, 4 figures, Proceedings of the 10th ICATPP Conference,Como
  Italy, 8-12 October 2007",,"10.1142/9789812819093_0050",,"astro-ph","http://arxiv.org/licenses/nonexclusive-distrib/1.0/","  The new EAS Cherenkov array TUNKA-133, with about 1 km**2 sensitive area, is
being installed in the Tunka Valley. The investigated energy range is
10**15-10**18 eV. It will consist of 133 optical detectors based on EMI9350
PMTs. Optical detectors are grouped into 19 clusters with 7 detectors each. The
detectors are connected to the cluster box with RG-58 cables. Every PMT signal
is digitized in the cluster box with 200 MHz FADC. The cluster boxes are
connected to the data acquisition center with a 1 Gb/s optical link. A detailed
description of the data acquisition system (DAQ) is presented.
","[{""version"":""v1"",""created"":""Sat, 5 Apr 2008 14:28:02 GMT""},{""version"":""v2"",""created"":""Mon, 14 Apr 2008 13:52:56 GMT""}]","2017-08-23"
