"0804.0812","Eugene V. Sukhorukov","Eugene V. Sukhorukov, and Jonathan Edwards","Theory of quantum noise detectors based on resonant tunneling","11 pages, 4 figures","Phys. Rev. B 78, 035332 (2008)","10.1103/PhysRevB.78.035332",,"cond-mat.mes-hall","http://arxiv.org/licenses/nonexclusive-distrib/1.0/","  We propose to use the phenomenon of resonant tunneling for the detection of
noise. The main idea of this method relies on the effect of homogeneous
broadening of the resonant tunneling peak induced by the emission and
absorption of collective charge excitations in the measurement circuit. In
thermal equilibrium, the signal to noise ratio of the detector as a function of
the detector bandwidth (the detector function) is given by the universal
hyperbolic tangent, which is the statement of the fluctuation-dissipation
theorem. The universality breaks down if non-equilibrium processes take place
in the measurement circuit. We propose the theory of this phenomenon and make
predictions for the detector function in case when non-equilibrium noise is
created by a mesoscopic conductor. We investigate measurement circuit effects
and prove the universality of the classical noise detection. Finally, we
evaluate the contribution of the third cumulant of current and make suggestions
of how it can be measured.
","[{""version"":""v1"",""created"":""Fri, 4 Apr 2008 21:17:18 GMT""}]","2009-11-13"
"0804.0813","Kaibin Huang","Kaibin Huang, Jeffrey G. Andrews, Robert W. Heath, Jr, Dongning Guo,
  Randall A. Berry","Spatial Interference Cancelation for Mobile Ad Hoc Networks: Perfect CSI","6 pages; submitted to IEEE Globecom 2008",,"10.1109/ACSSC.2008.5074377",,"cs.IT cs.NI math.IT","http://arxiv.org/licenses/nonexclusive-distrib/1.0/","  Interference between nodes directly limits the capacity of mobile ad hoc
networks. This paper focuses on spatial interference cancelation with perfect
channel state information (CSI), and analyzes the corresponding network
capacity. Specifically, by using multiple antennas, zero-forcing beamforming is
applied at each receiver for canceling the strongest interferers. Given spatial
interference cancelation, the network transmission capacity is analyzed in this
paper, which is defined as the maximum transmitting node density under
constraints on outage and the signal-to-interference-noise ratio. Assuming the
Poisson distribution for the locations of network nodes and spatially i.i.d.
Rayleigh fading channels, mathematical tools from stochastic geometry are
applied for deriving scaling laws for transmission capacity. Specifically, for
small target outage probability, transmission capacity is proved to increase
following a power law, where the exponent is the inverse of the size of antenna
array or larger depending on the pass loss exponent. As shown by simulations,
spatial interference cancelation increases transmission capacity by an order of
magnitude or more even if only one extra antenna is added to each node.
","[{""version"":""v1"",""created"":""Fri, 4 Apr 2008 21:45:57 GMT""}]","2016-11-17"
"0804.0814","J. David Zook","J. David zook and Norbert Schroeder","Sensors as Information Transducers","53 Pages. Published in the Encyclopedia of Sensors, vol.9. pp.
  329-359 (2006)",,,,"physics.ins-det physics.gen-ph","http://arxiv.org/licenses/nonexclusive-distrib/1.0/","  This chapter reviews the mechanisms by which sensors gather information from
the physical world and transform it into the electronic signals that are used
in today's information and control systems. It introduces a new methodology for
describing sensing mechanisms based on the process of information flow and
applies it to the broad spectrum of sensors, instruments and data input devices
in current use. We identify four distinct elemental transduction processes:
energy conversion, energy dispersion, energy modulation and modulation of a
material property. We posit that these four mechanisms form a complete set for
describing information transduction in sensing systems.
","[{""version"":""v1"",""created"":""Fri, 4 Apr 2008 21:31:56 GMT""}]","2008-04-08"
"0804.0815","Jan Trlifaj","L. Angeleri Huegel, O. Kerner, J. Trlifaj","Large tilting modules and representation type","14 pages","Manuscripta Math. 132 (2010), 483-499",,,"math.RT math.RA","http://arxiv.org/licenses/nonexclusive-distrib/1.0/","  We study finiteness conditions on large tilting modules over arbitrary rings.
We then turn to a hereditary artin algebra R and apply our results to the
(infinite dimensional) tilting module L that generates all modules without
preprojective direct summands. We show that the behaviour of L over its
endomorphism ring determines the representation type of R. A similar result
holds true for the (infinite dimensional) tilting module W that generates the
divisible modules. Finally, we extend to the wild case some results on Baer
modules and torsion-free modules proven in [AHT] for tame hereditary algebras.
","[{""version"":""v1"",""created"":""Fri, 4 Apr 2008 21:48:23 GMT""}]","2016-01-06"
"0804.0816","Ivan Ezequiel Angiono","Iv\'an Ezequiel Angiono","On Nichols algebras with standard braiding","70 pages","Algebra & Number Theory, Vol. 3 (2009), No. 1, 35-106",,,"math.QA","http://arxiv.org/licenses/nonexclusive-distrib/1.0/","  The class of standard braided vector spaces, introduced by Andruskiewitsch
and the author in \texttt{arXiv:math/0703924v2} to understand the proof of a
theorem of Heckenberger \cite{H2}, is slightly more general than the class of
braided vector spaces of Cartan type. In the present paper, we classify
standard braided vector spaces with finite-dimensional Nichols algebra. For any
such braided vector space, we give a PBW-basis, a closed formula of the
dimension and a presentation by generators and relations of the associated
Nichols algebra.
","[{""version"":""v1"",""created"":""Fri, 4 Apr 2008 21:58:07 GMT""}]","2010-10-06"
"0804.0817","Paul Stokes","Paul Stokes and Saiful I. Khondaker","Controlled fabrication of single electron transistors from single-walled
  carbon nanotubes","5 pages, 3 figures","APL 92, 262107 (2008)","10.1063/1.2955520",,"cond-mat.mes-hall","http://arxiv.org/licenses/nonexclusive-distrib/1.0/","  Single electron transistors (SETs) are fabricated by placing single walled
carbon nanotubes (SWNTs) on a 100 nm wide local Al/Al2O3 bottom gate and then
contacting with Pd electrodes. Coulomb oscillations up to 125 K were observed
and charging energies of 12-15 meV with level spacing of ~5 meV were measured
from the Couloumb diamond, in agreement with a dot size of ~100 nm, implying
that the local gate defines the dot size by bending SWNT at the edges and
controls its operation. This ""mechanical template"" approach may facilitate
large scale fabrication of SET devices using SWNT.
","[{""version"":""v1"",""created"":""Fri, 4 Apr 2008 22:08:08 GMT""},{""version"":""v2"",""created"":""Mon, 16 Jun 2008 21:12:50 GMT""}]","2009-11-13"
"0804.0818","Graziano Rossi","Graziano Rossi, Ravi K. Sheth","Effect of Distance Errors: Applications to SDSS Early-Type Galaxies","5 pages, 2 figures, to appear in the proceedings of the XLIIIst
  Rencontres de Moriond, Cosmology, La Thuile, Italy, 15-22 March 2008",,,,"astro-ph","http://arxiv.org/licenses/nonexclusive-distrib/1.0/","  Noisy distance estimates associated with photometric rather than
spectroscopic redshifts lead to a mis-estimate of the luminosities, and produce
a correlated mis-estimate of the sizes. We consider a sample of early-type
galaxies from the SDSS DR6 and apply the generalization of the V_max method to
correct for these biases. We show that our technique recovers the true
redshift, magnitude and size distributions, as well as the true size-luminosity
relation. Regardless the specific application outlined here, our method impacts
a broader range of studies, when at least one distance-dependent quantity is
involved.
","[{""version"":""v1"",""created"":""Fri, 4 Apr 2008 22:54:05 GMT""}]","2008-04-08"
"0804.0819","Namrata Vaswani","Namrata Vaswani","Kalman Filtered Compressed Sensing","A slightly shorter version submitted to IEEE Intl. Conf. Image Proc.
  (ICIP) 2008. (5 pages, 1 figure)",,"10.1109/ICIP.2008.4711899",,"cs.IT math.IT math.ST stat.TH","http://arxiv.org/licenses/nonexclusive-distrib/1.0/","  We consider the problem of reconstructing time sequences of spatially sparse
signals (with unknown and time-varying sparsity patterns) from a limited number
of linear ""incoherent"" measurements, in real-time. The signals are sparse in
some transform domain referred to as the sparsity basis. For a single spatial
signal, the solution is provided by Compressed Sensing (CS). The question that
we address is, for a sequence of sparse signals, can we do better than CS, if
(a) the sparsity pattern of the signal's transform coefficients' vector changes
slowly over time, and (b) a simple prior model on the temporal dynamics of its
current non-zero elements is available. The overall idea of our solution is to
use CS to estimate the support set of the initial signal's transform vector. At
future times, run a reduced order Kalman filter with the currently estimated
support and estimate new additions to the support set by applying CS to the
Kalman innovations or filtering error (whenever it is ""large"").
","[{""version"":""v1"",""created"":""Fri, 4 Apr 2008 22:56:33 GMT""}]","2016-11-17"
"0804.0820","Ewelina Hankiewicz","E. M. Hankiewicz, G. Vignale and Y. Tserkovnyak","Inhomogeneous Gilbert damping from impurities and electron-electron
  interactions","5 pages, 1 figure","Phys. Rev. B 78, 020404 (2008)","10.1103/PhysRevB.78.020404",,"cond-mat.mes-hall cond-mat.mtrl-sci","http://arxiv.org/licenses/nonexclusive-distrib/1.0/","  We present a unified theory of magnetic damping in itinerant electron
ferromagnets at order $q^2$ including electron-electron interactions and
disorder scattering. We show that the Gilbert damping coefficient can be
expressed in terms of the spin conductivity, leading to a Matthiessen-type
formula in which disorder and interaction contributions are additive. In a weak
ferromagnet regime, electron-electron interactions lead to a strong enhancement
of the Gilbert damping.
","[{""version"":""v1"",""created"":""Fri, 4 Apr 2008 23:31:34 GMT""},{""version"":""v2"",""created"":""Sat, 9 Aug 2008 18:31:44 GMT""}]","2009-11-13"
"0804.0821","Hao Sha","Hao Sha, F. Ye, Pengcheng Dai, J. A. Fernandez-Baca, D. Mesa, J. W.
  Lynn, Y. Tomioka, Y. Tokura, Jiandi Zhang","Signature of Magnetic Phase Separation in the Ground State of
  Pr1-xCaxMnO3","4 pages, 4 figures, submitted to Phys. Rev. Letters",,"10.1103/PhysRevB.78.052410",,"cond-mat.str-el cond-mat.mtrl-sci","http://arxiv.org/licenses/nonexclusive-distrib/1.0/","  Neutron scattering has been used to investigate the evolution of the long-
and short-range charge-ordered (CO), ferromagnetic (FM), and antiferromagnetic
(AF) correlations in single crystals of Pr1-xCaxMnO3. The existence and
population of spin clusters as refected by short-range correlations are found
to drastically depend on the doping (x) and temperature (T). Concentrated spin
clusters coexist with long-range canted AF order in a wide temperature range in
x = 0.3 while clusters do not appear in x = 0.4 crystal. In contrast, both CO
and AF order parameters in the x = 0.35 crystal show a precipitous decrease
below ~ 35 K where spin clusters form. These results provide direct evidence of
magnetic phase separation and indicate that there is a critical doping x_c
(close to x = 0.35) that divides the phase-separated site-centered from the
homogeneous bond-centered or charge-disproportionated CO ground state.
","[{""version"":""v1"",""created"":""Fri, 4 Apr 2008 23:33:23 GMT""}]","2009-11-13"
"0804.0822","Eric Keto","Eric Keto and Paola Caselli","The Different Structures of the Two Classes of Starless Cores","ApJ in press",,"10.1086/589147",,"astro-ph","http://arxiv.org/licenses/nonexclusive-distrib/1.0/","  We describe a model for the thermal and dynamical equilibrium of starless
cores that includes the radiative transfer of the gas and dust and simple CO
chemistry. The model shows that the structure and behavior of the cores is
significantly different depending on whether the central density is either
above or below about 10^5 cm-3. This density is significant as the critical
density for gas cooling by gas-dust collisions and also as the critical density
for dynamical stability, given the typical properties of the starless cores.
The starless cores thus divide into two classes that we refer to as thermally
super-critical and thermally sub-critical.This two-class distinction allows an
improved interpretation of the different observational data of starless cores
within a single model.
","[{""version"":""v1"",""created"":""Fri, 4 Apr 2008 23:38:20 GMT""},{""version"":""v2"",""created"":""Wed, 11 Jun 2008 15:24:31 GMT""}]","2009-11-13"
"0804.0824","Vladimir Z. Kresin","Baopeng Cao, Colleen M. Neal, Anne K. Starace, Yurii N. Ovchinnikov,
  Vladimir Z. Kresin, Martin F. Jarrold","Evidence for High Tc Superconducting Transitions in Isolated Al45- and
  Al47- Nanoclusters",,,,,"cond-mat.supr-con physics.atm-clus","http://arxiv.org/licenses/nonexclusive-distrib/1.0/","  Heat capacities measured for Al45- and Al47- nanoclusters have reproducible
jumps at ~ 200 K. These jumps are consistent with theoretical predictions that
some clusters with highly degenerate electronic states near the Fermi level
will undergo a transition into a high Tc superconducting state. An analysis
based on a theoretical treatment of pairing in Al45- and Al47- agrees well with
the experimental data in both the value of the critical temperature and in the
size and width of the jumps in the heat capacity.
","[{""version"":""v1"",""created"":""Sat, 5 Apr 2008 00:12:26 GMT""}]","2008-04-09"
"0804.0826","Roberto H. Mendez","R. H. Mendez, A. M. Teodorescu, D. Schoenberner, R. Jacob, M. Steffen","Toward better simulations of planetary nebulae luminosity functions","23 pages, 9 figures, accepted for publication in ApJ",,"10.1086/588808",,"astro-ph","http://arxiv.org/licenses/nonexclusive-distrib/1.0/","  We describe a procedure for the numerical simulation of the planetary nebulae
luminosity function (PNLF), improving on previous work (Mendez & Soffner 1997).
Earlier PNLF simulations were based on an imitation of the observed
distribution of the intensities of [O III] 5007 relative to Hbeta, generated
predominantly using random numbers. We are now able to replace this by a
distribution derived from the predictions of hydrodynamical PN models
(Schoenberner et al. 2007), which are made to evolve as the central star moves
across the HR diagram, using proper initial and boundary conditions. In this
way we move one step closer to a physically consistent procedure for the
generation of a PNLF. As an example of these new simulations, we have been able
to reproduce the observed PNLF in the Small Magellanic Cloud.
","[{""version"":""v1"",""created"":""Sat, 5 Apr 2008 01:05:18 GMT""}]","2009-11-13"
"0804.0827","Xianli Zhang","X. L. Zhang, R. S. Fletcher, S. L. Rolston, P. N. Guzdar, and M.
  Swisdak","Ultracold Plasma Expansion in a Magnetic Field","4 pages, 5 figures, submitted to PRL","Phys. Rev. Lett. 100, 235002 (2008)","10.1103/PhysRevLett.100.235002",,"physics.plasm-ph","http://creativecommons.org/licenses/by/3.0/","  We measure the expansion of an ultracold plasma across the field lines of a
uniform magnetic field. We image the ion distribution by extracting the ions
with a high voltage pulse onto a position-sensitive detector. Early in the
lifetime of the plasma ($< 20$ $\mu$s), the size of the image is dominated by
the time-of-flight Coulomb explosion of the dense ion cloud. For later times,
we measure the 2-D Gaussian width of the ion image, obtaining the transverse
expansion velocity as a function of magnetic field (up to 70 G). We observe
that the expansion velocity scales as B$^{-1/2}$, explained by a nonlinear
ambipolar diffusion model with anisotropic diffusion in two different
directions.
","[{""version"":""v1"",""created"":""Sat, 5 Apr 2008 01:05:56 GMT""}]","2009-11-13"
"0804.0828","Rubin","Robert H. Rubin, Janet P. Simpson, Sean W.J. Colgan, Reginald J.
  Dufour, Gregory Brunner, Ian A. McNabb, Adalbert W.A. Pauldrach, Edwin F.
  Erickson, Michael R. Haas, and Robert I. Citron","Spitzer Observations of M33 and the Hot Star, H II Region Connection","Accepted MNRAS: 47 pages, 12 figures, 6 tables, abstract truncated",,,,"astro-ph","http://arxiv.org/licenses/nonexclusive-distrib/1.0/","  We have observed emission lines of [S IV] 10.51, H(7-6) 12.37, [Ne II] 12.81,
[Ne III] 15.56, and [S III] 18.71 um in a number of extragalactic H II regions
with the Spitzer Space Telescope. A previous paper presented our data and
analysis for the substantially face-on spiral galaxy M83. Here we report our
results for the local group spiral galaxy M33. The nebulae selected cover a
wide range of galactocentric radii (R_G). The observations were made with the
Infrared Spectrograph with the short wavelength, high resolution module. The
above set of five lines is observed cospatially, thus permitting a reliable
comparison of the fluxes. From the measured fluxes, we determine the ionic
abundance ratios including Ne++/Ne+, S3+/S++, and S++/Ne+ and find that there
is a correlation of increasingly higher ionization with larger R_G. By sampling
the dominant ionization states of Ne (Ne+, Ne++) and S (S++, S3+) for H II
regions, we can estimate the Ne/H, S/H, and Ne/S ratios. We find from linear
least-squares fits that there is a decrease in metallicity with increasing R_G:
d log (Ne/H)/dR_G = -0.058+-0.014 and d log (S/H)/dR_G = -0.052+-0.021 dex
kpc-1. There is no apparent variation in the Ne/S ratio with R_G. Unlike our
previous similar study of M83, where we conjectured that this ratio was an
upper limit, for M33 the derived ratios are likely a robust indication of Ne/S.
This occurs because the H II regions have lower metallicity and higher
ionization than those in M83. Both Ne and S are primary elements produced in
alpha-chain reactions, following C and O burning in stars, making their yields
depend very little on the stellar metallicity. Thus, it is expected that Ne/S
remains relatively constant throughout a galaxy. The median (average) Ne/S
ratio derived for H II regions in M33 is 16.3 (16.9), just slightly higher than
","[{""version"":""v1"",""created"":""Sat, 5 Apr 2008 01:08:31 GMT""}]","2008-04-08"
"0804.0829","Jozsi Jalics","Jozsi Jalics, Martin Krupa, Horacio G. Rotstein","A novel canard-based mechanism for mixed-mode oscillations in a neuronal
  model","46 pages, 17 figures",,,,"math.DS physics.bio-ph q-bio.NC","http://arxiv.org/licenses/nonexclusive-distrib/1.0/","  We analyze a biophysical model of a neuron from the entorhinal cortex that
includes persistent sodium and slow potassium as non-standard currents using
reduction of dimension and dynamical systems techniques to determine the
mechanisms for the generation of mixed-mode oscillations. We have found that
the standard spiking currents (sodium and potassium) play a critical role in
the analysis of the interspike interval. To study the mixed-mode oscillations,
the six dimensional model has been reduced to a three dimensional model for the
subthreshold regime. Additional transformations and a truncation have led to a
simplified model system with three timescales that retains many properties of
the original equations, and we employ this system to elucidate the underlying
structure and explain a novel mechanism for the generation of mixed-mode
oscillations based on the canard phenomenon. In particular, we prove the
existence of a special solution, a singular primary canard, that serves as a
transition between mixed-mode oscillations and spiking in the singular limit by
employing appropriate rescalings, center manifold reductions, and energy
arguments. Additionally, we conjecture that the singular canard solution is the
limit of a family of canards and provide numerical evidence for the conjecture.
","[{""version"":""v1"",""created"":""Sat, 5 Apr 2008 01:40:45 GMT""}]","2008-04-08"
"0804.0830","C. K. Raju Dr","C. K. Raju","Time Travel and the Reality of Spontaneity","17 pages, 6 figures, Fig. 6 size reduced","Found.Phys.36:1099-1113,2006","10.1007/s10701-006-9056-x",,"physics.gen-ph","http://arxiv.org/licenses/nonexclusive-distrib/1.0/","  Contrary to the informed consensus, time travel implies spontaneity (as
distinct from chance) so that time travel can only be of the second kind.
","[{""version"":""v1"",""created"":""Sat, 5 Apr 2008 01:43:34 GMT""}]","2011-07-22"
"0804.0831","Masaya Iwabuchi","Belle Collaboration: M. Iwabuchi, M. Nakao, et al","Search for B+ -> D*+ pi0 decay","5pages, 2figures, submitted to PRL (v1); PRL published version (v2:
  minor corrections in the text)","Phys.Rev.Lett.101:041601,2008","10.1103/PhysRevLett.101.041601","Belle Preprint 2008-9, KEK Preprint 2008-2","hep-ex","http://arxiv.org/licenses/nonexclusive-distrib/1.0/","  We report on a search for the doubly Cabibbo suppressed decay B+ -> D*+ pi0,
based on a data sample of 657 million BBbar pairs collected at the Upsilon(4S)
resonance with the Belle detector at the KEKB asymmetric energy e+ e- collider.
We find no significant signal and set an upper limit of Br(B+ -> D*+ pi0) < 3.6
x 10^-6 at the 90% confidence level. This limit can be used to constrain the
ratio between suppressed and favored B -> D* pi decay amplitudes, r < 0.051, at
the 90% confidence level.
","[{""version"":""v1"",""created"":""Sat, 5 Apr 2008 01:53:58 GMT""},{""version"":""v2"",""created"":""Mon, 28 Jul 2008 07:46:02 GMT""}]","2008-11-26"
"0804.0832","Matthew Baring","Matthew G. Baring","Photon Splitting and Pair Conversion in Strong Magnetic Fields","18 pages, 3 embedded figures, invited review, to appear in Proc.
  CASYS '07 Conference ""Computing Anticipatory Systems,"" eds. D. Dubois, et al.
  (AIP Conf. Proc., New York, 2008)","AIP Conf.Proc.1051:53-64,2008","10.1063/1.3020681",,"astro-ph","http://arxiv.org/licenses/nonexclusive-distrib/1.0/","  The magnetospheres of neutron stars provide a valuable testing ground for
as-yet unverified theoretical predictions of quantum electrodynamics (QED) in
strong electromagnetic fields. Exhibiting magnetic field strengths well in
excess of a TeraGauss, such compact astrophysical environments permit the
action of exotic mechanisms that are forbidden by symmetries in field-free
regions. Foremost among these processes are single-photon pair creation, where
a photon converts to an electron-positron pair, and magnetic photon splitting,
where a single photon divides into two of lesser energy via the coupling to the
external field. The pair conversion process is exponentially small in weak
fields, and provides the leading order contribution to vacuum polarization. In
contrast, photon splitting possesses no energy threshold and can operate in
kinematic regimes where the lower order pair conversion is energetically
forbidden. This paper outlines some of the key physical aspects of these
processes, and highlights their manifestation in neutron star magnetospheres.
Anticipated observational signatures include profound absorption turnovers in
pulsar spectra at gamma-ray wavelengths. The shapes of these turnovers provide
diagnostics on the possible action of pair creation and the geometrical locale
of the photon emission region. There is real potential for the first
confirmation of strong field QED with the new GLAST mission, to be launched by
NASA in 2008. Suppression of pair creation by photon splitting and its
implications for pulsars is also discussed.
","[{""version"":""v1"",""created"":""Sat, 5 Apr 2008 02:00:55 GMT""}]","2009-06-23"
"0804.0833","Peter Hogan","C. Barrabes and P. A. Hogan","On Generating Gravity Waves with Matter and Electromagnetic Waves","Latex file, 15 pages, accepted for publication in Physical Review D","Phys.Rev.D77:104014,2008","10.1103/PhysRevD.77.104014",,"gr-qc","http://arxiv.org/licenses/nonexclusive-distrib/1.0/","  If a homogeneous plane light-like shell collides head-on with a homogeneous
plane electromagnetic shock wave having a step-function profile then no
backscattered gravitational waves are produced. We demonstrate, by explicit
calculation, that if the matter is accompanied by a homogeneous plane
electromagnetic shock wave with a step-function profile then backscattered
gravitational waves appear after the collision.
","[{""version"":""v1"",""created"":""Sat, 5 Apr 2008 02:19:58 GMT""}]","2008-11-26"
"0804.0834","Hao Pan","Hao Pan","q-Analogue of Gauss' Divisibility Theorem","4 pages",,,,"math.NT math.CO","http://creativecommons.org/licenses/by/3.0/","  We give a q-analogue of Gauss' divisibility theorem
","[{""version"":""v1"",""created"":""Sat, 5 Apr 2008 03:16:27 GMT""}]","2008-04-08"
"0804.0835","Lei Fang","Peng Cheng, Lei Fang, Huan Yang, Xiyu Zhu, Gang Mu, Huiqian Luo,
  Zhaosheng Wang and Hai-Hu Wen","Superconductivity at 36 K in Gadolinium-arsenide Oxides
  GdO$_{1-x}$F$_{x}$FeAs","3 pages, 4 figures","Science in China G 51(6), 719-722(2008).","10.1007/s11433-008-0075-9",,"cond-mat.supr-con","http://arxiv.org/licenses/nonexclusive-distrib/1.0/","  In this paper we report the fabrication and superconducting properties of
GdO$_{1-x}$F$_{x}$FeAs. It is found that when x is equal to 0.17,
GdO$_{0.83}$F$_{0.17}$FeAs is a superconductor with the onset transition
temperature T$_{c}^{on}\approx$ 36.6K. Resistivity anomaly near 130K was
observed for all samples up to x = 0.17, such a phenomenon is similar to that
of LaO$_{1-x}$F$_{x}$FeAs. Hall coefficient indicates that
GdO$_{0.83}$F$_{0.17}$FeAs is conducted by electron-like charge carriers.
","[{""version"":""v1"",""created"":""Sat, 5 Apr 2008 03:45:43 GMT""},{""version"":""v2"",""created"":""Tue, 8 Apr 2008 03:28:55 GMT""}]","2009-11-13"
