"0804.0613","Brenno Carlini Vallilo","William D. Linch III, Jock McOrist, Brenno Carlini Vallilo","Type IIB Flux Vacua from the String Worldsheet","29 pages; added references and fixed typo's","JHEP 0809:042,2008","10.1088/1126-6708/2008/09/042",,"hep-th","http://arxiv.org/licenses/nonexclusive-distrib/1.0/","  We study type IIB string compactifications in the presence of RR and NSNS
fluxes using worldsheet techniques. Vertex operators corresponding to internal
RR and NSNS fluxes are constructed in the hybrid formalism with manifest target
space supersymmetry. In a simple class of examples, we compute various known
physical phenomena such as warping and the generation of a superpotential for
complex structure moduli. The results are in precise agreement with the
supergravity literature.
","[{""version"":""v1"",""created"":""Fri, 4 Apr 2008 18:46:41 GMT""},{""version"":""v2"",""created"":""Wed, 25 Jun 2008 15:03:02 GMT""}]","2009-12-04"
"0804.0614","Paul Koerber","Paul Koerber, Dieter Lust and Dimitrios Tsimpis","Type IIA AdS4 compactifications on cosets, interpolations and domain
  walls","39 pages, 4 figures, 4 tables; v2: added reference, corrected eqs.
  (4.12)-(4.14) and (4.25)-(4.27)","JHEP 0807:017,2008","10.1088/1126-6708/2008/07/017","MPP-2008-29, LMU-ASC 19/08","hep-th","http://arxiv.org/licenses/nonexclusive-distrib/1.0/","  We present a classification of a large class of type IIA N=1 supersymmetric
compactifications to AdS4, based on left-invariant SU(3)-structures on coset
spaces. In the absence of sources the parameter spaces of all cosets leading to
a solution contain regions corresponding to nearly-Kaehler structure. I.e. all
these cosets can be viewed as deformations of nearly-Kaehler manifolds.
Allowing for (smeared) six-brane/orientifold sources we obtain more
possibilities. In the second part of the paper, we use a simple ansatz, which
can be applied to all six-dimensional coset manifolds considered here, to
construct explicit thick domain wall solutions separating two AdS4 vacua of
different radii. We also consider smooth interpolations between AdS4 x M6 and
R^{1,2} x M7, where M6 is a nearly-Kaehler manifold and M7 is the G2-holonomy
cone over M6.
","[{""version"":""v1"",""created"":""Fri, 4 Apr 2008 16:31:27 GMT""},{""version"":""v2"",""created"":""Wed, 2 Jul 2008 14:20:13 GMT""}]","2009-10-07"
"0804.0621","Arnon Dar","Shlomo Dado, Arnon Dar, A. De Rujula","Is there anything special about GRB 080319B?","8 pages, 4 figures",,,,"astro-ph","http://arxiv.org/licenses/nonexclusive-distrib/1.0/","  We show that the properties of gamma ray burst 080319B and its afterglow are
well reproduced by the cannonball model of long gamma ray bursts (GRBs). It was
an ordinary GRB, produced by a jet of highly relativistic plasmoids (CBs),
ejected in a core-collapse supernova (SN) and viewed, as some others before,
particularly close to the CB-emission axis. It still remains to be seen whether
GRB 080319B was associated with an SN akin to SN1998bw, the SN type ordinarily
associated with GRBs, or with a much more luminous SN.
","[{""version"":""v1"",""created"":""Fri, 4 Apr 2008 16:54:19 GMT""}]","2008-04-07"
"0804.0622","Johannes Heinonen","Csaba Csaki, Johannes Heinonen, Maxim Perelstein and Christian
  Spethmann","A Weakly Coupled Ultraviolet Completion of the Littlest Higgs with
  T-parity","v1: 30 pages, 4 figures v2: minor clarifications added and typos
  corrected","Phys.Rev.D79:035014,2009","10.1103/PhysRevD.79.035014",,"hep-ph hep-th","http://arxiv.org/licenses/nonexclusive-distrib/1.0/","  We construct a weakly coupled, renormalizable ultraviolet completion of the
Littlest Higgs model with T-parity (LHT), based on an SU(5)xSU(2)xU(1) gauge
theory with a discrete Z_2 symmetry. Our model reproduces the complete
structure of the LHT below the 10 TeV scale, including the collective symmetry
breaking mechanism which solves the little hierarchy problem. The model is
manifestly free of anomalies, including both gauge/gravitational anomalies and
anomalies involving T-parity. At the TeV scale, the model contains additional
states not present in the LHT. We estimate the impact of these states on
precision electroweak observables, and show that the model is realistic. We
also discuss how our model can be embedded into a supersymmetric theory or a
five-dimensional setup with a warped extra dimension, stabilyzing the hierarchy
between the 10 TeV and the Planck scale.
","[{""version"":""v1"",""created"":""Fri, 4 Apr 2008 19:18:47 GMT""},{""version"":""v2"",""created"":""Thu, 3 Jul 2008 15:44:31 GMT""}]","2009-11-13"
"0804.0623","Claudio Mendoza","P. Palmeri, P. Quinet, C. Mendoza, M. A. Bautista, J. Garcia, and T.
  R. Kallman","K-vacancy levels in Ne, Mg, Si, S, Ar, and Ca","31 pages, 5 figures, 2 machine-readable tables",,,,"astro-ph","http://arxiv.org/licenses/nonexclusive-distrib/1.0/","  The HFR and AUTOSTRUCTURE atomic structure codes are used to compute complete
data sets of level energies, wavelengths, A-values, and radiative and Auger
widths for K-vacancy states of the Ne, Mg, Si, S, Ar, and Ca isonuclear
sequences. Ions with electron number N>9 are treated for the first time.
Detailed comparisons with previous measurements and theoretical data for ions
with N<=9 are carried out in order to estimate reliable accuracy ratings.
","[{""version"":""v1"",""created"":""Fri, 4 Apr 2008 19:41:25 GMT""}]","2008-04-07"
"0804.0646","Bohan Fang","Bohan Fang","Homological mirror symmetry is T-duality for $\mathbb P^n$","21 pages, 4 figures, submitted version",,,,"math.SG math.AG","http://arxiv.org/licenses/nonexclusive-distrib/1.0/","  In this paper, we apply the idea of T-duality to projective spaces. From a
connection on a line bundle on $\mathbb P^n$, a Lagrangian in the mirror
Landau-Ginzburg model is constructed. Under this correspondence, the full
strong exceptional collection $\mathcal O_{\mathbb P^n}(-n-1),...,\mathcal
O_{\mathbb P^n}(-1)$ is mapped to standard Lagrangians in the sense of
\cite{nz}. Passing to constructible sheaves, we explicitly compute the quiver
structure of these Lagrangians, and find that they match the quiver structure
of this exceptional collection of $\mathbb P^n$. In this way, T-duality
provides quasi-equivalence of the Fukaya category generated by these
Lagrangians and the category of coherent sheaves on $\mathbb P^n$, which is a
kind of homological mirror symmetry.
","[{""version"":""v1"",""created"":""Fri, 4 Apr 2008 19:44:37 GMT""},{""version"":""v2"",""created"":""Wed, 29 Oct 2008 19:35:48 GMT""}]","2008-10-29"
"0804.0651","Ashoke Sen","Ashoke Sen","U-duality Invariant Dyon Spectrum in type II on T^6","LaTeX file, 9 pages; minor corrections","JHEP 0808:037,2008","10.1088/1126-6708/2008/08/037",,"hep-th","http://arxiv.org/licenses/nonexclusive-distrib/1.0/","  We give a manifestly U-duality invariant formula for the degeneracy of 1/8
BPS dyons in type II string theory on T^6 for a U-duality invariant subset of
charge vectors. Besides depending on the Cremmer-Julia invariant the degeneracy
also depends on other discrete invariants of E_{7(7)}(Z).
","[{""version"":""v1"",""created"":""Fri, 4 Apr 2008 16:10:34 GMT""},{""version"":""v2"",""created"":""Sat, 5 Apr 2008 06:58:00 GMT""},{""version"":""v3"",""created"":""Thu, 30 Jul 2009 13:20:12 GMT""}]","2009-09-15"
"0804.0778","Michael C. Ogilvie","Michael C. Ogilvie and Peter N. Meisinger","PT symmetry and large-N models","15 pages, to be published in J. Phys. A special issue on Pseudo
  Hermitian Hamiltonians in Quantum Physics","J.Phys.A41:244021,2008","10.1088/1751-8113/41/24/244021",,"hep-th","http://arxiv.org/licenses/nonexclusive-distrib/1.0/","  Recently developed methods for PT-symmetric models can be applied to
quantum-mechanical matrix and vector models. In matrix models, the calculation
of all singlet wave functions can be reduced to the solution a one-dimensional
PT-symmetric model. The large-N limit of a wide class of matrix models exists,
and properties of the lowest-lying singlet state can be computed using WKB. For
models with cubic and quartic interactions, the ground state energy appears to
show rapid convergence to the large-N limit. For the special case of a quartic
model, we find explicitly an isospectral Hermitian matrix model. The Hermitian
form for a vector model with O(N) symmetry can also be found, and shows many
unusual features. The effective potential obtained in the large-N limit of the
Hermitian form is shown to be identical to the form obtained from the original
PT-symmetric model using familiar constraint field methods. The analogous
constraint field prescription in four dimensions suggests that PT-symmetric
scalar field theories are asymptotically free.
","[{""version"":""v1"",""created"":""Fri, 4 Apr 2008 16:01:08 GMT""}]","2008-11-26"
"0804.0779","Wen-Yu Wen","Wen-Yu Wen","Universal ratio as lower bound","7 pages, 1 figure, revtex4",,,,"hep-th cond-mat.stat-mech","http://arxiv.org/licenses/nonexclusive-distrib/1.0/","  We refine the definition of universal ratio c/\tilde{c} obtained via AdS/CFT
correspondence as shown in arXiv:0801.2785 [hep-th], denoted as \gamma_c, and
apply it to non-CFTs whose dual gravitational theory have metric of asymptotic
AdS. We conjecture that \gamma_c=1 is the lower bound being saturated at high
temperature regime and serves as an ordering parameter as energy scale varies.
We test this conjecture with the hard wall AdS/QCD toy model and N=2*
Pilch-Warner solution and find the agreement. At last, we make a connection
with the C-Theorem and prove this conjecture in a general holographic
background with multi-kink geometry.
","[{""version"":""v1"",""created"":""Fri, 4 Apr 2008 16:14:02 GMT""}]","2008-04-07"
"0804.0780","Mikhail Lyubich","Mikhail Lyubich, Marco Martens","Renormalization in the H\'enon family, II: The heteroclinic web",,,,"Stony Brook IMS # 2008/2","math.DS","http://arxiv.org/licenses/nonexclusive-distrib/1.0/","  We study highly dissipative H\'enon maps $$ F_{c,b}: (x,y) \mapsto (c-x^2-by,
x) $$ with zero entropy. They form a region $\Pi$ in the parameter plane
bounded on the left by the curve $W$ of infinitely renormalizable maps. We
prove that Morse-Smale maps are dense in $\Pi$, but there exist infinitely many
different topological types of such maps (even away from $W$). We also prove
that in the infinitely renormalizable case, the average Jacobian $b_F$ on the
attracting Cantor set $\OO_F$ is a topological invariant. These results come
from the analysis of the heteroclinic web of the saddle periodic points based
on the renormalization theory. Along these lines, we show that the unstable
manifolds of the periodic points form a lamination outside $\OO_F$ if and only
if there are no heteroclinic tangencies.
","[{""version"":""v1"",""created"":""Fri, 4 Apr 2008 19:06:47 GMT""},{""version"":""v2"",""created"":""Fri, 4 Apr 2008 21:20:36 GMT""}]","2008-04-07"
"0804.0781","Domenico Truzzolillo","D. Truzzolillo, F. Bordi, F. Sciortino and C. Cametti","Kinetic Arrest in Polyion-Induced Inhomogeneously-Charged Colloidal
  Particle Aggregation","9 pages. 11 figures",,"10.1140/epje/i2009-10471-1",,"cond-mat.soft","http://arxiv.org/licenses/nonexclusive-distrib/1.0/","  Polymer chains adsorbed onto oppositely charged spherical colloidal particles
can significantly modify the particle-particle interactions. For sufficient
amounts of added polymers, the original electrostatic repulsion can even turn
into an effective attraction and relatively large kinetically stable aggregates
can form which display several unexpected and interesting peculiarities and
some intriguing biotechnological implications. The attractive interaction
contribution between two oppositely particles arises from the correlated
adsorption of polyions at the oppositely charged particle surfaces, resulting
in a non-homogeneous surface charge distribution. Here, we investigate the
aggregation kinetics of polyion-induced colloidal complexes through Monte Carlo
simulation, in which the effect of charge anisotropy is taken into account by a
DLVO-like intra-particle potential, as recentely proposed by Velegol and Thwar
[D. Velegol and P.K. Thwar, Langmuir, 17, 2001]. The results reveal that in the
presence of a charge heterogeneity the aggregation process slows down due to
the progressive increase of the potential barrier height upon clustering.
Within this framework, the experimentally observed cluster phases in
polyelectrolyte-liposomes solutions should be considered as a kinetic arrested
state.
","[{""version"":""v1"",""created"":""Fri, 4 Apr 2008 16:40:00 GMT""},{""version"":""v2"",""created"":""Mon, 26 May 2008 08:05:56 GMT""}]","2015-05-13"
"0804.0782","Rishi Sharma","Elena Gubankova, Massimo Mannarelli and Rishi Sharma","Collective modes in asymmetric ultracold Fermi systems","41 pages, 6 figures. Expanded introduction, improved figures,
  conclusions unchanged. Version to match the published version","Annals Phys.325:1987-2017,2010","10.1016/j.aop.2010.05.001",,"cond-mat.supr-con cond-mat.stat-mech hep-ph","http://arxiv.org/licenses/nonexclusive-distrib/1.0/","  We derive the low energy effective action for the collective modes in systems
of fermions interacting via a short-range s-wave attraction, featuring unequal
chemical potentials for the two fermionic species (asymmetric systems). As a
consequence of the attractive interaction, fermions form a condensate that
spontaneously breaks the U(1) symmetry associated with total number
conservation. Therefore at sufficiently small temperatures and asymmetries, the
system is a superfluid. We reproduce previous results for the stability
conditions of the system as a function of the four-fermion coupling and
asymmetry. We obtain these results analyzing the coefficients of the low energy
effective Lagrangian of the modes describing fluctuations in the magnitude
(Higgs mode) and in the phase (Goldstone mode) of the difermion condensate. We
find that for certain values of parameters, the mass of the Higgs mode
decreases with increasing mismatch between the chemical potentials of the two
populations, if we keep the scattering length and the gap parameter constant.
Furthermore, we find that the energy cost for creating a position dependent
fluctuation of the condensate is constant in the gapped region and increases in
the gapless region. These two features may lead to experimentally detectable
effects. As an example, we argue that if the superfluid is put in rotation, the
square of the radius of the outer core of a vortex should sharply increase on
increasing the asymmetry, when we pass through the relevant region in the
gapless superfluid phase. Finally, by gauging the global U(1) symmetry, we
relate the coefficients of the effective Lagrangian of the Goldstone mode with
the screening masses of the gauge field.
","[{""version"":""v1"",""created"":""Fri, 4 Apr 2008 16:42:06 GMT""},{""version"":""v2"",""created"":""Wed, 13 Jan 2010 16:33:01 GMT""},{""version"":""v3"",""created"":""Wed, 21 Jul 2010 03:31:28 GMT""}]","2014-11-18"
"0804.0783","Isabel M. C. Salavessa","Guanghan Li and Isabel M.C. Salavessa","Mean Curvature Flow of Spacelike Graphs","version 5: Math.Z (online first 30 July 2010). version 4: 30 pages:
  we replace the condition $K_1\geq 0$ by the the weaker one $Ricci_1\geq 0$.
  The proofs are essentially the same. We change the title to a shorter one. We
  add an application",,"10.1007/s00209-010-0768-4",,"math.DG math.AP","http://arxiv.org/licenses/nonexclusive-distrib/1.0/","  We prove the mean curvature flow of a spacelike graph in $(\Sigma_1\times
\Sigma_2, g_1-g_2)$ of a map $f:\Sigma_1\to \Sigma_2$ from a closed Riemannian
manifold $(\Sigma_1,g_1)$ with $Ricci_1> 0$ to a complete Riemannian manifold
$(\Sigma_2,g_2)$ with bounded curvature tensor and derivatives, and with
sectional curvatures satisfying $K_2\leq K_1$, remains a spacelike graph,
exists for all time, and converges to a slice at infinity. We also show, with
no need of the assumption $K_2\leq K_1$, that if $K_1>0$, or if $Ricci_1>0$ and
$K_2\leq -c$, $c>0$ constant, any map $f:\Sigma_1\to \Sigma_2$ is trivially
homotopic provided $f^*g_2<\rho g_1$ where
$\rho=\min_{\Sigma_1}K_1/\sup_{\Sigma_2}K_2^+\geq 0$, in case $K_1>0$, and
$\rho=+\infty$ in case $K_2\leq 0$. This largely extends some known results for
$K_i$ constant and $\Sigma_2$ compact, obtained using the Riemannian structure
of $\Sigma_1\times \Sigma_2$, and also shows how regularity theory on the mean
curvature flow is simpler and more natural in pseudo-Riemannian setting then in
the Riemannian one.
","[{""version"":""v1"",""created"":""Fri, 4 Apr 2008 17:18:40 GMT""},{""version"":""v2"",""created"":""Thu, 10 Apr 2008 14:09:26 GMT""},{""version"":""v3"",""created"":""Mon, 21 Apr 2008 23:02:38 GMT""},{""version"":""v4"",""created"":""Thu, 31 Jul 2008 12:23:05 GMT""},{""version"":""v5"",""created"":""Wed, 11 Aug 2010 18:18:44 GMT""}]","2010-08-12"
"0804.0784","Danil Boukhvalov W","Danil W. Boukhvalov, and Mikhail I. Katsnelson","Modeling of graphite oxide","12 pages, 7 figures. Discussion about reduction to pure graphene and
  several references added. Methodological part expanded. Accepted to J. Am.
  Chem. Soc","J. Am. Chem. Soc. 2008; 130(32); 10697-10701","10.1021/ja8021686",,"cond-mat.mtrl-sci","http://arxiv.org/licenses/nonexclusive-distrib/1.0/","  Based on density functional calculations, optimized structures of graphite
oxide are found for various coverage by oxygen and hydroxyl groups, as well as
their ratio corresponding to the minimum of total energy. The model proposed
describes well known experimental results. In particular, it explains why it is
so difficult to reduce the graphite oxide up to pure graphene. Evolution of the
electronic structure of graphite oxide with the coverage change is
investigated.
","[{""version"":""v1"",""created"":""Fri, 4 Apr 2008 17:05:09 GMT""},{""version"":""v2"",""created"":""Tue, 10 Jun 2008 10:35:58 GMT""}]","2008-09-05"
"0804.0785","Henrik Aratyn","H. Aratyn and J. van de Leur","Solutions of the Painleve VI Equation from Reduction of Integrable
  Hierarchy in a Grassmannian Approach","34 pages",,,,"math-ph hep-th math.MP nlin.SI","http://arxiv.org/licenses/nonexclusive-distrib/1.0/","  We present an explicit method to perform similarity reduction of a
Riemann-Hilbert factorization problem for a homogeneous GL (N, C) loop group
and use our results to find solutions to the Painleve VI equation for N=3. The
tau function of the reduced hierarchy is shown to satisfy the sigma-form of the
Painleve VI equation. A class of tau functions of the reduced integrable
hierarchy is constructed by means of a Grassmannian formulation. These
solutions provide rational solutions of the Painleve VI equation.
","[{""version"":""v1"",""created"":""Fri, 4 Apr 2008 18:09:13 GMT""},{""version"":""v2"",""created"":""Fri, 4 Apr 2008 21:08:40 GMT""}]","2008-04-07"
"0804.0786","Jason Alicea","Jason Alicea","Monopole Quantum Numbers in the Staggered Flux Spin Liquid","9 pages, 0 figures; minor clarifications","Phys. Rev. B 78, 035126 (2008)","10.1103/PhysRevB.78.035126",,"cond-mat.str-el","http://arxiv.org/licenses/nonexclusive-distrib/1.0/","  Algebraic spin liquids, which are exotic gapless spin states preserving all
microscopic symmetries, have been widely studied due to potential realizations
in frustrated quantum magnets and the cuprates. At low energies, such putative
phases are described by quantum electrodynamics in 2+1 dimensions. While
significant progress has been made in understanding this nontrivial interacting
field theory and the associated spin physics, one important issue which has
proved elusive is the quantum numbers carried by so-called monopole operators.
Here we address this issue in the ``staggered-flux'' spin liquid which may be
relevant to the pseudogap regime in high-T_c. Employing general analytical
arguments supported by simple numerics, we argue that proximate phases encoded
in the monopole operators include the familiar Neel and valence bond solid
orders, as well as other symmetry-breaking orders closely related to those
previously explored in the monopole-free sector of the theory. Surprisingly, we
also find that one monopole operator carries trivial quantum numbers, and
briefly discuss its possible implications.
","[{""version"":""v1"",""created"":""Fri, 4 Apr 2008 17:12:23 GMT""},{""version"":""v2"",""created"":""Thu, 17 Apr 2008 17:33:27 GMT""}]","2009-11-13"
"0804.0787","Harm Derksen","Harm Derksen, Theodore Owen","New Graphs of Finite Mutation Type","14 pages",,,,"math.CO","http://arxiv.org/licenses/nonexclusive-distrib/1.0/","  To a directed graph without loops and 2-cycles, we can associate a
skew-symmetric matrix with integer entries. Mutations of such skew-symmetric
matrices, and more generally skew-symmetrizable matrices, have been defined in
the context of cluster algebras by Fomin and Zelevinsky. The mutation class of
a graph G is the set of all isomorphism classes of graphs that can be obtained
from G by a sequence of mutations. A graph is called mutation-finite if its
mutation class is finite. Fomin, Shapiro and Thurston constructed
mutation-finite graphs from triangulations of oriented bordered surfaces with
marked points. We will call such graphs ""of geometric type"". Besides graphs
with 2 vertices, and graphs of geometric type, there are only 9 other
""exceptional"" mutation classes that are known to be finite. In this paper we
introduce 2 new exceptional finite mutation classes.
","[{""version"":""v1"",""created"":""Fri, 4 Apr 2008 17:33:17 GMT""}]","2008-04-07"
"0804.0788","Nicolae Zamfir","Sebastian Zamfir, Jack W. Sulentic, Paola Marziani","New Insights on the QSO Radio-Loud/Radio-Quiet Dichotomy: SDSS Spectra
  in the Context of the 4D Eigenvector1 Parameter Space","16 pages, 9 figures, 5 tables - accepted for publication in MNRAS",,"10.1111/j.1365-2966.2008.13290.x",,"astro-ph","http://arxiv.org/licenses/nonexclusive-distrib/1.0/","  We search fora dichotomy/bimodality between Radio Loud (RL) and Radio Quiet
(RQ) Type 1 Active Galactic Nuclei (AGN). We examine several samples of SDSS
QSOs with high S/N optical spectra and matching FIRST/NVSS radio observations.
We use the radio data to identify the weakest RL sources with FRII structure to
define a RL/RQ boundary which corresponds to log L$_{1.4GHz}$=31.6 ergs
s$^{-1}$ Hz$^{-1}$. We measure properties of broad line H$\beta$ and FeII
emission to define the optical plane of a 4DE1 spectroscopic diagnostic space.
The RL quasars occupy a much more restricted domain in this optical plane
compared to the RQ sources, which a 2D Kolmogorov-Smirnov test finds to be
highly significant. This tells us that the range of BLR kinematics and
structure for RL sources is more restricted than for the RQ QSOs, which
supports the notion of dichotomy. FRII and CD RL sources also show significant
4DE1 domain differences that likely reflect differences in line of sight
orientation (inclined vs. face-on respectively) for these two classes. The
possibility of a distinct Radio Intermediate (RI) population between RQ and RL
source is disfavored because a 4DE1 diagnostic space comparison shows no
difference between RI and RQ sources. We show that searches for dichotomy in
radio vs. bolometric luminosity diagrams will yield ambiguous results mainly
because in a reasonably complete sample the radio brightest RQ sources will be
numerous enough to blur the gap between RQ and RL sources. Within resolution
constraints of NVSS and FIRST we find no FRI sources among the broad line
quasar population.
","[{""version"":""v1"",""created"":""Fri, 4 Apr 2008 17:38:23 GMT""}]","2009-11-13"
"0804.0789","Jorge S. Diaz","Jorge S. Diaz","Two-dimensional Hawking radiation from the AdS/CFT correspondence","4 pages",,,,"hep-th","http://creativecommons.org/licenses/publicdomain/","  The AdS/CFT correspondence has been tested through the reproduction of
standard results. Following this approach, we use the correspondence to obtain
the Hawking temperature of a black hole in 1+1 dimensions. Using an auxiliary
Liouville field, the holographic energy-momentum tensor is found and compared
with a radiation energy-momentum tensor, verifying that the correspondence
gives the correct temperature. The information about the radiated field in the
CFT sector is contained in the central charge, whereas in the radiation tensor
this information is in the statistical distribution. This result allows to
determine the radiation of scalar and Dirac fields easily and without the
necessity of solving the corresponding Klein-Gordon or Dirac equation in a
curved spacetime. In both cases, the correct temperature was obtained.
","[{""version"":""v1"",""created"":""Fri, 4 Apr 2008 17:55:20 GMT""}]","2008-04-07"
