"0804.3254","Gerard Ascensi","Gerard Ascensi, Joaquim Bruna","Model spaces results for the Gabor and Wavelet transforms","Submitted to IEEE Transactions on Information Theory",,"10.1109/TIT.2009.2016028",,"math.FA","http://arxiv.org/licenses/nonexclusive-distrib/1.0/","  We prove that the unique Gabor atom with analytical model space is the
Gaussian function. We give an analogous result for the wavelet transform. For
the general case we give a new approach to study the irregular Gabor and
wavelet frames. We improve some results for Gabor atoms in the Feichtinger
algebra, and for a special class of wavelets.
","[{""version"":""v1"",""created"":""Mon, 21 Apr 2008 09:42:07 GMT""}]","2016-11-18"
"0804.3255","Alessandro Nordio","A. Nordio, C-F. Chiasserini, and E. Viterbo","Reconstruction of Multidimensional Signals from Irregular Noisy Samples","To appear on IEEE Transactions on Signal Processing, 2008",,"10.1109/TSP.2008.925953",,"cs.IT math.IT","http://arxiv.org/licenses/nonexclusive-distrib/1.0/","  We focus on a multidimensional field with uncorrelated spectrum, and study
the quality of the reconstructed signal when the field samples are irregularly
spaced and affected by independent and identically distributed noise. More
specifically, we apply linear reconstruction techniques and take the mean
square error (MSE) of the field estimate as a metric to evaluate the signal
reconstruction quality. We find that the MSE analysis could be carried out by
using the closed-form expression of the eigenvalue distribution of the matrix
representing the sampling system. Unfortunately, such distribution is still
unknown. Thus, we first derive a closed-form expression of the distribution
moments, and we find that the eigenvalue distribution tends to the
Marcenko-Pastur distribution as the field dimension goes to infinity. Finally,
by using our approach, we derive a tight approximation to the MSE of the
reconstructed field.
","[{""version"":""v1"",""created"":""Mon, 21 Apr 2008 09:55:39 GMT""}]","2009-11-13"
"0804.3256","{\O}ystein Langangen","{\O}. Langangen, B. De Pontieu, M. Carlsson, V. H. Hansteen, G.
  Cauzzi, K. Reardon","Search for high velocities in the disk counterpart of type II spicules","4 pages, Accepted in ApJL",,"10.1086/589442",,"astro-ph","http://arxiv.org/licenses/nonexclusive-distrib/1.0/","  Recently, De Pontieu et al. (2007b) discovered a class of spicules that
evolves more rapidly than previously known spicules, with rapid apparent
motions of 50--150 km s${}^{-1}$, thickness of a few 100 km, and lifetimes of
order 10--60 seconds. These so-called type II spicules have been difficult to
study because of limited spatio-temporal and thermal resolution. Here we use
the IBIS instrument to search for the high velocities in the disk counterpart
of type II spicules. We have detected rapidly evolving events, with lifetimes
that are less than a minute and often equal to the cadence of the instrument
(19 secs). These events are characterized by a Doppler shift that only appears
in the blue wing of the Ca II IR line. Furthermore the spatial extent,
lifetime, and location near network, all suggest a link to type II spicules.
However, the magnitude of the measured Doppler velocity is significantly lower
than the apparent motions seen at the limb. We use Monte Carlo simulations to
show that this discrepancy can be explained by a forward model in which the
visibility on the disk of the high-velocity flows in these events is limited by
a combination of line-of-sight projection and reduced opacity in upward
propelled plasma, especially in reconnection driven jets that are powered by a
roughly constant energy supply.
","[{""version"":""v1"",""created"":""Mon, 21 Apr 2008 09:49:12 GMT""}]","2009-11-13"
"0804.3257","Clara I. Osorio","Clara I. Osorio, Sergio Barreiro, Morgan W. Mitchell and Juan P.
  Torres","Spatial entanglement of paired photons generated in cold atomic
  ensembles","5 pages, 4 figures. Submitted to Phys. Rev. A.; one figure (Fig. 3)
  was added, typos and labels in figure 2 were corrected","Phys. Rev. A 78, 052301 (2008)","10.1103/PhysRevA.78.052301",,"quant-ph","http://arxiv.org/licenses/nonexclusive-distrib/1.0/","  Cold atomic ensembles can mediate the generation of entanglement between
pairs of photons. Photons with specific directions of propagation are detected,
and the entanglement can reside in any of the degrees of freedom that describe
the whole quantum state of the photons: polarization, spatial shape or
frequency. We show that the direction of propagation of the generated photons
determines the spatial quantum state of the photons and therefore, the amount
of entanglement generated. When photons generated in different directions are
combined, this spatial distinguishing information can degrade the quantum
purity of the polarization or frequency entanglement.
","[{""version"":""v1"",""created"":""Mon, 21 Apr 2008 09:56:58 GMT""},{""version"":""v2"",""created"":""Thu, 24 Jul 2008 10:55:25 GMT""}]","2009-11-13"
"0804.3258","Takahiko Yoshida","Hajime Fujita, Mikio Furuta, Takahiko Yoshida","Torus fibrations and localization of index I","23 pages. 2 figures. Errors corrected. The title changed. Corollary
  6.12 and references added","J. Math. Sci. Univ. Tokyo 17 (2010), 1-26",,,"math.SG math.DG","http://arxiv.org/licenses/nonexclusive-distrib/1.0/","  We define a local Riemann-Roch number for an open symplectic manifold when a
complete integrable system without Bohr-Sommerfeld fiber is provided on its
end. In particular when a structure of a singular Lagrangian fibration is given
on a closed symplectic manifold, its Riemann-Roch number is described as the
sum of the number of nonsingular Bohr-Sommerfeld fibers and a contribution of
the singular fibers. A key step of the proof is formally explained as a version
of Witten's deformation applied to a Hilbert bundle.
","[{""version"":""v1"",""created"":""Mon, 21 Apr 2008 09:52:39 GMT""},{""version"":""v2"",""created"":""Wed, 28 May 2008 04:31:28 GMT""},{""version"":""v3"",""created"":""Tue, 7 Jul 2009 10:38:42 GMT""},{""version"":""v4"",""created"":""Thu, 18 Mar 2010 18:14:08 GMT""},{""version"":""v5"",""created"":""Wed, 7 Apr 2010 15:32:36 GMT""},{""version"":""v6"",""created"":""Thu, 22 Apr 2010 12:36:29 GMT""},{""version"":""v7"",""created"":""Thu, 2 Sep 2010 01:29:07 GMT""}]","2010-09-03"
"0804.3259","Rui Zhang","Rui Zhang, Mehdi Mohseni, and John M. Cioffi","On Multiuser Power Region of Fading Multiple-Access Channel with
  Multiple Antennas",,,,,"cs.IT math.IT","http://arxiv.org/licenses/nonexclusive-distrib/1.0/","  This paper is concerned with the fading MIMO-MAC with multiple receive
antennas at the base station (BS) and multiple transmit antennas at each mobile
terminal (MT). Two multiple-access techniques are considered for scheduling
transmissions from each MT to the BS at the same frequency, which are
space-division multiple-access (SDMA) and time-division multiple-access (TDMA).
For SDMA, all MTs transmit simultaneously to the BS and their individual
signals are resolved at the BS via multiple receive antennas while for TDMA,
each MT transmits independently to the BS during mutually orthogonal time
slots. It is assumed that the channel-state information (CSI) of the fading
channel from each MT to the BS is unknown at each MT transmitter, but is
perfectly known at the BS receiver. Thereby, the BS can acquire the long-term
channel-distribution information (CDI) for each MT. This paper extends the
well-known transmit-covariance feedback scheme for the point-to-point fading
MIMO channel to the fading MIMO-MAC, whereby the BS jointly optimizes the
transmit signal covariance matrices for all MTs based on their CDI, and then
sends each transmit covariance matrix back to the corresponding MT via a
feedback channel. The main goal of this paper is to characterize the so-called
multiuser power region under the multiuser transmit-covariance feedback scheme
for both SDMA and TDMA. The power region is defined as the constitution of all
user transmit power-tuples that can achieve reliable transmissions for a given
set of user target rates. Simulation results show that SDMA can achieve
substantial power savings over TDMA for the fading MIMO-MAC. Moreover, this
paper demonstrates the usefulness of the multiuser power region for maintaining
proportionally-fair power consumption among the MTs.
","[{""version"":""v1"",""created"":""Mon, 21 Apr 2008 10:13:39 GMT""}]","2008-04-22"
"0804.3260","Takao Yamazaki","Takao Yamazaki","Milnor $K$-group attached to a torus and Birch-Tate conjecture","16 pages",,,,"math.NT math.KT","http://arxiv.org/licenses/nonexclusive-distrib/1.0/","  We formulate (and prove under a certain assumption) a conjecture relating the
order of Somekawa's Milnor $K$-group attached to a torus $T$ and the value of
the Artin $L$-function attached to the cocharacter group of $T$ (regarded as an
Artin representation) at $s=-1$. The case $T=\G_m$ reduces to the classical
Birch-Tate conjecture.
","[{""version"":""v1"",""created"":""Mon, 21 Apr 2008 09:55:48 GMT""}]","2008-04-22"
"0804.3261","Rui Zhang","Rui Zhang","Optimal Dynamic Resource Allocation for Multi-Antenna Broadcasting with
  Heterogeneous Delay-Constrained Traffic",,,"10.1109/JSTSP.2008.922470",,"cs.IT math.IT","http://arxiv.org/licenses/nonexclusive-distrib/1.0/","  This paper is concerned with dynamic resource allocation in a cellular
wireless network with slow fading for support of data traffic having
heterogeneous transmission delay requirements. The multiple-input single-output
(MISO) fading broadcast channel (BC) is of interest where the base station (BS)
employs multiple transmit antennas to realize simultaneous downlink
transmission at the same frequency to multiple mobile users each having a
single receive antenna. An information-theoretic approach is taken for
characterizing capacity limits of the fading MISO-BC under various transmission
delay considerations. First, this paper studies transmit optimization at the BS
when some users have delay-tolerant ``packet'' data and the others have
delay-sensitive ``circuit'' data for transmission at the same time. Based on
the convex optimization framework, an online resource allocation algorithm is
derived that is amenable to efficient cross-layer implementation of both
physical (PHY) -layer multi-antenna transmission and media-access-control (MAC)
-layer multiuser rate scheduling. Secondly, this paper investigates the
fundamental throughput-delay tradeoff for transmission over the fading MISO-BC.
By comparing the network throughput under completely relaxed versus strictly
zero transmission delay constraint, this paper characterizes the limiting loss
in sum capacity due to the vanishing delay tolerance, termed the delay penalty,
under some prescribed user fairness for transmit rate allocation.
","[{""version"":""v1"",""created"":""Mon, 21 Apr 2008 10:21:27 GMT""}]","2009-11-13"
"0804.3262","Jan Zeman","J. Sejnoha, M. Sejnoha, J. Zeman, J. Sykora and J. Vorel","Mesoscopic study on historic masonry","38 pages, 15 figures","Structural Engineering and Mechanics 30(1): 99-117, 2008",,,"cond-mat.mtrl-sci","http://arxiv.org/licenses/nonexclusive-distrib/1.0/","  This paper presents a comprehensive approach to the evaluation of macroscopic
material parameters for natural stone and quarry masonry. To that end, a
reliable non-linear material model on a meso-scale is developed to cover the
random arrangement of stone blocks and quasi-brittle behaviour of both basic
components, as well as the impaired cohesion and tensile strength on the
interface between the blocks and mortar joints. The paper thus interrelates the
following three problems: (i) definition of a suitable periodic unit cell (PUC)
representing a particular masonry structure; (ii) derivation of material
parameters of individual constituents either experimentally or running a mixed
numerical-experimental problem; (iii) assessment of the macroscopic material
parameters including the tensile and compressive strengths and fracture energy.
","[{""version"":""v1"",""created"":""Mon, 21 Apr 2008 10:25:23 GMT""}]","2008-09-16"
"0804.3263","Stefan van Zwam","R. A. Pendavingh and S. H. M. van Zwam","Lifts of matroid representations over partial fields","41 pages, 1 figure. Contains minor revisions, the most substantial
  being a new Section 4.1 that shows how Tutte's characterization of regular
  matroids follows from our theorem, a new proof of Theorem 5.1 (a partial
  field can be embedded in a ring), and a new appendix listing partial fields.
  Submitted to Journal of Combinatorial Theory, Series B","Journal of Combinatorial Theory, Series B, vol. 100, Issue 1, pp.
  36-67, 2010","10.1016/j.jctb.2009.03.006",,"math.CO","http://arxiv.org/licenses/nonexclusive-distrib/1.0/","  There exist several theorems which state that when a matroid is representable
over distinct fields F_1,...,F_k, it is also representable over other fields.
We prove a theorem, the Lift Theorem, that implies many of these results.
  First, parts of Whittle's characterization of representations of ternary
matroids follow from our theorem. Second, we prove the following theorem by
Vertigan: if a matroid is representable over both GF(4) and GF(5), then it is
representable over the real numbers by a matrix such that the absolute value of
the determinant of every nonsingular square submatrix is a power of the golden
ratio. Third, we give a characterization of the 3-connected matroids having at
least two inequivalent representations over GF(5). We show that these are
representable over the complex numbers.
  Additionally we provide an algebraic construction that, for any set of fields
F_1,...,F_k, gives the best possible result that can be proven using the Lift
Theorem.
","[{""version"":""v1"",""created"":""Mon, 21 Apr 2008 11:34:20 GMT""},{""version"":""v2"",""created"":""Thu, 12 Mar 2009 15:23:50 GMT""}]","2011-01-14"
"0804.3264","Elias C. Vagenas","Elias C. Vagenas","Area spectrum of rotating black holes via the new interpretation of
  quasinormal modes","v1: 4 pages, REVTeX, no figures; v2: clarifications and comments
  added, comments on last result modified, Abstract slightly changed; v3:
  comments and references added;","JHEP0811:073,2008","10.1088/1126-6708/2008/11/073",,"gr-qc astro-ph hep-th","http://arxiv.org/licenses/nonexclusive-distrib/1.0/","  Motivated by the recent work on a new physical interpretation of quasinormal
modes by Maggiore, we utilize this new proposal to the interesting case of Kerr
black hole. In particular, by modifying Hod's idea, the resulting black hole
horizon area is quantized and the resulting area quantum is in full agreement
with Bekenstein's result. Furthermore, in an attempt to show that the area
spectrum is equally spaced, we follow Kunstatter's method. We propose a new
interpretation as a result of Maggiore's idea, for the frequency that appears
in the adiabatic invariant of a black hole. The derived area spectrum is
similar to that of the quantum-corrected Kerr black hole but it is not equally
spaced.
","[{""version"":""v1"",""created"":""Mon, 21 Apr 2008 10:44:02 GMT""},{""version"":""v2"",""created"":""Wed, 23 Apr 2008 19:17:01 GMT""},{""version"":""v3"",""created"":""Wed, 15 Oct 2008 19:50:23 GMT""}]","2008-12-18"
"0804.3265","Sibo Zheng","Mingxing Luo, Sibo Zheng","E2 Instanton Effects and Higgs Physics In Intersecting Brane Models","11 pages, 1 figure",,,,"hep-th","http://creativecommons.org/licenses/by/3.0/","  String instanton effects in Higgs physics are discussed through a type IIA
model based on T^{6}/(Z^{2}\times Z^{'2}) orentifold compactifaction. By
inclusion of rigid E2-branes, the model exhibits a MSSM-like spectrum, as well
as extra mu and quartic Higgs couplings. These extra couplings are induced via
E2 instantons non-perturbatively. Setting the string scale at 10^{18} GeV, one
gets interesting TeV Higgs physics. In particlular, the tree-level Higgs mass
can be uplifted substantially.
","[{""version"":""v1"",""created"":""Mon, 21 Apr 2008 10:48:10 GMT""}]","2008-04-22"
"0804.3267","Bindusar Sahoo","Justin R. David and Bindusar Sahoo","Giant magnons in the D1-D5 system","Added references and comments on integrabilty/S-matrix","JHEP 0807:033,2008","10.1088/1126-6708/2008/07/033",,"hep-th","http://arxiv.org/licenses/nonexclusive-distrib/1.0/","  We study giant magnons in the the D1-D5 system from both the boundary CFT and
as classical solutions of the string sigma model in $AdS_3\times S^3\times
T^4$. Re-examining earlier studies of the symmetric product conformal field
theory we argue that giant magnons in the symmetric product are BPS states in a
centrally extended $SU(1|1)\times SU(1|1)$ superalgebra with two more
additional central charges. The magnons carry these additional central charges
locally but globally they vanish. Using a spin chain description of these
magnons and the extended superalgebra we show that these magnons obey a
dispersion relation which is periodic in momentum. We then identify these
states on the string theory side and show that here too they are BPS in the
same centrally extended algebra and obey the same dispersion relation which is
periodic in momentum. This dispersion relation arises as the BPS condition for
the extended algebra and is similar to that of magnons in ${\cal N}=4$
Yang-Mills
","[{""version"":""v1"",""created"":""Mon, 21 Apr 2008 11:30:16 GMT""},{""version"":""v2"",""created"":""Sun, 18 May 2008 17:13:00 GMT""},{""version"":""v3"",""created"":""Fri, 6 Jun 2008 16:24:32 GMT""}]","2014-11-18"
"0804.3268","Tomohiro Matsuda","Tomohiro Matsuda","Modulated inflation from kinetic term","15 pages, 1 figure, Accepted for publication in JCAP","JCAP0805:022,2008","10.1088/1475-7516/2008/05/022",,"hep-th astro-ph hep-ph","http://arxiv.org/licenses/nonexclusive-distrib/1.0/","  We study modulated inflation from kinetic term. Using the Mukhanov-Sasaki
variable, it is possible to determine how mixing induced by the kinetic term
feeds the curvature perturbation with the isocurvature perturbation. We show
explicitly that the analytic result obtained from the evolution of the
Mukhanov-Sasaki variable is consistent with the $\delta N$-formula. From our
results, we find analytic conditions for the modulated fluctuation and the
non-Gaussianity parameter.
","[{""version"":""v1"",""created"":""Mon, 21 Apr 2008 11:09:09 GMT""},{""version"":""v2"",""created"":""Wed, 23 Apr 2008 05:35:02 GMT""},{""version"":""v3"",""created"":""Sat, 3 May 2008 08:01:42 GMT""}]","2008-11-26"
"0804.3269","Santiago Fern\'andez","Santiago Fern\'andez, Alex Graves, Juergen Schmidhuber","Phoneme recognition in TIMIT with BLSTM-CTC","8 pages",,,"IDSIA-04-08","cs.CL cs.NE","http://arxiv.org/licenses/nonexclusive-distrib/1.0/","  We compare the performance of a recurrent neural network with the best
results published so far on phoneme recognition in the TIMIT database. These
published results have been obtained with a combination of classifiers.
However, in this paper we apply a single recurrent neural network to the same
task. Our recurrent neural network attains an error rate of 24.6%. This result
is not significantly different from that obtained by the other best methods,
but they rely on a combination of classifiers for achieving comparable
performance.
","[{""version"":""v1"",""created"":""Mon, 21 Apr 2008 15:38:45 GMT""}]","2008-04-22"
"0804.3270","Senthilkumar Vijayan","D. V. Senthilkumar, M. Lakshmanan and J. Kurths","Transition from phase to generalized synchronization in time-delay
  systems","Accepted for publication in CHAOS",,"10.1063/1.2911541",,"nlin.CD","http://arxiv.org/licenses/nonexclusive-distrib/1.0/","  The notion of phase synchronization in time-delay systems, exhibiting highly
non-phase-coherent attractors, has not been realized yet even though it has
been well studied in chaotic dynamical systems without delay. We report the
identification of phase synchronization in coupled nonidentical piece-wise
linear and in coupled Mackey-Glass time-delay systems with highly
non-phase-coherent regimes. We show that there is a transition from
non-synchronized behavior to phase and then to generalized synchronization as a
function of coupling strength. We have introduced a transformation to capture
the phase of the non-phase coherent attractors, which works equally well for
both the time-delay systems. The instantaneous phases of the above coupled
systems calculated from the transformed attractors satisfy both the phase and
mean frequency locking conditions. These transitions are also characterized in
terms of recurrence based indices, namely generalized autocorrelation function
$P(t)$, correlation of probability of recurrence (CPR), joint probability of
recurrence (JPR) and similarity of probability of recurrence (SPR). We have
quantified the different synchronization regimes in terms of these indices. The
existence of phase synchronization is also characterized by typical transitions
in the Lyapunov exponents of the coupled time-delay systems.
","[{""version"":""v1"",""created"":""Mon, 21 Apr 2008 11:11:56 GMT""}]","2009-11-13"
"0804.3271","Ayfer Ozgur","Ayfer Ozgur, Ramesh Johari, David Tse, Olivier Leveque","Information Theoretic Operating Regimes of Large Wireless Networks","12 pages, 5 figures, to appear in IEEE Transactions on Information
  Theory",,,,"cs.IT math.IT","http://arxiv.org/licenses/nonexclusive-distrib/1.0/","  In analyzing the point-to-point wireless channel, insights about two
qualitatively different operating regimes--bandwidth- and power-limited--have
proven indispensable in the design of good communication schemes. In this
paper, we propose a new scaling law formulation for wireless networks that
allows us to develop a theory that is analogous to the point-to-point case. We
identify fundamental operating regimes of wireless networks and derive
architectural guidelines for the design of optimal schemes.
  Our analysis shows that in a given wireless network with arbitrary size,
area, power, bandwidth, etc., there are three parameters of importance: the
short-distance SNR, the long-distance SNR, and the power path loss exponent of
the environment. Depending on these parameters we identify four qualitatively
different regimes. One of these regimes is especially interesting since it is
fundamentally a consequence of the heterogeneous nature of links in a network
and does not occur in the point-to-point case; the network capacity is {\em
both} power and bandwidth limited. This regime has thus far remained hidden due
to the limitations of the existing formulation. Existing schemes, either
multihop transmission or hierarchical cooperation, fail to achieve capacity in
this regime; we propose a new hybrid scheme that achieves capacity.
","[{""version"":""v1"",""created"":""Mon, 21 Apr 2008 13:12:50 GMT""},{""version"":""v2"",""created"":""Tue, 15 Sep 2009 11:33:00 GMT""}]","2009-09-29"
"0804.3272","Masaki Kobayashi","M. Kobayashi, Y. Ishida, J. I. Hwang, G. S. Song, A. Fujimori, C.-S.
  Yang, L. Lee, H.-J. Lin, D.-J. Huang, C. T. Chen, Y. Takeda, S.-I. Fujimori,
  T. Okane, Y. Saitoh, H. Yamagami, K. Kobayashi, A. Tanaka, H. Saito, and K.
  Ando","Local electronic structure of Cr in the II-VI diluted ferromagnetic
  semiconductor Zn$_{1-x}$Cr$_x$Te","Accepted for New Journal of Physics. Single column, 21 pages, 7
  figures","New J. Phys. 10, 055011 (2008)","10.1088/1367-2630/10/5/055011",,"cond-mat.mtrl-sci cond-mat.str-el","http://arxiv.org/licenses/nonexclusive-distrib/1.0/","  The electronic structure of the Cr ions in the diluted ferromagnetic
semiconductor Zn$_{1-x}$Cr$_x$Te ($x=0.03$ and 0.15) thin films has been
investigated using x-ray magnetic circular dichroism (XMCD) and photoemission
spectroscopy (PES). Magnetic-field ($H$) and temperature ($T$) dependences of
the Cr $2p$ XMCD spectra well correspond to the magnetization measured by a
SQUID magnetometer. The line shape of the Cr $2p$ XMCD spectra is independent
of $H$, $T$, and $x$, indicating that the ferromagnetism is originated from the
same electronic states of the Cr ion. Cluster-model analysis indicates that
although there are two or more kinds of Cr ions in the Zn$_{1-x}$Cr$_x$Te
samples, the ferromagnetic XMCD signal is originated from Cr ions substituted
for the Zn site. The Cr 3d partial density of states extracted using Cr $2p \to
3d$ resonant PES shows a broad feature near the top of the valence band,
suggesting strong $s$,$p$-$d$ hybridization. No density of states is detected
at the Fermi level, consistent with their insulating behavior. Based on these
findings, we conclude that double exchange mechanism cannot explain the
ferromagnetism in Zn$_{1-x}$Cr$_{x}$Te.
","[{""version"":""v1"",""created"":""Mon, 21 Apr 2008 11:18:47 GMT""}]","2008-06-01"
