"0804.3090","Jos\'e C. Barba","J.C. Barba and V.I. Inozemtsev","On the solutions of multicomponent generalizations of the Lam{\'e}
  equation","8 pages, 1 table, no figures, revtex4","Phys. Lett. A 372 (2008) 5951-5954","10.1016/j.physleta.2008.07.067",,"math-ph math.MP","http://arxiv.org/licenses/nonexclusive-distrib/1.0/","  We describe a class of the singular solutions to the multicomponent analogs
of the Lam{\'e} equation, arising as equations of motion of the elliptic
Calogero--Moser systems of particles carrying spin 1/2. At special value of the
coupling constant we propose the ansatz which allows one to get meromorphic
solutions with two arbitrary parameters. They are quantized upon the
requirement of the regularity of the wave function on the hyperplanes at which
particles meet and imposing periodic boundary conditions. We find also the
extra integrals of motion for three-particle systems which commute with the
Hamiltonian for arbitrary values of the coupling constant.
","[{""version"":""v1"",""created"":""Mon, 21 Apr 2008 13:49:30 GMT""}]","2008-10-15"
"0804.3110","Paul Chesler","Paul M. Chesler, Kristan Jensen, Andreas Karch","Jets in strongly-coupled N = 4 super Yang-Mills theory","21 pages, 12 figures. Added discussion regarding string profiles in
  more than one spatial dimension. Refs added","Phys.Rev.D79:025021,2009","10.1103/PhysRevD.79.025021",,"hep-th hep-ph","http://arxiv.org/licenses/nonexclusive-distrib/1.0/","  We study jets of massless particles in N=4 super Yang-Mills using the AdS/CFT
correspondence both at zero and finite temperature. We set up an initial state
corresponding to a highly energetic quark/anti-quark pair and follow its time
evolution into two jets. At finite temperature the jets stop after traveling a
finite distance, whereas at zero temperature they travel and spread forever. We
map out the corresponding baryon number charge density and identify the generic
late time behavior of the jets as well as features that depend crucially on the
initial conditions.
","[{""version"":""v1"",""created"":""Mon, 21 Apr 2008 08:55:15 GMT""},{""version"":""v2"",""created"":""Sat, 21 Jun 2008 21:56:30 GMT""}]","2009-02-18"
"0804.3152","Christian Robert P","Yves Atchade, Nicolas Lartillot and Christian P. Robert","Bayesian computation for statistical models with intractable normalizing
  constants","20 pages, 4 figures, submitted for publication",,,,"stat.CO stat.ME","http://arxiv.org/licenses/nonexclusive-distrib/1.0/","  This paper deals with some computational aspects in the Bayesian analysis of
statistical models with intractable normalizing constants. In the presence of
intractable normalizing constants in the likelihood function, traditional MCMC
methods cannot be applied. We propose an approach to sample from such posterior
distributions. The method can be thought as a Bayesian version of the MCMC-MLE
approach of Geyer and Thompson (1992). To the best of our knowledge, this is
the first general and asymptotically consistent Monte Carlo method for such
problems. We illustrate the method with examples from image segmentation and
social network modeling. We study as well the asymptotic behavior of the
algorithm and obtain a strong law of large numbers for empirical averages.
","[{""version"":""v1"",""created"":""Mon, 21 Apr 2008 11:07:23 GMT""}]","2008-04-22"
"0804.3160","Giorgos Christodoulou","George Christodoulou, Elias Koutsoupias and Paul Spirakis","On the performance of approximate equilibria in congestion games",,,,,"cs.GT cs.AI cs.NI","http://arxiv.org/licenses/nonexclusive-distrib/1.0/","  We study the performance of approximate Nash equilibria for linear congestion
games. We consider how much the price of anarchy worsens and how much the price
of stability improves as a function of the approximation factor $\epsilon$. We
give (almost) tight upper and lower bounds for both the price of anarchy and
the price of stability for atomic and non-atomic congestion games. Our results
not only encompass and generalize the existing results of exact equilibria to
$\epsilon$-Nash equilibria, but they also provide a unified approach which
reveals the common threads of the atomic and non-atomic price of anarchy
results. By expanding the spectrum, we also cast the existing results in a new
light. For example, the Pigou network, which gives tight results for exact Nash
equilibria of selfish routing, remains tight for the price of stability of
$\epsilon$-Nash equilibria but not for the price of anarchy.
","[{""version"":""v1"",""created"":""Mon, 21 Apr 2008 12:45:08 GMT""},{""version"":""v2"",""created"":""Sat, 10 May 2008 15:45:44 GMT""}]","2008-12-18"
"0804.3170","German Rodrigo","Stefano Catani, Tanju Gleisberg, Frank Krauss, German Rodrigo and
  Jan-Christopher Winter","From loops to trees by-passing Feynman's theorem","46 pages. A new appendix included. Appendix B simplified. Some
  comments and references added. Final version published in JHEP","JHEP 0809:065,2008","10.1088/1126-6708/2008/09/065","IFIC/08-21, IPPP/08/22, FERMILAB-PUB-08-092-T, SLAC-PUB-13218","hep-ph hep-th","http://arxiv.org/licenses/nonexclusive-distrib/1.0/","  We derive a duality relation between one-loop integrals and phase-space
integrals emerging from them through single cuts. The duality relation is
realized by a modification of the customary +i0 prescription of the Feynman
propagators. The new prescription regularizing the propagators, which we write
in a Lorentz covariant form, compensates for the absence of multiple-cut
contributions that appear in the Feynman Tree Theorem. The duality relation can
be applied to generic one-loop quantities in any relativistic, local and
unitary field theories. %It is suitable for applications to the analytical
calculation of %one-loop scattering amplitudes, and to the numerical evaluation
of %cross-sections at next-to-leading order. We discuss in detail the duality
that relates one-loop and tree-level Green's functions. We comment on
applications to the analytical calculation of one-loop scattering amplitudes,
and to the numerical evaluation of cross-sections at next-to-leading order.
","[{""version"":""v1"",""created"":""Sun, 20 Apr 2008 19:19:43 GMT""},{""version"":""v2"",""created"":""Thu, 11 Sep 2008 16:41:14 GMT""}]","2009-09-17"
"0804.3180","Wen-Yu Wen","Eiji Nakano, Wen-Yu Wen","Critical magnetic field in AdS/CFT superconductor","8 pages, 3 figures, REVTeX v4. Typos corrected and Fig.3 replaced","Phys.Rev.D78:046004,2008","10.1103/PhysRevD.78.046004",,"hep-th cond-mat.supr-con","http://arxiv.org/licenses/nonexclusive-distrib/1.0/","  We have studied a holographically dual description of superconductor in
(2+1)-dimensions in the presence of applied magnetic field, and observed that
there exists a critical value of magnetic field, below which a charged
condensate can form via a second order phase transition.
","[{""version"":""v1"",""created"":""Mon, 21 Apr 2008 07:08:58 GMT""},{""version"":""v2"",""created"":""Sun, 11 May 2008 10:15:31 GMT""}]","2010-05-28"
"0804.3194","Michitaka Miyauchi","Michitaka Miyauchi","Representations of unramified U(2,2) over a p-adic field I:
  representations of non-integral level","26 pages",,,,"math.RT","http://arxiv.org/licenses/nonexclusive-distrib/1.0/","  Let F_0 be a non-archimedean local field of odd residual characteristic and
let G be the unramified unitary group U(2,2) defined over F_0. In this paper,
we give a classification of the irreducible smooth representations of G of
non-integral level using the Hecke algebraic method developed by Allen Moy for
GSp(4).
","[{""version"":""v1"",""created"":""Mon, 21 Apr 2008 03:01:06 GMT""}]","2008-04-22"
"0804.3198","Kwei-Chou Yang","Hisaki Hatanaka, Kwei-Chou Yang","$B \to K_1 \gamma$ Decays in the Light-Cone QCD Sum Rules","19 pages, 3 figures, 2 tables, Eqs. (3.7), (5.14), Fig. 2, Table II
  corrected","Phys.Rev.D77:094023,2008; Erratum-ibid.D78:059902,2008","10.1103/PhysRevD.77.094023 10.1103/PhysRevD.78.059902",,"hep-ph hep-ex","http://arxiv.org/licenses/nonexclusive-distrib/1.0/","  We present a detailed study of $B\to K_1(1270) \gamma$ and $B\to K_1(1400)
\gamma$ decays. Using the light-cone sum rule technique, we calculate the $B\to
K_{1A} (1^3P_1)$ and $B\to K_{1B} (1^1P_1)$ tensor form factors,
$T_1^{K_{1A}}(0)$ and $T_1^{K_{1B}}(0)$, where the contributions are included
up to the first order in $m_{K_1}/m_b$. We resolve the sign ambiguity of the
$K_1(1270)$--$K_1(1400)$ mixing angle $\theta_{K_1}$ by defining the signs of
decay constants, $f_{K_{1A}}$ and $f_{K_{1B}}^\perp$. From the comparison of
the theoretical calculation and the data for decays $B\to K_1 \gamma$ and
$\tau^-\to K_1^-(1270)\nu_\tau$, we find that $\theta_{K_1}=-(34\pm 13)^\circ$
is favored. In contrast to $B\to K^* \gamma$, the hard-spectator contribution
suppresses the $B\to K_1(1270) \gamma$ and $B\to K_1(1400) \gamma$ branching
ratios slightly. The predicted branching ratios are in agreement with the Belle
measurement within the errors. We point out that a more precise measurement for
the ratio $R_{K_1}={\cal B}(B\to K_1(1400)\gamma)/{\cal B}(B\to
K_1(1270)\gamma)$ can offer a better determination for the $\theta_{K_1}$ and
consequently the theoretical uncertainties can be reduced.
","[{""version"":""v1"",""created"":""Sun, 20 Apr 2008 16:06:27 GMT""},{""version"":""v2"",""created"":""Thu, 24 Apr 2008 03:02:49 GMT""},{""version"":""v3"",""created"":""Mon, 30 Jun 2008 15:03:27 GMT""},{""version"":""v4"",""created"":""Thu, 11 Sep 2008 11:00:53 GMT""}]","2014-11-18"
"0804.3200","Victor A. Gopar","Victor A. Gopar","Statistical analysis of the transmission based on the DMPK equation: An
  application to Pb nano-contacts","6 pages, 6 figures","Eur. Phys. J. B, 62, 299 (2008)","10.1140/epjb/e2008-00169-x",,"cond-mat.mes-hall cond-mat.dis-nn","http://arxiv.org/licenses/nonexclusive-distrib/1.0/","  The density of the transmission eigenvalues of Pb nano-contacts has been
estimated recently in mechanically controllable break-junction experiments.
Motivated by these experimental analyses, here we study the evolution of the
density of the transmission eigenvalues with the disorder strength and the
number of channels supported by the ballistic constriction of a quantum point
contact in the framework of the Dorokhov-Mello-Pereyra-Kumar equation. We find
that the transmission density evolves rapidly into the density in the diffusive
metallic regime as the number of channels $N_c$ of the constriction increase.
Therefore, the transmission density distribution for a few $N_c$ channels comes
close to the known bimodal density distribution in the metallic limit. This is
in agreement with the experimental statistical-studies in Pb nano-contacts. For
the two analyzed cases, we show that the experimental densities are seen to be
well described by the corresponding theoretical results.
","[{""version"":""v1"",""created"":""Sun, 20 Apr 2008 16:29:10 GMT""}]","2008-04-26"
"0804.3201","Pai-Yi Hsiao","Pai-Yi Hsiao","Overcharging, charge inversion and reentrant condensation: Using
  highly-charged polyelectrolytes in tetravalent salt solutions as an example
  of study","letter (11 pages, 4 figures), accepted for publication in jpcb","J. Phys. Chem. B (Letters) 112 (2008) 7347","10.1021/jp800331b",,"cond-mat.soft cond-mat.stat-mech","http://arxiv.org/licenses/nonexclusive-distrib/1.0/","  We study salt-induced charge overcompensation and charge inversion of
flexible polyelectrolytes via computer simulations and demonstrate the
importance of ion excluded volume. Reentrant condensation takes place when the
ion size is comparable to monomer size, and happens in a middle region of salt
concentration. In a high-salt region, ions can overcharge a chain near its
surface and charge distribution around a chain displays an oscillatory
behavior. Unambiguous evidence obtained by electrophoresis shows that charge
inversion does not necessarily appear with overcharging and occurs when the ion
size is not big. These findings suggest a disconnection of resolubilization of
polyelectrolyte condensates at high salt concentration with charge inversion.
","[{""version"":""v1"",""created"":""Sun, 20 Apr 2008 16:30:08 GMT""},{""version"":""v2"",""created"":""Sat, 10 May 2008 01:43:33 GMT""}]","2008-06-26"
"0804.3203","Charles Gallo","C. F. Gallo and James Q. Feng","Galactic Rotation Described with Bulge+Disk Gravitational Models","13 Pages Text + 4 Figures",,,,"astro-ph","http://arxiv.org/licenses/nonexclusive-distrib/1.0/","  Observations reveal that mature spiral galaxies consist of stars, gases and
plasma approximately distributed in a thin disk of circular shape, usually with
a central bulge. The rotation velocities quickly increase from the galactic
center and then achieve a constant velocity from the core to the periphery. The
basic dynamic behavior of a mature spiral galaxy, such as the Milky Way, is
well described by simple models balancing Newtonian gravitational forces
against the centrifugal forces associated with a rotating thin axisymmetric
disk. In this research, we investigate the effects of adding central bulges to
thin disk gravitational models. Even with the addition of substantial central
bulges, all the critical essential features of our thin disk gravitational
models are preserved. (1) Balancing Newtonian gravitational and centrifugal
forces at every point within the disk yields computed radial mass distributions
that describe the measured rotation velocity profiles of mature spiral galaxies
successfully. (2) There is no need for gravity deviations or ``massive
peripheral spherical halos of mysterious Dark Matter''. (3) The calculated
total galactic masses are in good agreement with star count data. (4) The
addition of central bulges increases the calculated total galactic masses,
possibly more consistent with the presence of galactic gases, dust, grains,
lumps, planets and plasma in addition to stars. (5) Compared with the light
distribution, our mass distributions within the disk are larger out toward the
galactic periphery which is cooler with lower opactiy/emissivity (and thus
darker). This is apparent from edge-on views of galaxies which display a dark
disk-line against a much brighter galactic halo.
","[{""version"":""v1"",""created"":""Sun, 20 Apr 2008 16:56:19 GMT""}]","2008-04-22"
"0804.3204","Sebastian Schmitt","Norbert Grewe, Sebastian Schmitt, Torben Jabben and Frithjof B. Anders","Conserving approximations in direct perturbation theory: new
  semianalytical impurity solvers and their application to general lattice
  problems","45 pages, 22 figures","J. Phys.: Condens. Matter 20 (2008) 365217","10.1088/0953-8984/20/36/365217",,"cond-mat.str-el","http://arxiv.org/licenses/nonexclusive-distrib/1.0/","  For the treatment of interacting electrons in crystal lattices approximations
based on the picture of effective sites, coupled in a self-consistent fashion,
have proven very useful. Particularly in the presence of strong local
correlations, a local approach to the problem, combining a powerful method for
the short ranged interactions with the lattice propagation part of the
dynamics, determines the quality of results to a large extent. For a
considerable time the non crossing approximation (NCA) in direct perturbation
theory, an approach originally developed by Keiter for the Anderson impurity
model, built a standard for the description of the local dynamics of
interacting electrons. In the last couple of years exact methods like the
numerical renormalization group (NRG) as pioneered by Wilson, have surpassed
this approximation as regarding the description of the low energy regime. We
present an improved approximation level of direct perturbation theory for
finite Coulomb repulsion U, the crossing approximation one (CA1) and discuss
its connections with other generalizations of NCA. CA1 incorporates all
processes up to fourth order in the hybridization strength V in a
self-consistent skeleton expansion, retaining the full energy dependence of the
vertex functions. We reconstruct the local approach to the lattice problem from
the point of view of cumulant perturbation theory in a very general way and
discuss the proper use of impurity solvers for this purpose. Their reliability
can be tested in applications to e.g. the Hubbard model and the
Anderson-lattice model. We point out shortcomings of existing impurity solvers
and improvements gained with CA1 in this context.
  This paper is dedicated to the memory of Hellmut Keiter.
","[{""version"":""v1"",""created"":""Mon, 21 Apr 2008 08:18:43 GMT""}]","2008-09-19"
"0804.3205","Andrew Duncan","A. J. Duncan, I.V. Kazachkov and V.N. Remeslennikov","Stability of Universal Equivalence of Groups under Free Constructions","12 pages",,,,"math.GR math.LO","http://arxiv.org/licenses/nonexclusive-distrib/1.0/","  In 1971 J. Stallings introduced a generalisation of amalgamated products of
groups -- called a pregroup, which is a particular kind of a partial group. He
defined the universal group U(P) of a pregroup P to be a universal object (in
the sense of category theory) extending the partial operations on P to group
operations on U(P). This turns out to be a versatile and convenient
generalisation of classical group constructions: HNN-extensions and amalgamated
products. In this respect the following general question arises. Which
properties of pregroups, or relations between pregroups, carry over to the
respective universal groups? In this paper it is proved that universal
equivalence of pregroups extends to universal equivalence of universal groups.
Applications to free products with amalgamation and HNN-extensions are then
described.
","[{""version"":""v1"",""created"":""Sun, 20 Apr 2008 17:20:46 GMT""}]","2008-04-22"
"0804.3206","Ed Seidewitz","Ed Seidewitz","Spacetime path formalism for massive particles of any spin","RevTex draft format, 36 pages; v2, per reviewer comments, added
  additional explanatory material on group theoretic concepts; accepted for
  publication in Annals of Physics","Annals Phys.324:309-331,2009","10.1016/j.aop.2008.10.007",,"quant-ph","http://arxiv.org/licenses/nonexclusive-distrib/1.0/","  Earlier work presented a spacetime path formalism for relativistic quantum
mechanics arising naturally from the fundamental principles of the Born
probability rule, superposition, and spacetime translation invariance. The
resulting formalism can be seen as a foundation for a number of previous
parameterized approaches to relativistic quantum mechanics in the literature.
Because time is treated similarly to the three space coordinates, rather than
as an evolution parameter, such approaches have proved particularly useful in
the study of quantum gravity and cosmology. The present paper extends the
foundational spacetime path formalism to include massive, nonscalar particles
of any (integer or half-integer) spin. This is done by generalizing the
principle of translational invariance used in the scalar case to the principle
of full Poincare invariance, leading to a formulation for the nonscalar
propagator in terms of a path integral over the Poincare group. Once the
difficulty of the non-compactness of the component Lorentz group is dealt with,
the subsequent development is remarkably parallel to the scalar case. This
allows the formalism to retain a clear probabilistic interpretation throughout,
with a natural reduction to non-relativistic quantum mechanics closely related
to the well known generalized Foldy-Wouthuysen transformation.
","[{""version"":""v1"",""created"":""Sun, 20 Apr 2008 17:15:00 GMT""},{""version"":""v2"",""created"":""Sun, 16 Nov 2008 23:40:12 GMT""}]","2009-02-23"
"0804.3207","Adrian Melott","Dimitra Atri (1), Adrian L. Melott (1), and Brian C. Thomas (2) ((1)U
  Kansas (2) Washburn U)","Lookup tables to compute high energy cosmic ray induced atmospheric
  ionization and changes in atmospheric chemistry","In press: Journal of Cosmology and Astroparticle Physics. 6 figures,
  3 tables, two associated data files. Major revisions, including results of a
  greatly expanded computation, clarification and updated references. In the
  future we will expand the table to at least EeV levels.","JCAP 1005:008,2010","10.1088/1475-7516/2010/05/008",,"astro-ph astro-ph.HE hep-ex hep-ph hep-th physics.ao-ph","http://arxiv.org/licenses/nonexclusive-distrib/1.0/","  A variety of events such as gamma-ray bursts and supernovae may expose the
Earth to an increased flux of high-energy cosmic rays, with potentially
important effects on the biosphere. Existing atmospheric chemistry software
does not have the capability of incorporating the effects of substantial cosmic
ray flux above 10 GeV . An atmospheric code, the NASA-Goddard Space Flight
Center two-dimensional (latitude, altitude) time-dependent atmospheric model
(NGSFC), is used to study atmospheric chemistry changes. Using CORSIKA, we have
created tables that can be used to compute high energy cosmic ray (10 GeV - 1
PeV) induced atmospheric ionization and also, with the use of the NGSFC code,
can be used to simulate the resulting atmospheric chemistry changes. We discuss
the tables, their uses, weaknesses, and strengths.
","[{""version"":""v1"",""created"":""Sun, 20 Apr 2008 17:25:03 GMT""},{""version"":""v2"",""created"":""Sat, 13 Dec 2008 23:44:22 GMT""},{""version"":""v3"",""created"":""Thu, 5 Mar 2009 17:03:45 GMT""},{""version"":""v4"",""created"":""Mon, 3 May 2010 18:05:45 GMT""}]","2010-05-25"
"0804.3208","Sergey Favorov","S. Favorov and L. Golinskii","A Blaschke-type condition for analytic and subharmonic functions and
  application to contraction operators","12 pages, Bibliography 19 items. Added references, corrected typos","Linear and Complex Analysis, AMS Translations, 2009 Ser.2, V.226,
  p.37-47",,,"math.CV math.SP","http://arxiv.org/licenses/nonexclusive-distrib/1.0/","  Let $E$ be a closed set on the unit circle. We find a Blaschke-type
condition, optimal in a sense of the order, on the Riesz measure of a
subharmonic function $v$ in the unit disk with a certain growth at the
direction of $E$. In particular case when $E$ is a finite set, and $v=\log|f|$
with an analytic function $f$, our result agrees with the recent one by A.
Borichev, L. Golinskii and S. Kupin. An application to contractions close to
unitary operators in the Hilbert space is given.
","[{""version"":""v1"",""created"":""Sun, 20 Apr 2008 17:32:18 GMT""},{""version"":""v2"",""created"":""Sat, 27 Jun 2009 19:09:33 GMT""}]","2009-06-27"
"0804.3209","Hirbod Assa","Hirbod Assa","Convex Risk Measures: Lebesgue Property on one Period and Multi Period
  Risk Measures and Application in Capital Allocation Problem","17 pages",,,,"q-fin.RM math.OC math.PR","http://arxiv.org/licenses/nonexclusive-distrib/1.0/","  In this work we study the Lebesgue property for convex risk measures on the
space of bounded c\`adl\`ag random processes ($\mathcal{R}^\infty$). Lebesgue
property has been defined for one period convex risk measures in \cite{Jo} and
earlier had been studied in \cite{De} for coherent risk measures. We introduce
and study the Lebesgue property for convex risk measures in the multi period
framework. We give presentation of all convex risk measures with Lebesgue
property on bounded c\`adl\`ag processes. To do that we need to have a complete
description of compact sets of $\mathcal{A}^1$. The main mathematical
contribution of this paper is the characterization of the compact sets of
$\mathcal{A}^p$ (including $\mathcal{A}^1$). At the final part of this paper,
we will solve the Capital Allocation Problem when we work with coherent risk
measures.
","[{""version"":""v1"",""created"":""Sun, 20 Apr 2008 18:21:16 GMT""}]","2008-12-02"
"0804.3210","Robi Peschanski","Robi Peschanski (Saclay)","Introduction to String Theory and Gauge/Gravity duality for students in
  QCD and QGP phenomenology","37 pages, 10 figures, Presented at the School on QCD, Low-x Physics
  and Diffraction,Copanello, Calabria, Italy, July 2007.To be published by Acat
  Physica Polonica","Acta Phys.Polon.B39:2479-2510,2008",,,"hep-ph","http://arxiv.org/licenses/nonexclusive-distrib/1.0/","  String theory has been initially derived from motivations coming from strong
interaction phenomenology,but its application faced deep conceptual and
practical difficulties. The strong interactions found their theoretical
foundation elsewhere, namely on QCD, the quantum gauge field theory of quarks
and gluons. Recently, the Gauge/Gravity correspondence allowed to initiate a
reformulation of the connection between strings and gauge field theories,
avoiding some of the initial drawbacks and opening the way to new insights on
the gauge theory at strong coupling and eventually QCD. Among others, the
recent applications of the Gauge/Gravity correspondence to the formation of the
QGP, the quark-gluon plasma, in heavy-ion reactions seem to provide a
physically interesting insight on phenomenological features of the reactions.
In these lectures we will give a simplified introduction to those aspects of
string theory which, at the origin and in the recent developments, are
connected to strong interactions, for those students which are starting to
learn QCD and QGP physics from an experimental or phenomenological point of
view.
","[{""version"":""v1"",""created"":""Sun, 20 Apr 2008 18:42:57 GMT""}]","2008-12-19"
"0804.3211","Van Vu H.","Van Vu","A structural approach to subset-sum problems",,,,,"math.CO","http://arxiv.org/licenses/nonexclusive-distrib/1.0/","  We discuss a structural approach to subset-sum problems in additive
combinatorics. The core of this approach are Freiman-type structural theorems,
many of which will be presented through the paper. These results have
applications in various areas, such as number theory, combinatorics and
mathematical physics.
","[{""version"":""v1"",""created"":""Sun, 20 Apr 2008 18:58:39 GMT""}]","2008-04-22"
