"0804.3273","Kevin Weatherill","A. K. Mohapatra, M. G. Bason, B. Butscher, K. J. Weatherill, and C. S.
  Adams","Giant electro-optic effect using polarizable dark states","To appear in Nature Physics","Nature Physics. 4, 890 (2008)","10.1038/nphys1091",,"quant-ph","http://arxiv.org/licenses/nonexclusive-distrib/1.0/","  The electro-optic effect, where the refractive index of a medium is modified
by an electric field, is of central importance in non-linear optics, laser
technology, quantum optics and optical communications. In general,
electro-optic coefficients are very weak and a medium with a giant
electro-optic coefficient would have profound implications for non-linear
optics, especially at the single photon level, enabling single photon
entanglement and switching. Here we propose and demonstrate a giant
electro-optic effect based on polarizable dark states. We demonstrate phase
modulation of the light field in the dark state medium and measure an
electro-optic coefficient that is more than 12 orders of magnitude larger than
in other gases. This enormous Kerr non-linearity also creates the potential for
precision electrometry and photon entanglement.
","[{""version"":""v1"",""created"":""Mon, 21 Apr 2008 11:24:10 GMT""},{""version"":""v2"",""created"":""Tue, 19 Aug 2008 11:21:09 GMT""}]","2009-06-05"
"0804.3274","Ian Harry","I.W. Harry, S. Fairhurst, B.S. Sathyaprakash","A hierarchical search for gravitational waves from supermassive black
  hole binary mergers","11 pages, 2 figures, for GWDAW-12 proceedings edition of CQG","Class.Quant.Grav.25:184027,2008","10.1088/0264-9381/25/18/184027",,"gr-qc","http://arxiv.org/licenses/nonexclusive-distrib/1.0/","  We present a method to search for gravitational waves from coalescing
supermassive binary black holes in LISA data. The search utilizes the
$\mathcal{F}$-statistic to maximize over, and determine the values of, the
extrinsic parameters of the binary system. The intrinsic parameters are
searched over hierarchically using stochastically generated multi-dimensional
template banks to recover the masses and sky locations of the binary. We
present the results of this method applied to the mock LISA data Challenge 1B
data set.
","[{""version"":""v1"",""created"":""Mon, 21 Apr 2008 11:38:25 GMT""},{""version"":""v2"",""created"":""Wed, 1 Oct 2008 11:48:41 GMT""}]","2008-11-26"
"0804.3275","Gergely J Sz\""oll\H{o}si","Andras Czovek, Gergely J. Szollosi, Imre Derenyi","The relevance of neck linker docking in the motility of kinesin","Accepted for publication in BioSystems as part of the proceedings of
  BIOCOMP 2007","BioSystems 93, 29-33 (2008)","10.1016/j.biosystems.2008.04.006",,"physics.bio-ph q-bio.BM","http://arxiv.org/licenses/nonexclusive-distrib/1.0/","  Conventional kinesin is a motor protein, which is able to walk along a
microtubule processively. The exact mechanism of the stepping motion and force
generation of kinesin is still far from clear. In this paper we argue that neck
linker docking is a crucial element of this mechanism, without which the
experimentally observed dwell times of the steps could not be explained under a
wide range of loading forces. We also show that the experimental data impose
very strict constraints on the lengths of both the neck linker and its docking
section, which are compatible with the known structure of kinesin.
","[{""version"":""v1"",""created"":""Mon, 21 Apr 2008 11:31:36 GMT""}]","2009-01-25"
"0804.3276","Karim . A. Malik","Karim A. Malik and David R. Matravers","A Concise Introduction to Perturbation Theory in Cosmology","revtex4, 16 pages, 3 figures; v2: minor changes, typos corrected,
  reference added, version accepted by CQG","Class.Quant.Grav.25:193001,2008","10.1088/0264-9381/25/19/193001",,"astro-ph","http://arxiv.org/licenses/nonexclusive-distrib/1.0/","  We give a concise, self-contained introduction to perturbation theory in
cosmology at linear and second order, striking a balance between mathematical
rigour and usability. In particular we discuss gauge issues and the active and
passive approach to calculating gauge transformations. We also construct
gauge-invariant variables, including the second order tensor perturbation on
uniform curvature hypersurfaces.
","[{""version"":""v1"",""created"":""Mon, 21 Apr 2008 13:05:48 GMT""},{""version"":""v2"",""created"":""Mon, 22 Sep 2008 15:14:05 GMT""}]","2009-06-23"
"0804.3277","Diana Dorobantu","Diana Dorobantu (LSProba)","Optimal stopping for L\'evy processes and affine functions","32 pages",,,,"math.PR","http://arxiv.org/licenses/nonexclusive-distrib/1.0/","  This paper studies an optimal stopping problem for L\'evy processes. We give
a justification of the form of the Snell envelope using standard results of
optimal stopping. We also justify the convexity of the value function, and
without a priori restriction to a particular class of stopping times, we deduce
that the smallest optimal stopping time is necessarily a hitting time. We
propose a method which allows to obtain the optimal threshold. Moreover this
method allows to avoid long calculations of the integro-differential
operatorused in the usual proofs.
","[{""version"":""v1"",""created"":""Mon, 21 Apr 2008 11:37:42 GMT""}]","2008-12-18"
"0804.3278","Paulo M. S\'a","Paulo M. S\'a and Alfredo B. Henriques","Gravitational wave generation in power-law inflationary models","8 pages, 6 figures, added 3 references, text improved","Gen.Rel.Grav.41:2345-2359,2009","10.1007/s10714-009-0761-6",,"astro-ph","http://arxiv.org/licenses/nonexclusive-distrib/1.0/","  We investigate the generation of gravitational waves in power-law
inflationary models. The energy spectrum of the gravitational waves is
calculated using the method of continuous Bogoliubov coefficients. We show
that, by looking at the interval of frequencies between 10^(-5) and 10^5 Hz and
also at the GHz range, important information can be obtained, both about the
inflationary period itself and about the thermalization regime between the end
of inflation and the beginning of the radiation-dominated era. We thus deem the
development of gravitational wave detectors, covering the MHz/GHz range of
frequencies, to be an important task for the future.
","[{""version"":""v1"",""created"":""Mon, 21 Apr 2008 12:48:34 GMT""},{""version"":""v2"",""created"":""Fri, 6 Jun 2008 10:58:29 GMT""}]","2009-09-28"
"0804.3279","Gergely J Sz\""oll\H{o}si","Gergely J. Szollosi, Imre Derenyi","The Effect of Recombination on the Neutral Evolution of Genetic
  Robustness","Accepted for publication in Math. Biosci. as part of the proceedings
  of BIOCOMP 2007",,"10.1016/j.mbs.2008.03.010",,"q-bio.PE","http://arxiv.org/licenses/nonexclusive-distrib/1.0/","  Conventional population genetics considers the evolution of a limited number
of genotypes corresponding to phenotypes with different fitness. As model
phenotypes, in particular RNA secondary structure, have become computationally
tractable, however, it has become apparent that the context dependent effect of
mutations and the many-to-one nature inherent in these genotype-phenotype maps
can have fundamental evolutionary consequences. It has previously been
demonstrated that populations of genotypes evolving on the neutral networks
corresponding to all genotypes with the same secondary structure only through
neutral mutations can evolve mutational robustness [Nimwegen {\it et al.}
Neutral evolution of mutational robustness, 1999 PNAS], by concentrating the
population on regions of high neutrality. Introducing recombination we
demonstrate, through numerically calculating the stationary distribution of an
infinite population on ensembles of random neutral networks that mutational
robustness is significantly enhanced and further that the magnitude of this
enhancement is sensitive to details of the neutral network topology. Through
the simulation of finite populations of genotypes evolving on random neutral
networks and a scaled down microRNA neutral network, we show that even in
finite populations recombination will still act to focus the population on
regions of locally high neutrality.
","[{""version"":""v1"",""created"":""Mon, 21 Apr 2008 11:55:43 GMT""}]","2008-04-22"
"0804.3280","Jani-Petri Martikainen","J.-P. Martikainen, E. Lundh, and T. Paananen","Interband physics in an ultra-cold Fermi gas in an optical lattice","5 pages, 2 figures","Phys. Rev. A 78, 023607 (2008)","10.1103/PhysRevA.78.023607","NORDITA-2008-17","cond-mat.stat-mech cond-mat.supr-con","http://arxiv.org/licenses/nonexclusive-distrib/1.0/","  We study a gas of strongly polarized cold fermions in an optical lattice when
the excited p-bands are populated. We derive the relevant Hamiltonian and
discuss the expected phase diagram for both repulsive and attractive
interactions. In the parameter regime covered here, checkerboard
anti-ferromagnetic ordering is found to be possible for repulsive interactions
while for attractive interactions, transitions between different types of
paired phases are predicted.
","[{""version"":""v1"",""created"":""Mon, 21 Apr 2008 11:45:50 GMT""},{""version"":""v2"",""created"":""Wed, 24 Sep 2008 08:00:25 GMT""}]","2009-11-13"
"0804.3281","Anastasiya Derkachova","M. Zientara, D. Jakubczyk, K. Kolwas and M. Kolwas","Temperature dependence of evaporation coeffcient of water in air and
  nitrogen under atmospheric pressure; study in water droplets","Accepted The Journal of Phys. Chem. A",,"10.1021/jp7114324",,"physics.chem-ph","http://creativecommons.org/licenses/by/3.0/","  The evaporation coefficients of water in air and nitrogen were found as a
function of temperature, by studying the evaporation of pure water droplet. The
droplet was levitated in an electrodynamic trap placed in a climatic chamber
maintaining atmospheric pressure. Droplet radius evolution and evaporation
dynamics were studied with high precision by analyzing the angle-resolved light
scattering Mie interference patterns. A model of quasi-stationary droplet
evolution, accounting for the kinetic effects near the droplet surface was
applied. In particular, the effect of thermal effusion (a short range analogue
of thermal diffusion) was discussed and accounted for. The evaporation
coefficient \alpha in air and in nitrogen were found equal. \alpha was found to
decrease from ~ 0.18 to ~ 0.13 for the temperature range from 273.1 K to 293.1
K and follow the trend given by Arrhenius formula. The agreement with
condensation coefficient values obtained with essentially different method by
Li et al.[1] was found excellent. The comparison of experimental conditions
used in both methods revealed no dependence of evaporation/condensation
coefficient upon droplet charge nor ambient gas pressure within experimental
parameters range. The average value of thermal accommodation coefficient over
the same temperature range was found to be 1 \pm 0.05.
","[{""version"":""v1"",""created"":""Mon, 21 Apr 2008 12:13:53 GMT""}]","2016-09-28"
"0804.3282","Petre Dita","Petre Dita","CKM matrix unitarity and a novel type of global fits","4 pages",,,,"hep-ph","http://arxiv.org/licenses/nonexclusive-distrib/1.0/","  The aim of the paper is to propose one paradigm change of CKM global fits on
experimental data from electroweak sector. The change refers to using in fits
the exact unitarity constraints expressed in terms of four invariant
parameters, such as moduli of the CKM matrix, and to take into account an
important set of the available experimental data. In the paper we use data from
nuclear beta decays, and from leptonic and semileptonic decays, in order to
find the most probable numerical form of the CKM matrix, as well as the
determination of decay constants, $f_{P}$, and of various form factors
$f_+^{Pp}(0)$, directly from experimental results.
","[{""version"":""v1"",""created"":""Mon, 21 Apr 2008 11:51:53 GMT""}]","2008-04-22"
"0804.3283","Alexey Shorikov","A.O. Shorikov, M.A. Korotin, S.V. Streltsov, S.L. Skornyakov, D.M.
  Korotin and V.I. Anisimov","Coulomb correlation effects in LaOFeAs: LDA+DMFT(QMC) study","4 pages, 4 figures",,"10.1134/S1063776109010154",,"cond-mat.str-el","http://arxiv.org/licenses/nonexclusive-distrib/1.0/","  Effects of Coulomb correlation on LaOFeAs electronic structure have been
investigated by LDA+DMFT(QMC) method. The calculation results show that LaOFeAs
is in the regime of intermediate correlation strength with significant part of
the spectral density moved from the Fermi energy to Hubbard bands. However the
system is not on the edge of metal insulator-transition because increase of the
Coulomb interaction parameter value from $U$=4.0 eV to $U$=5.0 eV did not
result in insulator state. Correlations affect different d-orbitals not in the
same way. $t_{2g}$ states ($xz,yz$ and $x^2-y^2$ orbitals) have higher energy
due to crystal filed splitting and are nearly half-filled. Their spectral
functions have pseudogap with Fermi energy position on the higher sub-band
slope. Lower energy $e_g$ set of d-orbitals ($3z^2-r^2$ and $xy$) have
significantly larger occupancy values with typically metallic spectral
functions.
","[{""version"":""v1"",""created"":""Mon, 21 Apr 2008 11:52:04 GMT""},{""version"":""v2"",""created"":""Wed, 30 Apr 2008 10:22:12 GMT""}]","2009-11-13"
"0804.3284","Arianna Montorsi","Arianna Montorsi","Phase separation in fermionic systems with particle-hole asymmetry","4 pages, 2 figures","J. Stat. Mech. (2008) L09001","10.1088/1742-5468/2008/09/L09001",,"cond-mat.str-el cond-mat.stat-mech","http://arxiv.org/licenses/nonexclusive-distrib/1.0/","  We determine the ground-state phase-diagram of a Hubbard Hamiltonian with
correlated hopping, which is asymmetric under particle-hole transform. By
lowering the repulsive Coulomb interaction U at appropriate filling and
interaction parameters, the ground state separates into a hole and an electron
conducting phases: two different wave vectors characterize the system and
charge-charge correlations become incommensurate. By further decreasing U
another transition occurs at which the hole conducting region becomes
insulating, and conventional phase separation takes place. Finally, for
negative U the whole system eventually becomes a paired insulator. It is
speculated that such behavior could be at the origin of the incommensurate
superconducting phase recently discovered in the 1D Hirsch model. The exact
phase boundaries are calculated in one dimension.
","[{""version"":""v1"",""created"":""Mon, 21 Apr 2008 12:12:09 GMT""},{""version"":""v2"",""created"":""Wed, 7 May 2008 09:39:36 GMT""},{""version"":""v3"",""created"":""Fri, 1 Aug 2008 13:42:22 GMT""}]","2009-11-13"
"0804.3285","Gamal G.L. Nashed","Gamal Gergess Lamee Nashed","Charged Dilaton, Energy, Momentum and Angular-Momentum in Teleparallel
  Theory Equivalent to General Relativity","22 Pages Latex","Eur.Phys.J.C54:291-302,2008","10.1140/epjc/s10052-007-0511-4",,"gr-qc","http://arxiv.org/licenses/nonexclusive-distrib/1.0/","  We apply the energy-momentum tensor to calculate energy, momentum and
angular-momentum of two different tetrad fields. This tensor is coordinate
independent of the gravitational field established in the Hamiltonian structure
of the teleparallel equivalent of general relativity (TEGR). The spacetime of
these tetrad fields is the charged dilaton. Our results show that the energy
associated with one of these tetrad fields is consistent, while the other one
does not show this consistency. Therefore, we use the regularized expression of
the gravitational energy-momentum tensor of the TEGR. We investigate the energy
within the external event horizon using the definition of the gravitational
energy-momentum.
","[{""version"":""v1"",""created"":""Mon, 21 Apr 2008 12:23:50 GMT""}]","2008-11-26"
"0804.3286","Kungho Chan","Kungho Chan","A characterization of double covers of curves in terms of the ample cone
  of second symmetric product","13 pages, to appear in J. Pure App. Algebra",,,,"math.AG","http://arxiv.org/licenses/nonexclusive-distrib/1.0/","  We investigate the nef cone spanned by the diagonal and the fibre classes of
second symmetric product of a curve of genus $g$. This 2-dimensional nef cone
gives a characterization of double covers of curves of genus $\le
\frac{g-1}{8}$. This is a generalization of a result by Debarre.
","[{""version"":""v1"",""created"":""Mon, 21 Apr 2008 12:24:15 GMT""},{""version"":""v2"",""created"":""Thu, 8 May 2008 09:14:00 GMT""}]","2008-05-08"
"0804.3287","Veronica Ahufinger","V. Ahufinger, B. A. Malomed, G. Birkl, R. Corbalan and A. Sanpera","Double barrier potentials for matter-wave gap solitons","5 pages, 4 figures","Phys. Rev. A 78, 013608 (2008)","10.1103/PhysRevA.78.013608",,"cond-mat.other nlin.PS","http://arxiv.org/licenses/nonexclusive-distrib/1.0/","  We investigate collisions of solitons of the gap type, supported by a lattice
potential in repulsive Bose-Einstein condensates, with an effective
double-barrier potential that resembles a Fabry-Perot cavity. We identify
conditions under which the trapping of the entire incident soliton in the
cavity is possible. Collisions of the incident soliton with an earlier trapped
one are considered too. In the latter case, many outcomes of the collisions are
identified, including merging, release of the trapped soliton with or without
being replaced by the incoming one, and trapping of both solitons.
","[{""version"":""v1"",""created"":""Mon, 21 Apr 2008 12:25:48 GMT""}]","2009-11-13"
"0804.3288","Stefan Engblom","Stefan Engblom, Lars Ferm, Andreas Hellander, Per L\""otstedt","Simulation of stochastic reaction-diffusion processes on unstructured
  meshes",,"Revised version in SIAM J. Sci. Comput. 31(3):1774-1797, 2009","10.1137/080721388",,"math.NA","http://arxiv.org/licenses/nonexclusive-distrib/1.0/","  Stochastic chemical systems with diffusion are modeled with a
reaction-diffusion master equation. On a macroscopic level, the governing
equation is a reaction-diffusion equation for the averages of the chemical
species. On a mesoscopic level, the master equation for a well stirred chemical
system is combined with Brownian motion in space to obtain the
reaction-diffusion master equation. The space is covered by an unstructured
mesh and the diffusion coefficients on the mesoscale are obtained from a finite
element discretization of the Laplace operator on the macroscale. The resulting
method is a flexible hybrid algorithm in that the diffusion can be handled
either on the meso- or on the macroscale level. The accuracy and the efficiency
of the method are illustrated in three numerical examples inspired by molecular
biology.
","[{""version"":""v1"",""created"":""Mon, 21 Apr 2008 12:27:07 GMT""}]","2009-03-06"
"0804.3289","Rudolf Rohr","Rudolf Philippe Rohr","Principal basis in Cartan subalgebra","14 pages","Journal of Lie theory (2010), 20:673-687",,,"math.RT","http://arxiv.org/licenses/nonexclusive-distrib/1.0/","  Let $\Lie{g}$ be a simple complex Lie algebra and $\Lie{h}$ a Cartan
subalgebra. In this article we explain how to obtain the principal basis of
$\Lie{h}$ starting form a set of generators
$\{p_1,...,p_r\}$,$r=\rank(\Lie{g})$, of the invariants polynomials $\Sgg$. For
each invariant polynomial $p$, we define a $G$-equivariant map $Dp$ form
$\Lie{g}$ to $\Lie{g}$. We show that the Gram-Schmidt orthogonalization of the
elements $\{Dp_1(\rho^\vee), ... Dp_r(\rho^\vee) \}$ gives the principal basis
of $\Lie{h}$. Similarly the orthogonalization of the elements $\{Dp_1(\rho),
>... Dp_r(\rho) \}$ produces the principal basis of the Cartan subalgebra of
$\lLie{g}$, the Langlands dual of $\Lie{g}$.
","[{""version"":""v1"",""created"":""Mon, 21 Apr 2008 12:32:48 GMT""}]","2011-05-17"
"0804.3290","Naohito Tomita","Naohito Tomita","On the H\""ormander multiplier theorem and modulation spaces",,,,,"math.FA math.AP","http://arxiv.org/licenses/nonexclusive-distrib/1.0/","  It is known that the Sobolev space $L^2_s$ with $s>n/2$ appeared in the
H\""ormander multiplier theorem can be replaced by the Besov space
$B^{2,1}_{n/2}$. On the other hand, the Besov space $B_{n/2}^{2,1}$ is
continuously embedded in the modulation space $M^{2,1}_0$. In this paper, we
consider the problem whether we can replace $B_{n/2}^{2,1}$ by $M^{2,1}_0$.
","[{""version"":""v1"",""created"":""Mon, 21 Apr 2008 12:33:35 GMT""},{""version"":""v2"",""created"":""Sat, 26 Apr 2008 02:03:48 GMT""},{""version"":""v3"",""created"":""Sun, 5 Oct 2008 23:23:21 GMT""}]","2008-10-06"
"0804.3291","Sergey Vodopyanov K.","Maria Karmanova, Sergey Vodopyanov","Geometry of Carnot--Carath\'{e}odory Spaces, Differentiability and
  Coarea Formula","94 pages",,,,"math.MG","http://arxiv.org/licenses/nonexclusive-distrib/1.0/","  We give a simple proof of Gromov's Theorem on nilpotentization of vector
fields, and exhibit a new method for obtaining quantitative estimates of
comparing geometries of two different local Carnot groups in
Carnot--Carath\'{e}odory spaces with $C^{1,\alpha}$-smooth basis vector fields,
$\alpha\in[0,1]$. From here we obtain the similar estimates for comparing
geometries of a Carnot--Carath\'{e}odory space and a local Carnot group. These
two theorems imply basic results of the theory: Gromov type Local Approximation
Theorems, and for $\alpha>0$ Rashevski\v{\i}-Chow Theorem and Ball--Box
Theorem, etc. We apply the obtained results for proving $hc$-differentiability
of mappings of Carnot--Carath\'{e}odory spaces with continuous horizontal
derivatives. The latter is used in proving the coarea formula for some classes
of contact mappings of Carnot--Carath\'{e}odory spaces.
","[{""version"":""v1"",""created"":""Mon, 21 Apr 2008 12:36:16 GMT""},{""version"":""v2"",""created"":""Mon, 26 May 2008 13:39:29 GMT""}]","2008-05-26"
"0804.3293","Eric Nordenstam","Peter J. Forrester, Eric Nordenstam","The Anti-Symmetric GUE Minor Process","22 pages, 1 figure","Mosc. Math. J., 9 (2009), no. 4, 749-774",,,"math.PR","http://arxiv.org/licenses/nonexclusive-distrib/1.0/","  Our study is initiated by a multi-component particle system underlying the
tiling of a half hexagon by three species of rhombi. In this particle system
species $j$ consists of $\lfloor j/2 \rfloor$ particles which are interlaced
with neigbouring species. The joint probability density function (PDF) for this
particle system is obtained, and is shown in a suitable scaling limit to
coincide with the joint eigenvalue PDF for the process formed by the successive
minors of anti-symmetric GUE matrices, which in turn we compute from first
principles. The correlations for this process are determinantal and we give an
explicit formula for the corresponding correlation kernel in terms of Hermite
polynomials. Scaling limits of the latter are computed, giving rise to the Airy
kernel, extended Airy kernel and bead kernel at the soft edge and in the bulk,
as well as a new kernel at the hard edge.
","[{""version"":""v1"",""created"":""Mon, 21 Apr 2008 12:38:09 GMT""}]","2010-06-16"
"0804.3294","Riccardo Franco","Riccardo Franco","Grover's algorithm and human memory",,,,,"quant-ph","http://arxiv.org/licenses/nonexclusive-distrib/1.0/","  In this article we consider an experimental study showing the influence of
emotion regulation strategies on human memory performance: part of such
experimental results are difficult to explain within a classic cognitive
allocation model. We provide a first attempt to build a model of human memory
processes based on a quantum algorithm, the Grover's algorithm, which allows to
search a particular item within an unsorted set of items more efficiently than
any classic search algorithm. Based on Grover's algorithm paradigm, this new
memory model results to have interesting features: it is an iterative process,
it uses parallelism and interference effects. Moreover, the strength of such
interference effects depends on a parameter of the generalized Grover's
algorithm, called the phase, which admits an interpretation in terms of the
emotions involved by the items and by the emotion regulation strategies. Thus
we show that a reasonable choice of the phase is able to describe correctly the
experimental results we consider.
","[{""version"":""v1"",""created"":""Mon, 21 Apr 2008 12:38:25 GMT""}]","2008-04-22"
"0804.3295","Valentina Klochkova","V.G.Klochkova, E.L.Chentsov, V.E.Panchuk","V2324Cyg - an F-type star with fast wind","28 pages, 6 figures",,"10.1134/S199034130802003X",,"astro-ph","http://arxiv.org/licenses/nonexclusive-distrib/1.0/","  For the first time high-resolution optical spectroscopy of the variable star
V2324Cyg associated with the IR-source IRAS20572+4919 is made. More than 200
absorption features (mostly FeII, TiII, CrII, YII, BaII, and YII) are
identified within the wavelength interval 4549-7880AA. The spectral type and
rotation velocity of the star are found to be F0III and Vsini=69km/s,
respectively. HI and NaID lines have complex PCyg-type profiles with an
emission component. Neither systematic trend of radial velocity Vr with line
depth Ro nor temporal variability of Vr have been found. We determined the
average heliocentric radial velocity Vr=-16.8\pm 0.6km/s. The radial velocities
inferred from the cores of the absorption components of the H$\beta$ and NaI
wind lines vary from -140 to -225km/s (and the expansion velocities of the
corresponding layers, from about 120 to 210km/s). The maximum expansion
velocity is found for the blue component of the split H$\alpha$ absorption:
450km/s for December 12, 1995. The model atmospheres method is used to
determine the star's parameters: Teff=7500K, log g=2.0, $\xi_t$=6.0km/s, and
metallicity, which is equal to the solar value. The main peculiarity of the
chemical abundances pattern is the overabundance of lithium and sodium. The
results cast some doubt on the classification of V2324Cyg as a post-AGB star.
","[{""version"":""v1"",""created"":""Mon, 21 Apr 2008 13:08:36 GMT""}]","2009-11-13"
