"0804.3234","Jorge Leandro","J. J. G. Leandro (1), R. M. Cesar Jr (1) and L. da F. Costa (2) ((1)
  Institute of Mathematics and Statistics - USP - Brazil, (2) Instituto de
  F\'isica de S\~ao Carlos - USP - Brazil)","Technical Report - Automatic Contour Extraction from 2D Neuron Images","40 pages, 22 figures and 02 tables. Typos corrected, references
  added, figures added, new experiments added. Submitted to Elsevier-Journal of
  Neuronscience Methods. For associated video demonstration of the system, see
  http://www.vision.ime.usp.br/creativision/demos/branch/alfa-bta-bscea-fast.html",,,,"cs.CV q-bio.NC","http://arxiv.org/licenses/nonexclusive-distrib/1.0/","  This work describes a novel methodology for automatic contour extraction from
2D images of 3D neurons (e.g. camera lucida images and other types of 2D
microscopy). Most contour-based shape analysis methods can not be used to
characterize such cells because of overlaps between neuronal processes. The
proposed framework is specifically aimed at the problem of contour following
even in presence of multiple overlaps. First, the input image is preprocessed
in order to obtain an 8-connected skeleton with one-pixel-wide branches, as
well as a set of critical regions (i.e., bifurcations and crossings). Next, for
each subtree, the tracking stage iteratively labels all valid pixel of
branches, up to a critical region, where it determines the suitable direction
to proceed. Finally, the labeled skeleton segments are followed in order to
yield the parametric contour of the neuronal shape under analysis. The reported
system was successfully tested with respect to several images and the results
from a set of three neuron images are presented here, each pertaining to a
different class, i.e. alpha, delta and epsilon ganglion cells, containing a
total of 34 crossings. The algorithms successfully got across all these
overlaps. The method has also been found to exhibit robustness even for images
with close parallel segments. The proposed method is robust and may be
implemented in an efficient manner. The introduction of this approach should
pave the way for more systematic application of contour-based shape analysis
methods in neuronal morphology.
","[{""version"":""v1"",""created"":""Mon, 21 Apr 2008 04:03:48 GMT""},{""version"":""v2"",""created"":""Fri, 24 Oct 2008 16:02:03 GMT""}]","2008-10-24"
"0804.3235","Jesus Zavala","Dario Nunez, Jesus Zavala, Lukas Nellen, Roberto A. Sussman, Luis G.
  Cabral-Rosetti and Myriam Mondragon","Constraining the mSUGRA parameter space using the entropy of dark matter
  halos","25 pages, 6 figures. Accepted for publication in JCAP","JCAP 0805:003,2008","10.1088/1475-7516/2008/05/003",,"astro-ph hep-ph","http://arxiv.org/licenses/nonexclusive-distrib/1.0/","  We derive an expression for the entropy of a dark matter halo described by a
Navarro-Frenk-White model with a core. The comparison of this entropy with the
one of dark matter at the freeze-out era allows us to constraint the parameter
space in mSUGRA models. Moreover, joining these constraints with the ones
obtained from the usual abundance criteria and demanding both criteria to be
consistent with the 2$\sigma$ bounds for the abundance of dark matter:
$0.112\leq\Omega_{DM}h^2\leq0.122$, we are able to clearly discriminate
validity regions among the values of $\tan \beta$, one of the parameters of the
mSUGRA model. We found that for the explored regions of the parameter space,
small values of tan$\beta$ are not favored; only for tan$\beta\simeq50$ are
both criteria significantly consistent. In the region where both criteria are
consistent we also found a lower bound for the neutralino mass, $m_{\chi}\geq
141$ GeV.
","[{""version"":""v1"",""created"":""Mon, 21 Apr 2008 04:14:30 GMT""}]","2009-06-23"
"0804.3236","Hidehiko Shimada","Hidehiko Shimada","$\beta$-deformation for matrix model of M-theory","36 pages","Nucl.Phys.B813:283-314,2009","10.1016/j.nuclphysb.2008.08.018","AEI-2008-025","hep-th","http://arxiv.org/licenses/nonexclusive-distrib/1.0/","  A new class of deformation of the matrix model of M-theory is considered. The
deformation is analogous to the so-called $\b$-deformation of $D=3+1$, $\mN=4$
Super Yang-Mills theory, which preserves the conformal symmetry. It is shown
that the deformed matrix model can be considered as a matrix model of M-theory
on a certain curved background in eleven-dimensional supergravity, under a
scaling limit involving the deformation parameter and $N$ (the size of the
matrices). The background belongs to the so-called pp-wave type metric with a
non-constant four-form flux depending linearly on transverse coordinates. Some
stable solutions of the deformed model are studied, which correspond to
membranes with the torus topology. In particular, it is found that apparently
distinct configurations of membranes, having different winding numbers, are
indistinguishable in the matrix model. Simultaneous introduction of both
$\b$-deformation and mass-deformation is also considered, and, in particular, a
situation is found in which the stable membrane configuration interpolates
between a torus and a sphere, depending on the values of the deformation
parameters.
","[{""version"":""v1"",""created"":""Mon, 21 Apr 2008 07:19:02 GMT""}]","2010-05-28"
"0804.3237","Chantal Enguehard","Chantal Enguehard (LINA), Jean-Didier Graton","Electronic Voting: the Devil is in the Details","9 pages",,,,"cs.CY","http://arxiv.org/licenses/nonexclusive-distrib/1.0/","  Observing electronic voting from an international point of view gives some
perspective about its genesis and evolution. An analysis of the voting process
through its cultural, ontological, legal and political dimensions explains the
difficulty to normalize this process. It appears that international
organizations are not capable to properly defend the fundamental rights of the
citizens. The approach that was taken when DRE voting computers appeared seems
to have reoccured with VVAT voting computers and the european e-poll project.
","[{""version"":""v1"",""created"":""Mon, 21 Apr 2008 06:01:54 GMT""}]","2008-12-18"
"0804.3238","Emeric Falize","Emeric Falize (DPTA, LUTH), Claire Michaut (LUTH), Serge Bouquet
  (DPTA), C\'ecile Cavet (LUTH)","Analytical solutions of specific classes of astrophysical radiating
  shocks",,"SF2A proceeding (2007) 4",,,"astro-ph","http://arxiv.org/licenses/nonexclusive-distrib/1.0/","  In this paper we study specific classes of radiating shocks which are widely
spread in astrophysical environments. We present more general solutions of
their structure and proceed to the analytical determination of physical
quantities.
","[{""version"":""v1"",""created"":""Mon, 21 Apr 2008 06:07:20 GMT""}]","2008-12-18"
"0804.3239","Dong Phung Van","P. V. Dong and H. N. Long","The economical SU(3)_C X SU(3)_L X U(1)_X model","89 pages, 26 figures, accepted for publication in Advances in High
  Energy Physics","Adv.High Energy Phys.2008:739492,2008","10.1155/2008/739492","KEK-TH-1245","hep-ph","http://arxiv.org/licenses/nonexclusive-distrib/1.0/","  In this report the SU(3)_C X SU(3)_L X U(1)_X gauge model with minimal scalar
sector, two Higgs triplets, is presented in detail. One of the vacuum
expectation values $u$ is a source of lepton-number violations and a reason for
mixing among charged gauge bosons--the standard model W^\pm and the bilepton
gauge bosons Y^\pm as well as among the neutral non-Hermitian bilepton X^0 and
neutral gauge bosons--the Z and the new Z'. An exact diagonalization of the
neutral gauge boson sector is derived and bilepton mass splitting is also
given. Because of these mixings, the lepton-number violating interactions exist
in both charged and neutral gauge boson sectors. Constraints on vacuum
expectation values of the model are estimated and u \simeq O(1) GeV, v \simeq
v_weak = 246 GeV, and \omega \simeq O(1) TeV. In this model there are three
physical scalars, two neutral and one charged, and eight Goldstone bosons--the
needed number for massive gauge bosons. The minimal scalar sector can provide
all fermions including quarks and neutrinos consistent masses in which some of
them require one-loop radiative corrections.
","[{""version"":""v1"",""created"":""Mon, 21 Apr 2008 06:22:40 GMT""}]","2009-12-17"
"0804.3240","Sebastien Louis Mr","Sebastien G.R. Louis, W.J. Munro, T.P. Spiller, and Kae Nemoto","Loss in hybrid qubit-bus couplings and gates","11 pages, 7 figures","Phys. Rev. A 78, 022326 (2008)","10.1103/PhysRevA.78.022326",,"quant-ph cond-mat.supr-con","http://arxiv.org/licenses/nonexclusive-distrib/1.0/","  We provide a characterization and analysis of the effects of dissipation on
oscillator assisted (qubus) quantum gates. The effects can be understood and
minimized by looking at the dynamics of the signal coherence and its
entanglement with the continuous variable probe. Adding loss in between
successive interactions we obtain the effective quantum operations, providing a
novel approach to loss analysis in such hybrid settings. We find that in the
presence of moderate dissipation the gate can operate with a high fidelity. We
also show how a simple iteration scheme leads to independent single qubit
dephasing, while retaining the conditional phase operation regardless of the
amount of loss incurred by the probe.
","[{""version"":""v1"",""created"":""Mon, 21 Apr 2008 06:31:08 GMT""}]","2010-08-23"
"0804.3241","Sossio Vergara","Sossio Vergara","A Synthesizer Based on Frequency-Phase Analysis and Square Waves","9 pages. Digital Signal Processing Journal 22 (2012)",,,,"cs.SD cs.DM","http://arxiv.org/licenses/nonexclusive-distrib/1.0/","  This article introduces an effective generalization of the polar flavor of
the Fourier Theorem based on a new method of analysis. Under the premises of
the new theory an ample class of functions become viable as bases, with the
further advantage of using the same basis for analysis and reconstruction. In
fact other tools, like the wavelets, admit specially built nonorthogonal bases
but require different bases for analysis and reconstruction (biorthogonal and
dual bases) and vectorial coordinates; this renders those systems unintuitive
and computing intensive. As an example of the advantages of the new
generalization of the Fourier Theorem, this paper introduces a novel method for
the synthesis that is based on frequency-phase series of square waves (the
equivalent of the polar Fourier Theorem but for nonorthogonal bases). The
resulting synthesizer is very efficient needing only few components, frugal in
terms of computing needs, and viable for many applications.
","[{""version"":""v1"",""created"":""Mon, 21 Apr 2008 06:32:23 GMT""},{""version"":""v2"",""created"":""Sat, 23 Nov 2013 09:08:26 GMT""}]","2013-11-26"
"0804.3242","Clara L\""oh","Clara Loeh","Fundamental classes of negatively curved manifolds cannot be represented
  by products of manifolds","this preprint is superseded by arXiv:0806.4540; 8 pages",,,,"math.AT","http://arxiv.org/licenses/nonexclusive-distrib/1.0/","  Not every singular homology class is the push-forward of the fundamental
class of some manifold. In the same spirit, one can study the following
problem: Which singular homology classes are the push-forward of the
fundamental class of a given type of manifolds? In the present article, we show
that the fundamental classes of negatively curved manifolds cannot be
represented by a non-trivial product of manifolds. This observation sheds some
light on the functorial semi-norm on singular homology given by products of
compact surfaces.
","[{""version"":""v1"",""created"":""Mon, 21 Apr 2008 07:03:55 GMT""},{""version"":""v2"",""created"":""Fri, 9 May 2008 11:55:21 GMT""},{""version"":""v3"",""created"":""Fri, 4 Jul 2008 08:14:21 GMT""}]","2008-07-04"
"0804.3243","Ronald Christensen","Ronald Christensen, Wesley Johnson","A Conversation with Seymour Geisser","Published in at http://dx.doi.org/10.1214/088342307000000131 the
  Statistical Science (http://www.imstat.org/sts/) by the Institute of
  Mathematical Statistics (http://www.imstat.org)","Statistical Science 2007, Vol. 22, No. 4, 621-636","10.1214/088342307000000131","IMS-STS-STS203","stat.ME","http://arxiv.org/licenses/nonexclusive-distrib/1.0/","  Seymour Geisser received his bachelor's degree in Mathematics from the City
College of New York in 1950, and his M.A. and Ph.D. degrees in Mathematical
Statistics at the University of North Carolina in 1952 and 1955, respectively.
He then held positions at the National Bureau of Standards and the National
Institute of Mental Health until 1961. From 1961 until 1965, he was Chief of
the Biometry Section at the National Institute of Arthritis and Metabolic
Diseases, and also held the position of Professorial Lecturer at the George
Washington University from 1960 to 1965. From 1965 to 1970, he was the founding
Chair of the Department of Statistics at the State University of New York,
Buffalo, and in 1971, he became the founding Director of the School of
Statistics at the University of Minnesota, remaining in that position until
2001. He held visiting professorships at Iowa State University, 1960;
University of Wisconsin, 1964; University of Tel-Aviv (Israel), 1971;
University of Waterloo (Canada), 1972; Stanford University, 1976, 1977, 1988;
Carnegie Mellon University, 1976; University of the Orange Free State (South
Africa), 1978, 1993; Harvard University, 1981; University of Chicago, 1985;
University of Warwick (England), 1986; University of Modena (Italy), 1996; and
National Chiao Tung University (Taiwan), 1998. He was the Lady Davis Visiting
Professor, Hebrew University of Jerusalem, 1991, 1994, 1999, and the Schor
Scholar, Merck Research Laboratories, 2002-2003. He was a Fellow of the
Institute of Mathematical Statistics and the American Statistical Association.
","[{""version"":""v1"",""created"":""Mon, 21 Apr 2008 07:06:30 GMT""}]","2008-12-18"
"0804.3244","Barry I. Graubard","Barry I. Graubard, Paul S. Levy, Gordon B. Willis","A Conversation with Monroe Sirken","Published in at http://dx.doi.org/10.1214/07-STS245 the Statistical
  Science (http://www.imstat.org/sts/) by the Institute of Mathematical
  Statistics (http://www.imstat.org)","Statistical Science 2007, Vol. 22, No. 4, 637-650","10.1214/07-STS245","IMS-STS-STS245","stat.ME","http://arxiv.org/licenses/nonexclusive-distrib/1.0/","  Born January 11, 1921 in New York City, Monroe Sirken grew up in a suburb of
Pasadena, California. He earned B.A. and M.A. degrees in sociology at UCLA in
1946 and 1947, and a Ph.D. in 1950 in sociology with a minor in mathematics at
the University of Washington in 1950 where Professor Z. W. Birnbaum was his
mentor and thesis advisor. As a Post-Doctoral Fellow of the Social Science
Research Council, Monroe spent 1950--1951 at the Statistics Laboratory,
University of California at Berkeley and the Office of the Assistant Director
for Research, U.S. Bureau of the Census in Suitland, Maryland. Monroe visited
the Census Bureau at a time of great change in the use of sampling and survey
methods, and decided to remain. He began his government career there in 1951 as
a mathematical statistician, and moved to the National Office of Vital
Statistics (NOVS) in 1953 where he was an actuarial mathematician and a
mathematical statistician. He has held a variety of research and administrative
positions at the National Center for Health Statistics (NCHS) and he was the
Associate Director, Research and Methodology and the Director, Office of
Research and Methodology until 1996 when he became a senior research scientist,
the title he currently holds. Aside from administrative responsibilities,
Monroe's major professional interests have been conducting and fostering survey
and statistical research responsive to the needs of federal statistics. His
interest in the design of rare and sensitive population surveys led to the
development of network sampling which improves precision by linking multiple
selection units to the same observation units. His interest in fostering
research on the cognitive aspects of survey methods led to the establishment of
permanent questionnaire design research laboratories, first at NCHS and later
at other federal statistical agencies here and abroad.
","[{""version"":""v1"",""created"":""Mon, 21 Apr 2008 07:58:24 GMT""}]","2008-12-18"
"0804.3245","Jan Chwedenczuk","Jan Chwede\'nczuk, Wojciech Wasilewski","Intensity of parametric fluorescence pumped by ultrashort pulses",,,"10.1103/PhysRevA.78.063823",,"quant-ph","http://arxiv.org/licenses/nonexclusive-distrib/1.0/","  We investigate intensity of the parametric down conversion of ultrashort,
ultraviolet pulse both in a low- and high-conversion regime. In the first
regime, we develop a simple analytical expressions for the photon flux of the
fluorescence. Numerical simulations using three-dimensional stochastic Wigner
method provide results in the latter regime. We find that the perturbative
approximation for the photon flux as a function of the wavelength of the signal
and the observation angle, quantitatively describes even the non-perturbative
regime. For short pump pulses the intensity of the fluorescence is highest at
frequencies where the group velocities of the pump and the down-conversion are
equal. For longer pump pulses this requirement is gradually relaxed.
Additionally, for small pump beams, the intensity strongly depends on the
spatial divergence between interacting fields.
","[{""version"":""v1"",""created"":""Mon, 21 Apr 2008 08:15:27 GMT""}]","2009-11-13"
"0804.3246","Gabriele Tartaglino-Mazzucchelli","Sergei M. Kuzenko, Gabriele Tartaglino-Mazzucchelli","Wandering in five-dimensional curved superspace","10 pages, LaTeX, Contribution to the proceedings of the Third
  Workshop of the RTN project ""Constituents, Fundamental Forces and Symmetries
  of the Universe,"" Valencia, October 1-5, 2007; V2: typo above eq. (26)
  corrected","Fortsch.Phys.56:929-935,2008","10.1002/prop.200810560",,"hep-th","http://arxiv.org/licenses/nonexclusive-distrib/1.0/","  This is a brief review of the superspace formulation for five-dimensional N=1
matter-coupled supergravity recently developed by the authors.
","[{""version"":""v1"",""created"":""Mon, 21 Apr 2008 08:19:22 GMT""},{""version"":""v2"",""created"":""Thu, 26 Jun 2008 16:15:13 GMT""}]","2008-11-26"
"0804.3247","Dario Zappala","M. Baldo, V. Palmisano","Probing protoneutron star density profile from neutrino signals","9 figures","Phys.Rev.C78:015807,2008","10.1103/PhysRevC.78.015807",,"astro-ph","http://arxiv.org/licenses/nonexclusive-distrib/1.0/","  Supernovae of Type II is a phenomenon that occurs at the end of evolution of
massive stars when the iron core of the star exceeds a mass limit. After
collapse of the core under gravity the shock wave alone does not succeed in
expelling the mass of the star and in this sense the role of neutrinos is the
most important mechanism to do so. During the emission of neutrinos flavor
conversion is possible, related the phenomenon of oscillations, which however
depends directly on the particular density profile of the medium. In this paper
we present results of numerical simulations of neutrino flavor conversion in
protoneutron stars and after collapse. The probabilities of survival for a
given flavor in a complete three-flavors framework is estimated through an
algorithm which conserves unitarity to a high degree of accuracy. The
sensitivity of the results to the different adopted models for the protoneutron
star structure is examined in detail demonstrating how the neutrino signal
could be used to check the validity of models.
","[{""version"":""v1"",""created"":""Mon, 21 Apr 2008 09:02:30 GMT""}]","2008-11-26"
"0804.3248","Kiyoshi Ichimoto Dr.","K.Ichimoto, Y.Katsukawa, T.Tarbell, R.A.Shine, C.Hoffmann, T.Berger,
  T.Cruz, Y.Suematsu, S.Tsuneta, T.Shimizu, B.W.Lites","On-orbit Performance of the Solar Optical Telescope aboard Hinode","6 pages, Hinode science meeting in Dublin, ASP conf. series",,,,"astro-ph","http://arxiv.org/licenses/nonexclusive-distrib/1.0/","  On-orbit performance of the Solar Optical Telescope (SOT) aboard Hinode is
described with some attentions on its unpredicted aspects. In general, SOT
revealed an excellent performance and has been providing outstanding data. Some
unexpected features exist, however, in behaviors of the focus position,
throughput and structural stability. Most of them are recovered by the daily
operation i.e., frequent focus adjustment, careful heater setting and
corrections in data analysis. The tunable filter contains air bubbles which
degrade the data quality significantly. Schemes for tuning the filter without
disturbing the bubbles have been developed and tested, and some useful
procedures to obtain Dopplergram and magnetogram are now available. October and
March when the orbit of satellite becomes nearly perpendicular to the direction
towards the sun provide a favorable condition for continuous runs of the
narrow-band filter imager.
","[{""version"":""v1"",""created"":""Mon, 21 Apr 2008 09:03:44 GMT""}]","2008-04-22"
"0804.3250","Eva Maria Br\""uning","E.M. Br\""uning, C. Krellner, M. Baenitz, A. Jesche, F. Steglich, and
  C. Geibel","CeFePO: A Heavy Fermion Metal with Ferromagnetic Correlations","5 pages, 4 figures","Phys. Rev. Lett. 101, 117206 (2008)","10.1103/PhysRevLett.101.117206",,"cond-mat.str-el cond-mat.mtrl-sci","http://arxiv.org/licenses/nonexclusive-distrib/1.0/","  The ground state properties of CeFePO, a homologue of the new high
temperature superconductors RFePnO(1-x)Fx, were studied by means of
susceptibility, specific heat, resistivity, and NMR measurements on
polycrystals. All the results demonstrate that this compound is a magnetically
non-ordered heavy Fermion metal with a Kondo temperature TK~10K, a Sommerfeld
coefficient gamma=700mJ/molK2 and a mass enhancement factor of the order of
200. The absence of a Fe-contribution to the effective moment at high
temperatures indicates that the magnetism in CeFePO is completely dominated by
the effect of Ce. Thus the strong electronic correlation effects originate from
the Ce-4f electrons rather than from the Fe-3d electrons. An enhanced
Sommerfeld-Wilson ratio R=5.5 as well as a Korringa product S0/T1TK2~0.065 well
below 1 indicate the presence of ferromagnetic correlations. Therefore, CeFePO
appears to be on the non-magnetic side of a ferromagnetic instability.
","[{""version"":""v1"",""created"":""Mon, 21 Apr 2008 09:51:45 GMT""},{""version"":""v2"",""created"":""Fri, 19 Sep 2008 08:46:18 GMT""}]","2008-09-19"
"0804.3251","Sandra Malvezzi","Sandra Malvezzi (for the FOCUS collaboration)","Heavy Flavor decays and light hadrons in the FOCUS experiment: recent
  results","10 pages,6 figures, Invited talk presented at SCADRON 70 (Workshop on
  Scalar Mesons), Lisbon 11-16 Feb 2008","AIPConf.Proc.1030:64-73,2008","10.1063/1.2973554",,"hep-ex","http://arxiv.org/licenses/nonexclusive-distrib/1.0/","  Interpretation of D-meson decay-dynamics has revealed itself to be strongly
dependent on our understanding of the light-meson sector. The interplay becomes
particularly evident in Dalitz plot analyses to study physics within and beyond
the Standard Model. Experience and results from FOCUS are presented and
discussed. A brief update of the pentaquark search in the experiment is also
reported.
","[{""version"":""v1"",""created"":""Mon, 21 Apr 2008 09:43:53 GMT""}]","2019-08-13"
"0804.3252","Gerard Ascensi","Gerard Ascensi, Joaquim Bruna","Poisson type generators for L^1(R)","Submitted to The Journal of Fourier Analysis and Applications",,,,"math.CA math.FA","http://arxiv.org/licenses/nonexclusive-distrib/1.0/","  We characterize the discrete sets L of the real line such that {f(t-l), l in
L} span L^1(R), f being an L^1(R)-function whose Fourier transform behaves like
the one of the Poisson function.
","[{""version"":""v1"",""created"":""Mon, 21 Apr 2008 09:26:59 GMT""}]","2008-04-22"
"0804.3253","Neil Tarrant","N. J. Tarrant, W. J. Chaplin, Y. Elsworth, S. A. Spreckley, I. R.
  Stevens","Oscillations in Beta UMi - Observations with SMEI","5 Pages, 3 Figures; Correction to minor typo in equation 3",,"10.1051/0004-6361:200809738",,"astro-ph","http://arxiv.org/licenses/nonexclusive-distrib/1.0/","  Aims: From observations of the K4III star Beta UMi we attempt to determine
whether oscillations or any other form of variability is present.
  Methods: A high-quality photometric time series of approximately 1000 days in
length obtained from the SMEI instrument on the Coriolis satellite is analysed.
Various statistical tests were performed to determine the significance of
features seen in the power density spectrum of the light curve.
  Results: Two oscillations with frequencies 2.44 and 2.92 microhertz have been
identified. We interpret these oscillations as consecutive overtones of an
acoustic spectrum, implying a large frequency spacing of 0.48 microhertz. Using
derived asteroseismic parameters in combination with known astrophysical
parameters, we estimate the mass of Beta UMi to be 1.3 +/- 0.3 solar masses.
Peaks of the oscillations in the power density spectrum show width, implying
that modes are stochastically excited and damped by convection. The mode
lifetime is estimated at 18 +/- 9 days.
","[{""version"":""v1"",""created"":""Mon, 21 Apr 2008 09:31:59 GMT""},{""version"":""v2"",""created"":""Tue, 22 Apr 2008 09:56:56 GMT""}]","2009-11-13"
