"0802.4432","Marco Brunella","Marco Brunella","Uniformisation of foliations by curves","60 pages, 7 figures",,,,"math.CV math.AG","http://arxiv.org/licenses/nonexclusive-distrib/1.0/","  These are lecture notes for a course to be held. They provide a full
discussion of certain analytic aspects of the uniformisation theory of
(singular) holomorphic foliations by curves on compact Kaehler manifolds, with
emphasis on their consequences on positivity properties of the corresponding
canonical bundles.
","[{""version"":""v1"",""created"":""Fri, 29 Feb 2008 17:16:39 GMT""}]","2008-03-03"
"0802.4433","Anne Pellerin","Anne Pellerin, Martin J. Meyer, Jason Harris, and Daniela Calzetti","The evolution of star clusters: The resolved-star approach","7 pages including 11 figures. Talk given at the meeting on ""Young
  massive star clusters - Initial conditions and environments"", E. Perez, R. de
  Grijs, R. M. Gonzalez Delgado, eds., Granada (Spain), September 2007,
  Springer: Dordrecht","Astrophys.Space Sci.324:247-252,2009","10.1007/s10509-009-0114-7",,"astro-ph","http://arxiv.org/licenses/nonexclusive-distrib/1.0/","  We present the first results of a new technique to detect, locate, and
characterize young dissolving star clusters. Using HST/ACS archival images of
the nearby galaxy IC2574, we performed stellar PSF photometry and selected the
most massive stars as our first test sample. We used a group-finding algorithm
on the selected massive stars to find cluster candidates. We then plot the
color-magnitude diagrams for each group, and use stellar evolutionary models to
estimate their age. So far, we found 79 groups with ages of up to about 100
Myr, displaying various sizes and densities.
","[{""version"":""v1"",""created"":""Fri, 29 Feb 2008 17:17:22 GMT""}]","2009-12-04"
"0802.4434","Diego Dominici","Charles Knessl and Diego Dominici","Asymptotic analysis of a fluid model modulated by an $M/M/1$ queue","37 pages, 5 figures",,,,"math.PR math.CA","http://arxiv.org/licenses/nonexclusive-distrib/1.0/","  We analyze asymptotically a differential-difference equation, that arises in
a Markov-modulated fluid model. We use singular perturbation methods to analyze
the problem with appropriate scalings of the two state variables. In
particular, the ray method and asymptotic matching are used.
","[{""version"":""v1"",""created"":""Fri, 29 Feb 2008 17:25:44 GMT""}]","2008-03-03"
"0802.4435","Nadia Binggeli","G. Trimarchi, I. Leonov, N. Binggeli, Dm. Korotin and V. I. Anisimov","LDA+DMFT implemented with the pseudopotential plane-wave approach","14 pages, 5 figures. Accepted for publication in J. Phys.: Condens.
  Matter",,"10.1088/0953-8984/20/13/135227",,"cond-mat.str-el","http://arxiv.org/licenses/nonexclusive-distrib/1.0/","  We present a joint implementation of dynamical-mean-field theory (DMFT) with
the pseudopotential plane-wave approach, via Wannier functions, for the
determination of the electronic properties of strongly correlated materials.
The scheme uses, as input for the DMFT calculations, a tight-binding
Hamiltonian obtained from the plane-wave calculations by projecting onto
atomic-centered symmetry-constrained Wannier functions for the correlated
orbitals. We apply this scheme to two prototype systems: a paramagnetic
correlated metal, SrVO3, and a paramagnetic correlated system, V2O3, which
exhibits a metal-insulator transition. Comparison with available
Linear-Muffin-Tin-Orbital (LMTO) plus DMFT calculations demonstrate the
suitability of the joint DMFT pseudopotential-plane-wave approach to describe
the electronic properties of strongly correlated materials. This opens the way
to future developments using the pseudopotential-plane-wave DMFT approach to
address also total-energy properties, such as structural properties.
","[{""version"":""v1"",""created"":""Fri, 29 Feb 2008 17:31:05 GMT""}]","2018-08-08"
"0802.4436","Vesko Valov","Eiichi Matsuhashi and Vesko Valov","Krasinkiewicz spaces and parametric Krasinkiewicz maps","14 pages",,,,"math.GN math.GT","http://arxiv.org/licenses/nonexclusive-distrib/1.0/","  We say that a metrizable space $M$ is a Krasinkiewicz space if any map from a
metrizable compactum $X$ into $M$ can be approximated by Krasinkiewicz maps (a
map $g\colon X\to M$ is Krasinkiewicz provided every continuum in $X$ is either
contained in a fiber of $g$ or contains a component of a fiber of $g$). In this
paper we establish the following property of Krasinkiewicz spaces: Let $f\colon
X\to Y$ be a perfect map between metrizable spaces and $M$ a Krasinkiewicz
complete $ANR$-space. If $Y$ is a countable union of closed finite-dimensional
subsets, then the function space $C(X,M)$ with the source limitation topology
contains a dense $G_{\delta}$-subset of maps $g$ such that all restrictions
$g|f^{-1}(y)$, $y\in Y$, are Krasinkiewicz maps. The same conclusion remains
true if $M$ is homeomorphic to a closed convex subset of a Banach space and $X$
is a $C$-space.
","[{""version"":""v1"",""created"":""Fri, 29 Feb 2008 17:31:24 GMT""},{""version"":""v2"",""created"":""Fri, 28 Mar 2008 03:42:59 GMT""}]","2008-03-28"
"0802.4437","Sergei Sergeenkov","Sergei Sergeenkov, Marcel Ausloos","Dislocation induced ac Josephson effect in high-T_c superconductors",,"Phys. Lett. A 206, 383 (1995)","10.1016/0375-9601(95)00612-7",,"cond-mat.supr-con","http://arxiv.org/licenses/nonexclusive-distrib/1.0/","  A possible scenario for an ac Josephson effect initiated by the flow of
dislocations through a mechanically loaded but electrically unbiased
superconductor is proposed. The characteristic voltages due to the motion of
dislocations in loaded (under the applied stress of 10^7N/m^2) YBCO crystals
are estimated to be of the order of a few picovolts (which corresponds to the
Josephson frequency of 10 kHz).
","[{""version"":""v1"",""created"":""Fri, 29 Feb 2008 17:34:15 GMT""}]","2008-03-03"
"0802.4438","Luis Fernando Mello","Jorge Sotomayor, Luis Fernando Mello and Denis de Carvalho Braga","Hopf Bifurcations in a Watt Governor With a Spring","30 pages and 7 figures",,"10.2991/jnmp.2008.15.s3.28",,"math.DS math.CA","http://arxiv.org/licenses/nonexclusive-distrib/1.0/","  This paper pursues the study carried out by the authors in ""Stability and
Hopf bifurcation in a hexagonal governor system"", focusing on the codimension
one Hopf bifurcations in the hexagonal Watt governor differential system. Here
are studied the codimension two, three and four Hopf bifurcations and the
pertinent Lyapunov stability coefficients and bifurcation diagrams, ilustrating
the number, types and positions of bifurcating small amplitude periodic orbits,
are determined. As a consequence it is found an open region in the parameter
space where two attracting periodic orbits coexist with an attracting
equilibrium point.
","[{""version"":""v1"",""created"":""Fri, 29 Feb 2008 18:09:46 GMT""},{""version"":""v2"",""created"":""Tue, 4 Mar 2008 09:57:07 GMT""}]","2015-05-13"
"0802.4439","Paul Woon Yin Lee","Boris Khesin, Paul Lee","Poisson geometry and first integrals of geostrophic equations","6 pages, to appear in Physica D",,"10.1016/j.physd.2008.03.001",,"math.DG math.SG","http://arxiv.org/licenses/nonexclusive-distrib/1.0/","  We describe first integrals of geostrophic equations, which are similar to
the enstrophy invariants of the Euler equation for an ideal incompressible
fluid. We explain the geometry behind this similarity, give several equivalent
definitions of the Poisson structure on the space of smooth densities on a
symplectic manifold, and show how it can be obtained via the Hamiltonian
reduction from a symplectic structure on the diffeomorphism group.
","[{""version"":""v1"",""created"":""Fri, 29 Feb 2008 17:49:08 GMT""}]","2009-11-13"
"0802.4440","Jacques Tempere","J. Tempere, S.N. Klimin, J.T. Devreese, V.V. Moshchalkov","Imbalanced d-wave superfluids in the BCS-BEC crossover regime at finite
  temperatures","22 pages, 7 figures","Phys. Rev. B 77, 134502 (2008).","10.1103/PhysRevB.77.134502",,"cond-mat.supr-con","http://arxiv.org/licenses/nonexclusive-distrib/1.0/","  Singlet pairing in a Fermi superfluid is frustrated when the amounts of
fermions of each pairing partner are unequal. The resulting `imbalanced
superfluid' has been realized experimentally for ultracold atomic gases with
s-wave interactions. Inspired by high-temperature superconductivity, we
investigate the case of d-wave interactions, and find marked differences from
the s-wave superfluid. Whereas s-wave imbalanced Fermi gases tend to phase
separate in real space, in a balanced condensate and an imbalanced normal halo,
we show that the d-wave gas can phase separate in reciprocal space so that
imbalance and superfluidity can coexist spatially. We show that the mechanism
explaining this property is the creation of polarized excitations in the nodes
of the gap. The Sarma mechanism, present only at nonzero temperatures for the
s-wave case, is still applicable in the temperature zero limit for the d-wave
case. As a result, the d-wave BCS superfluid is more robust with respect to
imbalance, and a region of the phase diagram can be identified where the s-wave
BCS superfluidity is suppressed whereas the d-wave superfluidity is not. When
these results are extended into the BEC limit of strongly bound molecules, the
symmetry of the order parameter matters less. The effects of fluctuations
beyond mean field is taken into account in the calculation of the structure
factor and the critical temperature. The poles of the structure factor
(corresponding to bound molecular states) are less damped in the d-wave case as
compared to s-wave. On the BCS side of the unitarity limit, the critical
temperature follows the temperature corresponding to the pair binding energy
and as such will also be more robust against imbalance. Possible routes for the
experimental observation of the d-wave superfluidity have been discussed.
","[{""version"":""v1"",""created"":""Fri, 29 Feb 2008 17:57:59 GMT""}]","2008-07-28"
"0802.4441","Qiang Zhang","Qiang Zhang, Hiroki Takesue, Carsten Langrock, Xiuping Xie, M. M.
  Fejer, Yoshihisa Yamamoto","Hong-Ou-Mandel dip using photon pairs from a PPLN waveguide","5 Pages, 2 figures","Jpn. J. Appl. Phys. 49 (2010) 064401","10.1143/JJAP.49.064401",,"quant-ph","http://arxiv.org/licenses/nonexclusive-distrib/1.0/","  We experimentally observed a Hong-Ou-Mandle dip with photon pairs generated
in a periodically poled reverse-proton-exchange lithium niobate waveguide with
an integrated mode demultiplexer at a wavelength of 1.5 um. The visibility of
the dip in the experiment was 80% without subtraction of any noise terms at a
peak pump power of 4.4 mW. The new technology developed in the experiment can
find various applications in the research field of linear optics quantum
computation in fiber or quantum optical coherence tomography with near infrared
photon pairs.
","[{""version"":""v1"",""created"":""Fri, 29 Feb 2008 18:01:52 GMT""}]","2015-05-13"
"0802.4442","Yaroslav M. Blanter","R. El Boubsi, O. Usmani, and Ya. M. Blanter","Mechanical feedback in the high-frequency limit","10 pages, written for the Focus Issue of New J. Phys. on ""Mechanical
  Systems at the Quantum Limit"", ed. by Markus Aspelmeyer and Keith Schwab",,"10.1088/1367-2630/10/9/095011",,"cond-mat.mes-hall","http://arxiv.org/licenses/nonexclusive-distrib/1.0/","  We investigate strong mechanical feedback for the single-electron tunneling
device coupled to an underdamped harmonic oscillator in the high-frequency
case, when the mechanical energy of the oscillator exceeds the tunnel rate, and
for weak coupling. In the strong feedback regime, the mechanical oscillations
oscillated by the telegraph signal from the SET in their turn modify the
electric current. In contrast to the earlier results for the low frequencies,
the current noise in not enhanced above the Poisson value.
","[{""version"":""v1"",""created"":""Fri, 29 Feb 2008 18:04:20 GMT""}]","2009-11-13"
"0802.4443","Alexander Silenko","Alexander J. Silenko","Classical and Quantum Spins in Curved Spacetimes","Invited lecture presented at the International conference devoted to
  Myron Mathisson: his life, work, and influence on current research. 23 pages","Acta Physica Polonica B Proc. Suppl. 1:87-107,2008",,,"gr-qc","http://arxiv.org/licenses/nonexclusive-distrib/1.0/","  A comparative analysis of the Mathisson-Papapetrou and Pomeransky-Khriplovich
equations is presented. Motion of spinning particles and their spins in
gravitational fields and noninertial frames is considered. The angular velocity
of spin precession defined by the Pomeransky-Khriplovich equations depends on
the choice of the tetrad. The connection of such a dependence with the Thomas
precession is established. General properties of spin interactions with
gravitational fields are discussed. It is shown that dynamics of classical and
quantum spins in curved spacetimes is identical. A manifestation of the
equivalence principle in an evolution of the helicity is analyzed.
","[{""version"":""v1"",""created"":""Fri, 29 Feb 2008 18:08:47 GMT""}]","2008-05-16"
"0802.4444","A. Yu. Petrov","M. Gomes, J. R. Nascimento, A. Yu. Petrov, A. J. da Silva, E. O. Silva","On duality of the noncommutative Maxwell-Chern-Simons theory","8 pages, reference added","Phys.Lett.B666:91-94,2008","10.1016/j.physletb.2008.06.053",,"hep-th","http://arxiv.org/licenses/nonexclusive-distrib/1.0/","  We study the possibility of establishing the dual equivalence between the
noncommutative Maxwell-Chern-Simons theory and the noncommutative self-dual
theory. It turns to be that whereas in the commutative case the
Maxwell-Chern-Simons theory can be mapped into the sum of the self-dual theory
and the Chern-Simons theory, in the noncommutative case such a mapping is
possible only for the theory with the modified Maxwell term.
","[{""version"":""v1"",""created"":""Fri, 29 Feb 2008 18:52:05 GMT""},{""version"":""v2"",""created"":""Wed, 5 Mar 2008 19:46:28 GMT""}]","2008-11-26"
"0802.4445","Vittorio del Duca","V. Del Duca, E.W.N. Glover","Testing high-energy factorization beyond the next-to-leading-logarithmic
  accuracy","13 pages, it uses JHEP3 style; corrected typos; accepted by JHEP","JHEP 0805:056,2008","10.1088/1126-6708/2008/05/056","IPPP/08/13","hep-th","http://arxiv.org/licenses/nonexclusive-distrib/1.0/","  By taking the high-energy limit of the two-loop and the three-loop four-point
amplitudes in the maximally supersymmetric N=4 Yang-Mill theory (MSYM), we test
the validity of the loop expansion of the high-energy amplitude, beyond the
next-to-leading-logarithmic (NLL) accuracy. We compute the three-loop Regge
trajectory, and the two-loop and three-loop coefficient functions. These
quantities are relevant for the BFKL evolution beyond NLL, as well as building
MSYM two-loop and three-loop amplitudes with many legs in the high-energy
limit, which in turn may be used as a powerful check of the evaluation of the
corresponding exact amplitudes.
","[{""version"":""v1"",""created"":""Fri, 29 Feb 2008 18:23:29 GMT""},{""version"":""v2"",""created"":""Tue, 18 Mar 2008 11:13:06 GMT""},{""version"":""v3"",""created"":""Wed, 14 May 2008 13:53:56 GMT""}]","2009-11-19"
"0802.4446","Sharon Toolan","E. Sabbi (2,3,5), J.S. Gallagher (4), L.J. Smith (2,5,6), D.F. de
  Mello (7,8,9), and M. Mountain (2) ((2) Space Telescope Science Institute,
  (3) Universitaet Heidelberg, (4) University of Wisconsin, (5) European Space
  Agency, (6) University College London, (7) Goddard Space Flight Center, (8)
  Catholic University of America, (9) Johns Hopkins University)","Holmberg Ix: The Nearest Young Galaxy","14 pages, 4 figures; ApJL accepted",,"10.1086/587548","STScI Eprint #1793","astro-ph","http://arxiv.org/licenses/nonexclusive-distrib/1.0/","  Deep images taken with the Wide Field Channel of the Advanced Camera for
Surveys on board the Hubble Space Telescope provide the basis for study the
resolved stellar population of the M81 companion dwarf irregular galaxy
Holmberg IX. Based on color-magnitude diagrams the stellar population toward
Holmberg IX contains numerous stars with ages of <~200 Myr as well as older red
giant stars. By charting the spatial distribution of the red giant stars and
considering their inferred metallicities, we concluded that most of these older
stars are associated with M81 or its tidal debris. At least 20% of the stellar
mass in Holmberg IX was produced in the last ~200 Myr, giving it the youngest
stellar populations if any nearby galaxy. The location of Holmberg IX, its high
gas content, and its youthful stellar population suggests that it is a tidal
dwarf galaxy, perhaps formed during the last close passage of M82 around M81.
","[{""version"":""v1"",""created"":""Fri, 29 Feb 2008 18:37:31 GMT""}]","2009-11-13"
"0802.4447","Jack Raymond","Jack Raymond and David Saad","On composite systems of dilute and dense couplings","35 pages, 9 figures, submitted to JPhys A",,"10.1088/1751-8113/41/32/324014",,"cond-mat.dis-nn cond-mat.stat-mech","http://arxiv.org/licenses/nonexclusive-distrib/1.0/","  Composite systems, where couplings are of two types, a combination of strong
dilute and weak dense couplings of Ising spins, are examined through the
replica method. The dilute and dense parts are considered to have independent
canonical disordered or uniform bond distributions; mixing the models by
variation of a parameter $\gamma$ alongside inverse temperature $\beta$ we
analyse the respective thermodynamic solutions. We describe the variation in
high temperature transitions as mixing occurs; in the vicinity of these
transitions we exactly analyse the competing effects of the dense and sparse
models. By using the replica symmetric ansatz and population dynamics we
described the low temperature behaviour of mixed systems.
","[{""version"":""v1"",""created"":""Fri, 29 Feb 2008 19:28:05 GMT""},{""version"":""v2"",""created"":""Tue, 18 Mar 2008 13:01:44 GMT""}]","2009-11-13"
"0802.4448","Sandro Costa","Sandro Silva e Costa","Relations between the modified Chaplygin gas and a scalar field","13 pages, 2 figures",,,,"gr-qc astro-ph","http://arxiv.org/licenses/nonexclusive-distrib/1.0/","  In this work the modified Chaplygin gas is related to a cosmological scalar
field. Analytical results, more general than the solutions previously shown in
the literature, are presented for the case when the curvature is absent, and
one entirely new particular result is shown for a case where there is
curvature. Also, it is emphasized here that one interesting feature of the
scalar field associated to the modified Chaplygin gas is the possible presence
of two minima in its potential. Finally, it is argued that the scalar field
representation of the Chaplygin gas can be another useful tool in the study of
the evolution of perturbations and, as an example of this, a new analytical
result for the density contrast is presented.
","[{""version"":""v1"",""created"":""Fri, 29 Feb 2008 19:00:52 GMT""}]","2008-03-03"
"0802.4449","Alex Bernardini","Alex E. Bernardini, O. Bertolami","Stationary condition in a perturbative approach for mass varying
  neutrinos","11 pages, 5 figures","Phys.Lett.B662:97-101,2008","10.1016/j.physletb.2008.02.066",,"hep-ph","http://arxiv.org/licenses/nonexclusive-distrib/1.0/","  A perturbative approach for arbitrary choices of the equation of state of the
universe is introduced in order to treat scenarios for mass varying neutrinos
(MaVaN's) coupled to the dark sector. The generalized criterion for the
applicability of such an approach is expressed through a constraint on the
coefficient of the linear perturbation on the dark sector scalar field. This
coefficient depends on the ratio between the variation of the neutrino energy
and the scalar field potential. Upon certain conditions, the usual {\em
stationary condition} found in the context of MaVaN models together with the
perturbative contribution can be employed to predict the dynamical evolution of
the neutrino mass. Our results clearly indicate that the positiveness of the
squared speed of sound of the coupled fluid and the model stability are not
conditioned by the {\em stationary condition}.
","[{""version"":""v1"",""created"":""Fri, 29 Feb 2008 19:01:39 GMT""},{""version"":""v2"",""created"":""Sat, 16 Jan 2010 18:59:27 GMT""}]","2014-11-18"
"0802.4450","Tamas Keviczky","Tamas Keviczky, Karl Henrik Johansson","A Study On Distributed Model Predictive Consensus","20 pages, 4 figures, longer version of paper presented at 17th IFAC
  World Congress",,,,"cs.MA","http://arxiv.org/licenses/nonexclusive-distrib/1.0/","  We investigate convergence properties of a proposed distributed model
predictive control (DMPC) scheme, where agents negotiate to compute an optimal
consensus point using an incremental subgradient method based on primal
decomposition as described in Johansson et al. [2006, 2007]. The objective of
the distributed control strategy is to agree upon and achieve an optimal common
output value for a group of agents in the presence of constraints on the agent
dynamics using local predictive controllers. Stability analysis using a
receding horizon implementation of the distributed optimal consensus scheme is
performed. Conditions are given under which convergence can be obtained even if
the negotiations do not reach full consensus.
","[{""version"":""v1"",""created"":""Fri, 29 Feb 2008 19:05:31 GMT""}]","2008-03-03"
"0802.4451","Sophie Morel","Sophie Morel","On the cohomology of certain non-compact Shimura varieties (with an
  appendix by Robert Kottwitz)","242 pages, final version; appeared as Annals of Mathematics Studies
  173 (2010)",,,,"math.AG math.NT","http://arxiv.org/licenses/nonexclusive-distrib/1.0/","  The goal of this paper is to calculate the trace of the composition of a
Hecke correspondence and a (high enough) power of the Frobenius at a good place
on the intersection cohomology of the Satake-Baily-Borel compactification of
certain Shimura varieties, to stabilize the result for Shimura varieties
associated to unitary groups over $\mathbb{Q}$ and to give applications of this
calculations using base change from these unitary groups to $GL_n$.
  -----
  Le but de ce texte est de calculer la trace d'une correspondance de Hecke
composee avec une puissance (assez grande) du Frobenius en une bonne place sur
la cohomologie d'intersection de la compactification de Satake-Baily-Borel de
certaines varietes de Shimura, de stabiliser le resultat obtenu pour les
varietes de Shimura associees aux groupes unitaires sur $\mathbb{Q}$, et de
donner des applications de ces calculs en utilisant le changement de base de
ces groupes unitaires a $GL_n$.
","[{""version"":""v1"",""created"":""Fri, 29 Feb 2008 19:06:02 GMT""},{""version"":""v2"",""created"":""Tue, 26 Jun 2018 09:09:32 GMT""}]","2018-06-27"
"0802.4452","Roberto Aloisio","R. Aloisio, V. Berezinsky, S. Grigorieva","Analytic calculations of the spectra of ultra-high energy cosmic ray
  nuclei. I. The case of CMB radiation","The paper is the first part of a two papers series, it is composed by
  41 pages, 4 appendixes and 27 eps figures, version accepted for publication
  in Astroparticle Physics","Astropart.Phys. 41 (2013) 73-93","10.1016/j.astropartphys.2012.07.010",,"astro-ph astro-ph.CO astro-ph.HE","http://arxiv.org/licenses/nonexclusive-distrib/1.0/","  We present a systematic study of different methods for the analytic
calculation of ultra-high energy nuclei diffuse spectra. Nuclei propagating in
the intergalactic space are photo-disintegrated and decrease their Lorentz
factor due to the interaction with cosmic microwave background and
extragalactic background light. We calculate the evolution trajectories in the
backward time, that describe how atomic mass number $A$ and Lorentz factor
$\Gamma$ change with redshift $z$. Three methods of spectra calculations are
investigated and compared: {\it (i)} trajectory method, {\it(ii)} kinetic
equation combined with trajectory calculations and {\it (iii)} coupled kinetic
equations. We believe that these three methods exhaust at least the principal
possibilities for any analytic solution of the problem. In the most
straightforward method {\it(i)} only trajectory calculations are used to
connect the observed nuclei flux with the production rate of primary
(accelerated) nuclei $A_0$. In the second method {\it (ii)} the flux (space
density) of primary nuclei, and secondary nuclei and protons are calculated
with the help of kinetic equation and trajectories are used only to determine
the generation rates of these nuclei. The third method {\it (iii)} consists in
solving the complete set of coupled kinetic equations, written starting with
primary nuclei $A_0$, then for $A_0-1$ etc down to the $A$ of interest. The
solution of the preceding equation gives the generation rate for the one which
follows. An important element of the calculations for all methods is the
systematic use of Lorentz factor instead of energy. We consider here the
interaction of nuclei only with the cosmic microwave background, this case is
particularly suitable for understanding the physical results.
","[{""version"":""v1"",""created"":""Fri, 29 Feb 2008 19:41:44 GMT""},{""version"":""v2"",""created"":""Wed, 26 Mar 2008 12:59:51 GMT""},{""version"":""v3"",""created"":""Sat, 12 Jun 2010 18:59:49 GMT""},{""version"":""v4"",""created"":""Sat, 28 Jul 2012 18:58:29 GMT""}]","2013-06-04"
