"0802.4453","Nikodem Poplawski","Nikodem J. Poplawski","Geometrical formulation of classical electromagnetism","5 pages, REVTeX4",,,,"gr-qc math-ph math.MP","http://arxiv.org/licenses/nonexclusive-distrib/1.0/","  A general affine connection has enough degrees of freedom to describe the
classical gravitational and electromagnetic fields in the metric-affine
formulation of gravity. The gravitational field is represented in the
Lagrangian by the symmetric part of the Ricci tensor, while the classical
electromagnetic field is represented geometrically by the tensor of homothetic
curvature. We introduce matter as the four-velocity field subject to the
kinematical constraint in which the Lagrange multiplier represents the energy
density. A coupling between the four-velocity and the trace of the nonmetricity
tensor represents the electric charge density. We show that the simplest
metric-affine Lagrangian that depends on the Ricci tensor and the tensor of
homothetic curvature generates the Einstein-Maxwell field equations, while the
Bianchi identity gives the Lorentz equation of motion. If the four-velocity
couples to the torsion vector, the Einstein equations are modified by a term
that is significant at the Planck scale and may prevent the formation of
spacetime singularities.
","[{""version"":""v1"",""created"":""Fri, 29 Feb 2008 19:20:41 GMT""}]","2008-03-03"
"0802.4454","Leonidas Mouchliadis","L. Mouchliadis and A. L. Ivanov","First-order spatial coherence of excitons in planar nanostructures: a
  k-filtering effect",,,"10.1103/PhysRevB.78.033306",,"cond-mat.mes-hall","http://arxiv.org/licenses/nonexclusive-distrib/1.0/","  We propose and analyze a k-filtering effect which gives rise to the drastic
difference between the actual spatial coherence length of quasi-two-dimensional
(quasi-2D) excitons or microcavity (MC) polaritons in planar nanostructures and
that inferred from far-field optical measurements. The effect originates from
the conservation of in-plane wavevector k in the optical decay of the particles
in outgoing bulk photons. The k-filtering effect explains the large coherence
lengths recently observed for indirect excitons in coupled quantum wells (QWs),
but is less pronounced for MC polaritons at low temperatures, T<10K.
","[{""version"":""v1"",""created"":""Fri, 29 Feb 2008 19:27:07 GMT""},{""version"":""v2"",""created"":""Tue, 4 Mar 2008 17:18:55 GMT""}]","2009-11-13"
"0802.4455","Thomas Gilbert","Pierre Gaspard and Thomas Gilbert","Heat conduction and Fourier's law in a class of many particle dispersing
  billiards","fixed figs. 12 & 13. Version to appear in New J. Phys","New J. Phys. 10 (2008) 103004","10.1088/1367-2630/10/10/103004",,"nlin.CD cond-mat.stat-mech","http://arxiv.org/licenses/nonexclusive-distrib/1.0/","  We consider the motion of many confined billiard balls in interaction and
discuss their transport and chaotic properties. In spite of the absence of mass
transport, due to confinement, energy transport can take place through binary
collisions between neighbouring particles. We explore the conditions under
which relaxation to local equilibrium occurs on time scales much shorter than
that of binary collisions, which characterize the transport of energy, and
subsequent relaxation to local thermal equilibrium. Starting from the
pseudo-Liouville equation for the time evolution of phase-space distributions,
we derive a master equation which governs the energy exchange between the
system constituents. We thus obtain analytical results relating the transport
coefficient of thermal conductivity to the frequency of collision events and
compute these quantities. We also provide estimates of the Lyapunov exponents
and Kolmogorov-Sinai entropy under the assumption of scale separation. The
validity of our results is confirmed by extensive numerical studies.
","[{""version"":""v1"",""created"":""Fri, 29 Feb 2008 19:27:28 GMT""},{""version"":""v2"",""created"":""Tue, 10 Jun 2008 19:04:21 GMT""},{""version"":""v3"",""created"":""Sat, 30 Aug 2008 12:03:17 GMT""}]","2009-08-29"
"0802.4456","Lawrence Friedman","Chandan Kumar and Lawrence H. Friedman","Effects of elastic heterogeneity and anisotropy on the morphology of
  self-assembled epitaxial quantum dots","11 pages, 7 figures, 1 table, submitted for review","J. Appl. Phys. 104, 034902 (2008)","10.1063/1.2960560",,"cond-mat.mtrl-sci cond-mat.stat-mech","http://arxiv.org/licenses/nonexclusive-distrib/1.0/","  Epitaxial self-assembled quantum dots (SAQDs) are of both technological and
fundamental interest, but their reliable manufacture still presents a technical
challenge. To better understand the formation, morphology and ordering of
epitaxial self-assembled quantum dots (SAQDs), it is essential to have an
accurate model that can aid further experiments and predict the trends in SAQD
formation. SAQDs form because of the destabilizing effect of elastic mismatch
strain, but most analytic models and some numerical models of SAQD formation
either assume an elastically homogeneous anisotropic film-substrate system or
assume an elastically heterogeneous isotropic system. In this work, we perform
the full film-substrate elastic calculation. Then we incorporate the elasticity
calculation into a stochastic linear growth model. We find that using
homogeneous elasticity can cause errors in the elastic energy density as large
as 26%, and for typical modeling parameters lead to errors of about 11% in the
estimated value of average dot spacing. We also quantify the effect of elastic
heterogeneity on the order estimates of SAQDs and confirm previous finding on
the possibility of order enhancement by growing a film near the critical film
height.
","[{""version"":""v1"",""created"":""Fri, 29 Feb 2008 19:35:43 GMT""}]","2008-08-21"
"0802.4457","Jiansong Gao","Jiansong Gao, Miguel Daal, Peter Day, Benjamin Mazin, Henry LeDuc,
  Anastasios Vayonakis, Shwetank Kumar, Bernard Sadoulet, Jonas Zmuidzinas","Experimental evidence for a surface distribution of two-level systems in
  superconducting lithographed microwave resonators","3 figures, submitted to APL",,"10.1063/1.2906373",,"cond-mat.supr-con","http://arxiv.org/licenses/nonexclusive-distrib/1.0/","  We present measurements of the temperature-dependent frequency shift of five
niobium superconducting coplanar waveguide microresonators with center strip
widths ranging from 3 $\mu$m to 50 $\mu$m, taken at temperatures in the range
100-800 mK, far below the 9.2 K transition temperature of niobium. These data
agree well with the two-level system (TLS) theory. Fits to this theory provide
information on the number of TLS that interact with each resonator geometry.
The geometrical scaling indicates a surface distribution of TLS, and the data
are consistent with a TLS surface layer thickness of order a few nm, as might
be expected for a native oxide layer.
","[{""version"":""v1"",""created"":""Fri, 29 Feb 2008 19:32:49 GMT""},{""version"":""v2"",""created"":""Fri, 14 Mar 2008 23:04:50 GMT""}]","2009-11-13"
"0802.4459","Francesco Cellarosi","Francesco Cellarosi","Renewal-type Limit Theorem for Continued Fractions with Even Partial
  Quotients","27 pages, 3 figures, some typos corrected, section 2 expanded, final
  version to appear in ""Ergodic Theory and Dynamical Systems""",,,,"math.DS","http://arxiv.org/licenses/nonexclusive-distrib/1.0/","  We prove the existence of the limiting distribution for the sequence of
denominators generated by continued fraction expansions with even partial
quotients, which were introduced by F. Schweiger and studied also by C.
Kraaikamp and A. Lopes. Our main result is proven following the strategy used
by Ya. Sinai and C. Ulcigrai in their proof of a similar renewal-type theorem
for Euclidean continued fraction expansions and the Gauss map. The main steps
in our proof are the construction of a natural extension of a Gauss-like map
and the proof of mixing of a related special flow.
","[{""version"":""v1"",""created"":""Fri, 29 Feb 2008 20:05:50 GMT""},{""version"":""v2"",""created"":""Tue, 5 Aug 2008 15:15:46 GMT""}]","2008-08-05"
"0802.4460","Yuri A. Kuperin","Yu.A Kuperin, R.R. Schastlivtsev","Modified Holder Exponents Approach to Prediction of the USA Stock Market
  Critical Points and Crashes","15 pages, 9 figures",,,,"q-fin.ST physics.soc-ph","http://arxiv.org/licenses/nonexclusive-distrib/1.0/","  The paper is devoted to elaboration of a novel specific indicator based on
the modified Holder exponents. This indicator has been used for forecasting
critical points of financial time series and crashes of the USA stock market.
The proposed approach is based on the hypothesis, which claims that before
market critical points occur the dynamics of financial time series radically
changes, namely time series become smoother. The approach has been tested on
the stylized data and real USA stock market data. It has been shown that it is
possible to forecast such critical points of financial time series as large
upward and downward movements and trend changes. On this basis a new trading
strategy has been elaborated and tested.
","[{""version"":""v1"",""created"":""Fri, 29 Feb 2008 20:13:56 GMT""}]","2008-12-10"
"0802.4461","Allen Shafter","A. W. Shafter, J. R. A. Davenport, T. G\""uth, S. Kattner, E. Marin, N.
  Sreenivasamurthy","Time-Resolved Photometry of the Optical Counterpart of Swift
  J2319.4+2619","15 pages, 5 figures, Accepted for publication in the April 2008 PASP",,"10.1086/588268",,"astro-ph","http://arxiv.org/licenses/nonexclusive-distrib/1.0/","  Time-resolved CCD photometry is presented of the V~17 optical counterpart of
the newly-discovered, hard-X-ray-emitting polar Swift J2619.4+2619. A total of
~20 hr of data obtained over five nights in various bandpasses (B, V, R, and I)
reveals a strong quasi-sinusoidal modulation in the light curve at a
best-fitting period of 0.1254 d (3.01 hr), which we associate with the orbital
period of the system (one-day aliases of this period at 0.1114 d and 0.1435 d
are considered, but appear to be ruled out by our analysis). The amplitude of
the modulation increases with wavelength from ~0.8 mag in B to ~1.1 mag in R
and I. The increase in amplitude with wavelength is typical of polar systems
where the modulated radiation comes from cyclotron emission. The combination of
the relatively long orbital period and the emission of hard X-rays suggest that
Swift J2619.4+2619 may be a good candidate for an asynchronous polar system.
","[{""version"":""v1"",""created"":""Fri, 29 Feb 2008 20:19:18 GMT""}]","2009-11-13"
"0802.4462","Martin Sahl\'en","Martin Sahl\'en, Pedro T. P. Viana, Andrew R. Liddle, A. Kathy Romer,
  Michael Davidson, Mark Hosmer, Ed Lloyd-Davies, Kivanc Sabirli, Chris A.
  Collins, Peter E. Freeman, Matt Hilton, Ben Hoyle, Scott T. Kay, Robert G.
  Mann, Nicola Mehrtens, Christopher J. Miller, Robert C. Nichol, S. Adam
  Stanford and Michael J. West (for the XCS Collaboration)","The XMM Cluster Survey: Forecasting cosmological and cluster
  scaling-relation parameter constraints","28 pages, 17 figures. Revised version, as accepted for publication in
  MNRAS. High-resolution figures available at http://xcs-home.org (under
  ""Publications"")","Mon.Not.Roy.Astron.Soc.397:577,2009","10.1111/j.1365-2966.2009.14923.x",,"astro-ph","http://arxiv.org/licenses/nonexclusive-distrib/1.0/","  We forecast the constraints on the values of sigma_8, Omega_m, and cluster
scaling relation parameters which we expect to obtain from the XMM Cluster
Survey (XCS). We assume a flat Lambda-CDM Universe and perform a Monte Carlo
Markov Chain analysis of the evolution of the number density of galaxy clusters
that takes into account a detailed simulated selection function. Comparing our
current observed number of clusters shows good agreement with predictions. We
determine the expected degradation of the constraints as a result of
self-calibrating the luminosity-temperature relation (with scatter), including
temperature measurement errors, and relying on photometric methods for the
estimation of galaxy cluster redshifts. We examine the effects of systematic
errors in scaling relation and measurement error assumptions. Using only (T,z)
self-calibration, we expect to measure Omega_m to +-0.03 (and Omega_Lambda to
the same accuracy assuming flatness), and sigma_8 to +-0.05, also constraining
the normalization and slope of the luminosity-temperature relation to +-6 and
+-13 per cent (at 1sigma) respectively in the process. Self-calibration fails
to jointly constrain the scatter and redshift evolution of the
luminosity-temperature relation significantly. Additional archival and/or
follow-up data will improve on this. We do not expect measurement errors or
imperfect knowledge of their distribution to degrade constraints significantly.
Scaling-relation systematics can easily lead to cosmological constraints 2sigma
or more away from the fiducial model. Our treatment is the first exact
treatment to this level of detail, and introduces a new `smoothed ML' estimate
of expected constraints.
","[{""version"":""v1"",""created"":""Fri, 29 Feb 2008 20:58:35 GMT""},{""version"":""v2"",""created"":""Sun, 26 Apr 2009 13:32:18 GMT""}]","2019-08-13"
"0802.4463","Joanne Dawson","J. R. Dawson, N. Mizuno, T. Onishi, N. M. McClure-Griffiths and Y.
  Fukui","The ""Carina Flare"" Supershell: Probing the Atomic and Molecular ISM in a
  Galactic Chimney","16 pages, 8 figures, to appear in MNRAS (accepted 25th February
  2008). Version with high resolution images available from:
  http://a.phys.nagoya-u.ac.jp/~joanne/dawson_et_al_2008.pdf. Corrected typo in
  author list","Mon.Not.Roy.Astron.Soc 387 (2008) 31-44","10.1111/j.1365-2966.2008.13152.x",,"astro-ph","http://arxiv.org/licenses/nonexclusive-distrib/1.0/","  The ""Carina Flare"" supershell, GSH 287+04-17, is a molecular supershell
originally discovered in 12CO(J=1-0) with the NANTEN 4m telescope. We present
the first study of the shell's atomic ISM, using HI 21 cm line data from the
Parkes 64m telescope Southern Galactic Plane Survey. The data reveal a gently
expanding, ~ 230 x 360 pc HI supershell that shows strong evidence of Galactic
Plane blowout, with a break in its main body at z ~ 280 pc and a capped
high-latitude extension reaching z ~ 450 pc. The molecular clouds form
co-moving parts of the atomic shell, and the morphology of the two phases
reflects the supershell's influence on the structure of the ISM. We also report
the first discovery of an ionised component of the supershell, in the form of
delicate, streamer-like filaments aligned with the proposed direction of
blowout. The distance estimate to the shell is re-examined, and we find strong
evidence to support the original suggestion that it is located in the Carina
Arm at a distance of 2.6 +- 0.4 kpc. Associated HI and H2 masses are estimated
as M(HI) ~ 7 +- 3 x 10^5 Msol and M(H2) ~ 2.0 +- 0.6 x 10^5 Msol, and the
kinetic energy of the expanding shell as E ~ 1 x 10^51 erg. We examine the
results of analytical and numerical models to estimate a required formation
energy of several 10^51 to ~ 10^52 erg, and an age of ~ 10^7 yr. This age is
compatible with molecular cloud formation time-scales, and we briefly consider
the viability of a supershell-triggered origin for the molecular component.
","[{""version"":""v1"",""created"":""Fri, 29 Feb 2008 20:23:03 GMT""},{""version"":""v2"",""created"":""Mon, 14 Apr 2008 03:16:34 GMT""}]","2008-08-27"
"0803.0001","Jose Kenichi Mizukoshi","R.H.K. Kadala, P.G. Mercadante, J.K. Mizukoshi, Xerxes Tata","Heavy-flavour tagging and the supersymmetry reach of the CERN Large
  Hadron Collider","Minor changes in the text, with addition and update of the
  references. To be published in the European Physical Journal C","Eur.Phys.J.C56:511-528,2008","10.1140/epjc/s10052-008-0672-9",,"hep-ph","http://arxiv.org/licenses/nonexclusive-distrib/1.0/","  The branching fraction for the decays of gluinos to third generation quarks
is expected to be enhanced in classes of supersymmetric models where either
third generation squarks are lighter than other squarks, or in mixed-higgsino
dark matter models constructed to be in concordance with the measured density
of cold dark matter. In such scenarios, gluino production events at the CERN
Large Hadron Collider should be rich in top and bottom quark jets. Requiring
b-jets in addition to missing transverse energy should, therefore, enhance the
supersymmetry signal relative to Standard Model backgrounds from V + jet, VV
and QCD backgrounds (V=W, Z). We quantify the increase in the supersymmetry
reach of the LHC from b-tagging in a variety of well-motivated models of
supersymmetry. We also explore ``top-tagging'' at the LHC. We find that while
the efficiency for this turns out to be too low to give an increase in reach
beyond that obtained via b-tagging, top-tagging can indeed provide a
confirmatory signal if gluinos are not too heavy. Finally, we explore the
prospects for detecting the direct production of third generation squarks in
models with an inverted squark mass hierarchy. This is signalled by b-jets +
missing transverse energy events harder than in the Standard Model, but softer
than those from the production of gluinos and heavier squarks. We find that
while these events can be readily separated from SM background (for third
generation squark masses ~300-500 GeV), the contamination from the much heavier
gluinos and squarks remains formidable if these are also accessible.
","[{""version"":""v1"",""created"":""Fri, 29 Feb 2008 21:00:21 GMT""},{""version"":""v2"",""created"":""Wed, 6 Aug 2008 21:25:11 GMT""}]","2008-11-26"
"0803.0002","Eugene Vasiliev","Eugene Vasiliev, Maxim Zelnikov","Dark matter dynamics in Galactic center","10 pages, 5 figs","Phys.Rev.D78:083506,2008","10.1103/PhysRevD.78.083506",,"astro-ph","http://arxiv.org/licenses/nonexclusive-distrib/1.0/","  The evolution of dark matter in central areas of galaxies is considered (the
Milky Way is taken as an example). It is driven by scattering off of dark
matter particles by bulge stars, their absorption by the supermassive black
hole and self-annihilation. This process is described by diffusion equation in
the phase space of energy and angular momentum. The equation was integrated for
several different models of initial dark matter distribution and using various
assumptions about the dynamical factors. It turns out that because the Milky
Way center is rather dynamically old (~5 relaxation times t_r), the difference
in initial conditions almost vanishes. The density attains a nearly universal
profile, and the gamma-ray flux from dark matter annihilation lies in rather
narrow range, which enables more robust determination of the dark matter
parameters. By present time the mass of dark matter inside the black hole
sphere of influence (r<2 pc) has been reduced approximately twice, mostly
because of heating by stars. It is shown that the dynamics of dark matter for
t>t_r is determined mainly by stars outside the sphere of influence.
","[{""version"":""v1"",""created"":""Fri, 29 Feb 2008 21:00:21 GMT""},{""version"":""v2"",""created"":""Thu, 9 Oct 2008 06:57:33 GMT""}]","2008-11-26"
"0803.0004","Luigi Bedin Rolly","R. K. S. Yadav (1), L. R. Bedin (2), G. Piotto (1), J. Anderson (2),
  S. Cassisi (3), S. Villanova (4), I. Platais (5), L. Pasquini (6), Y. Momany
  (7), R. Sagar (8) ((1) Univ. Padova, (2) STScI, (3) INAF-Obs. Teramo, (4)
  Univ. Concepcion, (5) JHU, (6) ESO Garching, (7) INAF-Obs. Padova, (8) AIRES)","Ground-based CCD astrometry with wide field imagers. II. A star
  catalogue for M67: WFI@2.2m MPG/ESO astrometry, FLAMES@VLT radial velocities","15 pages, 11 figures, 5 table. Accepted (2008 February 25) on A&A",,"10.1051/0004-6361:20079245",,"astro-ph","http://arxiv.org/licenses/nonexclusive-distrib/1.0/","  The solar-age open cluster M67 (C0847+120, NGC2682) is a touchstone in
studies of the old Galactic disk. Despite its outstanding role, the census of
cluster membership for M67 at fainter magnitudes and their properties are not
well-established. Using the proprietary and archival ESO data, we have obtained
astrometric, photometric, and radial velocities of stars in a 34'x 33' field
centered on the old open cluster M67. The two-epoch archival observations
separated by 4 years and acquired with the Wide Field Imager at the 2.2m
MPG/ESO telescope have been reduced with our new astrometric techniques, as
described in the first paper of this series. The same observations served to
derive calibrated BVI photometry in M67. Radial velocities were measured using
the archival and new spectroscopic data obtained at VLT. We have determined
relative proper motions and membership probabilities for ~2,400 stars. The
precision of proper motions for optimally exposed stars is ~2 mas/yr, gradually
degrading down to ~5 mas/yr at V= 20. Our relatively precise proper motions at
V>16 are first obtained in this magnitude range for M67. Radial velocities are
measured for 211 stars in the same field. We also present a detailed comparison
with recent theoretical isochrones from several independent groups. For M67
area we provide positions, calibrated BVI photometry, relative proper motions,
membership probabilities, and radial velocities. We demonstrate that the
ground-based CCD mosaic observations just a few years apart are producing
proper motions, allowing a reliable membership determination. We produced a
catalogue that is made electronically available to the astronomical community.
","[{""version"":""v1"",""created"":""Fri, 29 Feb 2008 21:06:06 GMT""}]","2009-11-13"
"0803.0005","Saul Davis","D.S. Davis, H.B.Richer, J. Anderson, J.P. Brewer, J. Hurley, J.S.
  Kalirai, R.M. Rich, P.B. Stetson","The binary fraction in the globular cluster NGC 6397","19 pages, 7 figures, accepted in AJ",,"10.1088/0004-6256/135/6/2155",,"astro-ph","http://arxiv.org/licenses/nonexclusive-distrib/1.0/","  Using Hubble Space Telescope (HST) observations of the globular cluster
NGC6397, we constrain the cluster's binary fraction. The observations consist
of two fields: the primary science field, a single ACS pointing centered
approximately 5' from the cluster center; and the parallel field, a single
WFPC2 field centered on the cluster center. Using the exquisite photometric
precision of these observations, we determine the binary fraction in these
regions of the cluster by examining stars lying off the main sequence. The
binary fraction is constrained to be 0.012 +/- 0.004 in the ACS field, and to
be 0.051 +/- 0.010 in the WFPC field. N-body simulations by Hurley et al.
(2007) suggest that the binary fraction remains nearly constant beyond the
half-mass radius for the lifetime of the cluster. In the context of these
simulations, our results suggest that NGC 6397 had a primordial binary fraction
of only ~1%.
","[{""version"":""v1"",""created"":""Fri, 29 Feb 2008 21:06:30 GMT""},{""version"":""v2"",""created"":""Tue, 4 Mar 2008 18:39:03 GMT""}]","2015-05-13"
"0803.0006","Edward Lee","Edward Lee","Update on Modular Non-Rigid Calabi-Yau Threefolds","Accepted for publication in Proceedings of the BIRS Workshop on
  Modular Forms and String Duality",,,,"math.AG math.NT","http://arxiv.org/licenses/nonexclusive-distrib/1.0/","  We review some recent results on the modularity of non-rigid Calabi-Yau
threefolds.
","[{""version"":""v1"",""created"":""Fri, 29 Feb 2008 21:10:05 GMT""}]","2008-03-04"
"0803.0007","Aderaldo Araujo I. L.","Gilberto Corso, Aderaldo I. L. Araujo, Adriana M. Almeida","A new nestedness estimator in community networks","16 pages, 8 figures, 1 table",,,,"physics.bio-ph physics.soc-ph q-bio.PE","http://arxiv.org/licenses/nonexclusive-distrib/1.0/","  A recent problem in community ecology lies in defining structures behind
matrices of species interactions. The interest in this area is to quantify the
nestedness degree of the matrix after its maximal packing. In this work we
evaluate nestedness using the sum of all distances of the occupied sites to the
vertex of the matrix. We calculate the distance for two artificial matrices
with the same size and occupancy: a random matrix and a perfect nested one.
Using these two benchmarks we develop a nestedness estimator. The estimator is
applied to a set of 23 real networks of insect-plant interactions.
","[{""version"":""v1"",""created"":""Fri, 29 Feb 2008 21:17:30 GMT""}]","2008-03-04"
"0803.0008","Kevin Carlin","Kevin J. Carlin","Derived Functors Related to Wall Crossing","14 pages, revised and expanded, accepted by Communications in Algebra",,,,"math.RT","http://arxiv.org/licenses/nonexclusive-distrib/1.0/","  The setting is the representation theory of a simply connected, semisimple
algebraic group over a field of positive characteristic. There is a natural
transformation from the wall-crossing functor to the identity functor. The
kernel of this transformation is a left exact functor. This functor and its
first derived functor are evaluated on the global sections of a line bundle on
the flag variety. It is conjectured that the derived functors of order greater
than one annihilate the global sections. Also, the principal indecomposable
modules for the Frobenius subgroups are shown to be acyclic.
","[{""version"":""v1"",""created"":""Fri, 29 Feb 2008 21:32:25 GMT""},{""version"":""v2"",""created"":""Tue, 9 Feb 2010 16:08:30 GMT""}]","2010-02-09"
