"0802.4332","Pascu Catalin Moca","A. I. Toth, C. P. Moca, O. Legeza, G. Zarand","Density matrix numerical renormalization group for non-Abelian
  symmetries","12 pages, 6 figures, PRB format","Phys. Rev. B 78, 245109 (2008)","10.1103/PhysRevB.78.245109",,"cond-mat.mes-hall","http://arxiv.org/licenses/nonexclusive-distrib/1.0/","  We generalize the spectral sum rule preserving density matrix numerical
renormalization group (DM-NRG) method in such a way that it can make use of an
arbitrary number of not necessarily Abelian, local symmetries present in the
quantum impurity system. We illustrate the benefits of using non-Abelian
symmetries by the example of calculations for the T-matrix of the two-channel
Kondo model in the presence of magnetic field, for which conventional NRG
methods produce large errors and/or take a long run-time.
","[{""version"":""v1"",""created"":""Fri, 29 Feb 2008 19:53:14 GMT""}]","2009-11-13"
"0802.4344","Luca Sanguinetti","Luca Sanguinetti, Michele Morelli and H. Vincent Poor","An Improved Scheme for Initial Ranging in OFDMA-based Networks","6 pages, 3 figures, To appear in the Proceedings of the 2008 IEEE
  International Conference on Communications, Beijing, May 19 - 23, 2008",,"10.1109/ICC.2008.652",,"cs.IT cs.OH math.IT","http://arxiv.org/licenses/nonexclusive-distrib/1.0/","  An efficient scheme for initial ranging has recently been proposed by X. Fu
et al. in the context of orthogonal frequency-division multiple-access (OFDMA)
networks based on the IEEE 802.16e-2005 standard. The proposed solution aims at
estimating the power levels and timing offsets of the ranging subscriber
stations (RSSs) without taking into account the effect of possible carrier
frequency offsets (CFOs) between the received signals and the base station
local reference. Motivated by the above problem, in the present work we design
a novel ranging scheme for OFDMA in which the ranging signals are assumed to be
misaligned both in time and frequency. Our goal is to estimate the timing
errors and CFOs of each active RSS. Specifically, CFO estimation is
accomplished by resorting to subspacebased methods while a least-squares
approach is employed for timing recovery. Computer simulations are used to
assess the effectiveness of the proposed solution and to make comparisons with
existing alternatives.
","[{""version"":""v1"",""created"":""Fri, 29 Feb 2008 20:09:34 GMT""}]","2016-11-17"
"0802.4354","Juan Bueno-Sanchez","Juan Carlos Bueno Sanchez, Mar Bastero-Gil, Arjun Berera, and
  Konstantinos Dimopoulos","Warm hilltop inflation","9 pages, 2 figures","Phys.Rev.D77:123527,2008","10.1103/PhysRevD.77.123527",,"hep-ph astro-ph gr-qc hep-th","http://arxiv.org/licenses/nonexclusive-distrib/1.0/","  We study the low-temperature limit of warm inflation in a hilltop model. This
limit remains valid up to the end of inflation, allowing an analytic
description of the entire inflationary stage. In the weak dissipative regime,
if the kinetic density of the inflaton dominates after inflation, low scale
inflation is attained with Hubble scale as low as 1 GeV. In the strong
dissipative regime, the model satisfies the observational requirements for the
spectral index with a mild tuning of the model parameters, while also
overcoming the $\eta$-problem of inflation. However, there is some danger of
gravitino overproduction unless the particle content of the theory is large.
","[{""version"":""v1"",""created"":""Fri, 29 Feb 2008 20:35:17 GMT""}]","2008-11-26"
"0802.4384","Georg Anetsberger","G. Anetsberger, R. Rivi\`ere, A. Schliesser, O. Arcizet, T. J.
  Kippenberg","Demonstration of Ultra Low Dissipation Optomechanical Resonators on a
  Chip","9 pages, 5 figures",,,,"quant-ph","http://arxiv.org/licenses/nonexclusive-distrib/1.0/","  Cavity-enhanced radiation-pressure coupling of optical and mechanical degrees
of freedom gives rise to a range of optomechanical phenomena, in particular
providing a route to the quantum regime of mesoscopic mechanical oscillators. A
prime challenge in cavity optomechanics has however been to realize systems
which simultaneously maximize optical finesse and mechanical quality. Here we
demonstrate for the first time independent control over both mechanical and
optical degree of freedom within one and the same on-chip resonator. The first
direct observation of mechanical normal mode coupling in a micromechanical
system allows for a quantitative understanding of mechanical dissipation.
Subsequent optimization of the resonator geometry enables intrinsic material
loss limited mechanical Q-factors, rivalling the best values reported in the
high MHz frequency range, while simultaneously preserving the resonators'
ultra-high optical finesse. Besides manifesting a complete understanding of
mechanical dissipation in microresonator based optomechanical systems, our
results provide an ideal setting for cavity optomechanics.
","[{""version"":""v1"",""created"":""Fri, 29 Feb 2008 16:14:56 GMT""},{""version"":""v2"",""created"":""Fri, 18 Jul 2008 12:17:21 GMT""}]","2008-07-18"
"0802.4395","Gianluca Calcagni","Gianluca Calcagni, Giuseppe Nardelli","Nonlocal instantons and solitons in string models","12 pages","Phys.Lett.B669:102-112,2008","10.1016/j.physletb.2008.09.016",,"hep-th gr-qc math-ph math.MP","http://arxiv.org/licenses/nonexclusive-distrib/1.0/","  We study a class of nonlocal systems which can be described by a local scalar
field diffusing in an auxiliary radial dimension. As examples p-adic, open and
boundary string field theory are considered on Minkowski,
Friedmann-Robertson-Walker and Euclidean metric backgrounds. Starting from
distribution-like initial field configurations which are constant almost
everywhere, we construct exact and approximate nonlocal solutions. The
Euclidean p-adic lump is interpreted as a solitonic brane, and the Euclidean
kink of supersymmetric open string field theory as an instanton. Some relations
between solutions of different string theories are highlighted also thanks to a
reformulation of nonlocal systems as fixed points in a renormalization group
flow.
","[{""version"":""v1"",""created"":""Fri, 29 Feb 2008 20:47:36 GMT""},{""version"":""v2"",""created"":""Thu, 2 Oct 2008 14:22:58 GMT""}]","2009-02-12"
"0802.4412","Matthew Macauley","Matthew Macauley and Henning S. Mortveit","Cycle Equivalence of Graph Dynamical Systems",,"Nonlinearity 22 (2009) 421-436.","10.1088/0951-7715/22/2/010",,"math.DS math.CO","http://arxiv.org/licenses/nonexclusive-distrib/1.0/","  Graph dynamical systems (GDSs) can be used to describe a wide range of
distributed, nonlinear phenomena. In this paper we characterize cycle
equivalence of a class of finite GDSs called sequential dynamical systems SDSs.
In general, two finite GDSs are cycle equivalent if their periodic orbits are
isomorphic as directed graphs. Sequential dynamical systems may be thought of
as generalized cellular automata, and use an update order to construct the
dynamical system map.
  The main result of this paper is a characterization of cycle equivalence in
terms of shifts and reflections of the SDS update order. We construct two
graphs C(Y) and D(Y) whose components describe update orders that give rise to
cycle equivalent SDSs. The number of components in C(Y) and D(Y) is an upper
bound for the number of cycle equivalence classes one can obtain, and we
enumerate these quantities through a recursion relation for several graph
classes. The components of these graphs encode dynamical neutrality, the
component sizes represent periodic orbit structural stability, and the number
of components can be viewed as a system complexity measure.
","[{""version"":""v1"",""created"":""Fri, 29 Feb 2008 18:24:20 GMT""}]","2009-11-13"
"0802.4418","Mark Dykman","M.I. Dykman and V.N. Smelyanskiy","Distribution of Fluctuational Paths in Noise-Driven Systems","A paper written in 1997 for a special issue in honor of Rolf Landauer","Superlatt. Microstruct. 23, 495 (1998)",,,"cond-mat.stat-mech cond-mat.mes-hall","http://arxiv.org/licenses/nonexclusive-distrib/1.0/","  Dynamics of a system that performs a large fluctuation to a given state is
essentially deterministic: the distribution of fluctuational paths peaks
sharply at a certain optimal path along which the system is most likely to
move. For the general case of a system driven by colored Gaussian noise, we
provide a formulation of the variational problem for optimal paths. We also
consider the prehistory problem, which makes it possible to analyze the shape
of the distribution of fluctuational paths that arrive at a given state. We
obtain, and solve in the limiting case, a set of linear equations for the
characteristic width of this distribution.
","[{""version"":""v1"",""created"":""Fri, 29 Feb 2008 16:01:14 GMT""}]","2008-03-03"
"0802.4419","Fernando Falo","Javier Munarriz, Juan J. Mazo, Fernando Falo (BIFI- ICMA- Universidad
  de Zaragoza)","A model for hand-over-hand motion of molecular motors","8 pages, Phys. Rev. E (in press)","Physical Review E 77, 031915 (2008)","10.1103/PhysRevE.77.031915",,"physics.bio-ph cond-mat.soft q-bio.SC","http://arxiv.org/licenses/nonexclusive-distrib/1.0/","  A simple flashing ratchet model in two dimensions is proposed to simulate the
hand-over-hand motion of two head molecular motors like kinesin. Extensive
Langevin simulations of the model are performed. Good qualitative agreement
with the expected behavior is observed. We discuss different regimes of motion
and efficiency depending of model parameters.
","[{""version"":""v1"",""created"":""Fri, 29 Feb 2008 16:03:23 GMT""}]","2008-03-18"
"0802.4420","Justyn Maund","J.R. Maund (1) ((1) University of Texas, Austin)","Optical spectropolarimetry with incomplete data sets","A&A accepted, 6 pages, 7 figures",,"10.1051/0004-6361:20078302",,"astro-ph","http://arxiv.org/licenses/nonexclusive-distrib/1.0/","  Linear spectropolarimetry is a ``photon-hungry'' observing technique,
requiring a specific sequence of observations to determine the Stokes Q and U
parameters. For dual-beam spectropolarimeters, the parameters can be ideally
determined using observations at N=2 retarder plate positions. The additional
polarization signal introduced by instrumental effects requires the redundancy
of N=4 observations to correct for these effects. We wish to determine if the
``instrumental signature corrections'', eQ and eU, are identical for
observations with dual-beam spectropolarimeters. For instances when
observations were acquired at N=3 retarder plate angles, we wish to determine
if the complete measurement of one Stokes parameter and the associated
instrumental signature correction can be used to determine the other Stokes
parameter. We constructed analytical and Monte Carlo models of a general
dual-beam spectropolarimeter to study the factors affecting the assumption
eQ=eU. We compared these models with VLT FORS1 spectropolarimetry. We find that
eQ-eU=0, with the variance around zero (\Delta(eQ-eU)) being directly related
to the signal-to-noise ratio of the observations. Observations of a polarized
standard star, over the period 2002-2007, show that the assumption of eQ-eU=0
is generally true, although the absolute values of eQ and eU vary between
observational epochs. Incomplete spectropolarimetry datasets can be analyzed
under the assumption that eQ=eU. This property of the analysis of
spectropolarimetry, with dual beam spectropolarimeters, can be used to assess
the quality of the reduction for complete data.
","[{""version"":""v1"",""created"":""Fri, 29 Feb 2008 17:50:35 GMT""}]","2009-11-13"
"0802.4421","Philip James","P. A. James (1), J. H. Knapen (2), N. S. Shane (1 and 3), I. K. Baldry
  (1), R. S. de Jong (4) ((1) Liverpool John Moores University, (2) Instituto
  de Astrofisica de Canarias, (3) Mullard Space Science Laboratory, (4) Space
  Telescope Science Institute)","The H alpha Galaxy Survey. IV. Star formation in the local Universe","12 pages, accepted for publication in Astronomy and Astrophysics",,"10.1051/0004-6361:20078560",,"astro-ph","http://arxiv.org/licenses/nonexclusive-distrib/1.0/","  We present an analysis of the star formation properties of field galaxies
within the local volume out to a recession velocity limit of 3000 km/s. A
parent sample of 863 star-forming galaxies is used to calculate a B-band
luminosity function. This is then populated with star formation information
from a subsample of 327 galaxies, for which we have H alpha imaging, firstly by
calibrating a relationship between galaxy B-band luminosity and star formation
rate, and secondly by a Monte Carlo simulation of a representative sample of
galaxies, in which star formation information is randomly sampled from the
observed subset. The total star formation rate density of the local Universe is
found to be between 0.016 and 0.023 MSun/yr/cubic Mpc, with the uncertainties
being dominated by the internal extinction correction used in converting
measured H alpha fluxes to star formation rates. If our internally derived
B-band luminosity function is replaced by one from the Sloan Digital Sky Survey
blue sequence, the star formation rate densities are approx. 60% of the above
values. We also calculate the contribution to the total star formation rate
density from galaxies of different luminosities and Hubble T-types. The largest
contribution comes from bright galaxies with B absolute mag of approx. -20 mag,
and the total contribution from galaxies fainter than -15.5 mag is less than
10%. Almost 60% of the star formation rate density comes from galaxies of types
Sb, Sbc or Sc; 9% from galaxies earlier than Sb and 33% from galaxies later
than Sc. Finally, 75 - 80% of the total star formation in the local Universe is
shown to be occurring in disk regions, defined as being >1 kpc from the centres
of galaxies.
","[{""version"":""v1"",""created"":""Fri, 29 Feb 2008 16:14:44 GMT""}]","2009-11-13"
"0802.4422","Dieter Engels","A. Winnberg, D. Engels, J. Brand, L. Baldacci, C.M. Walmsley","Water vapour masers in long-period variable stars. I. RX Boo and SV Peg","37 pages, 24 figures, accepted for publication in Astronomy &
  Astrophysics",,"10.1051/0004-6361:20078295",,"astro-ph","http://arxiv.org/licenses/nonexclusive-distrib/1.0/","  We wish to understand the reasons for the strong variability of H2O masers in
circumstellar shells of late-type stars. We monitored RX Boo and SV Peg in the
22-GHz maser line of water vapour with single-dish telescopes. The monitoring
period covered two decades for RX Boo (1987 -- 2007) and 12 years for SV Peg
(1990 -- 1995, 2000 -- 2007). In addition, maps were obtained of RX Boo with
the Very Large Array over several years. We find that most of the emission in
the circumstellar shell of RX Boo is located in an incomplete ring with an
inner radius of 91 mas (15 AU). A velocity gradient is found in a NW--SE
direction. The maser region can be modelled as a shell with a thickness of 22
AU, which is only partially filled. The gas crossing time is 16.5 years. The
ring-like structure and the velocity gradient remained stable for at least 11
years, while the maser line profiles varied strongly. This suggests that the
spatial asymmetry is not accidental, so that either the mass loss process or
the maser excitation conditions in RX Boo are not spherically symmetric. The
strong variability of the maser spectral features is mainly due to incoherent
intensity fluctuations of maser emission spots, which have lifetimes of the
order of 1 year. We found no correlation between the optical and the maser
variability in either star. The variability properties of the SV Peg masers do
not differ substantially from those of RX Boo. There were fewer spectral
features present, and the range of variations was narrower. The maser was
active on the >10-Jy level only 1990 -- 1992 and 2006/2007. At other times the
maser was either absent (<1 Jy) or barely detectable.
","[{""version"":""v1"",""created"":""Fri, 29 Feb 2008 16:30:09 GMT""}]","2009-11-13"
"0802.4423","Vincenzo Branchina","Vincenzo Branchina, Hugo Faivre, Vincent Pangon","Effective potential and vacuum stability","10 pages, 4 figures","J.Phys.G36:015006,2009","10.1088/0954-3899/36/1/015006",,"hep-ph hep-th","http://arxiv.org/licenses/nonexclusive-distrib/1.0/","  By following previous work on this subject, we investigate the issue of the
instability of the electroweak vacuum against the top loop corrections by
performing an accurate analysis of a Higgs-Yukawa model. We find that, when the
physical cutoff is properly implemented in the theory, the potential does not
exhibit any instability. Moreover, contrary to recent claims, we show that this
instability cannot be understood in terms of the very insightful work of Wu and
Weinberg on the non-convexity of the one-loop effective potential of a scalar
theory. Some of the theoretical and phenomenological consequences of our
results are briefly discussed.
","[{""version"":""v1"",""created"":""Fri, 29 Feb 2008 16:16:40 GMT""}]","2008-11-26"
"0802.4424","C. Jordan","A. Kuzmin, B. Ya. Losovsky, C.A.Jordan, F.Graham Smith","Correlation of the scattering and dispersion events in the Crab Nebula
  pulsar","3 pages, 1 figure, accepted by A&A",,"10.1051/0004-6361:20079211",,"astro-ph","http://arxiv.org/licenses/nonexclusive-distrib/1.0/","  In separate series of observations of the Crab pulsar, pulse broadening due
to scattering was measured at 111 MHz, and variations of dispersion due to
pulse delay were measured at higher radio frequencies. In a remarkable event
lasting 200 days a large increase occurred in both parameters and with similar
time signatures. The increases in scattering and dispersion measure observed
over the 200 days MJD 53950 - 54150 are attributable to the effects of an
ionised cloud or filament crossing the line of sight. The cloud would be $10^11
- 10^12 m across, with electron density 10^3 - 10^4 cm^-3. The increased
scattering might originate within the cloud itself, or the moving filament
might induce turbulence in a separate higher density cloud in the line of
sight.
","[{""version"":""v1"",""created"":""Fri, 29 Feb 2008 16:22:55 GMT""}]","2009-11-13"
"0802.4425","Boris Novikov","V. V. Kirichenko, B. V. Novikov","On the Brauer monoid for finite fields","5 pages, Latex","Finite fields and applications. Springer, Berlin, 2001, 313-318",,,"math.GR math.NT","http://arxiv.org/licenses/nonexclusive-distrib/1.0/","  The Brauer monoid is studied by the notion of 0-cohomology. We investigate
the impact of invertible elements of modifications on the structure of the
Brauer monoid, especially for finite fields.
","[{""version"":""v1"",""created"":""Fri, 29 Feb 2008 16:25:15 GMT""}]","2008-03-03"
"0802.4426","A. Marco Saitta","A. Marco Saitta, Michele Lazzeri, Matteo Calandra, Francesco Mauri","Giant non-adiabatic effects in layer metals: Raman spectra of
  intercalated graphite explained","4 pages, 3 figures, 1 table",,"10.1103/PhysRevLett.100.226401",,"cond-mat.mtrl-sci cond-mat.supr-con","http://arxiv.org/licenses/nonexclusive-distrib/1.0/","  The occurrence of non-adiabatic effects in the vibrational properties of
metals have been predicted since the 60's, but hardly confirmed experimentally.
We report the first fully \emph{ab initio} calculations of non-adiabatic
frequencies of a number of layer and conventional metals. We suggest that
non-adiabatic effects can be a feature of the vibrational Raman spectra of any
bulk metal, and show that they are spectacularly large (up to 30% of the phonon
frequencies) in the case of layer metals, such as superconducting $MgB_2$,
$CaC_6$ and other graphite intercalated compounds. We develop a framework
capable to estimate the electron momentum-relaxation time of a given system,
and thus its degree of non-adiabaticity, in terms of the experimentally
observed frequencies and linewidths.
","[{""version"":""v1"",""created"":""Fri, 29 Feb 2008 16:36:02 GMT""},{""version"":""v2"",""created"":""Sat, 1 Mar 2008 09:26:23 GMT""}]","2009-11-13"
"0802.4427","Birjoo Vaishnav","Deirdre Shoemaker, Birjoo Vaishnav, Ian Hinder and Frank Herrmann","Numerical Relativity meets Data Analysis: Spinning Binary Black Hole
  Case","Invited submission to Class.Quant.Grav. for Amaldi07 proceedings","Class.Quant.Grav.25:114047,2008","10.1088/0264-9381/25/11/114047",,"gr-qc","http://creativecommons.org/licenses/by/3.0/","  We present a study of the gravitational waveforms from a series of spinning,
equal-mass black hole binaries focusing on the harmonic content of the waves
and the contribution of the individual harmonics to the signal-to-noise ratio.
The gravitational waves were produced from two series of evolutions with black
holes of initial spins equal in magnitude and anti-aligned with each other. In
one series the magnitude of the spin is varied; while in the second, the
initial angle between the black-hole spins and the orbital angular momentum
varies. We also conduct a preliminary investigation into using these waveforms
as templates for detecting spinning binary black holes. Since these runs are
relativity short, containing about two to three orbits, merger and ringdown, we
limit our study to systems of total mass greater than 50 solar masses. This
choice ensures that our waveforms are present in the ground-based detector band
without needing addition gravitational wave cycles. We find that while the mode
contribution to the signal-to-noise ratio varies with the initial angle, the
total mass of the system caused greater variations in the match.
","[{""version"":""v1"",""created"":""Fri, 29 Feb 2008 17:45:23 GMT""}]","2008-11-26"
"0802.4428","Giovanni Ortenzi","G. Falqui, G. Ortenzi","The Sato Grassmannian and the CH hierarchy","10 pages, no figures",,"10.2991/jnmp.2008.15.s3.30",,"nlin.SI","http://arxiv.org/licenses/nonexclusive-distrib/1.0/","  We discuss how the Camassa-Holm hierarchy can be framed within the geometry
of the Sato Grassmannian.
","[{""version"":""v1"",""created"":""Fri, 29 Feb 2008 16:45:03 GMT""}]","2015-05-13"
"0802.4429","Lucia Steinke","L. Steinke, D. Schuh, M. Bichler, G. Abstreiter and M. Grayson","Hopping conduction in strongly insulating states of a diffusive bent
  quantum Hall junction","4 pages, 3 figures","Phys. Rev. B 77, 235319 (2008)","10.1103/PhysRevB.77.235319",,"cond-mat.mes-hall","http://arxiv.org/licenses/nonexclusive-distrib/1.0/","  Transport studies of a bent quantum Hall junction at integer filling factors
show strongly insulating states at higher fields. In this paper we analyze the
strongly insulating behavior as a function of temperature T and dc bias V, in
order to classify the localization mechanisms responsible for the insulating
state. The temperature dependence suggests a crossover from activated
nearest-neighbor hopping at higher T to variable-range hopping conduction at
lower T. The base temperature electric field dependence is consistent with 1D
variable-range hopping conduction. We observe almost identical behavior at
filling factors 1 and 2, and discuss how the bent quantum Hall junction
conductance appears to be independent of the bulk spin state. Various models of
1D variable-range hopping which either include or ignore interactions are
compared, all of which are consistent with the basic model of disorder coupled
counter-propagating quantum Hall edges.
","[{""version"":""v1"",""created"":""Fri, 29 Feb 2008 16:49:12 GMT""},{""version"":""v2"",""created"":""Tue, 15 Jul 2008 01:54:36 GMT""}]","2008-07-15"
"0802.4430","Rouzbeh Allahverdi","Rouzbeh Allahverdi, Anupam Mazumdar","Affleck-Dine condensate, late thermalization and the gravitino problem","10 pages. Clarifying comments added, final version accepted for
  publication in Phys. Rev. D","Phys.Rev.D78:043511,2008","10.1103/PhysRevD.78.043511",,"hep-ph","http://arxiv.org/licenses/nonexclusive-distrib/1.0/","  In this clarifying note we discuss the late decay of an Affleck-Dine
condensate by providing a no-go theorem that attributes to conserved global
charges which are identified by the net particle number in fields which are
included in the flat direction(s). For a rotating condensate, this implies
that: (1) the net baryon/lepton number density stored in the condensate is
always conserved, and (2) the total particle number density in the condensate
cannot decrease. This reiterates that, irrespective of possible
non-perturbative particle production due to $D$-terms in a multiple flat
direction case, the prime decay mode of an Affleck-Dine condensate will be
perturbative as originally envisaged. As a result, cosmological consequences of
flat directions such as delayed thermalization as a novel solution to the
gravitino overproduction problem will remain virtually intact.
","[{""version"":""v1"",""created"":""Fri, 29 Feb 2008 16:59:21 GMT""},{""version"":""v2"",""created"":""Tue, 24 Jun 2008 05:42:05 GMT""}]","2008-11-26"
"0802.4431","Guido Pezzini","Guido Pezzini","Automorphisms of wonderful varieties","16 pages; added details and last section",,,,"math.RT math.AG","http://arxiv.org/licenses/nonexclusive-distrib/1.0/","  Let G be a complex semisimple linear algebraic group, and X a wonderful
G-variety. We determine the connected automorphism group of X and we calculate
Luna's invariants of X under its action.
","[{""version"":""v1"",""created"":""Fri, 29 Feb 2008 17:13:51 GMT""},{""version"":""v2"",""created"":""Thu, 31 Jul 2008 14:22:31 GMT""}]","2008-07-31"
