"0803.0032","Srivatsava Ranjit Ganta","Srivatsava Ranjit Ganta, Shiva Prasad Kasiviswanathan, Adam Smith","Composition Attacks and Auxiliary Information in Data Privacy",,,,,"cs.DB cs.CR","http://arxiv.org/licenses/nonexclusive-distrib/1.0/","  Privacy is an increasingly important aspect of data publishing. Reasoning
about privacy, however, is fraught with pitfalls. One of the most significant
is the auxiliary information (also called external knowledge, background
knowledge, or side information) that an adversary gleans from other channels
such as the web, public records, or domain knowledge. This paper explores how
one can reason about privacy in the face of rich, realistic sources of
auxiliary information. Specifically, we investigate the effectiveness of
current anonymization schemes in preserving privacy when multiple organizations
independently release anonymized data about overlapping populations. 1. We
investigate composition attacks, in which an adversary uses independent
anonymized releases to breach privacy. We explain why recently proposed models
of limited auxiliary information fail to capture composition attacks. Our
experiments demonstrate that even a simple instance of a composition attack can
breach privacy in practice, for a large class of currently proposed techniques.
The class includes k-anonymity and several recent variants. 2. On a more
positive note, certain randomization-based notions of privacy (such as
differential privacy) provably resist composition attacks and, in fact, the use
of arbitrary side information. This resistance enables stand-alone design of
anonymization schemes, without the need for explicitly keeping track of other
releases. We provide a precise formulation of this property, and prove that an
important class of relaxations of differential privacy also satisfy the
property. This significantly enlarges the class of protocols known to enable
modular design.
","[{""version"":""v1"",""created"":""Sat, 1 Mar 2008 00:36:12 GMT""},{""version"":""v2"",""created"":""Mon, 31 Mar 2008 16:23:40 GMT""}]","2008-12-18"
"0803.0033","Henry Tsz-King Wong","Henry T. Wong","Ultra-Low-Energy Germanium Detector for Neutrino-Nucleus Coherent
  Scattering and Dark Matter Searches","Proceedings of the CosPA Symoposium 2007, 12 pages, 5 figures","Mod.Phys.Lett.A23:1431-1442,2008","10.1142/S0217732308027801","AS-TEXONO/08-03","hep-ex","http://arxiv.org/licenses/nonexclusive-distrib/1.0/","  The status and plans of a research program on the development of
ultra-low-energy germanium detectors with sub-keV sensitivities are reported.
We survey the scientific goals which include the observation of
neutrino-nucleus coherent scattering, the studies of neutrino magnetic moments,
as well as the searches of WIMP dark matter. In particular, a threshold of
100-200 eV and a sub-keV background comparable to underground experiments were
achieved with prototype detectors. New limits were set for WIMPs with mass
between 3-6 GeV. The prospects of the realization of full-scale experiments are
discussed.
","[{""version"":""v1"",""created"":""Sat, 1 Mar 2008 01:42:47 GMT""}]","2008-11-26"
"0803.0034","Leonid Andreev V","Leonid Andreev","From a set of parts to an indivisible whole. Part I: Operations in a
  closed mode","28 pages, 10 figures; typos in equations (4) and (5) corrected",,,,"cs.OH","http://arxiv.org/licenses/nonexclusive-distrib/1.0/","  This paper provides a description of a new method for information processing
based on holistic approach wherein analysis is a direct product of synthesis.
The core of the method is iterative averaging of all the elements of a system
according to all the parameters describing the elements. Contrary to common
logic, the iterative averaging of a system's elements does not result in
homogenization of the system; instead, it causes an obligatory subdivision of
the system into two alternative subgroups, leaving no outliers. Within each of
the formed subgroups, similarity coefficients between the elements reach the
value of 1, whereas similarity coefficients between the elements of different
subgroups equal a certain constant value greater than 0 but lower than 1. When
subjected to iterative averaging, any system consisting of three or more
elements of which at least two elements are not completely identical undergo
such a process of bifurcation that occurs non-linearly. Successive iterative
averaging of each of the forming subgroups eventually provides a hierarchical
system that reflects relationships between the elements of an input system
under analysis. We propose a definition of a natural hierarchy that can exist
only in conditions of closeness of a system and can be discovered upon
providing such an effect onto a system which allows its elements interact with
each other based on the principle of self-organization. Self-organization can
be achieved through an overall and total cross-averaging of a system's
elements. We demonstrate the application potentials of the proposed technology
on a number of examples, including a system of scattered points, randomized
datasets, as well as meteorological and demographical datasets.
","[{""version"":""v1"",""created"":""Sat, 1 Mar 2008 01:58:59 GMT""},{""version"":""v2"",""created"":""Wed, 28 May 2008 04:43:14 GMT""}]","2008-05-28"
"0803.0035","Andrzej Kwasniewski","A. K. Kwasniewski","Cauchy_Riemann Equations for Cayley Numbers` Functions","14 pages, 1 figure","Bulletin de la Soc. des Sciences et de Lettres de Lodz (PAN) vol.
  XXVI) pp.49-62 (1998)",,,"math.GM","http://arxiv.org/licenses/nonexclusive-distrib/1.0/","  Since the discovery of octonions in 1843 we seem to be still lacking a
satisfactory if any theory of octave valued functions satisfactory according to
standard requirements or expectation from the side of a theory like a one might
look for. Here is a proposal coming back to my twentieth century presentation
of a perhaps nonstandard idea hoping to be coping with nonassociativity by an
invention.
","[{""version"":""v1"",""created"":""Sat, 1 Mar 2008 02:34:51 GMT""}]","2008-03-04"
"0803.0036","Doron Gazit","Doron Gazit","Muon Capture on 3He and the Weak Structure of the Nucleon","Submitted to Phys. Lett. B","Phys.Lett.B666:472-476,2008","10.1016/j.physletb.2008.08.008","INT PUB 08-03","nucl-th hep-ph","http://arxiv.org/licenses/nonexclusive-distrib/1.0/","  The weak form factors of the nucleon, including the induced pseudoscalar form
factor and second class terms, are constrained using a microscopic calculation
of the weak capture process $^3He(\mu^{-},\nu_\mu)^3{H}$. The calculation is
parameter free, and yields a rate of 1499(16) Hz, in agreement with the
remarkable experimental measurement 1496(4) Hz. The nuclear wave functions are
obtained using the EIHH method with the Argonne V18 nucleon--nucleon potential
and the Urbana-IX three nucleon force. The weak currents in the nuclei are
described using HB$\chi$PT formalism. The induced pseudoscalar form factor is
found to agree with HB$\chi$PT prediction. The result is compatible with
vanishing second class currents, with the tightest constraint to date on the
conservation of vector current (CVC) hypothesis.
","[{""version"":""v1"",""created"":""Sat, 1 Mar 2008 02:39:58 GMT""},{""version"":""v2"",""created"":""Tue, 1 Jul 2008 17:41:48 GMT""}]","2010-05-12"
"0803.0037","Abedelaziz Mohaisen","Tamer AbuHmed, Abedelaziz Mohaisen, DaeHun Nyang","A Survey on Deep Packet Inspection for Intrusion Detection Systems","10 pages, 7 figures, 1 table","Magazine of Korea Telecommunication Society, vol. 24, No. 11, pp.
  25-36, November 2007",,,"cs.CR","http://arxiv.org/licenses/nonexclusive-distrib/1.0/","  Deep packet inspection is widely recognized as a powerful way which is used
for intrusion detection systems for inspecting, deterring and deflecting
malicious attacks over the network. Fundamentally, almost intrusion detection
systems have the ability to search through packets and identify contents that
match with known attacks. In this paper, we survey the deep packet inspection
implementations techniques, research challenges and algorithms. Finally, we
provide a comparison between the different applied systems.
","[{""version"":""v1"",""created"":""Sat, 1 Mar 2008 02:56:13 GMT""}]","2008-03-04"
"0803.0038","Clifford V. Johnson","Clifford V. Johnson, Arnab Kundu","External Fields and Chiral Symmetry Breaking in the Sakai-Sugimoto Model","26 pages. LaTeX, minor changes","JHEP 0812:053,2008","10.1088/1126-6708/2008/12/053",,"hep-th","http://arxiv.org/licenses/nonexclusive-distrib/1.0/","  Using the Sakai-Sugimoto model we study the effect of an external magnetic
field on the dynamics of fundamental flavours in both the confined and
deconfined phases of a large N_c gauge theory. We find that an external
magnetic field promotes chiral symmetry breaking, consistent with the ""magnetic
catalysis"" observed in the field theory literature, and seen in other studies
using holographic duals. The external field increases the separation between
the deconfinement temperature and the chiral symmetry restoring temperature. In
the deconfined phase we investigate the temperature-magnetic field phase
diagram and observe, for example, there exists a maximum critical temperature
(at which symmetry is restored) for very large magnetic field. We find that
this and certain other phenomena persist for the Sakai-Sugimoto type models
with probe branes of diverse dimensions. We comment briefly on the dynamics in
the presence of an external electric field.
","[{""version"":""v1"",""created"":""Sat, 1 Mar 2008 03:24:53 GMT""},{""version"":""v2"",""created"":""Sun, 5 Oct 2008 19:52:40 GMT""},{""version"":""v3"",""created"":""Tue, 2 Dec 2008 02:22:55 GMT""}]","2009-02-09"
"0803.0039","Yongqin Liu","Yongqin Liu, Weike Wang","Well-posedness of the IBVP for 2-D Euler Equations with Damping","26 pages,no figures",,,,"math.AP math-ph math.MP","http://arxiv.org/licenses/nonexclusive-distrib/1.0/","  In this paper we focus on the initial-boundary value problem of the 2-D
isentropic Euler equations with damping. We prove the global-in-time existence
of classical solution to the initial-boundary value problem by the method of
energy estimates.
","[{""version"":""v1"",""created"":""Sat, 1 Mar 2008 04:37:16 GMT""}]","2008-03-04"
"0803.0040","Ali R. Mohazab","Ali R. Mohazab and Steven S. Plotkin","Minimal distance transformations between links and polymers: Principles
  and examples","Submitted to J. Phys.:Condens. Matter",,"10.1088/0953-8984/20/24/244133",,"cond-mat.soft cond-mat.other","http://creativecommons.org/licenses/by/3.0/","  The calculation of Euclidean distance between points is generalized to
one-dimensional objects such as strings or polymers. Necessary and sufficient
conditions for the minimal transformation between two polymer configurations
are derived. Transformations consist of piecewise rotations and translations
subject to Weierstrass-Erdmann corner conditions. Numerous examples are given
for the special cases of one and two links. The transition to a large number of
links is investigated, where the distance converges to the polymer length times
the mean root square distance (MRSD) between polymer configurations, assuming
curvature and non-crossing constraints can be neglected. Applications of this
metric to protein folding are investigated. Potential applications are also
discussed for structural alignment problems such as pharmacophore
identification, and inverse kinematic problems in motor learning and control.
","[{""version"":""v1"",""created"":""Sat, 1 Mar 2008 04:51:23 GMT""}]","2009-11-13"
"0803.0041","Yun-Su Kim","Yun-Su Kim","Banach Spaces with respect to Operator-Valued Norms","13 page",,,,"math.FA math.OA","http://arxiv.org/licenses/nonexclusive-distrib/1.0/","  We introduce the notions of L(H)-valued norms and Banach spaces with respect
to L(H)-valued norms. In particular, we introduce Hilbert spaces with respect
to L(H)-valued inner products. In addition, we provide several fundamental
examples of Hilbert spaces with respect to L(H)-valued inner products.
","[{""version"":""v1"",""created"":""Sat, 1 Mar 2008 04:52:10 GMT""}]","2008-03-04"
"0803.0042","Nagarajan Valanoor","S. Fujino, M. Murakami, A. Varatharajan, S.-H. Lim, V. Nagarajan, C.
  J. Fennie, M. Wuttig, L. Salamanca-Riba, and I. Takeuchi","Combinatorial discovery of a lead-free morphotropic phase boundary in a
  thin-film piezoelectric perovskite","16 pages, 5 figures, submitted to Applied Physics Letters",,"10.1063/1.2931706",,"cond-mat.mtrl-sci","http://arxiv.org/licenses/nonexclusive-distrib/1.0/","  We report on the discovery of a lead-free morphotropic phase boundary in Sm
doped BiFeO3 with a simple perovskite structure using the combinatorial thin
film strategy. The boundary is a rhombohedral to pseudo-orthorhombic structural
transition which exhibits a ferroelectric (FE) to antiferroelectric (AFE)
transition at approximately Bi0.86Sm0.14FeO3 with dielectric constant and
out-of-plane piezoelectric coefficient comparable to those of epitaxial (001)
oriented Pb(Zr,Ti)O3 (PZT) thin films at the MPB. The discovered composition
may be a strong candidate of a Pb-free piezoelectric replacement of PZT.
","[{""version"":""v1"",""created"":""Sat, 1 Mar 2008 05:06:56 GMT""}]","2009-11-13"
"0803.0043","Dmytro Savchuk","Dmytro Savchuk","Some graphs related to Thompson's group F","20 pages, 13 figures",,,,"math.GR","http://arxiv.org/licenses/nonexclusive-distrib/1.0/","  The Schreier graphs of Thompson's group F with respect to the stabilizer of
1/2 and generators x_0 and x_1, and of its unitary representation in L_2([0,1])
induced by the standard action on the interval [0,1] are explicitly described.
The coamenability of the stabilizers of any finite set of dyadic rational
numbers is established. The induced subgraph of the right Cayley graph of the
positive monoid of F containing all the vertices of the form x_nv, where n>=0
and v is any word over the alphabet {x_0, x_1}, is constructed. It is proved
that the latter graph is non-amenable.
","[{""version"":""v1"",""created"":""Sat, 1 Mar 2008 05:22:43 GMT""},{""version"":""v2"",""created"":""Fri, 15 Aug 2008 19:38:16 GMT""}]","2008-08-15"
"0803.0044","Yafis Barlas","Yafis Barlas, R. Cote, K. Nomura, A. H. MacDonald","Intra-Landau level Cyclotron Resonance in Bilayer Graphene","5 pages, 2 figures","Phys. Rev. Lett. 101,097601(2008)","10.1103/PhysRevLett.101.097601",,"cond-mat.mes-hall","http://arxiv.org/licenses/nonexclusive-distrib/1.0/","  Interaction driven integer quantum Hall effects are anticipated in graphene
bilayers because of the near-degeneracy of the eight Landau levels which appear
near the neutral system Fermi level. We predict that an intra-Landau-level
cyclotron resonance signal will appear at some odd-integer filling factors,
accompanied by collective modes which are nearly gapless and have approximate
$k^{3/2}$ dispersion. We speculate on the possibility of unususal localization
physics associated with these modes.
","[{""version"":""v1"",""created"":""Sat, 1 Mar 2008 05:31:14 GMT""},{""version"":""v2"",""created"":""Tue, 17 Jun 2008 18:18:08 GMT""}]","2008-08-31"
"0803.0045","Helge Glockner","Helge Glockner","Direct limits of infinite-dimensional Lie groups","survey article, 38 pages, LaTeX (v2: minor revisions)",,,,"math.GR math.FA","http://arxiv.org/licenses/nonexclusive-distrib/1.0/","  Many infinite-dimensional Lie groups of interest can be expressed as a union
of an ascending sequence of (finite- or infinite-dimensional) Lie groups. In
this survey article, we compile general results concerning such ascending
unions, describe the main classes of examples, and explain what the general
theory tells us about these.
  In particular, we discuss:
  (1) Direct limit properties of ascending unions of Lie groups in the relevant
categories;
  (2) Regularity in Milnor's sense;
  (3) Homotopy groups of direct limit groups and of Lie groups containing a
dense union of Lie groups;
  (4) Subgroups of direct limit groups;
  (5) Constructions of Lie group structures on ascending unions of Lie groups.
","[{""version"":""v1"",""created"":""Sat, 1 Mar 2008 06:05:04 GMT""},{""version"":""v2"",""created"":""Tue, 1 Apr 2008 22:30:47 GMT""}]","2008-04-02"
"0803.0046","Nithin Nagaraj","Nithin Nagaraj and Prabhakar G. Vaidya","One-Time Pad, Arithmetic Coding and Logic Gates: An unifying theme using
  Dynamical Systems","9 pages, 7 figures, 1 table",,,,"nlin.CD cs.CR","http://arxiv.org/licenses/nonexclusive-distrib/1.0/","  In this letter, we prove that the perfectly secure One-Time Pad (OTP)
encryption can be seen as finding the initial condition on the binary map under
a random switch based on the perfectly random pad. This turns out to be a
special case of Grangetto's randomized arithmetic coding performed on the
Binary Map. Furthermore, we derive the set of possible perfect secrecy systems
using such an approach. Since OTP encryption is an XOR operation, we thus have
a dynamical systems implementation of the XOR gate. We show similar
implementations for other gates such as NOR, NAND, OR, XNOR, AND and NOT. The
dynamical systems framework unifies the three areas to which Shannon made
foundational contributions: lossless compression (Source Coding), perfect
encryption (Cryptography), and design of logic gates (Computation)
","[{""version"":""v1"",""created"":""Sat, 1 Mar 2008 05:54:08 GMT""}]","2008-03-04"
"0803.0047","Bozhidar Zakhariev Iliev","Bozhidar Z. Iliev (Institute for Nuclear Research and Nuclear Energy,
  Bulgarian Academy of Sciences, Sofia, Bulgaria)","Ludwig Valentin Lorenz is the discoverer of the ""Lorenz gauge""!","5 LaTeX pages. The packages AMS-LaTeX and amsfonts are required",,,,"physics.hist-ph hep-th math-ph math.MP physics.class-ph physics.gen-ph","http://arxiv.org/licenses/nonexclusive-distrib/1.0/","  The letter reminds the historical fact that the known ""Lorenz gauge"" (or
""Lorenz condition/relation"") is first mentioned in a written form and named
after Ludwig Valentin Lorenz and not by/after Hendrik Antoon Lorentz.
","[{""version"":""v1"",""created"":""Sat, 1 Mar 2008 06:29:35 GMT""}]","2016-09-08"
"0803.0048","Xin Dong","Xin Dong, Gene Cooperman","A Bit-Compatible Shared Memory Parallelization for ILU(k)
  Preconditioning and a Bit-Compatible Generalization to Distributed Memory","25 pages",,,,"cs.DC","http://arxiv.org/licenses/nonexclusive-distrib/1.0/","  ILU(k) is a commonly used preconditioner for iterative linear solvers for
sparse, non-symmetric systems. It is often preferred for the sake of its
stability. We present TPILU(k), the first efficiently parallelized ILU(k)
preconditioner that maintains this important stability property. Even better,
TPILU(k) preconditioning produces an answer that is bit-compatible with the
sequential ILU(k) preconditioning. In terms of performance, the TPILU(k)
preconditioning is shown to run faster whenever more cores are made available
to it --- while continuing to be as stable as sequential ILU(k). This is in
contrast to some competing methods that may become unstable if the degree of
thread parallelism is raised too far. Where Block Jacobi ILU(k) fails in an
application, it can be replaced by TPILU(k) in order to maintain good
performance, while also achieving full stability. As a further optimization,
TPILU(k) offers an optional level-based incomplete inverse method as a fast
approximation for the original ILU(k) preconditioned matrix. Although this
enhancement is not bit-compatible with classical ILU(k), it is bit-compatible
with the output from the single-threaded version of the same algorithm. In
experiments on a 16-core computer, the enhanced TPILU(k)-based iterative linear
solver performed up to 9 times faster. As we approach an era of many-core
computing, the ability to efficiently take advantage of many cores will become
ever more important. TPILU(k) also demonstrates good performance on cluster or
Grid. For example, the new algorithm achieves 50 times speedup with 80 nodes
for general sparse matrices of dimension 160,000 that are diagonally dominant.
","[{""version"":""v1"",""created"":""Sat, 1 Mar 2008 07:21:27 GMT""},{""version"":""v2"",""created"":""Sun, 3 Oct 2010 05:30:32 GMT""},{""version"":""v3"",""created"":""Tue, 3 May 2011 19:48:42 GMT""},{""version"":""v4"",""created"":""Thu, 12 May 2011 06:02:29 GMT""}]","2011-05-13"
"0803.0049","Shobha Madan","Debashish Bose, C.P. Anil Kumar, R. Krishnan, Shobha Madan","On Fuglede's conjecture for three intervals","21 pages",,,,"math.CA","http://arxiv.org/licenses/nonexclusive-distrib/1.0/","  In this paper we prove the ""Tiling implies Spectral"" part of Fuglede's paper
for the case of three intervals. Then we prove the ""Spectral implies Tiling""
part of the conjecture for the case of three equal intervals as also when the
intervals have lengths 1/2, 1/4, 1/4. For the general case we change our
approach to get information on the structure of the spectrum for the n-interval
case. Finally, we use symbolic computations on Mathematica, and prove this part
of the conjecture with an additional assumption on the spectrum.
","[{""version"":""v1"",""created"":""Sat, 1 Mar 2008 07:26:33 GMT""},{""version"":""v2"",""created"":""Tue, 23 Feb 2010 11:17:36 GMT""}]","2010-02-23"
"0803.0050","Angelo Loinger","Angelo Loinger, Tiziana Marsico","Hilbertian Repulsive Effect and Dark Energy","12 pages, 10 figures, LaTeX",,,,"physics.gen-ph","http://arxiv.org/licenses/nonexclusive-distrib/1.0/","  A repulsive gravitational effect of general relativity (without cosmological
term), which was pointed out by Hilbert many years ago, could play a decisive
role in the explanation of the observational data concerning the accelerated
expansion of the universe.
","[{""version"":""v1"",""created"":""Sat, 1 Mar 2008 07:48:13 GMT""}]","2008-03-04"
"0803.0051","Hikaru Kawamura","Atsushige Ikeda and Hikaru Kawamura","Ordering of the pyrochlore Ising model with the long-range RKKY
  interaction",,"J. Phys. Soc. Jpn. 77, 073707 (2008)","10.1143/JPSJ.77.073707",,"cond-mat.stat-mech","http://arxiv.org/licenses/nonexclusive-distrib/1.0/","  The ordering of the Ising model on a pyrochlore lattice interacting via the
long-range RKKY interaction, which models a metallic pyrochlore magnet such as
Pr_2Ir_2O_7, is studied by Monte Carlo simulations. Depending on the parameter
k_F representing the Fermi wavevector, the model exhibits rich ordering
behaviors.
","[{""version"":""v1"",""created"":""Sat, 1 Mar 2008 07:55:27 GMT""},{""version"":""v2"",""created"":""Wed, 18 Jun 2008 06:19:53 GMT""}]","2009-11-13"
"0803.0052","Han-Jin Noh","Han-Jin Noh, H. Koh, S.-J. Oh, J.-H. Park, H.-D. Kim, J. D. Rameau, T.
  Valla, T. Kidd, P. D. Johnson, Y. Hu, Q. Li","Spin-orbit interaction effect in the electronic structure of \BiTe \
  observed by angle-resolved photoemission spectroscopy","3 figures","Europhysic Letters 81, 57006 (2008)","10.1209/0295-5075/81/57006",,"cond-mat.mtrl-sci","http://arxiv.org/licenses/nonexclusive-distrib/1.0/","  The electronic structure of $p$-type doped \BiTe is studied by angle resolved
photoemission spectroscopy (ARPES) to experimentally confirm the mechanism
responsible for the high thermoelectric figure of merit. Our ARPES study shows
that the band edges are located off the $\Gamma$-Z line in the Brillouin zone,
which provides direct observation that the spin-orbit interaction is a key
factor to understand the electronic structure and the corresponding
thermoelectric properties of \BiTe. Successive time dependent ARPES measurement
also reveals that the electron-like bands crossing E$_F$ near the
$\underline{\Gamma}$ point are formed in an hour after cleaving the crystals.
We interpret these as surface states induced by surface band bending, possibly
due to quintuple inter-layer distance change of \BiTe.
","[{""version"":""v1"",""created"":""Sat, 1 Mar 2008 08:25:21 GMT""}]","2009-09-29"
"0803.0053","M Sabu THAMPI","Sabu M. Thampi, K. Chandra Sekaran","Mobile Agents for Content-Based WWW Distributed Image Retrieval",,,,,"cs.DC cs.IR","http://arxiv.org/licenses/nonexclusive-distrib/1.0/","  At present, the de-facto standard for providing contents in the Internet is
the World Wide Web. A technology, which is now emerging on the Web, is
Content-Based Image Retrieval (CBIR). CBIR applies methods and algorithms from
computer science to analyse and index images based on their visual content.
Mobile agents push the flexibility of distributed systems to their limits since
not only computations are dynamically distributed but also the code that
performs them. The current commercial applet-based methodologies for accessing
image database systems offer limited flexibility, scalability and robustness.
In this paper the author proposes a new framework for content-based WWW
distributed image retrieval based on Java-based mobile agents. The
implementation of the framework shows that its performance is comparable to,
and in some cases outperforms, the current approach.
","[{""version"":""v1"",""created"":""Sat, 1 Mar 2008 08:27:59 GMT""}]","2008-03-04"
