"0803.4035","Sang-Sung Lee","Sang-Sung Lee (1), Andrei P. Lobanov (1), Thomas P. Krichbaum (1),
  Arno Witzel (1), J. Anton Zensus (1), Michael Bremer (2), Albert Greve (2),
  and Michael Grewing (2) ((1) MPIfR, Germany; (2) IRAM, France)","A Global 86GHz VLBI Survey of Compact Radio Sources","72 pages, 12 figures, accepted for publication in the Astronomical
  Journal",,"10.1088/0004-6256/136/1/159",,"astro-ph","http://arxiv.org/licenses/nonexclusive-distrib/1.0/","  We present results from a large 86GHz global VLBI survey of compact radio
sources. The main goal of the survey is to increase by factors of 3--5 the
total number of objects accessible for future 3-mm VLBI imaging. The survey
observations reach the baseline sensitivity of 0.1Jy and image sensitivity of
better than 10 mJy/beam. The total of 127 compact radio sources have been
observed. The observations have yielded images for 109 sources, extending the
database of the sources imaged at 86GHz with VLBI observation by a factor of 5,
and only 6 sources have not been detected. The remaining 12 objects have been
detected but could not be imaged due to insufficient closure phase information.
Radio galaxies are less compact than quasars and BL Lacs on sub-milliarcsecond
scale. Flux densities and sizes of core and jet components of all imaged
sources have been estimated using Gaussian model fitting. From these
measurements, brightness temperatures have been calculated, taking into account
resolution limits of the data. The cores of 70% of the imaged sources are
resolved. The core brightness temperatures of the sources peak at $\sim
10^{11}$ K and only 1% have brightness temperatures higher than $10^{12}$ K.
Cores of Intraday Variable (IDV) sources are smaller in angular size than
non-IDV sources, and so yield higher brightness temperatures.
","[{""version"":""v1"",""created"":""Fri, 28 Mar 2008 01:27:26 GMT""}]","2009-11-13"
"0803.4036","Rodney J. Baxter","R.J. Baxter","Algebraic reduction of the Ising model","25 pages, one figure, last reference completed. Various typos fixed.
  Changes on 12 July 2008: Fig 1, 0 to +1; before (2.1), if to is; after (4.6),
  from to form; before (4.46), first three to middle two; before (4.46), last
  to others; Conclusions, 2nd para, insert how ; renewcommand \i to be \rm i","J. Stat. Phys. 132, 959 (2008)","10.1007/s10955-008-9587-y",,"cond-mat.stat-mech","http://arxiv.org/licenses/nonexclusive-distrib/1.0/","  We consider the Ising model on a cylindrical lattice of L columns, with
fixed-spin boundary conditions on the top and bottom rows. The spontaneous
magnetization can be written in terms of partition functions on this lattice.
We show how we can use the Clifford algebra of Kaufman to write these partition
functions in terms of L by L determinants, and then further reduce them to m by
m determinants, where m is approximately L/2. In this form the results can be
compared with those of the Ising case of the superintegrable chiral Potts
model. They point to a way of calculating the spontaneous magnetization of that
more general model algebraically.
","[{""version"":""v1"",""created"":""Fri, 28 Mar 2008 01:49:01 GMT""},{""version"":""v2"",""created"":""Sat, 7 Jun 2008 02:48:48 GMT""},{""version"":""v3"",""created"":""Sat, 12 Jul 2008 02:50:46 GMT""}]","2009-12-15"
"0803.4037","Rodney J. Baxter","R.J. Baxter","A conjecture for the superintegrable chiral Potts model","19 pages, one figure; Corrections made between 28 March 2008 and 28
  April 2008: (1) 2.10: q to p; (2) 3.1: epsilon to 0 (not infinity); (3) 5.29:
  p to q; (4) p14: sub-head: p, q to q,p; (5) p15: sub-head: p, q to q,p; (6)
  7.5 second theta to -theta ; (7) before 7.6: make more explicit definition of
  lambda_j. Several other typos fixed later","J. Stat. Phys. 132, 983 (2008)","10.1007/s10955-008-9588-x",,"cond-mat.stat-mech","http://arxiv.org/licenses/nonexclusive-distrib/1.0/","  We adapt our previous results for the ``partition function'' of the
superintegrable chiral Potts model with open boundaries to obtain the
corresponding matrix elements of e^{-\alpha H}, where H is the associated
hamiltonian. The spontaneous magnetization M_r can be expressed in terms of
particular matrix elements of e^{-\alpha H} S^r_1 \e^{-\beta H}, where S_1 is a
diagonal matrix.We present a conjecture for these matrix elements as an m by m
determinant, where m is proportional to the width of the lattice. The author
has previously derived the spontaneous magnetization of the chiral Potts model
by analytic means, but hopes that this work will facilitate a more algebraic
derivation, similar to that of Yang for the Ising model.
","[{""version"":""v1"",""created"":""Fri, 28 Mar 2008 01:41:28 GMT""},{""version"":""v2"",""created"":""Mon, 28 Apr 2008 04:39:47 GMT""},{""version"":""v3"",""created"":""Sat, 7 Jun 2008 02:50:46 GMT""},{""version"":""v4"",""created"":""Sat, 12 Jul 2008 02:56:45 GMT""}]","2009-12-15"
"0803.4038","Hassan Raza","Tuo-Hung Hou, Hassan Raza, Kamran Afshari, Daniel J. Ruebusch and
  Edwin C. Kan","Nonvolatile memory with molecule-engineered tunneling barriers","to appear in Applied Physics Letters","Appl. Phys. Lett. 92, 153109 (2008)","10.1063/1.2911741",,"cond-mat.mes-hall cond-mat.mtrl-sci","http://arxiv.org/licenses/nonexclusive-distrib/1.0/","  We report a novel field-sensitive tunneling barrier by embedding C60 in SiO2
for nonvolatile memory applications. C60 is a better choice than ultra-small
nanocrystals due to its monodispersion. Moreover, C60 provides accessible
energy levels to prompt resonant tunneling through SiO2 at high fields.
However, this process is quenched at low fields due to HOMO-LUMO gap and large
charging energy of C60. Furthermore, we demonstrate an improvement of more than
an order of magnitude in retention to program/erase time ratio for a metal
nanocrystal memory. This shows promise of engineering tunnel dielectrics by
integrating molecules in the future hybrid molecular-silicon electronics.
","[{""version"":""v1"",""created"":""Fri, 28 Mar 2008 02:21:15 GMT""}]","2008-04-17"
"0803.4039","Dao-Jun Liu","Wei-Zhong Liu, Dao-Jun Liu","Statefinder Diagnostic for Quintessence with or without Thermal
  Interaction","10 pages, 6 figures, accepted for publication in IJMPD","Int.J.Mod.Phys.D18:43-52,2009","10.1142/S0218271809014261",,"astro-ph","http://arxiv.org/licenses/nonexclusive-distrib/1.0/","  The cosmological dynamics of minimally coupled scalar field that couples to
the background matter with thermal interactions is investigated by using
statefinder diagnostics. The time evolution of the statefinder pairs $\{r,s\}$
and $\{r,q\}$ are obtained under the circumstance that different values of
model parameters are chosen. We show that the thermal coupling term does not
affect the location of the late-time attractor, but exert an influence on the
evolution of the statefinder parameters. The most notable feature of the $r-s$
plane for the thermal coupling model which is distinguished from the other dark
energy models is that some part of the curve with thermal coupling can form a
closed loop in the second quadrant ($r>1,s<0$).
","[{""version"":""v1"",""created"":""Fri, 28 Mar 2008 02:21:24 GMT""}]","2009-06-23"
"0803.4040","Joseph B. Keller Prof.","Thomas Callaghan and Joseph B. Keller","Probability distribution of the resistance of a random network","10 pages total, 5 figures",,,,"physics.class-ph","http://arxiv.org/licenses/nonexclusive-distrib/1.0/","  The probability density of the resistance of a two dimensional rectangular
network between two conducting plates is calculated. The nodes form an $M$ by
$N$ lattice, and each edge has a random resistance. The Monte Carlo method is
used.
","[{""version"":""v1"",""created"":""Fri, 28 Mar 2008 02:24:19 GMT""}]","2008-03-31"
"0803.4041","Vladimir Matic Milan","V. M. Matic","CuO chain statistics, charge transfer and Tc(x) dependence in
  YBa2Cu3O6+x, Y0.9(Ca)0.1Ba2Cu3O6+x, and Y0.8(Ca)0.2Ba2Cu3O6+x","10 pages, 2 figures",,,,"cond-mat.supr-con","http://arxiv.org/licenses/nonexclusive-distrib/1.0/","  x dependences of Tc in YBa2Cu3O6+x and Y1-b(Ca)bBa2Cu3O6+x (b=0.1 and b=0.2)
have been calculated assuming that the net doping of CuO2 layers is a sum of
contributions from CuO chains and from substitution of Y3+ by Ca2+. We applied
the concept of minimal (critical) chain length lcr needed to trigger charge
transfer from chains to planes. The model proposed assumes that only a certain
part, say kappa, of those chain-holes that are created beyond the first lcr-2
holes in chains of length l>lcr, are able to attract electrons from CuO2
bilayer. Our analysis points to the conclusion that parameter lcr should be
equal to 4 (four oxygen atoms in a chain), or very close to it (3, or 5).
Calculated x dependences of doping, p(x), at constant (room) temperature and
for three different substitution levels b=0, 0.1, and 0.2, are found to be in
excellent agreement with available experimental data. These p(x) dependences
are combined with universal (parabolic) phase relation Tc(p) to obtain three
Tc(x) dependences that also remarkably correlate with those reported in
experiments. The results obtained indicate that in long chains (x=1) the
probability for a chain-hole to capture an electron (expressing hole ability to
become transferred) decreases with the concentration of 3d Cu electrons in CuO2
layers, ranking from kappa=40%(42%) in YBa2Cu3O6+x, over kappa=36% in
Y0.9(Ca)0.1Ba2Cu3O6+x to kappa=33% in Y0.8(Ca)0.2Ba2Cu3O6+x. We estimate that
in these three systems the wavelength of charge corrugations in long chains (at
x=1) should be ranking around lambda=1.38nm, lambda=1.25nm, lambda=1.20nm,
respectively.
","[{""version"":""v1"",""created"":""Fri, 28 Mar 2008 02:27:57 GMT""}]","2008-03-31"
"0803.4042","Ugo Bruzzo","Indranil Biswas, Ugo Bruzzo","On semistable principal bundles over a complex projective manifold","21 pages. To appear in ""International Mathematical Research Notices""","International Mathematics Research Notices, Vol. 2008, Article ID
  rnn035, 28 pages","10.1093/imrn/rnn035",,"math.AG math.DG","http://arxiv.org/licenses/nonexclusive-distrib/1.0/","  Let G be a simple linear algebraic group defined over the complex numbers.
Fix a proper parabolic subgroup P of G and a nontrivial antidominant character
\chi of P. We prove that a holomorphic principal G-bundle E over a connected
complex projective manifold M is semistable and the second Chern class of its
adjoint bundle vanishes in rational cohomology if and only if the line bundle
over E/P defined by \chi is numerically effective. Similar results remain valid
for principal bundles with a reductive linear algebraic group as the structure
group. These generalize an earlier work of Y. Miyaoka where he gave a
characterization of semistable vector bundles over a smooth projective curve.
Using these characterizations one can also produce similar criteria for the
semistability of parabolic principal bundles over a compact Riemann surface.
","[{""version"":""v1"",""created"":""Fri, 28 Mar 2008 03:08:36 GMT""}]","2008-09-01"
"0803.4043","Renat Sultanov","Renat A. Sultanov, Avas V. Khugaev, Dennis Guster","State-resolved rotational cross sections and thermal rate coefficients
  for ortho-/para-H2+HD at low temperatures and HD+HD elastic scattering","16 pages, 5 figures, additional results included",,"10.1016/j.cplett.2009.05.021",,"physics.chem-ph physics.atm-clus","http://arxiv.org/licenses/nonexclusive-distrib/1.0/","  Results for quantum mechanical calculations of the integral cross sections
and corresponding thermal rate coefficients for para-/ortho-H2+HD collisions
are presented. Because of significant astrophysical interest in regard to the
cooling of primodial gas the low temperature limit of para-/ortho-H2+HD is
investigated. Sharp resonances in the rotational state-resolved cross sections
have been calculated at low energies. These resonances are important and
significantly contribute to the corresponding rotational state-resolved thermal
rate coefficients, particularly at low temperatures, that is less than $T \sim
100$K. Additionally in this work, the cross sections for the elastic HD+HD
collision have also been calculated. We obtained quite satisfactory agreement
with the results of other theoretical works and experiments.
","[{""version"":""v1"",""created"":""Fri, 28 Mar 2008 03:45:52 GMT""},{""version"":""v2"",""created"":""Fri, 23 Jan 2009 20:50:08 GMT""}]","2015-05-13"
"0803.4044","Cesar E. Silva","Chris Dodd, Phakawa Jeasakul, Anne Jirapattanakul, Daniel M. Kane,
  Becky Robinson, Noah Stein, and Cesar E. Silva","Ergodic Properties of a Class of Discrete Abelian Group Extensions of
  Rank-One Transformations","20 pages","Colloq. Math. 119 (2010), no. 1, 1--22",,,"math.DS","http://arxiv.org/licenses/nonexclusive-distrib/1.0/","  We define a class of discrete abelian group extensions of rank-one
transformations and establish necessary and sufficient conditions for these
extensions to be power weakly mixing. We show that all members of this class
are multiply recurrent. We then study conditions sufficient for showing that
cartesian products of transformations are conservative for a class of
invertible infinite measure-preserving transformations and provide examples of
these transformations.
","[{""version"":""v1"",""created"":""Fri, 28 Mar 2008 04:31:46 GMT""}]","2011-05-10"
"0803.4045","Abdurahim Okhunov A","Ph.N. Usmanov, A.A. Okhunov, U.S. Salikhbaev, R. Rajabbaev","Electromagnetic Characteristics of States $^{172}Yb$}","11 pages, LaTex",,,,"nucl-th","http://arxiv.org/licenses/nonexclusive-distrib/1.0/","  To describe the ground (gr) and excited states of even-even deformed nuclei
with the phenomenological model, which takes into account the mixing ground
$(gr)$, $0^{+}_{2}(\beta_1)$--, $0^{+}_{3}(\beta_2)$--,
$2^{+}_{1}(\gamma_1)$--, $2^{+}_{2}(\gamma_2)$-- and $K^{\pi}=1^{+}_{\nu}$
rotational bands the calculation has been done for the isotope $^{172}Yb$. The
energy specterum is described. The reduced probability of electric quadrupole,
monopole and dipole magnetic transitions from the states $0^{+}_{\nu}$ and
$2^{+}_{\nu}$ - bands to the ground $(gr)$ state band is calculated. A non
adiabatic effect in the energy and electromagnetic characteristics is
discussed.
","[{""version"":""v1"",""created"":""Fri, 28 Mar 2008 05:27:10 GMT""}]","2008-03-31"
"0803.4046","Dapeng Cai","Dapeng CAI (1), Takashi Gyoshin NITTA (2) ((1) Institute for Advanced
  Research, Nagoya University, Nagoya, Japan, (2) Department of Mathematics,
  Faculty of Education, Mie University, Tsu, Japan)","Constructing the Optimal Solutions to the Undiscounted Continuous-Time
  Infinite Horizon Optimization Problems",,"Nonlinear Analysis: Theory, Methods & Applications, Volume 71,
  Issue 12, 15 December 2009, Pages e2103-e2108","10.1016/j.na.2009.03.066",,"q-fin.GN math.OC","http://arxiv.org/licenses/nonexclusive-distrib/1.0/","  We aim to construct the optimal solutions to the undiscounted continuous-time
infinite horizon optimization problems, the objective functionals of which may
be unbounded. We identify the condition under which the limit of the solutions
to the finite horizon problems is optimal for the infinite horizon problems
under the overtaking criterion.
","[{""version"":""v1"",""created"":""Fri, 28 Mar 2008 05:51:11 GMT""}]","2012-03-20"
"0803.4048","Elena Ostrovskaya","S. F. Caballero Benitez, E. A. Ostrovskaya, M. Gulacsi, and Yu. S.
  Kivshar","Macroscopic quantum self-trapping in a Bose-Josephson junction with
  fermions","8 pages, 8 figures, submitted to PRA",,,,"cond-mat.other","http://arxiv.org/licenses/nonexclusive-distrib/1.0/","  We study the macroscopic quantum self-trapping effect in a mixture of
Bose-Einstein condensate and a large number of quantum degenerate fermions,
trapped in a double-well potential with a variable separation between the
wells. The large number of fermions localized in each well form quasi-static
impurities that affect the dynamics of the bosonic cloud. Our semi-analytical
analysis based on a mean-field model shows that main features of macroscopic
quantum self trapping in a pure bosonic system are radically modified by the
influence of fermions, with both the onset of self-trapping and properties of
the self-trapped state depending on the fermion concentration as well as on the
type of inter-species interaction. Remarkably, repulsive inter-species
interaction leads to population inversion of the bosonic energy levels in the
trapping potential and hence to the inversion of symmetry of the macroscopic
wavefunction. Realistic physical estimates are given based on experimental
parameters for a $^{40}$K-$^{87}$Rb system.
","[{""version"":""v1"",""created"":""Fri, 28 Mar 2008 05:54:19 GMT""}]","2008-03-31"
"0803.4049","Ke Liu","Ke Liu and Nael Abu-Ghazaleh","Stateless and Delivery Guaranteed Geometric Routing on Virtual
  Coordinate System",,,,,"cs.NI cs.DC","http://arxiv.org/licenses/nonexclusive-distrib/1.0/","  Stateless geographic routing provides relatively good performance at a fixed
overhead, which is typically much lower than conventional routing protocols
such as AODV. However, the performance of geographic routing is impacted by
physical voids, and localization errors. Accordingly, virtual coordinate
systems (VCS) were proposed as an alternative approach that is resilient to
localization errors and that naturally routes around physical voids. However,
VCS also faces virtual anomalies, causing their performance to trail geographic
routing. In existing VCS routing protocols, there is a lack of an effective
stateless and delivery guaranteed complementary routing algorithm that can be
used to traverse voids. Most proposed solutions use variants of flooding or
blind searching when a void is encountered. In this paper, we propose a
spanning-path virtual coordinate system which can be used as a complete routing
algorithm or as the complementary algorithm to greedy forwarding that is
invoked when voids are encountered. With this approach, and for the first time,
we demonstrate a stateless and delivery guaranteed geometric routing algorithm
on VCS. When used in conjunction with our previously proposed aligned virtual
coordinate system (AVCS), it out-performs not only all geometric routing
protocols on VCS, but also geographic routing with accurate location
information.
","[{""version"":""v1"",""created"":""Fri, 28 Mar 2008 05:58:51 GMT""},{""version"":""v2"",""created"":""Sat, 29 Mar 2008 02:53:24 GMT""}]","2008-12-18"
"0803.4050","Dapeng Cai","Dapeng CAI (1), Takashi Gyoshin NITTA (2) ((1) Institute for Advanced
  Research, Nagoya University, Nagoya, Japan, (2) Department of Mathematics,
  Faculty of Education, Mie University, Tsu, Japan)","Limit of the Solutions for the Finite Horizon Problems as the Optimal
  Solution to the Infinite Horizon Optimization Problems",,"Journal of Difference Equations and Applications Volume 17, Issue
  3, 2011, Pages 359 - 373","10.1080/10236190902953763",,"q-fin.GN math.OC","http://arxiv.org/licenses/nonexclusive-distrib/1.0/","  We aim to generalize the results of Cai and Nitta (2007) by allowing both the
utility and production function to depend on time. We also consider an
additional intertemporal optimality criterion. We clarify the conditions under
which the limit of the solutions for the finite horizon problems is optimal
among all attainable paths for the infinite horizon problems under the
overtaking criterion, as well as the conditions under which such a limit is the
unique optimum under the sum-of-utilities criterion. The results are applied to
a parametric example of the one-sector growth model to examine the impacts of
discounting on optimal paths.
","[{""version"":""v1"",""created"":""Fri, 28 Mar 2008 06:03:50 GMT""}]","2012-03-20"
"0803.4052","Lianyi He","Lianyi He and Pengfei Zhuang","Critical Zeeman Splitting of Fermi Superfluidity at Infinite Scattering
  Length","Version updated, 4.1 pages, title changed",,,,"cond-mat.supr-con nucl-th","http://arxiv.org/licenses/nonexclusive-distrib/1.0/","  We determine the critical Zeeman energy splitting for Fermi superfluidity at
infinite s-wave scattering length according to the Monte Carlo and experimental
results of the equations of state. Based on the universality hypothesis, we
show that there exist two critical fields $H_{c1}$ and $H_{c2}$, between which
a superfluid-normal mixed phase is energetically favored, and model-independent
formulae for $H_{c1}$, $H_{c2}$ and the critical population imbalance $P_c$ are
derived. Using recent Monte Carlo and experimental results of $P_c$, $H_{c1}$
and $H_{c2}$ are determined. It is found $H_{c1}=0.41\epsilon_{\text F}$ and
$H_{c2}=0.50\epsilon_{\text F}$, with $\epsilon_{\text F}$ being the Fermi
energy of non-interacting gas.
","[{""version"":""v1"",""created"":""Fri, 28 Mar 2008 06:30:13 GMT""},{""version"":""v2"",""created"":""Sat, 15 Aug 2009 06:01:54 GMT""}]","2009-08-15"
"0803.4053","Paul Clark Dr","Paul C. Clark, Ian A. Bonnell, Ralf S. Klessen","The star formation efficiency and its relation to variations in the
  initial mass function","8 pages, 6 figures, accepted by MNRAS for publictaion. Now available
  through the 'Online Early' scheme",,"10.1111/j.1365-2966.2008.13005.x",,"astro-ph","http://arxiv.org/licenses/nonexclusive-distrib/1.0/","  We investigate how the dynamical state of a turbulently supported, 1000 solar
mass, molecular cloud affects the properties of the cluster it forms, focusing
our discussion on the star formation efficiency (SFE) and the initial mass
function (IMF). A variety of initial energy states are examined in this paper,
ranging from clouds with PE = 0.1 KE to clouds with PE = 10 KE, and for both
isothermal and piece-wise polytropic equations of state (similar to that
suggested by Larson). It is found that arbitrary star formation efficiencies
are possible, with strongly unbound clouds yielding very low star formation
efficiencies. We suggest that the low star formation efficiency in the
Maddelena cloud may be a consequence of the relatively unbound state of its
internal structure. It is also found that competitive accretion results in the
observed IMF when the clouds have initial energy states of PE >= KE. We show
that under such conditions the shape of the IMF is independent of time in the
calculations. This demonstrates that the global accretion process can be
terminated at any stage in the cluster's evolution, while still yielding a
distribution of stellar masses that is consistent with the observed IMF. As the
clouds become progressively more unbound, competitive accretion is less
important and the protostellar mass function flattens. These results predict
that molecular clouds should be permeated with a distributed population of
stars that follow a flatter than Salpeter IMF.
","[{""version"":""v1"",""created"":""Fri, 28 Mar 2008 14:08:30 GMT""},{""version"":""v2"",""created"":""Tue, 1 Apr 2008 08:24:18 GMT""}]","2009-11-13"
"0803.4054","\'Angel del R\'io","Ferran Cedo, Eric Jespers, Angel del Rio","Involutive Yang-Baxter Groups","19 pages",,,,"math.QA math.GR","http://arxiv.org/licenses/nonexclusive-distrib/1.0/","  In 1992 Drinfeld posed the question of finding the set theoretic solutions of
the Yang-Baxter equation. Recently, Gateva-Ivanova and Van den Bergh and
Etingof, Schedler and Soloviev have shown a group theoretical interpretation of
involutive non-degenerate solutions. Namely, there is a one-to-one
correspondence between involutive non-degenerate solutions on finite sets and
groups of $I$-type. A group $\mathcal{G}$ of $I$-type is a group isomorphic to
a subgroup of the natural semidirect product of $Fa_n$, the free abelian group
of rank $n$, by $Sym_n$, the symmetric group on $n$ letters, so that the
projection onto $Fa_n$ is a bijective map. The projection of $\mathcal{G}$ onto
$Sym_n$ we call an involutive Yang-Baxter group (IYB group). This suggests the
following strategy to attack Drinfeld's problem for involutive non-degenerate
set theoretic solutions. First classify the IYB groups and second, for a given
IYB group $G$, classify the groups of $I$-type with $G$ as associated IYB
group. It is known that every IYB group is solvable. In this paper some results
supporting the converse of this property are obtained. More precisely, we show
that some classes of groups are IYB groups. We also give a non-obvious method
to construct infinitely many groups of $I$-type (and hence infinitely many
involutive non-degenerate set theoretic solutions of the Yang-Baxter equation)
with a prescribed associated IYB group.
","[{""version"":""v1"",""created"":""Fri, 28 Mar 2008 06:45:44 GMT""}]","2008-03-31"
