"0803.3809","Lorenzo Sorbo","Nemanja Kaloper, Lorenzo Sorbo, Jun'ichi Yokoyama","Higgsflation at the GUT scale in a Higgsless Universe","12 pages LaTeX, v2: takes into account the revised version of ref.
  [26], v3: improved discussion of the origin of the action, version published
  on PRD","Phys.Rev.D78:043527,2008","10.1103/PhysRevD.78.043527",,"hep-ph astro-ph gr-qc hep-th","http://arxiv.org/licenses/nonexclusive-distrib/1.0/","  We revisit inflation in induced gravity. Our focus is on models where the low
scale Planck mass is completely determined by the breaking of the scaling
symmetry in the field theory sector. The Higgs-like field which breaks the
symmetry with a GUT-scale vacuum expectation value has non-minimal couplings to
the curvature, induced by the gravitational couplings of the other light fields
in the theory, so that its expectation value controls the gravitational
strength. This field can drive inflation, and give a low energy universe in
very good agreement with the cosmological observations. The low energy dynamics
of the Standard Model cannot be unitarized by the Higgsflaton, which decouples
from the low energy theory, both because it picks up a large mass and because
its direct couplings to the low energy modes are weakened. Instead, the short
distance behavior of the Standard Model may be regulated by the dynamics of
other light degrees of freedom, such as in Higgsless models.
","[{""version"":""v1"",""created"":""Thu, 27 Mar 2008 18:39:46 GMT""},{""version"":""v2"",""created"":""Sat, 19 Apr 2008 14:38:04 GMT""},{""version"":""v3"",""created"":""Thu, 21 Aug 2008 16:14:16 GMT""}]","2008-11-26"
"0803.3811","Andrew Blechman","Andrew E. Blechman, Siew-Phang Ng","QCD Corrections to K-Kbar Mixing in R-symmetric Supersymmetric Models","11 pages, 11 pdf-figures; updated acknowledgments and references,
  clarified relationship to Ref[17], clarified CP-violation section","JHEP 0806:043,2008","10.1088/1126-6708/2008/06/043",,"hep-ph","http://arxiv.org/licenses/nonexclusive-distrib/1.0/","  The leading-log QCD corrections to K-Kbar mixing in R-symmetric
supersymmetric models are computed using effective field theory techniques. The
spectrum topology where the gluino is significantly heavier than the squarks is
motivated and focused on. It is found that, like in the MSSM, QCD corrections
can tighten the kaon mass difference bound by roughly a factor of three. CP
violation is also briefly considered, where QCD corrections can constrain
phases to be as much as a factor of ten smaller than the uncorrected value.
","[{""version"":""v1"",""created"":""Thu, 27 Mar 2008 19:28:35 GMT""},{""version"":""v2"",""created"":""Wed, 9 Apr 2008 17:59:17 GMT""}]","2009-11-13"
"0803.3820","Rakhi Mahbubani","Tao Han, Rakhi Mahbubani, Devin G. E. Walker, Lian-Tao Wang","Top Quark Pair plus Large Missing Energy at the LHC","22 pages,16 figures","JHEP 0905:117,2009","10.1088/1126-6708/2009/05/117","MADPH-08-1504, NSF-KITP-08-27, FERMILAB-PUB-08-059-T, UCB-PTH-08/05,
  PUPT-2260","hep-ph","http://arxiv.org/licenses/nonexclusive-distrib/1.0/","  We study methods of extracting new physics signals in final states with a
top-quark pair plus large missing energy at the LHC. We consider two typical
examples of such new physics: pair production of a fermionic top partner (a
$T'$ in Little Higgs models for example) and of a scalar top partner (a
$\tilde{t}$ in SUSY). With a commonly-adopted discrete symmetry under which non
Standard Model particles are odd, the top partner is assumed to decay
predominantly to a top quark plus a massive neutral stable particle $A^0$. We
focus on the case in which one of the top quarks decays leptonically and the
other decays hadronically, $pp \to {\tt} A^0A^0 X \to bj_1j_2 \bar b\ell^-
\bar\nu A^0A^0 X + c.c.$, where the $A^0$s escape detection. We identify a key
parameter for the signal observation: the mass splitting between the top
partner and the missing particle. We reconstruct a transverse mass for the
lepton-missing transverse energy system to separate the real $W$ background
from the signal and propose a definition for the reconstructed top quark mass
that allows it to take unphysical values as an indication of new physics. We
perform a scan over the two masses to map out the discovery reach at the LHC in
this channel. We also comment on the possibility of distinguishing between
scalar and fermionic top partners using collider signatures.
","[{""version"":""v1"",""created"":""Thu, 27 Mar 2008 19:16:00 GMT""}]","2011-01-13"
"0803.3910","Alex Carciofi C","A. C. Carciofi, J. E. Bjorkman","Non-LTE Monte Carlo Radiative Transfer: II. Non-Isothermal Solutions for
  Viscous Keplerian Disks","22 pages, 9 figures, ApJ",,"10.1086/589875",,"astro-ph","http://arxiv.org/licenses/nonexclusive-distrib/1.0/","  We discuss the basic hydrodynamics that determines the density structure of
the disks around hot stars. Observational evidence supports the idea that these
disks are Keplerian (rotationally supported) gaseous disks. A popular scenario
in the literature, which naturally leads to the formation of Keplerian disks,
is the viscous decretion model. According to this scenario, the disks are
hydrostatically supported in the vertical direction, while the radial structure
is governed by the viscous transport. This suggests that the temperature is one
primary factor that governs the disk density structure. In a previous study we
demonstrated, using 3-D NLTE Monte Carlo simulations, that viscous keplerian
disks can be highly non-isothermal. In this paper we build upon our previous
work and solve the full problem of the steady-state non-isothermal viscous
diffusion and vertical hydrostatic equilibrium. We find that the
self-consistent solution departs significantly from the analytic isothermal
density, with potentially large effects on the emergent spectrum. This implies
that non-isothermal disk models must be used for a detailed modeling of Be star
disks.
","[{""version"":""v1"",""created"":""Thu, 27 Mar 2008 18:05:29 GMT""},{""version"":""v2"",""created"":""Fri, 2 May 2008 11:37:49 GMT""},{""version"":""v3"",""created"":""Tue, 8 Jul 2008 15:21:11 GMT""}]","2009-11-13"
"0803.3944","N. Bouche","Nicolas Bouche (MPE)","Towards Understanding the Mass-Metallicity relation of Quasar Absorbers:
  Evidence for bimodality and consequences","6 pages, 4 figures, accepted for publication in MNRAS",,"10.1111/j.1745-3933.2008.00513.x",,"astro-ph","http://arxiv.org/licenses/nonexclusive-distrib/1.0/","  One way to characterize and understand HI-selected galaxies is to study their
metallicity properties. In particular, we show that the metallicity of
absorbers is a bivariate function of the HI column density (NHI) and the MgII
equivalent width (Wr(2796)). Thus, a selection upon Wr(2796) is not equivalent
to a HI selection for intervening absorbers. A direct consequence for damped
absorbers with NHI>20.3 from the bivariate metallicity distribution is that any
correlation between the metallicity [X/H] and velocity width (or Wr(2796))
arises from the HI cut and therefore can not be interpreted as a signature of
the mass-metallicity relation akin to normal field galaxies. Thus DLA samples
are intrinsically heterogeneous. On the other hand, a sample of MgII-selected
absorbers, which are statistically dominated by lowest NHI systems (sub-DLAs),
are found to have a more uniform metallicity distribution. We postulate that
the bivariate metallicity distribution can be explained by two different
physical origins of absorbers, namely sight-lines through the ISM of small
galaxies and sight-lines through out-flowing material.
  Several published results follow from this bivariate [X/H] distribution such
as (a) the two classes of DLAs, reported by Wolfe et al., and (b) the constant
dust-to-gas ratio for MgII-absorbers.
","[{""version"":""v1"",""created"":""Thu, 27 Mar 2008 17:24:36 GMT""},{""version"":""v2"",""created"":""Sun, 6 Apr 2008 17:25:27 GMT""},{""version"":""v3"",""created"":""Mon, 23 Jun 2008 17:14:55 GMT""}]","2009-11-13"
"0803.3952","Federico Elias","Sergiy Silich, Federico Elias and Jos\'e Franco","On the origin of the neutral hydrogen supershells: the ionized
  progenitors and the limitations of the multiple supernovae hypothesis","Accepted for publication in ApJ, tentatively scheduled for the ApJ
  July 1, 2008, v681n1 issue. 19 pages, 4 figures",,"10.1086/588210",,"astro-ph","http://arxiv.org/licenses/nonexclusive-distrib/1.0/","  Here we address the question whether the ionized shells associated with giant
HII regions can be progenitors of the larger HI shell-like objects found in the
Milky Way and other spiral and dwarf irregular galaxies. We use for our
analysis a sample of 12 HII shells presented recently by Rela\~no et al. (2005,
2007). We calculate the evolutionary tracks that these shells would have if
their expansion is driven by multiple supernovae explosions from the parental
stellar clusters. We find, contrary to Rela\~no et al. (2007), that the
evolutionary tracks of their sample HII shells are inconsistent with the
observed parameters of the largest and most massive neutral hydrogen
supershells. We conclude that HII shells found inside giant HII regions may
represent the progenitors of small or intermediate HI shells, however they
cannot evolve into the largest HI objects unless, aside from the multiple
supernovae explosions, an additional energy source contributes to their
expansion.
","[{""version"":""v1"",""created"":""Thu, 27 Mar 2008 19:11:15 GMT""}]","2009-11-13"
"0803.3960","Huey-Wen Lin","Robert G. Edwards, B\'alint Jo\'o, Huey-Wen Lin","Tuning for Three-flavors of Anisotropic Clover Fermions with Stout-link
  Smearing","23 pages, 18 figures","Phys.Rev.D78:054501,2008","10.1103/PhysRevD.78.054501","JLAB-THY-08-806","hep-lat","http://creativecommons.org/licenses/by-nc-sa/3.0/","  In this work we perform the parameter tuning of three flavors of dynamical
clover quarks on anisotropic lattices. The fermion action uses
three-dimensional spatial stout-link smearing. The gauge anisotropy is
determined in a small box with Schr\""odinger background using Wilson-loop
ratios. The fermion anisotropy is obtained from studying the meson dispersion
relation with antiperiodic boundary conditions in the time direction. The
spatial and temporal clover coefficients are fixed to the tree-level
tadpole-improved values, and we demonstrate that they satisfy the
nonperturbative conditions as determined by the Schr\""odinger functional
method. For the desired lattice spacing $a_s\approx 0.12$ fm and renormalized
anisotropy $\xi=3.5$, we find the gauge and fermionic anisotropies can be fixed
to quark mass independent values up through the strange quark mass. This work
lays the foundation needed for further studies of the excited-state hadron
spectrum.
","[{""version"":""v1"",""created"":""Thu, 27 Mar 2008 19:59:58 GMT""},{""version"":""v2"",""created"":""Thu, 27 Mar 2008 21:42:28 GMT""}]","2009-01-09"
"0803.3963","Martin Hohenadler","Markus Aichhorn, Martin Hohenadler, Charles Tahan, Peter B. Littlewood","Quantum Fluctuations, Temperature and Detuning Effects in Solid-Light
  Systems","4 pages, 4 figures, to appear in Phys. Rev. Letters","Phys. Rev. Lett. 100, 216401 (2008)","10.1103/PhysRevLett.100.216401",,"cond-mat.other quant-ph","http://arxiv.org/licenses/nonexclusive-distrib/1.0/","  The superfluid to Mott insulator transition in cavity polariton arrays is
analyzed using the variational cluster approach, taking into account quantum
fluctuations exactly on finite length scales. Phase diagrams in one and two
dimensions exhibit important non-mean-field features. Single-particle
excitation spectra in the Mott phase are dominated by particle and hole bands
separated by a Mott gap. In contrast to Bose-Hubbard models, detuning allows
for changing the nature of the bosonic particles from quasi-localized excitons
to polaritons to weakly interacting photons. The Mott state with density one
exists up to temperatures $T/g\gtrsim0.03$, implying experimentally accessible
temperatures for realistic cavity couplings $g$.
","[{""version"":""v1"",""created"":""Thu, 27 Mar 2008 16:00:00 GMT""},{""version"":""v2"",""created"":""Tue, 20 May 2008 11:05:44 GMT""}]","2009-09-17"
"0803.3965","Joaquim Gomis","Joaquim Gomis and Jerzy Lukierski","Enlarged NH symmetries: Particle Dynamics and Gauge Symmetries","13 pages, Latex","Phys.Lett.B664:107-111,2008","10.1016/j.physletb.2008.05.005",,"hep-th","http://arxiv.org/licenses/nonexclusive-distrib/1.0/","  We show how the Newton-Hooke (NH) symmetries, representing a nonrelativistic
version of de-Sitter symmetries, can be enlarged by a pair of translation
vectors describing in Galilean limit the class of accelerations linear in time.
We study the Cartan-Maurer one-forms corresponding to such enlarged NH symmetry
group and by using cohomological methods we determine the general 2-parameter
(in D=2+1 4-parameter)central extension of the corresponding Lie algebra. We
derive by using nonlinear realizations method the most general group -
invariant particle dynamics depending on two (in D=2+1 on four) central charges
occurring as the Lagrangean parameters. Due to the presence of gauge
invariances we show that for the enlarged NH symmetries quasicovariant dynamics
reduces to the one following from standard NH symmetries, with one central
charge in arbitrary dimension D and with second exotic central charge in D=2+1.
","[{""version"":""v1"",""created"":""Thu, 27 Mar 2008 16:26:11 GMT""}]","2008-11-26"
"0803.3969","Alban Ponse","Jan A. Bergstra and Inge Bethke and Alban Ponse","Cancellation Meadows: a Generic Basis Theorem and Some Applications","24 pages, 6 tables; Inge Bethke is added as an extra author; new
  title (previous title: A Generic Basis Theorem for Cancellation Meadows)","The Computer Journal 56(1): 3-14, 2013","10.1093/comjnl/bxs028",,"math.RA cs.LO","http://arxiv.org/licenses/nonexclusive-distrib/1.0/","  Let Q_0 denote the rational numbers expanded to a ""meadow"", that is, after
taking its zero-totalized form (0^{-1}=0) as the preferred interpretation. In
this paper we consider ""cancellation meadows"", i.e., meadows without proper
zero divisors, such as $Q_0$ and prove a generic completeness result. We apply
this result to cancellation meadows expanded with differentiation operators,
the sign function, and with floor, ceiling and a signed variant of the square
root, respectively. We give an equational axiomatization of these operators and
thus obtain a finite basis for various expanded cancellation meadows.
","[{""version"":""v1"",""created"":""Thu, 27 Mar 2008 16:01:31 GMT""},{""version"":""v2"",""created"":""Sun, 30 Mar 2008 23:03:41 GMT""},{""version"":""v3"",""created"":""Wed, 22 May 2013 13:17:07 GMT""}]","2013-05-23"
"0803.3970","Darius Jurciukonis","D. Jurciukonis, E. Norvaisas","Noncanonicaly Embedded Rational Map Soliton in Quantum SU(3) Skyrme
  Model","11 RevTex4 pages, no figures","J.Phys.Conf.Ser.128:012007,2008","10.1088/1742-6596/128/1/012007",,"hep-th math-ph math.MP","http://arxiv.org/licenses/nonexclusive-distrib/1.0/","  The quantum Skyrme model is considered in non canonical bases SU(3) > SO(3)
for the state vectors. A rational map ansatz is used to describe the soliton
with the topological number bigger than one. The canonical quantization of the
Lagrangian generates in Hamiltonian five different ""moments of inertia"" and
negative quantum mass corrections, which can stabilize the quantum soliton
solution. Explicit expressions of the quantum Lagrangian and the Hamiltonian
are derived for this model soliton.
","[{""version"":""v1"",""created"":""Thu, 27 Mar 2008 16:03:12 GMT""}]","2008-11-26"
"0803.3971","A. Peter Young","A.P. Young, S. Knysh, V. N. Smelyanskiy","Size dependence of the minimum excitation gap in the Quantum Adiabatic
  Algorithm","4 pages, 5 figures","Phys. Rev. Lett. 101, 170503 (2008)","10.1103/PhysRevLett.101.170503",,"cond-mat.dis-nn cond-mat.stat-mech quant-ph","http://arxiv.org/licenses/nonexclusive-distrib/1.0/","  We study the typical (median) value of the minimum gap in the quantum version
of the Exact Cover problem using Quantum Monte Carlo simulations, in order to
understand the complexity of the quantum adiabatic algorithm (QAA) for much
larger sizes than before. For a range of sizes, N <= 128, where the classical
Davis-Putnam algorithm shows exponential median complexity, the QAA shows
polynomial median complexity. The bottleneck of the algorithm is an isolated
avoided crossing point of a Landau-Zener type (collision between the two lowest
energy levels only).
","[{""version"":""v1"",""created"":""Thu, 27 Mar 2008 16:04:37 GMT""},{""version"":""v2"",""created"":""Thu, 23 Oct 2008 16:06:42 GMT""}]","2009-11-13"
"0803.3972","J\""urgen Piest","J. Piest","Problem with the derivation of the Navier-Stokes equation by means of
  Zwanzig-Mori technique: Correction and solution","8 pages, no figures; prepared with Scientific Word",,,,"physics.gen-ph physics.flu-dyn","http://arxiv.org/licenses/nonexclusive-distrib/1.0/","  The derivation of the Navier-Stokes equation starting from the Liouville
equation using projector techniques yields a friction term which is nonlinear
in the velocity. As has been explained in the 1. version of this paper, when
the second-order part of the term is non-zero, this leads to an incorrect
formula for the equation.
  In this 2. version, it is shown that the problem is due to an inadequate
treatment of one of the correlation functions appearing . Repeating the
calculation leads to zero second-order part. The Navier-Stokes equation is
correctly derived by projection operator technique.
","[{""version"":""v1"",""created"":""Thu, 27 Mar 2008 16:07:11 GMT""},{""version"":""v2"",""created"":""Thu, 6 Nov 2008 14:22:18 GMT""}]","2013-04-30"
"0803.3973","Agapitos Hatzinikitas","Agapitos Hatzinikitas and Jiannis K. Pachos","One dimensional stable probability density functions for rational index
  $\bf 0<\alpha \leq 2$","22 pages, 1 figure","Annals of Physics, Vol. 323, Issue 12, (2008) 3000-3019","10.1016/j.aop.2008.06.004",,"math-ph hep-th math.MP","http://arxiv.org/licenses/nonexclusive-distrib/1.0/","  Fox's H-function provide a unified and elegant framework to tackle several
physical phenomena. We solve the space fractional diffusion equation on the
real line equipped with a delta distribution initial condition and identify the
corresponding H-function by studying the small $x$ expansion of the solution.
The asymptotic expansions near zero and infinity are expressed, for rational
values of the index $\alpha$, in terms of a finite series of generalized
hypergeometric functions. In $x$-space, the $\alpha=1$ stable law is also
derived by solving the anomalous diffusion equation with an appropriately
chosen infinitesimal generator for time translations. We propose a new
classification scheme of stable laws according to which a stable law is now
characterized by a generating probability density function. Knowing this
elementary probability density function and bearing in mind the infinitely
divisible property we can reconstruct the corresponding stable law. Finally,
using the asymptotic behavior of H-function in terms of hypergeometric
functions we can compute closed expressions for the probability density
functions depending on their parameters $\alpha, \beta, c, \tau $. Known cases
are then reproduced and new probability density functions are presented.
","[{""version"":""v1"",""created"":""Thu, 27 Mar 2008 16:27:32 GMT""},{""version"":""v2"",""created"":""Fri, 25 Apr 2008 08:46:07 GMT""}]","2009-11-13"
"0803.3974","Chase Zachary","Chase E. Zachary, Frank H. Stillinger, Salvatore Torquato","Gaussian core model phase diagram and pair correlations in high
  Euclidean dimensions","23 pages, 8 figures, 1 table",,"10.1063/1.2928843",,"cond-mat.stat-mech","http://arxiv.org/licenses/nonexclusive-distrib/1.0/","  The physical properties of a classical many-particle system with interactions
given by a repulsive Gaussian pair potential are extended to arbitrarily high
Euclidean dimensions. The goals of this paper are to characterize the behavior
of the pair correlation function (pcf) in various density regimes and to
understand the phase properties of the Gaussian core model (GCM) as
parametrized by dimension d. To this end, we explore the fluid and crystalline
solid phases. For the dilute regime of the fluid phase, a cluster expansion of
the pcf in reciprocal temperature is presented, the coefficients of which may
be evaluated analytically due to the nature of the Gaussian potential. We
present preliminary results concerning the convergence properties of this
expansion. The analytical cluster expansion is related to numerical
approximations for the pcf in the dense fluid regime by utilizing hypernetted
chain, Percus-Yevick, and mean-field closures to the Ornstein-Zernike equation.
Based on the results of these comparisons, we provide evidence in support of a
decorrelation principle for the GCM in high Euclidean dimensions. In the solid
phase, we consider the behavior of the freezing temperature in the limit of
zero density and show that it approaches zero itself in this limit for any d
via a collective coordinate argument. Duality relations with respect to the
energies of a lattice and its dual are then discussed, and these relations aid
in the Maxwell double-tangent construction of phase coexistence regions between
dual lattices based on lattice summation energies. The results from this
analysis are used to draw conclusions about the ground-state structures of the
GCM for a given dimension.
","[{""version"":""v1"",""created"":""Thu, 27 Mar 2008 16:33:06 GMT""}]","2009-11-13"
"0803.3975","Jancu Jean-Marc","J.-M. Jancu, J.-Ch. Girard, M. Nestoklon, A. Lemaitre, F. Glas, Z.Z.
  Wang","STM images of sub-surface Mn atoms in GaAs: evidence of hybridization of
  surface and impurity states",,,"10.1103/PhysRevLett.101.196801",,"cond-mat.mtrl-sci","http://arxiv.org/licenses/nonexclusive-distrib/1.0/","  We prove that scanning tunneling microscopy (STM) images of sub-surface Mn
atoms in GaAs are formed by hybridization of the impurity state with intrinsic
surface states. They cannot be interpreted in terms of bulk-impurity
wavefunction imaging. High atomic resolution images obtained using a
low-temperature apparatus are compared with advanced, parameter-free
tight-binding simulations accounting for both the buckled (110) surface and
vacuum electronic properties.
","[{""version"":""v1"",""created"":""Thu, 27 Mar 2008 16:36:30 GMT""}]","2009-11-13"
"0803.3976","David Sevilla","Jaime Gutierrez, David Sevilla","On Ritt's decomposition Theorem in the case of finite fields","13 pages. v2: added comment from reader and additional references","Finite Fields Appl. 12 (2006), no. 3, 403--412. MR2229324
  (2007a:13024)","10.1016/j.ffa.2005.08.004",,"cs.SC math.AC","http://arxiv.org/licenses/nonexclusive-distrib/1.0/","  A classical theorem by Ritt states that all the complete decomposition chains
of a univariate polynomial satisfying a certain tameness condition have the
same length. In this paper we present our conclusions about the generalization
of these theorem in the case of finite coefficient fields when the tameness
condition is dropped.
","[{""version"":""v1"",""created"":""Thu, 27 Mar 2008 16:39:03 GMT""},{""version"":""v2"",""created"":""Thu, 10 Apr 2008 09:01:01 GMT""}]","2008-04-10"
"0803.3977","Atsuo Okazaki","Atsuo T. Okazaki, Stanley P. Owocki, Christopher M. P. Russell and
  Michael F. Corcoran","3-D SPH simulations of colliding winds in eta Carinae","6 pages, 3 figures, To be published in Proceedings of IAU Symposium
  250: Massive Stars as Cosmic Engines, held in Kauai, Hawaii, USA, Dec 2007,
  edited by F. Bresolin, P.A. Crowther & J. Puls (Cambridge University Press)",,"10.1017/S1743921308020413",,"astro-ph","http://arxiv.org/licenses/nonexclusive-distrib/1.0/","  We study colliding winds in the superluminous binary eta Carinae by
performing three-dimensional, Smoothed Particle Hydrodynamics (SPH)
simulations. For simplicity, we assume both winds to be isothermal. We also
assume that wind particles coast without any net external forces. We find that
the lower density, faster wind from the secondary carves out a spiral cavity in
the higher density, slower wind from the primary. Because of the
phase-dependent orbital motion, the cavity is very thin on the periastron side,
whereas it occupies a large volume on the apastron side. The model X-ray light
curve using the simulated density structure fits very well with the observed
light curve for a viewing angle of i=54 degrees and phi=36 degrees, where i is
the inclination angle and phi is the azimuth from apastron.
","[{""version"":""v1"",""created"":""Thu, 27 Mar 2008 16:39:27 GMT""}]","2009-11-13"
