"0803.3998","Andrew K. Waldron","S. Carlip, S. Deser, A. Waldron and D.K. Wise","Cosmological Topologically Massive Gravitons and Photons","36 pages, 1 figure. v2: Expanded; exhibits localized normalizable
  wave packets and exact chiral pp-wave solutions. v3: Added references;
  clarification on bulk vs. boundary chirality. v4: Published version; changes
  include discussion of bulk solutions' asymptotic acceptability at all mu","Class.Quant.Grav.26:075008,2009","10.1088/0264-9381/26/7/075008",,"hep-th gr-qc","http://arxiv.org/licenses/nonexclusive-distrib/1.0/","  We study topologically massive (2+1)-dimensional gravity with a negative
cosmological constant. The masses of the linearized curvature excitations about
AdS_3 backgrounds are not only shifted from their flat background values but,
more surprisingly, split according to chirality. For all finite values of the
topological mass, we find a single bulk degree of freedom with positive energy,
and exhibit a complete set of normalizable, finite-energy wave packet
solutions. This model can also be written as a sum of two higher-derivative
SL(2,R) Chern--Simons theories, weighted by the central charges of the boundary
conformal field theory. At two particular ""critical"" values of the couplings,
one of these central charges vanishes, and linearized topologically massive
gravity becomes equivalent to topologically massive electromagnetism; however,
the physics of the bulk wave packets remains unaltered here.
","[{""version"":""v1"",""created"":""Thu, 27 Mar 2008 19:00:57 GMT""},{""version"":""v2"",""created"":""Thu, 29 May 2008 17:37:19 GMT""},{""version"":""v3"",""created"":""Thu, 28 Aug 2008 18:33:43 GMT""},{""version"":""v4"",""created"":""Thu, 30 Apr 2009 04:25:00 GMT""}]","2010-04-28"
"0803.3999","Keisuke Okamura","Keisuke Okamura","Aspects of Integrability in AdS/CFT Duality","301 pages, Ph.D thesis (revised), v2: Minor corrections and
  references added",,,"UT-08-03","hep-th","http://arxiv.org/licenses/nonexclusive-distrib/1.0/","  In this dissertation, we discuss how our understanding of the large-N
spectrum of AdS/CFT has been deepened by integrability-based approaches. We
begin with a comprehensive review of the integrability of the gauge theory
spin-chain and that of the string sigma model. In the light of the AdS/CFT
duality, they should be just two ways of describing the same underlying
integrability, and it is believed that the unified integrability can be
characterised by a set of Bethe ansatz equations which is valid for all values
of the 't Hooft coupling. By studying the asymptotic spectrum of the AdS/CFT in
the infinite spin/R-charge limit, we first identify the corresponding solitonic
counterparts in the context of the AdS/CFT, which are the so-called dyonic
giant magnons and the SYM magnon boundstates. Then we show that the S-matrix
computed directly from the string solitons scattering precisely reproduces the
prediction from the conjecture. We further perform an analyticity test by
studying the singularities of the conjectured magnon boundstate S-matrix and
checking the physicality conditions. These tests give strong positive supports
for the integrability of large-N AdS/CFT as well as the specific form of the
conjectured Bethe ansatz equations. Concerning the string theory integrability,
we also provide a detailed study of certain classical string solutions on AdS_5
x S^5. These are constructed in such a way they correspond to generic soliton
solutions of (Complex) sine/sinh-Gordon equations via the so-called Pohlmeyer
reduction procedure. Furthermore, we describe them in terms of
algebro-geometric data as finite-gap solutions, giving a complete map of the
elliptic string solutions.
","[{""version"":""v1"",""created"":""Thu, 27 Mar 2008 17:46:47 GMT""},{""version"":""v2"",""created"":""Mon, 7 Apr 2008 13:50:27 GMT""}]","2008-04-07"
"0803.4000","Jurjen Koksma","Jurjen F. Koksma (UU) Tomislav Prokopec (UU)","Effect of the Trace Anomaly on the Cosmological Constant","18 pages, 11 figures, published version","Phys.Rev.D78:023508,2008","10.1103/PhysRevD.78.023508","ITP-UU-08/08, SPIN-08/08","gr-qc astro-ph hep-th","http://arxiv.org/licenses/nonexclusive-distrib/1.0/","  It has been argued that the quantum (conformal) trace anomaly could
potentially provide us with a dynamical explanation of the cosmological
constant problem. In this paper, however, we show by means of a semiclassical
analysis that the trace anomaly does not affect the cosmological constant. We
construct the effective action of the conformal anomaly for flat FLRW
spacetimes consisting of local quadratic geometric curvature invariants.
Counterterms are thus expected to influence the numerical value of the
coefficients in the trace anomaly and we must therefore allow these parameters
to vary. We calculate the evolution of the Hubble parameter in quasi de Sitter
spacetime, where we restrict our Hubble parameter to vary slowly in time, and
in FLRW spacetimes. We show dynamically that a Universe consisting of matter
with a constant equation of state, a cosmological constant and the quantum
trace anomaly evolves either to the classical de Sitter attractor or to a
quantum trace anomaly driven one. When considering the trace anomaly truncated
to quasi de Sitter spacetime, we find a region in parameter space where the
quantum attractor destabilises. When considering the exact expression of the
trace anomaly, a stability analysis shows that whenever the trace anomaly
driven attractor is stable, the classical de Sitter attractor is unstable, and
vice versa. Semiclassically, the trace anomaly does not affect the classical
late time de Sitter attractor and hence it does not solve the cosmological
constant problem.
","[{""version"":""v1"",""created"":""Thu, 27 Mar 2008 19:52:33 GMT""},{""version"":""v2"",""created"":""Wed, 6 Aug 2008 13:20:59 GMT""}]","2008-11-26"
"0803.4001","Christopher Wipf","Christopher Wipf, Thomas Corbitt, Yanbei Chen, Nergis Mavalvala","A route to observing ponderomotive entanglement with optically trapped
  mirrors","4 pages, 4 figures",,"10.1088/1367-2630/10/9/095017","LIGO-P070064","quant-ph","http://arxiv.org/licenses/nonexclusive-distrib/1.0/","  The radiation pressure of two detuned laser beams can create a stable trap
for a suspended cavity mirror; here it is shown that such a configuration
entangles the output light fields via interaction with the mirror.
Intra-cavity, the opto-mechanical system can become entangled also. The degree
of entanglement is quantified spectrally using the logarithmic negativity.
Entanglement survives in the experimentally accessible regime of gram-scale
masses subject to thermal noise at room temperature.
","[{""version"":""v1"",""created"":""Thu, 27 Mar 2008 19:54:12 GMT""}]","2009-11-13"
"0803.4002","Thomas A. Trainor","Thomas A. Trainor","Azimuth quadrupole component spectra on transverse rapidity ${\bf y_t}$
  for identified hadrons from Au-Au collisions at $\sqrt{s_{NN}} =$ 200 GeV","22 pages, 17 figures","Phys.Rev.C78:064908,2008","10.1103/PhysRevC.78.064908",,"hep-ph","http://arxiv.org/licenses/nonexclusive-distrib/1.0/","  I present the first isolation of azimuth quadrupole components from published
$v_2(p_t)$ data (called elliptic flow) as spectra on transverse rapidity $y_t$
for identified pions, kaons and lambdas/protons from minimum-bias Au-Au
collisions at 200 GeV. The form of the spectra on $y_t$ indicates that the
three hadron species are emitted from a common boosted source with boost
$\Delta y_{t0} \sim 0.6$. The quadrupole spectra have a L\'evy form similar to
the soft component of the single-particle spectrum, but with significantly
reduced ($\sim 0.7\times$) slope parameters $T$. Comparison of quadrupole
spectra with single-particle spectra suggests that the quadrupole component
comprises a small fraction ($< 5$%) of the total hadron yield, contradicting
the hydrodynamic picture of a thermalized, flowing bulk medium. The form of
$v_2(p_t)$ is, within a constant factor, the product of $p'_t$ ($p_t$ in the
boost frame) times the ratio of quadrupole spectrum to single-particle
spectrum. That ratio in turn implies that above 0.5 GeV/c the form of
$v_2(p_t)$ is dominated by the hard component of the single-particle spectrum
(interpreted as due to minijets). It is therefore unlikely that so-called {\em
constituent-quark scaling} attributed to $v_2$ is relevant to soft hadron
production mechanisms (e.g., chemical freezeout).
","[{""version"":""v1"",""created"":""Thu, 27 Mar 2008 23:00:38 GMT""},{""version"":""v2"",""created"":""Mon, 22 Sep 2008 22:50:09 GMT""},{""version"":""v3"",""created"":""Wed, 19 Nov 2008 01:24:18 GMT""}]","2009-01-08"
"0803.4003","Rupert Croft","Rupert A.C. Croft (1), Tiziana Di Matteo (1), Volker Springel (2),
  Lars Hernquist (3) ((1) McWilliams Center for Cosmology, Carnegie Mellon, (2)
  Max Planck Institute for Astrophysics, (3) Harvard CfA)","Galaxy morphology, kinematics and clustering in a hydrodynamic
  simulation of a LambdaCDM universe","25 pages, 15 figures, submitted to MNRAS",,"10.1111/j.1365-2966.2009.15446.x",,"astro-ph","http://arxiv.org/licenses/nonexclusive-distrib/1.0/","  We explore galaxy properties and their link with environment and clustering
using a population of ~1000 galaxies formed in a high resolution hydrodynamic
simulation of the Lambda CDM cosmology. At the redshift we concentrate on, z=1,
the spatial resolution is 1.4 proper kpc/h and Milky-way sized disk galaxies
contain ~10^5 particles within their virial radii. We include supermassive
black hole accretion and feedback as well as a multiphase model for star
formation. We find that a number of familiar qualitative relationships hold
approximately between galaxy properties, for example, galaxies lie between two
broad extremes of type, where ``late'' types tend to be smaller in size, have
lower circular velocities, younger stars, higher star formation rates, larger
disk to bulge ratios and lower Sersic indices than ``early types''. As in
previous studies the stellar component of disk galaxies is not as rotationally
supported as in observations. Bulges contain too much of the stellar mass,
although disks do have scale lengths compatible with observations. The addition
of black hole physics to the simulations does not appear to have an impact on
the angular momentum results, nor do we find that it is affected in an
identical simulation with significantly lower mass resolution. Despite this, we
can profitably use the rank order of either disk to total ratio, Sersic index,
or galaxy age to separate galaxies into morphological classes and examine the
density-morphology relation and morphology dependence of clustering. We find
that while at redshift z=0, the well known preponderance of early types in
dense environments is seen, at z=1 the density-morphology relation becomes
flatter and late type galaxies are even seen to have a higher clustering
amplitude than early types (abridged).
","[{""version"":""v1"",""created"":""Thu, 27 Mar 2008 20:06:49 GMT""}]","2015-05-13"
"0803.4004","Adam Miller","Adam A. Miller (1), Jonathan Irwin (2), Suzanne Aigrain (3), Simon
  Hodgkin (4), Leslie Hebb (5) (1. UC Berkeley, 2. CfA, 3. University of
  Exeter, 4. IoA - Cambridge, 5. University of St. Andrews)","The Monitor project: the search for transits in the open cluster NGC
  2362","17 pages, 11 figures, accepted to MNRAS","Mon.Not.Roy.Astron.Soc.387:349,2008","10.1111/j.1365-2966.2008.13236.x",,"astro-ph","http://arxiv.org/licenses/nonexclusive-distrib/1.0/","  We present the results of a systematic search for transiting planets in a ~5
Myr open cluster, NGC 2362. We observed ~1200 candidate cluster members, of
which ~475 are believed to be genuine cluster members, for a total of ~100
hours. We identify 15 light curves with reductions in flux that pass all our
detection criteria, and 6 of the candidates have occultation depths compatible
with a planetary companion. The variability in these six light curves would
require very large planets to reproduce the observed transit depth. If we
assume that none of our candidates are in fact planets then we can place upper
limits on the fraction of stars with hot Jupiters (HJs) in NGC 2362. We obtain
99% confidence upper limits of 0.22 and 0.70 on the fraction of stars with HJs
(f_p) for 1-3 and 3-10 day orbits, respectively, assuming all HJs have a
planetary radius of 1.5R_Jup. These upper limits represent observational
constraints on the number of stars with HJs at an age <~10 Myr, when the vast
majority of stars are thought to have lost their protoplanetary discs. Finally,
we extend our results to the entire Monitor Project, a survey searching young,
open clusters for planetary transits, and find that the survey as currently
designed should be capable of placing upper limits on f_p near the observed
values of f_p in the solar neighbourhood.
","[{""version"":""v1"",""created"":""Fri, 28 Mar 2008 08:34:08 GMT""}]","2011-02-01"
"0803.4005","Kathryn Zurek","Frank J. Petriello, Seth Quackenbush, Kathryn M. Zurek","The Invisible Z' at the LHC","18 pages, 11 figures. References added","Phys.Rev.D77:115020,2008","10.1103/PhysRevD.77.115020",,"hep-ph","http://arxiv.org/licenses/nonexclusive-distrib/1.0/","  We study the feasibility of observing an invisibly decaying Z' at the LHC
through the process pp -> ZZ' -> l+l-XX*, where X is any neutral, (quasi-)
stable particle, whether a Standard Model (SM) neutrino or a new state. The
measurement of the invisible width through this process facilitates both a
model independent measurement of Gamma_{Z' -> \bar{nu} nu} and potentially
detection of light neutral hidden states. Such particles appear in many models
where the Z' is a messenger to a hidden sector, and also if dark matter is
charged under the U(1)' of the Z'. We find that with as few as 30 fb^-1 of data
the invisibly decaying Z' can be observed at 5 sigma over SM background for a 1
TeV Z' with reasonable couplings. If the Z' does not couple to leptons and
therefore cannot be observed in the Drell-Yan channel, this process becomes a
discovery mode. For reasonable hidden sector couplings, masses up to 2 TeV can
be probed at the LHC. If the Z' does couple to leptons, then the rate for this
invisible decay is predicted by on-peak data and the presence of additional
hidden states can be searched for. With 100 fb^-1 of data, the presence of
excess decays to hidden states can be excluded at 95% C.L. if they comprise
20-30% of the total invisible cross section.
","[{""version"":""v1"",""created"":""Thu, 27 Mar 2008 20:11:51 GMT""},{""version"":""v2"",""created"":""Thu, 12 Jun 2008 16:33:39 GMT""}]","2008-11-26"
"0803.4007","John Teufel","J. D. Teufel, C. A. Regal, K. W. Lehnert","Prospects for cooling nanomechanical motion by coupling to a
  superconducting microwave resonator","6 pages, 6 figures","J. D. Teufel et al, New J. Phys. 10, 095002, 2008","10.1088/1367-2630/10/9/095002",,"cond-mat.mes-hall","http://arxiv.org/licenses/nonexclusive-distrib/1.0/","  Recent theoretical work has shown that radiation pressure effects can in
principle cool a mechanical degree of freedom to its ground state. In this
paper, we apply this theory to our realization of an opto-mechanical system in
which the motion of mechanical oscillator modulates the resonance frequency of
a superconducting microwave circuit. We present experimental data demonstrating
the large mechanical quality factors possible with metallic, nanomechanical
beams at 20 mK. Further measurements also show damping and cooling effects on
the mechanical oscillator due to the microwave radiation field. These data
motivate the prospects for employing this dynamical backaction technique to
cool a mechanical mode entirely to its quantum ground state.
","[{""version"":""v1"",""created"":""Thu, 27 Mar 2008 20:26:28 GMT""},{""version"":""v2"",""created"":""Mon, 31 Mar 2008 19:22:05 GMT""},{""version"":""v3"",""created"":""Wed, 23 Jul 2008 18:00:05 GMT""},{""version"":""v4"",""created"":""Thu, 6 Nov 2008 18:29:14 GMT""}]","2008-11-06"
"0803.4009","T. Senthil","T. Senthil","Critical fermi surfaces and non-fermi liquid metals","15 pages, 7 figures; some clarificatory remarks/references added and
  typos fixed","Phys. Rev. B 78, 035103 (2008).","10.1103/PhysRevB.78.035103",,"cond-mat.str-el","http://arxiv.org/licenses/nonexclusive-distrib/1.0/","  At certain quantum critical points in metals an entire Fermi surface may
disappear. A crucial question is the nature of the electronic excitations at
the critical point. Here we provide arguments showing that at such quantum
critical points the Fermi surface remains sharply defined even though the
Landau quasiparticle is absent. The presence of such a critical Fermi surface
has a number of consequences for the universal phenomena near the quantum
critical point which are discussed. In particular the structure of scaling of
the universal critical singularities can be significantly modified from more
familiar criticality. Scaling hypotheses appropriate to a critical fermi
surface are proposed. Implications for experiments on heavy fermion critical
points are discussed. Various phenomena in the normal state of the cuprates are
also examined from this perspective. We suggest that a phase transition that
involves a dramatic reconstruction of the Fermi surface might underlie a number
of strange observations in the metallic states above the superconducting dome.
","[{""version"":""v1"",""created"":""Fri, 28 Mar 2008 15:30:39 GMT""},{""version"":""v2"",""created"":""Mon, 7 Apr 2008 14:49:36 GMT""}]","2009-11-13"
"0803.4010","Adalto Gomes","M. M. Ferreira Jr. (UFMA), A.R. Gomes (CEFET-Ma)","Lorentz violating effects on a quantized two-level system","9 pages, 3 figures",,,,"hep-th","http://arxiv.org/licenses/nonexclusive-distrib/1.0/","  In this work, we consider the effects of the Lorentz-violating (LV) term $
v_{\mu}\bar{\psi}\gamma ^{\mu}\psi $ belonging to the fermion sector of the
extended standard model on the dynamics of a quantum two-level system. We
examine how its non-relativistic counterpart, ${(\mathbf{p}-e \mathbf{A})\cdot
}\mathbf{v}/{m_{e},}$ affects the Rabi oscillations of a two-level atom coupled
with a quantum cavity electromagnetic field. Taking an initial coherent field
state in a resonant cavity, it was found that the LV background increases the
Rabi frequency and the time interval between collapses and revivals of the
population inversion function. It was found that initial field states with low
mean number of photons are better probes in order to establish more stringent
upper bounds on the background magnitude. In particular, for an initial vacuum
state in the cavity the upper limit $\text{v}_{x}<10^{-10}eV$ was attained.
","[{""version"":""v1"",""created"":""Thu, 27 Mar 2008 22:47:26 GMT""}]","2008-03-31"
"0803.4011","Jacco Vink","J. Vink (Utrecht University)","The Kinematics of Kepler's Supernova Remnant as revealed by Chandra","Accepted for publication in ApJ. This new version is the accepted
  version, which differs mainly in the discussion section",,"10.1086/592375",,"astro-ph","http://arxiv.org/licenses/nonexclusive-distrib/1.0/","  I determine the expansion of the supernova remnant of SN1604 (Kepler's
supernova) based on archival Chandra ACIS-S observations made in 2000 and 2006.
The measurements were done in several distinct energy bands, and were made for
the remnant as a whole, and for six individual sectors. The average expansion
parameter indicates that the remnant expands as $r \propto t^{0.5}$, but there
are significant differences in different parts of the remnant: the bright
northwestern part expands as $r \propto t^{0.35}$, whereas the rest of the
remnant's expansion shows an expansion $r \propto t^{0.6}$. The latter is
consistent with an explosion in which the outer part of the ejecta has a
negative power law slope for density ($\rho \propto v^{-n}$) of $n=7$, or with
an exponential density profile($\rho \propto \exp(-v/v_e)$). The expansion
parameter in the southern region, in conjunction with the shock radius,
indicate a rather low value (<5E50 erg) for the explosion energy of SN1604 for
a distance of 4 kpc. An higher explosion energy is consistent with the results,
if the distance is larger.
  The filament in the eastern part of the remnant, which is dominated by X-ray
synchrotron radiation seems to mark a region with a fast shock speed $r \propto
t^{0.7}$, corresponding to a shock velocity of v= 4200 km/s, for a distance to
SN1604 of 4 kpc. This is consistent with the idea that X-ray synchrotron
emission requires shock velocities in excess of ~2000 km/s.
  The X-ray based expansion measurements reported are consistent with results
based on optical and radio measurements, but disagree with previous X-ray
measurements based on ROSAT and Einstein observations.
","[{""version"":""v1"",""created"":""Thu, 27 Mar 2008 20:28:34 GMT""},{""version"":""v2"",""created"":""Mon, 11 Aug 2008 10:44:37 GMT""}]","2009-11-13"
"0803.4012","Gerald A. Miller","L. Frankfurt, G.A Miller, M. Strikman","Color Transparency in Semi-Inclusive Electroproduction of rho Mesons","20 pages, 19 figures replacement adds references","Phys.Rev.C78:015208,2008","10.1103/PhysRevC.78.015208","NT@UW-08-07","nucl-th","http://arxiv.org/licenses/nonexclusive-distrib/1.0/","  We study the electroproduction of rho mesons in nuclei at intermediate
energies, deriving a treatment of the energy lost by the rho in each step of
multiple-scattering. This enables a close match between calculations and the
experimental kinematic conditions. A standard Glauber calculation is presented,
and then the effects of color-transparency are included. The influence of poor
experimental resolution on the extracted transparency is assessed. The effects
of $\rho$ meson decay inside the nucleus are examined, and are typically about
5 percent at most. This effect disappears rapidly as $Q^2$ increases from about
1 to 3 GeV$^2$, causing a rise in the transparency that is not attributable to
color transparency. The size of color transparency effects for C and Fe nuclei
is studied for values of $Q^2$ up to 10 GeV$^2$. The detailed results depend
strongly on the assumed value of the $\rho N$ cross section. The overall
effects of color transparency are greater than about 10 % for both nuclear
targets if $Q^2$ is greater than about 5 GeV$^2$.
","[{""version"":""v1"",""created"":""Thu, 27 Mar 2008 20:28:56 GMT""},{""version"":""v2"",""created"":""Thu, 3 Apr 2008 17:42:06 GMT""}]","2008-11-26"
"0803.4013","Salvatore Savasta","S. Savasta and O. Di Stefano","Classical Origin of the Spin of Relativistic Pointlike Particles and
  Geometric interpretation of Dirac Solutions",,,,,"quant-ph","http://arxiv.org/licenses/nonexclusive-distrib/1.0/","  Spin of elementary particles is the only kinematic degree of freedom not
having classical corre- spondence. It arises when seeking for the
finite-dimensional representations of the Lorentz group, which is the only
symmetry group of relativistic quantum field theory acting on
multiple-component quantum fields non-unitarily. We study linear
transformations, acting on the space of spatial and proper-time velocities
rather than on coordinates. While ensuring the relativistic in- variance, they
avoid these two exceptions: they describe the spin degree of freedom of a
pointlike particle yet at a classical level and form a compact group hence with
unitary finite-dimensional rep- resentations. Within this approach changes of
the velocity modulus and direction can be accounted for by rotations of two
independent unit vectors. Dirac spinors just provide the quantum description of
these rotations.
","[{""version"":""v1"",""created"":""Thu, 27 Mar 2008 20:46:47 GMT""}]","2008-03-31"
"0803.4014","Pedro Orellana","V.M. Apel, P.A. Orellana, M. Pacheco","Fano and Dicke effects and spin polarization in a double Rashba-ring
  system side coupled to a quantum wire","6 pages, 7 figures",,,,"cond-mat.mes-hall","http://arxiv.org/licenses/nonexclusive-distrib/1.0/","  The electronic transport in a system of two quantum rings side-coupled to a
quantum wire is studied via a single-band tunneling tight-binding Hamiltonian.
We derived analytical expressions for the conductance and spin polarization
when the rings are threaded by magnetic fluxes with Rashba spin-orbit
interaction. We show that by using the Fano and Dicke effects this system can
be used as an efficient spin-filter even for small spin orbit interaction and
small values of magnetic flux. We compare the spin-dependent polarization of
this design and the polarization obtained with one ring side coupled to a
quantum ring. As a main result, we find better spin polarization capabilities
as compared to the one ring design
","[{""version"":""v1"",""created"":""Thu, 27 Mar 2008 20:49:26 GMT""}]","2008-03-31"
