"0803.4097","Anna L. Watts","Anna Watts (MPA/Amsterdam), Badri Krishnan (AEI/MPG), Lars Bildsten
  (KITP/UCSB), Bernard Schutz (AEI/MPG)","Detecting gravitational wave emission from the known accreting neutron
  stars","Minor revisions, MNRAS accepted","Mon.Not.Roy.Astron.Soc.389:839-868,2008","10.1111/j.1365-2966.2008.13594.x",,"astro-ph gr-qc","http://arxiv.org/licenses/nonexclusive-distrib/1.0/","  Detection of gravitational waves from accreting neutron stars (NSs) in our
galaxy, due to ellipticity or internal oscillation, would be a breakthrough in
our understanding of compact objects and explain the absence of NSs rotating
near the break-up limit. Direct detection, however, poses a formidable
challenge. Using the current data available on the properties of the accreting
NSs in Low Mass X-Ray Binaries (LMXBs), we quantify the detectability for the
known accreting NSs, considering various emission scenarios and taking into
account the negative impact of parameter uncertainty on the data analysis
process. Only a few of the persistently bright NSs accreting at rates near the
Eddington limit are detectable by Advanced LIGO if they are emitting
gravitational waves at a rate matching the torque from accretion. A larger
fraction of the known population is detectable if the spin and orbital
parameters are known in advance, especially with the narrow-band Advanced LIGO.
We identify the most promising targets, and list specific actions that would
lead to significant improvements in detection probability. These include
astronomical observations (especially for unknown orbital periods),
improvements in data analysis algorithms and capabilities, and further detector
development.
","[{""version"":""v1"",""created"":""Fri, 28 Mar 2008 12:30:20 GMT""},{""version"":""v2"",""created"":""Tue, 17 Jun 2008 12:18:11 GMT""}]","2009-11-13"
"0803.4098","Angelo Felice Lopez","Andreas Leopold Knutsen and Angelo Felice Lopez","Brill-Noether theory of curves on Enriques surfaces I: the positive cone
  and gonality","To appear on Math.Z",,,,"math.AG math.AC","http://arxiv.org/licenses/nonexclusive-distrib/1.0/","  We study the existence of linear series on curves lying on an Enriques
surface and general in their complete linear system. Using a method that works
also below the Bogomolov-Reider range, we compute, in all cases, the gonality
of such curves. We also give a new result about the positive cone of line
bundles on an Enriques surface and we show how this relates to the gonality.
","[{""version"":""v1"",""created"":""Fri, 28 Mar 2008 12:25:31 GMT""}]","2008-03-31"
"0803.4099","Boncho Bonev","Boncho P . Bonev, Michael J. Mumma, Hideyo Kawakita, Hitomi Kobayashi,
  Geronimo L. Villanueva","IRCS/Subaru Observations of Water in the Inner Coma of Comet
  73P-B/Schwassmann-Wachmann 3: Spatially Resolved Rotational Temperatures and
  Ortho-Para Ratios","accepted for Icarus",,"10.1016/j.icarus.2008.02.023",,"astro-ph","http://arxiv.org/licenses/nonexclusive-distrib/1.0/","  Comet 73P-B/Schwassmann-Wachmann 3 was observed with IRCS/Subaru at
geocentric distance of 0.074 AU on UT 10 May 2006. Multiple H2O emission lines
were detected in non-resonant fluorescence near 2.9 microns. No significant
variation in total H2O production rate was found during the (3 hour) duration
of our observations. H2O rotational temperatures and ortho-to-para abundance
ratios were measured for several positions in the coma. The temperatures
extracted from two different time intervals show very similar spatial
distributions. For both, the rotational temperature decreased from ~110 K to
~90 K as the projected distance from the nucleus increased from ~5 to ~30 km.
We see no evidence for OPR change in the coma. The H2O ortho-para ratio is
consistent with the statistical equilibrium value (3.0) for all spatially
resolved measurements. This implies a nuclear spin temperature higher than ~ 45
K.
","[{""version"":""v1"",""created"":""Fri, 28 Mar 2008 12:27:58 GMT""}]","2009-11-13"
"0803.4100","Nial R. Tanvir","N. R. Tanvir, A. J. Levan, E. Rol, R. L. C. Starling, J. Gorosabel, R.
  S. Priddey, D. Malesani, P. Jakobsson, P. T. O'Brien, A. O. Jaunsen, J.
  Hjorth, J. P. U. Fynbo, A. Melandri, A. Gomboc, B. Milvang-Jensen, A. S.
  Fruchter, M. Jarvis, C. A. C. Fernandes, T. Wold","The extreme, red afterglow of GRB 060923A: Distance or dust?","Submitted to MNRAS (revised in light of referee's comments)","Mon.Not.Roy.Astron.Soc.388:1743-1750, 2008","10.1111/j.1365-2966.2008.13496.x",,"astro-ph","http://arxiv.org/licenses/nonexclusive-distrib/1.0/","  Gamma-ray bursts are powerful probes of the early universe, but locating and
identifying very distant GRBs remains challenging. We report here the discovery
of the K-band afterglow of Swift GRB 060923A, imaged within the first hour
post-burst, and the faintest so far found. It was not detected in any bluer
bands to deep limits, making it a candidate very high redshift burst (z>11).
However, our later-time optical imaging and spectroscopy reveal a faint galaxy
coincident with the GRB position which, if it is the host, implies a more
moderate redshift (most likely z<2.8) and therefore that dust is the likely
cause of the very red afterglow colour. This being the case, it is one of the
few instances so far found of a GRB afterglow with high dust extinction.
","[{""version"":""v1"",""created"":""Fri, 28 Mar 2008 12:31:23 GMT""}]","2009-06-23"
"0803.4101","G\'{a}bor J. Sz\'{e}kely","G\'abor J. Sz\'ekely, Maria L. Rizzo, Nail K. Bakirov","Measuring and testing dependence by correlation of distances","Published in at http://dx.doi.org/10.1214/009053607000000505 the
  Annals of Statistics (http://www.imstat.org/aos/) by the Institute of
  Mathematical Statistics (http://www.imstat.org)","Annals of Statistics 2007, Vol. 35, No. 6, 2769-2794","10.1214/009053607000000505","IMS-AOS-AOS0283","math.ST stat.TH","http://arxiv.org/licenses/nonexclusive-distrib/1.0/","  Distance correlation is a new measure of dependence between random vectors.
Distance covariance and distance correlation are analogous to product-moment
covariance and correlation, but unlike the classical definition of correlation,
distance correlation is zero only if the random vectors are independent. The
empirical distance dependence measures are based on certain Euclidean distances
between sample elements rather than sample moments, yet have a compact
representation analogous to the classical covariance and correlation.
Asymptotic properties and applications in testing independence are discussed.
Implementation of the test and Monte Carlo results are also presented.
","[{""version"":""v1"",""created"":""Fri, 28 Mar 2008 12:35:10 GMT""}]","2008-12-18"
"0803.4102","Fang-Yu Hong","Fang-Yu Hong and Shi-Jie Xiong","Proposal for a loophole-free Bell test with electron spins of donors","4 pages,4 figures",,"10.1103/PhysRevA.77.052113",,"quant-ph","http://arxiv.org/licenses/nonexclusive-distrib/1.0/","  So far, all experimental tests of Bell inequalities which must be satisfied
by all local realistic hidden-variable theories and are violated by quantum
mechanical predictions have left at least one loophole open. We propose a
feasible setup allowing for a loophole-free test of the Bell inequalities. Two
electron spin qubits of phosphorus donors in semiconductors in different
cavities 300 m apart are entangled through a bright coherent light and
postselections using homodyne measurements. The electron spins are then read
out randomly and independently by Alice and Bob, respectively, with unity
efficiency in less than 0.7$\mu$s by using optically induced spin to charge
transduction detected by radio-frequency single electron transistor. A
violation of Bell inequality larger than 37% and 18% is achievable provided
that the detection accuracy is 0.99 and 0.95, respectively.
","[{""version"":""v1"",""created"":""Fri, 28 Mar 2008 14:38:56 GMT""},{""version"":""v2"",""created"":""Fri, 14 Nov 2008 06:53:47 GMT""},{""version"":""v3"",""created"":""Thu, 26 Mar 2009 14:33:47 GMT""}]","2009-11-13"
"0803.4103","Jiri Bicak","Jiri Bicak and Bernd G. Schmidt","Helical Symmetry in Linear Systems","11 pages","Phys.Rev.D76:104040,2007","10.1103/PhysRevD.76.104040",,"gr-qc hep-th","http://arxiv.org/licenses/nonexclusive-distrib/1.0/","  We investigate properties of solutions of the scalar wave equation and
Maxwell's equations on Minkowski space with helical symmetry. Existence of
local and global solutions with this symmetry is demonstrated with and without
sources. The asymptotic properties of the solutions are analyzed. We show that
the Newman--Penrose retarded and advanced scalars exhibit specific symmetries
and generalized peeling properties.
","[{""version"":""v1"",""created"":""Fri, 28 Mar 2008 12:40:23 GMT""}]","2008-11-26"
"0803.4104","Alexander Andrianov A","A.A.Andrianov, D.Espriu","Parity doubling from Weinberg sum rules","4 pages","Phys.Lett.B671:275-279,2009","10.1016/j.physletb.2008.12.030",,"hep-ph","http://arxiv.org/licenses/nonexclusive-distrib/1.0/","  We investigate the relation among slopes and intercepts of Regge trajectories
for mesons of a given spin and different parities using large N_c arguments and
the matching to perturbative QCD in the deep-Minkowski region. For spin-1
mesons of opposite parities we prove that: a) for large and increasing N_c, the
scale \Lambda^{(V,A)} separating the resonance-dominated and the
perturbative-saturated region in the channels V,A grows as \sqrt{N_c}; b) to
satisfy the Weinberg sum rules the slopes of Regge trajectories for mesons of
opposite parities must coincide; c) their intercepts may differ and their
difference corresponds to the difference between \Lambda^V and \Lambda^A. Some
arguments indicate that this difference should tend to zero as N_c\to\infty.
","[{""version"":""v1"",""created"":""Fri, 28 Mar 2008 12:47:52 GMT""}]","2009-01-25"
"0803.4105","Martijn van den Broek","M. van den Broek and C. Van den Broeck","Chiral Brownian rotor and heat pump",,,,,"cond-mat.stat-mech","http://arxiv.org/licenses/nonexclusive-distrib/1.0/","  This paper provides some comprehensive calculations supporting the results in
Phys. Rev. Lett. 100, 130601 (2008) [arXiv:0711.1758].
","[{""version"":""v1"",""created"":""Fri, 28 Mar 2008 15:32:21 GMT""}]","2008-03-31"
"0803.4106","Jiri Bicak","Jiri Bicak, Joseph Katz and Donald Lynden-Bell","Cosmological perturbation theory, instantaneous gauges and local
  inertial frames","68 pages, 2 figures","Phys.Rev.D76:063501,2007","10.1103/PhysRevD.76.063501",,"gr-qc astro-ph hep-th","http://arxiv.org/licenses/nonexclusive-distrib/1.0/","  Linear perturbations of Friedmann-Robertson-Walker universes with any
curvature and cosmological constant are studied in a general gauge without
decomposition into harmonics. Desirable gauges are selected as those which
embody best Mach's principle: in these gauges local inertial frames can be
determined instantaneously via the perturbed Einstein field equations from the
distributions of energy and momentum in the universe. The inertial frames are
identified by their `accelerations and rotations' with respect to the
cosmological frames associated with the `Machian gauges'. In closed spherical
universes, integral gauge conditions are imposed to eliminate motions generated
by the conformal Killing vectors. The meaning of Traschen's integral constraint
vectors is thus elucidated. For all three types of FRW universes the Machian
gauges admit much less residual freedom than the synchronous or generalized
harmonic gauge. Mach's principle is best exhibited in the Machian gauges in
closed spherical universes. Independent of any Machian motivation the general
perturbation equations and discussion of gauges are useful for cosmological
perturbation theory.
","[{""version"":""v1"",""created"":""Fri, 28 Mar 2008 13:02:10 GMT""}]","2008-11-26"
"0803.4107","Fei Zhan","Fei Zhan, Yuan Lin, and Biao Wu","Equivalence of Two Approaches for Quantum-Classical Hybrid Systems","9 pages","J. Chem. Phys. 128, 204104 (2008)","10.1063/1.2927348",,"quant-ph","http://arxiv.org/licenses/nonexclusive-distrib/1.0/","  We discuss two approaches that are used frequently to describe
quantum-classical hybrid system. One is the well-known mean-field theory and
the other adopts a set of hybrid brackets which is a mixture of quantum
commutators and classical Poisson brackets. We prove that these two approaches
are equivalent.
","[{""version"":""v1"",""created"":""Fri, 28 Mar 2008 13:08:10 GMT""}]","2009-11-13"
"0803.4108","Heinz Juergen Schreiber","H.J. Schreiber and N.B. Skachkov","Relativistic and Nonrelativistic Descriptions of Electron Energy Levels
  in a Static Magnetic Field","& pages",,,,"hep-ph","http://arxiv.org/licenses/nonexclusive-distrib/1.0/","  The physical consequences of the relativistic and nonrelativistic approaches
to describe the energy levels of electrons which propagate in a static
homogeneous magnetic field are considered. It is shown that for a given
strength of the magnetic field, the quantized energy levels of the electrons
calculated by nonrelativistic and relativistic equations differ substantially,
up to few orders of magnitude for a magnetic field of about 1 Tesla.
Experimental verification to resolve the discrepancy would be very welcome.
","[{""version"":""v1"",""created"":""Fri, 28 Mar 2008 13:39:53 GMT""}]","2008-03-31"
"0803.4109","Ping Chen","K. Rompicharla, D. I. Novita, Ping Chen, P. Boolchand, M. Micoulaut,
  W. Huff","Abrupt boundaries of intermediate phases and space filling in oxide
  glasses",,,"10.1088/0953-8984/20/20/202101",,"cond-mat.dis-nn","http://arxiv.org/licenses/nonexclusive-distrib/1.0/","  Modulated DSC measurements on bulk (Na2O)x(GeO2)1-x glasses show a sharp
reversibility window in the 14% < x < 19% soda range, which correlates well
with a broad global minimum in molar volumes. Raman and IR reflectance TO and
LO mode frequencies exhibit anomalies between xc(1) = 14% (stress transition)
and xc(2) = 19% (rigidity transition), with optical elasticity power-laws
confirming the nature of the transitions . Birefringence measurements dramatize
the macroscopically stress-free nature of the Intermediate Phase in the
reversibility window.
","[{""version"":""v1"",""created"":""Fri, 28 Mar 2008 13:15:38 GMT""}]","2009-11-13"
"0803.4110","Rahul Basu","Rahul Basu, Debajyoti Choudhury and H. S. Mani","Fermionic un-particles, gauge interactions and the $\beta$ function","15 pages, LateX, uses axocolor.sty, included","Eur.Phys.J.C61:461-470,2009","10.1140/epjc/s10052-009-1022-2","IMSc/2008/03/03","hep-ph","http://arxiv.org/licenses/nonexclusive-distrib/1.0/","  The dynamics of fermionic unparticles is developed from first principles. It
is shown that any unparticle, whether fermionic or bosonic, can be recast in
terms of a canonically quantized field, but with non-local interaction terms.
We further develop a possible gauge theory for fermionic unparticles. Computing
the consequent contribution of un-fermions to the $\beta$ function of the
theory, it is shown that this can be viewed as the sum of two contributions,
one fermion-like and the other scalar-like. However, if full conformal
invariance is imposed, the latter vanishes identically. We discuss the
consequences thereof as well as some general phenomenological issues.
","[{""version"":""v1"",""created"":""Fri, 28 Mar 2008 13:17:57 GMT""}]","2009-07-22"
"0803.4111","Vasiliy Ryazanov","V.V. Ryazanov","Family of non-equilibrium statistical operators and influence of the
  past on the present","21 pages",,,,"cond-mat.stat-mech cond-mat.soft","http://arxiv.org/licenses/nonexclusive-distrib/1.0/","  A family of non-equilibrium statistical operators (NSO) is introduced which
differ by the system lifetime distribution over which the quasi-equilibrium
(relevant) distribution is averaged. This changes the form of the source in the
Liouville equation, as well as the expressions for the kinetic coefficients,
average fluxes, and kinetic equations obtained with use of NSO. It is possible
to choose a class of lifetime distributions for which thermodynamic limiting
transition and to tend to infinity of average lifetime of system is reduced to
the result received at exponential distribution for lifetime, used by Zubarev.
However there is also other extensive class of realistic distributions of
lifetime of system for which and after to approach to infinity of average
lifetime of system non-equilibrium properties essentially change. For some
distributions the effect of ""finite memory"" when only the limited interval of
the past influence on behaviour of system is observed. It is shown, how it is
possible to spend specification the description of effects of memory within the
limits of NSO method, more detailed account of influence on evolution of system
of quickly varying variables through the specified and expanded form of density
of function of distribution of lifetime. The account of character of history of
the system, features of its conduct in the past, can have substantial influence
on non-equilibrium conduct of the system in a present moment time.
","[{""version"":""v1"",""created"":""Fri, 28 Mar 2008 13:22:43 GMT""}]","2008-03-31"
"0803.4112","Wenyang Zhang","Yan Sun, Wenyang Zhang, Howell Tong","Estimation of the covariance matrix of random effects in longitudinal
  studies","Published in at http://dx.doi.org/10.1214/009053607000000523 the
  Annals of Statistics (http://www.imstat.org/aos/) by the Institute of
  Mathematical Statistics (http://www.imstat.org)","Annals of Statistics 2007, Vol. 35, No. 6, 2795-2814","10.1214/009053607000000523","IMS-AOS-AOS0286","math.ST stat.TH","http://arxiv.org/licenses/nonexclusive-distrib/1.0/","  Longitudinal studies are often conducted to explore the cohort and age
effects in many scientific areas. The within cluster correlation structure
plays a very important role in longitudinal data analysis. This is because not
only can an estimator be improved by incorporating the within cluster
correlation structure into the estimation procedure, but also the within
cluster correlation structure can sometimes provide valuable insights in
practical problems. For example, it can reveal the correlation strengths among
the impacts of various factors. Motivated by data typified by a set from
Bangladesh pertinent to the use of contraceptives, we propose a random effect
varying-coefficient model, and an estimation procedure for the within cluster
correlation structure of the proposed model. The estimation procedure is
optimization-free and the proposed estimators enjoy asymptotic normality under
mild conditions. Simulations suggest that the proposed estimation is
practicable for finite samples and resistent against mild forms of model
misspecification. Finally, we analyze the data mentioned above with the new
random effect varying-coefficient model together with the proposed estimation
procedure, which reveals some interesting sociological dynamics.
","[{""version"":""v1"",""created"":""Fri, 28 Mar 2008 13:32:37 GMT""}]","2008-12-18"
"0803.4113","Brian Harbourne","A.V. Geramita, B. Harbourne and J. Migliore","Classifying Hilbert functions of fat point subschemes in $\mathbb P^2$","27 pages, revised version. Reason for revision: corrections to Tables
  2, 4 and 7 (a 1 page erratum will be published in Collect. Math. in 2011)","Collect. Math. 60, 2 (2009), 159-192",,,"math.AG math.AC","http://arxiv.org/licenses/nonexclusive-distrib/1.0/","  A recent paper by the first and third authors together with Sabourin raised
the question of what the possible Hilbert functions are for fat point
subschemes of the form $2p_1+...+2p_r$, for all possible choices of $r$
distinct points in the projective plane. We study this problem for $r$ points
in the plane over an algebraically closed field $k$ of arbitrary characteristic
in case either $r \le 8$ or the points lie on a (possibly reducible) conic. In
either case, it follows from work of the second author that there are only
finitely many configuration types of points, where our notion of configuration
type is a generalization of the notion of a representable combinatorial
geometry, also known as a representable simple matroid. (We say $p_1,...,p_r$
and $p'_1,...,p'_r$ have the same {\it configuration type} if for all choices
of nonnegative integers $m_i$, $Z=m_1p_1+...+m_rp_r$ and
$Z'=m_1p'_1+...+m_rp'_r$ have the same Hilbert function.) Assuming either that
$7 \le r\le 8$ (see recent work of Guardo and the second author for the cases
$r\le 6$) or that the points $p_i$ lie on a conic, we explicitly determine all
the configuration types, and show how the configuration type and the
coefficients $m_i$ determine (in an explicitly computable way) the Hilbert
function (and sometimes the graded Betti numbers) of $Z=m_1p_1+...+m_rp_r$. We
demonstrate our results by explicitly listing all Hilbert functions for schemes
of $r\le 8$ double points, and for each Hilbert function we state precisely how
the points must be arranged (in terms of the configuration type) to obtain that
Hilbert function.
","[{""version"":""v1"",""created"":""Fri, 28 Mar 2008 13:34:45 GMT""},{""version"":""v2"",""created"":""Tue, 8 Jul 2008 16:19:50 GMT""},{""version"":""v3"",""created"":""Sat, 11 Dec 2010 15:00:23 GMT""}]","2010-12-14"
"0803.4114","Du\v{s}an Repov\v{s}","Umed H. Karimov and Du\v{s}an Repov\v{s}","Examples of cohomology manifolds which are not homologically locally
  connected",,"Topol. Appl. 155:11 (2008), 1169-1174.","10.1016/j.topol.2008.02.002",,"math.AT math.GT","http://arxiv.org/licenses/nonexclusive-distrib/1.0/","  Bredon has constructed a 2-dimensional compact cohomology manifold which is
not homologically locally connected, with respect to the singular homology. In
the present paper we construct infinitely many such examples (which are in
addition metrizable spaces) in all remaining dimensions $n \ge 3$.
","[{""version"":""v1"",""created"":""Fri, 28 Mar 2008 13:35:25 GMT""}]","2008-05-14"
"0803.4115","Vadim Lensky","Vadim Lensky, Vladimir Pascalutsa","Manifestly-covariant chiral PT calculation of nucleon Compton scattering","6 pages, 4 figures, REVTeX; Major revision, the effect of Delta is
  computed entirely to order p^4 over the Delta-nulceon mass difference","Pisma Zh.Eksp.Teor.Fiz.89:127-132,2009; JETP Lett.89:108-113,2009","10.1134/S0021364009030035","ECT*-08-03","nucl-th hep-ph","http://arxiv.org/licenses/nonexclusive-distrib/1.0/","  We compute the Compton scattering off the nucleons in the framework of
manifestly covariant baryon chiral perturbation theory (B$\chi$PT). The results
for observables differ substantially from the corresponding calculations in
heavy-baryon chiral perturbation theory (HB$\chi$PT), most appreciably in the
forward kinematics. We verify that the covariant $p^3$ result fulfills the
forward-Compton-scattering sum rules. We also explore the effect of the
$\Delta$(1232) resonance at order $p^4/\varDelta$, with $\varDelta\approx 300$
MeV, the resonance excitation energy. We find that the substantial effect of
the $\Delta$-excitation on the nucleon polarizabilities can naturally be
accommodated in the manifestly covariant calculation.
","[{""version"":""v1"",""created"":""Fri, 28 Mar 2008 13:36:04 GMT""},{""version"":""v2"",""created"":""Tue, 16 Dec 2008 19:02:24 GMT""}]","2009-04-17"
"0803.4116","Mathias Albert","M. Albert, T. Paul, N. Pavloff, P. Leboeuf","Dipole Oscillations of a Bose-Einstein Condensate in Presence of Defects
  and Disorder","4 pages, 4 figures","Phys. Rev. Lett. 100, 250405 (2008)","10.1103/PhysRevLett.100.250405",,"cond-mat.other","http://arxiv.org/licenses/nonexclusive-distrib/1.0/","  We consider dipole oscillations of a trapped dilute Bose-Einstein condensate
in the presence of a scattering potential consisting either in a localized
defect or in an extended disordered potential. In both cases the breaking of
superfluidity and the damping of the oscillations are shown to be related to
the appearance of a nonlinear dissipative flow. At supersonic velocities the
flow becomes asymptotically dissipationless.
","[{""version"":""v1"",""created"":""Fri, 28 Mar 2008 13:43:34 GMT""}]","2009-11-13"
"0803.4117","Du\v{s}an Repov\v{s}","Taras Banakh, Du\v{s}an Repov\v{s}, and Lyubomyr Zdomskyy","Fr\'{e}chet-Urysohn fans in free topological groups",,"J. Pure Appl. Algebra 212:9 (2008), 2105-2114.","10.1016/j.jpaa.2007.12.006",,"math.GN","http://arxiv.org/licenses/nonexclusive-distrib/1.0/","  In this paper we answer the question of T. Banakh and M. Zarichnyi
constructing a copy of the Fr\'echet-Urysohn fan $S_\w$ in a topological group
$G$ admitting a functorial embedding $[0,1]\subset G$. The latter means that
each autohomeomorphism of $[0,1]$ extends to a continuous homomorphism of $G$.
This implies that many natural free topological group constructions (e.g. the
constructions of the Markov free topological group, free abelian topological
group, free totally bounded group, free compact group) applied to a Tychonov
space $X$ containing a topological copy of the space $\IQ$ of rationals give
topological groups containing $S_\w$.
","[{""version"":""v1"",""created"":""Fri, 28 Mar 2008 15:58:42 GMT""}]","2008-05-24"
