"0803.4400","Dominique Mouhanna","B. Delamotte, Yu. Holovatch, D. Ivaneyko, D. Mouhanna and M. Tissier","Fixed points in frustrated magnets revisited","18 pages, 8 figures. This article is an extended version of
  arXiv:cond-mat/0609285","J. Stat. Mech. (2008) P03014","10.1088/1742-5468/2008/03/P03014",,"cond-mat.stat-mech cond-mat.other","http://arxiv.org/licenses/nonexclusive-distrib/1.0/","  We analyze the validity of perturbative renormalization group estimates
obtained within the fixed dimension approach of frustrated magnets. We
reconsider the resummed five-loop beta-functions obtained within the minimal
subtraction scheme without epsilon-expansion for both frustrated magnets and
the well-controlled ferromagnetic systems with a cubic anisotropy. Analyzing
the convergence properties of the critical exponents in these two cases we find
that the fixed point supposed to control the second order phase transition of
frustrated magnets is very likely an unphysical one. This is supported by its
non-Gaussian character at the upper critical dimension d=4. Our work confirms
the weak first order nature of the phase transition occuring at three
dimensions and provides elements towards a unified picture of all existing
theoretical approaches to frustrated magnets.
","[{""version"":""v1"",""created"":""Mon, 31 Mar 2008 08:47:53 GMT""}]","2009-11-13"
"0803.4401","Vladimir Korenev","V.L. Korenev","Optical Orientation in Ferromagnet/Semiconductor Hybrids","The review is written for a special issue ""Spin Orientation"" of
  Semiconductor Science and Technology journal dedicated to the memory of B.P.
  Zakharchenya","Semicond. Sci, Technol. 23, 114012 (2011)","10.1088/0268-1242/23/11/114012",,"cond-mat.mes-hall","http://arxiv.org/licenses/nonexclusive-distrib/1.0/","  The physics of optical pumping of semiconductor electrons in the
ferromagnet/semiconductor hybrids is discussed. Optically oriented
semiconductor electrons detect the magnetic state of the ferromagnetic film. In
turn, the ferromagnetism of the hybrid can be controlled optically with the
help of the semiconductor. Spin-spin interactions near the interface
ferromagnet/semiconductor play crucial role in the optical readout and the
manipulation of ferromagnetism.
","[{""version"":""v1"",""created"":""Mon, 31 Mar 2008 08:53:57 GMT""}]","2011-08-15"
"0803.4402","Robert Prevedel","Robert Prevedel, Markus Aspelmeyer, Caslav Brukner, Thomas Jennewein
  and Anton Zeilinger","Photonic entanglement as a resource in quantum computation and quantum
  communication","33 pages, 4 figures, OSA style","J. Opt. Soc. Am. B 24, 241-248 (2007)","10.1364/JOSAB.24.000241",,"quant-ph","http://arxiv.org/licenses/nonexclusive-distrib/1.0/","  Entanglement is an essential resource in current experimental implementations
for quantum information processing. We review a class of experiments exploiting
photonic entanglement, ranging from one-way quantum computing over quantum
communication complexity to long-distance quantum communication. We then
propose a set of feasible experiments that will underline the advantages of
photonic entanglement for quantum information processing.
","[{""version"":""v1"",""created"":""Mon, 31 Mar 2008 08:53:58 GMT""}]","2009-11-13"
"0803.4403","Michael Bonitz","C. Henning, K. Fujioka, P. Ludwig, A. Piel, A. Melzer, M. Bonitz","Existence and Vanishing of the Breathing Mode in Strongly Correlated
  Finite Systems",,"Phys. Rev. Lett. 101, 045002 (2008)","10.1103/PhysRevLett.101.045002",,"physics.plasm-ph physics.atm-clus","http://arxiv.org/licenses/nonexclusive-distrib/1.0/","  One of the fundamental eigenmodes of finite interacting systems is the mode
of {\em uniform radial expansion and contraction} -- the ``breathing'' mode
(BM). Here we show in a general way that this mode exists only under special
conditions: i) for harmonically trapped systems with interaction potentials of
the form $1/r^\gamma$ $(\gamma\in\mathbb{R}_{\neq0})$ or $\log(r)$, or ii) for
some systems with special symmetry such as single shell systems forming
platonic bodies. Deviations from the BM are demonstrated for two examples:
clusters interacting with a Lennard-Jones potential and parabolically trapped
systems with Yukawa repulsion. We also show that vanishing of the BM leads to
the occurence of multiple monopole oscillations which is of importance for
experiments.
","[{""version"":""v1"",""created"":""Mon, 31 Mar 2008 08:57:11 GMT""}]","2009-11-13"
"0803.4404","Christian Le Merdy","Christian Le Merdy, Fedor Sukochev","Rademacher averages on noncommutative symmetric spaces",,,,,"math.OA math.FA","http://arxiv.org/licenses/nonexclusive-distrib/1.0/","  Let E be a separable (or the dual of a separable) symmetric function space,
let M be a semifinite von Neumann algebra and let E(M) be the associated
noncommutative function space. Let $(\epsilon_k)_k$ be a Rademacher sequence,
on some probability space $\Omega$. For finite sequences $(x_k)_k of E(M), we
consider the Rademacher averages $\sum_k \epsilon_k\otimes x_k$ as elements of
the noncommutative function space $E(L^\infty(\Omega)\otimes M)$ and study
estimates for their norms $\Vert \sum_k \epsilon_k \otimes x_k\Vert_E$
calculated in that space. We establish general Khintchine type inequalities in
this context. Then we show that if E is 2-concave, the latter norm is
equivalent to the infimum of $\Vert (\sum y_k^*y_k)^{{1/2}}\Vert + \Vert (\sum
z_k z_k^*)^{{1/2}}\Vert$ over all $y_k,z_k$ in E(M) such that $x_k=y_k+z_k$ for
any k. Dual estimates are given when E is 2-convex and has a non trivial upper
Boyd index. We also study Rademacher averages for doubly indexed families of
E(M).
","[{""version"":""v1"",""created"":""Mon, 31 Mar 2008 09:03:53 GMT""}]","2008-04-01"
"0803.4405","Solveig Skadhauge","F. de Campos, M.A. Diaz, O.J.P. Eboli, M.B. Magro, W. Porod, S.
  Skadhauge","LHC signals for neutrino mass model in bilinear R-parity violating mAMSB","27 pages","Phys.Rev.D77:115025,2008","10.1103/PhysRevD.77.115025","Nordita-2008-13","hep-ph","http://arxiv.org/licenses/nonexclusive-distrib/1.0/","  We investigate a neutrino mass model in which the neutrino data is accounted
for by bilinear R-parity violating supersymmetry with anomaly mediated
supersymmetry breaking. We focus on the CERN Large Hadron Collider (LHC)
phenomenology, studying the reach of generic supersymmetry search channels with
leptons, missing energy and jets. A special feature of this model is the
existence of long lived neutralinos and charginos which decay inside the
detector leading to detached vertices. We demonstrate that the largest reach is
obtained in the displaced vertices channel and that practically all of the
reasonable parameter space will be covered with an integrated luminosity of 10
fb-1. We also compare the displaced vertex reaches of the LHC and Tevatron.
","[{""version"":""v1"",""created"":""Mon, 31 Mar 2008 09:06:27 GMT""}]","2008-11-26"
"0803.4406","Neal Jackson","Neal Jackson (1), Eran O. Ofek (2), Masamune Oguri (3) ((1) University
  of Manchester, Jodrell Bank Centre for Astrophysics, (2) Caltech, Division of
  Physics, Mathematics and Astronomy (3) KIPAC, Stanford University)","ULAS J234311.93-005034.0: A gravitational lens system selected from
  UKIDSS and SDSS","Accepted by MNRAS","Mon.Not.Roy.Astron.Soc.387:741-746,2008","10.1111/j.1365-2966.2008.13268.x",,"astro-ph","http://arxiv.org/licenses/nonexclusive-distrib/1.0/","  We report the discovery of a new gravitational lens system. This object, ULAS
J234311.93-005034.0, is the first to be selected by using the new UKIRT
Infrared Deep Sky Survey (UKIDSS), together with the Sloan Digital Sky Survey
(SDSS). The ULAS J234311.93-005034.0 system contains a quasar at redshift 0.788
which is doubly imaged, with separation 1.4"". The two quasar images have the
same redshift and similar, though not identical, spectra. The lensing galaxy is
detected by subtracting point-spread functions from R-band images taken with
the Keck telescope. The lensing galaxy can also be detected by subtracting the
spectra of the A and B images, since more of the galaxy light is likely to be
present in the latter. No redshift is determined from the galaxy, although the
shape of its spectrum suggests a redshift of about 0.3. The object's lens
status is secure, due to the identification of two objects with the same
redshift together with a lensing galaxy. Our imaging suggests that the lens is
found in a cluster environment, in which candidate arc-like structures, that
require confirmation, are visible in the vicinity. Further discoveries of
lenses from the UKIDSS survey are likely as part of this programme, due to the
depth of UKIDSS and its generally good seeing conditions.
","[{""version"":""v1"",""created"":""Mon, 31 Mar 2008 09:18:06 GMT""}]","2009-06-23"
"0803.4407","Markus H. Thoma","Markus H. Thoma and Gregor E. Morfill","Ratio of viscosity to entropy density in a strongly coupled
  one-component plasma","5 pages, revised version to be published in Europhysics Letters","Europhys.Lett.82:65001,2008","10.1209/0295-5075/82/65001",,"physics.plasm-ph astro-ph hep-ph nucl-th","http://arxiv.org/licenses/nonexclusive-distrib/1.0/","  String theoretical arguments led to the hypothesis that the ratio of
viscosity to entropy of any physical system has a lower bound. Strongly coupled
systems usually have a small viscosity compared to weakly coupled plasmas in
which the viscosity is proportional to the mean free path. In the case of a
one-component plasma the viscosity as a function of the coupling strength shows
a minimum. Here we show that the ratio of viscosity to entropy of a strongly
coupled one-component plasma is always above the lower bound predicted by
string theory.
","[{""version"":""v1"",""created"":""Mon, 31 Mar 2008 09:20:40 GMT""},{""version"":""v2"",""created"":""Mon, 5 May 2008 07:55:10 GMT""}]","2009-08-03"
"0803.4408","Christian Le Merdy","Christian Le Merdy, Eric Ricard, Jean Roydor","Completely 1-complemented subspaces of Schatten spaces","To be pubished in the Transactions of the American Mathematical
  Society. This revised version contains minor corrections. More specifically,
  Remark 5.5, Proposition 7.3 and its proof, as well as Remark 7.4 have been
  modified",,,,"math.OA math.FA","http://arxiv.org/licenses/nonexclusive-distrib/1.0/","  We consider the Schatten spaces S^p in the framework of operator space theory
and for any $1\leq p\not=2<\infty$, we characterize the completely
1-complemented subspaces of S^p. They turn out to be the direct sums of spaces
of the form S^p(H,K), where H,K are Hilbert spaces. This result is related to
some previous work of Arazy-Friedman giving a description of all 1-complemented
subspaces of S^p in terms of the Cartan factors of types 1-4. We use operator
space structures on these Cartan factors regarded as subspaces of appropriate
noncommutative L^p-spaces. Also we show that for any $n\geq 2$, there is a
triple isomorphism on some Cartan factor of type 4 and of dimension 2n which is
not completely isometric, and we investigate L^p-versions of such isomorphisms.
","[{""version"":""v1"",""created"":""Mon, 31 Mar 2008 09:22:03 GMT""},{""version"":""v2"",""created"":""Thu, 8 Jan 2009 11:28:21 GMT""}]","2009-01-08"
"0803.4410","Christian Le Merdy","Marius Junge, Christian Le Merdy","Dilations and rigid factorisations on noncommutative L^p-spaces","To be published in Journal of Functional Analysis",,,,"math.OA math.FA","http://arxiv.org/licenses/nonexclusive-distrib/1.0/","  We study some factorisation and dilation properties of completely positive
maps on noncommutative L^p-spaces. We show that Akcoglu's dilation theorem for
positive contractions on classical (=commutative) L^p-spaces has no reasonable
analog in the noncommutative setting. Our study relies on non symmetric analogs
of Pisier's operator space valued noncommutative L^p-spaces that we investigate
in the first part of the paper.
","[{""version"":""v1"",""created"":""Mon, 31 Mar 2008 09:31:15 GMT""}]","2008-04-01"
"0803.4412","Franz J. Kaiser","Franz J. Kaiser, Peter H\""anggi and Sigmund Kohler","Molecular electronics in junctions with energy disorder","11 pages, 3 figures","New J. Phys. 10 065013 (2008)","10.1088/1367-2630/10/6/065013",,"cond-mat.mes-hall","http://arxiv.org/licenses/nonexclusive-distrib/1.0/","  We investigate transport through molecular wires whose energy levels are
affected by environmental fluctuations. We assume that the relevant
fluctuations are so slow that they, within a tight-binding description, can be
described by disordered, Gaussian distributed onsite energies. For long wires,
we find that the corresponding current distribution can be rather broad even
for a small energy variance. Moreover, we analyse with a Floquet master
equation the interplay of laser excitations and static disorder. Then the
disorder leads to spatial asymmetries such that the laser diving can induce a
ratchet current.
","[{""version"":""v1"",""created"":""Mon, 31 Mar 2008 09:50:54 GMT""},{""version"":""v2"",""created"":""Tue, 1 Apr 2008 12:13:40 GMT""}]","2008-07-09"
"0803.4413","Dieter W. Heermann","Marcel Hellmann, Youjin Deng, Matthias Weiss and Dieter W. Heermann","A modified Potts model for the interaction of surface-attached polymer
  complexes",,,,,"cond-mat.stat-mech cond-mat.soft","http://arxiv.org/licenses/nonexclusive-distrib/1.0/","  We present a simple yet generic model for the behavior of a system of many
surface-attached flexible polymers with rigid side chains. Beyond its potential
application in describing the dynamics of the extracellular matrix of mammalian
cells, the model itself shows an interesting phase transition behavior since
the underlying models (a two-dimensional Potts model and a XY-model) undergo
different phase transitions.
","[{""version"":""v1"",""created"":""Mon, 31 Mar 2008 09:46:57 GMT""}]","2008-04-01"
"0803.4414","Michel Poirier","Nikolaos Kontogiannopoulmos (LULI), Serena Bastiani-Ceccotti (LULI),
  Fr\'ed\'eric Thais (SPAM), Claude Chenais-Popovics (LULI), Pascal Sauvan, R.
  Schott (LULI), Wolfgang F\""olsner, Philippe Arnault (dam/dif), Michel Poirier
  (SPAM), Thomas Blenski (SPAM)","Measurement of XUV-absorption spectra of ZnS radiatively heated foils",,"Dans High Energy Density Physics - Radiative Properties of Hot
  Dense Matter 2006, Albufeira : Portugal (2006)","10.1016/j.hedp.2007.02.011",,"physics.plasm-ph","http://arxiv.org/licenses/nonexclusive-distrib/1.0/","  Time-resolved absorption of zinc sulfide (ZnS) and aluminum in the XUV-range
has been measured. Thin foils in conditions close to local thermodynamic
equilibrium were heated by radiation from laser-irradiated gold spherical
cavities. Analysis of the aluminum foil radiative hydrodynamic expansion, based
on the detailed atomic calculations of its absorption spectra, showed that the
cavity emitted flux that heated the absorption foils corresponds to a radiation
temperature in the range 55 60 eV. Comparison of the ZnS absorption spectra
with calculations based on a superconfiguration approach identified the
presence of species Zn6+ - Zn8+ and S5+ - S6+. Based on the validation of the
radiative source simulations, experimental spectra were then compared to
calculations performed by post-processing the radiative hydrodynamic
simulations of ZnS. Satisfying agreement is found when temperature gradients
are accounted for.
","[{""version"":""v1"",""created"":""Mon, 31 Mar 2008 09:47:11 GMT""}]","2008-12-18"
"0803.4415","Marc Lefranc","Pierre-Emmanuel Morant (PhLAM), Quentin Thommen (PhLAM), Fran\c{c}ois
  Lemaire (LIFL), Constant Vandermo\""ere (PhLAM), Benjamin Parent (UGSF, IRI),
  Marc Lefranc (PhLAM, IRI)","Oscillations in the expression of a self-repressed gene induced by a
  slow transcriptional dynamics",,"Physical Review Letters 102, 6 (2009) 068104","10.1103/PhysRevLett.102.068104",,"q-bio.QM q-bio.MN","http://arxiv.org/licenses/nonexclusive-distrib/1.0/","  We revisit the dynamics of a gene repressed by its own protein in the case
where the transcription rate does not adapt instantaneously to protein
concentration but is a dynamical variable. We derive analytical criteria for
the appearance of sustained oscillations and find that they require degradation
mechanisms much less nonlinear than for infinitely fast regulation.
Deterministic predictions are also compared with stochastic simulations of this
minimal genetic oscillator.
","[{""version"":""v1"",""created"":""Mon, 31 Mar 2008 09:50:30 GMT""},{""version"":""v2"",""created"":""Mon, 12 Jan 2009 16:26:37 GMT""}]","2009-02-19"
"0803.4416","Mikl\'{o}s R\'{a}sonyi","Paolo Guasoni, Mikl\'os R\'asonyi, Walter Schachermayer","Consistent price systems and face-lifting pricing under transaction
  costs","Published in at http://dx.doi.org/10.1214/07-AAP461 the Annals of
  Applied Probability (http://www.imstat.org/aap/) by the Institute of
  Mathematical Statistics (http://www.imstat.org)","Annals of Applied Probability 2008, Vol. 18, No. 2, 491-520","10.1214/07-AAP461","IMS-AAP-AAP461","q-fin.PR math.PR","http://arxiv.org/licenses/nonexclusive-distrib/1.0/","  In markets with transaction costs, consistent price systems play the same
role as martingale measures in frictionless markets. We prove that if a
continuous price process has conditional full support, then it admits
consistent price systems for arbitrarily small transaction costs. This result
applies to a large class of Markovian and non-Markovian models, including
geometric fractional Brownian motion. Using the constructed price systems, we
show, under very general assumptions, the following ``face-lifting'' result:
the asymptotic superreplication price of a European contingent claim $g(S_T)$
equals $\hat{g}(S_0)$, where $\hat{g}$ is the concave envelope of $g$ and $S_t$
is the price of the asset at time $t$. This theorem generalizes similar results
obtained for diffusion processes to processes with conditional full support.
","[{""version"":""v1"",""created"":""Mon, 31 Mar 2008 09:55:40 GMT""}]","2008-12-18"
"0803.4417","Erling Stormer","Erling Stormer","Separable states and positive maps II","10 pages",,,,"math.OA","http://arxiv.org/licenses/nonexclusive-distrib/1.0/","  Using the natural duality between linear functionals on tensor products of
C*-algebras with the trace class operators on a Hilbert space H and linear maps
of the C*-algebra into B(H), we give two characterizations of separability, one
relating it to abelianness of the definite set of the map, and one on tensor
products of nuclear and UHF C*-algebras
","[{""version"":""v1"",""created"":""Mon, 31 Mar 2008 09:56:17 GMT""}]","2008-04-01"
"0803.4418","Marc Noy Mr.","S. Gerke, O. Gimenez, M. Noy, A. Weissl","On the number of graphs not containing $K_{3,3}$ as a minor","17 pages",,,,"math.CO","http://arxiv.org/licenses/nonexclusive-distrib/1.0/","  We derive precise asymptotic estimates for the number of labelled graphs not
containing $K_{3,3}$ as a minor, and also for those which are edge maximal.
Additionally, we establish limit laws for parameters in random
$K_{3,3}$-minor-free graphs, like the expected number of edges. To establish
these results, we translate a decomposition for the corresponding graph class
into equations for generating functions and use singularity analysis. We also
find a precise estimate for the number of graphs not containing the graph
$K_{3,3}$ plus an edge as a minor.
","[{""version"":""v1"",""created"":""Mon, 31 Mar 2008 10:05:26 GMT""},{""version"":""v2"",""created"":""Tue, 1 Apr 2008 12:21:38 GMT""}]","2008-04-01"
"0803.4419","Alessio Recati","A. Recati, C. Lobo, S. Stringari","The role of interactions in spin-polarised atomic Fermi gases at
  unitarity","Revisitedc version accepted for pubblication. 1 figure added, 1
  figure correted, typos corrected, references updated","Phys. Rev. A 78, 023633 (2008)","10.1103/PhysRevA.78.023633",,"cond-mat.other","http://arxiv.org/licenses/nonexclusive-distrib/1.0/","  We study the zero temperature properties of a trapped polarized Fermi gas at
unitarity by assuming phase separation between an unpolarized superfluid and a
polarized normal phase. The effects of the interaction are accounted using the
formalism of quasi-particles to build up the equation of state of the normal
phase with the Monte Carlo results for the relevant parameters. Our predictions
for the Chandrasekhar-Clogston limit of critical polarization and for the
density profiles, including the density jump at the interface, are confirmed
with excellent accuracy by the recent experimental results at MIT. The role of
interaction on the radial width of the minority component, on the gap of the RF
transition and on the spin oscillations in the normal phase is also discussed.
Our analysis points out the Fermi liquid nature of these strongly interacting
spin polarized configurations.
","[{""version"":""v1"",""created"":""Mon, 31 Mar 2008 10:05:55 GMT""},{""version"":""v2"",""created"":""Thu, 11 Sep 2008 13:27:00 GMT""}]","2009-11-13"
"0803.4420","Kazem Azizi","T. M. Aliev, K. Azizi, A. Ozpineci","Magnetic Moments of Heavy $\Xi_{Q}$ Baryons in Light Cone QCD Sum Rules","26 Pages, 8 Figures and 1 Table","Phys.Rev.D77:114006,2008","10.1103/PhysRevD.77.114006",,"hep-ph","http://arxiv.org/licenses/nonexclusive-distrib/1.0/","  The magnetic moments of heavy $\Xi_{Q}$ baryons containing a single charm or
bottom quark are calculated in the framework of light cone QCD sum rules
method. A comparison of our results with the predictions of the quark models is
presented.
","[{""version"":""v1"",""created"":""Mon, 31 Mar 2008 10:06:52 GMT""},{""version"":""v2"",""created"":""Sat, 31 May 2008 09:31:09 GMT""}]","2008-11-26"
"0803.4421","Michael Dittmar","Michael Dittmar","The European Electricity Grid System and Winter Peak Load Stress: For
  how long can the european grid system survive the ever increasing demand
  during cold winter days?","16 pages no figures",,,,"physics.soc-ph physics.ed-ph","http://arxiv.org/licenses/nonexclusive-distrib/1.0/","  The rich countries of Western Europe and its citizens benefited during at
least the last 30 years from an extraordinary stable electricity grid. This
stability was achieved by the european grid system and a large flexible and
reliable spare power plant capacity. This system allowed a continuous demand
growth during the past 10-20 years of up to a few % per year. However,
partially due to this overcapacity, no new large power plants have been
completed during the past 10-15 years. The obvious consequence is that the
reliable spare capacity has been reduced and that a further yearly demand
growth of 1-2% for electric energy can only be achieved if new power plants
will be constructed soon. Data from various European countries, provided by the
UCTE, indicate that the system stress during peak load times and especially
during particular cold winter days is much larger than generally assumed. In
fact, the latest UCTE data on reliable power capacity indicate that already
during the Winter 2007/8 only a few very cold winter days in Western Europe
could have resulted in very unpleasant supply problems during the early evening
peak load times in France and the neighboring countries.
  An analysis of the potential to build and operate new power plants
demonstrates that no short term solution, which allows a further continuous
1-2% consumption growth seems to exist. Thus, without any action from the
various governments in Europe to reduce the electricity demand in a serious
way, the risk of blackouts will increase dramatically in the near future.
Instead of simply waiting for the blackout disaster to happen, a few simple
short term political actions are suggested.
","[{""version"":""v1"",""created"":""Mon, 31 Mar 2008 10:07:31 GMT""}]","2008-04-01"
"0803.4422","Sven Van Loo","S. Van Loo, S. A. E. G. Falle, T. W. Hartquist and A. J. Barker","The effect of ambipolar resistivity on the formation of dense cores","7 pages; 7 figures; accepted by A&A",,"10.1051/0004-6361:200809432",,"astro-ph","http://arxiv.org/licenses/nonexclusive-distrib/1.0/","  We aim to understand the formation of dense cores by magnetosonic waves in
regions where the thermal to magnetic pressure ratio is small. Because of the
low-ionisation fraction in molecular clouds, neutral and charged particles are
weakly coupled. Ambipolar diffusion then plays an important role in the
formation process. A quiescent, uniform plasma is perturbed by a fast-mode
wave. Using 2D numerical simulations, we follow the evolution of the fast-mode
wave. The simulations are done with a multifluid, adaptive mesh refinement MHD
code. Initial perturbations with wavelengths that are 2 orders of magnitude
larger than the dissipation length are strongly affected by the ion-neutral
drift. Only in situations where there are large variations in the magnetic
field corresponding to a highly turbulent gas can fast-mode waves generate
dense cores. This means that, in most cores, no substructure can be produced.
However, Core D of TMC-1 is an exception to this case. Due to its atypically
high ionisation fraction, waves with wavelengths up to 3 orders of magnitude
greater than the dissipation length can be present. Such waves are only weakly
affected by ambipolar diffusion and can produce dense substructure without
large wave-amplitudes. Our results also explain the observed transition from
Alfvenic turbulent motion at large scales to subsonic motions at the level of
dense cores.
","[{""version"":""v1"",""created"":""Mon, 31 Mar 2008 10:07:49 GMT""}]","2009-11-13"
