"0803.4423","Hyunsung David Jun","Hyunsung David Jun and Myungshin Im","The Mid-Infrared Fundamental Plane of Early-Type Galaxies","5 pages, 3 figures, to appear in ApJL",,"10.1086/588552",,"astro-ph","http://arxiv.org/licenses/nonexclusive-distrib/1.0/","  Three observables of early-type galaxies - size ($r_{e}$), surface brightness
($I_{e}$), and velocity dispersion ($\sigma_{0}$) - form a tight planar
correlation known as the fundamental plane (FP), which has provided great
insights into the galaxy formation and the evolution processes. However, the FP
has been found to be tilted against the simple virial expectation, prompting
debates on its origin. In order to investigate the contribution of systematic
stellar population variation to the FP tilt, we study here the FP relations of
early-type galaxies in mid-infrared (MIR) which may represent the stellar mass
well. We examined the wavelength dependence of the FP coefficients, $a$ and $b$
in $\log r_{e}= a\log\sigma_{0} + b\log< I >_{e} + c$, using a sample of 56
early-type galaxies for which visible (V-band), near-infrared (K-band), and MIR
(Spitzer IRAC, 3.6--8.0$\mu$m) data are available. We find that the coefficient
$a$ increases as a function of wavelength as $da/d\lambda=0.11\pm0.04\mu
m^{-1}$, while the coefficient $b$ reaches the closest to -1 at 3.6--5.8$\mu$m.
When applied to the visible FP coefficients derived from a larger sample of
nearby early-type galaxies, we get the FP relation with $(a,b) \simeq
$(1.6--1.8,-0.9) at 3.6$\mu$m. Our result suggests that the stellar population
effect can explain more than half of the FP tilt, closing the gap between the
virial expectation and the optical FP. The reduction in the FP tilt is
reflected in the dynamical mass-to-light ratio, $M_{dyn}/L$, dependence on $L$
which decreases toward 3.6--5.8$\mu$m, suggesting that the MIR light better
represents mass than the shorter wavelengths.
","[{""version"":""v1"",""created"":""Mon, 31 Mar 2008 10:23:47 GMT""}]","2009-11-13"
"0803.4424","Swee Goh","Swee K. Goh, Johnpierre Paglione, Mike Sutherland, E. C. T. O'Farrell,
  C. Bergemann, T. A. Sayles and M. B. Maple","Fermi Surface Reconstruction in CeRh$_{1-x}$Co$_{x}$In$_{5}$","4 pages, 4 figures","Phys. Rev. Lett. 101, 056402 (2008)","10.1103/PhysRevLett.101.056402",,"cond-mat.str-el cond-mat.supr-con","http://arxiv.org/licenses/nonexclusive-distrib/1.0/","  The evolution of the Fermi surface of CeRh$_{1-x}$Co$_x$In$_5$ was studied as
a function of Co concentration $x$ via measurements of the de Haas-van Alphen
effect. By measuring the angular dependence of quantum oscillation frequencies,
we identify a Fermi surface sheet with $f$-electron character which undergoes
an abrupt change in topology as $x$ is varied. Surprisingly, this
reconstruction does not occur at the quantum critical concentration $x_c$,
where antiferromagnetism is suppressed to T=0. Instead we establish that this
sudden change occurs well below $x_c$, at the concentration x ~ 0.4 where long
range magnetic order alters its character and superconductivity appears. Across
all concentrations, the cyclotron effective mass of this sheet does not
diverge, suggesting that critical behavior is not exhibited equally on all
parts of the Fermi surface.
","[{""version"":""v1"",""created"":""Mon, 31 Mar 2008 10:24:47 GMT""},{""version"":""v2"",""created"":""Wed, 30 Jul 2008 19:21:44 GMT""}]","2008-07-30"
"0803.4425","Sara Rombetto","S Rombetto, A Vettoliere, C Granata, M Russo, C Nappi","Sensitivity and spatial resolution of square loop SQUID magnetometers",,,"10.1016/j.physc.2008.08.005",,"cond-mat.supr-con","http://arxiv.org/licenses/nonexclusive-distrib/1.0/","  We calculate the flux threading the pick-up coil of a square SQUID
magnetometer in the presence of a current dipole source. The result reproduces
that of a circle coil magnetometer calculated by Wikswo with only small
differences. However it has a simpler form so that it is possible to derive
from it closed form expressions for the current dipole sensitivity and the
spatial resolution. The results are useful to assess the overall performance of
the device and to compare different designs.
","[{""version"":""v1"",""created"":""Mon, 31 Mar 2008 10:27:54 GMT""}]","2009-11-13"
"0803.4426","K. S. Nagapriya","K. S. Nagapriya, Savas Berber, Tzahi Cohen-Karni, Lior Segev, Onit
  Srur-Lavi, David Tomanek and Ernesto Joselevich","Diameter-dependent conductance oscillations in carbon nanotubes upon
  torsion","4 pages, 5 figures, submitted to PRL",,,,"cond-mat.mtrl-sci","http://arxiv.org/licenses/nonexclusive-distrib/1.0/","  We combine electromechanical measurements with {\em ab initio} density
functional calculations to settle the controversy about the origin of
torsion-induced conductance oscillations in multi-wall carbon nanotubes.
According to our observations, the oscillation period is inversely proportional
to the squared diameter of the nanotube, as expected for a single-wall nanotube
of the same diameter. This is supported by our theoretical finding that
differential torsion effectively decouples the walls of a multi-wall nanotube
near the Fermi level and moves the Fermi momentum across quantization lines. We
exclude the alternative explanation linked to registry changes between the
walls, since it would cause a different diameter dependence of the oscillation
period.
","[{""version"":""v1"",""created"":""Mon, 31 Mar 2008 10:32:46 GMT""}]","2008-04-01"
"0803.4428","Sven Friedemann","S. Friedemann, N. Oeschler, S. Wirth, C. Krellner, C. Geibel, F.
  Steglich, S. MaQuilon, Z. Fisk, S. Paschen, and G. Zwicknagl","Hall effect measurements on YbRh2Si2 and relatives in the light of
  electronic structure calculations","12 pages, 8 figures","Phys. Rev. B, 82, 035103 (2010)","10.1103/PhysRevB.82.035103",,"cond-mat.str-el","http://arxiv.org/licenses/nonexclusive-distrib/1.0/","  We report experimental and theoretical investigations of the Hall effect in
YbRh2Si2 and its reference compounds LuRh2Si2 and YbIr2Si2. Based on
band-structure calculations we identify two bands dominating the Hall
coefficient in all these compounds. For the case of LuRh2Si2 - the non-magnetic
reference compound of YbRh2Si2 - the temperature dependence of the Hall
coefficient is described quantitatively to arise from two hole-like bands. For
YbIr2Si2 and YbRh2Si2, renormalized band calculations yield two bands of
opposite character. In YbRh2Si2 these two bands almost compensate each other.
We present strong indications that the sample dependences of the
low-temperature Hall coefficient observed for YbRh2Si2 arise from slight
variations of the relative scattering rates of the two bands. Minute changes of
the composition appear to be the origin.
","[{""version"":""v1"",""created"":""Mon, 31 Mar 2008 10:43:37 GMT""},{""version"":""v2"",""created"":""Mon, 26 Apr 2010 10:53:42 GMT""},{""version"":""v3"",""created"":""Wed, 7 Jul 2010 10:13:09 GMT""}]","2010-07-08"
"0803.4429","Holger Braun","H. Braun, A. Ganopolski, M. Christl and D. R. Chialvo","A simple conceptual model of abrupt glacial climate events",,"Nonlin. Processes Geophys. 14, 709-721, 2007","10.5194/npg-14-709-2007",,"physics.geo-ph physics.ao-ph","http://creativecommons.org/licenses/by/3.0/","  Here we use a very simple conceptual model in an attempt to reduce essential
parts of the complex nonlinearity of abrupt glacial climate changes (the
so-called Dansgaard-Oeschger events) to a few simple principles, namely (i) a
threshold process, (ii) an overshooting in the stability of the system and
(iii) a millennial-scale relaxation. By comparison with a so-called Earth
system model of intermediate complexity (CLIMBER-2), in which the events
represent oscillations between two climate states corresponding to two
fundamentally different modes of deep-water formation in the North Atlantic, we
demonstrate that the conceptual model captures fundamental aspects of the
nonlinearity of the events in that model. We use the conceptual model in order
to reproduce and reanalyse nonlinear resonance mechanisms that were already
suggested in order to explain the characteristic time scale of
Dansgaard-Oeschger events. In doing so we identify a new form of stochastic
resonance (i.e. an overshooting stochastic resonance) and provide the first
explicitly reported manifestation of ghost resonance in a geosystem, i.e. of a
mechanism which could be relevant for other systems with thresholds and with
multiple states of operation. Our work enables us to explicitly simulate
realistic probability measures of Dansgaard-Oeschger events (e.g. waiting time
distributions, which are a prerequisite for statistical analyses on the
regularity of the events by means of Monte-Carlo simulations). We thus think
that our study is an important advance in order to develop more adequate
methods to test the statistical significance and the origin of the proposed
glacial 1470-year climate cycle.
","[{""version"":""v1"",""created"":""Mon, 31 Mar 2008 11:00:29 GMT""}]","2020-01-29"
"0803.4430","Tor Olof Strandberg","T. O. Strandberg and C. M. Canali (Lund, Kalmar University, Sweden) A.
  H. MacDonald (University of Texas at Austin, Austin TX)","Chern-number spin Hamiltonians for magnetic nano-clusters by DFT methods","19 pages, 13 figures","Phys. Rev. B 77, 174416 (2008)","10.1103/PhysRevB.77.174416",,"cond-mat.other","http://arxiv.org/licenses/nonexclusive-distrib/1.0/","  Combining field-theoretical methods and ab-initio calculations, we construct
an effective Hamiltonian with a single giant-spin degree of freedom, capable of
the describing the low-energy spin dynamics of ferromagnetic metal nanoclusters
consisting of up to a few tens of atoms. In our procedure, the magnetic moment
direction of the Kohn-Sham SDFT wave-function is constrained by means of a
penalty functional, allowing us to explore the entire parameter space of
directions, and to extract the magnetic anisotropy energy and Berry curvature
functionals. The average of the Berry curvature over all magnetization
directions is a Chern number - a topological invariant that can only take on
values equal to multiples of one half, representing the dimension of the
Hilbert space of the effective spin system. The spin Hamiltonian is obtained by
quantizing the classical anisotropy energy functional, after performing a
change of variables to a constant Berry curvature space. The purpose of this
article is to examine the impact of the topological effect from the Berry
curvature on the low-energy total-spin-system dynamics. To this end, we study
small transition metal clusters: Co$_{n}$ ($n=2,...,5$), Rh$_{2}$, Ni$_{2}$,
Pd$_{2}$, Mn$_{x}$N$_{y}$, Co$_{3}$Fe$_{2}$.
","[{""version"":""v1"",""created"":""Mon, 31 Mar 2008 15:48:53 GMT""}]","2010-01-28"
"0803.4431","Gautam Gangopadhyay","Madhubrata Bhattacharya and G. Gangopadhyay","$\alpha$-Decay Lifetime in Superheavy Nuclei With $A>282$","To appear in Physical Rev. C","Phys.Rev.C77:047302,2008","10.1103/PhysRevC.77.047302",,"nucl-th","http://arxiv.org/licenses/nonexclusive-distrib/1.0/","  Nuclei with $A>282$ have been studied in the Relativistic Mean Field approach
using the force FSU Gold and a zero range pairing interaction. The
Euler-Lagrange equations have been solved in the co-ordinate space. Alpha
nucleus potential has been constructed with the DDM3Y1 interaction, which has
an exponential density dependence, in the double folding model using the
nucleon densities in the daughter nucleus and the $\alpha$ particle. Half lives
of $\alpha$ decay have been calculated for tunneling of the $\alpha$ particle
through the potential barrier in the WKB approximation and assuming a constant
preformation probability. The resulting values agree well with experimental
measurements.
","[{""version"":""v1"",""created"":""Mon, 31 Mar 2008 11:02:02 GMT""}]","2008-11-26"
"0803.4432","I. Shlimak","I. Shlimak, v. Ginodman, A. Butenko, K.-J. Friedland, and S. V.
  Kravchenko","Electron transport in a slot-gate Si MOSFET","To appear in Europhys. Lett",,"10.1209/0295-5075/82/47001",,"cond-mat.mes-hall cond-mat.str-el","http://arxiv.org/licenses/nonexclusive-distrib/1.0/","  The transversal and longitudinal resistance in the quantum Hall effect regime
was measured in a Si MOSFET sample in which a slot-gate allows one to vary the
electron density and filling factor in different parts of the sample. In case
of unequal gate voltages, the longitudinal resistances on the opposite sides of
the sample differ from each other because the originated Hall voltage
difference is added to the longitudinal voltage only on one side depending on
the gradient of the gate voltages and the direction of the external magnetic
field. After subtracting the Hall voltage difference, the increase in
longitudinal resistance is observed when electrons on the opposite sides of the
slot occupy Landau levels with different spin orientations.
","[{""version"":""v1"",""created"":""Mon, 31 Mar 2008 11:11:43 GMT""}]","2009-11-13"
"0803.4433","Vahan Minasyan Dr","V.N. Minasyan","Creation of neutron spinless pairs in a superfluid liquid $^4$He and a
  neutron gas mixture","10 pages",,,,"cond-mat.stat-mech","http://arxiv.org/licenses/nonexclusive-distrib/1.0/","  First, the creation of a free neutron spinless pairs is predicted in a
superfluid liquid $^4$He and a neutron gas mixture. For solving the given
problem, it is presented an exact solution to the model of dilute Bose gas as
an extension of the Bogoliubov model, at quantity of the condensate fraction
varying in the state $0\leq\frac{N_0}{N}\leq 1$, which in turn might be useful
for a description of the superfluid liquid $^4$He. Due to an application of
presented new model of dilute Bose gas, we prove that an appearance of atoms in
the condensate is a suppressor for the collective modes as well as a creator
for single-particle excitations On other hand, it is shown that the terms of
the interaction between the Bogoliubov excitations (Bogoliubov phonon-roton
modes) and the density modes of the neutron meditate an attractive interaction
via the neutron modes, which in turn leads to a bound state on a spinless
neutron pair.
","[{""version"":""v1"",""created"":""Mon, 31 Mar 2008 11:12:11 GMT""},{""version"":""v10"",""created"":""Wed, 1 Apr 2009 05:08:18 GMT""},{""version"":""v2"",""created"":""Wed, 2 Apr 2008 06:43:39 GMT""},{""version"":""v3"",""created"":""Fri, 16 May 2008 09:58:54 GMT""},{""version"":""v4"",""created"":""Thu, 4 Dec 2008 09:56:09 GMT""},{""version"":""v5"",""created"":""Wed, 24 Dec 2008 06:37:50 GMT""},{""version"":""v6"",""created"":""Thu, 5 Feb 2009 09:14:31 GMT""},{""version"":""v7"",""created"":""Mon, 23 Feb 2009 07:27:32 GMT""},{""version"":""v8"",""created"":""Thu, 26 Feb 2009 06:48:36 GMT""},{""version"":""v9"",""created"":""Mon, 30 Mar 2009 12:19:00 GMT""}]","2009-04-01"
"0803.4434","Jyotishman Bhowmick","Jyotishman Bhowmick","Quantum Isometry Group of the n tori","Minor changes, acknowledgement to an unknown referee who pointed out
  that a separability assumption can be removed, to appear in Proc. Amer. Math.
  Soc",,,,"math.OA math.QA","http://arxiv.org/licenses/nonexclusive-distrib/1.0/","  We show that the Quantum Isometry Group(as introduced in \cite{goswami}) of
the n tori is the classical isometry group. Moreover, using a result in
\cite{bhowmick goswami}, we conclude that the Quantum Isometry group of the
noncommutative n tori is a Rieffel deformation of the Quantum Isometry Group of
the commutative n tori.
","[{""version"":""v1"",""created"":""Mon, 31 Mar 2008 11:15:42 GMT""},{""version"":""v2"",""created"":""Tue, 17 Feb 2009 13:53:44 GMT""}]","2009-02-17"
"0803.4435","Indranil Biswas","Indranil Biswas and Georg Schumacher","Yang-Mills equation for stable Higgs sheaves",,"Int.J.Math.20:541-556,2009","10.1142/S0129167X09005406",,"math.AG math.DG","http://arxiv.org/licenses/nonexclusive-distrib/1.0/","  We establish a Kobayashi-Hitchin correspondence for the stable Higgs sheaves
on a compact Kaehler manifold. Using it, we also obtain a Kobayashi-Hitchin
correspondence for the stable Higgs G-sheaves, where G is any complex reductive
linear algebraic group.
","[{""version"":""v1"",""created"":""Mon, 31 Mar 2008 11:23:55 GMT""}]","2009-10-16"
"0803.4436","Metod Saniga","Metod Saniga (ASTRINSTSAV), Hans Havlicek (TUW), Michel Planat
  (FEMTO-ST), Petr Pracna (JH-Inst)","Twin ""Fano-Snowflakes"" Over the Smallest Ring of Ternions","6 pages, 1 table, 1 figure; v2 -- standard representation of the ring
  of ternions given, 1 figure and 3 references added; v3 -- published in SIGMA
  (Symmetry, Integrability and Geometry: Methods and Applications) at
  http://www.emis.de/journals/SIGMA/","SIGMA 4 (2008) 050, 7 pages","10.3842/SIGMA.2008.050",,"math-ph math.AG math.MP quant-ph","http://arxiv.org/licenses/nonexclusive-distrib/1.0/","  Given a finite associative ring with unity, $R$, any free (left) cyclic
submodule (FCS) generated by a $uni$modular ($n+1$)-tuple of elements of $R$
represents a point of the $n$-dimensional projective space over $R$. Suppose
that $R$ also features FCSs generated by ($n+1$)-tuples that are $not$
unimodular: what kind of geometry can be ascribed to such FCSs? Here, we
(partially) answer this question for $n=2$ when $R$ is the (unique)
non-commutative ring of order eight. The corresponding geometry is dubbed a
""Fano-Snowflake"" due to its diagrammatic appearance and the fact that it
contains the Fano plane in its center. There exist, in fact, two such
configurations -- each being tied to either of the two maximal ideals of the
ring -- which have the Fano plane in common and can, therefore, be viewed as
twins. Potential relevance of these noteworthy configurations to quantum
information theory and stringy black holes is also outlined.
","[{""version"":""v1"",""created"":""Mon, 31 Mar 2008 11:27:58 GMT""},{""version"":""v2"",""created"":""Mon, 7 Apr 2008 07:19:49 GMT""},{""version"":""v3"",""created"":""Wed, 4 Jun 2008 06:59:36 GMT""}]","2008-12-18"
"0803.4437","Adeline Samson","Xavi\`ere Panhard, Adeline Samson (MAP5)","Extension of the SAEM algorithm for nonlinear mixed models with two
  levels of random effects",,,,"MAP5 2008-04","stat.ME math.ST stat.TH","http://arxiv.org/licenses/nonexclusive-distrib/1.0/","  This article focuses on parameter estimation of multi-levels nonlinear mixed
effects models (MNLMEMs). These models are used to analyze data presenting
multiple hierarchical levels of grouping (cluster data, clinical trials with
several observation periods,...). The variability of the individual parameters
of the regression function is thus decomposed as a between-sub ject variability
and higher levels of variability (for example within-sub ject variability). We
propose maximum likelihood estimates of parameters of those MNLMEMs with two
levels of random effects, using an extension of the SAEM-MCMC algorithm. The
extended SAEM algorithm is split into an explicit direct EM algorithm and a
stochastic EM part. Compared to the original algorithm, additional sufficient
statistics have to be approximated by relying on the conditional distribution
of the second level of random effects. This estimation method is evaluated on
pharmacokinetic cross-over simulated trials, mimicking theophyllin
concentration data. Results obtained on those datasets with either the SAEM
algorithm or the FOCE algorithm (implemented in the nlme function of R
software) are compared: biases and RMSEs of almost all the SAEM estimates are
smaller than the FOCE ones. Finally, we apply the extended SAEM algorithm to
analyze the pharmacokinetic interaction of tenofovir on atazanavir, a novel
protease inhibitor, from the ANRS 107-Puzzle 2 study. A significant decrease of
the area under the curve of atazanavir is found in patients receiving both
treatments.
","[{""version"":""v1"",""created"":""Mon, 31 Mar 2008 11:29:08 GMT""}]","2008-12-18"
"0803.4438","Pavel Gabor","Pavel Gabor, Bruno Chazelas, Frank Brachet, Marc Ollivier, Michel
  Decaudin, Sophie Jacquinod, Alain Lab\`eque, and Alain L\'eger","Stabilising a nulling interferometer using optical path difference
  dithering",,,"10.1051/0004-6361:20077830",,"astro-ph","http://arxiv.org/licenses/nonexclusive-distrib/1.0/","  Context. Nulling interferometry has been suggested as the underlying
principle for the Darwin and TPF-I exoplanet research missions. Aims. There are
constraints both on the mean value of the nulling ratio, and on its stability.
Instrument instability noise is most detrimental to the stability of the
nulling performance. Methods. We applied a modified version of the classical
dithering technique to the optical path difference in the scientific beam.
Results. Using only this method, we repeatedly stabilised the dark fringe for
several hours. This method alone sufficed to remove the 1/ f component of the
noise in our setup for periods of 10 minutes, typically. These results indicate
that performance stability may be maintained throughout the long-duration data
acquisitions typical of exoplanet spectroscopy. Conclusions. We suggest that
further study of possible stabilisation strategies should be an integral part
of Darwin/TPF-I research and development
","[{""version"":""v1"",""created"":""Mon, 31 Mar 2008 11:36:35 GMT""}]","2008-04-01"
"0803.4439","Nikita Sidorov","Jean-Paul Allouche, Matthew Clarke, Nikita Sidorov","Periodic unique beta-expansions: the Sharkovskii ordering","21 pages, 3 figures","Ergodic Theory Dynam. Systems 29 (2009), 1055-1074",,,"math.DS math.NT","http://arxiv.org/licenses/nonexclusive-distrib/1.0/","  Let $\beta\in(1,2)$. Each $x\in[0,\frac{1}{\beta-1}]$ can be represented in
the form \[ x=\sum_{k=1}^\infty \epsilon_k\beta^{-k}, \] where
$\epsilon_k\in\{0,1\}$ for all $k$ (a $\beta$-expansion of $x$). If
$\beta>\frac{1+\sqrt5}{2}$, then, as is well known, there always exist
$x\in(0,\frac1{\beta-1})$ which have a unique $\be$-expansion.
  In the present paper we study (purely) periodic unique $\beta$-expansions and
show that for each $n\ge2$ there exists $\beta_n\in[\frac{1+\sqrt5}{2},2)$ such
that there are no unique periodic $\beta$-expansions of smallest period $n$ for
$\beta\le\beta_n$ and at least one such expansion for $\beta>\beta_n$.
  Furthermore, we prove that $\beta_k<\beta_m$ if and only if $k$ is less than
$m$ in the sense of the Sharkovski\u{\i} ordering. We give two proofs of this
result, one of which is independent, and the other one links it to the dynamics
of a family of trapezoidal maps.
","[{""version"":""v1"",""created"":""Mon, 31 Mar 2008 11:37:13 GMT""},{""version"":""v2"",""created"":""Mon, 4 Aug 2008 16:25:53 GMT""}]","2011-06-21"
"0803.4440","Holger Braun","H. Braun, P. Ditlevsen and D. R. Chialvo","Solar forced Dansgaard-Oeschger events and their phase relation with
  solar proxies",,"Geophys. Res. Lett., 35, L06703, 2008","10.1029/2008GL033414",,"physics.geo-ph physics.ao-ph","http://arxiv.org/licenses/nonexclusive-distrib/1.0/","  North Atlantic climate during glacial times was characterized by
large-amplitude switchings, the Dansgaard-Oeschger (DO) events, with an
apparent tendency to recur preferably in multiples of about 1470 years. Recent
work interpreted these intervals as resulting from a subharmonic response of a
highly nonlinear system to quasi-periodic solar forcing plus noise. This
hypothesis was challenged as inconsistent with the observed variability in the
phase relation between proxies of solar activity and Greenland climate. Here we
reject the claim of inconsistency by showing that this phase variability is a
robust, generic feature of the nonlinear dynamics of DO events, as described by
a model. This variability is expected from the fact that the events are
threshold crossing events, resulting from a cooperative process between the
periodic forcing and the noise. This process produces a fluctuating phase
relation with the periodic forcing, consistent with proxies of solar activity
and Greenland climate.
","[{""version"":""v1"",""created"":""Mon, 31 Mar 2008 11:55:31 GMT""}]","2008-04-01"
"0803.4441","Prasenjit Saha","Prasenjit Saha (Univ Zurich)","Interpreting the Kustaanheimo-Stiefel transform in gravitational
  dynamics","To appear in MNRAS",,"10.1111/j.1365-2966.2009.15437.x",,"astro-ph","http://arxiv.org/licenses/nonexclusive-distrib/1.0/","  The Kustaanheimo-Stiefel transform turns a gravitational two-body problem
into a harmonic oscillator, by going to four dimensions. In addition to the
mathematical-physics interest, the KS transform has proved very useful in
N-body simulations, where it helps handle close encounters. Yet the formalism
remains somewhat arcane, with the role of the extra dimension being especially
mysterious. This paper shows how the basic transformation can be interpreted as
a rotation in three dimensions. For example, if we slew a telescope from zenith
to a chosen star in one rotation, we can think of the rotation axis and angle
as the KS transform of the star. The non-uniqueness of the rotation axis
encodes the extra dimension. This geometrical interpretation becomes evident on
writing KS transforms in quaternion form, which also helps derive concise
expressions for regularized equations of motion.
","[{""version"":""v1"",""created"":""Mon, 31 Mar 2008 11:57:03 GMT""},{""version"":""v2"",""created"":""Thu, 23 Jul 2009 12:54:46 GMT""},{""version"":""v3"",""created"":""Fri, 21 Aug 2009 15:28:21 GMT""}]","2015-05-13"
