"0803.4355","Marko A. Rodriguez","Marko A. Rodriguez","Grammar-Based Random Walkers in Semantic Networks","First draft of manuscript originally written in November 2006","Rodriguez, M.A., ""Grammar-Based Random Walkers in Semantic
  Networks"", Knowledge-Based Systems, volume 21, issue 7, pages 727-739, ISSN:
  0950-7051, Elsevier, October 2008","10.1016/j.knosys.2008.03.030","LA-UR-06-7791","cs.AI cs.DS","http://creativecommons.org/licenses/publicdomain/","  Semantic networks qualify the meaning of an edge relating any two vertices.
Determining which vertices are most ""central"" in a semantic network is
difficult because one relationship type may be deemed subjectively more
important than another. For this reason, research into semantic network metrics
has focused primarily on context-based rankings (i.e. user prescribed
contexts). Moreover, many of the current semantic network metrics rank semantic
associations (i.e. directed paths between two vertices) and not the vertices
themselves. This article presents a framework for calculating semantically
meaningful primary eigenvector-based metrics such as eigenvector centrality and
PageRank in semantic networks using a modified version of the random walker
model of Markov chain analysis. Random walkers, in the context of this article,
are constrained by a grammar, where the grammar is a user defined data
structure that determines the meaning of the final vertex ranking. The ideas in
this article are presented within the context of the Resource Description
Framework (RDF) of the Semantic Web initiative.
","[{""version"":""v1"",""created"":""Mon, 31 Mar 2008 00:13:26 GMT""},{""version"":""v2"",""created"":""Wed, 10 Sep 2008 23:58:07 GMT""}]","2008-09-11"
"0803.4356","Ping Ao","P. Ao","Stochastic Dynamical Structure (SDS) of Nonequilibrium Processes in the
  Absence of Detailed Balance. II: construction of SDS with nonlinear force and
  multiplicative noise","Latex, 9 pages","Potential in Stochastic Differential Equations: Novel
  Construction. P. Ao, J. Phys. A37 L25-L30 (2004)","10.1088/0305-4470/37/3/L01",,"cond-mat.other astro-ph math-ph math.DS math.MP nlin.AO physics.bio-ph q-bio.PE q-bio.SC","http://arxiv.org/licenses/nonexclusive-distrib/1.0/","  There is a whole range of emergent phenomena in non-equilibrium behaviors can
be well described by a set of stochastic differential equations. Inspired by an
insight gained during our study of robustness and stability in phage lambda
genetic switch in modern biology, we found that there exists a classification
of generic nonequilibrium processes: In the continuous description in terms of
stochastic differential equations, there exists four dynamical elements: the
potential function $\phi$, the friction matrix $ S$, the anti-symmetric matrix
$ T $, and the noise. The generic feature of absence of detailed balance is
then precisely represented by $T$. For dynamical near a fixed point, whether or
not it is stable or not, the stochastic dynamics is linear. A rather complete
analysis has been carried out (Kwon, Ao, Thouless, cond-mat/0506280; PNAS, {\bf
102} (2005) 13029), referred to as SDS I. One important and persistent question
is the existence of a potential function with nonlinear force and with
multiplicative noise, with both nice local dynamical and global steady state
properties. Here we demonstrate that a dynamical structure built into
stochastic differential equation allows us to construct such a global
optimization potential function. First, we provide the construction. One of
most important ingredient is the generalized Einstein relation. We then present
an approximation scheme: The gradient expansion which turns every order into
linear matrix equations. The consistent of such methodology with other known
stochastic treatments will be discussed in next paper, SDS III; and the
explicitly connection to statistical mechanics and thermodynamics will be
discussed in a forthcoming paper, SDS IV.
","[{""version"":""v1"",""created"":""Mon, 31 Mar 2008 00:22:22 GMT""}]","2016-09-08"
"0803.4357","Alan M. Nathan","Michael K. McBeath, Alan M. Nathan, A. Terry Bahill, David G. Baldwin","Paradoxical popups: Why are they hard to catch?","28 pages, 10 figures, sumitted to American Journal of Physics",,"10.1119/1.2937899",,"physics.pop-ph","http://arxiv.org/licenses/nonexclusive-distrib/1.0/","  Even professional baseball players occasionally find it difficult to
gracefully approach seemingly routine pop-ups. This paper describes a set of
towering pop-ups with trajectories that exhibit cusps and loops near the apex.
For a normal fly ball, the horizontal velocity is continuously decreasing due
to drag caused by air resistance. But for pop-ups, the Magnus force (the force
due to the ball spinning in a moving airflow) is larger than the drag force. In
these cases the horizontal velocity decreases in the beginning, like a normal
fly ball, but after the apex, the Magnus force accelerates the horizontal
motion. We refer to this class of pop-ups as paradoxical because they appear to
misinform the typically robust optical control strategies used by fielders and
lead to systematic vacillation in running paths, especially when a trajectory
terminates near the fielder. In short, some of the dancing around when
infielders pursue pop-ups can be well explained as a combination of bizarre
trajectories and misguidance by the normally reliable optical control strategy,
rather than apparent fielder error. Former major league infielders confirm that
our model agrees with their experiences.
","[{""version"":""v1"",""created"":""Mon, 31 Mar 2008 00:24:19 GMT""}]","2009-11-13"
"0803.4358","Hiroaki Kusunose","Hiroaki Kusunose","Description of Multipole in f-Electron Systems","18 pages, 3 tables, 6 figures, submitted to J. Phys. Soc. Jpn","J. Phys. Soc. Jpn. 77 (2008) 064710","10.1143/JPSJ.77.064710",,"cond-mat.str-el","http://arxiv.org/licenses/nonexclusive-distrib/1.0/","  A systematic description of multipole degrees of freedom is discussed on the
basis of the Stevens' operator-equivalent technique. The generalized Stevens'
multiplicative factors are derived for all of the electric and the magnetic
multipoles relevant to f-electron systems. With extensive use of the Stevens'
factors, we express the spatial dependences of the electric and the magnetic
fields, and the electric and the magnetic charge densities of localized f
electrons. The latter is utilized to draw wave functions including their
magnetic profile in addition to their shape with the charge density. The
definite relation between the operators as quantum-mechanical variables in a
multipole exchange model and the multipole moments in expansion of
electromagnetic fields is given. The general treatments for the exchange model
with the RPA susceptibility and the Ginzburg-Landau free-energy expansion are
discussed, using CexLa1-xB6 as a typical example. The representative formula of
the vector spherical harmonics are summarized, which are suitable basis for
vector fields in the spherical expansion.
","[{""version"":""v1"",""created"":""Mon, 31 Mar 2008 01:50:33 GMT""}]","2011-07-26"
"0803.4359","Lorenzo Monaco","L. Monaco (ESO), P. Bonifacio (GEPI, Cifist, Inaf-Oat)","Lithium-rich giants in the Sagittarius dSph Tidal Streams","5 pages, 4 figures, 2 tables. Proceedings of the workshop ""XXI
  Century challenges for stellar evolution"", held in Cefalu' (Sicily, Italy),
  August 29 - September 2, 2007; S. Cassisi and M. Salaris Eds. To be published
  in Mem. SAIt Vol. 79 No. 2",,,,"astro-ph","http://arxiv.org/licenses/nonexclusive-distrib/1.0/","  The nature and origin of Lithium rich giant stars is still matter of debate.
In the contest of our spectroscopic survey of giants in the tidal streams of
the Sagittarius dwarf spheroidal (dSph) galaxy, we present the serendipitous
discovery of 2 super Li-rich stars (A(Li)$>$3.5-4.0). Besides D461 in Draco,
these are the only Li-rich stars known in a Local Group dSph galaxy. The high
Li abundance and the low mass of these stars support their origin as due to
fresh Li production in the stars associated with some kind of extra-mixing
process.
","[{""version"":""v1"",""created"":""Mon, 31 Mar 2008 02:12:47 GMT""}]","2008-04-01"
"0803.4360","Qun Wang","Jian Deng, Jin-cheng Wang, Qun Wang","BCS-BEC crossover in a relativistic boson-fermion model beyond mean
  field approximation","The model Lagrangian is re-formulated by decomposing the complex
  scalar field into its real and imaginary parts. The anomalous propagators of
  the complex scalar are then included at tree level. All numerical results are
  updated. ReVTex 4, 13 pages, 10 figures, PRD accepted version","Phys.Rev.D78:034014,2008","10.1103/PhysRevD.78.034014",,"hep-ph","http://arxiv.org/licenses/nonexclusive-distrib/1.0/","  We investigate the fluctuation effect of the di-fermion field in the
crossover from Bardeen-Cooper-Schrieffer (BCS) pairing to a Bose-Einstein
condensate (BEC) in a relativistic superfluid. We work within the boson-fermion
model obeying a global U(1) symmetry. To go beyond the mean field approximation
we use Cornwall-Jackiw-Tomboulis (CJT) formalism to include higher order
contributions. The quantum fluctuations of the pairing condensate is provided
by bosons in non-zero modes, whose interaction with fermions gives the
two-particle-irreducible (2PI) effective potential. It changes the crossover
property in the BEC regime. With the fluctuations the superfluid phase
transition becomes the first order in grand canonical ensemble. We calculate
the condensate, the critical temperature $T_{c}$ and particle abundances as
functions of crossover parameter the boson mass.
","[{""version"":""v1"",""created"":""Mon, 31 Mar 2008 02:16:31 GMT""},{""version"":""v2"",""created"":""Mon, 21 Jul 2008 01:23:59 GMT""}]","2008-11-26"
"0803.4361","Matthew Kennedy","Matthew Kennedy, Heydar Radjavi","Spectral conditions on Lie and Jordan algebras of compact operators","14 pages","J. Funct. Anal. 256 (2009), no. 10, 3143-3157",,,"math.OA math.FA","http://arxiv.org/licenses/nonexclusive-distrib/1.0/","  We investigate the properties of bounded operators which satisfy a certain
spectral additivity condition, and use our results to study Lie and Jordan
algebras of compact operators. We prove that these algebras have nontrivial
invariant subspaces when their elements have sublinear or submultiplicative
spectrum, and when they satisfy simple trace conditions. In certain cases we
show that these conditions imply that the algebra is (simultaneously)
triangularizable.
","[{""version"":""v1"",""created"":""Mon, 31 Mar 2008 02:33:03 GMT""}]","2010-01-20"
"0803.4362","Koichi Saito","S. Nagai, T. Miyatsu, K. Saito, K. Tsushima","Quark-meson coupling model with the cloudy bag","13 pages, 3 figures","Phys.Lett.B666:239-244,2008","10.1016/j.physletb.2008.07.065","JLAB-THY-08-807","nucl-th hep-ph nucl-ex","http://creativecommons.org/licenses/by-nc-sa/3.0/","  Using the volume coupling version of the cloudy bag model, the quark-meson
coupling model is extended to study the role of pion field and the properties
of nuclear matter. The extended model includes the effect of gluon exchange as
well as the pion-cloud effect, and provides a good description of the nuclear
matter properties. The relationship between the extended model and the EFT
approach to nuclear matter is also discussed.
","[{""version"":""v1"",""created"":""Mon, 31 Mar 2008 02:44:41 GMT""}]","2008-11-26"
"0803.4363","Daun Jeong","Daun Jeong, M. Y. Choi, YounJoon Jung, and Hyung J. Kim","1/f spectrum and memory function analysis of solvation dynamics in a
  room-temperature ionic liquid","10 pages, 4 figures",,"10.1063/1.2911927",,"cond-mat.stat-mech cond-mat.soft","http://arxiv.org/licenses/nonexclusive-distrib/1.0/","  To understand the non-exponential relaxation associated with solvation
dynamics in the ionic liquid 1-ethyl-3-methylimidazolium hexafluorophosphate,
we study power spectra of the fluctuating Franck-Condon energy gap of a
diatomic probe solute via molecular dynamics simulations. Results show 1/f
dependence in a wide frequency range over 2 to 3 decades, indicating
distributed relaxation times. We analyze the memory function and solvation time
in the framework of the generalized Langevin equation using a simple model
description for the power spectrum. It is found that the crossover frequency
toward the white noise plateau is directly related to the time scale for the
memory function and thus the solvation time. Specifically, the low crossover
frequency observed in the ionic liquid leads to a slowly-decaying tail in its
memory function and long solvation time. By contrast, acetonitrile
characterized by a high crossover frequency and (near) absence of 1/f behavior
in its power spectra shows fast relaxation of the memory function and
single-exponential decay of solvation dynamics in the long-time regime.
","[{""version"":""v1"",""created"":""Mon, 31 Mar 2008 05:07:37 GMT""}]","2009-11-13"
"0803.4364","Xian-Ting Liang","Xian-Ting Liang","Decoherence and relaxation of qubits coupled to low- and
  medium-frequency Ohmic baths directly and via a harmonic oscillator","5 pages, 6 figures","Chemical Physics 352 (2008) 106-110","10.1016/j.chemphys.2008.05.015",,"quant-ph","http://arxiv.org/licenses/nonexclusive-distrib/1.0/","  Using the numerical path integral method we investigate the decoherence and
relaxation of qubits in spin-boson (SB) and spin-intermediate harmonic
oscillator (IHO)-bath (SIB) models. The cases that the environment baths with
low and medium frequencies are investigated. It is shown that the qubits in SB
and SIB models have the same decoherence and relaxation as the baths with low
frequencies. However, the qubits in the two models have different decoherence
and relaxation as the baths with medium frequencies. The decoherence and
relaxation of the qubit in SIB model can be modulated through changing the
coupling coefficients of the qubit-IHO and IHO-bath and the oscillation
frequency of the IHO.
","[{""version"":""v1"",""created"":""Mon, 31 Mar 2008 03:27:28 GMT""}]","2009-11-13"
"0803.4365","Xian-Ting Liang","Zhi-Qiang Li, Xian-Ting Liang","Decoherence and purity of a driven solid-state qubit in Ohmic bath","9 pages, 8 figures","Physica E 40 (2008) 2671-2676","10.1016/j.physe.2007.12.003",,"quant-ph","http://arxiv.org/licenses/nonexclusive-distrib/1.0/","  In this paper we study the decoherence and purity of a driven solid-state
qubit in the Ohmic bath by using the method based on the master equation. At
first, instead of solving the master equation we investigate the coefficients
of the equation which describe the shift in frequency, diffusive, decoherence,
and so on. It is shown that one of the coefficients (we called it decoherence
coefficient) is crucial to the decoherence of the qubit in the model. Then we
investigate the evolution of the purity of the state in the model. From the
analysis of the purity we see that the decoherence time of the qubit decrease
with the increase of the amplitude of the driven fields and it is increase with
the increase of the frequency of the driven fields.
","[{""version"":""v1"",""created"":""Mon, 31 Mar 2008 03:35:53 GMT""}]","2009-11-13"
"0803.4366","Nikodem Poplawski","Nikodem J. Poplawski","Variational formulation of Eisenhart's unified theory","7 pages; published version","Int.J.Mod.Phys.A24 (2009) 3975-3984","10.1142/S0217751X09044735",,"gr-qc math-ph math.MP","http://arxiv.org/licenses/nonexclusive-distrib/1.0/","  Eisenhart's classical unified field theory is based on a non-Riemannian
affine connection related to the covariant derivative of the electromagnetic
field tensor. The sourceless field equations of this theory arise from
vanishing of the torsion trace and the symmetrized Ricci tensor. We formulate
Eisenhart's theory from the metric-affine variational principle. In this
formulation, a Lagrange multiplier constraining the torsion becomes the source
for the Maxwell equations.
","[{""version"":""v1"",""created"":""Mon, 31 Mar 2008 04:12:05 GMT""},{""version"":""v2"",""created"":""Sun, 30 Aug 2009 18:12:00 GMT""}]","2009-08-30"
"0803.4367","C. K. Raju Dr","C. K. Raju","A new mathematical model for molecular dynamics 1: Molecular basis of
  memory","6 pages, 4 figures",,,,"physics.gen-ph","http://arxiv.org/licenses/nonexclusive-distrib/1.0/","  Proteins have been empirically linked to memory. If memory relates to protein
structure, then each conformation would_functionally_ code only one bit, making
it difficult to explain large memories. Nor is there a simple way to relate
memory to protein dynamics on current molecular dynamics (MD), which is
memoryless. Here we point out that MD may be modified to involve memory ab
initio without any new hypothesis: simply replace the electrostatic (Coulomb)
force by the electrodynamic force--which is more accurate. We now need to solve
functional differential equations (FDEs), instead of the ordinary differential
equations (ODEs) currently solved in MD. Unlike ODEs, retarded FDEs are
history-dependent: so memory is already present even at the level of
interacting sites within molecules. The resulting increase in computational
complexity is within the reach of current computers. While Amdahl's law does
pose a challenge to parallelised time-stepping with this model, the
compute-intensive part--the force calculation--may still be carried out in
parallel. Thus, reformulating MD to use FDEs is feasible, and this could help
to understand the possible dynamical basis of memory.
","[{""version"":""v1"",""created"":""Mon, 31 Mar 2008 04:26:57 GMT""}]","2011-07-22"
"0803.4368","Yurii Nikonorov Gennadyevich","V.N. Berestovskii (Omsk Branch of Sobolev Institute of Mathematics SD
  RAS), Yu.G. Nikonorov (Rubtsovsk Industrial Institute)","Clifford-Wolf homogeneous Riemannian manifolds","24 pages",,,,"math.DG","http://arxiv.org/licenses/nonexclusive-distrib/1.0/","  In this paper, using connections between Clifford-Wolf isometries and Killing
vector fields of constant length on a given Riemannian manifold, we classify
simply connected Clifford-Wolf homogeneous Riemannian manifolds. We also get
the classification of complete simply connected Riemannian manifolds with the
Killing property defined and studied previously by J.E. D'Atri and H.K.
Nickerson. In the last part of the paper we study properties of
Clifford-Killing spaces, that is, real vector spaces of Killing vector fields
of constant length, on odd-dimensional round spheres, and discuss numerous
connections between these spaces and various classical objects.
","[{""version"":""v1"",""created"":""Mon, 31 Mar 2008 04:10:20 GMT""}]","2008-04-01"
"0803.4369","Tiberiu Harko","T. Harko, V. S. Sabau","Jacobi stability of the vacuum in the static spherically symmetric brane
  world models","21 pages, 3 figures, accepted for publication in PRD","Phys.Rev.D77:104009,2008","10.1103/PhysRevD.77.104009",,"gr-qc hep-th math-ph math.MP","http://arxiv.org/licenses/nonexclusive-distrib/1.0/","  We analyze the stability of the structure equations of the vacuum in the
brane world models, by using both the linear (Lyapunov) stability analysis, and
the Jacobi stability analysis, the Kosambi-Cartan-Chern (KCC) theory. In the
brane world models the four dimensional effective Einstein equations acquire
extra terms, called dark radiation and dark pressure, respectively, which arise
from the embedding of the 3-brane in the bulk. Generally, the spherically
symmetric vacuum solutions of the brane gravitational field equations, have
properties quite distinct as compared to the standard black hole solutions of
general relativity. We close the structure equations by assuming a simple
linear equation of state for the dark pressure. In this case the vacuum is
Jacobi stable only for a small range of values of the proportionality constant
relating the dark pressure and the dark radiation. The unstable trajectories on
the brane behave chaotically, in the sense that after a finite radial distance
it would be impossible to distinguish the trajectories that were very near each
other at an initial point. Hence the Jacobi stability analysis offers a
powerful method for constraining the physical properties of the vacuum on the
brane.
","[{""version"":""v1"",""created"":""Mon, 31 Mar 2008 04:33:35 GMT""},{""version"":""v2"",""created"":""Sat, 3 May 2008 04:38:48 GMT""}]","2008-11-26"
"0803.4370","L.T. Handoko","Z. Akbar and L.T. Handoko","GRID Architecture through a Public Cluster","5 pages, Proceeding of the 2008 International Conference on Computer
  and Communication Engineering",,"10.1109/ICCCE.2008.4580761","FISIKALIPI-08032","cs.DC cs.NI","http://arxiv.org/licenses/nonexclusive-distrib/1.0/","  An architecture to enable some blocks consisting of several nodes in a public
cluster connected to different grid collaborations is introduced. It is
realized by inserting a web-service in addition to the standard Globus Toolkit.
The new web-service performs two main tasks : authenticate the digital
certificate contained in an incoming requests and forward it to the designated
block. The appropriate block is mapped with the username of the block's owner
contained in the digital certificate. It is argued that this algorithm opens an
opportunity for any blocks in a public cluster to join various global grids.
","[{""version"":""v1"",""created"":""Mon, 31 Mar 2008 05:05:04 GMT""},{""version"":""v2"",""created"":""Wed, 9 Apr 2008 13:04:20 GMT""},{""version"":""v3"",""created"":""Thu, 1 Jan 2009 01:58:27 GMT""}]","2009-03-06"
"0803.4371","Koji Harada","Koji Harada","Problems in the derivations of the renormalization group equation for
  the low momentum nucleon interactions","16 pages, no figure; (ver.3) A significant revision is made; the
  condition under which the extra terms in the RGE cancel is clarified (ver.4)
  some expressions modified; it is emphasized that the numerical works in the
  literature are not affected by this paper",,"10.1143/PTP.120.741","KYUSHU-HET-112","nucl-th hep-ph","http://arxiv.org/licenses/nonexclusive-distrib/1.0/","  We carefully examine all the four derivations of the renormalization group
equation (RGE) for the so-called $\Vlk$ potential, given by Bogner, \textit{et.
al.}[nucl-th/0111042]. Two derivations based on the ``semi-group composition
law'' are shown to be unjustified, while the other two based on the
completeness relation of the model space must be modified if there are bound
states. It is however shown that the RGE is unchanged if the bound state
wavefunctions in the reduced theory are required to have the same low-momentum
components as those in the original theory. Several aspects of the $\Vlk$
approach are also discussed.
","[{""version"":""v1"",""created"":""Mon, 31 Mar 2008 05:26:00 GMT""},{""version"":""v2"",""created"":""Thu, 3 Apr 2008 04:56:22 GMT""},{""version"":""v3"",""created"":""Fri, 2 May 2008 08:41:48 GMT""},{""version"":""v4"",""created"":""Fri, 30 May 2008 01:57:35 GMT""}]","2009-11-13"
"0803.4372","Feng Yuan","Feng Yuan (SHAO), Fuguo Xie (SHAO), and Jeremiah P. Ostriker
  (Princeton)","Global Compton heating and cooling in hot accretion flows","7 pages, 3 figures; accepted by ApJ","Astrophys.J.691:98-104,2009","10.1088/0004-637X/691/1/98",,"astro-ph","http://arxiv.org/licenses/nonexclusive-distrib/1.0/","  The hot accretion flow is usually optically thin in the radial direction,
therefore the photons produced at one radius can travel for a long distance
without being absorbed. These photons thus can heat or cool electrons at other
radii via Compton scattering. This effect has been ignored in most previous
works on hot accretion flows and is the focus of this paper. If the mass
accretion rate is described by $\dot{M}=\dot{M}_0(r/r_{\rm out})^{0.3}$ and
$r_{\rm out}=10^4r_{\rm s}$, we find that the Compton scattering will play a
cooling and heating role at $r\la 5\times 10^3 r_{\rm s}$ and $r\ga 5\times
10^3 r_{\rm s}$, respectively. Specifically, when $\dot{M}_0>0.1L_{\rm
Edd}/c^2$, the Compton cooling rate is larger than the local viscous heating
rate at certain radius; therefore the cooling effect is important. When
$\dot{M}_0>2L_{\rm Edd}/c^2$, the heating effect at $r_{\rm out}$ is important.
We can obtain the self-consistent steady solution with the global Compton
effect included only if $\dot{M}_0\la L_{\rm Edd}/c^2$ for $r_{\rm
out}=50r_{\rm s}$, which corresponds to $L\la 0.02L_{\rm Edd}$. Above this rate
the Compton cooling is so strong at the inner region that hot solutions can not
exist. On the other hand, for $r_{\rm out}= 10^5r_{\rm s}$, we can only get the
self-consistent solution when $\dot{M}_0\la L_{\rm Edd}/c^2$ and $L<0.01L_{\rm
Edd}$. Above this accretion rate the equilibrium temperature of electrons at
$r_{\rm out}$ is higher than the virial temperature as a result of strong
Compton heating, so the accretion is suppressed. In this case the activity of
the black hole will likely ""oscillate"" between an active and an inactive
phases, with the oscillation timescale being the radiative timescale of the gas
at $r_{\rm out}$.
","[{""version"":""v1"",""created"":""Mon, 31 Mar 2008 05:44:01 GMT""},{""version"":""v2"",""created"":""Wed, 24 Sep 2008 05:33:20 GMT""}]","2009-06-23"
