"0811.2883","Gregory Lousberg","Gregory P. Lousberg, Marcel Ausloos, Christophe Geuzaine, Patrick
  Dular, Philippe Vanderbemden, and Benoit Vanderheyden","Numerical simulation of the magnetization of high-temperature
  superconductors: 3D finite element method using a single time-step iteration",,,"10.1088/0953-2048/22/5/055005",,"cond-mat.supr-con cond-mat.mtrl-sci","http://arxiv.org/licenses/nonexclusive-distrib/1.0/","  We make progress towards a 3D finite-element model for the magnetization of a
high temperature superconductor (HTS): We suggest a method that takes into
account demagnetisation effects and flux creep, while it neglects the effects
associated with currents that are not perpendicular to the local magnetic
induction. We consider samples that are subjected to a uniform magnetic field
varying linearly with time. Their magnetization is calculated by means of a
weak formulation in the magnetostatic approximation of the Maxwell equations
(A-phi formulation). An implicit method is used for the temporal resolution
(Backward Euler scheme) and is solved in the open source solver GetDP. Picard
iterations are used to deal with the power law conductivity of HTS. The finite
element formulation is validated for an HTS tube with large pinning strength
through the comparison with results obtained with other well-established
methods. We show that carrying the calculations with a single time-step (as
opposed to many small time-steps) produce results with excellent accuracy in a
drastically reduced simulation time. The numerical method is extended to the
study of the trapped magnetization of cylinders that are drilled with different
arrays of columnar holes arranged parallel to the cylinder axis.
","[{""version"":""v1"",""created"":""Tue, 18 Nov 2008 10:49:25 GMT""}]","2009-11-13"
"0811.2884","Marco Selvi","Marco Selvi (for the LVD Collaboration)","The LVD Core Facility: a study of LVD as muon veto and active shielding
  for dark matter experiments","5 pages, 4 figures, to appear in the proceedings of the
  Identification of Dark Matter conference (IDM2008), Stockholm, Sweden, 18-22
  August, 2008","PoS idm2008:081,2008",,,"hep-ex","http://arxiv.org/licenses/nonexclusive-distrib/1.0/","  In this study we explore the possibility of using the existing structure of a
running experiment, the LVD supernova observatory at the INFN Gran Sasso
National Laboratory, as an active shield and veto for the muon-induced
background. In our vision LVD could become (without affecting in any way its
main purpose of SN neutrino telescope) a host for a relatively compact but
massive experiment looking for rare events. The empty volume that can be
obtained removing 2 modules from the most internal part of the detector is 2.1m
x 6.2m x 2.8m; we will call it LVD Core Facility (LVD-CF). We have evaluated
the active vetoing and shielding power of LVD, with a detailed MC simulation
(based on Geant4) of the detector and the rock that surrounds it. The results
show that the flux of neutrons that are not associated with a visible muon in
LVD is very low; it results reduced by a factor 50, equivalent to the one
present in a much deeper underground laboratory, i.e. Sudbury. Moreover we
present the results of on-going measurements about the gamma contamination
inside the LVD-CF: it is reduced by a factor greater than 10 with respect to
the one measured outside the LVD detector.
","[{""version"":""v1"",""created"":""Tue, 18 Nov 2008 10:53:24 GMT""}]","2019-08-13"
"0811.2885","Vincent Togo","V. Togo and I. Traore'","Bulk etch rate measurements and calibrations of CR39 and Makrofol
  nuclear track detectors","4 pages, 6 eps figures. Talk given at the 24th ICNTS, Bologna, Italy
  (1-5 Sept. 2008)",,,,"physics.ins-det","http://arxiv.org/licenses/nonexclusive-distrib/1.0/","  We developed a new method for determining the bulk etch rate velocity based
on both cone height and base diameter measurements of the etched tracks. This
method is applied here for the calibration of CR39 and Makrofol nuclear track
detectors exposed to 158 A GeV In^{49+} and Pb^{82+} ions, respectively. For
CR39 the peaks corresponding to indium ions and their different fragments are
well separated from Z/beta = 7 to 49: the detection threshold is at REL ~ 50
MeV cm^2 g^{-1}, corresponding to a nuclear fragment with Z/beta = 7. The
calibration of Makrofol with Pb^{82+} ions has shown all peaks due to lead ions
and their fragments from Z/beta ~ 51 to 83 (charge pickup). The detection
threshold of Makrofol is at REL ~ 2700 MeV cm^2 g^{-1}, corresponding to a
nuclear fragment with Z/beta = 51.
","[{""version"":""v1"",""created"":""Tue, 18 Nov 2008 10:57:18 GMT""}]","2008-11-19"
"0811.2886","Wim de Boer","Wim de Boer and Jochen Ebert (University of Karlsruhe, Germany)","Powering via Cooling Pipes: an Optimized Design for an SLHC Silicon
  Tracker","Contributed Paper to the IEEE Conference in Dresden, Germany, October
  2008. 6 pages, 13 figures",,,,"physics.ins-det","http://arxiv.org/licenses/nonexclusive-distrib/1.0/","  Silicon trackers at the SLHC will suffer high radiation damage from particles
produced during the collisions, which leads to high leakage currents. Reducing
these currents in the sensors requires efficient cooling to -30 C. The large
heat of evaporation of CO2 and the low viscosity allows for a two-phase cooling
system with thin and long cooling pipes, because the small flow of liquid
needed leads to negligible temperature drops. In order to reduce the material
budget a system is proposed in which a large scale tracker requiring ca. 50 kW
of power is powered via 1-2 mm diameter aluminum cooling pipes with a length of
several m. These long cooling pipes allow to have all service connections
outside the tracking volume, thus reducing the material budget significantly.
The whole system is designed to have negligible thermal stresses. A CO2 blow
system has been designed and first tests show the feasibility of a barrel
detector with long ladders and disks at small radii leading to an optimized
design with respect to material budget and simplicity in construction.
","[{""version"":""v1"",""created"":""Tue, 18 Nov 2008 11:09:07 GMT""}]","2008-11-19"
"0811.2887","Tan Aihong","Aihong Tan, Changde Xie, Kunchi Peng","Quantum Logical Gates with Linear Quadripartite Cluster States of
  Continuous Variables","accepted for publication by PRA",,"10.1103/PhysRevA.79.042338",,"quant-ph","http://arxiv.org/licenses/nonexclusive-distrib/1.0/","  The concrete schemes to realize three types of basic quantum logical gates
using linear quadripartite cluster states of optical continuous variables are
proposed. The influences of noises and finite squeezing on the computation
precision are analyzed in terms of the fidelity of propagated quantum
information through the continuous variable cluster states. The proposed
schemes provide direct references for the design of experimental systems of
one-way quantum computer based on the cluster entanglement of amplitude and
phase quadratures of light.
","[{""version"":""v1"",""created"":""Tue, 18 Nov 2008 11:26:20 GMT""},{""version"":""v2"",""created"":""Sun, 29 Mar 2009 11:31:32 GMT""}]","2015-05-13"
"0811.2888","Gino Isidori","Riccardo Barbieri, Gino Isidori, Duccio Pappadopulo","Composite fermions in Electroweak Symmetry Breaking","18 pages, 2 figures (v2: minor modifications, published version)","JHEP 0902:029,2009","10.1088/1126-6708/2009/02/029",,"hep-ph","http://arxiv.org/licenses/nonexclusive-distrib/1.0/","  If the electroweak symmetry is broken by some unspecified strong dynamics,
composite fermions may exist with definite transformation properties under
SU(2)_L x SU(2)_R/SU(2)_{L+R} and may play a role in giving masses by mixing to
all the standard quarks and leptons. Assuming this to be the case, we analyze
the role of Singlets, Doublets and Triplets in the ElectroWeak Precision Tests
and in Flavour Physics. Doublets and Triplets are generically disfavoured. In
the Singlet case, we specify the breaking patterns of the flavour group that
allow to keep the CKM picture of flavour physics and we discuss the effects of
the mixing between composite and elementary fermions. These mixings affect in
particular the rather peculiar LHC phenomenology of the composite fermions.
","[{""version"":""v1"",""created"":""Tue, 18 Nov 2008 11:26:51 GMT""},{""version"":""v2"",""created"":""Wed, 11 Mar 2009 13:38:19 GMT""}]","2010-02-22"
"0811.2889","Basile Graf","Basile Graf","Quaternions and dynamics","22 pages, 2 figures",,,,"math.DS math-ph math.MP","http://arxiv.org/licenses/nonexclusive-distrib/1.0/","  We give a simple and self contained introduction to quaternions and their
practical usage in dynamics. The rigid body dynamics are presented in full
details. In the appendix, some more exotic relations are given that allow to
write more complex models, for instance, the one of a satellite with inertial
wheels and expressed in a non-inertial reference frame. As it is well known,
one nice advantage of quaternions over Euler angles, beside the usual
arguments, is that it allows to write down quite complex dynamics completely by
hand.
","[{""version"":""v1"",""created"":""Tue, 18 Nov 2008 11:28:30 GMT""}]","2008-11-19"
"0811.2890","Carlos Escudero","Carlos Escudero","On the Geometric Principles of Surface Growth",,"Phys. Rev. Lett. 101, 196102 (2008)","10.1103/PhysRevLett.101.196102",,"cond-mat.stat-mech cond-mat.mtrl-sci nlin.AO","http://arxiv.org/licenses/nonexclusive-distrib/1.0/","  We introduce a new equation describing epitaxial growth processes. This
equation is derived from a simple variational geometric principle and it has a
straightforward interpretation in terms of continuum and microscopic physics.
It is also able to reproduce the critical behavior already observed, mound
formation and mass conservation, but however does not fit a divergence form as
the most commonly spread models of conserved surface growth. This formulation
allows us to connect the results of the dynamic renormalization group analysis
with intuitive geometric principles, whose generic character may well allow
them to describe surface growth and other phenomena in different areas of
physics.
","[{""version"":""v1"",""created"":""Tue, 18 Nov 2008 11:33:32 GMT""}]","2009-11-13"
"0811.2891","Jose Illana","F. del Aguila, J.I. Illana, M.D. Jenkins","Precise limits from lepton flavour violating processes on the Littlest
  Higgs model with T-parity","41 pages, 11 figures; v3: matches published version in JHEP","JHEP 0901:080,2009","10.1088/1126-6708/2009/01/080","CAFPE-109/08, UG-FT-239/08","hep-ph","http://arxiv.org/licenses/nonexclusive-distrib/1.0/","  We recalculate the leading one-loop contributions to mu > e gamma and mu ->
eee in the Littlest Higgs model with T-parity, recovering previous results for
the former. When all the Goldstone interactions are taken into account, the
latter is also ultraviolet finite. The present experimental limits on these
processes require a somewhat heavy effective scale ~2.5 TeV, or the flavour
alignment of the Yukawa couplings of light and heavy leptons at the ~10% level,
or the splitting of heavy lepton masses to a similar precision. Present limits
on tau decays set no bounds on the corresponding parameters involving the tau
lepton
","[{""version"":""v1"",""created"":""Tue, 18 Nov 2008 15:24:20 GMT""},{""version"":""v2"",""created"":""Thu, 27 Nov 2008 14:21:23 GMT""},{""version"":""v3"",""created"":""Tue, 27 Jan 2009 18:06:21 GMT""}]","2009-02-10"
"0811.2892","Eric Shellef","Eric Shellef","An Upper Bound on the critical density for Activated Random Walks on
  Euclidean Lattices","4 pages",,,,"math.PR math-ph math.MP","http://arxiv.org/licenses/nonexclusive-distrib/1.0/","  We show the critical density for activated random walks on Euclidean lattices
is at most one.
","[{""version"":""v1"",""created"":""Tue, 18 Nov 2008 11:48:35 GMT""}]","2008-11-19"
"0811.2893","Feng Yuan","Feng Yuan (SHAO), Jun Lin (YNAO/CfA), Kinwah Wu (MSSL-UCL), Luis C. Ho
  (Carnegie Observatories)","A Magnetohydrodynamic Model for the Formation of Episodic Jets","8 pages, 2 figures; the finalized version to appear in MNRAS",,"10.1111/j.1365-2966.2009.14673.x",,"astro-ph","http://arxiv.org/licenses/nonexclusive-distrib/1.0/","  Episodic ejection of plasma blobs have been observed in many black hole
systems. While steady, continuous jets are believed to be associated with
large-scale open magnetic fields, what causes the episodic ejection of blobs
remains unclear. Here by analogy with the coronal mass ejection on the Sun, we
propose a magnetohydrodynamical model for episodic ejections from black holes
associated with the closed magnetic fields in an accretion flow. Shear and
turbulence of the accretion flow deform the field and result in the formation
of a flux rope in the disk corona. Energy and helicity are accumulated and
stored until a threshold is reached. The system then loses its equilibrium and
the flux rope is thrust outward by the magnetic compression force in a
catastrophic way. Our calculations show that for parameters appropriate for the
black hole in our Galactic center, the plasmoid can attain relativistic speeds
in about 35 minutes.
","[{""version"":""v1"",""created"":""Tue, 18 Nov 2008 12:01:00 GMT""},{""version"":""v2"",""created"":""Tue, 24 Feb 2009 23:30:48 GMT""}]","2009-11-13"
"0811.2894","Vladimir Zoller","R.Fiore and V.R.Zoller","Current non-conservation effects in $\nu$DIS diffraction","Prepared for the Int. Workshop on Diffraction in High-Energy Physics,
  Diffraction 2008, La Londe-les-Maures, France, Sept. 9-14, 2008",,"10.1063/1.3122200",,"hep-ph","http://arxiv.org/licenses/nonexclusive-distrib/1.0/","  In the neutrino DIS diffraction the charged current non-conservation gives
rise to sizable corrections to the longitudinal structure function, $F_L$.
These corrections is a higher twist effect enhanced at small-$x$ by the rapidly
growing gluon density. The phenomenon manifests itself in abundant production
of charm and strangeness by longitudinally polarized W bosons of moderate
virtualities $Q^2\lsim m_c^2$.
","[{""version"":""v1"",""created"":""Tue, 18 Nov 2008 12:36:11 GMT""}]","2009-11-13"
"0811.2895","Arno Fehm","Arno Fehm","Subfields of ample fields I. Rational maps and definability","8 pages",,,,"math.AG math.LO math.NT","http://arxiv.org/licenses/nonexclusive-distrib/1.0/","  Pop proved that a smooth curve C over an ample field K that has a K-rational
point has |K| many K-rational points. We strengthen this result by showing that
there are |K| many K-rational points that do not lie in a given proper
subfield, even after applying a rational map. As a consequence we gain insight
into the structure of existentially definable subsets of ample fields. In
particular, we prove that a perfect ample field has no existentially definable
proper infinite subfields.
","[{""version"":""v1"",""created"":""Tue, 18 Nov 2008 13:07:56 GMT""}]","2008-11-19"
"0811.2896","B. J. Mochejska","B. J. Mochejska, K. Z. Stanek, D. D. Sasselov, A. H. Szentgyorgyi, R.
  L. Cooper, R. C. Hickox, V. Hradecky, D. P. Marrone, J. N. Winn, A.
  Schwarzenberg-Czerny","Planets in Stellar Clusters Extensive Search. V. Search for planets and
  identification of 18 new variable stars in the old open cluster NGC 188","17 pages LaTeX, including 8 figures and 3 tables. Paper with better
  resolution available at
  http://users.camk.edu.pl/mochejsk/PISCES/FTP/papers/5_N188/ms.ps.gz","ActaAstron.58:263,2008",,,"astro-ph","http://arxiv.org/licenses/nonexclusive-distrib/1.0/","  We have undertaken a long-term project, Planets in Stellar Clusters Extensive
Search (PISCES), to search for transiting planets in open clusters. In this
paper we present the results for NGC 188, an old, rather populous cluster. We
have monitored the cluster for more than 87 hours, spread over 45 nights. We
have not detected any good transiting planet candidates. We have discovered 18
new variable stars in the cluster, bringing the total number of identified
variables to 46, and present for them high precision light curves, spanning 15
months.
","[{""version"":""v1"",""created"":""Tue, 18 Nov 2008 12:52:36 GMT""}]","2008-12-18"
"0811.2897","Tobias Herr","T. Herr (MPI-K, Heidelberg, Germany), W. Hofmann (MPI-K, Heidelberg,
  Germany) (for the H.E.S.S. Collaboration)","Very-High Energy Gamma-Ray Flux Limits for Nearby Active Galactic Nuclei","4 pages, 5 figures, Submitted to Proceedings of ""4th International
  Symposium on High Energy Gamma-Ray Astronomy 2008""",,"10.1063/1.3076758",,"astro-ph","http://arxiv.org/licenses/nonexclusive-distrib/1.0/","  Combining the results of targeted observations, H.E.S.S. has accumulated a
large amount of extra-galactic exposure at TeV energies. Due to its large field
of view a considerable part of the sky (0.6 sr) has been observed with high
sensitivity outside the targeted observation positions. Since this exposure
region contains little inherent bias, it is well suited for studies of
extra-galactic source populations. Given the correlation between ultra-high
energy cosmic rays and nearby extra-galactic objects recently claimed by the
Auger collaboration, this unbiased sky sample by H.E.S.S. is of interest since
it includes (besides the targeted sources) 63 AGN within 100 Mpc, for which
very-high energy gamma-ray flux limits are derived.
","[{""version"":""v1"",""created"":""Tue, 18 Nov 2008 13:07:51 GMT""}]","2019-08-14"
"0811.2898","Mateusz Goryca","M. Goryca, T. Kazimierczuk, M. Nawrocki, A. Golnik, J.A. Gaj, P.
  Kossacki, P. Wojnar, G. Karczewski","Optical manipulation of a single Mn spin in a CdTe-based quantum dot","4 pages, 3 figures","Phys. Rev. Lett. 103, 087401 (2009)","10.1103/PhysRevLett.103.087401",,"cond-mat.other","http://arxiv.org/licenses/nonexclusive-distrib/1.0/","  A system of two coupled CdTe quantum dots, one of them containing a single Mn
ion, was studied in continuous wave and modulated photoluminescence,
photoluminescence excitation, and photon correlation experiments. Optical
writing of information in the spin state of the Mn ion has been demonstrated,
using orientation of the Mn spin by spin-polarized carriers transferred from
the neighbor quantum dot. Mn spin orientation time values from 20 ns to 100 ns
were measured, depending on the excitation power. Storage time of the
information in the Mn spin was found to be enhanced by application of a static
magnetic field of 1 T, reaching hundreds of microseconds in the dark. Simple
rate equation models were found to describe correctly static and dynamical
properties of the system.
","[{""version"":""v1"",""created"":""Tue, 18 Nov 2008 13:08:33 GMT""}]","2011-01-13"
"0811.2899","Manuel Kauers","Alin Bostan and Manuel Kauers","Automatic Classification of Restricted Lattice Walks",,,,,"math.CO","http://arxiv.org/licenses/nonexclusive-distrib/1.0/","  We propose an experimental mathematics approach leading to the
computer-driven discovery of various structural properties of general counting
functions coming from enumeration of walks.
","[{""version"":""v1"",""created"":""Tue, 18 Nov 2008 13:17:43 GMT""},{""version"":""v2"",""created"":""Mon, 1 Jun 2009 17:01:01 GMT""}]","2009-06-01"
"0811.2900","Pablo G. Camara","G. Aldazabal, P. G. Camara, J. A. Rosabal","Flux algebra, Bianchi identities and Freed-Witten anomalies in F-theory
  compactifications","50 pages. Section 5.2 corrected","Nucl.Phys.B814:21-52,2009","10.1016/j.nuclphysb.2009.01.006","CPHT-RR083.1108","hep-th","http://arxiv.org/licenses/nonexclusive-distrib/1.0/","  We discuss the structure of 4D gauged supergravity algebras corresponding to
globally non-geometric compactifications of F-theory, admitting a local
geometric description in terms of 10D supergravity. By starting with the well
known algebra of gauge generators associated to non-geometric type IIB fluxes,
we derive a full algebra containing all, closed RR and NSNS, geometric and
non-geometric dual fluxes. We achieve this generalization by a systematic
application of SL(2,Z) duality transformations and by taking care of the
spinorial structure of the fluxes. The resulting algebra encodes much
information about the higher dimensional theory. In particular, tadpole
equations and Bianchi identities are obtainable as Jacobi identities of the
algebra. When a sector of magnetized (p,q) 7-branes is included, certain closed
axions are gauged by the U(1) transformations on the branes. We indicate how
the diagonal gauge generators of the branes can be incorporated into the full
algebra, and show that Freed-Witten constraints and tadpole cancellation
conditions for (p,q) 7-branes can be described as Jacobi identities satisfied
by the algebra mixing bulk and brane gauge generators.
","[{""version"":""v1"",""created"":""Tue, 18 Nov 2008 13:19:06 GMT""},{""version"":""v2"",""created"":""Thu, 8 Jan 2009 10:06:23 GMT""},{""version"":""v3"",""created"":""Mon, 9 Mar 2009 16:39:14 GMT""},{""version"":""v4"",""created"":""Tue, 16 Nov 2010 18:20:49 GMT""}]","2010-11-17"
"0811.2901","Kirill Semenov-Tian-Shansky","Maxim V. Polyakov and Kirill M. Semenov-Tian-Shansky","Dual parametrization of GPDs versus the double distribution Ansatz","18 pages, 5 figures. A version that appeared in Eur. Phys. J. A. Some
  of the statements were refined and misprints in the formulas were corrected","Eur.Phys.J.A40:181-198,2009","10.1140/epja/i2008-10759-2",,"hep-ph","http://arxiv.org/licenses/nonexclusive-distrib/1.0/","  We establish a link between the dual parametrization of GPDs and a popular
parametrization based on the double distribution Ansatz, which is in prevalent
use in phenomenological applications. We compute several first forward-like
functions that express the double distribution Ansatz for GPDs in the framework
of the dual parametrization and show that these forward-like functions make the
dominant contribution into the GPD quintessence function. We also argue that
the forward-like functions $Q_{2 \nu}(x)$ with $\nu \ge 1$ contribute to the
leading singular small-$x_{Bj}$ behavior of the imaginary part of DVCS
amplitude. This makes the small-$x_{Bj}$ behavior of $\im A^{DVCS}$ independent
of the asymptotic behavior of PDFs. Assuming analyticity of Mellin moments of
GPDs in the Mellin space we are able to fix the value of the $D$-form factor in
terms of the GPD quintessence function $N(x,t)$ and the forward-like function
$Q_0(x,t)$.
","[{""version"":""v1"",""created"":""Tue, 18 Nov 2008 13:53:41 GMT""},{""version"":""v2"",""created"":""Sun, 31 May 2009 09:29:31 GMT""}]","2011-04-12"
"0811.2902","Mathias Schultheis","M. Schultheis, K. Sellgren, S. Ramirez, S. Stolovy, S. Ganesh, I.S.
  Glass and L. Girardi","Interstellar Extinction and Long-Period Variables in the Galactic Center","12 pages, 11 figures accepted for publication in Astronomy &
  Astrophysics",,"10.1051/0004-6361:200810342",,"astro-ph","http://arxiv.org/licenses/nonexclusive-distrib/1.0/","  We use the Spitzer IRAC catalogue of the Galactic Center (GC) point sources
(Ramirez et al. 2008) and combine it with new isochrones (Marigo et al. 2008)
to derive extinctions based on photometry of red giants and asymptotic giant
branch (AGB) stars. This new extinction map extends to much higher values of Av
than previoulsy available. Our new extinction map of the GC region covers 2.0 x
1.4 degree (280 x 200 pc at a distance of 8 kpc). We apply it to deredden the
LPVs found by Glass et al. (2001) near the GC. We make period-magnitude
diagrams and compare them to those from other regions of different metallicity.
  The Glass-LPVs follow well-defined period-luminosity relations (PL) in the
IRAC filter bands at 3.6, 4.5, 5.8, and 8.0 micron. The period-luminosity
relations are similar to those in the Large Magellanic Cloud, suggesting that
the PL relation in the IRAC bands is universal. We use ISOGAL data to derive
mass-loss rates and find for the Glass-LPV sample some correlation between
mass-loss and pulsation period, as expected theoretically.The GC has an excess
of high luminosity and long period LPVs compared to the Bulge, which supports
previous suggestions that it contains a younger stellar population.
","[{""version"":""v1"",""created"":""Tue, 18 Nov 2008 14:03:32 GMT""}]","2009-11-13"
"0811.2903","Stuartt Corder","S. A. Corder, K. Sheth, N. Z. Scoville, J. Koda, S. N. Vogel, E.
  Ostriker","Detection of Dense Molecular Gas in Inter-Arm Spurs in M51","6 pages, 3 figures, emulate-apj format, accepted in ApJ",,"10.1086/592557",,"astro-ph","http://arxiv.org/licenses/nonexclusive-distrib/1.0/","  Spiral arm spurs are prominent features that have been observed in extinction
and 8$\mu$m emission in nearby galaxies. In order to understand their molecular
gas properties, we used the Owens Valley Radio Observatory to map the
CO(J=1--0) emission in three spurs emanating from the inner northwestern spiral
arm of M51. We report CO detections from all three spurs. The molecular gas
mass and surface density are M$_{H2} \sim3\times10^6$ M$_{\sun}$ and
$\Sigma_{H2} \sim$50 M$_{\sun}$ pc$^{-2}$. Thus, relative to the spiral arms,
the spurs are extremely weak features. However, since the spurs are extended
perpendicular to the spiral arms for $\sim$500 pc and contain adequate fuel for
star formation, they may be the birthplace for observed inter-arm HII regions.
This reduces the requirement for the significant time delay that would be
otherwise needed if the inter-arm star formation was initiated in the spiral
arms. Larger maps of galaxies at similar depth are required to further
understand the formation and evolution of these spurs and their role in star
formation - such data should be forthcoming with the new CARMA and future ALMA
telescopes and can be compared to several recent numerical simulations that
have been examining the evolution of spiral arm spurs.
","[{""version"":""v1"",""created"":""Tue, 18 Nov 2008 13:28:05 GMT""}]","2009-11-13"
