"0811.2825","Andrei Mironov","A.Alexandrov, A.Mironov, A.Morozov and P.Putrov","Partition Functions of Matrix Models as the First Special Functions of
  String Theory. II. Kontsevich Model","48 pages, 2 figures","Int.J.Mod.Phys.A24:4939-4998,2009","10.1142/S0217751X09046278","FIAN/TD-22/08; ITEP/TH-49/08; IHES/P/08/52","hep-th","http://arxiv.org/licenses/nonexclusive-distrib/1.0/","  In arXiv:hep-th/0310113 we started a program of creating a reference-book on
matrix-model tau-functions, the new generation of special functions, which are
going to play an important role in string theory calculations. The main focus
of that paper was on the one-matrix Hermitian model tau-functions. The present
paper is devoted to a direct counterpart for the Kontsevich and Generalized
Kontsevich Model (GKM) tau-functions. We mostly focus on calculating resolvents
(=loop operator averages) in the Kontsevich model, with a special emphasis on
its simplest (Gaussian) phase, where exists a surprising integral formula, and
the expressions for the resolvents in the genus zero and one are especially
simple (in particular, we generalize the known genus zero result to genus one).
We also discuss various features of generic phases of the Kontsevich model, in
particular, a counterpart of the unambiguous Gaussian solution in the generic
case, the solution called Dijkgraaf-Vafa (DV) solution. Further, we extend the
results to the GKM and, in particular, discuss the p-q duality in terms of
resolvents and corresponding Riemann surfaces in the example of dualities
between (2,3) and (3,2) models.
","[{""version"":""v1"",""created"":""Mon, 17 Nov 2008 23:40:50 GMT""},{""version"":""v2"",""created"":""Tue, 9 Dec 2008 13:27:03 GMT""}]","2009-11-05"
"0811.2826","Wan Yan Wong","Wan Yan Wong","Cosmological Recombination","PhD thesis, University of British Columbia (Canada), 2008. 137 pages.
  Chapter 2 is a review of the recent progress in cosmological recombination. A
  discussion on the pre-recombination peak is included at the end of Chapter 3",,,,"astro-ph","http://arxiv.org/licenses/nonexclusive-distrib/1.0/","  In this thesis we focus on studying the physics of cosmological recombination
and how the details of recombination affect the Cosmic Microwave Background
(CMB) anisotropies. We present a detailed calculation of the spectral line
distortions on the CMB spectrum arising from the Lyman-alpha and the lowest
two-photon transitions in the recombination of hydrogen (H), and the
corresponding lines from helium (He). The peak of these distortions mainly
comes from the Lyman-alpha transition and occurs at about 170 microns, which is
the Wien part of the CMB. The major theoretical limitation for extracting
cosmological parameters from the CMB sky lies in the precision with which we
can calculate the cosmological recombination process. With this motivation, we
perform a multi-level calculation of the recombination of H and He with the
addition of the spin-forbidden transition for neutral helium (He I), plus the
higher order two-photon transitions for H and among singlet states of He I. We
find that the inclusion of the spin-forbidden transition results in more than a
percent change in the ionization fraction, while the other transitions give
much smaller effects. Last we modify RECFAST by introducing one more parameter
to reproduce recent numerical results for the speed-up of helium recombination.
Together with the existing hydrogen `fudge factor', we vary these two
parameters to account for the remaining dominant uncertainties in cosmological
recombination. By using a Markov Chain Monte Carlo method with Planck forecast
data, we find that we need to determine the parameters to better than 10% for
He I and 1% for H, in order to obtain negligible effects on the cosmological
parameters.
","[{""version"":""v1"",""created"":""Tue, 18 Nov 2008 01:11:20 GMT""}]","2008-11-19"
"0811.2827","Yukio Hayashi","Yukio Hayashi","Evolutionary Construction of Geographical Networks with Nearly Optimal
  Robustness and Efficient Routing Properties","14 pages, 10 figures, 1 table","Physica A 388, pp.991-998, 2009","10.1016/j.physa.2008.11.027",,"physics.data-an cs.CG cs.NI physics.soc-ph","http://arxiv.org/licenses/nonexclusive-distrib/1.0/","  Robust and efficient design of networks on a realistic geographical space is
one of the important issues for the realization of dependable communication
systems. In this paper, based on a percolation theory and a geometric graph
property, we investigate such a design from the following viewpoints: 1)
network evolution according to a spatially heterogeneous population, 2)
trimodal low degrees for the tolerant connectivity against both failures and
attacks, and 3) decentralized routing within short paths. Furthermore, we point
out the weakened tolerance by geographical constraints on local cycles, and
propose a practical strategy by adding a small fraction of shortcut links
between randomly chosen nodes in order to improve the robustness to a similar
level to that of the optimal bimodal networks with a larger degree
$O(\sqrt{N})$ for the network size $N$. These properties will be useful for
constructing future ad-hoc networks in wide-area communications.
","[{""version"":""v1"",""created"":""Tue, 18 Nov 2008 01:19:37 GMT""},{""version"":""v2"",""created"":""Mon, 8 Dec 2008 07:38:24 GMT""},{""version"":""v3"",""created"":""Thu, 3 Nov 2011 00:16:35 GMT""}]","2011-11-04"
"0811.2828","Mar\'ia Florencia Carusela","M.F.Carusela, A.J.Fendrik, L.Romanelli","Transport and dynamical properties of inertial ratchets","PDF, 16 pages, 7 figures",,"10.1016/j.physa.2009.06.031",,"cond-mat.other","http://creativecommons.org/licenses/by/3.0/","  In this paper we discuss the dynamics and transport properties of a massive
particle, in a time dependent periodic potential of the ratchet type, with a
dissipative environment. The directional currents and characteristics of the
motion are studied as the specific frictional coefficient varies, finding that
the stationary regime is strongly dependent on this parameter. The maximal
Lyapunov exponent and the current show large fluctuations and inversions,
therefore for some range of the control parameter, this inertial ratchet could
originate a mass separation device. Also an exploration of the effect of a
random force on the system is performed.
","[{""version"":""v1"",""created"":""Tue, 18 Nov 2008 15:48:21 GMT""}]","2015-05-13"
"0811.2829","Adrian Butscher","Adrian Butscher and Justin Corvino","Hamiltonian Stationary Lagrangian Tori in Kaehler Manifolds","31 pages",,,,"math.DG math.AP","http://arxiv.org/licenses/nonexclusive-distrib/1.0/","  A Hamiltonian stationary Lagrangian submanifold of a Kaehler manifold is a
Lagrangian submanifold whose volume is stationary under Hamiltonian variations.
We find a sufficient condition on the curvature of a Kaehler manifold of real
dimension four that guarantees the existence of a family of small Hamiltonian
stationary Lagrangian tori.
","[{""version"":""v1"",""created"":""Tue, 18 Nov 2008 02:11:01 GMT""}]","2008-11-19"
"0811.2830","Ite Yu","Wen-Te Liao, Yen-Wei Lin, Thorsten Peters, Hung-Chih Chou, Jian-Siung
  Wang, Pei-Chen Kuan, and Ite A. Yu","Stationary Light Pulses in Cold Atomic Media","4 pages, 4 figures","Phys. Rev. Lett. 102, 213601 (2009)","10.1103/PhysRevLett.102.213601",,"physics.optics physics.atom-ph","http://arxiv.org/licenses/nonexclusive-distrib/1.0/","  Stationary light pulses (SLPs), i.e., light pulses without motion, are formed
via the retrieval of stored probe pulses with two counter-propagating coupling
fields. We show that there exist non-negligible hybrid Raman excitations in
media of cold atoms that prohibit the SLP formation. We experimentally
demonstrate a method to suppress these Raman excitations and realize SLPs in
laser-cooled atoms. Our work opens the way to SLP studies in cold as well as in
stationary atoms and provides a new avenue to low-light-level nonlinear optics.
","[{""version"":""v1"",""created"":""Tue, 18 Nov 2008 02:26:05 GMT""}]","2009-06-26"
"0811.2831","Zilu Wang","Zilu Wang, Xuehao He","Dynamics of Vesicle Formation from Lipid Droplet: Mechanism and
  Controllability","22 pages, 11 figures Submitted to J. Chem. Phys",,"10.1063/1.3079097",,"cond-mat.soft","http://creativecommons.org/licenses/by-nc-sa/3.0/","  A coarse-grained model developed by Marrink et al. [J. Phys. Chem. B 111,
7812 (2007)] is applied to investigate vesiculation of lipid
[dipalmitoylphosphatidylcholine (DPPC)] droplets in water. Three kinds of
morphologies of micelles are found with increasing lipid droplet size. When the
initial lipid droplet is smaller, the equilibrium structure of the droplet is a
spherical micelle. When the initial lipid droplet is larger, the lipid ball
starts to transform into a disk micelle or vesicle. The mechanism of vesicle
formation from a lipid ball is analyzed from the self-assembly of DPPC on the
molecular level, and the morphological transition from disk to vesicle with
increasing droplet size is demonstrated. Importantly, we discover that the
transition point is not very sharp, and for a fixed-size lipid ball, the disk
and vesicle appear with certain probabilities. The splitting phenomenon, i.e.,
the formation of a disk/vesicle structure from a lipid droplet, is explained by
applying a hybrid model of the Helfrich membrane theory. The elastic module of
the DPPC bilayer and the smallest size of a lipid droplet for certain formation
of a vesicle are successfully predicted.
","[{""version"":""v1"",""created"":""Tue, 18 Nov 2008 03:30:56 GMT""},{""version"":""v2"",""created"":""Sat, 7 Mar 2009 09:33:34 GMT""}]","2009-11-13"
"0811.2832","Ali Shojai","Fatimah Shojai, and Ali Shojai","Geodesic Congruences in the Palatini f(R) Theory",,"Phys.Rev.D78:104011,2008","10.1103/PhysRevD.78.104011",,"gr-qc","http://arxiv.org/licenses/nonexclusive-distrib/1.0/","  We shall investigate the properties of a congruence of geodesics in the
framework of Palatini f(R) theories. We shall evaluate the modified geodesic
deviation equation and the Raychaudhuri's equation and show that f(R) Palatini
theories do not necessarily lead to attractive forces. Also we shall study
energy condition for f(R) Palatini gravity via a perturbative analysis of the
Raychaudhuri's equation.
","[{""version"":""v1"",""created"":""Tue, 18 Nov 2008 03:47:22 GMT""}]","2008-12-18"
"0811.2833","Marco Battaglia","Marco Battaglia, Devis Contarato, Peter Denes, Dionisio Doering, Piero
  Giubilato, Tae Sung Kim, Serena Mattiazzo, Velimir Radmilovic, Sarah Zalusky","A Rad-hard CMOS Active Pixel Sensor for Electron Microscopy","16 pages, 9 figures, submitted to Nucl. Instr and Meth A","Nucl.Instrum.Meth.A598:642-649,2009","10.1016/j.nima.2008.09.029",,"physics.ins-det","http://arxiv.org/licenses/nonexclusive-distrib/1.0/","  Monolithic CMOS pixel sensors offer unprecedented opportunities for fast
nano-imaging through direct electron detection in transmission electron
microscopy. We present the design and a full characterisation of a CMOS pixel
test structure able to withstand doses in excess of 1 MRad. Data collected with
electron beams at various energies of interest in electron microscopy are
compared to predictions of simulation and to 1.5 GeV electron data to
disentagle the effect of multiple scattering. The point spread function
measured with 300 keV electrons is (8.1 +/- 1.6) micron for 10 micron pixel and
(10.9 +/- 2.3) micron for 20 micron pixels, respectively, which agrees well
with the values of 8.4 micron and 10.5 micron predicted by our simulation.
","[{""version"":""v1"",""created"":""Tue, 18 Nov 2008 03:51:52 GMT""}]","2009-02-10"
"0811.2834","Andrew Mugler","Andrew Mugler, Etay Ziv, Ilya Nemenman, Chris H. Wiggins","Quantifying evolvability in small biological networks","8 pages, 3 figures","IET Sys. Bio. 3 (2009) 379-387","10.1049/iet-syb.2008.0165",,"q-bio.MN","http://arxiv.org/licenses/nonexclusive-distrib/1.0/","  We introduce a quantitative measure of the capacity of a small biological
network to evolve. We apply our measure to a stochastic description of the
experimental setup of Guet et al. (Science 296:1466, 2002), treating chemical
inducers as functional inputs to biochemical networks and the expression of a
reporter gene as the functional output. We take an information-theoretic
approach, allowing the system to set parameters that optimize signal processing
ability, thus enumerating each network's highest-fidelity functions. We find
that all networks studied are highly evolvable by our measure, meaning that
change in function has little dependence on change in parameters. Moreover, we
find that each network's functions are connected by paths in the parameter
space along which information is not significantly lowered, meaning a network
may continuously change its functionality without losing it along the way. This
property further underscores the evolvability of the networks.
","[{""version"":""v1"",""created"":""Tue, 18 Nov 2008 03:56:57 GMT""}]","2009-10-05"
"0811.2835","Victor Kaftal","Victor Kaftal, Ping Wong Ng, Shuang Zhang","Strong sums of projections in von Neumann factors",,,,,"math.OA math.AG","http://arxiv.org/licenses/nonexclusive-distrib/1.0/","  This paper presents necessary and sufficient conditions for a positive
bounded operator on a separable Hilbert space to be the sum of a finite or
infinite collection of projections (not necessarily mutually orthogonal), with
the sum converging in the strong operator topology if the collection is
infinite. A similar necessary condition is given when the operator and the
projections are taken in a type II von Neumann factor, and the condition is
proven to be also sufficient if the operator is ""diagonalizable"". A simpler
necessary and sufficient condition is given in the type III factor case.
","[{""version"":""v1"",""created"":""Tue, 18 Nov 2008 03:58:14 GMT""}]","2008-11-19"
"0811.2836","Efrat Shimshoni","E. Shimshoni, D. Rasch, P. Jung, A. V. Sologubenko and A. Rosch","Large thermomagnetic effects in weakly disordered Heisenberg chains","5 pages, 2 figures","Phys. Rev. B 79, 064406 (2009)","10.1103/PhysRevB.79.064406",,"cond-mat.str-el","http://arxiv.org/licenses/nonexclusive-distrib/1.0/","  The interplay of different scattering mechanisms can lead to novel effects in
transport. We show theoretically that the interplay of weak impurity and
Umklapp scattering in spin-1/2 chains leads to a pronounced dip in the magnetic
field dependence of the thermal conductivity $\kappa$ at a magnetic field $B
\sim T$. In sufficiently clean samples, the reduction of the magnetic
contribution to heat transport can easily become larger than 50% and the effect
is predicted to exist even in samples with a large exchange coupling, J >> B,
where the field-induced magnetization is small. Qualitatively, our theory might
explain dips at $B \sim T$ observed in recent heat transport measurements on
copper pyrazine dinitrate, but a fully quantitative description is not possible
within our model.
","[{""version"":""v1"",""created"":""Tue, 18 Nov 2008 12:00:35 GMT""}]","2009-11-13"
"0811.2837","Tom Chou","Pak-Wing Fok, Chin-Lin Guo, Tom Chou","Charge transport-mediated recruitment of DNA repair enzymes","9 Figures, Accepted to J. Chem. Phys","Journal of Chemical Physics, 129, 235101, (2008)","10.1063/1.3026735",,"q-bio.BM q-bio.SC","http://arxiv.org/licenses/nonexclusive-distrib/1.0/","  Damaged or mismatched bases in DNA can be repaired by Base Excision Repair
(BER) enzymes that replace the defective base. Although the detailed molecular
structures of many BER enzymes are known, how they colocalize to lesions
remains unclear. One hypothesis involves charge transport (CT) along DNA
[Yavin, {\it et al.}, PNAS, {\bf 102}, 3546, (2005)]. In this CT mechanism,
electrons are released by recently adsorbed BER enzymes and travel along the
DNA. The electrons can scatter (by heterogeneities along the DNA) back to the
enzyme, destabilizing and knocking it off the DNA, or, they can be absorbed by
nearby lesions and guanine radicals. We develop a stochastic model to describe
the electron dynamics, and compute probabilities of electron capture by guanine
radicals and repair enzymes. We also calculate first passage times of electron
return, and ensemble-average these results over guanine radical distributions.
Our statistical results provide the rules that enable us to perform
implicit-electron Monte-Carlo simulations of repair enzyme binding and
redistribution near lesions. When lesions are electron absorbing, we show that
the CT mechanism suppresses wasteful buildup of enzymes along intact portions
of the DNA, maximizing enzyme concentration near lesions.
","[{""version"":""v1"",""created"":""Tue, 18 Nov 2008 04:38:18 GMT""}]","2009-11-13"
"0811.2838","Tom Chou","Sarah A. Nowak, Tom Chou","Mechanisms of receptor/coreceptor-mediated entry of enveloped viruses","10 Figures","Biophysical Journal, 96, 2624-2636, (2009)","10.1016/j.bpj.2009.01.018",,"q-bio.SC q-bio.BM","http://arxiv.org/licenses/nonexclusive-distrib/1.0/","  Enveloped viruses enter host cells either through endocytosis, or by direct
fusion of the viral membrane envelope and the membrane of the host cell.
However, some viruses, such as HIV-1, HSV-1, and Epstein-Barr can enter a cell
through either mechanism, with the choice of pathway often a function of the
ambient physical chemical conditions, such as temperature and pH. We develop a
stochastic model that describes the entry process at the level of binding of
viral glycoprotein spikes to cell membrane receptors and coreceptors. In our
model, receptors attach the cell membrane to the viral membrane, while
subsequent binding of coreceptors enables fusion. The model quantifies the
competition between fusion and endocytotic entry pathways. Relative
probabilities for each pathway are computed numerically, as well as
analytically in the high viral spike density limit. We delineate parameter
regimes in which fusion or endocytosis is dominant. These parameters are
related to measurable and potentially controllable quantities such as membrane
bending rigidity and receptor, coreceptor, and viral spike densities.
Experimental implications of our mechanistic hypotheses are proposed and
discussed.
","[{""version"":""v1"",""created"":""Tue, 18 Nov 2008 05:06:44 GMT""}]","2009-11-13"
"0811.2839","Yoshio Koide","Yoshio Koide and Hiroyuki Nishiura","Maximal CP Violation Hypothesis and a Lepton Mixing Matrix","10 pages, 4 figure, version in Phys.Rev.D","Phys.Rev.D79:093005,2009","10.1103/PhysRevD.79.093005","OU-HET 629/2009","hep-ph","http://arxiv.org/licenses/nonexclusive-distrib/1.0/","  Maximal CP violation hypothesis is applied to a simple lepton mixing matrix
form U=V_{CKM}^\dagger U_{TB}, which has recently been speculated under an
ansatz that U becomes an exact tribimaximal mixing U_{TB} in a limit of the
quark mixing matrix V_{CKM} \to {\bf 1}. The prediction \tan^2 \theta_{12} =1/2
in the case of the exact tribimaximal mixing U=U_{TB} is onsiderably spoiled in
the speculated mixing U=V_{CKM}^\dagger U_{TB}. However, the application of the
hypothesis to the lepton sector can again recover the spoiled value to \tan^2
\theta_{12} \simeq 1/2 if the original Kobayashi-Maskawa phase convention for
V_{CKM} is adopted.
","[{""version"":""v1"",""created"":""Tue, 18 Nov 2008 05:41:59 GMT""},{""version"":""v2"",""created"":""Tue, 25 Nov 2008 05:59:44 GMT""},{""version"":""v3"",""created"":""Thu, 30 Apr 2009 09:30:35 GMT""}]","2010-04-28"
"0811.2840","Anne-Marie Weijmans","A. Weijmans (1), M. Cappellari (2), P.T. de Zeeuw (3,1), E. Emsellem
  (4), J. Falcon-Barroso (5), H. Kuntschner (3), R.M. McDermid (6), R.C.E. van
  den Bosch (7) and G. van de Ven (8) ((1) Sterrewacht Leiden, (2) Oxford, (3)
  ESO, (4) CRAL/Observatoire de Lyon, (5) ESTEC, (6) Gemini Observatory, (7)
  University of Texas at Austin, (8) IAS Princeton)","Stellar Velocity Profiles and Line-Strengths out to Four Effective Radii
  in the Early-Type Galaxy NGC 3379","4 pages, 3 figures, to appear in the proceedings of ""Galaxy
  Evolution: Emerging Insights and Future Challenges"", 11-14 November 2008,
  Austin, USA",,,,"astro-ph","http://creativecommons.org/licenses/by/3.0/","  We describe a new technique to measure stellar kinematics and line-strengths
at large radii in nearby galaxies. Using the integral-field spectrograph SAURON
as a 'photon-collector', we obtain spectra out to four effective radii (Re) in
the early-type galaxy NGC 3379. By fitting orbit-based models to the extracted
stellar velocity profile, we find that ~40% of the total mass within 5 Re is
dark. The measured absorption line-strengths reveal a radial gradient with
constant slope out to 4 Re.
","[{""version"":""v1"",""created"":""Tue, 18 Nov 2008 06:04:40 GMT""}]","2008-11-19"
"0811.2841","Mukund Sundararajan","Arpita Ghosh, Tim Roughgarden, Mukund Sundararajan","Universally Utility-Maximizing Privacy Mechanisms","rewritten for clarity, typos corrected",,,,"cs.DB cs.GT","http://arxiv.org/licenses/nonexclusive-distrib/1.0/","  A mechanism for releasing information about a statistical database with
sensitive data must resolve a trade-off between utility and privacy. Privacy
can be rigorously quantified using the framework of {\em differential privacy},
which requires that a mechanism's output distribution is nearly the same
whether or not a given database row is included or excluded. The goal of this
paper is strong and general utility guarantees, subject to differential
privacy.
  We pursue mechanisms that guarantee near-optimal utility to every potential
user, independent of its side information (modeled as a prior distribution over
query results) and preferences (modeled via a loss function).
  Our main result is: for each fixed count query and differential privacy
level, there is a {\em geometric mechanism} $M^*$ -- a discrete variant of the
simple and well-studied Laplace mechanism -- that is {\em simultaneously
expected loss-minimizing} for every possible user, subject to the differential
privacy constraint. This is an extremely strong utility guarantee: {\em every}
potential user $u$, no matter what its side information and preferences,
derives as much utility from $M^*$ as from interacting with a differentially
private mechanism $M_u$ that is optimally tailored to $u$.
","[{""version"":""v1"",""created"":""Tue, 18 Nov 2008 05:59:39 GMT""},{""version"":""v2"",""created"":""Thu, 19 Mar 2009 19:17:20 GMT""},{""version"":""v3"",""created"":""Fri, 20 Mar 2009 16:34:43 GMT""}]","2009-03-20"
"0811.2842","Lisa Prato","L. Prato, E. L. Rice, T. M. Dame","Where are all the Young Stars in Aquila?","18 pages, 7 figures; to be published in the Star Formation Handbook,
  B. Reipurth, ed",,,,"astro-ph","http://arxiv.org/licenses/nonexclusive-distrib/1.0/","  The high Galactic longitude end of the Aquila Rift comprises the large Aquila
molecular cloud complex, however, few young stars are known to be located in
the area, and only one is directly associated with the Rift. In contrast, the
Serpens star-forming region at the low Galactic longitude end of the Rift
contains hundreds of young stars. We review studies of the raw molecular
material and describe searches for young objects in the Aquila clouds. The
characteristics of the known young stars and associated jets and outflows are
also provided. Finally, we suggest some possible explanations for the dearth of
star formation in this gas-rich region and propose some future observations to
examine this mystery further.
","[{""version"":""v1"",""created"":""Tue, 18 Nov 2008 06:39:08 GMT""}]","2008-11-19"
"0811.2843","Steven P. Ellis","Steven P. Ellis","An Algorithm for Unconstrained Quadratically Penalized Convex
  Optimization","Submitted to the Electronic Journal of Statistics
  (http://www.i-journals.org/ejs/) by the Institute of Mathematical Statistics
  (http://www.imstat.org)",,,"IMS-EJS-EJS_2008_330","stat.CO","http://arxiv.org/licenses/nonexclusive-distrib/1.0/","  A descent algorithm, ""Quasi-Quadratic Minimization with Memory"" (QQMM), is
proposed for unconstrained minimization of the sum, $F$, of a non-negative
convex function, $V$, and a quadratic form. Such problems come up in
regularized estimation in machine learning and statistics. In addition to
values of $F$, QQMM requires the (sub)gradient of $V$. Two features of QQMM
help keep low the number of evaluations of the objective function it needs.
First, QQMM provides good control over stopping the iterative search. This
feature makes QQMM well adapted to statistical problems because in such
problems the objective function is based on random data and therefore stopping
early is sensible. Secondly, QQMM uses a complex method for determining trial
minimizers of $F$. After a description of the problem and algorithm a
simulation study comparing QQMM to the popular BFGS optimization algorithm is
described. The simulation study and other experiments suggest that QQMM is
generally substantially faster than BFGS in the problem domain for which it was
designed. A QQMM-BFGS hybrid is also generally substantially faster than BFGS
but does better than QQMM when QQMM is very slow.
","[{""version"":""v1"",""created"":""Tue, 18 Nov 2008 08:57:00 GMT""}]","2008-11-19"
