"0811.2762","Joan Soto","Guillem Perez-Nadal, Joan Soto","Effective string theory constraints on the long distance behavior of the
  subleading potentials","5 pages, 1 figure, reference and explanations added. Journal version","Phys.Rev.D79:114002,2009","10.1103/PhysRevD.79.114002","UB-ECM-PF 08/20","hep-ph hep-lat hep-th","http://arxiv.org/licenses/nonexclusive-distrib/1.0/","  The dynamics of heavy quarkonium systems in the strong coupling regime
reduces to a quantum mechanical problem with a number of potentials which may
be organized in powers of 1/m, m being the heavy quark mass. The potentials
must be calculated non-perturbatively, for instance in lattice QCD. It is well
known that the long distance behavior of the static (1/m^0) potential is well
reproduced by an effective string theory. We show that this effective string
theory, if correct, should also reproduce the long distance behavior of all 1/m
suppressed potentials. We demonstrate the practical usefulness of this result
by finding a suitable parameterization of the recently calculated 1/m
potential. We also calculate the 1/m^2 velocity dependent and spin dependent
potentials. Once Poincar\'e invariance is implemented, the shapes of most of
the spin independent potentials are fully predicted in terms of the string
tension, and the shapes of the spin dependent ones in terms of a single
parameter.
","[{""version"":""v1"",""created"":""Mon, 17 Nov 2008 17:40:25 GMT""},{""version"":""v2"",""created"":""Fri, 22 May 2009 16:59:07 GMT""}]","2010-04-28"
"0811.2763","Andrzej Kup\'s\'c Dr","WASA-at-COSY Collaboration","Measurement of the eta->3pi0 Dalitz Plot Distribution with the WASA
  Detector at COSY","6 pages, 4 figures, elsarticle","Phys.Lett.B677:24-29,2009","10.1016/j.physletb.2009.03.063",,"nucl-ex","http://arxiv.org/licenses/nonexclusive-distrib/1.0/","  In the first production run of the WASA experiment at COSY, the eta decay
into three neutral pions was measured in proton-proton interactions at a proton
beam kinetic energy of 1.4 GeV. The Dalitz plot of the three pions was studied
using 1.2e5 fully reconstructed events, and the quadratic slope parameter alpha
was determined to be -0.027+/-0.008(stat)+/-0.005(syst). The result is
consistent with previous measurements and further corroborates the importance
of pion-pion final state interactions.
","[{""version"":""v1"",""created"":""Mon, 17 Nov 2008 17:53:13 GMT""}]","2014-11-18"
"0811.2764","Gabriella Sciolla","Gabriella Sciolla (MIT)","Directional detection of Dark Matter","17 pages, 11 postscript figures, mini-review submitted to Modern
  Physics Letters A (MPLA). Submitted to Modern Physics Letters A (MPLA)","Mod.Phys.Lett.A24:1793-1809,2009","10.1142/S0217732309031569",,"astro-ph","http://arxiv.org/licenses/nonexclusive-distrib/1.0/","  Among the many experimental techniques available, those providing directional
information have the potential of yielding an unambiguous observation of WIMPs
even in the presence of insidious backgrounds. A measurement of the
distribution of arrival direction of WIMPs can also discriminate between
Galactic Dark Matter halo models. In this article, I will discuss the
motivation for directional detectors and review the experimental techniques
used by the various experiments. I will then describe one of them, the DMTPC
detector, in more detail.
","[{""version"":""v1"",""created"":""Mon, 17 Nov 2008 19:47:14 GMT""},{""version"":""v2"",""created"":""Tue, 18 Nov 2008 00:04:39 GMT""},{""version"":""v3"",""created"":""Mon, 13 Jul 2009 21:41:01 GMT""}]","2014-11-18"
"0811.2765","Jeronimo Peralta Ramos","J. Peralta-Ramos, and E. Calzetta","Two-particle irreducible effective action approach to nonlinear current
  conserving approximations in driven systems","30 pages. Accepted for publication in JPCM","J. Phys.: Condens. Matter 21, 215601 (2009)","10.1088/0953-8984/21/21/215601",,"cond-mat.str-el","http://arxiv.org/licenses/nonexclusive-distrib/1.0/","  Using closed-time path two-particle irreducible coarse-grained effective
action (CTP 2PI CGEA) techniques, we study the response of an open interacting
electronic system to time-dependent external electromagnetic fields. We show
that the CTP 2PI CGEA is invariant under a simultaneous gauge transformation of
the external field and the full Schwinger-Keldysh propagator, and that this
property holds even when the loop expansion of the CTP 2PI CGEA is truncated at
arbitrary order. The effective action approach provides a systematic way of
calculating the propagator and response functions of the system, via the
Schwinger-Dyson equation and the Bethe-Salpeter equations, respectively. We
show that, due to the invariance of the CTP 2PI CGEA under external gauge
transformations, the response functions calculated from it satisfy the
Ward-Takahashi hierarchy, thus warranting the conservation of the electronic
current beyond the expectation value level. We also clarify the connection
between nonlinear response theory and the WT hierarchy, and discuss an example
of an ad hoc approximation that violate it. These findings may be useful in the
study of current fluctuations in correlated electronic pumping devices.
","[{""version"":""v1"",""created"":""Mon, 17 Nov 2008 18:05:57 GMT""},{""version"":""v2"",""created"":""Wed, 1 Apr 2009 15:02:18 GMT""}]","2009-12-03"
"0811.2766","Pham H. Tiep","Alexander S. Kleshchev and Pham Huu Tiep","Representations of the general linear groups which are irreducible over
  subgroups","36 pages. Amer. J. Math., to appear",,,,"math.RT math.GR","http://arxiv.org/licenses/nonexclusive-distrib/1.0/","  We classify all triples $(G,V,H)$ such that $SL_n(q)\leq G\leq GL_n(q)$, $V$
is a representation of $G$ of dimension greater than one over an algebraically
closed field $\FF$ of characteristic coprime to $q$, and $H$ is a proper
subgroup of $G$ such that the restriction $V\dar_{H}$ is irreducible. This
problem is a natural part of the Aschbacher-Scott program on maximal subgroups
of finite classical groups.
","[{""version"":""v1"",""created"":""Mon, 17 Nov 2008 18:11:37 GMT""}]","2008-11-18"
"0811.2767","Iris Gebauer","Iris Gebauer","Dark Matter Annihilation in the light of EGRET, HEAT, WMAP, INTEGRAL and
  ROSAT","5 pages, 9 figures, to appear in the proceedings of the
  Identification of Dark Matter conference (IDM 2008), Stockholm, Sweden, 18-22
  August, 2008","PoS idm2008:030,2008",,,"astro-ph","http://arxiv.org/licenses/nonexclusive-distrib/1.0/","  The ROSAT Galactic wind observations confirm that our Galaxy launches
supernova driven Galactic winds with wind speeds of about 150 km/s in the
Galactic plane. Galactic winds of this strength are incompatible with current
isotropic models for Cosmic Ray transport. In order to reproduce our local CRs
in the presence of Galactic winds, charged CRs are required to be much more
localized than in the standard isotropic GALPROP models. This requires that
anisotropic diffusion is the dominant diffusion mode in the interstellar
medium, particularly that the diffusion in the disk and in the halo are
different. In addition small scale phenomena such as trapping by molecular
cloud complexes and the structure of our local environment might influence the
secondary CR production rate and our local CR density gradients. We introduce
an anisotropic convection driven transport model (aCDM) which is consistent
with the Galactic wind observations by ROSAT. This also explains the large
bulge/disk ratio as observed by INTEGRAL. Furthermore such models predict an
increase in the $e^+/(e^++e^-)$-fraction as observed by PAMELA and HEAT, if the
synchrotron constraints in the 408 MHz and WMAP range are taken into account.
No additional contribution from Dark Matter is required. The aCDM is able to
explain the absence of a positron annihilation signal from molecular clouds as
observed by INTEGRAL by virtue of a mechanism which confines and isotropizes
CRs between MCs. We find that the EGRET excess of diffuse $\gamma$-rays
currently cannot be explained by astrophysical effects in this type of model
and that the interpretation of the EGRET excess as Dark Matter annihilation is
perfectly consistent with all observational constraints from local CR fluxes
and synchrotron radiation.
","[{""version"":""v1"",""created"":""Mon, 17 Nov 2008 18:12:05 GMT""}]","2010-02-17"
"0811.2768","Avraham Aizenbud","Avraham Aizenbud","A partial analog of integrability theorem for distributions on p-adic
  spaces and applications","18 pages",,,,"math.RT","http://arxiv.org/licenses/nonexclusive-distrib/1.0/","  Let X be a smooth real algebraic variety. Let $\xi$ be a distribution on it.
One can define the singular support of $\xi$ to be the singular support of the
$D_X$-module generated by $\xi$ (some times it is also called the
characteristic variety). A powerful property of the singular support is that it
is a coisotropic subvariety of $T^*X$. This is the integrability theorem (see
[KKS, Mal, Gab]). This theorem turned out to be useful in representation theory
of real reductive groups (see e.g. [AG_AMOT, AS, Say]).
  The aim of this paper is to give an analog of this theorem to the
non-Archimedean case. The theory of D-modules is not available to us so we need
a different definition of the singular support. We use the notion wave front
set from [Hef] and define the singular support to be its Zariski closure. Then
we prove that the singular support satisfies some property that we call weakly
coisotropic, which is weaker than being coisotropic but is enough for some
applications. We also prove some other properties of the singular support that
were trivial in the Archimedean case (using the algebraic definition) but not
obvious in the non-Archimedean case.
","[{""version"":""v1"",""created"":""Mon, 17 Nov 2008 18:19:39 GMT""}]","2008-11-18"
"0811.2769","Elizabeth Meckes","Elizabeth Meckes","Quantitative asymptotics of graphical projection pursuit","Proof of Theorem 2 reorganized, some additional comments on
  motivation, including a new corollary on waiting times to find non-Gaussian
  directions. To appear in Elec. Comm. Probab","Electron. Comm. Probab. 14 (2009)",,,"math.PR math.ST stat.TH","http://arxiv.org/licenses/nonexclusive-distrib/1.0/","  There is a result of Diaconis and Freedman which says that, in a limiting
sense, for large collections of high-dimensional data most one-dimensional
projections of the data are approximately Gaussian. This paper gives
quantitative versions of that result. For a set of deterministic vectors
$\{x_i\}_{i=1}^n$ in $\R^d$ with $n$ and $d$ fixed, let $\theta\in\s^{d-1}$ be
a random point of the sphere and let $\mu_n^\theta$ denote the random measure
which puts mass $\frac{1}{n}$ at each of the points
$\inprod{x_1}{\theta},...,\inprod{x_n}{\theta}$. For a fixed bounded Lipschitz
test function $f$, $Z$ a standard Gaussian random variable and $\sigma^2$ a
suitable constant, an explicit bound is derived for the quantity $\ds\P[|\int f
d\mu_n^\theta-\E f(\sigma Z)|>\epsilon]$. A bound is also given for
$\ds\P[d_{BL}(\mu_n^\theta, N(0,\sigma^2))>\epsilon]$, where $d_{BL}$ denotes
the bounded-Lipschitz distance, which yields a lower bound on the waiting time
to finding a non-Gaussian projection of the $\{x_i\}$ if directions are tried
independently and uniformly on $\s^{d-1}$.
","[{""version"":""v1"",""created"":""Mon, 17 Nov 2008 18:30:39 GMT""},{""version"":""v2"",""created"":""Mon, 20 Apr 2009 17:29:51 GMT""}]","2010-05-18"
"0811.2770","Malcolm Gray","M.D. Gray, M. Wittkowski, M. Scholz, E.M.L. Humphreys, K. Ohnaka, D.
  Boboltz","An Improved Model of SiO Maser Emission in Miras","accepted by MNRAS, MN-08-1478-MJ.R1","2009MNRAS.394...51G","10.1111/j.1365-2966.2008.14237.x",,"astro-ph","http://arxiv.org/licenses/nonexclusive-distrib/1.0/","  We describe a combined dynamic atmosphere and maser propagation model of SiO
maser emission in Mira variables. This model rectifies many of the defects of
an earlier model of this type, particularly in relation to the infra-red (IR)
radiation field generated by dust and various wavelength-dependent, optically
thick layers. Modelled masers form in rings with radii consistent with those
found in VLBI observations and with earlier models. This agreement requires the
adoption of a radio photosphere of radius approximately twice that of the
stellar photosphere, in agreement with observations. A radio photosphere of
this size renders invisible certain maser sites with high amplification at low
radii, and conceals high-velocity shocks, which are absent in radio continuum
observations. The SiO masers are brightest at an optical phase of 0.1 to 0.25,
which is consistent with observed phase-lags. Dust can have both mild and
profound effects on the maser emission. Maser rings, a shock and the optically
thick layer in the SiO pumping band at 8.13\micron appear to be closely
associated in three out of four phase samples.
","[{""version"":""v1"",""created"":""Mon, 17 Nov 2008 18:24:54 GMT""}]","2009-10-16"
"0811.2771","Edward Hinds","E. A. Hinds and Stephen M. Barnett","Momentum exchange between light and a single atom: Abraham or Minkowski?","4 pages, 1 figure",,"10.1103/PhysRevLett.102.050403",,"quant-ph","http://arxiv.org/licenses/nonexclusive-distrib/1.0/","  We consider the forces exerted by a pulse of plane-wave light on a single
atom. The leading edge of the pulse exerts a dispersive force on the atom, and
this modifies the atomic momentum while the atom is enveloped in the light. The
standard view of the optical dipole force indicates that red-detuned light
should attract the atom towards high intensity. This should increase the
average momentum per photon to $\textbf{p}_{0} n$, where $\textbf{p}_{0}$ is
the photon momentum in free space and $n$ is the average refractive index due
to the presence of the atom in the light. We show, however, that this is the
wrong conclusion and that the atom is in fact repelled from the light by the
dispersive forces, giving the photons a momentum $\textbf{p}_{0} /n$. This
leads us to identify Abraham's optical momentum with the kinetic momentum
transfer. The form due to Minkowski is similarly associated with the canonical
momentum. We consider the possibility of demonstrating this in the laboratory,
and we note an unexpected connection with the Aharonov-Casher effect.
","[{""version"":""v1"",""created"":""Mon, 17 Nov 2008 18:28:14 GMT""}]","2009-11-13"
"0811.2772","Klaus Kirsten","Michael Coons and Klaus Kirsten","General moment theorems for non-distinct unrestricted partitions","21 pages","J.Math.Phys.50:013517,2009","10.1063/1.3050060",,"math-ph cond-mat.stat-mech hep-th math.MP","http://arxiv.org/licenses/nonexclusive-distrib/1.0/","  A well-known result from Hardy and Ramanujan gives an asymptotic expression
for the number of possible ways to express an integer as the sum of smaller
integers. In this vein, we consider the general partitioning problem of writing
an integer $n$ as a sum of summands from a given sequence $\gL$ of
non-decreasing integers. Under suitable assumptions on the sequence $\gL$, we
obtain results using associated zeta-functions and saddle-point techniques. We
also calculate higher moments of the sequence $\gL$ as well as the expected
number of summands. Applications are made to various sequences, including those
of Barnes and Epstein types. These results are of potential interest in
statistical mechanics in the context of Bose-Einstein condensation.
","[{""version"":""v1"",""created"":""Mon, 17 Nov 2008 18:57:22 GMT""}]","2009-02-10"
"0811.2773","Valeriy Nazaruk","V. I. Nazaruk","On the $n\bar{n}$ transitions in the medium","10 pages, 3 figures, minor corrections",,,,"hep-ph nucl-th","http://arxiv.org/licenses/nonexclusive-distrib/1.0/","  The corrections to the model of $n\bar{n}$ transitions in the medium and
additional baryon-number-violating processes are considered. We focus on the
time-dependence since it is different for the $n\bar{n}$ transition followed by
annihilation (basic process) and processes mentioned above.
","[{""version"":""v1"",""created"":""Mon, 17 Nov 2008 19:06:12 GMT""},{""version"":""v2"",""created"":""Sat, 13 Dec 2008 15:27:21 GMT""}]","2008-12-13"
"0811.2774","Maria Emilia Maietti","Maria Emilia Maietti","A minimalist two-level foundation for constructive mathematics","46 pages, revised version (I corrected typos)",,,,"math.LO","http://arxiv.org/licenses/nonexclusive-distrib/1.0/","  We present a two-level theory to formalize constructive mathematics as
advocated in a previous paper with G. Sambin. One level is given by an
intensional type theory, called Minimal type theory. This theory extends the
set-theoretic version introduced in the mentioned paper with collections. The
other level is given by an extensional set theory which is interpreted in the
first one by means of a quotient model. This two-level theory has two main
features: it is minimal among the most relevant foundations for constructive
mathematics; it is constructive thanks to the way the extensional level is
linked to the intensional one which fulfills the ""proofs-as-programs"" paradigm
and acts as a programming language.
","[{""version"":""v1"",""created"":""Mon, 17 Nov 2008 19:24:28 GMT""},{""version"":""v2"",""created"":""Mon, 15 Dec 2008 15:20:16 GMT""},{""version"":""v3"",""created"":""Mon, 17 Oct 2011 17:37:14 GMT""}]","2011-10-18"
"0811.2775","Per Sundin","Per Sundin","The AdS(4) x CP(3) string and its Bethe equations in the near plane wave
  limit","28 pages, references and footnote added","JHEP 0902:046,2009","10.1088/1126-6708/2009/02/046","HU-EP-08/58","hep-th","http://arxiv.org/licenses/nonexclusive-distrib/1.0/","  We perform a detailed study of bosonic type IIA string theory in a large
light-cone momentum / near plane wave limit of $AdS_4 \times CP_3$. In order to
attain this we derive the Hamiltonian up to cubic and quartic order in number
of fields and calculate the energies for string excitations in a $R\times S^2
\times S^2$ subspace. The computation for the string energies is performed for
arbitrary length excitations utilizing an unitary transformation which allows
us to remove the cubic terms in the Hamiltonian. We then rewrite a recent set
of proposed all loop Bethe equations in a light-cone language and compare their
predictions with the obtained string energies. We find perfect agreement.
","[{""version"":""v1"",""created"":""Mon, 17 Nov 2008 19:29:41 GMT""},{""version"":""v2"",""created"":""Tue, 18 Nov 2008 12:07:23 GMT""},{""version"":""v3"",""created"":""Sun, 23 Nov 2008 21:49:03 GMT""}]","2011-03-02"
"0811.2776","Peter Grassl","Peter Grassl","On a damage-plasticity approach to model concrete failure","Revised version. Resubmitted to Engineering and Computational
  Mechanics",,,"GU2008PG03","cond-mat.mtrl-sci","http://arxiv.org/licenses/nonexclusive-distrib/1.0/","  A damage-plasticity constitutive model for the description of fracture in
plain concrete is presented. Two approaches, the local model comprising the
adjustment of the softening modulus and the nonlocal model based on spatial
averaging of history variables, are applied to the analysis of a concrete bar
subjected to uniaxial tension and to a three-point bending test. The influence
of mesh size and the decomposition into damage and plasticity components are
discussed. It is shown that for the two examples studied, both approaches
result in mesh-independent results. However, the nonlocal model, which relies
on spatial averaging of history variables, exhibits sensitivity with respect to
boundary conditions, which requires further studies.
","[{""version"":""v1"",""created"":""Mon, 17 Nov 2008 19:24:14 GMT""},{""version"":""v2"",""created"":""Fri, 2 Jan 2009 20:42:43 GMT""}]","2009-01-02"
"0811.2777","Volodymyr Nekrashevych","Volodymyr Nekrashevych","The Julia set of a post-critically finite endomorphism of PC^2","60 pages, 28 figures",,,,"math.DS math.GR","http://arxiv.org/licenses/nonexclusive-distrib/1.0/","  We construct a combinatorial model of the Julia set of the endomorphism $f(z,
w)=((1-2z/w)^2, (1-2/w)^2)$ of $PC^2$.
","[{""version"":""v1"",""created"":""Mon, 17 Nov 2008 19:26:18 GMT""},{""version"":""v2"",""created"":""Wed, 3 Feb 2010 18:27:09 GMT""}]","2010-02-03"
"0811.2778","Jose' P. S. Lemos","Jos\'e P. S. Lemos, Oleg B. Zaslavskii","The mass formula for quasi-black holes","22 pages","Phys.Rev.D78:124013,2008","10.1103/PhysRevD.78.124013",,"gr-qc","http://arxiv.org/licenses/nonexclusive-distrib/1.0/","  A quasi-black hole, either non-extremal or extremal, can be broadly defined
as the limiting configuration of a body when its boundary approaches the body's
quasihorizon. We consider the mass contributions and the mass formula for a
static quasi-black hole. The analysis involves careful scrutiny of the surface
stresses when the limiting configuration is reached. It is shown that there
exists a strict correspondence between the mass formulas for quasi-black holes
and pure black holes. This perfect parallelism exists in spite of the
difference in derivation and meaning of the formulas in both cases. For
extremal quasi-black holes the finite surface stresses give zero contribution
to the total mass. This leads to a very special version of Abraham-Lorentz
electron in general relativity in which the total mass has pure electromagnetic
origin in spite of the presence of bare stresses.
","[{""version"":""v1"",""created"":""Mon, 17 Nov 2008 19:32:30 GMT""}]","2008-12-30"
"0811.2779","Peter Casazza","Janet C. Tremain","Concrete Constructions of Real Equiangular Line Sets",,,,,"math.MG","http://arxiv.org/licenses/nonexclusive-distrib/1.0/","  We give some concrete constructions of real equiangular line sets. The
emphasis here is on {\em building blocks} for certain angles which are then
used to build up larger equiangular line sets. We concentrate on angles greater
than or equal to 1/7.
","[{""version"":""v1"",""created"":""Mon, 17 Nov 2008 19:39:27 GMT""}]","2008-11-18"
"0811.2780","Aravind Chiruvelli","Aravind Chiruvelli, Hwang Lee","Canonical Phase Measurements in the Presence of Photon Loss","5 pages, 3 figures, Submitted to PRA. Rewritten as per the comments
  of referee. More references added. Comments welcome",,,,"quant-ph","http://arxiv.org/licenses/nonexclusive-distrib/1.0/","  We analyze the optimal state, as given by Berry and Wiseman [Phys. Rev. Lett
{\bf 85}, 5098, (2000)], under the canonical phase measurement in the presence
of photon loss. The model of photon loss is a generic fictitious beam splitter,
and we present the full density matrix calculations, which are more direct and
do not involve any approximations. We find for a given amount of loss the upper
bound for the input photon number that yields a sub-shot noise estimate.
","[{""version"":""v1"",""created"":""Mon, 17 Nov 2008 19:25:52 GMT""},{""version"":""v2"",""created"":""Wed, 7 Jan 2009 18:57:41 GMT""}]","2009-01-07"
"0811.2781","Andrew Kresch","Anders S. Buch, Andrew Kresch, and Harry Tamvakis","A Giambelli formula for isotropic Grassmannians","39 pages; improvements and corrections made to the exposition",,,,"math.AG","http://arxiv.org/licenses/nonexclusive-distrib/1.0/","  Let X be a symplectic or odd orthogonal Grassmannian parametrizing isotropic
subspaces in a vector space equipped with a nondegenerate (skew) symmetric
form. We prove a Giambelli formula which expresses an arbitrary Schubert class
in H^*(X,Z) as a polynomial in certain special Schubert classes. We study theta
polynomials, a family of polynomials defined using raising operators whose
algebra agrees with the Schubert calculus on X. Furthermore, we prove that
theta polynomials are special cases of Billey-Haiman Schubert polynomials and
use this connection to express the former as positive linear combinations of
products of Schur Q-functions and S-polynomials.
","[{""version"":""v1"",""created"":""Mon, 17 Nov 2008 19:48:02 GMT""},{""version"":""v2"",""created"":""Wed, 4 Aug 2010 06:41:14 GMT""}]","2010-08-05"
"0811.2782","Jean Berard","Jean B\'erard (ICJ), Jean-Baptiste Gou\'er\'e (MAPMO)","Brunet-Derrida behavior of branching-selection particle systems on the
  line",,,,,"math.PR","http://arxiv.org/licenses/nonexclusive-distrib/1.0/","  We consider a class of branching-selection particle systems on $\R$ similar
to the one considered by E. Brunet and B. Derrida in their 1997 paper ""Shift in
the velocity of a front due to a cutoff"". Based on numerical simulations and
heuristic arguments, Brunet and Derrida showed that, as the population size $N$
of the particle system goes to infinity, the asymptotic velocity of the system
converges to a limiting value at the unexpectedly slow rate $(\log N)^{-2}$. In
this paper, we give a rigorous mathematical proof of this fact, for the class
of particle systems we consider. The proof makes use of ideas and results by R.
Pemantle, and by N. Gantert, Y. Hu and Z. Shi, and relies on a comparison of
the particle system with a family of $N$ independent branching random walks
killed below a linear space-time barrier.
","[{""version"":""v1"",""created"":""Mon, 17 Nov 2008 19:57:40 GMT""},{""version"":""v2"",""created"":""Mon, 27 Apr 2009 14:04:57 GMT""},{""version"":""v3"",""created"":""Wed, 3 Mar 2010 14:16:06 GMT""}]","2010-03-03"
