"0811.3709","Silv\`ere Bonnabel","Silvere Bonnabel","A simple intrinsic reduced-observer for geodesic flow","Published in IEEE Transactions on Automatic Control, Sept. 2010, Vol
  55 Issue:9, pages : 2186 - 2191",,,,"math.OC","http://arxiv.org/licenses/nonexclusive-distrib/1.0/","  Aghannan and Rouchon proposed a new design method of asymptotic observers for
a class of nonlinear mechanical systems: Lagrangian systems with configuration
(position) measurements. The observer is based on the Riemannian structure of
the configuration manifold endowed with the kinetic energy metric and is
intrinsic. They proved local convergence. When the system is conservative, we
propose a globally convergent intrinsic reduced-observer based on the Jacobi
metric. For non-conservative systems the observer can be used as a complement
to the one of Aghannan and Rouchon. More generally the reduced-observer
provides velocity estimation for geodesic flow with position measurements. Thus
it can be (formally) used as a fluid flow soft sensor in the case of a perfect
incompressible fluid. When the curvature is negative in all planes the geodesic
flow is sensitive to initial conditions. Surprisingly this instability yields
faster convergence.
","[{""version"":""v1"",""created"":""Sat, 22 Nov 2008 22:22:04 GMT""},{""version"":""v2"",""created"":""Thu, 30 Sep 2010 07:59:06 GMT""}]","2010-10-01"
"0811.3710","Pierre Mathonet","Pierre Mathonet, Fabian Radoux","Existence of natural and conformally invariant quantizations of
  arbitrary symbols","18 pages",,,,"math.DG","http://arxiv.org/licenses/nonexclusive-distrib/1.0/","  A quantization over a manifold can be seen as a way to construct a
differential operator with prescribed principal symbol. The quantization map is
moreover required to be a linear bijection. It is known that there is in
general no natural quantization procedure. However, considering manifolds
endowed with additional structures, such as projective or pseudo-conformal
structures, one can seek for quantizations that depend on this additional
structure and that are natural if the dependence with respect to the structure
is taken into account.
  The question of existence of such a quantization was addressed in a series of
papers in the context of projective geometry, using the framework of
Thomas-Whitehead connections (see Bordemann, Hansoul and Fox). Recently, we
recovered these existence results, using the theory of Cartan projective
connections.
  In the present work, we show that our method can be adapted to
pseudo-conformal geometry to yield the so-called natural and conformally
invariant quantization for arbitrary symbols, still outside some critical
situations. Our method is general enough to analyze the problem of invariant
quantizations in the context of manifolds with irreducible parabolic
geometries.
","[{""version"":""v1"",""created"":""Sat, 22 Nov 2008 19:50:22 GMT""}]","2008-11-25"
"0811.3711","Chris T. Woodward","Eduardo Gonzalez and Chris Woodward","Deformations of symplectic vortices","44 pages, 1 figure. Title changed",,,,"math.SG","http://creativecommons.org/licenses/by/3.0/","  We prove a gluing theorem for a symplectic vortex on a compact complex curve
and a collection of holomorphic sphere bubbles. Using the theorem we show that
the moduli space of regular stable symplectic vortices on a fixed curve with
varying markings has the structure of a stratified-smooth topological orbifold.
In addition, we show that the moduli space has a non-canonical $C^1$-orbifold
structure.
","[{""version"":""v1"",""created"":""Sat, 22 Nov 2008 20:01:20 GMT""},{""version"":""v2"",""created"":""Fri, 27 Mar 2009 15:54:16 GMT""},{""version"":""v3"",""created"":""Mon, 2 Aug 2010 15:04:02 GMT""}]","2010-08-03"
"0811.3712","Kui Wu","Kui Wu, Yuming Jiang, Guoqiang Hu","Performance Modeling and Evaluation for Information-Driven Networks","14 pages",,,,"cs.PF cs.NI","http://arxiv.org/licenses/nonexclusive-distrib/1.0/","  Information-driven networks include a large category of networking systems,
where network nodes are aware of information delivered and thus can not only
forward data packets but may also perform information processing. In many
situations, the quality of service (QoS) in information-driven networks is
provisioned with the redundancy in information. Traditional performance models
generally adopt evaluation measures suitable for packet-oriented service
guarantee, such as packet delay, throughput, and packet loss rate. These
performance measures, however, do not align well with the actual need of
information-driven networks. New performance measures and models for
information-driven networks, despite their importance, have been mainly blank,
largely because information processing is clearly application dependent and
cannot be easily captured within a generic framework. To fill the vacancy, we
present a new performance evaluation framework particularly tailored for
information-driven networks, based on the recent development of stochastic
network calculus. We analyze the QoS with respect to information delivery and
study the scheduling problem with the new performance metrics. Our analytical
framework can be used to calculate the network capacity in information delivery
and in the meantime to help transmission scheduling for a large body of systems
where QoS is stochastically guaranteed with the redundancy in information.
","[{""version"":""v1"",""created"":""Sat, 22 Nov 2008 21:29:47 GMT""}]","2008-11-25"
"0811.3713","Don Johnson","Don H. Johnson","The Correlation Function of Multiple Dependent Poisson Processes
  Generated by the Alternating Renewal Process Method","7 pages",,,,"physics.data-an","http://creativecommons.org/licenses/by-nc-sa/3.0/","  We derive conditions under which alternating renewal processes can be used to
construct correlated Poisson processes. The pairwise correlation function is
also derived, showing that the resulting correlations can be negative. The
technique and the analysis can be extended to the generation of two or more
dependent renewal processes.
","[{""version"":""v1"",""created"":""Sat, 22 Nov 2008 21:16:08 GMT""}]","2008-11-25"
"0811.3716","Jonathan Doye","Gabriel Villar, Alex W. Wilber, Alex J. Williamson, Parvinder Thiara,
  Jonathan P.K. Doye, Ard A. Louis, Mara N. Jochum, Anna C.F. Lewis and
  Emmanuel D. Levy","The self-assembly and evolution of homomeric protein complexes","4 pages, 4 figures","Phys. Rev. Lett. 102, 118106 (2009)","10.1103/PhysRevLett.102.118106",,"q-bio.BM","http://arxiv.org/licenses/nonexclusive-distrib/1.0/","  We introduce a simple ""patchy particle"" model to study the thermodynamics and
dynamics of self-assembly of homomeric protein complexes. Our calculations
allow us to rationalize recent results for dihedral complexes. Namely, why
evolution of such complexes naturally takes the system into a region of
interaction space where (i) the evolutionarily newer interactions are weaker,
(ii) subcomplexes involving the stronger interactions are observed to be
thermodynamically stable on destabilization of the protein-protein interactions
and (iii) the self-assembly dynamics are hierarchical with these same
subcomplexes acting as kinetic intermediates.
","[{""version"":""v1"",""created"":""Sat, 22 Nov 2008 23:05:05 GMT""}]","2009-10-07"
"0811.3717","Massimiliano Esposito","Massimiliano Esposito, Upendra Harbola and Shaul Mukamel","Nonequilibrium fluctuations, fluctuation theorems, and counting
  statistics in quantum systems","Accepted in Rev. Mod. Phys. v2: Some references added and typos
  corrected","Rev. Mod. Phys. 81, 1665 (2009)","10.1103/RevModPhys.81.1665",,"cond-mat.stat-mech","http://arxiv.org/licenses/nonexclusive-distrib/1.0/","  Fluctuation theorems (FTs), which describe some universal properties of
nonequilibrium fluctuations, are examined from a quantum perspective and
derived by introducing a two-point measurement on the system. FTs for closed
and open systems driven out of equilibrium by an external time-dependent force,
and for open systems maintained in a nonequilibrium steady-state by
nonequilibrium boundary conditions, are derived from a unified approach.
Applications to fermion and boson transport in quantum junctions are discussed.
Quantum master equations and Green's functions techniques for computing the
energy and particle statistics are presented.
","[{""version"":""v1"",""created"":""Sat, 22 Nov 2008 23:20:30 GMT""},{""version"":""v2"",""created"":""Thu, 19 Feb 2009 08:31:45 GMT""}]","2015-05-13"
"0811.3718","Shinji Watanabe","Shinji Watanabe, Takahiro Mizusaki and Masatoshi Imada","Comment on arXiv:0811.1575 entitled ""Quantum phase transitions in the
  Hubbard model on triangular lattice"" by T. Yoshioka, A. Koga and N. Kawakami","3 pages, 6 figures",,,,"cond-mat.str-el","http://arxiv.org/licenses/nonexclusive-distrib/1.0/","  We show that the phase boundary between the paramagnetic metal and the
nonmagnetic Mott insulator for the Hubbard model on a triangular lattice
obtained by Yoshioka et al. in arXiv:0811.1575 does not correctly represent
that of the thermodynamic limit but is an artifact of the 6 by 6 lattice they
rely on. After the system size extrapolation, the phase boundary is located at
U/t=5.2 as proposed by Morita et al., J. Phys. Soc. Jpn. 71 (2008) 2109 and in
contrast to Yoshioka et al. Here, U is the onsite Coulomb repulsion and t is
the nearest-neighbor transfer.
","[{""version"":""v1"",""created"":""Sat, 22 Nov 2008 23:53:07 GMT""}]","2008-11-25"
"0811.3719","Roshan Foadi","Roshan Foadi, Matti J\""arvinen, Francesco Sannino","Unitarity in Technicolor","23 pages, 5 figures","Phys.Rev.D79:035010,2009","10.1103/PhysRevD.79.035010",,"hep-ph","http://arxiv.org/licenses/nonexclusive-distrib/1.0/","  We investigate the longitudinal $WW$ scattering in models of dynamical
electroweak symmetry breaking featuring a spin one axial and vector state and a
composite Higgs. We also investigate the effects of a composite spin two state
which has the same properties of a massive graviton. Any model of dynamical
electroweak symmetry breaking will feature, depending on the dynamics, some or
all these basic resonances as part of the low energy spectrum. We suggest how
to take limits in the effective Lagrangian parameter space to reproduce the
dynamics of different types of underlying gauge theories, from the traditional
Technicolor models to the newest ones featuring nearly conformal dynamics. We
study the direct effects of a light composite Higgs and the indirect ones
stemming from the presence of a light axial resonance on the longitudinal $WW$
scattering.
","[{""version"":""v1"",""created"":""Sun, 23 Nov 2008 00:08:58 GMT""},{""version"":""v2"",""created"":""Sun, 30 Nov 2008 16:40:23 GMT""}]","2010-01-08"
"0811.3720","Malcolm Connolly Ph.D","M. R. Connolly, M. V. Milosevic, S. J. Bending, J. R. Clem and T.
  Tamegai","Continuum versus discrete flux behaviour in large mesoscopic
  Bi(2)Sr(2)CaCu(2)O(8+delta) disks","Submitted to Europhysics Letters",,"10.1209/0295-5075/85/17008",,"cond-mat.supr-con cond-mat.mes-hall","http://arxiv.org/licenses/nonexclusive-distrib/1.0/","  Scanning Hall probe and local Hall magnetometry measurements have been used
to investigate flux distributions in large mesoscopic superconducting disks
with sizes that lie near the crossover between the bulk and mesoscopic vortex
regimes. Results obtained by directly mapping the magnetic induction profiles
of the disks at different applied fields can be quite successfully fitted to
analytic models which assume a continuous distribution of flux in the sample.
At low fields, however, we do observe clear signatures of the underlying
discrete vortex structure and can resolve the characteristic mesoscopic
compression of vortex clusters in increasing magnetic fields. Even at higher
fields, where single vortex resolution is lost, we are still able to track
configurational changes in the vortex patterns, since competing vortex orders
impose unmistakable signatures on ""local"" magnetisation curves as a function of
the applied field. Our observations are in excellent agreement with molecular
dynamics numerical simulations which lead us to a natural definition of the
lengthscale for the crossover between discrete and continuum behaviours in our
system.
","[{""version"":""v1"",""created"":""Sun, 23 Nov 2008 00:42:01 GMT""}]","2009-11-13"
"0811.3721","Dante Chialvo","Daniel Fraiman, Pablo Balenzuela, Jennifer Foss, Dante R. Chialvo","Ising-like dynamics in large-scale functional brain networks",,,"10.1103/PhysRevE.79.061922",,"cond-mat.dis-nn q-bio.NC","http://arxiv.org/licenses/nonexclusive-distrib/1.0/","  Brain ""rest"" is defined -more or less unsuccessfully- as the state in which
there is no explicit brain input or output. This work focuss on the question of
whether such state can be comparable to any known \emph{dynamical} state. For
that purpose, correlation networks from human brain Functional Magnetic
Resonance Imaging (fMRI) are constrasted with correlation networks extracted
from numerical simulations of the Ising model in 2D, at different temperatures.
For the critical temperature $T_c$, striking similarities appear in the most
relevant statistical properties, making the two networks indistinguishable from
each other. These results are interpreted here as lending support to the
conjecture that the dynamics of the functioning brain is near a critical point.
","[{""version"":""v1"",""created"":""Sun, 23 Nov 2008 02:06:47 GMT""}]","2015-05-13"
"0811.3722","Viktor Lopatkin","Lopatkin Viktor","The Torsion of Homology Groups of M(E,I)-sets","5 pages, 1 figure",,,,"math.AT math.CT","http://creativecommons.org/licenses/by/3.0/","  We consider the torsion of homology groups of right pointed sets over a
partially commutative monoid M(E,I)
","[{""version"":""v1"",""created"":""Sun, 23 Nov 2008 02:30:36 GMT""}]","2008-11-25"
"0811.3723","Mingyu Xiao","Mingyu Xiao, Leizhen Cai and Andrew C. Yao","Tight Approximation Ratio of a General Greedy Splitting Algorithm for
  the Minimum k-Way Cut Problem","12 pages",,,,"cs.DS cs.DM","http://arxiv.org/licenses/nonexclusive-distrib/1.0/","  For an edge-weighted connected undirected graph, the minimum $k$-way cut
problem is to find a subset of edges of minimum total weight whose removal
separates the graph into $k$ connected components. The problem is NP-hard when
$k$ is part of the input and W[1]-hard when $k$ is taken as a parameter.
  A simple algorithm for approximating a minimum $k$-way cut is to iteratively
increase the number of components of the graph by $h-1$, where $2 \le h \le k$,
until the graph has $k$ components. The approximation ratio of this algorithm
is known for $h \le 3$ but is open for $h \ge 4$.
  In this paper, we consider a general algorithm that iteratively increases the
number of components of the graph by $h_i-1$, where $h_1 \le h_2 \le ... \le
h_q$ and $\sum_{i=1}^q (h_i-1) = k-1$. We prove that the approximation ratio of
this general algorithm is $2 - (\sum_{i=1}^q {h_i \choose 2})/{k \choose 2}$,
which is tight. Our result implies that the approximation ratio of the simple
algorithm is $2-h/k + O(h^2/k^2)$ in general and $2-h/k$ if $k-1$ is a multiple
of $h-1$.
","[{""version"":""v1"",""created"":""Sun, 23 Nov 2008 03:47:50 GMT""}]","2008-11-25"
"0811.3724","Xiaoping Xu","Xiaoping Xu","Stable-Range Approach to Short Wave and Khokhlov-Zabolotskaya Equations","21pages; Acta Applicanda Mathematicae, online-first",,,,"math-ph math.AP math.MP nlin.SI physics.flu-dyn","http://arxiv.org/licenses/nonexclusive-distrib/1.0/","  Short wave equations were introduced in connection with the nonlinear
reflection of weak shock waves. They also relate to the modulation of a
gas-fluid mixture. Khokhlov-Zabolotskaya equation are used to describe the
propagation of a diffraction sound beam in a nonlinear medium. We give a new
algebraic method of solving these equations by using certain finite-dimensional
stable range of the nonlinear terms and obtain large families of new explicit
exact solutions parameterized by several functions for them. These parameter
functions enable one to find the solutions of some related practical models and
boundary value problems.
","[{""version"":""v1"",""created"":""Sun, 23 Nov 2008 03:57:33 GMT""}]","2008-11-25"
"0811.3725","Mesfin Asfaw","Mesfin Asfaw and Hsuan-Yi Chen","Adhesion-induced lateral phase separation of multi-component membranes:
  the effect of repellers and confinement",,,"10.1103/PhysRevE.79.041917",,"cond-mat.soft","http://arxiv.org/licenses/nonexclusive-distrib/1.0/","  We present a theoretical study for adhesion-induced lateral phase separation
for a membrane with short stickers, long stickers and repellers confined
between two hard walls. The effects of confinement and repellers on lateral
phase separation are investigated. We find that the critical potential depth of
the stickers for lateral phase separation increases as the distance between the
hard walls decreases. This suggests confinement-induced or force-induced mixing
of stickers. We also find that stiff repellers tend to enhance, while soft
repellers tend to suppress adhesion-induced lateral phase separation.
","[{""version"":""v1"",""created"":""Sun, 23 Nov 2008 10:34:39 GMT""}]","2015-05-13"
"0811.3726","Keiichi Sakai","Keiichi Sakai","Configuration space integrals for embedding spaces and the Haefliger
  invariant","41 pages, many figures (v2: Theorem 1.3 and its proof have been
  improved. many minor corrections. v3: Theorem 1.3 and its proof have been
  revised, since Lemma 5.26 in v2 was wrong. v4: The proof of Theorem 1.3 has
  been fully revised. To appear in J. Knot Theory Ramifications)","Journal of Knot Theory and Its Ramifications, Vol. 19, No. 12
  (2010), 1597-1644","10.1142/S0218216510008583",,"math.GT","http://arxiv.org/licenses/nonexclusive-distrib/1.0/","  Let K be the space of long j-knots in R^n. In this paper we introduce a graph
complex D and a linear map I from D to the de Rham complex of K via
configuration space integral, and prove that (1) when both n>j>=3 are odd, the
map I is a cochain map if restricted to graphs with at most one loop component,
(2) when n-j>=2 is even, the map I is a cochain map if restricted to tree
graphs, and (3) when n-j >=3 is odd, the map I added a correction term produces
a (2n-3j-3)-cocycle of K which gives a new formulation of the Haefliger
invariant when n=6k, j=4k-1 for some k.
","[{""version"":""v1"",""created"":""Sun, 23 Nov 2008 05:07:23 GMT""},{""version"":""v2"",""created"":""Thu, 4 Dec 2008 08:28:26 GMT""},{""version"":""v3"",""created"":""Sat, 20 Dec 2008 08:02:41 GMT""},{""version"":""v4"",""created"":""Wed, 30 Sep 2009 08:43:14 GMT""}]","2011-01-18"
"0811.3727","Xiaoping Xu","Xiaoping Xu","Algebraic Approaches to the geopotential Forecast and Nonlinear MHD
  Equations","10pages",,,,"math-ph math.AP math.MP nlin.SI physics.flu-dyn","http://arxiv.org/licenses/nonexclusive-distrib/1.0/","  In this paper, we use various anstazes motivated from our earlier works on
transonic gas flows, boundary layer problems and Navier-Stokes equations to
find new explicit exact solutions with multiple parameter functions for the
equation of geopotential forecast and the equations of nonlinear
magnetohydrodynamics.
","[{""version"":""v1"",""created"":""Sun, 23 Nov 2008 05:21:18 GMT""}]","2008-11-25"
"0811.3728","Prasanna Kulkarni","Prasanna D. Kulkarni, U. V. Vaidya, S. K. Dhar, P. Manfrinetti and A.
  K. Grover","New Samarium and Neodymium based admixed ferromagnets with near zero net
  magnetization and tunable exchange bias field","6 page text + 5 figures","J. Phys. D: Applied Physics (Fast track communication) 42, 082001
  (2009)","10.1088/0022-3727/42/8/082001",,"cond-mat.str-el cond-mat.mtrl-sci","http://arxiv.org/licenses/nonexclusive-distrib/1.0/","  Rare earth based intermetallics, SmScGe and NdScGe, are shown to exhibit near
zero net magnetization with substitutions of 6 to 9 atomic percent of Nd and 25
atomic percent of Gd, respectively. The notion of magnetic compensation in them
is also elucidated by the crossover of zero magnetization axis at low magnetic
fields (less than 103 Oe) and field-induced reversal in the orientation of the
magnetic moments of the dissimilar rare earth ions at higher magnetic fields.
These magnetically ordered materials with no net magnetization and appreciable
conduction electron polarization display an attribute of an exchange bias
field, which can be tuned. The attractively high magnetic ordering temperatures
of about 270 K, underscore the importance of these materials for potential
applications in spintronics.
","[{""version"":""v1"",""created"":""Sun, 23 Nov 2008 06:33:50 GMT""}]","2010-09-28"
"0811.3729","Yanping Cao Ms.","Yanping Cao, Ziad H. Musslimani and Edriss S. Titi","Modulation theory for self-focusing in the nonlinear
  Schr\""{o}dinger-Helmholtz equation","new article, 20 pages, 10 figures, to appear in Numerical Functional
  Analysis and Optimization",,,,"math-ph math.MP","http://arxiv.org/licenses/nonexclusive-distrib/1.0/","  The nonlinear Schr\""{o}dinger-Helmholtz (SH) equation in $N$ space dimensions
with $2\sigma$ nonlinear power was proposed as a regularization of the
classical nonlinear Schr\""{o}dinger (NLS) equation. It was shown that the SH
equation has a larger regime ($1\le\sigma<\frac{4}{N}$) of global existence and
uniqueness of solutions compared to that of the classical NLS
($0<\sigma<\frac{2}{N}$). In the limiting case where the
Schr\""{o}dinger-Helmholtz equation is viewed as a perturbed system of the
classical NLS equation, we apply modulation theory to the classical critical
case ($\sigma=1,\:N=2$) and show that the regularization prevents the formation
of singularities of the NLS equation. Our theoretical results are supported by
numerical simulations
","[{""version"":""v1"",""created"":""Sun, 23 Nov 2008 07:31:25 GMT""},{""version"":""v2"",""created"":""Sun, 8 Feb 2009 07:38:27 GMT""}]","2009-02-08"
"0811.3731","Hee-Jung Lee","Byung-Yoon Park, Hee-Jung Lee, Vicente Vento","Skyrmions at finite density and temperature: the chiral phase transition","7 pages, 2 figures","Phys.Rev.D80:036001,2009","10.1103/PhysRevD.80.036001",,"hep-ph","http://arxiv.org/licenses/nonexclusive-distrib/1.0/","  The Skyrme model, an effective low energy theory rooted in large $N_c$ QCD,
has been applied to the study of dense matter. Matter is described by various
crystal structures of skyrmions. When this system is heated, the dominating
thermal degrees of freedom are the fluctuating pions. Taking these mechanisms
jointly produces a description of the chiral phase transition leading to the
conventional phase diagram with critical temperatures and densities in
agreement with expected values.
","[{""version"":""v1"",""created"":""Sun, 23 Nov 2008 07:37:45 GMT""}]","2010-04-30"
"0811.3732","Pedro Lacerda","Pedro Lacerda","Time-Resolved Near-Infrared Photometry of Extreme Kuiper Belt Object
  Haumea","10 pages, 10 figures, 6 tables. Accepted for publication in The
  Astronomical Journal (2008 November 28)",,"10.1088/0004-6256/137/2/3404",,"astro-ph","http://arxiv.org/licenses/nonexclusive-distrib/1.0/","  We present time-resolved near-infrared (J and H) photometry of the extreme
Kuiper belt object (136108) Haumea (formerly 2003 EL61) taken to further
investigate rotational variability of this object. The new data show that the
near-infrared peak-to-peak photometric range is similar to the value at visible
wavelengths, \Delta m_R = 0.30+/-0.02 mag. Detailed analysis of the new and
previous data reveals subtle visible/near-infrared color variations across the
surface of Haumea. The color variations are spatially correlated with a
previously identified surface region, redder in B-R and darker than the mean
surface. Our photometry indicates that the J-H colors of Haumea
(J-H=-0.057+/-0.016 mag) and its brightest satellite Hi'iaka
(J-H=-0.399+/-0.034 mag) are significantly (>9 sigma) different. The satellite
Hi'iaka is unusually blue in J-H, consistent with strong 1.5 micron water-ice
absorption. The phase coefficient of Haumea in the J-band is found to increase
monotonically with wavelength in the range 0.4<lambda<1.3. We compare our
findings with other Solar system objects and discuss implications regarding the
surface of Haumea.
","[{""version"":""v1"",""created"":""Sun, 23 Nov 2008 07:56:51 GMT""}]","2009-11-13"
"0811.3735","Juhani Riihentaus","Juhani Riihentaus","On an inequality related to the radial growth of subharmonic functions","8 pages","CUBO, A Mathematical Journal, Vol. 11, No. 4 (2009), pp. 127-136",,,"math.AP","http://arxiv.org/licenses/nonexclusive-distrib/1.0/","  It is a classical result that every subharmonic function, defined and
${\mathcal{L}}^p$-integrable for some $p$, $0<p<+\infty$, on the unit disk
$\mathbb{D}$ of the complex plane ${\mathbb{C}}$ is for almost all $\theta$ of
the form $o((1-| z|)^{-1/p})$, uniformly as $z\to e^{i\theta}$ in any Stolz
domain. Recently Pavlovi\'c gave a related integral inequality for absolute
values of harmonic functions, also defined on the unit disk in the complex
plane. We generalize Pavlovi\'c's result to so called quasi-nearly subharmonic
functions defined on rather general domains in ${\mathbb {R}}^n$, $n\geq 2$.
","[{""version"":""v1"",""created"":""Sun, 23 Nov 2008 10:25:21 GMT""}]","2009-10-27"
