"0811.3736","Carsten Weber","C. Weber, A. Wacker, A. Knorr","Density-matrix theory of the optical dynamics and transport in quantum
  cascade structures: The role of coherence","14 pages, 11 figures; final version","Phys. Rev. B 79, 165322 (2009)","10.1103/PhysRevB.79.165322",,"cond-mat.mes-hall","http://arxiv.org/licenses/nonexclusive-distrib/1.0/","  The impact of coherence on the nonlinear optical response and stationary
transport is studied in quantum cascade laser structures. Nonequilibrium
effects such as pump-probe signals, the spatio-temporally resolved electron
density evolution, and the subband population dynamics (Rabi flopping) as well
as the stationary current characteristics are investigated within a microscopic
density-matrix approach. Focusing on the stationary current and the recently
observed gain oscillations, it is found that the inclusion of coherence leads
to observable coherent effects in opposite parameter regimes regarding the
relation between the level broadening and the tunnel coupling across the main
injection barrier. This shows that coherence plays a complementary role in
stationary transport and nonlinear optical dynamics in the sense that it leads
to measurable effects in opposite regimes. For this reason, a fully coherent
consideration of such nonequilibrium structures is necessary to describe the
combined optical and transport properties
","[{""version"":""v1"",""created"":""Sun, 23 Nov 2008 10:56:00 GMT""},{""version"":""v2"",""created"":""Tue, 12 May 2009 16:09:13 GMT""}]","2009-05-12"
"0811.3737","Boris Blok","B. Blok (Technion, Haifa), L. Frankfurt (Tel Aviv University, Tel
  Aviv), M. Strikman (Pensilvania State University, University Park)","On the shape of a rapid hadron in QCD","14 pages, 2 figures, uses epstopdf.sty typos corrected","Phys.Lett.B679:122-129,2009","10.1016/j.physletb.2009.07.015",,"hep-ph","http://arxiv.org/licenses/nonexclusive-distrib/1.0/","  We visualize the fundamental property of pQCD: the smaller size of the
colorless quark-gluon configurations leads to a more rapid increase of its
interaction with energy. Within the frame of dipole model we use the $k_t$
factorization theorem to generalize the DGLAP approximation and/or leading
$\ln(x_0/x)$ approximation and evaluate the interaction of quark dipole with a
target. In the limit of fixed $Q^2$ and $x\to 0$ we found the increase with
energy of transverse momenta of quark(antiquark) within q$\bar q$ pair produced
by strongly virtual photon. The average $p^2_t$ is evaluated analytically
within the double logarithmic approximation. We demonstrate that the invariant
mass$^2$ of the q$\bar q$ pair increases with the energy as
$M^2_0(x_0/x)^{\lambda}$, where $\lambda\sim 0.4\alpha_sN_c/\pi$ for transverse
photons, and as $\sim M^2_0 \exp{0.17[(4\alpha_sN_c/\pi)\log(x_0/x)]^{1/2}}$
for longitudinal photons, where $M^2_0 \approx 0.7Q^2$ at the energies of the
order $s_0\sim 10^4$ GeV$^2$ ($x_0\sim 10^{-2}$). The magnitude of the effect
depends strongly on the small $x$ behavior of the gluon distribution. Similar
pattern of the energy dependence of $M^2$ is found in the LO DGLAP
approximation generalized to account for $k_t$ factorization. We discuss the
impact of the found phenomenon on the dependence of the coherence length on the
initial energy and demonstrate that the shape of final hadron state in DIS has
biconcave form instead of pancake. Some implications of the found phenomena for
the hard processes in pp collisions are discussed.
","[{""version"":""v1"",""created"":""Sun, 23 Nov 2008 11:26:04 GMT""},{""version"":""v2"",""created"":""Wed, 10 Dec 2008 10:24:17 GMT""}]","2009-08-17"
"0811.3738","Sebastian Burciu M","S. Burciu","On normal Hopf subalgebras of semisimple Hopf algebras","17 pages","ART 15, (2012) 491-506",,,"math.RA","http://arxiv.org/licenses/nonexclusive-distrib/1.0/","  A criterion for subcoalgebras to be invariant under the adjoint action is
given generalizing Masuoka's criterion for normal Hopf subalgebras. At the
level of characters, the image of the induction functor from a normal Hopf
subalgebra is isomorphic to the image of the restriction functor.
","[{""version"":""v1"",""created"":""Sun, 23 Nov 2008 11:32:13 GMT""},{""version"":""v2"",""created"":""Mon, 15 Oct 2012 08:03:43 GMT""}]","2012-10-16"
"0811.3739","Eric Chitambar","Eric Chitambar, Runyao Duan","Nonlocal Entanglement Transformations Achievable by Separable Operations","v2 has rephrased Theorem 1 and corrected Kraus operators in Theorem
  2. Additional comments are welcomed","Phys. Rev. Lett. 103, 110502 (2009)","10.1103/PhysRevLett.103.110502",,"quant-ph","http://arxiv.org/licenses/nonexclusive-distrib/1.0/","  For manipulations of multipartite quantum systems, it was well known that all
local operations assisted by classical communication (LOCC) constitute a proper
subset of the class of separable operations. Recently, Gheorghiu and Griffiths
found that LOCC and general separable operations are equally powerful for
transformations between bipartite pure states. In this letter we extend this
comparison to mixed states and show that in general separable operations are
strictly stronger than LOCC when transforming a mixed state to a pure entangled
state. A remarkable consequence of our finding is the existence of entanglement
monotone which may increase under separable operations.
","[{""version"":""v1"",""created"":""Sun, 23 Nov 2008 12:00:09 GMT""},{""version"":""v2"",""created"":""Wed, 26 Nov 2008 17:18:09 GMT""}]","2009-10-23"
"0811.3740","Radu A. Ionas","Radu A. Ionas","Quaternionic Kahler spaces with large toric symmetry","35 pages",,,,"math.DG hep-th","http://arxiv.org/licenses/nonexclusive-distrib/1.0/","  We consider a general 4n-dimensional quaternionic Kahler geometry with a free
action of the torus T^(n+1). The toric action lifts onto the Swann bundle of
the quaternionic Kahler space to a tri-holomorphic action that commutes with
the standard H* action on the bundle. By matching Pedersen and Poon's
generalized Gibbons-Hawking Ansatz description of the total space with the
Swann picture we extract the local geometry of the quaternionic Kahler base.
Specifically, we obtain explicit expressions for the quaternionic Kahler metric
and Sp(1) connection in terms of a set of reduced Higgs fields and connection
1-forms that satisfy a reduced Bogomol'nyi-type equation. We find, moreover,
that these Higgs fields can be derived from a single function V satisfying a
system of linear second-order partial differential constraints. In four
dimensions, corresponding to the case of self-dual Einstein manifolds with two
commuting Killing vector fields, our formulas coincide with those obtained
through a different approach by Calderbank and Pedersen. Finally, we show how
to construct explicit solutions to the reduced Bogomol'nyi and V equations by
means of Lindstrom and Rocek's generalized Legendre transform construction for
a large class of quaternionic Kahler manifolds related to the c-map.
","[{""version"":""v1"",""created"":""Sun, 23 Nov 2008 11:46:50 GMT""}]","2008-11-25"
"0811.3741","Matteo Novaga","G. Bellettini, M. Novaga, G. Orlandi","Time-like lorentzian minimal submanifolds as singular limits of
  nonlinear wave equations",,,,,"math-ph math.AP math.MP","http://arxiv.org/licenses/nonexclusive-distrib/1.0/","  We consider the sharp interface limit $\epsilon \to 0$ of the semilinear wave
equation $u_{tt} - \Delta u + \nabla W(u)/ \epsilon^2 = 0$ in $\mathbf
R^{1+n}$, where $u$ takes values in $\mathbf R^k$, $k = 1,2$, and $W$ is a
double-well potential if $k = 1$ and vanishes on the unit circle and is
positive elsewhere if $k = 2$. For fixed $\epsilon > 0$ we find some special
solutions, constructed around minimal surfaces in $\mathbf R^n$. In the general
case, under some additional assumptions, we show that the solutions converge to
a Radon measure supported on a time-like $k$-codimensional minimal submanifold
of the Minkowski space-time. This result holds also after the appearence of
singularities, and enforces the observation made by J. Neu that this semilinear
equation can be regarded as an approximation of the Born-Infeld equation.
","[{""version"":""v1"",""created"":""Sun, 23 Nov 2008 11:55:12 GMT""},{""version"":""v2"",""created"":""Thu, 5 Nov 2009 17:46:24 GMT""}]","2009-11-05"
"0811.3742","Jean Ruppenthal","Jean Ruppenthal, Eduardo S. Zeron","An explicit d-bar-integration formula for weighted homogeneous varieties
  II: forms of higher degree","16 pages",,,,"math.CV","http://arxiv.org/licenses/nonexclusive-distrib/1.0/","  Let Y be a weighted homogeneous (singular) subvariety of C^n. The main
objective of this paper is to present a class of explicit integral formulae for
solving the d-bar-equation $\omega=\dbar\lambda$ on the regular part of Y,
where $\omega$ is a d-bar-closed (0,q)-form with compact support and degree
q>=1. Particular cases of these formulae yield L^p-bounded solution operators
for $1<=p<=\infty$ if Y is a homogeneous and pure dimensional subvariety with
an arbitrary singular locus.
","[{""version"":""v1"",""created"":""Sun, 23 Nov 2008 11:57:15 GMT""}]","2008-11-25"
"0811.3745","Hatem Najar","M. Marx, H. Najar","On the singular spectrum for adiabatic quasi-periodic Schr\""odinger
  Operators","23 pages",,,,"math-ph math.MP math.SP","http://arxiv.org/licenses/nonexclusive-distrib/1.0/","  In this paper we study spectral properties of a family of quasi-periodic
Schr\""odinger operators on the real line in the adiabatic limit. We assume that
the adiabatic iso-energetic curve has a real branch that is extended along the
momentum direction. In the energy intervals where this happens, we obtain an
asymptotic formula for the Lyapunov exponent and show that the spectrum is
purely singular. This result was conjectured and proved in a particular case by
Fedotov and Klopp in \cite{FEKL1}.
","[{""version"":""v1"",""created"":""Sun, 23 Nov 2008 13:45:38 GMT""}]","2008-11-25"
"0811.3747","M. Ryan Joung","M. Ryan Joung (Princeton), Mordecai-Mark Mac Low (AMNH), Greg L. Bryan
  (Columbia)","Dependence of Interstellar Turbulent Pressure on Supernova Rate","13 pages incl. 8 figures; accepted for publication in ApJ; contains a
  new model of starburst galaxy showing superbubble blow-out","Astrophys.J.704:137-149,2009","10.1088/0004-637X/704/1/137",,"astro-ph","http://arxiv.org/licenses/nonexclusive-distrib/1.0/","  Feedback from massive stars is one of the least understood aspects of galaxy
formation. We perform a suite of vertically stratified local interstellar
medium (ISM) simulations in which supernova rates and vertical gas column
densities are systematically varied based on the Schmidt-Kennicutt law. Our
simulations have a sufficiently high spatial resolution (1.95 pc) to follow the
hydrodynamic interactions among multiple supernovae that structure the ISM. At
a given supernova rate, we find that the mean mass-weighted sound speed and
velocity dispersion decrease as the inverse square root of gas density,
indicating that both thermal and turbulent pressures are nearly constant in the
midplane, so the effective equation of state is isobaric. In contrast, across
our four models having supernova rates that range from one to 512 times the
Galactic supernova rate, the mass-weighted velocity dispersion remains in the
range 4-6 km/s. Hence, gas averaged over ~100 pc regions follows an effective
equation of state that is close to isothermal. Simulated H I emission lines
have widths of 10-18 km/s, comparable to observed values. In our highest
supernova rate model, superbubble blow-outs occur, and the turbulent pressure
on large scales is >~4 times higher than the thermal pressure. We find a tight
correlation between the thermal and turbulent pressures averaged over ~100 pc
regions in the midplane of each model, as well as across the four ISM models.
We construct a subgrid model for turbulent pressure based on analytic arguments
and explicitly calibrate it against our stratified ISM simulations. The subgrid
model provides a simple yet physically motivated way to include supernova
feedback in cosmological simulations.
","[{""version"":""v1"",""created"":""Sun, 23 Nov 2008 14:03:27 GMT""},{""version"":""v2"",""created"":""Tue, 28 Jul 2009 19:51:52 GMT""},{""version"":""v3"",""created"":""Tue, 28 Jul 2009 20:12:06 GMT""}]","2009-09-24"
"0811.3748","Wei Wang","Wei Wang, Yue-Long Shen, and Cai-Dian L\""u (IHEP, CAS)","Covariant Light-Front Approach for $B_c$ transition form factors","15 pages, 1 figure, uncertainties reanalyzed, several parts
  reorganized, conclusions unchanged","Phys.Rev.D79:054012,2009","10.1103/PhysRevD.79.054012",,"hep-ph","http://arxiv.org/licenses/nonexclusive-distrib/1.0/","  In the covariant light-front quark model, we investigate the form factors of
$B_c$ decays into $D, D^*, D_s, D_s^*, \eta_c, J/\psi, B, B^*, B_s, B_s^*$
mesons. The form factors in the spacelike region $q^2<0$ are directly
evaluated. To extrapolate the form factors to the full kinematic region, we fit
the form factors by adopting a three-parameter form from the spacelike region.
$b\to u,d,s$ transition form factors at maximally recoiling point ($q^2=0$) are
smaller than $b\to c$ and $c\to d,s$ transition form factors, while the $b\to
d,s,c$ form factors at zero recoiling point are close to each other. In the
fitting procedure, we find the parameters for the form factors $A_2(B_c\to
B^*)$ and $A_2(B_c\to B^*_s)$ strongly depend on the decay constants of $B^*$
and $B_s^*$ mesons. Fortunately, the semileptonic and nonleptonic $B_c$ decays
are not sensitive to these form factors. With the form factors, we also
investigate the branching fractions, polarizations of the semileptonic $B_c\to
Ml\nu$ decays. Semileptonic $B_c\to (\eta_c,J/\psi)l\nu$ and $B_c\to
(B_s,B_s^*)l\nu$ decays have much larger branching fractions than $B_c\to
(D,D^*,B,B^*)l\nu$. In the three kinds of $B_c\to Vl\nu$ decays, contributions
from the longitudinal polarized vector is comparable with those from the
transversely polarized vector. These predictions will be tested at the ongoing
and forthcoming hadron colliders.
","[{""version"":""v1"",""created"":""Sun, 23 Nov 2008 14:19:21 GMT""},{""version"":""v2"",""created"":""Tue, 24 Mar 2009 01:36:10 GMT""}]","2014-11-18"
"0811.3749","Zbigniew Palmowski","Przemyslaw Klusik, Zbigniew Palmowski, Jakub Zwierz","Quantile hedging for an insider",,,,,"math.PR q-fin.PR","http://arxiv.org/licenses/nonexclusive-distrib/1.0/","  In this paper we consider the problem of the quantile hedging from the point
of view of a better informed agent acting on the market. The additional
knowledge of the agent is modelled by a filtration initially enlarged by some
random variable. By using equivalent martingale measures introduced in
Amendinger (2000) and Amendinger, Imkeller and Schweizer (1998) we solve the
problem for the complete case, by extending the results obtained in F{\""o}llmer
and Leukert (1999) to the insider context. Finally, we consider the examples
with the explicit calculations within the standard Black-Scholes model.
","[{""version"":""v1"",""created"":""Sun, 23 Nov 2008 14:59:13 GMT""}]","2008-12-02"
"0811.3750","Zbigniew  J. Jurek","Agnieszka Czyzewska-Jankowska and Zbigniew J. Jurek","A note on a composition of two random integral mappings $\J^\be$ and
  some examples","11 pages","Stochastic Analysis and Applications vol.27 (2009), pp. 1212-1222",,,"math.PR","http://arxiv.org/licenses/nonexclusive-distrib/1.0/","  A method of random integral representation, that is, a method of representing
a given probability measure as the probability distribution of some random
integral, was quite successful in the past few decades. In this note we show
that a composition of two random integral mappings $\J^\be$ is again a random
integral mapping. We illustrate our results on some examples.
","[{""version"":""v1"",""created"":""Sun, 23 Nov 2008 15:15:25 GMT""}]","2022-08-02"
"0811.3752","Zbigniew  J. Jurek","Zbigniew J. Jurek","A calculus on L\'evy exponents and selfdecomposability on Banach spaces","11 pages","Probability and Mathematical Statistics, vol. 28 no 2, 2008,
  pp.271-280",,,"math.PR","http://arxiv.org/licenses/nonexclusive-distrib/1.0/","  In infinite dimensional Banach spaces there is no complete characterization
of the L\'evy exponents of infinitely divisible probability measures. Here we
propose \emph{a calculus on L\'evy exponents} that is derived from some random
integrals. As a consequence we prove that \emph{each} selfdecomposable measure
can by factorized as another selfdecomposable measure and its background
driving measure that is s-selfdecomposable. This complements a result from the
paper of Iksanov-Jurek-Schreiber in the Annals of Probability \textbf{32},
2004.}
","[{""version"":""v1"",""created"":""Sun, 23 Nov 2008 15:32:52 GMT""}]","2010-09-15"
"0811.3753","Daniel Wohns","S.-H. Henry Tye, Daniel Wohns, and Yang Zhang","Coleman-de Luccia Tunneling and the Gibbons-Hawking Temperature","38 pages, 11 figures, ref. added, minor revisions","Int.J.Mod.Phys.A25:1019-1060,2010","10.1142/S0217751X10047981",,"hep-th","http://arxiv.org/licenses/nonexclusive-distrib/1.0/","  We study Coleman-de Luccia tunneling in some detail. We show that, for a
single scalar field potential with a true and a false vacuum, there are four
types of tunneling, depending on the properties of the potential. A general
tunneling process involves a combination of thermal (Gibbons-Hawking
temperature) fluctuation part way up the barrier followed by quantum tunneling.
The thin-wall approximation is a special limit of the case (of only quantum
tunneling) where inside the nucleation bubble is the true vacuum while the
outside reaches the false vacuum. Hawking-Moss tunneling is the (only thermal
fluctuation) limit of the case where the inside of the bubble does not reach
the true vacuum at the moment of its creation, and the outside is cut off by
the de Sitter horizon before it reaches the false vacuum. We estimate the
corrections to the Hawking-Moss formula, which can be large. In all cases, we
see that the bounce of the Euclidean action decreases rapidly as the vacuum
energy density increases, signaling that the tunneling is not exponentially
suppressed. In some sense, this phenomenon may be interpreted as a finite
temperature effect due to the Gibbons-Hawking temperature of the de Sitter
space. As an application, we discuss the implication of this tunneling property
to the cosmic landscape.
","[{""version"":""v1"",""created"":""Sun, 23 Nov 2008 15:59:58 GMT""},{""version"":""v2"",""created"":""Wed, 10 Dec 2008 21:52:53 GMT""},{""version"":""v3"",""created"":""Mon, 18 May 2009 20:33:38 GMT""}]","2010-03-17"
"0811.3754","Thomas Vojta","Thomas Vojta, J. A. Hoyos","Smeared quantum phase transition in the dissipative random quantum Ising
  model","7 pages, 10 eps figures embedded, final version as published","Physica E 42, 383-387 (2010)",,,"cond-mat.str-el cond-mat.dis-nn","http://arxiv.org/licenses/nonexclusive-distrib/1.0/","  We investigate the quantum phase transition in the random transverse-field
Ising model under the influence of Ohmic dissipation. To this end, we
numerically implement a strong-disorder renormalization-group scheme. We find
that Ohmic dissipation destroys the quantum critical point and the associated
quantum Griffiths phase by smearing. Our results quantitatively confirm a
recent theory [Phys. Rev. Lett. {\bf 100}, 240601 (2008)] of smeared quantum
phase transitions.
","[{""version"":""v1"",""created"":""Sun, 23 Nov 2008 15:49:56 GMT""},{""version"":""v2"",""created"":""Mon, 18 Jan 2010 04:07:57 GMT""}]","2010-01-18"
