"0811.3636","Igor Soszynski","I. Soszynski, A. Udalski, M.K. Szymanski, M. Kubiak, G. Pietrzynski,
  L. Wyrzykowski, O. Szewczyk, K. Ulaczyk, R. Poleski","The Optical Gravitational Lensing Experiment. The OGLE-III Catalog of
  Variable Stars. II. Type II Cepheids and Anomalous Cepheids in the Large
  Magellanic Cloud","20 pages, 9 figures","Acta Astronomica 2008, 58, 293",,,"astro-ph","http://arxiv.org/licenses/nonexclusive-distrib/1.0/","  In the second part of the OGLE-III Catalog of Variable Stars (OIII-CVS) we
present 197 type II Cepheids and 83 anomalous Cepheids in the Large Magellanic
Cloud (LMC). The sample of type II Cepheids consists of 64 BL Her stars, 96 W
Vir stars and 37 RV Tau stars. Anomalous Cepheids are divided into 62
fundamental-mode and 21 first-overtone pulsators. These are the largest samples
of such types of variable stars detected anywhere outside the Galaxy.
  We present the period-luminosity and color-magnitude diagrams of stars in the
sample. If the boundary period between BL Her and W Vir stars is adopted at 4
days, both groups differ significantly in (V-I) colors. We identify a group of
16 peculiar W Vir stars with different appearance of the light curves, brighter
and bluer than ordinary stars of that type. Four of these peculiar W Vir stars
show additional eclipsing modulation superimposed on the pulsation light
curves. Four other stars of that type show long-period secondary variations
which may be ellipsoidal modulations. It suggests that peculiar W Vir subgroup
may be related to binarity. In total, we identified seven type II Cepheids
simultaneously exhibiting eclipsing variations which is a very large fraction
compared to classical Cepheids in the LMC. We discuss diagrams showing Fourier
parameters of the light curve decomposition against periods. Three sharp
features interpreted as an effect of resonances between radial modes are
detectable in these diagrams for type II Cepheids.
","[{""version"":""v1"",""created"":""Sat, 22 Nov 2008 21:43:46 GMT""},{""version"":""v2"",""created"":""Wed, 7 Jan 2009 13:08:53 GMT""}]","2009-01-07"
"0811.3662","Zhong-Bo Kang","Zhong-Bo Kang (Iowa State U.), Jian-Wei Qiu (Iowa State U.), and
  Werner Vogelsang (BNL)","Low-mass lepton pair production at large transverse momentum","16 pages, 11 figures, revised version to appear in Phys. Rev. D","Phys.Rev.D79:054007,2009","10.1103/PhysRevD.79.054007",,"hep-ph nucl-th","http://arxiv.org/licenses/nonexclusive-distrib/1.0/","  We study the transverse momentum distribution of low-mass lepton pairs
produced in hadronic scattering, using the perturbative QCD factorization
approach. We argue that the distribution at large transverse momentum, $Q_T \gg
Q$, with the pair's invariant mass $Q$ as low as $Q \sim
\Lambda_{\mathrm{QCD}}$, can be systematically factorized into universal
parton-to-lepton pair fragmentation functions, parton distributions, and
perturbatively calculable partonic hard parts evaluated at a short distance
scale $\sim {\cal O}(1/Q_T)$. We introduce a model for the input lepton pair
fragmentation functions at a scale $\mu_0\sim 1$ GeV, which are then evolved
perturbatively to scales relevant at RHIC. Using the evolved fragmentation
functions, we calculate the transverse momentum distributions in hadron-hadron,
hadron-nucleus, and nucleus-nucleus collisions at RHIC. We also discuss the
sensitivity of the transverse momentum distribution of low-mass lepton pairs to
the gluon distribution.
","[{""version"":""v1"",""created"":""Sat, 22 Nov 2008 19:06:54 GMT""},{""version"":""v2"",""created"":""Fri, 20 Feb 2009 06:05:02 GMT""}]","2009-03-24"
"0811.3675","Marco Guzzi","Claudio Coriano', Marco Guzzi, Antonio Mariano and Simone Morelli","A Light Supersymmetric Axion in an Anomalous Abelian Extension of the
  Standard Model","46 pages, 28 figures. Revised version, accepted for a publication on
  Phys.Rev.D","Phys.Rev.D80:035006,2009","10.1103/PhysRevD.80.035006",,"hep-ph hep-th","http://arxiv.org/licenses/nonexclusive-distrib/1.0/","  We present a supersymmetric extension of the Standard Model (USSM-A) with an
anomalous U(1) and Stueckelberg axions for anomaly cancellation, generalizing
similar non-supersymmetric constructions. The model, built by a bottom-up
approach, is expected to capture the low-energy supersymmetric description of
axionic symmetries in theories with gauged anomalous abelian interactions,
previously explored in the non-supersymmetric case for scenarios with
intersecting branes. The choice of a USSM-like superpotential, with one extra
singlet superfield and an extra abelian symmetry, allows a physical axion-like
particle in the spectrum. We describe some general features of this
construction and in particular the modification of the dark-matter sector which
involves both the axion and several neutralinos with an axino component. The
axion is expected to be very light in the absence of phases in the
superpotential but could acquire a mass which can also be in the few GeV range
or larger. In particular, the gauging of the anomalous symmetry allows
independent mass/coupling interaction to the gauge fields of this particle, a
feature which is absent in traditional (invisible) axion models. We comment on
the general implications of our study for the signature of moduli from string
theory due to the presence of these anomalous symmetries.
","[{""version"":""v1"",""created"":""Sun, 23 Nov 2008 08:23:15 GMT""},{""version"":""v2"",""created"":""Wed, 15 Jul 2009 15:08:26 GMT""}]","2009-08-13"
"0811.3683","Bahtiyar Ozgur Sarioglu","Ozgur Sarioglu, Bayram Tekin","Comment on the new AdS universe","2 pages; version 2: major changes including the title","Class.Quant.Grav.26:048001,2009","10.1088/0264-9381/26/4/048001",,"gr-qc","http://arxiv.org/licenses/nonexclusive-distrib/1.0/","  We show that Bonnor's new Anti-de Sitter (AdS) universe and its D-dimensional
generalization is the previously studied AdS soliton.
","[{""version"":""v1"",""created"":""Sun, 23 Nov 2008 10:38:10 GMT""},{""version"":""v2"",""created"":""Tue, 25 Nov 2008 11:50:15 GMT""}]","2009-06-10"
"0811.3692","Ioan Grosu i","I.Grosu, L.Tugulan","Plasmon dispersion in quasi-one and one-dimensional systems with
  non-magnetic impurities","12 pages, no figures, Physica E, 40, 474, (2008)",,"10.1016/j.physe.2007.07.001",,"cond-mat.dis-nn","http://arxiv.org/licenses/nonexclusive-distrib/1.0/","  We calculate the plasmon dispersion in quasi-one-dimensional quantum wires,
in the presence of non-magnetic impurities, taking into consideration the
memory function formalism and the role of the forward scattering. The plasma
frequency is reduced by the presence of impurities. We also calculate,
analytically, the plasmon dispersion in the Born approximation, for the
scattering of the electrons by the non-magnetic impurities. We compare our
result with the numerical results of Sarma and Hwang.
","[{""version"":""v1"",""created"":""Sat, 22 Nov 2008 16:17:08 GMT""}]","2009-11-13"
"0811.3693","Agostino Prastaro","Agostino Prastaro","Extended Crystal PDE's","61 pages; 7 figures",,,,"math.AT math.AP","http://arxiv.org/licenses/nonexclusive-distrib/1.0/","  In this paper we show that between PDE's and crystallographic groups there is
an unforeseen relation. In fact we prove that integral bordism groups of PDE's
can be considered extensions of crystallographic subgroups. In this respect we
can consider PDE's as {\em extended crystals}. Then an algebraic-topological
obstruction ({\em crystal obstruction}), characterizing existence of global
smooth solutions for smooth boundary value problems, is obtained. Applications
of this new theory to the Ricci-flow equation and Navier-Stokes equation are
given that solve some well-known fundamental problems. These results, are also
extended to singular PDE's, introducing ({\em extended crystal singular
PDE's}). An application to singular MHD-PDE's, is given following some our
previous results on such equations, and showing existence of (finite times
stable smooth) global solutions crossing critical nuclear energy production
zone.
","[{""version"":""v1"",""created"":""Sat, 22 Nov 2008 16:22:20 GMT""},{""version"":""v10"",""created"":""Thu, 27 May 2010 12:43:12 GMT""},{""version"":""v11"",""created"":""Mon, 31 May 2010 00:13:04 GMT""},{""version"":""v12"",""created"":""Tue, 8 Jun 2010 08:37:28 GMT""},{""version"":""v13"",""created"":""Wed, 20 Oct 2010 23:50:13 GMT""},{""version"":""v14"",""created"":""Mon, 16 May 2011 14:53:11 GMT""},{""version"":""v15"",""created"":""Wed, 22 Jun 2011 22:43:26 GMT""},{""version"":""v16"",""created"":""Fri, 24 Jun 2011 11:51:49 GMT""},{""version"":""v17"",""created"":""Sun, 3 Jul 2011 23:17:08 GMT""},{""version"":""v18"",""created"":""Wed, 24 Aug 2011 19:02:04 GMT""},{""version"":""v2"",""created"":""Tue, 9 Dec 2008 23:29:22 GMT""},{""version"":""v3"",""created"":""Sat, 30 May 2009 14:41:48 GMT""},{""version"":""v4"",""created"":""Wed, 5 Aug 2009 18:17:12 GMT""},{""version"":""v5"",""created"":""Sat, 10 Apr 2010 17:19:39 GMT""},{""version"":""v6"",""created"":""Thu, 29 Apr 2010 12:13:10 GMT""},{""version"":""v7"",""created"":""Mon, 3 May 2010 14:45:32 GMT""},{""version"":""v8"",""created"":""Fri, 7 May 2010 13:15:52 GMT""},{""version"":""v9"",""created"":""Sun, 16 May 2010 01:15:46 GMT""}]","2015-03-13"
"0811.3694","Paul Manneville","M. Lagha and P. Manneville","Modeling transitional plane Couette flow","33 pages, 10 figures","Eur. Phys. J. B vol. 58 (2007) 433-447","10.1140/epjb/e2007-00243-y",,"physics.flu-dyn","http://arxiv.org/licenses/nonexclusive-distrib/1.0/","  The Galerkin method is used to derive a realistic model of plane Couette flow
in terms of partial differential equations governing the space-time dependence
of the amplitude of a few cross-stream modes. Numerical simulations show that
it reproduces the globally sub-critical behavior typical of this flow. In
particular, the statistics of turbulent transients at decay from turbulent to
laminar flow displays striking similarities with experimental findings.
","[{""version"":""v1"",""created"":""Sat, 22 Nov 2008 16:25:25 GMT""}]","2008-11-25"
"0811.3695","Paul Manneville","M. Lagha and P. Manneville","Large scale flow around turbulent spots","16 pages, 6 figures","Phys. Fluids vol. 19 (2007) 094105","10.1063/1.2768946",,"physics.flu-dyn","http://arxiv.org/licenses/nonexclusive-distrib/1.0/","  Numerical simulations of a model of plane Couette flow focusing on its
in-plane spatio-temporal properties are used to study the dynamics of turbulent
spots.
","[{""version"":""v1"",""created"":""Sat, 22 Nov 2008 16:35:58 GMT""}]","2008-11-25"
"0811.3696","Vassilios Karakostas Dr.","Vassilios Karakostas","Nonseparability, Potentiality and the Context-Dependence of Quantum
  Objects",,"Journal for General Philosophy of Science (2007) 38: 279-297",,,"quant-ph","http://arxiv.org/licenses/nonexclusive-distrib/1.0/","  Standard quantum mechanics undeniably violates the notion of separability
that classical physics accustomed us to consider as valid. By relating the
phenomenon of quantum nonseparability to the all-important concept of
potentiality, we effectively provide a coherent picture of the puzzling
entangled correlations among spatially separated systems. We further argue that
the generalized phenomenon of quantum nonseparability implies contextuality for
the production of well-defined events in the quantum domain, whereas
contextuality entails in turn a structural-relational conception of quantal
objects, viewed as carriers of dispositional properties. It is finally
suggested that contextuality, if considered as a conditionalization preparation
procedure of the object to be measured, naturally leads to a separable concept
of reality whose elements are experienced as distinct, well-localized objects
having determinate properties. In this connection, we find it necessary to
distinguish the meaning of the term reality from the criterion of reality for
us. The implications of the latter considerations for the notion of objectivity
in quantum mechanics are also discussed.
","[{""version"":""v1"",""created"":""Sat, 22 Nov 2008 16:37:34 GMT""}]","2008-11-25"
"0811.3697","Jinqiao Duan","Jinqiao Duan","Predictability in Nonlinear Dynamical Systems with Model Uncertainty","A review and tutorial article; Stochastic Physics and Climate
  Modeling, T. N. Palmer and P. Williams (eds.), Cambridge Univ. Press, 2008
  (to appear)",,,,"math.DS math.PR","http://arxiv.org/licenses/nonexclusive-distrib/1.0/","  Nonlinear systems with model uncertainty are often described by stochastic
differential equations. Some techniques from random dynamical systems are
discussed. They are relevant to better understanding of solution processes of
stochastic differential equations and thus may shed lights on predictability in
nonlinear systems with model uncertainty.
","[{""version"":""v1"",""created"":""Sat, 22 Nov 2008 16:59:32 GMT""}]","2008-11-25"
"0811.3698","Naihuan Jing","Chengming Bai, Mo-Lin Ge, Naihuan Jing","Principal Realization of the Yangian Y(gl(n))","10 pages","J. Math. Phys. 50, 013518 (2009) (7 pages)","10.1063/1.3050319",,"math.QA hep-th math.RT","http://arxiv.org/licenses/nonexclusive-distrib/1.0/","  Motivated to simplify the structure of tensor representations we give a new
set of generators for the Yangian $Y(sl(n))$ using the principal realization in
simple Lie algebras. The isomorphism between our new basis and the standard
Cartan-Weyl basis is also given. We show by example that the principal basis
simplifies the Yangian action significantly in the tensor product of the
fundamental representation and its dual.
","[{""version"":""v1"",""created"":""Sat, 22 Nov 2008 17:05:06 GMT""}]","2009-11-13"
"0811.3699","Jinqiao Duan","Jinqiao Duan","Stochastic Modeling of Unresolved Scales in Complex Systems","Frontiers of Mathematics in China, Vol 4, 2009, to appear",,,,"math.DS math.NA","http://arxiv.org/licenses/nonexclusive-distrib/1.0/","  Model uncertainties and simulation uncertainties occur in mathematical
modeling of multiscale complex systems, since some mechanisms or scales are not
represented (i.e., ""unresolved"") due to lack in our understanding of these
mechanisms or limitations in computational power. The impact of these
unresolved scales on the resolved scales needs to be parameterized or taken
into account. A stochastic scheme is devised to take the effects of unresolved
scales into account, in the context of solving nonlinear partial differential
equations. An example is presented to demonstrate this strategy.
","[{""version"":""v1"",""created"":""Sat, 22 Nov 2008 17:06:24 GMT""}]","2008-11-25"
"0811.3700","J. C. Yoon","J.C. Yoon","Relative Spin Polarization of Parity-Violating Asymmetries",,,,,"hep-ph","http://arxiv.org/licenses/nonexclusive-distrib/1.0/","  Parity-violating asymmetries in polarized electron scattering have been
interpreted as the asymmetries between opposite helicities of incoming fermion
based on the approximation of the spin polarization operator. Here exact
calculations of cross sections for parity-violating asymmetries in SLAC E158
and SLD have been performed using spin projection operators. And the
parity-violating factor incorporating with spin polarization and momentum has
been identified and shown that its sign depends on the spin polarization of
incoming particle and the relative velocity of incoming and target particles.
Therefore, I suggest a new concept of relative spin polarization to interpret
the parity-violating asymmetry as contributed by the antisymmetric nature of
the weak interactions depending on whether the spin direction of the incoming
electron is inward or outward relative to the target electron.
","[{""version"":""v1"",""created"":""Sat, 22 Nov 2008 17:08:02 GMT""}]","2008-11-25"
"0811.3701","Jean-Paul Cardinal","Jean-Paul Cardinal","Symmetric matrices related to the Mertens function","Version submitted to LAA; some new references",,,,"math.NT","http://arxiv.org/licenses/nonexclusive-distrib/1.0/","  In this paper we explore a family of congruences over $\N^\ast$ from which
one builds a sequence of symmetric matrices related to the Mertens function.
  From the results of numerical experiments, we formulate a conjecture about
the growth of the quadratic norm of these matrices, which implies the Riemann
hypothesis. This suggests that matrix analysis methods may come to play a more
important role in this classical and difficult problem.
","[{""version"":""v1"",""created"":""Sat, 22 Nov 2008 17:22:06 GMT""},{""version"":""v2"",""created"":""Sun, 30 Nov 2008 19:59:46 GMT""},{""version"":""v3"",""created"":""Wed, 31 Dec 2008 14:53:20 GMT""},{""version"":""v4"",""created"":""Mon, 9 Mar 2009 11:28:48 GMT""}]","2009-03-09"
"0811.3702","Said Benayadi","Amir Baklouti (LMAM), Said Benayadi (LMAM)","Pseudo-euclidean Jordan algebras","39 pages",,,,"math.RA","http://arxiv.org/licenses/nonexclusive-distrib/1.0/","  A Jordan algebra J is said to be pseudo-euclidean if J is endowed with an
associative non-degenerate symmetric bilinear form B. B is said an associative
scalar product on J. First, we provide a description of the pseudo-euclidean
Jordan K-algebras in terms of double extensions and generalized double
extensions. In particular, we shall use this description to construct all
pseudo-euclidean Jordan algebras of dimension less than or equal to 5. And
then, from one of these algebras, we shall construct a twelve dimension Lie
algebra by the ""TKK"" construction. Second, a description of symplectic
pseudo-euclidean Jordan algebras is provided and finally we describe a
particular class of these algebras namely the class of symplectic Jordan-Manin
Algebras. In addition to these descriptions, this paper demonstrates that these
last two classes are identical and provides several information on the
structure of pseudo-euclidean Jordan algebras.
","[{""version"":""v1"",""created"":""Sat, 22 Nov 2008 17:37:21 GMT""}]","2008-11-25"
"0811.3703","Bernard Host","Bernard Host (LAMA)","Ergodic seminorms for commuting transformations and applications",,"Studia Mathematica 195 (2009) 31-49",,,"math.DS","http://arxiv.org/licenses/nonexclusive-distrib/1.0/","  Recently, T. Tao gave a finitary proof a convergence theorem for multiple
averages with several commuting transformations and soon later, T. Austin gave
an ergodic proof of the same result. Although we give here one more proof of
the same theorem, this is not the main goal of this paper. Our main concern is
to provide some tools for the case of several commuting transformations,
similar to the tools successfully used in the case of a single transformation,
with the idea that they will be useful in the solution of other problems.
","[{""version"":""v1"",""created"":""Sat, 22 Nov 2008 17:38:24 GMT""}]","2012-09-27"
"0811.3704","Olivier Finkel","Olivier Finkel (LIP, Elm)","Highly Undecidable Problems about Recognizability by Tiling Systems","to appear in a Special Issue of the journal Fundamenta Informaticae
  on Machines, Computations and Universality","Fundamenta Informaticae 2, 91 (2009) 305-323",,,"cs.CC cs.LO math.LO","http://arxiv.org/licenses/nonexclusive-distrib/1.0/","  Altenbernd, Thomas and W\""ohrle have considered acceptance of languages of
infinite two-dimensional words (infinite pictures) by finite tiling systems,
with usual acceptance conditions, such as the B\""uchi and Muller ones [1]. It
was proved in [9] that it is undecidable whether a B\""uchi-recognizable
language of infinite pictures is E-recognizable (respectively, A-recognizable).
We show here that these two decision problems are actually $\Pi_2^1$-complete,
hence located at the second level of the analytical hierarchy, and ""highly
undecidable"". We give the exact degree of numerous other undecidable problems
for B\""uchi-recognizable languages of infinite pictures. In particular, the
non-emptiness and the infiniteness problems are $\Sigma^1_1$-complete, and the
universality problem, the inclusion problem, the equivalence problem, the
determinizability problem, the complementability problem, are all
$\Pi^1_2$-complete. It is also $\Pi^1_2$-complete to determine whether a given
B\""uchi recognizable language of infinite pictures can be accepted row by row
using an automaton model over ordinal words of length $\omega^2$.
","[{""version"":""v1"",""created"":""Sat, 22 Nov 2008 17:41:28 GMT""}]","2009-08-04"
"0811.3705","Amor Keziou","Michel Broniatowski (LSTA), Amor Keziou (LSTA, LM-Reims)","Parametric estimation and tests through divergences and duality
  technique",,,,,"math.ST stat.TH","http://arxiv.org/licenses/nonexclusive-distrib/1.0/","  We introduce estimation and test procedures through divergence optimization
for discrete or continuous parametric models. This approach is based on a new
dual representation for divergences. We treat point estimation and tests for
simple and composite hypotheses, extending maximum likelihood technique. An
other view at the maximum likelihood approach, for estimation and test, is
given. We prove existence and consistency of the proposed estimates. The limit
laws of the estimates and test statistics (including the generalized likelihood
ratio one) are given both under the null and the alternative hypotheses, and
approximation of the power functions is deduced. A new procedure of
construction of confidence regions, when the parameter may be a boundary value
of the parameter space, is proposed. Also, a solution to the irregularity
problem of the generalized likelihood ratio test pertaining to the number of
components in a mixture is given, and a new test is proposed, based on $\chi
^{2}$-divergence on signed finite measures and duality technique.
","[{""version"":""v1"",""created"":""Sat, 22 Nov 2008 17:44:30 GMT""}]","2008-12-02"
"0811.3706","Gideon Amir","Gideon Amir, Omer Angel, Benedek Valk\'o","The TASEP speed process","Published in at http://dx.doi.org/10.1214/10-AOP561 the Annals of
  Probability (http://www.imstat.org/aop/) by the Institute of Mathematical
  Statistics (http://www.imstat.org)","Annals of Probability 2011, Vol. 39, No. 4, 1205-1242","10.1214/10-AOP561","IMS-AOP-AOP561","math.PR math-ph math.MP","http://arxiv.org/licenses/nonexclusive-distrib/1.0/","  In the multi-type totally asymmetric simple exclusion process (TASEP) on the
line, each site of Z is occupied by a particle labeled with some number, and
two neighboring particles are interchanged at rate one if their labels are in
increasing order. Consider the process with the initial configuration where
each particle is labeled by its position. It is known that in this case a.s.
each particle has an asymptotic speed which is distributed uniformly on [-1,1].
We study the joint distribution of these speeds: the TASEP speed process. We
prove that the TASEP speed process is stationary with respect to the multi-type
TASEP dynamics. Consequently, every ergodic stationary measure is given as a
projection of the speed process measure. This generalizes previous descriptions
restricted to finitely many classes. By combining this result with known
stationary measures for TASEPs with finitely many types, we compute several
marginals of the speed process, including the joint density of two and three
consecutive speeds. One striking property of the distribution is that two
speeds are equal with positive probability and for any given particle there are
infinitely many others with the same speed. We also study the partially
asymmetric simple exclusion process (ASEP). We prove that the states of the
ASEP with the above initial configuration, seen as permutations of Z, are
symmetric in distribution. This allows us to extend some of our results,
including the stationarity and description of all ergodic stationary measures,
also to the ASEP.
","[{""version"":""v1"",""created"":""Sun, 23 Nov 2008 01:59:23 GMT""},{""version"":""v2"",""created"":""Thu, 15 Nov 2012 08:40:46 GMT""}]","2012-11-16"
"0811.3707","Olaf Post","Pavel Exner and Olaf Post","Approximation of quantum graph vertex couplings by scaled Schr\""odinger
  operators on thin branched manifolds","19 pages, 1 figure",,,,"math-ph math.MP","http://arxiv.org/licenses/nonexclusive-distrib/1.0/","  We discuss approximations of vertex couplings of quantum graphs using
families of thin branched manifolds. We show that if a Neumann type Laplacian
on such manifolds is amended by suitable potentials, the resulting
Schr\""odinger operators can approximate non-trivial vertex couplings. The
latter include not only the delta-couplings but also those with wavefunctions
discontinuous at the vertex. We work out the example of the symmetric
delta'-couplings and conjecture that the same method can be applied to all
couplings invariant with respect to the time reversal.
","[{""version"":""v1"",""created"":""Sat, 22 Nov 2008 18:47:18 GMT""}]","2008-11-25"
"0811.3708","Tino Nyawelo S","Tino S. Nyawelo and Paolo Gondolo","One-loop Self Energies in Softly Broken Supersymmetric QED","19 pages, 2 figures",,,,"hep-ph hep-th","http://arxiv.org/licenses/nonexclusive-distrib/1.0/","  We apply the supergraph with spurion technique to compute the renormalization
of one-loop diagrams that contributes to electron and selectron self energies
in a softly broken Supersymmetric Quantum Electrodynamics (SQED). In
particular, we calculate the one-loop gauge superfield contribution to the
two-point function.
","[{""version"":""v1"",""created"":""Sat, 22 Nov 2008 20:27:54 GMT""}]","2008-11-25"
