"0809.0727","L.T. Handoko","I. Firmansyah, Z. Akbar, B. Hermanto and L.T. Handoko","Microcontroller-based System for Modular Networked Robot","6 pages, 5 figures, Proceeding of the 2008 International Conference
  on Advanced Computational Intelligence and Its Applications",,,"FISIKALIPI-08077","cs.RO cs.CY","http://arxiv.org/licenses/nonexclusive-distrib/1.0/","  A prototype of modular networked robot for autonomous monitoring works with
full control over web through wireless connection has been developed. The robot
is equipped with a particular set of built-in analyzing tools and appropriate
censors, depending on its main purposes, to enable self-independent and
real-time data acquisition and processing. The paper is focused on the
microcontroller-based system to realize the modularity. The whole system is
divided into three modules : main unit, data acquisition and data processing,
while the analyzed results and all aspects of control and monitoring systems
are fully accessible over an integrated web-interface. This concept leads to
some unique features : enhancing flexibility due to enabling partial
replacement of the modules according to user needs, easy access over web for
remote users, and low development and maintenance cost due to software
dominated components.
","[{""version"":""v1"",""created"":""Thu, 4 Sep 2008 00:13:11 GMT""}]","2008-09-05"
"0809.0728","Wenyi Zhang","Wenyi Zhang, Urbashi Mitra","A Spectrum-Shaping Perspective on Cognitive Radio","To appear in DySPAN'08",,,,"cs.IT math.IT","http://arxiv.org/licenses/nonexclusive-distrib/1.0/","  A new perspective on cognitive radio is presented, where the pre-existent
legacy service is either uncoded or coded and a pair of cognitive transceivers
need be appropriately deployed to coexist with the legacy service. The basic
idea underlying the new perspective is to exploit the fact that, typically, the
legacy channel is not fully loaded by the legacy service, thus leaving a
non-negligible margin to accommodate the cognitive transmission. The
exploitation of such a load margin is optimized by shaping the spectrum of the
transmitted cognitive signal. It is shown that non-trivial coexistence of
legacy and cognitive systems is possible even without sharing the legacy
message with the cognitive transmitter. Surprisingly, the optimized cognitive
transmitter is no longer limited by its interference power at the legacy
receiver, and can always transmit at its full available device power.
Analytical development and numerical illustration are presented, in particular
focusing on the logarithmic growth rate, {\it i.e.}, the prelog coefficient, of
cognitive transmission in the high-power regime.
","[{""version"":""v1"",""created"":""Thu, 4 Sep 2008 00:50:20 GMT""}]","2008-09-05"
"0809.0729","Yu Liu","Y. Liu, H. Lin","The Solar Coronal Magnetic Field Measurements With SOLARC","3 pages, 4 figs, APRIM 2008 Proceedinds",,,,"astro-ph","http://arxiv.org/licenses/nonexclusive-distrib/1.0/","  Direct solar coronal magnetic field measurements have become possible since
recent development of high-sensitivity infrared detection technology. The
SOLARC instrument installed on Mt. Haleakala is such a polarimetric coronagraph
that was designed for routinely observing Stokes parameter profiles in near
infrared (NIR) wavelengthes. The Fe$^{+12}$ 1075 nm forbidden coronal emission
line (CEL) is potential for weak coronal magnetic field detection. As a first
step the potential field model has been used to compare with the SOLARC
observation in the Fe$^{+12}$ 1075 nm line (Liu and Lin 2008). It's found that
the potential fields can be a zeroth-order proxy for approaching the observed
coronal field above a simple stable sunspot. In this paper we further discuss
several nodi that are hampering the progress for reconstructing the real
coronal magnetic field structures. They include the well-known Van Vleck effect
in linear polarization signals, ignorance of the information of the NIR
emission sources (i.e., inversion problem of coronal magnetic fields), a fat
lot of global non-linear force-free field tools available for better modeling
coronal magnetic fields, and so on.
","[{""version"":""v1"",""created"":""Thu, 4 Sep 2008 01:00:30 GMT""},{""version"":""v2"",""created"":""Fri, 5 Sep 2008 04:23:25 GMT""}]","2008-09-05"
"0809.0730","Maciej Niebrzydowski","Maciej Niebrzydowski","Three geometric applications of quandle homology","16 pages, 13 figures","Topology and its Applications, Volume 156, Issue 9 (2009),
  1729-1738",,,"math.GT","http://arxiv.org/licenses/nonexclusive-distrib/1.0/","  In this paper we describe three geometric applications of quandle homology.
We show that it gives obstructions to tangle embeddings, provides the lower
bound for the 4-move distance between links, and can be used in determining
periodicity of links.
","[{""version"":""v1"",""created"":""Thu, 4 Sep 2008 01:12:16 GMT""}]","2019-10-29"
"0809.0731","Nan Zhao","Nan Zhao, H. Dong, Shuo Yang, C. P. Sun","Observable Topological Effects of Mobius Molecular Devices","4 pages, 4 figures","PRB 79, 125440 (2009)","10.1103/PhysRevB.79.125440",,"quant-ph cond-mat.mes-hall","http://arxiv.org/licenses/nonexclusive-distrib/1.0/","  We study the topological properties of quantum states for the spinless
particle hopping in a Mobius ladder. This system can be regarded as a molecular
device possibly engineered from the aromatic Mobius annulenes, which enjoys a
pseudo-spin orbital interaction described by a non-Abelian gauge structure. It
results from the nontrivial topology of configuration space, and results in
various observable effects, such as optical spectral splitting. The
transmission spectrum through the Mobius molecular device is calculated to
demonstrate a topological effect as a destructive interferences in the
conduction band. The induced interaction also leads to an entanglement between
the transverse and longitudinal modes for any locally factorized state.
","[{""version"":""v1"",""created"":""Thu, 4 Sep 2008 02:12:25 GMT""}]","2010-04-29"
"0809.0732","Kazumasa Hattori","Kazumasa Hattori and Hirokazu Tsunetsugu","A Possible Phase Transition in beta-pyrochlore Compounds","4 pages, 4 figures, submitted to J. Phys. Soc. Jpn",,"10.1143/JPSJ.78.013603",,"cond-mat.str-el cond-mat.stat-mech","http://arxiv.org/licenses/nonexclusive-distrib/1.0/","  We investigate a lattice of interacting anharmonic oscillators by using a
mean field theory and exact diagonalization. We construct an effective
five-state hopping model with intersite repulsions as a model for
beta-pyrochlore AOs_2O_6(A=K, Rb or Cs). We obtain the first order phase
transition line from large to small oscillation amplitude phases as temperature
decreases. We also discuss the possibility of a phase with local electric
polarizations. Our theory can explain the origin of the mysterious first order
transition in KOs_2O_6.
","[{""version"":""v1"",""created"":""Thu, 4 Sep 2008 01:41:08 GMT""}]","2009-11-13"
"0809.0733","Masaaki Harada","Masaaki Harada and Akihiro Munemasa","There exists no self-dual [24,12,10] code over F5","To appear in Designs, Codes and Cryptogr","Designs, Codes and Cryptogr. 52 (2009), 125-127",,,"math.CO cs.IT math.IT","http://arxiv.org/licenses/nonexclusive-distrib/1.0/","  Self-dual codes over F5 exist for all even lengths. The smallest length for
which the largest minimum weight among self-dual codes has not been determined
is 24, and the largest minimum weight is either 9 or 10. In this note, we show
that there exists no self-dual [24,12,10] code over F5, using the
classification of 24-dimensional odd unimodular lattices due to Borcherds.
","[{""version"":""v1"",""created"":""Thu, 4 Sep 2008 02:17:12 GMT""},{""version"":""v2"",""created"":""Fri, 6 Mar 2009 07:37:52 GMT""}]","2012-05-28"
"0809.0734","Leonid Ksenofontov","E.G.Berezhko (Yu.G. Shafer Institute of Cosmophysical Research and
  Aeronomy, Yakutsk, Russia)","Cosmic rays from active galactic nuclei","9 pages, Accepted for publication in ApJL","Astrophys.J.684:L69-L71,2008","10.1086/592233",,"astro-ph","http://arxiv.org/licenses/nonexclusive-distrib/1.0/","  Cosmic ray (CR) acceleration at the shock created by the expanding cocoons
around active galactic nuclei (AGNs) is studied. It is shown that above the
energy $10^{18}$ eV the overall energy spectrum of CRs, produced during the AGN
evolution and released in the intergalactic space, has the form $N\propto
\epsilon^{-\gamma}$, with $\gamma\approx 2.6$, which extends up to
$\epsilon_{max}\sim 10^{20}$ eV. It is concluded that cocoons shocks have to be
considered as a main source of extragalactic CRs, which together with Galactic
supernova remnants provide the observed CR spectrum.
","[{""version"":""v1"",""created"":""Thu, 4 Sep 2008 02:19:42 GMT""}]","2009-11-19"
"0809.0735","Ryosuke Kadono","K. H. Satoh, M. Hiraishi, M. Miyazaki, S. Takeshita, A. Koda, R.
  Kadono, I. Yamada, K. Oka, M. Azuma, Y. Shimakawa, and M. Takano","Effect of Zn substitution for Cu on Ca$_{2-x}$Na$_{x}$CuO$_{2}$Cl$_{2}$
  near the hole concentration of 1/8 per Cu","4 pages, 3 figures",,"10.1016/j.physb.2008.11.191",,"cond-mat.supr-con cond-mat.str-el","http://arxiv.org/licenses/nonexclusive-distrib/1.0/","  A weakening of superconductivity upon substitution of Cu by Zn (0.5~1 %) is
observed in a high-T_c cuprate, Ca_{2-x}Na_xCuO2Cl2, near the hole
concentration of 1/8 per Cu. The superconducting transition temperature and its
volume fraction, estimated by magnetic susceptibility, exhibit a sizable
anomaly for x=0.12~0.14, where the slowing down of Cu spin fluctuations below 5
K is demonstrated by muon spin relaxation experiments. These observations are
in close resemblance to other typical cuprates including YBa2Cu3O_{7-d}, and
Bi2Sr2Ca_{1-x}Y_xCu2O_{8+d}, providing further evidence that Zn-induced
""stripe"" correlation is a universal feature of high-T_c cuprate superconductors
common to that of La_{2-x}A_{x}CuO4 (A=Ba, Sr).
","[{""version"":""v1"",""created"":""Thu, 4 Sep 2008 02:23:25 GMT""}]","2009-11-13"
"0809.0736","Tim Gould","Tim Gould and Evan Gray and John F. Dobson","van der Waals dispersion power laws for cleavage, exfoliation and
  stretching in multi-scale, layered systems",,"Phys. Rev. B 79, 113402 (2009)","10.1103/PhysRevB.79.113402",,"cond-mat.mtrl-sci","http://arxiv.org/licenses/nonexclusive-distrib/1.0/","  Layered and nanotubular systems that are metallic or graphitic are known to
exhibit unusual dispersive van der Waals (vdW) power laws under some
circumstances. In this letter we investigate the vdW power laws of bulk and
finite layered systems and their interactions with other layered systems and
atoms in the electromagnetically non-retarded case. The investigation reveals
substantial difference between `cleavage' and `exfoliation' of graphite and
metals where cleavage obeys a $C_2 D^{-2}$ vdW power law while exfoliation
obeys a $C_3 \log(D/D_0) D^{-3}$ law for graphitics and a $C_{5/2} D^{-5/2}$
law for layered metals. This leads to questions of relevance in the
interpretation of experimental results for these systems which have previously
assumed more trival differences. Furthermore we gather further insight into the
effect of scale on the vdW power laws of systems that simultaneously exhibit
macroscopic and nanoscopic dimensions. We show that, for metallic and graphitic
layered systems, the known ""unusual"" power laws can be reduced to standard or
near standard power laws when the effective scale of one or more dimension is
changed. This allows better identification of the systems for which the
commonly employed `sum of $C_6 D^{-6}$' type vdW methods might be valid such as
layered bulk to layered bulk and layered bulk to atom.
","[{""version"":""v1"",""created"":""Thu, 4 Sep 2008 02:31:43 GMT""},{""version"":""v2"",""created"":""Tue, 9 Sep 2008 10:56:36 GMT""},{""version"":""v3"",""created"":""Tue, 3 Feb 2009 00:25:57 GMT""}]","2012-08-28"
"0809.0737","Lav Varshney","Lav R. Varshney, Julius Kusuma, and Vivek K Goyal","Malleable Coding with Fixed Reuse",,,,,"cs.IT math.IT","http://arxiv.org/licenses/nonexclusive-distrib/1.0/","  In cloud computing, storage area networks, remote backup storage, and similar
settings, stored data is modified with updates from new versions. Representing
information and modifying the representation are both expensive. Therefore it
is desirable for the data to not only be compressed but to also be easily
modified during updates. A malleable coding scheme considers both compression
efficiency and ease of alteration, promoting codeword reuse. We examine the
trade-off between compression efficiency and malleability cost-the difficulty
of synchronizing compressed versions-measured as the length of a reused prefix
portion. Through a coding theorem, the region of achievable rates and
malleability is expressed as a single-letter optimization. Relationships to
common information problems are also described.
","[{""version"":""v1"",""created"":""Thu, 4 Sep 2008 02:41:25 GMT""},{""version"":""v2"",""created"":""Mon, 9 May 2011 21:55:40 GMT""}]","2011-05-11"
"0809.0738","Leonid Ksenofontov","E.G.Berezhko (Yu.G. Shafer Institute of Cosmophysical Research and
  Aeronomy, Yakutsk, Russia)","Cosmic Ray Acceleration by Supernova Shocks","30 pages, 8 figures, Solicited talk at 36th COSPAR Scientific
  Assembly; Beijing, China","Adv.SpaceRes.41:429-441,2008","10.1016/j.asr.2007.04.034",,"astro-ph","http://arxiv.org/licenses/nonexclusive-distrib/1.0/","  We analyse the results of recent measurements of nonthermal emission from
individual supernova remnants (SNRs) and their correspondence to the nonlinear
kinetic theory of cosmic ray (CR) acceleration in SNRs. It is shown that the
theory fits these data in a satisfactory way and provides the strong evidences
for the efficient CR production in SNRs accompanied by significant magnetic
field amplification. Magnetic field amplification leads to considerable
increase of CR maximum energy so that the spectrum of CRs accelerated in SNRs
is consistent with the requirements for the formation of Galactic CR spectrum
up to the energy ~10^17 eV.
","[{""version"":""v1"",""created"":""Thu, 4 Sep 2008 02:43:12 GMT""}]","2008-11-26"
"0809.0739","Gordan Zitkovic","Gordan \v{Z}itkovi\'c","A dual characterization of self-generation and exponential forward
  performances","Published in at http://dx.doi.org/10.1214/09-AAP607 the Annals of
  Applied Probability (http://www.imstat.org/aap/) by the Institute of
  Mathematical Statistics (http://www.imstat.org)","Annals of Applied Probability 2009, Vol. 19, No. 6, 2176-2210","10.1214/09-AAP607","IMS-AAP-AAP607","q-fin.CP math.PR q-fin.PM","http://arxiv.org/licenses/nonexclusive-distrib/1.0/","  We propose a mathematical framework for the study of a family of random
fields--called forward performances--which arise as numerical representation of
certain rational preference relations in mathematical finance. Their spatial
structure corresponds to that of utility functions, while the temporal one
reflects a Nisio-type semigroup property, referred to as self-generation. In
the setting of semimartingale financial markets, we provide a dual formulation
of self-generation in addition to the original one, and show equivalence
between the two, thus giving a dual characterization of forward performances.
Then we focus on random fields with an exponential structure and provide
necessary and sufficient conditions for self-generation in that case. Finally,
we illustrate our methods in financial markets driven by It\^o-processes, where
we obtain an explicit parametrization of all exponential forward performances.
","[{""version"":""v1"",""created"":""Thu, 4 Sep 2008 02:48:27 GMT""},{""version"":""v2"",""created"":""Sat, 15 Nov 2008 23:45:14 GMT""},{""version"":""v3"",""created"":""Mon, 23 Nov 2009 16:46:05 GMT""},{""version"":""v4"",""created"":""Thu, 10 Dec 2009 08:02:19 GMT""}]","2009-12-10"
"0809.0740","Peter Nickolas","Peter Nickolas and Reinhard Wolf","Distance Geometry in Quasihypermetric Spaces. I","To appear in the Bulletin of the Australian Mathematical Society; 25
  pages. References [27] and [28] are arXiv:0809.0744v1 [math.MG] and
  arXiv:0809.0746v1 [math.MG]",,,,"math.MG","http://arxiv.org/licenses/nonexclusive-distrib/1.0/","  Let $(X, d)$ be a compact metric space and let $\mathcal{M}(X)$ denote the
space of all finite signed Borel measures on $X$. Define $I \colon
\mathcal{M}(X) \to \R$ by \[I(\mu) = \int_X \int_X d(x,y) d\mu(x) d\mu(y),\]
and set $M(X) = \sup I(\mu)$, where $\mu$ ranges over the collection of signed
measures in $\mathcal{M}(X)$ of total mass 1.
  The metric space $(X, d)$ is quasihypermetric if for all $n \in \N$, all
$\alpha_1, ..., \alpha_n \in \R$ satisfying $\sum_{i=1}^n \alpha_i = 0$ and all
$x_1, ..., x_n \in X$, one has $\sum_{i,j=1}^n \alpha_i \alpha_j d(x_i, x_j)
\leq 0$. Without the quasihypermetric property $M(X)$ is infinite, while with
the property a natural semi-inner product structure becomes available on
$\mathcal{M}_0(X)$, the subspace of $\mathcal{M}(X)$ of all measures of total
mass 0. This paper explores: operators and functionals which provide natural
links between the metric structure of $(X, d)$, the semi-inner product space
structure of $\mathcal{M}_0(X)$ and the Banach space $C(X)$ of continuous
real-valued functions on $X$; conditions equivalent to the quasihypermetric
property; the topological properties of $\mathcal{M}_0(X)$ with the topology
induced by the semi-inner product, and especially the relation of this topology
to the weak-$*$ topology and the measure-norm topology on $\mathcal{M}_0(X)$;
and the functional-analytic properties of $\mathcal{M}_0(X)$ as a semi-inner
product space, including the question of its completeness. A later paper [Peter
Nickolas and Reinhard Wolf, Distance Geometry in Quasihypermetric Spaces. II]
will apply the work of this paper to a detailed analysis of the constant
$M(X)$.
","[{""version"":""v1"",""created"":""Thu, 4 Sep 2008 04:54:24 GMT""}]","2008-09-05"
"0809.0741","William Y. C. Chen","William Y. C. Chen, Robert L. Tang and Alina F. Y. Zhao","Derangement Polynomials and Excedances of Type B","18 pages",,,,"math.CO","http://arxiv.org/licenses/nonexclusive-distrib/1.0/","  Adopting the definition of excedances of type B due to Brenti, we give a type
B analogue of the q-derangement polynomials. The connection between
q-derangement polynomials and Eulerian polynomials naturally extends to the
type B case. Based on this relation, we derive some basic properties of the
q-derangement polynomials of type B, including the generating function formula,
the Sturm sequence property, and the asymptotic normal distribution. We also
show that the q-derangement polynomials are almost symmetric in the sense that
the coefficients possess the spiral property.
","[{""version"":""v1"",""created"":""Thu, 4 Sep 2008 03:42:39 GMT""}]","2008-09-05"
"0809.0742","Vladimir Pomerantsev","V.P. Popov and V.N. Pomerantsev","Long-lived $2s$ state of muonic hydrogen: population and lifetime","5 pages, 5 figures",,,,"nucl-th","http://arxiv.org/licenses/nonexclusive-distrib/1.0/","  Ab initio study of the density-dependent population and lifetime of the
long-lived $(\mu p)_{2s}$ and the yield of $(\mu p)_{1s}$ atoms with kinetic
energy 0.9 keV have been performed for the first time. The direct Coulomb
$2s\to 1s$ deexcitation is proved to be the dominant quenching mechanism of the
$2s$ state at kinetic energy below $2p$ threshold and explain the lifetime of
the metastable $2s$ state and high-energy 0.9 keV component of $(\mu p)_{1S}$
observed at low densities. The cross sections of the elastic, Stark and Coulomb
deexcitation processes have been calculated in the close-coupling approach
taking into account for the first time both the closed channels and the
threshold effects due to vacuum polarization shifts of the $ns$ states. The
cross sections are used as the input data in the detailed study of the atomic
cascade kinetics. The theoretical predictions are compared with the known
experimental data at low densities. The 40% yield of the 0.9 keV$(\mu p)_{1s}$
atoms is predicted for liquid hydrogen density.
","[{""version"":""v1"",""created"":""Thu, 4 Sep 2008 03:55:11 GMT""}]","2008-09-05"
"0809.0743","Dongho Chae","Dongho Chae","Liouville type of theorems for the Euler and the Navier-Stokes equations","15 pages",,,,"math.AP","http://arxiv.org/licenses/nonexclusive-distrib/1.0/","  We prove Liouville type of theorems for weak solutions of the Navier-Stokes
and the Euler equations. In particular, if the pressure satisfies $ p\in L^1
(0,T; L^1 (\Bbb R^N))$ with $\int_{\Bbb R^N} p(x,t)dx \geq 0$, then the
corresponding velocity should be trivial, namely $v=0$ on $\Bbb R^N \times
(0,T)$. In particular, this is the case when $p\in L^1 (0,T; \mathcal{H}^1
(\Bbb R^N))$, where $\mathcal{H}^1 (\Bbb R^N)$ the Hardy space. On the other
hand, we have equipartition of energy over each component, if $p\in L^1 (0,T;
L^1 (\Bbb R^N))$ with $\int_{\Bbb R^N} p(x,t)dx <0$. Similar results hold also
for the magnetohydrodynamic equations.
","[{""version"":""v1"",""created"":""Thu, 4 Sep 2008 03:59:19 GMT""},{""version"":""v2"",""created"":""Thu, 4 Sep 2008 21:14:45 GMT""},{""version"":""v3"",""created"":""Mon, 15 Sep 2008 06:09:22 GMT""},{""version"":""v4"",""created"":""Wed, 17 Sep 2008 11:05:23 GMT""},{""version"":""v5"",""created"":""Tue, 23 Sep 2008 05:28:12 GMT""},{""version"":""v6"",""created"":""Thu, 25 Sep 2008 12:39:12 GMT""}]","2008-09-25"
"0809.0744","Peter Nickolas","Peter Nickolas and Reinhard Wolf","Distance Geometry in Quasihypermetric Spaces. II","15 pages. References [8] and [9] are arXiv:0809.0740v1 [math.MG] and
  arXiv:0809.0746v1 [math.MG]",,,,"math.MG","http://arxiv.org/licenses/nonexclusive-distrib/1.0/","  Let $(X, d)$ be a compact metric space and let $\mathcal{M}(X)$ denote the
space of all finite signed Borel measures on $X$. Define $I \colon
\mathcal{M}(X) \to \R$ by \[ I(\mu) = \int_X \int_X d(x,y) d\mu(x) d\mu(y), \]
and set $M(X) = \sup I(\mu)$, where $\mu$ ranges over the collection of signed
measures in $\mathcal{M}(X)$ of total mass 1. This paper, with an earlier and a
subsequent paper [Peter Nickolas and Reinhard Wolf, Distance geometry in
quasihypermetric spaces. I and III], investigates the geometric constant $M(X)$
and its relationship to the metric properties of $X$ and the
functional-analytic properties of a certain subspace of $\mathcal{M}(X)$ when
equipped with a natural semi-inner product. Using the work of the earlier
paper, this paper explores measures which attain the supremum defining $M(X)$,
sequences of measures which approximate the supremum when the supremum is not
attained and conditions implying or equivalent to the finiteness of $M(X)$.
","[{""version"":""v1"",""created"":""Thu, 4 Sep 2008 04:57:03 GMT""}]","2008-09-05"
"0809.0745","Rayan Saab","Rayan Saab, Ozgur Yilmaz","Sparse Recovery by Non-convex Optimization -- Instance Optimality","32 pages, 4 figures v2",,,,"cs.IT math.IT","http://arxiv.org/licenses/nonexclusive-distrib/1.0/","  In this note, we address the theoretical properties of $\Delta_p$, a class of
compressed sensing decoders that rely on $\ell^p$ minimization with 0<p<1 to
recover estimates of sparse and compressible signals from incomplete and
inaccurate measurements. In particular, we extend the results of Candes,
Romberg and Tao, and Wojtaszczyk regarding the decoder $\Delta_1$, based on
$\ell^1$ minimization, to $\Delta_p$ with 0<p<1. Our results are two-fold.
First, we show that under certain sufficient conditions that are weaker than
the analogous sufficient conditions for $\Delta_1$ the decoders $\Delta_p$ are
robust to noise and stable in the sense that they are (2,p) instance optimal
for a large class of encoders. Second, we extend the results of Wojtaszczyk to
show that, like $\Delta_1$, the decoders $\Delta_p$ are (2,2) instance optimal
in probability provided the measurement matrix is drawn from an appropriate
distribution.
","[{""version"":""v1"",""created"":""Thu, 4 Sep 2008 04:24:32 GMT""},{""version"":""v2"",""created"":""Mon, 10 Aug 2009 11:21:36 GMT""}]","2009-08-10"
"0809.0746","Peter Nickolas","Peter Nickolas and Reinhard Wolf","Distance Geometry in Quasihypermetric Spaces. III","20 pages. References [10] and [11] are arXiv:0809.0740v1 [math.MG]
  and arXiv:0809.0744v1 [math.MG]",,,,"math.MG","http://arxiv.org/licenses/nonexclusive-distrib/1.0/","  Let $(X, d)$ be a compact metric space and let $\mathcal{M}(X)$ denote the
space of all finite signed Borel measures on $X$. Define $I \colon
\mathcal{M}(X) \to \R$ by \[ I(\mu) = \int_X \int_X d(x,y) d\mu(x) d\mu(y), \]
and set $M(X) = \sup I(\mu)$, where $\mu$ ranges over the collection of signed
measures in $\mathcal{M}(X)$ of total mass 1. This paper, with two earlier
papers [Peter Nickolas and Reinhard Wolf, Distance geometry in quasihypermetric
spaces. I and II], investigates the geometric constant $M(X)$ and its
relationship to the metric properties of $X$ and the functional-analytic
properties of a certain subspace of $\mathcal{M}(X)$ when equipped with a
natural semi-inner product. Specifically, this paper explores links between the
properties of $M(X)$ and metric embeddings of $X$, and the properties of $M(X)$
when $X$ is a finite metric space.
","[{""version"":""v1"",""created"":""Thu, 4 Sep 2008 04:59:19 GMT""}]","2008-09-05"
