"0809.0690","Peter Mucha","Amanda L. Traud, Eric D. Kelsic, Peter J. Mucha, and Mason A. Porter","Comparing Community Structure to Characteristics in Online Collegiate
  Social Networks","Version 3 (17 pages, 5 multi-part figures), accepted in SIAM Review","SIAM Review 53, 526-543 (2011)","10.1137/080734315",,"physics.soc-ph physics.data-an","http://arxiv.org/licenses/nonexclusive-distrib/1.0/","  We study the structure of social networks of students by examining the graphs
of Facebook ""friendships"" at five American universities at a single point in
time. We investigate each single-institution network's community structure and
employ graphical and quantitative tools, including standardized pair-counting
methods, to measure the correlations between the network communities and a set
of self-identified user characteristics (residence, class year, major, and high
school). We review the basic properties and statistics of the pair-counting
indices employed and recall, in simplified notation, a useful analytical
formula for the z-score of the Rand coefficient. Our study illustrates how to
examine different instances of social networks constructed in similar
environments, emphasizes the array of social forces that combine to form
""communities,"" and leads to comparative observations about online social lives
that can be used to infer comparisons about offline social structures. In our
illustration of this methodology, we calculate the relative contributions of
different characteristics to the community structure of individual universities
and subsequently compare these relative contributions at different
universities, measuring for example the importance of common high school
affiliation to large state universities and the varying degrees of influence
common major can have on the social structure at different universities. The
heterogeneity of communities that we observe indicates that these networks
typically have multiple organizing factors rather than a single dominant one.
","[{""version"":""v1"",""created"":""Wed, 3 Sep 2008 19:44:15 GMT""},{""version"":""v2"",""created"":""Wed, 23 Sep 2009 23:58:12 GMT""},{""version"":""v3"",""created"":""Mon, 18 Oct 2010 23:27:14 GMT""}]","2012-03-21"
"0809.0691","Aslak Bakke Buan","Aslak Bakke Buan, Hugh Thomas","Coloured quiver mutation for higher cluster categories","25 pages, added new section",,,,"math.RT math.CO","http://arxiv.org/licenses/nonexclusive-distrib/1.0/","  We define mutation on coloured quivers associated to tilting objects in
higher cluster categories. We show that this operation is compatible with the
mutation operation on the tilting objects. This gives a combinatorial approach
to tilting in higher cluster categories and especially an algorithm to
determine the Gabriel quivers of tilting objects in such categories.
","[{""version"":""v1"",""created"":""Wed, 3 Sep 2008 19:51:31 GMT""},{""version"":""v2"",""created"":""Wed, 3 Sep 2008 20:01:35 GMT""},{""version"":""v3"",""created"":""Sat, 20 Sep 2008 12:20:34 GMT""}]","2008-09-20"
"0809.0692","Krzysztof Stanek","Krzysztof Zbigniew Stanek","How long should an astronomical paper be to increase its Impact?","11 pages, 5 figures",,,,"astro-ph cs.DL physics.soc-ph","http://arxiv.org/licenses/nonexclusive-distrib/1.0/","  Naively, one would expect longer papers to have larger impact (i.e., to be
cited more). I tested this expectation by selecting all (~30,000) refereed
papers from A&A, AJ, ApJ and MNRAS published between 2000 and 2004. These
particular years were chosen so papers analyzed would not be too ""fresh"", but
at the same time length of each article could be obtained via ADS. I find that
indeed longer papers published in these four major astronomy journals are on
average cited more, with a median number of citations increasing from 6 for
articles 2-3 pages long to about 50 for articles ~50 pages long. I do however
observe a significant ""Letters effect"", i.e. ApJ and A&A articles 4 pages long
are cited more than articles 5-10 pages long. Also, the very few longest (>80
pages) papers are actually cited less than somewhat shorter papers. For
individual journals, median citations per paper increase from 11 for ~9,300 A&A
papers to 14 for ~5,300 MNRAS papers, 16 for ~2,550 AJ papers, and 20 for
~12,850 ApJ papers (including ApJ Letters and Supplement). I conclude with some
semi-humorous career advice, directed especially at first-year graduate
students.
","[{""version"":""v1"",""created"":""Wed, 3 Sep 2008 20:00:03 GMT""}]","2008-09-05"
"0809.0693","Yvonne Wong","Yvonne Y. Y. Wong","Higher order corrections to the large scale matter power spectrum in the
  presence of massive neutrinos","22 pages, 5 figures, uses iopart.cls; v2: 23 pages, added references,
  to appear in JCAP","JCAP 0810:035,2008","10.1088/1475-7516/2008/10/035","MPP-2008-111","astro-ph","http://arxiv.org/licenses/nonexclusive-distrib/1.0/","  We present the first systematic derivation of the one-loop correction to the
large scale matter power spectrum in a mixed cold+hot dark matter cosmology
with subdominant massive neutrino hot dark matter. Starting with the equations
of motion for the density and velocity fields, we derive perturbative solutions
to these quantities and construct recursion relations for the interaction
kernels, noting and justifying all approximations along the way. We find
interaction kernels similar to those for a cold dark matter-only universe, but
with additional dependences on the neutrino energy density fraction f_nu and
the linear growth functions of the incoming wavevectors. Compared with the
f_nu=0 case, the one-loop corrected matter power spectrum for a mixed dark
matter cosmology exhibits a decrease in small scale power exceeding the
canonical ~8 f_nu suppression predicted by linear theory, a feature also seen
in multi-component N-body simulations.
","[{""version"":""v1"",""created"":""Thu, 4 Sep 2008 13:26:55 GMT""},{""version"":""v2"",""created"":""Mon, 6 Oct 2008 22:39:26 GMT""}]","2009-11-19"
"0809.0694","Subir Sachdev","Yang Qi, Cenke Xu, and Subir Sachdev","Dynamics and transport of the Z_2 spin liquid: application to
  kappa-(ET)2Cu2(CN)3","4 pages, 2 figures; (v2) added refs and minor changes; (v3) updated
  ref on experiment; (v4) added supplement with calculational details","Phys. Rev. Lett. 102, 176401 (2009)","10.1103/PhysRevLett.102.176401",,"cond-mat.str-el","http://arxiv.org/licenses/nonexclusive-distrib/1.0/","  We describe neutron scattering, NMR relaxation, and thermal transport
properties of Z_2 spin liquids in two dimensions. Comparison to recent
experiments on the spin S=1/2 triangular lattice antiferromagnet in
kappa-(ET)2Cu2(CN)3 shows that this compound may realize a Z_2 spin liquid. We
argue that the topological `vison' excitations dominate thermal transport, and
that recent thermal conductivity experiments by M. Yamashita et al. have
observed the vison gap.
","[{""version"":""v1"",""created"":""Wed, 3 Sep 2008 20:00:52 GMT""},{""version"":""v2"",""created"":""Sat, 6 Sep 2008 15:14:42 GMT""},{""version"":""v3"",""created"":""Thu, 27 Nov 2008 14:30:31 GMT""},{""version"":""v4"",""created"":""Sat, 4 Apr 2009 14:22:57 GMT""}]","2009-04-30"
"0809.0695","Christian D. Ott","Christian D. Ott (TAPIR, Caltech)","The Gravitational Wave Signature of Core-Collapse Supernovae","Topical Review, accepted for publication in CQG. 51 pages, 13
  figures, a version of the article with high-resolution figures is available
  from http://stellarcollapse.org/papers/Ott_SN_GW_review2008.pdf. Update:
  Added section on core collapse simulations and the treatment of general
  relativity","Class.Quant.Grav.26:063001,2009","10.1088/0264-9381/26/6/063001",,"astro-ph gr-qc","http://arxiv.org/licenses/nonexclusive-distrib/1.0/","  We review the ensemble of anticipated gravitational-wave (GW) emission
processes in stellar core collapse and postbounce core-collapse supernova
evolution. We discuss recent progress in the modeling of these processes and
summarize most recent GW signal estimates. In addition, we present new results
on the GW emission from postbounce convective overturn and protoneutron star
g-mode pulsations based on axisymmetric radiation-hydrodynamic calculations.
Galactic core-collapse supernovae are very rare events, but within 3-5 Mpc from
Earth, the rate jumps to 1 in ~2 years. Using the set of currently available
theoretical gravitational waveforms, we compute upper-limit optimal
signal-to-noise ratios based on current and advanced LIGO/GEO600/VIRGO noise
curves for the recent SN 2008bk which exploded at ~3.9 Mpc. While initial LIGOs
cannot detect GWs emitted by core-collapse events at such a distance, we find
that advanced LIGO-class detectors could put significant upper limits on the GW
emission strength for such events. We study the potential occurrence of the
various GW emission processes in particular supernova explosion scenarios and
argue that the GW signatures of neutrino-driven, magneto-rotational, and
acoustically-driven core-collapse SNe may be mutually exclusive. We suggest
that even initial LIGOs could distinguish these explosion mechanisms based on
the detection (or non-detection) of GWs from a galactic core-collapse
supernova.
","[{""version"":""v1"",""created"":""Wed, 3 Sep 2008 20:12:26 GMT""},{""version"":""v2"",""created"":""Sun, 11 Jan 2009 21:53:18 GMT""}]","2009-11-19"
"0809.0696","Nina Nowak","N. Nowak (1,2), R. P. Saglia (1,2), J. Thomas (1,2), R. Bender (1,2),
  R. I. Davies (1), K. Gebhardt (3) ((1) MPE Garching, (2) USM Munich, (3) UT
  Austin)","The supermassive black hole of Fornax A","24 pages, 24 figures, submitted to MNRAS",,"10.1111/j.1365-2966.2008.13960.x",,"astro-ph","http://arxiv.org/licenses/nonexclusive-distrib/1.0/","  The radio galaxy Fornax A (NGC 1316) is a prominent merger remnant in the
outskirts of the Fornax cluster. Its giant radio lobes suggest the presence of
a powerful AGN and thus a central supermassive black hole (SMBH). We present
high-resolution adaptive optics assisted integral-field data of Fornax A, taken
with SINFONI at the Very Large Telescope in the K band. We use axisymmetric
orbit models to determine the mass of the SMBH in the centre of Fornax A. The
three-dimensional nature of our data provides the possibility to directly test
the consistency of the data with axisymmetry by modelling each of the four
quadrants separately. According to our dynamical models, consistent SMBH masses
and dynamical Ks band mass-to-light ratios are obtained for all quadrants, with
<M_BH>=1.3x10^8 M_\odot (rms(M_BH)=0.4x10^8 Msun) and <M/L>=0.68
(rms(M/L)=0.03), confirming the assumption of axisymmetry. For the folded and
averaged data we find M_BH=(1.5+0.75-0.8)x10^8 Msun and M/L=(0.65+0.075-0.05)
(3-sigma errors). Thus the black-hole mass of Fornax A is consistent within the
error with the Tremaine (2002) M-sigma relation, but is a factor ~4 smaller
than expected from its bulge mass and the Marconi&Hunt (2003) relation.
","[{""version"":""v1"",""created"":""Wed, 3 Sep 2008 22:11:26 GMT""}]","2009-11-13"
"0809.0697","Scott S. Sheppard","Scott S. Sheppard (Carnegie Inst. of Wash.) and Michael C. Cushing
  (Univ. of Hawaii)","An Infrared High Proper Motion Survey Using 2MASS and SDSS: Discovery of
  M, L and T Dwarfs","14 pages, 7 tables, 9 figures: Accepted for the January 2009 AJ issue",,"10.1088/0004-6256/137/1/304",,"astro-ph","http://arxiv.org/licenses/nonexclusive-distrib/1.0/","  A search of the Two Micron All Sky Survey and Sloan Digital Sky
  Survey reveals 36 previously unknown high proper motion objects with
  J<17. Their red-optical colors indicate that 27 are M dwarfs, 8 are
early-type L dwarfs, and 1 is a late-type T dwarf. The L dwarfs have J-Ks
colors near the extrema of known L dwarfs indicating that previous surveys for
L dwarfs using color as a selection criterion may be biased. Followup
near-infrared spectroscopy of 6 dwarfs confirm they are all late-type with
spectral types ranging from M8 to T4. Spectroscopy also shows that some of the
L dwarf spectra exhibit peculiar features similar to other peculiar ""blue"" L
dwarfs which may indicate that these dwarfs have a relatively condensate free
atmosphere or may be metal poor. Photometric distance estimates indicate that
22 of the new M, L and T dwarfs lie within 100 pc of the Sun with the newly
discovered T dwarf, 2MASS J10595185+3042059, located at about 25 pc. Based on
the colors and proper motions of the newly identified objects, several appear
to be good subdwarf candidates. The proper motions of known ultracool dwarfs
detected in our survey were also measured, including, for the first time, SDSS
J085834.42+325627.6 (T1), SDSS J125011.65+392553.9 (T4) and 2MASS
J15261405+2043414 (L7).
","[{""version"":""v1"",""created"":""Wed, 3 Sep 2008 21:53:51 GMT""},{""version"":""v2"",""created"":""Fri, 17 Oct 2008 07:53:31 GMT""}]","2009-11-13"
"0809.0698","Philip Humphrey","Philip J Humphrey (UC Irvine)","Low-Mass X-ray Binaries and Globular Clusters in Early-Type Galaxies.
  II. Globular Cluster Candidates and their Mass-Metallicity Relation","15 pages, 7 figures. Accepted for publication in The Astrophysical
  Journal","Astrophys.J.690:512-525,2009","10.1088/0004-637X/690/1/512",,"astro-ph","http://arxiv.org/licenses/nonexclusive-distrib/1.0/","  We present an astrometry and photometry catalogue of globular cluster (GC)
candidates detected with HST WFPC2 in a sample of 19 early-type galaxies,
appropriate for comparison to the low-mass X-ray binary (LMXB) populations
observed with Chandra. In a companion paper, we present the Chandra data and
investigate the relation between these populations. We demonstrate that,
although there is little evidence of a colour-magnitude correlation for the
GCs, after estimating mass and metallicity from the photometry, under the
assumption of a single age simple stellar population, there is a significant
positive correlation between mass and metallicity. We constrained [Z/H] =
(-2.1+/-0.2)+(0.25+/-0.04)log M, with a 1-sigma intrinsic scatter of 0.62 dex
in metallicity. If GCs are bimodal in metallicity this relation is consistent
with recent suggestions of a mass-metallicity relation only for metal-poor
clusters. Adopting a new technique to fit the GC luminosity function (GCLF)
accounting for incompleteness and the Eddington bias, we compute the V-band
local GC specific frequency (Sn) and specific luminosity (Sl) of each galaxy.
We show that Sl is the more robust measure of the richness of a GC population
where a significant fraction is undetected due to source detection
incompleteness. We find that the absolute magnitude of the GCLF turnover
exhibits intrinsic scatter from galaxy to galaxy of ~0.3mag (1-sigma), limiting
its accuracy as a standard distance measure.
","[{""version"":""v1"",""created"":""Wed, 3 Sep 2008 20:02:29 GMT""}]","2008-12-18"
"0809.0699","Siu-Hung Ng","Michael Hilgemann and Siu-Hung Ng","Hopf algebras of dimension 2p^2","16pp Latex; Corrected typos and added references; Made a correction
  to the proof of Lemma 2.2 in the version (V1)","Journal of the London Mathematical Society 2009 80(2):295-310","10.1112/jlms/jdp026",,"math.QA math.RA math.RT","http://arxiv.org/licenses/nonexclusive-distrib/1.0/","  Let H be a non-semisimple Hopf algebra of dimension 2p^2 over an
algebraically closed field of characteristic zero, where p is an odd prime. We
prove that H or H^* is pointed, which completes the classification for Hopf
algebras of these dimensions.
","[{""version"":""v1"",""created"":""Wed, 3 Sep 2008 20:03:10 GMT""},{""version"":""v2"",""created"":""Mon, 15 Sep 2008 18:56:18 GMT""}]","2009-11-06"
"0809.0700","Andreas Koch","A. Koch, M.I. Wilkinson, J.T. Kleyna, M. Irwin, D.B. Zucker, V.
  Belokurov, G.F. Gilmore, M. Fellhauer, N.W. Evans","A spectroscopic confirmation of the Bootes II dwarf spheroidal","10 pages, 8 figures, accepted for publication in the Astrophysical
  Journal","Astrophys.J.690:453-462,2009","10.1088/0004-637X/690/1/453",,"astro-ph","http://arxiv.org/licenses/nonexclusive-distrib/1.0/","  We present a new suite of photometric and spectroscopic data for the faint
Bootes II dwarf spheroidal galaxy candidate. Our deep photometry, obtained with
the INT/WFC, suggests a distance of 46 kpc and a small half-light radius of 4.0
arcmin (56 pc), consistent with previous estimates. Follow-up spectroscopy
obtained with the Gemini/GMOS instrument yielded radial velocities and
metallicities. While the majority of our targets covers a broad range in
velocities and metallicities, we find five stars which share very similar
velocities and metallicities and which are all compatible with the colors and
magnitudes of the galaxy's likely red giant branch. We interpret these as a
spectroscopic detection of the Bootes II system. These stars have a mean
velocity of -117 km/s, a velocity dispersion of (10.5+-7.4) km/s and a mean
[Fe/H] of -1.79 dex, with a dispersion of 0.14 dex. At this metallicity, Boo II
is not consistent with the stellar-mass-metallicity relation for the more
luminous dwarf galaxies. Coupled with our distance estimate, its high negative
systemic velocity rules out any physical connection with its projected
neighbor, the Bootes I dwarf spheroidal, which has a velocity of ~+100 km/s.
The velocity and distance of Bootes II coincide with those of the leading arm
of Sagittarius, which passes through this region of the sky, so that it is
possible that Bootes II may be a stellar system associated with the Sagittarius
stream. Finally, we note that the properties of Bootes II are consistent with
being the surviving remnant of a previously larger and more luminous dSph
galaxy.
","[{""version"":""v1"",""created"":""Wed, 3 Sep 2008 20:05:32 GMT""}]","2008-12-18"
"0809.0701","Xavier Siemens","Melissa Anholm, Stefan Ballmer, Jolien D. E. Creighton, Larry R.
  Price, and Xavier Siemens","Optimal strategies for gravitational wave stochastic background searches
  in pulsar timing data","20 pages, 6 figures. Added figure with sky sensitivity for Parkes
  Pulsar Timing Array, included dipole overlap reduction function and
  derivation in appendix, extended likelihood discussion",,"10.1103/PhysRevD.79.084030",,"gr-qc astro-ph","http://arxiv.org/licenses/nonexclusive-distrib/1.0/","  A low frequency stochastic background of gravitational waves may be detected
by pulsar timing experiments in the next five to ten years. Using methods
developed to analyze interferometric gravitational wave data, in this paper we
lay out the optimal techniques to detect a background of gravitational waves
using a pulsar timing array. We show that for pulsar distances and
gravitational wave frequencies typical of pulsar timing experiments, neglecting
the effect of the metric perturbation at the pulsar does not result in a
significant deviation from optimality. We discuss methods for setting upper
limits using the optimal statistic, show how to construct skymaps using the
pulsar timing array, and consider several issues associated with realistic
analysis of pulsar timing data.
","[{""version"":""v1"",""created"":""Wed, 3 Sep 2008 20:12:48 GMT""},{""version"":""v2"",""created"":""Tue, 16 Dec 2008 23:31:23 GMT""}]","2015-05-13"
"0809.0702","Zhora Nikoghosyan","Zh.G. Nikoghosyan","Long cycles in graphs through fragments","32 pages",,,,"math.CO","http://arxiv.org/licenses/nonexclusive-distrib/1.0/","  Four basic Dirac-type sufficient conditions for a graph $G$ to be hamiltonian
are known involving order $n$, minimum degree $\delta$, connectivity $\kappa$
and independence number $\alpha$ of $G$: (1) $\delta \geq n/2$ (Dirac); (2)
$\kappa \geq 2$ and $\delta \geq (n+\kappa)/3$ (by the author); (3) $\kappa
\geq 2$ and $\delta \geq \max\lbrace (n+2)/3,\alpha \rbrace$ (Nash-Williams);
(4) $\kappa \geq 3$ and $\delta \geq \max\lbrace (n+2\kappa)/4,\alpha \rbrace$
(by the author). In this paper we prove the reverse version of (4) concerning
the circumference $c$ of $G$ and completing the list of reverse versions of
(1)-(4): (R1) if $\kappa \geq 2$, then $c\geq\min\lbrace n,2\delta\rbrace$
(Dirac); (R2) if $\kappa \geq 3$, then $c\geq\min\lbrace n,3\delta
-\kappa\rbrace$ (by the author); (R3) if $\kappa\geq 3$ and $\delta\geq
\alpha$, then $c\geq\min\lbrace n,3\delta-3\rbrace$ (Voss and Zuluaga); (R4) if
$\kappa\geq 4$ and $\delta\geq \alpha$, then $c\geq\min\lbrace
n,4\delta-2\kappa\rbrace$. To prove (R4), we present four more general results
centered around a lower bound $c\geq 4\delta-2\kappa$ under four alternative
conditions in terms of fragments. A subset $X$ of $V(G)$ is called a fragment
of $G$ if $N(X)$ is a minimum cut-set and $V(G)-(X\cup N(X))\neq\emptyset$.
","[{""version"":""v1"",""created"":""Wed, 3 Sep 2008 20:16:46 GMT""}]","2008-09-05"
"0809.0704","Winder Alexander Moura-Melo","J.M. Fonseca, A.H. Gomes, and W.A.Moura-Melo","Emission and absorption of photons and the black-body spectra in
  Lorentz-odd Electrodynamics","11 pages, Latex","Phys.Lett.B671:280-283,2009","10.1016/j.physletb.2008.12.029",,"hep-th","http://arxiv.org/licenses/nonexclusive-distrib/1.0/","  We study a number of issues related to the emission and absorption radiation
by non-relativistic electrons within the framework of a Lorentz-breaking
electrodynamics in (3+1) dimensions. Our main results concern how Planck-like
spectrum law is sensitive to terms that violate Lorentz symmetry. We have
realized that Planck law acquires extra terms proportional to the violating
parameters: for the CPT-odd model, the leading extra terms appear to be linear
or quadratic in these violating parameters according to the background vector
is parallel or perpendicular to the photon wave-vector. In the CPT-even case a
linear `correction' shows up. Among other possible ways to probe for these
violations, by means of the present results, we may quote the direct
observation of the extra contributions or an unbalancing in the mean occupation
number of photon modes in a given thermal bath.
","[{""version"":""v1"",""created"":""Wed, 3 Sep 2008 20:33:55 GMT""}]","2009-01-14"
"0809.0705","Jae-hyeon Park","P. Ko and Jae-hyeon Park","Implications of the measurements of B_s - B_s bar mixing on SUSY models","29 pages","Phys.Rev.D80:035019,2009","10.1103/PhysRevD.80.035019",,"hep-ph","http://arxiv.org/licenses/nonexclusive-distrib/1.0/","  We derive constraints on the mass insertion parameters from the recent
measurements of B_s - B_s bar mixing, and discuss their implications on SUSY
breaking mediation mechanisms and SUSY flavor models. Some SUSY flavor models
are already excluded or disfavored by B_s - B_s bar mixing. We also discuss how
to test the SM and SUSY models in the future experiments, by studying other CP
violating observables related to b -> s transition, such as the time-dependent
CP asymmetry in B -> phi K_S and the direct CP asymmetry in B -> X_s gamma.
","[{""version"":""v1"",""created"":""Wed, 3 Sep 2008 20:39:43 GMT""}]","2009-09-01"
"0809.0706","Barry Bradlyn","Barry Bradlyn, Francisco Ednilson A. dos Santos, Axel Pelster","Effective Action Approach for Quantum Phase Transitions in Bosonic
  Lattices",,"Phys. Rev. A 79, 013615 (2009)","10.1103/PhysRevA.79.013615",,"cond-mat.stat-mech","http://arxiv.org/licenses/nonexclusive-distrib/1.0/","  Based on standard field-theoretic considerations, we develop an effective
action approach for investigating quantum phase transitions in lattice Bose
systems at arbitrary temperature. We begin by adding to the Hamiltonian of
interest a symmetry breaking source term. Using time-dependent perturbation
theory, we then expand the grand-canonical free energy as a double power series
in both the tunneling and the source term. From here, an order parameter field
is introduced in the standard way, and the underlying effective action is
derived via a Legendre transformation. Determining the Ginzburg-Landau
expansion to first order in the tunneling term, expressions for the Mott
insulator-superfluid phase boundary, condensate density, average particle
number, and compressibility are derived and analyzed in detail. Additionally,
excitation spectra in the ordered phase are found by considering both
longitudinal and transverse variations of the order parameter. Finally, these
results are applied to the concrete case of the Bose-Hubbard Hamiltonian on a
three dimensional cubic lattice, and compared with the corresponding results
from mean-field theory. Although both approaches yield the same Mott insulator
- superfluid phase boundary to first order in the tunneling, the predictions of
our effective action theory turn out to be superior to the mean-field results
deeper into the superfluid phase.
","[{""version"":""v1"",""created"":""Thu, 4 Sep 2008 13:33:30 GMT""},{""version"":""v2"",""created"":""Mon, 27 Oct 2008 19:08:22 GMT""},{""version"":""v3"",""created"":""Tue, 20 Jan 2009 20:25:46 GMT""}]","2009-01-20"
"0809.0707","David McNutt","A. Coley, D. McNutt, N. Pelavas","CCNV Space-Times as Potential Supergravity Solutions","14 pages","Advances in Mathematical Physics, 2018:1-7","10.1155/2018/5861481",,"math.DG hep-th math-ph math.MP","http://arxiv.org/licenses/nonexclusive-distrib/1.0/","  It is of interest to study supergravity solutions preserving a non-minimal
fraction of supersymmetries. A necessary condition for supersymmetry to be
preserved is that the spacetime admits a Killing spinor and hence a null or
timelike Killing vector field. Any spacetime admitting a covariantly constant
null vector field ($CCNV$) belongs to the Kundt class of metrics, and more
importantly admits a null Killing vector field. We investigate the existence of
additional non-spacelike isometries in the class of higher-dimensional $CCNV$
Kundt metrics in order to produce potential solutions that preserve some
supersymmetries.
","[{""version"":""v1"",""created"":""Wed, 3 Sep 2008 20:54:18 GMT""},{""version"":""v2"",""created"":""Fri, 20 Apr 2018 11:45:30 GMT""}]","2018-04-23"
