"0809.0783","Marius de Leeuw","M de Leeuw","The Bethe Ansatz for AdS5 x S5 Bound States","typos corrected","JHEP 0901:005,2009","10.1088/1126-6708/2009/01/005","ITP-UU-08/52, SPIN-08/42","hep-th","http://arxiv.org/licenses/nonexclusive-distrib/1.0/","  We reformulate the nested coordinate Bethe ansatz in terms of coproducts of
Yangian symmetry generators. This allows us to derive the nested Bethe
equations for the bound state string S-matrices. We find that they coincide
with the Bethe equations obtained from a fusion procedure. The bound state
number dependence in the Bethe equations appears through the parameters x^{\pm}
and the dressing phase only.
","[{""version"":""v1"",""created"":""Thu, 4 Sep 2008 10:26:19 GMT""},{""version"":""v2"",""created"":""Thu, 22 Jan 2009 09:56:59 GMT""}]","2009-01-22"
"0809.0784","Mancho Manev","Kostadin Gribachev, Mancho Manev, Stancho Dimiev","On hypercomplex pseudo-Hermitian manifolds","12 pages, presented on The Sixth International Workshop on Complex
  Structures and Vector Fields, St Konstantin, Bulgaria, 3-6 September 2002","Trends in Complex Analysis, Differential Geometry and Mathematical
  Physics, World Sci. Publ., Singapore, 2003, 51-62","10.1142/9789812704191_0007",,"math.DG","http://arxiv.org/licenses/nonexclusive-distrib/1.0/","  The class of the hypercomplex pseudo-Hermitian manifolds is considered. The
flatness of the considered manifolds with the 3 parallel complex structures is
proved. Conformal transformations of the metrics are introduced. The conformal
invariance and the conformal equivalence of the basic types manifolds are
studied. A known example is characterized in relation to the obtained results.
","[{""version"":""v1"",""created"":""Thu, 4 Sep 2008 10:43:01 GMT""}]","2012-03-27"
"0809.0785","J.D. Vergados","J. D. Vergados (Physics Department, University of Ioannina, Ioannina,
  Greece and Theory Division, CERN), H. Ejiri (RCNP, Osaka University, Osaka,
  Japan and National Institute of Radiological Sciences, Chiba, Japan), I.
  Giomataris (IRFU, Centre d'etudes de Saclay, Gif sur Yvette CEDEX, France)","Solar Neutrinos as Background in Direct Dark Matter Searches","6 pages, 5 figures, Submitted for the DSU proceedings to be published
  by the American institute of Physics (AIP). References added","AIP Conf.Proc.1115:7-12,2009","10.1063/1.3131532",,"hep-ph","http://arxiv.org/licenses/nonexclusive-distrib/1.0/","  The coherent contribution of all neutrons in neutrino nucleus scattering due
to the neutral current is examined considering the boron solar neutrinos. These
neutrinos could potentially become a source of background in the future dark
matter searches aiming at nucleon cross sections in the region well below the
few events per ton per year.
","[{""version"":""v1"",""created"":""Thu, 4 Sep 2008 11:03:02 GMT""},{""version"":""v2"",""created"":""Mon, 8 Sep 2008 08:12:57 GMT""},{""version"":""v3"",""created"":""Tue, 16 Sep 2008 10:52:35 GMT""}]","2009-05-01"
"0809.0786","Thomas Kahle","Thomas Kahle","Neighborliness of Marginal Polytopes","9 pages","Contributions to Algebra and Geometry 51 (2010), No. 1, 45-56",,,"math.CO math.ST stat.TH","http://arxiv.org/licenses/nonexclusive-distrib/1.0/","  A neighborliness property of marginal polytopes of hierarchical models,
depending on the cardinality of the smallest non-face of the underlying
simplicial complex, is shown. The case of binary variables is studied
explicitly, then the general case is reduced to the binary case. A Markov basis
for binary hierarchical models whose simplicial complexes is the complement of
an interval is given.
","[{""version"":""v1"",""created"":""Thu, 4 Sep 2008 11:12:52 GMT""}]","2016-04-08"
"0809.0787","John Weir","E. B. Davies, John Weir","Convergence of eigenvalues for a highly non-self-adjoint differential
  operator","16 pages",,"10.1112/blms/bdp120",,"math.SP","http://arxiv.org/licenses/nonexclusive-distrib/1.0/","  In this paper we study a family of operators dependent on a small parameter
$\epsilon > 0$, which arise in a problem in fluid mechanics. We show that the
spectra of these operators converge to N as $\epsilon \to 0$, even though, for
fixed $\epsilon > 0$, the eigenvalue asymptotics are quadratic.
","[{""version"":""v1"",""created"":""Thu, 4 Sep 2008 11:09:40 GMT""}]","2014-02-26"
"0809.0788","Hubie Chen","Manuel Bodirsky and Hubie Chen","Peek Arc Consistency",,,,,"cs.AI cs.CC cs.LO","http://arxiv.org/licenses/nonexclusive-distrib/1.0/","  This paper studies peek arc consistency, a reasoning technique that extends
the well-known arc consistency technique for constraint satisfaction. In
contrast to other more costly extensions of arc consistency that have been
studied in the literature, peek arc consistency requires only linear space and
quadratic time and can be parallelized in a straightforward way such that it
runs in linear time with a linear number of processors. We demonstrate that for
various constraint languages, peek arc consistency gives a polynomial-time
decision procedure for the constraint satisfaction problem. We also present an
algebraic characterization of those constraint languages that can be solved by
peek arc consistency, and study the robustness of the algorithm.
","[{""version"":""v1"",""created"":""Thu, 4 Sep 2008 11:15:50 GMT""},{""version"":""v2"",""created"":""Fri, 3 Feb 2012 18:53:00 GMT""}]","2015-03-13"
"0809.0789","Lars Jonsson","B. L. G. Jonsson","Wave splitting of Maxwell's equations with anisotropic heterogeneous
  constitutive relations","45 pages, 2 figures","Inverse Problems and Imaging 3(2), pp 405-452, 2009.","10.3934/ipi.2009.3.405",,"math-ph math.MP","http://arxiv.org/licenses/nonexclusive-distrib/1.0/","  The equations for the electromagnetic field in an anisotropic media are
written in a form containing only the transverse field components relative to a
half plane boundary. The operator corresponding to this formulation is the
electromagnetic system's matrix. A constructive proof of the existence of
directional wave-field decomposition with respect to the normal of the boundary
is presented.
  In the process of defining the wave-field decomposition (wave-splitting), the
resolvent set of the time-Laplace representation of the system's matrix is
analyzed. This set is shown to contain a strip around the imaginary axis. We
construct a splitting matrix as a Dunford-Taylor type integral over the
resolvent of the unbounded operator defined by the electromagnetic system's
matrix. The splitting matrix commutes with the system's matrix and the
decomposition is obtained via a generalized eigenvalue-eigenvector procedure.
The decomposition is expressed in terms of components of the splitting matrix.
The constructive solution to the question on the existence of a decomposition
also generates an impedance mapping solution to an algebraic Riccati operator
equation. This solution is the electromagnetic generalization in an anisotropic
media of a Dirichlet-to-Neumann map.
","[{""version"":""v1"",""created"":""Thu, 4 Sep 2008 11:20:50 GMT""}]","2009-08-11"
"0809.0790","Vera Hankele","F. Campanario, V. Hankele, C. Oleari, S. Prestel and D. Zeppenfeld","QCD corrections to charged triple vector boson production with leptonic
  decay","16 pages, 9 figures, 3 tables","Phys.Rev.D78:094012,2008","10.1103/PhysRevD.78.094012",,"hep-ph","http://arxiv.org/licenses/nonexclusive-distrib/1.0/","  We compute the O(alpha_s) QCD corrections to charged triple vector boson
production at a hadron collider, i.e. the processes pp -> ZZW + X and pp -> WWW
+ X. Intermediate Higgs boson exchange effects, spin correlations from leptonic
vector boson decays, and off-shell contributions are all taken into account.
Results are implemented in a fully flexible Monte Carlo program that allows for
an easy customization of kinematical cuts and variation of the factorization
and renormalization scales. We analyze the dependence of the differential cross
sections under scale variations and present distributions where the QCD
corrections strongly modify the leading-order results.
","[{""version"":""v1"",""created"":""Thu, 4 Sep 2008 15:21:39 GMT""},{""version"":""v2"",""created"":""Tue, 27 Jan 2009 15:28:15 GMT""}]","2009-02-23"
"0809.0791","Rutger van Haasteren","Rutger van Haasteren, Yuri Levin, Patrick McDonald, Tingting Lu","On measuring the gravitational-wave background using Pulsar Timing
  Arrays","10 pages, 12 figures",,"10.1111/j.1365-2966.2009.14590.x",,"astro-ph gr-qc","http://arxiv.org/licenses/nonexclusive-distrib/1.0/","  Long-term precise timing of Galactic millisecond pulsars holds great promise
for measuring the long-period (months-to-years) astrophysical gravitational
waves. Several gravitational-wave observational programs, called Pulsar Timing
Arrays (PTA), are being pursued around the world. Here we develop a Bayesian
algorithm for measuring the stochastic gravitational-wave background (GWB) from
the PTA data. Our algorithm has several strengths: (1) It analyses the data
without any loss of information, (2) It trivially removes systematic errors of
known functional form, including quadratic pulsar spin-down, annual modulations
and jumps due to a change of equipment, (3) It measures simultaneously both the
amplitude and the slope of the GWB spectrum, (4) It can deal with unevenly
sampled data and coloured pulsar noise spectra. We sample the likelihood
function using Markov Chain Monte Carlo (MCMC) simulations. We extensively test
our approach on mock PTA datasets, and find that the algorithm has significant
benefits over currently proposed counterparts. We show the importance of
characterising all red noise components in pulsar timing noise by demonstrating
that the presence of a red component would significantly hinder a detection of
the GWB. Lastly, we explore the dependence of the signal-to-noise ratio on the
duration of the experiment, number of monitored pulsars, and the magnitude of
the pulsar timing noise. These parameter studies will help formulate observing
strategies for the PTA experiments.
","[{""version"":""v1"",""created"":""Thu, 4 Sep 2008 11:34:51 GMT""},{""version"":""v2"",""created"":""Fri, 28 Nov 2008 16:12:31 GMT""},{""version"":""v3"",""created"":""Wed, 11 Feb 2009 15:49:42 GMT""}]","2009-11-13"
"0809.0792","Chuan-Ren Chen","Chuan-Ren Chen, Fuminobu Takahashi and T. T. Yanagida","Gamma rays and positrons from a decaying hidden gauge boson","16 pages, 4 figures, adding PAMELA data, the version accepted by PLB","Phys.Lett.B671:71-76,2009","10.1016/j.physletb.2008.11.048","IPMU 08-0058","hep-ph astro-ph","http://arxiv.org/licenses/nonexclusive-distrib/1.0/","  We study a scenario that a hidden gauge boson constitutes the dominant
component of dark matter and decays into the standard model particles through a
gauge kinetic mixing. Interestingly, gamma rays and positrons produced from the
decay of hidden gauge boson can explain both the EGRET excess of diffuse gamma
rays and the HEAT anomaly in the positron fraction. The spectra of the gamma
rays and the positrons have distinctive features; the absence of line emission
of the gamma ray and a sharp peak in the positron fraction. Such features may
be observed by the GLAST and PAMELA satellites.
","[{""version"":""v1"",""created"":""Thu, 4 Sep 2008 11:46:33 GMT""},{""version"":""v2"",""created"":""Thu, 18 Dec 2008 08:02:28 GMT""}]","2009-01-16"
"0809.0793","Sannino Francesco","A. Belyaev, R. Foadi, M.T. Frandsen, M. Jarvinen, A. Pukhov, F.
  Sannino","Technicolor Walks at the LHC","RevTeX 4, 32 pages, 21 figures","Phys.Rev.D79:035006,2009","10.1103/PhysRevD.79.035006",,"hep-ph hep-ex","http://arxiv.org/licenses/nonexclusive-distrib/1.0/","  We analyze the potential of the Large Hadron Collider (LHC) to observe
signatures of phenomenologically viable Walking Technicolor models. We study
and compare the Drell-Yan (DY) and Vector Boson Fusion (VBF) mechanisms for the
production of composite heavy vectors. We find that the heavy vectors are most
easily produced and detected via the DY processes. The composite Higgs
phenomenology is also studied. If Technicolor walks at the LHC its footprints
will be visible and our analysis will help uncovering them.
","[{""version"":""v1"",""created"":""Thu, 4 Sep 2008 11:49:31 GMT""}]","2009-11-13"
"0809.0794","Vandana Nanal Dr.","P. C. Rout, D. R. Chakrabarty, V. M. Datar, Suresh Kumar, E. T.
  Mirgule, A. Mitra, V. Nanal and R. Kujur","A large area plastic scintillator detector array for fast neutron
  measurements","31 pages, 17 figures, submitted to NIM A","Nucl.Instrum.Meth.A598:526-533,2009","10.1016/j.nima.2008.09.034",,"nucl-ex","http://arxiv.org/licenses/nonexclusive-distrib/1.0/","  A large area plastic scintillator detector array(~ 1 m x1m) has been set up
for fast neutron spectroscopy at the BARC-TIFR Pelletron laboratory, Mumbai.
The energy, time and position response has been measured for electrons using
radioactive sources and for mono-energetic neutrons using the
7Li(p,n1)7Be*(0.429 MeV) reaction at proton energies between 6.3 and 19 MeV. A
Monte Carlo simulation of the energy dependent efficiency of the array for
neutron detection is in agreement with the 7Li(p,n1) measurements. The array
has been used to measure the neutron spectrum, in the energy range of 4-12 MeV,
in the reaction 12C+ 93Nb at E(12C)= 40 MeV. This is in reasonable agreement
with a statistical model calculation.
","[{""version"":""v1"",""created"":""Thu, 4 Sep 2008 11:58:00 GMT""}]","2009-01-16"
"0809.0795","Qiang Han","Q. Han, Z. D. Wang","Impurity states in antiferromagnetic Iron Arsenides","4 pages, 2 figures","New J Phys, 11 (2009) 025022","10.1088/1367-2630/11/2/025022",,"cond-mat.supr-con cond-mat.str-el","http://arxiv.org/licenses/nonexclusive-distrib/1.0/","  We explore theoretically impurity states in the antiferromagnetic
spin-density wave state of the iron arsenide. Two types of impurity models are
employed: one has only the intraband scattering while the other has both the
intraband and interband scattering with the equal strength. Interestingly, the
impurity bound state is revealed around the impurity site in the energy gap for
both models. However, the impurity state is doubly degenerate with respect to
spin for the first case; while the single impurity state is observed in either
the spin-up or spin-down channel for the second one. The impurity-induced
variations of the local density of states are also examined.
","[{""version"":""v1"",""created"":""Thu, 4 Sep 2008 12:02:24 GMT""}]","2009-11-13"
"0809.0796","Thomas Dahms","Thomas Dahms, Philipp H\""ovel, Eckehard Sch\""oll","Stabilizing continuous-wave output in semiconductor lasers by
  time-delayed feedback","12 pages, 17 figures",,"10.1103/PhysRevE.78.056213",,"nlin.CD","http://arxiv.org/licenses/nonexclusive-distrib/1.0/","  The stabilization of steady states is studied in a modified Lang-Kobayashi
model of a semiconductor laser. We show that multiple time-delayed feedback,
realized by a Fabry-Perot resonator coupled to the laser, provides a valuable
tool for the suppression of unwanted intensity pulsations, and leads to stable
continuous-wave operation. The domains of control are calulated in dependence
on the feedback strength, delay time (cavity round trip time), memory parameter
(mirror reflectivity), latency time, feedback phase, and bandpass filtering,
Due to the optical feedback, multistable behavior can also occur in the form of
delay-induced intensity pulsations or other modes for certain choices of the
control parameters. Control may then still be achieved by slowly ramping the
injection current during turn-on.
","[{""version"":""v1"",""created"":""Thu, 4 Sep 2008 12:09:22 GMT""},{""version"":""v2"",""created"":""Wed, 29 Oct 2008 12:17:33 GMT""}]","2009-11-13"
"0809.0797","Keisuke Nishida","Keisuke Nishida, Masaki Shimizu, Daikou Shiota, Hiroyuki Takasaki,
  Tetsuya Magara, and Kazunari Shibata","Numerical examination of plasmoid-induced reconnection model for solar
  flares: the relation between plasmoid velocity and reconnection rate","27 pages, 12 figures, Accepted for publication in ApJ","Astrophys.J.690:748-757,2009","10.1088/0004-637X/690/1/748",,"astro-ph","http://arxiv.org/licenses/nonexclusive-distrib/1.0/","  The plasmoid-induced-reconnection model explaining solar flares based on
bursty reconnection produced by an ejecting plasmoid suggests a possible
relation between the ejection velocity of a plasmoid and the rate of magnetic
reconnection. In this study, we focus on the quantitative description of this
relation. We performed magnetohydrodynamic (MHD) simulations of solar flares by
changing the values of resistivity and the plasmoid velocity. The plasmoid
velocity has been changed by applying an additional force to the plasmoid to
see how the plasmoid velocity affects the reconnection rate. An important
result is that the reconnection rate has a positive correlation with the
plasmoid velocity, which is consistent with the plasmoid-induced-reconnection
model for solar flares. We also discuss an observational result supporting this
positive correlation.
","[{""version"":""v1"",""created"":""Thu, 4 Sep 2008 12:18:55 GMT""}]","2008-12-18"
"0809.0798","Sergey Sosin","S. S. Sosin, L. A. Prozorova, P. Bonville, M. E. Zhitomirsky","Magnetic excitations in dipolar pyrochlore antiferromagnet
  Gd$_2$Sn$_2$O$_7$","8 pages, 5 figures","Phys. Rev. B 79, 014419 (2009)","10.1103/PhysRevB.79.014419",,"cond-mat.str-el","http://arxiv.org/licenses/nonexclusive-distrib/1.0/","  The spin dynamics in the geometrically frustrated pyrochlore antiferromagnet
$\rm Gd_2Sn_2O_7$ is studied by means of the electron spin resonance. In the
ordered phase ($T_N = 1$ K), we have detected three gapped resonance modes.
Their values agree well with the developed spin-wave theory which takes into
account the Heisenberg nearest-neighbor exchange, the single-ion anisotropy and
the long-range dipolar interactions. The theory also predicts a fourth
lowest-frequency gap, which lies beyond the experimental range of frequencies,
but determines the exponential decrease of the specific heat at low
temperature.
","[{""version"":""v1"",""created"":""Thu, 4 Sep 2008 14:25:49 GMT""}]","2013-05-29"
"0809.0799","Ji Young Kim Dr.","Byeong Moon Kim, Ji Young Kim, Poo-Sung Park","Even universal binary Hermitian lattices over imaginary quadratic fields","11 Pages",,,,"math.NT","http://arxiv.org/licenses/nonexclusive-distrib/1.0/","  A positive definite even Hermitian lattice is called \emph{even universal} if
it represents all even positive integers. We introduce a method to get all even
universal binary Hermitian lattices over imaginary quadratic fields $\Q{-m}$
for all positive square-free integers $m$ and we list optimal criterions on
even universality of Hermitian lattices over $\Q{-m}$ which admits even
universal binary Hermitian lattices.
","[{""version"":""v1"",""created"":""Thu, 4 Sep 2008 12:34:46 GMT""},{""version"":""v2"",""created"":""Thu, 19 Feb 2009 07:04:01 GMT""}]","2009-02-19"
"0809.0800","Ansgar Denner","Ansgar Denner, Bernd Jantzen, Stefano Pozzorini","Two-loop electroweak next-to-leading logarithms for processes involving
  heavy quarks","55 pages, LaTeX, version to appear in JHEP, minor revisions of text,
  results unchanged","JHEP 0811:062,2008","10.1088/1126-6708/2008/11/062","MPP-2008-89, PSI-PR-08-11","hep-ph","http://arxiv.org/licenses/nonexclusive-distrib/1.0/","  We derive logarithmically enhanced two-loop virtual electroweak corrections
for arbitrary fermion-scattering processes at the TeV scale. This extends
results previously obtained for massless fermion scattering to processes that
involve also bottom and top quarks. The contributions resulting from soft,
collinear, and ultraviolet singularities in the complete electroweak Standard
Model are explicitly extracted from two-loop diagrams to
next-to-leading-logarithmic accuracy including all effects associated with
symmetry breaking and Yukawa interactions.
","[{""version"":""v1"",""created"":""Thu, 4 Sep 2008 13:07:02 GMT""},{""version"":""v2"",""created"":""Wed, 19 Nov 2008 07:15:12 GMT""}]","2009-11-19"
"0809.0801","Dr. Alok Banerjee","K. Mukherjee and A. Banerjee","Selective substitution in orbital domains of a low doped manganite : an
  investigation from Griffiths phenomenon and modification of glassy features",,,"10.1088/0953-8984/21/10/106001",,"cond-mat.str-el cond-mat.mtrl-sci","http://arxiv.org/licenses/nonexclusive-distrib/1.0/","  An effort is made to study the contrast in magnetic behavior resulting from
minimal disorder introduced by substitution of 2.5% Ga or Al in Mn-site of
La${_{0.9}}$Sr$_{0.1}$MnO${_3}$. It is considered that Ga or Al selectively
creates disorder within the orbital domains or on its walls, causing
enhancement of Griffiths phase (GP) singularity for the former and
disappearance of it in the later case. It is shown that Ga replaces Mn$^{3+}$
which is considered to be concentrated within the domains, whereas Al replaces
Mn$^{4+}$ which is segregated on the hole-rich walls, without causing any
significant effect on structure or ferromagnetic transition temperatures. Thus,
it is presumed that the effect of disorder created by Ga extend across the bulk
of the domain having correlation over similar length-scale resulting in
enhancement of GP phenomenon. On the contrary, effect of disorder created by Al
remains restricted to the walls resulting in the modification of the dynamics
arising from the domain walls and suppresses the GP. Moreover contrasting
features are observed in the low temperature region of the compounds; a
re-entrant spin glass like behavior is observed in the Ga doped sample, while
the observed characteristics for the Al doped sample is ascribed only to
modified domain wall dynamics with the absence of any glassy phase. Distinctive
features in third order susceptibility measurements reveals that the magnetic
ground state of the entire series comprises of orbital domain states. These
observations bring out the role of the nature of disorder on GP phenomenon and
also reconfirms the character of self-organization in low-doped manganites.
","[{""version"":""v1"",""created"":""Thu, 4 Sep 2008 12:47:05 GMT""}]","2009-11-13"
"0809.0802","Francois Laudenbach","Francois Laudenbach (LMJL)","Positive Legendrian regular homotopies",,"New perspectives and challenges in symplectic topology, Stanford :
  \'Etats-Unis d'Am\'erique (2007)",,,"math.GT","http://arxiv.org/licenses/nonexclusive-distrib/1.0/","  In contrast with what happens for Legendrian embeddings, there always exist
positive loops of Legendrian immersions.
","[{""version"":""v1"",""created"":""Thu, 4 Sep 2008 12:56:03 GMT""}]","2010-01-18"
"0809.0803","Nathalie Pothier","H. Erramli, H.D. Godon, M.A. Misdaq, T. Sauvage (CEMHTI), Claire
  Ramboz (ISTO)","Study of pollution in the El Jadida-Safi Atlantic coastal zone (Morocco)
  by using PIXE and SSNTD methods",,"Journal of Environmental Radioactivity 99 (2008) 1216-1223","10.1016/j.jenvrad.2008.02.003",,"physics.geo-ph","http://arxiv.org/licenses/nonexclusive-distrib/1.0/","  In this work PIXE experiments were performed for measuring heavy and light
elements (ranging from aluminium to lead) concentrations inside various
polluted and unpolluted soils as well as liquid samples collected from
different phosphate factory sewers in the El Jadida-Safi Atlantic coastal
region (Morocco). In addition, uranium (238U) and thorium (232Th) contents were
evaluated in the same samples studied by using CR-39 and LR-115 type II solid
state nuclear track detectors (SSNTDs). The influence of the phosphate industry
wastes on the concentrations of both radioactive and non-radioactive elements
of the samples studied was investigated.
","[{""version"":""v1"",""created"":""Thu, 4 Sep 2008 13:01:06 GMT""}]","2008-09-05"
"0809.0804","Ronan Quarez","Ronan Quarez (IRMAR)","Repr\'esentations d\'eterminantales effectives des polyn\^omes
  univari\'es par les matrices fl\`eches",,,,,"math.RA","http://arxiv.org/licenses/nonexclusive-distrib/1.0/","  We first show the existence of an effective determinantal representation for
any univariate polynomial with real coefficients. Then, we more precisely
establish that any univariate polynomial with real coefficients has an
effective determinantal representation with signature (r+s,s) if and only if it
has at least r real roots with multiplicity. The effective determinantal
representations we construct used arrow matrices.
","[{""version"":""v1"",""created"":""Thu, 4 Sep 2008 13:02:43 GMT""}]","2008-09-05"
"0809.0805","Hideo Suganuma","Hideo Suganuma (Kyoto U.), Kanabu Nawa (RCNP, Osaka U.) and Toru Kojo
  (RIKEN-BNL)","Baryons and Baryonic Matter in Holographic QCD from Superstring",,"Nucl.Phys.Proc.Suppl.186:248-251,2009","10.1016/j.nuclphysbps.2008.12.055",,"hep-th","http://arxiv.org/licenses/nonexclusive-distrib/1.0/","  We study baryons and baryonic matter in holographic QCD using a
D4/D8/$\bar{\rm D8}$ multi-D-brane system in the superstring theory. We obtain
the chiral soliton solution for baryons in the four-dimensional meson theory
derived from the multi-D-brane system. For the analysis of finite
baryon-density matter, we investigate the chiral soliton on $S^3$ in
holographic QCD, and find the delocalization of the soliton, i.e., the swelling
of baryons in dense matter.
","[{""version"":""v1"",""created"":""Thu, 4 Sep 2008 13:04:23 GMT""}]","2009-03-20"
