"0809.4490","Avery Broderick","Avery E. Broderick, Vincent L. Fish, Sheperd S. Doeleman, Abraham Loeb","Estimating the Parameters of Sgr A*'s Accretion Flow Via Millimeter VLBI","10 pages, 7 figures, accepted by ApJ","Astrophys.J.697:45-54,2009","10.1088/0004-637X/697/1/45",,"astro-ph","http://arxiv.org/licenses/nonexclusive-distrib/1.0/","  Recent millimeter-VLBI observations of Sagittarius A* (Sgr A*) have, for the
first time, directly probed distances comparable to the horizon scale of a
black hole. This provides unprecedented access to the environment immediately
around the horizon of an accreting black hole. We leverage both existing
spectral and polarization measurements and our present understanding of
accretion theory to produce a suite of generic radiatively inefficient
accretion flow (RIAF) models of Sgr A*, which we then fit to these recent
millimeter-VLBI observations. We find that if the accretion flow onto Sgr A* is
well described by a RIAF model, the orientation and magnitude of the black
hole's spin is constrained to a two-dimensional surface in the spin,
inclination, position angle parameter space. For each of these we find the
likeliest values and their 1-sigma & 2-sigma errors to be a=0(+0.4+0.7),
inclination=50(+10+30)(-10-10) degrees, and position angle=-20(+31+107)(-16-29)
degrees, when the resulting probability distribution is marginalized over the
others. The most probable combination is a=0(+0.2+0.4), inclination=90(-40-50)
degrees and position angle=-14(+7+11)(-7-11) degrees, though the uncertainties
on these are very strongly correlated, and high probability configurations
exist for a variety of inclination angles above 30 degrees and spins below
0.99. Nevertheless, this demonstrates the ability millimeter-VLBI observations,
even with only a few stations, to significantly constrain the properties of Sgr
A*.
","[{""version"":""v1"",""created"":""Thu, 25 Sep 2008 21:27:22 GMT""},{""version"":""v2"",""created"":""Tue, 3 Mar 2009 21:44:21 GMT""}]","2010-01-15"
"0809.4491","Miguel Cervino","M. Cervino (IAA-Csic), V. Luridiana (IAA-Csic), L. Jamet (IA-Unam)","On surface brightness fluctuations: probabilistic and statistical bases
  I: Stellar population and theoretical SBF","A&A accepted",,"10.1051/0004-6361:20077515",,"astro-ph","http://arxiv.org/licenses/nonexclusive-distrib/1.0/","  This work aims to provide a theoretical formulation of Surface Brightness
Fluctuations (SBF) in the framework of probabilistic synthesis models, and to
distinguish between the different distributions involved in the SBF definition.
RESULTS: We propose three definitions of SBF: (i) stellar population SBF, which
can be computed from synthesis models and provide an intrinsic metric of fit
for stellar population studies; (ii) theoretical SBF, which include the stellar
population SBF plus an additional term that takes into account the distribution
of the number of stars per resolution element psi(N); theoretical SBF coincide
with Tonry & Schneider (1998) definition in the very particular case that
psi(N) is assumed to be a Poisson distribution. However, the Poisson
contribution to theoretical SBF is around 0.1% of the contribution due to the
stellar population SBF, so there is no justification to include any reference
to Poisson statistics in the SBF definition; (iii) observational SBF, which are
those obtained in observations that are distributed around the theoretical SBF.
Finally, we show alternative ways to compute SBF and extend the application of
stellar population SBF to defining a metric of fitting for standard stellar
population studies. CONCLUSIONS: We demostrate that SBF are observational
evidence of a probabilistic paradigm in population synthesis, where integrated
luminosities have an intrinsic distributed nature, and they rule out the
commonly assumed deterministic paradigm of stellar population modeling.
","[{""version"":""v1"",""created"":""Thu, 25 Sep 2008 20:03:06 GMT""}]","2009-11-13"
"0809.4493","Steven Furlanetto","Steven Furlanetto (UCLA), Andrei Mesinger (Princeton)","The ionizing background at the end of overlap","submitted to MNRAS, 7 pages, 5 figures",,"10.1111/j.1365-2966.2009.14449.x",,"astro-ph","http://arxiv.org/licenses/nonexclusive-distrib/1.0/","  One of the most sought-after signatures of reionization is a rapid increase
in the ionizing background (usually measured through the Lyman-alpha optical
depth toward distant quasars). Conventional wisdom associates this with the
""overlap"" phase when ionized bubbles merge, allowing each source to affect a
much larger volume. We argue that this picture fails to describe the transition
to the post-overlap Universe, where Lyman-limit systems absorb ionizing photons
over moderate lengthscales (20-100 Mpc). Using an analytic model, we compute
the probability distribution of the amplitude of the ionizing background
throughout reionization, including both discrete ionized bubbles and
Lyman-limit systems (parameterized by an attenuation length). We show that
overlap does not by itself cause a rapid increase in the ionizing background or
a rapid decrease in the mean Lyman-alpha transmission toward distant quasars.
More detailed semi-numeric models support these conclusions. We argue that
rapid changes should instead be interpreted as evolution in the attenuation
length itself, which may or may not be directly related to overlap.
","[{""version"":""v1"",""created"":""Thu, 25 Sep 2008 20:17:02 GMT""}]","2009-11-13"
"0809.4495","Francisco Nettel","Francisco J. Hernandez, Francisco Nettel and Hernando Quevedo","Gravitational fields as generalized string models","latex, 25 pages","Grav.Cosmol.15:109-120,2009","10.1134/S0202289309020029",,"math-ph math.MP","http://arxiv.org/licenses/nonexclusive-distrib/1.0/","  We show that Einstein's main equations for stationary axisymmetric fields in
vacuum are equivalent to the motion equations for bosonic strings moving on a
special nonflat background. This new representation is based on the analysis of
generalized harmonic maps in which the metric of the target space explicitly
depends on the parametrization of the base space. It is shown that this
representation is valid for any gravitational field which possesses two
commuting Killing vector fields. We introduce the concept of dimensional
extension which allows us to consider this type of gravitational fields as
strings embedded in D-dimensional nonflat backgrounds, even in the limiting
case where the Killing vector fields are hypersurface orthogonal.
","[{""version"":""v1"",""created"":""Thu, 25 Sep 2008 20:22:02 GMT""}]","2011-03-02"
"0809.4496","Daniel M. Pellegrino","Geraldo Botelho, Daniel Pellegrino and Pilar Rueda","Dominated polynomials on infinite dimensional spaces","9 pages",,,,"math.FA","http://arxiv.org/licenses/nonexclusive-distrib/1.0/","  The aim of this paper is to prove a stronger version of a conjecture on the
existence of non-dominated scalar-valued m-homogeneous polynomials (m>=3) on
arbitrary infinite dimensional Banach spaces.
","[{""version"":""v1"",""created"":""Thu, 25 Sep 2008 20:23:06 GMT""},{""version"":""v2"",""created"":""Fri, 7 Nov 2008 10:13:02 GMT""},{""version"":""v3"",""created"":""Wed, 28 Jan 2009 21:35:19 GMT""},{""version"":""v4"",""created"":""Tue, 3 Mar 2009 17:43:48 GMT""},{""version"":""v5"",""created"":""Wed, 13 May 2009 11:47:57 GMT""}]","2009-05-13"
"0809.4497","\'Etienne Artigau","Etienne Artigau, David Lafreniere, Rene Doyon, Loic Albert, Jasmin
  Robert, Lison Malo","SIMP: A Near-Infrared Proper Motion Survey","Proceedings article of the conference 'Cool Stars 15' held July 2008
  in St. Andrews",,"10.1063/1.3099156",,"astro-ph","http://arxiv.org/licenses/nonexclusive-distrib/1.0/","  SIMP is a proper motion (PM) survey made with the Observatoire du Mont
Megantic (OMM) wide-field near-infrared camera CPAPIR at the CTIO 1.5 m and OMM
1.6 m telescopes. The SIMP observations were initiated in early 2005, are still
ongoing and, to date, have covered 28% of the sky at high galactic latitudes.
The PMs of the sources detected are determined by comparing their measured
positions with those listed in the 2MASS point source catalog, giving a time
baseline of 4 to 10 years. The 5 sigma uncertainty on the relative SIMP and
2MASS astrometry is 1"", equivalent to a PM lower limit of 0.125-0.250""/yr, or a
tangential velocity limit of 15-30 km/s at 25 pc. Up to the 2MASS magnitude
limit (J~16.5), T dwarfs are found out to ~25 pc, while L dwarfs may be found
as far as 100 pc away.
","[{""version"":""v1"",""created"":""Thu, 25 Sep 2008 20:26:44 GMT""}]","2009-11-13"
"0809.4498","Gustavo S\'afar de A. M.","G. A. M. S\'afar, H. B. Ribeiro, C. Fantini, F. O. Plentz, A. P.
  Santos, G. DeFreitas-Silva, Y. M. Idemori","Doping single wall carbon nanotubes with differently charged porphyrins",,,,,"cond-mat.mtrl-sci cond-mat.other","http://arxiv.org/licenses/nonexclusive-distrib/1.0/","  Photoluminescence (PL) measurements of porphyrin-doped single wall carbon
nanotubes (SWNT) were studied in sodium dodecylbenzenesulfonate (NaDDBS)
aqueous dispersions. The PL spectra were used to draw PL maps were the maxima
corresponds to absorption-emission excitonic processes related to (E11, E22)
first Van Hove singularities of the SWNT electronic structure. The influence of
the net charge of the porphyrin was a determinant factor in the energy map
maximum shifts (EMMS) compared to the energy map of a pristine NaDDBS/SWNT
dispersion. A non-interacting porphyrin is used as a reference to discard the
influence of the dielectric constant of the medium in the EMMS.
","[{""version"":""v1"",""created"":""Thu, 25 Sep 2008 20:27:38 GMT""}]","2008-09-29"
"0809.4499","Paul Benioff","Paul Benioff","A Possible Approach to Inclusion of Space and Time in Frame Fields of
  Quantum Representations of Real and Complex Numbers","Paper has been greatly revised and shortened to 26 pages, 2 figures,
  per referees comments","Advances in Mathematical Physics, Vol. 2009, ID 452738","10.1155/2009/452738",,"quant-ph gr-qc","http://arxiv.org/licenses/nonexclusive-distrib/1.0/","  This work is based on the field of reference frames based on quantum
representations of real and complex numbers described in other work. Here frame
domains are expanded to include space and time lattices. Strings of qukits are
described as hybrid systems as they are both mathematical and physical systems.
As mathematical systems they represent numbers. As physical systems in each
frame the strings have a discrete Schrodinger dynamics on the lattices. The
frame field has an iterative structure such that the contents of a stage j
frame have images in a stage j-1 (parent) frame. A discussion of parent frame
images includes the proposal that points of stage j frame lattices have images
as hybrid systems in parent frames. The resulting association of energy with
images of lattice point locations, as hybrid systems states, is discussed.
Representations and images of other physical systems in the different frames
are also described.
","[{""version"":""v1"",""created"":""Thu, 25 Sep 2008 20:29:18 GMT""},{""version"":""v2"",""created"":""Wed, 26 Aug 2009 17:28:02 GMT""}]","2009-11-10"
"0809.4500","Ale\v{s} \v{C}ern\'y","Ale\v{s} \v{C}ern\'y","Characterization of the Oblique Projector $U(VU)^+V$ with Application to
  Constrained Least Squares","v1: 6 pages v2: 7 pages. Minor changes (formatting, references) in
  sections 1-2. Extra statement in Theorem 3.1. Substantial revision of section
  4 v3: 7 pages. A minor change (more explicit formula for \Xi) in Corollary
  4.2. Changed + to direct sum at the bottom of p.5 v4: 7 pages. Removed typo
  in eq. (17) which was present in v2 and v3","Linear Algebra and Its Applications 2009, 431(9), 1564-1570","10.1016/j.laa.2009.05.025",,"math.OC math.RA","http://arxiv.org/licenses/nonexclusive-distrib/1.0/","  We provide a full characterization of the oblique projector $U(VU)^+V$ in the
general case where the range of $U$ and the null space of $V$ are not
complementary subspaces. We discuss the new result in the context of
constrained least squares minimization.
","[{""version"":""v1"",""created"":""Thu, 25 Sep 2008 20:55:49 GMT""},{""version"":""v2"",""created"":""Sun, 8 Feb 2009 11:43:15 GMT""},{""version"":""v3"",""created"":""Wed, 20 May 2009 21:34:54 GMT""},{""version"":""v4"",""created"":""Tue, 26 May 2009 21:16:31 GMT""},{""version"":""v5"",""created"":""Mon, 24 Jul 2017 10:24:16 GMT""}]","2017-07-25"
"0809.4501","Guoshen Yu","Guoshen Yu, Jean-Jacques Slotine","Audio Classification from Time-Frequency Texture",,,,,"cs.CV cs.SD","http://arxiv.org/licenses/nonexclusive-distrib/1.0/","  Time-frequency representations of audio signals often resemble texture
images. This paper derives a simple audio classification algorithm based on
treating sound spectrograms as texture images. The algorithm is inspired by an
earlier visual classification scheme particularly efficient at classifying
textures. While solely based on time-frequency texture features, the algorithm
achieves surprisingly good performance in musical instrument classification
experiments.
","[{""version"":""v1"",""created"":""Thu, 25 Sep 2008 20:54:29 GMT""}]","2008-09-29"
"0809.4502","Alexander Velytsky","Alexander Velytsky","Entanglement entropy in SU(N) gauge theory","7 pages, 6 figures; talk presented at the XXVI International
  Symposium on Lattice Field Theory, July 14-19, 2008, Williamsburg, Virginia,
  USA","PoS LATTICE2008:256,2008",,,"hep-lat","http://arxiv.org/licenses/nonexclusive-distrib/1.0/","  The entanglement entropy of SU(N) lattice gauge theory is studied exactly in
1+1 space-time dimensions and in Migdal-Kadanoff approximation in higher
dimensional space. The existence of a non-analytical behavior reminiscent of a
phase transition for a characteristic size of the entangled region is
demonstrated for higher dimensional theories.
","[{""version"":""v1"",""created"":""Thu, 25 Sep 2008 20:56:00 GMT""}]","2010-01-21"
"0809.4503","Jacobus Verbaarschot","K. Splittorff and J.J.M. Verbaarschot","Lessons from Random Matrix Theory for QCD at Finite Density","Invited talk at ""Continuous Advances in QCD 2008"", Minneapolis, May
  2008; 14 pages, 7 figures",,"10.1142/9789812838667_0014",,"hep-ph","http://arxiv.org/licenses/nonexclusive-distrib/1.0/","  In this lecture we discuss various aspects of QCD at nonzero chemical
potential, including its phase diagram and the Dirac spectrum, and summarize
what chiral random matrix theory has contributed to this subject. To illustrate
the importance of the phase of the fermion determinant, we particularly
highlight the differences between QCD and phase quenched QCD.
","[{""version"":""v1"",""created"":""Thu, 25 Sep 2008 21:09:43 GMT""}]","2017-08-23"
"0809.4504","Paul Bryans","P. Bryans, H. Kreckel, E. Roueff, V. Wakelam and D. W. Savin","Molecular cloud chemistry and the importance of dielectronic
  recombination","24 pages, 2 tables, 9 figures. Submitted to ApJ","Astrophys.J.694:286-293,2009","10.1088/0004-637X/694/1/286",,"astro-ph","http://arxiv.org/licenses/nonexclusive-distrib/1.0/","  Dielectronic recombination (DR) of singly charged ions is a reaction pathway
that is commonly neglected in chemical models of molecular clouds. In this
study we include state-of-the-art DR data for He$^+$, C$^+$, N$^+$, O$^+$,
Na$^+$, and Mg$^+$ in chemical models used to simulate dense molecular clouds,
protostars, and diffuse molecular clouds. We also update the radiative
recombination (RR) rate coefficients for H$^+$, He$^+$, C$^+$, N$^+$, O$^+$,
Na$^+$, and Mg$^+$ to the current state-of-the-art values. The new RR data has
little effect on the models. However, the inclusion of DR results in
significant differences in gas-grain models of dense, cold molecular clouds for
the evolution of a number of surface and gas-phase species. We find differences
of a factor of 2 in the abundance for 74 of the 655 species at times of
$10^4$--$10^6$ years in this model when we include DR. Of these 74 species, 16
have at least a factor of 10 difference in abundance. We find the largest
differences for species formed on the surface of dust grains. These differences
are due primarily to the addition of C$^+$ DR, which increases the neutral C
abundance, thereby enhancing the accretion of C onto dust. These results may be
important for the warm-up phase of molecular clouds when surface species are
desorbed into the gas phase. We also note that no reliable state-of-the-art RR
or DR data exist for Si$^+$, P$^+$, S$^+$, Cl$^+$, and Fe$^+$. Modern
calculations for these ions are needed to better constrain molecular cloud
models.
","[{""version"":""v1"",""created"":""Thu, 25 Sep 2008 21:16:53 GMT""}]","2011-02-11"
"0809.4505","Beth Reid","Beth A. Reid and David N. Spergel","Constraining the LRG Halo Occupation Distribution using
  Counts-in-Cylinders","40 pages, 9 figures, submitted to Astrophysical Journal","Astrophys.J.698:143-154,2009","10.1088/0004-637X/698/1/143",,"astro-ph","http://arxiv.org/licenses/nonexclusive-distrib/1.0/","  The low number density of the Sloan Digital Sky Survey (SDSS) Luminous Red
Galaxies (LRGs) suggests that LRGs occupying the same dark matter halo can be
separated from pairs occupying distinct dark matter halos with high fidelity.
We present a new technique, Counts-in-Cylinders (CiC), to constrain the
parameters of the satellite contribution to the LRG Halo-Occupation
Distribution (HOD). For a fiber collision-corrected SDSS spectroscopic LRG
subsample at 0.16 < z < 0.36, we find the CiC multiplicity function is fit by a
halo model where the average number of satellites in a halo of mass M is
<Nsat(M)> = ((M - Mcut)/M1)^alpha with Mcut = 5.0 +1.5/-1.3 (+2.9/-2.6) X 10^13
Msun, M1 = 4.95 +0.37/-0.26 (+0.79/-0.53) X 10^14 Msun, and alpha = 1.035
+0.10/-0.17 (+0.24/-0.31) at the 68% and 95% confidence levels using a WMAP3
cosmology and z=0.2 halo catalog.
  Our method tightly constrains the fraction of LRGs that are satellite
galaxies, 6.36 +0.38/-0.39, and the combination Mcut/10^{14} Msun + alpha =
1.53 +0.08/-0.09 at the 95% confidence level. We also find that mocks based on
a halo catalog produced by a spherical overdensity (SO) finder reproduce both
the measured CiC multiplicity function and the projected correlation function,
while mocks based on a Friends-of-Friends (FoF) halo catalog has a deficit of
close pairs at ~1 Mpc/h separations. Because the CiC method relies on higher
order statistics of close pairs, it is robust to the choice of halo finder. In
a companion paper we will apply this technique to optimize Finger-of-God (FOG)
compression to eliminate the 1-halo contribution to the LRG power spectrum.
","[{""version"":""v1"",""created"":""Thu, 25 Sep 2008 21:31:43 GMT""}]","2010-12-14"
"0809.4506","Oyanarte Portilho","Oyanarte Portilho","On a possible connection between Chandler wobble and dark matter","19 pages, 10 figures. Final version, to appear in Brazilian Journal
  of Physics, vol 39 (2009)","Braz.J.Phys.39:1-11,2009",,,"astro-ph","http://arxiv.org/licenses/nonexclusive-distrib/1.0/","  Chandler wobble excitation and damping, one of the open problems in
geophysics, is treated as a consequence in part of the interaction between
Earth and a hypothetical oblate ellipsoid made of dark matter. The physical and
geometrical parameters of such an ellipsoid and the interacting torque strength
is calculated in such a way to reproduce the Chandler wobble component of the
polar motion in several epochs, available in the literature. It is also
examined the consequences upon the geomagnetic field dynamo and generation of
heat in the Earth outer core.
","[{""version"":""v1"",""created"":""Fri, 26 Sep 2008 11:58:21 GMT""},{""version"":""v2"",""created"":""Tue, 25 Nov 2008 11:41:49 GMT""},{""version"":""v3"",""created"":""Sun, 15 Feb 2009 12:59:01 GMT""}]","2010-04-21"
"0809.4507","Gaetano Fiore","Gaetano Fiore","On the consequences of twisted Poincare' symmetry upon QFT on Moyal
  noncommutative spaces","Latex file, 21 pages",,"10.1142/9789812833556_0005","Preprint 32-2008 Dip. Matematica e Applicazioni, Universita' di
  Napoli; DSF-17/08","hep-th","http://arxiv.org/licenses/nonexclusive-distrib/1.0/","  We explore some general consequences of a consistent formulation of
relativistic quantum field theory (QFT) on the Groenewold-Moyal-Weyl
noncommutative versions of Minkowski space with covariance under the twisted
Poincare' group of Chaichian et al. [12], Wess [44], Koch et al. [31], Oeckl
[34]. We argue that a proper enforcement of the latter requires braided
commutation relations between any pair of coordinates $\hat x,\hat y$
generating two different copies of the space, or equivalently a $\star$-tensor
product $f(x)\star g(y)$ (in the parlance of Aschieri et al. [3]) between any
two functions depending on $x,y$. Then all differences $(x-y)^\mu$ behave like
their undeformed counterparts. Imposing (minimally adapted) Wightman axioms one
finds that the $n$-point functions fulfill the same general properties as on
commutative space. Actually, upon computation one finds (at least for scalar
fields) that the $n$-point functions remain unchanged as functions of the
coordinates' differences both if fields are free and if they interact (we treat
interactions via time-ordered perturbation theory). The main, surprising
outcome seems a QFT physically equivalent to the undeformed counterpart (to
confirm it or not one should however first clarify the relation between
$n$-point functions and observables, in particular S-matrix elements).
  These results are mainly based on a joint work [24] with J. Wess
","[{""version"":""v1"",""created"":""Thu, 25 Sep 2008 21:46:07 GMT""}]","2017-08-23"
"0809.4508","Santiago Capriotti","Santiago Capriotti","Dirac constraints in field theory and exterior differential systems","51 pages, aims; added examples and references, typos added, improved
  some content, to appear in ""Journal of Geometric Mechanics"".",,"10.3934/jgm.2010.2.1",,"math-ph math.MP","http://arxiv.org/licenses/nonexclusive-distrib/1.0/","  The usual treatment of a (first order) classical field theory such as
electromagnetism has a little drawback: It has a primary constraint submanifold
that arise from the fact that the dynamics is governed by the antisymmetric
part of the jet variables. So it is natural to ask if there exists a
formulation of this kind of field theories which avoids this problem, retaining
the versatility of the known approach. The following paper deals with a family
of variational problems, namely, the so called non standard variational
problems, which intends to capture the data necessary to set up such a
formulation for field theories; moreover, we will formulate a multisymplectic
structure for the family of non standard variational problems, and we will
relate this with the (pre)symplectic structure arising on the space of sections
of the bundle of fields. In this setting the Dirac theory of constraints will
be studied, obtaining among other things a novel characterization of the
constraint manifold which arises in this theory, as generators of an exterior
differential system associated to the equations of motion and the chosen
slicing. Several examples of application of this formalism are discussed: Two
of them motivated from the physical point of view, that is, electromagnetism
and Poisson sigma models, and two examples of mathematical application. In the
case of electromagnetism, it is shown that this formulation avoids the problems
arising in the usual approach.
","[{""version"":""v1"",""created"":""Thu, 25 Sep 2008 22:00:26 GMT""},{""version"":""v2"",""created"":""Fri, 6 Mar 2009 14:27:03 GMT""},{""version"":""v3"",""created"":""Wed, 17 Mar 2010 17:36:58 GMT""}]","2014-05-21"
"0809.4509","Elem\'er Rosinger","Elemer E Rosinger","Two Essays on the Archimedean versus Non-Archimedean Debate",,,,,"math.GM","http://arxiv.org/licenses/nonexclusive-distrib/1.0/","  Part 1 : For more than two millennia, ever since Euclid's geometry, the so
called Archimedean Axiom has been accepted without sufficiently explicit
awareness of that fact. The effect has been a severe restriction of our views
of space-time, a restriction which above all affects Physics. Here it is argued
that, ever since the invention of Calculus by Newton, we may actually have {\it
empirical evidence} that time, and thus space as well, are not Archimedean.
  Part 2 : There is an insufficient awareness about the {\it rich and complex}
structure of various totally ordered scalar fields obtained through the {\it
ultrapower} construction. This rich and complex structure comes from the
presence of {\it infinitesimals} in such fields, presence which leads to the
fact that such fields are {\it non-Archimedean}. Here, with the concept of {\it
walkable world}, which has highly intuitive and pragmatic geometric meaning,
the mentioned rich and complex structure is illustrated. The issues presented
have relevance for what are usually called the ""infinities in physics"".
","[{""version"":""v1"",""created"":""Thu, 25 Sep 2008 22:36:17 GMT""},{""version"":""v2"",""created"":""Mon, 29 Sep 2008 08:24:54 GMT""},{""version"":""v3"",""created"":""Fri, 3 Oct 2008 16:16:54 GMT""}]","2008-10-03"
