"0809.4597","Richard West","R. G. West, A. Collier Cameron, L. Hebb, Y. C. Joshi, D. Pollacco, E.
  Simpson, I. Skillen, H. C. Stempels, P. J. Wheatley, D. Wilson, D. Anderson,
  S. Bentley, F. Bouchy, B. Enoch, N. Gibson, G. H\'ebrard, C. Hellier, B.
  Loeillet, M. Mayor, P. Maxted, I. McDonald, C. Moutou, F. Pont, D. Queloz, A.
  M. S. Smith, B. Smalley, R. A. Street, S. Udry","The sub-Jupiter mass transiting exoplanet WASP-11b","Submitted to A&A on 17-Sep-2008",,"10.1051/0004-6361/200810973",,"astro-ph","http://arxiv.org/licenses/nonexclusive-distrib/1.0/","  We report the discovery of a sub-Jupiter mass exoplanet transiting a
magnitude V=11.7 host star 1SWASP J030928.54+304024.7. A simultaneous fit to
the transit photometry and radial-velocity measurements yield a planet mass
M_p=0.53+-0.07M_J, radius R_p=0.91^{+0.06}_{-0.03}R_J and an orbital period of
3.722465^{+0.000006}_{-0.000008} days. The host star is of spectral type K3V,
with a spectral analysis yielding an effective temperature of 4800+-100K and
log g=4.45+-0.2. It is amongst the smallest, least massive and lowest
luminosity stars known to harbour a transiting exoplanet. WASP-11b is the third
least strongly irradiated transiting exoplanet discovered to date, experiencing
an incident flux F_p=1.9x10^8 erg s^{-1} cm^{-2} and having an equilibrium
temperature T_eq=960+-70K.
","[{""version"":""v1"",""created"":""Fri, 26 Sep 2008 11:10:12 GMT""}]","2015-05-13"
"0809.4598","Dumitru Ghilencea","I. Antoniadis, E. Dudas, D. M. Ghilencea, P. Tziveloglou","Higher Dimensional Operators in the MSSM","Contribution to the proceedings of the ""Susy 2008"" conference; (6
  pages)","AIP Conf.Proc.1078:175-180,2009","10.1063/1.3051901",,"hep-ph","http://arxiv.org/licenses/nonexclusive-distrib/1.0/","  The origin and the implications of higher dimensional effective operators in
4-dimensional theories are discussed in non-supersymmetric and supersymmetric
cases. Particular attention is paid to the role of general,
derivative-dependent field redefinitions which one can employ to obtain a
simpler form of the effective Lagrangian. An application is provided for the
Minimal Supersymmetric Standard Model extended with dimension-five R-parity
conserving operators, to identify the minimal irreducible set of such operators
after supersymmetry breaking. Among the physical consequences of this set of
operators are the presence of corrections to the MSSM Higgs sector and the
generation of ""wrong""-Higgs Yukawa couplings and fermion-fermion-scalar-scalar
interactions. These couplings have implications for supersymmetry searches at
the LHC.
","[{""version"":""v1"",""created"":""Fri, 26 Sep 2008 11:19:42 GMT""}]","2010-04-21"
"0809.4599","Alexei Ryabov B","A.B. Ryabov and B. Blasius","Population growth and persistence in a heterogeneous environment: the
  role of diffusion and advection","Introductory review of simple conceptual models. 45 pages, 15 figures
  v2: minor changes","Math. Model. Nat. Phenom. Vol.3, 2008, pp.42-86",,,"q-bio.PE","http://arxiv.org/licenses/nonexclusive-distrib/1.0/","  The spatio-temporal dynamics of a population present one of the most
fascinating aspects and challenges for ecological modelling. In this article we
review some simple mathematical models, based on one dimensional
reaction-diffusion-advection equations, for the growth of a population on a
heterogeneous habitat. Considering a number of models of increasing complexity
we investigate the often contrary roles of advection and diffusion for the
persistence of the population. When it is possible we demonstrate basic
mathematical techniques and give the critical conditions providing the survival
of a population, in simple systems and in more complex resource-consumer models
which describe the dynamics of phytoplankton in a water column.
","[{""version"":""v1"",""created"":""Fri, 26 Sep 2008 11:21:12 GMT""},{""version"":""v2"",""created"":""Tue, 18 Nov 2008 17:12:08 GMT""}]","2008-11-18"
"0809.4600","Paola Gori-Giorgi","Paola Gori-Giorgi and Andreas Savin","Range separation combined with the Overhauser model: Application to the
  H$_2$ molecule along the dissociation curve","submitted to Int. J. Quantum Chem., special issue dedicated to Prof.
  Hirao","Int. J. Quantum Chem. 109, 1950 (2009)","10.1002/qua.22034",,"cond-mat.other physics.chem-ph","http://arxiv.org/licenses/nonexclusive-distrib/1.0/","  The combination of density-functional theory with other approaches to the
many-electron problem through the separation of the electron-electron
interaction into a short-range and a long-range contribution (range separation)
is a successful strategy, which is raising more and more interest in recent
years. We focus here on a range-separated method in which only the short-range
correlation energy needs to be approximated, and we model it within the
""extended Overhauser approach"". We consider the paradigmatic case of the H$_2$
molecule along the dissociation curve, finding encouraging results. By means of
very accurate variational wavefunctions, we also study how the effective
electron-electron interaction appearing in the Overhauser model should be in
order to yield the exact correlation energy for standard Kohn-Sham density
functional theory.
","[{""version"":""v1"",""created"":""Fri, 26 Sep 2008 11:30:05 GMT""}]","2015-05-13"
"0809.4601","Holger Dette","Holger Dette, Bettina Reuther","Random block matrices and matrix orthogonal polynomials","25 pages, 5 figures",,,,"math.PR","http://arxiv.org/licenses/nonexclusive-distrib/1.0/","  In this paper we consider random block matrices, which generalize the general
beta ensembles, which were recently investigated by Dumitriu and Edelmann
(2002, 2005). We demonstrate that the eigenvalues of these random matrices can
be uniformly approximated by roots of matrix orthogonal polynomials which were
investigated independently from the random matrix literature. As a consequence
we derive the asymptotic spectral distribution of these matrices. The limit
distribution has a density, which can be represented as the trace of an
integral of densities of matrix measures corresponding to the Chebyshev matrix
polynomials of the first kind. Our results establish a new relation between the
theory of random block matrices and the field of matrix orthogonal polynomials,
which have not been explored so far in the literature.
","[{""version"":""v1"",""created"":""Fri, 26 Sep 2008 11:33:38 GMT""}]","2008-09-29"
"0809.4602","Yashwant Singh Prof.","Shikha Srivastava and Yashwant Singh","Dynamics of a bubble formed in double stranded DNA","11 pages, 4 figures. submitted to Phys. Rev. Lett","Europhys. Lett. 85,38001 (2009)","10.1209/0295-5075/85/38001",,"cond-mat.soft cond-mat.stat-mech","http://arxiv.org/licenses/nonexclusive-distrib/1.0/","  We study the fluctuational dynamics of a tagged base-pair in double stranded
DNA. We calculate the drift force which acts on the tagged base-pair using a
potential model that describes interactions at base pairs level and use it to
construct a Fokker-Planck equation.The calculated displacement autocorrelation
function is found to be in very good agreement with the experimental result of
Altan-Bonnet {\it et. al.} Phys. Rev. Lett. {\bf 90}, 138101 (2003) over the
entire time range of measurement. We calculate the most probable displacements
which predominately contribute to the autocorrelation function and the
half-time history of these displacements.
","[{""version"":""v1"",""created"":""Fri, 26 Sep 2008 11:38:12 GMT""}]","2011-06-28"
"0809.4603","Payal Kaura","Payal Kaura, Bindusar Sahoo","Boundary S-matrix in a (2,0) theory of AdS_{3} Supergravity","0+36 pages, latex, V2: substantial changes in abstract, introduction.
  Section 4 and section 5 swapped. Argument in section 4 (current version)
  extended. Discussion added. Some more references added","JHEP0812:002,2008","10.1088/1126-6708/2008/12/002",,"hep-th gr-qc","http://arxiv.org/licenses/nonexclusive-distrib/1.0/","  We will discuss two inequivalent generalizations of the standard (2,0)
supergravity action gr-qc/9501018 to include gravitational Chern-Simons term.
One is in the first order formalism where we treat \omega_{M}^{ab} as
independent and the other is in the second order formalism where
\omega_{M}^{ab} is determined in terms of other fields via a standard
constraint equation. The two theories have different equations of motion and
the solutions to the equations of motion of the first order theory spans only a
subset of those of the second order theory. We will be interested in computing
the boundary S-matrix, describing correlation functions in a dual conformal
field theory, in this sector and hence we use the equations of motion coming
out of the first order theory. We restrict ourselves to the gauge+fermionic
sector of the theory to compute the boundary S-matrix. We will also look at the
effect of higher derivative terms on the boundary S-matrix obtained using the
standard supergravity action.
","[{""version"":""v1"",""created"":""Fri, 26 Sep 2008 11:46:44 GMT""},{""version"":""v2"",""created"":""Tue, 7 Oct 2008 17:38:55 GMT""}]","2008-12-18"
"0809.4604","Matthias Lutz F.M.","C.L. Korpa, M.F.M. Lutz and F. Riek","Covariant and self consistent vertex corrections for pions and isobars
  in nuclear matter","21 pages, 8 figures","Phys.Rev.C80:024901,2009","10.1103/PhysRevC.80.024901",,"nucl-th","http://arxiv.org/licenses/nonexclusive-distrib/1.0/","  We evaluate the pion and isobar propagators in cold nuclear matter self
consistently applying a covariant form of the isobar-hole model. Migdal's
vertex correction effects are considered systematically in the absence of
phenomenological soft form factors. Saturated nuclear matter is modeled by
scalar and vector mean fields for the nucleon. It is shown that the short-range
dressing of the pi N Delta vertex has a significant effect on the pion and
isobar properties. Using realistic parameters sets we predict a downward shift
of about 50 MeV for the Delta resonance at nuclear saturation density. The
pionic soft modes are much less pronounced than in previous studies.
","[{""version"":""v1"",""created"":""Fri, 26 Sep 2008 12:48:47 GMT""}]","2009-08-20"
"0809.4605","Hans-Juergen Hagen","D. Reimers, H.-J. Hagen, R. Baade, K. Braun","The Antares emission nebula and mass loss of alpha Sco A","11 pages, 9 postscript figures accepted for A&A",,"10.1051/0004-6361:200809983",,"astro-ph","http://arxiv.org/licenses/nonexclusive-distrib/1.0/","  The Antares nebula is a peculiar emission nebula seen in numerous Fe II lines
and in radio free-free emission, probably associated with the H II region
caused by alpha Sco B in the wind of alpha Sco A. High-resolution spectra with
spatial resolution were used to study the emission line spectrum, the physical
nature of the nebula and to determine the mass-loss rate of the M supergiant
alpha Sco A.
","[{""version"":""v1"",""created"":""Fri, 26 Sep 2008 12:20:06 GMT""}]","2009-11-13"
"0809.4606","Roman Scoccimarro","Sebastian Pueblas and Roman Scoccimarro","Generation of Vorticity and Velocity Dispersion by Orbit Crossing","27 pages, 14 figures. v2: reorganization of the material, new
  appendix. Accepted by PRD","Phys.Rev.D80:043504,2009","10.1103/PhysRevD.80.043504",,"astro-ph","http://arxiv.org/licenses/nonexclusive-distrib/1.0/","  We study the generation of vorticity and velocity dispersion by orbit
crossing using cosmological numerical simulations, and calculate the
backreaction of these effects on the evolution of large-scale density and
velocity divergence power spectra. We use Delaunay tessellations to define the
velocity field, showing that the power spectra of velocity divergence and
vorticity measured in this way are unbiased and have better noise properties
than for standard interpolation methods that deal with mass weighted
velocities. We show that high resolution simulations are required to recover
the correct large-scale vorticity power spectrum, while poor resolution can
spuriously amplify its amplitude by more than one order of magnitude. We
measure the scalar and vector modes of the stress tensor induced by orbit
crossing using an adaptive technique, showing that its vector modes lead, when
input into the vorticity evolution equation, to the same vorticity power
spectrum obtained from the Delaunay method. We incorporate orbit crossing
corrections to the evolution of large scale density and velocity fields in
perturbation theory by using the measured stress tensor modes. We find that at
large scales (k~0.1 h/Mpc) vector modes have very little effect in the density
power spectrum, while scalar modes (velocity dispersion) can induce percent
level corrections at z=0, particularly in the velocity divergence power
spectrum. In addition, we show that the velocity power spectrum is smaller than
predicted by linear theory until well into the nonlinear regime, with little
contribution from virial velocities.
","[{""version"":""v1"",""created"":""Fri, 26 Sep 2008 12:21:51 GMT""},{""version"":""v2"",""created"":""Tue, 28 Jul 2009 21:47:31 GMT""}]","2009-09-02"
"0809.4607","Nabakumar Bera Mr.","Nabakumar Bera, Kamal Bhattacharyya, Jayanta K. Bhattacharjee","Perturbative and non-perturbative studies with the delta function
  potential","19 pages, 2 tables","Am. J. Phys. 76(3), March 2008, 250-257","10.1119/1.2830531",,"quant-ph","http://arxiv.org/licenses/nonexclusive-distrib/1.0/","  We show that the delta function potential can be exploited along with
perturbation theory to yield the result of certain infinite series. The idea is
that any exactly soluble potential if coupled with a delta function potential
remains exactly soluble. We use the strength of the delta function as an
expansion parameter and express the second-order energy shift as an infinite
sum in perturbation theory. The analytical solution is used to determine the
second-order energy shift and hence the sum of an infinite series. By an
appropriate choice of the unperturbed system, we can show the importance of the
continuum in the energy shift of bound states.
","[{""version"":""v1"",""created"":""Fri, 26 Sep 2008 12:28:23 GMT""}]","2009-11-13"
"0809.4608","Matthias Lutz F.M.","F. Riek, M.F.M. Lutz and C.L. Korpa","Photoabsorption off nuclei with self consistent vertex corrections","10 pages, 6 figures","Phys.Rev.C80:024902,2009","10.1103/PhysRevC.80.024902",,"nucl-th","http://arxiv.org/licenses/nonexclusive-distrib/1.0/","  We study photoproduction off nuclei based on a self consistent and covariant
many body approach for the pion and isobar propagation in infinite nuclear
matter. For the first time the t-channel exchange of an in-medium pion is
evaluated in the presence of vertex correction effects consistently. In
particular the interference pattern with the s-channel in-medium nucleon and
isobar exchange contribution is considered. Electromagnetic gauge invariance is
kept as a consequence of various Ward identities obeyed by the computation.
Adjusting the set of Migdal parameters to the data set we predict an attractive
mass shift for the isobar of about 50 MeV at nuclear saturation density.
","[{""version"":""v1"",""created"":""Fri, 26 Sep 2008 12:59:12 GMT""}]","2009-08-21"
"0809.4609","David Martin de Diego","Juan Carlos Marrero, David Martin de Diego and Diana Sosa","Variational Constrained Mechanics on Lie Affgebroids","23 pages",,,,"math-ph math.MP","http://arxiv.org/licenses/nonexclusive-distrib/1.0/","  In this paper we discuss variational constrained mechanics (vakonomic
mechanics) on Lie affgebroids. We obtain the dynamical equations and the
aff-Poisson bracket associated with a vakonomic system on a Lie affgebroid
${\mathcal A}$. We devote special attention to the particular case when the
nonholonomic constraints are given by an affine subbundle of ${\mathcal A}$ and
we discuss the variational character of the theory. Finally, we apply the
results obtained to several examples.
","[{""version"":""v1"",""created"":""Fri, 26 Sep 2008 12:35:26 GMT""}]","2008-09-29"
"0809.4610","Marija Mitrovic","Mitrovic Marija and Bosiljka Tadic","Search of Weighted Subgraphs on Complex Networks with Maximum Likelihood
  Methods",,,,,"physics.soc-ph cond-mat.stat-mech","http://arxiv.org/licenses/nonexclusive-distrib/1.0/","  Real-data networks often appear to have strong modularity, or
network-of-networks structure, in which subgraphs of various size and
consistency occur. Finding the respective subgraph structure is of great
importance, in particular for understanding the dynamics on these networks.
Here we study modular networks using generalized method of maximum likelihood.
We first demonstrate how the method works on computer-generated networks with
the subgraphs of controlled connection strengths and clustering. We then
implement the algorithm which is based on weights of links and show its
efficiency in finding weighted subgraphs on fully connected graph and on
real-data network of yeast.
","[{""version"":""v1"",""created"":""Fri, 26 Sep 2008 12:46:18 GMT""}]","2008-09-29"
"0809.4611","Kayoomars Karami","K. Karami and M. Barin","The effects of twisted magnetic field on coronal loops oscillations and
  dissipation","13 pages, 11 figures","Mon. Not. R. Astron. Soc. 394, 521--526 (2009)","10.1111/j.1365-2966.2008.14360.x",,"astro-ph","http://arxiv.org/licenses/nonexclusive-distrib/1.0/","  The standing MHD modes in a zero-$\beta$ cylindrical magnetic flux tube
modelled as a straight core surrounded by a magnetically twisted annulus, both
embedded in a straight ambient external field is considered. The dispersion
relation for the fast MHD waves is derived and solved numerically to obtain the
frequencies of both the kink ($m=1$), and fluting ($m=2,3$) waves. Damping
rates due to both viscous and resistive dissipations in presence of the twisted
magnetic field is derived and solved numerically for both the kink and fluting
waves.
","[{""version"":""v1"",""created"":""Fri, 26 Sep 2008 12:49:29 GMT""}]","2009-11-13"
"0809.4612","Laurent Mazet","Laurent Mazet","Optimal length estimates for stable CMC surfaces in 3-space forms","7 pages",,,,"math.DG","http://arxiv.org/licenses/nonexclusive-distrib/1.0/","  In this paper, we study stable constant mean curvature $H$ surfaces in
$\R^3$. We prove that, in such a surface, the distance from a point to the
boundary is less that $\pi/(2H)$. This upper-bound is optimal and is extended
to stable constant mean curvature surfaces in space forms.
","[{""version"":""v1"",""created"":""Fri, 26 Sep 2008 12:56:34 GMT""}]","2008-09-29"
"0809.4613","Boris Kopeliovich","B.Z. Kopeliovich, H.-J. Pirner, I.K. Potashnikova, Ivan Schmidt, A.V.
  Tarasov, O.O. Voskresenskaya","Quantum-mechanical description of in-medium fragmentation","20 pages, 7 figures","Phys.Rev.C78:055204,2008","10.1103/PhysRevC.78.055204",,"hep-ph","http://arxiv.org/licenses/nonexclusive-distrib/1.0/","  We present a quantum-mechanical description of quark-hadron fragmentation in
a nuclear environment. It employs the path-integral formulation of quantum
mechanics, which takes care of all phases and interferences, and which contains
all relevant time scales, like production, coherence, formation, etc. The cross
section includes the probability of pre-hadron (colorless dipole) production
both inside and outside the medium. Moreover, it also includes inside-outside
production, which is a typical quantum-mechanical interference effect (like
twin-slit electron propagation). We observe a substantial suppression caused by
the medium, even if the pre-hadron is produced outside the medium and no energy
loss is involved. This important source of suppression is missed in the usual
energy-loss scenario interpreting the effect of jet quenching observed in heavy
ion collisions. This may be one of the reasons of a too large gluon density,
reported by such analyzes.
","[{""version"":""v1"",""created"":""Fri, 26 Sep 2008 13:26:05 GMT""},{""version"":""v2"",""created"":""Sat, 27 Sep 2008 18:16:15 GMT""}]","2010-04-21"
"0809.4614","Luigi Coraggio","A. Covello, L. Coraggio, A. Gargano, and N. Itaco","Realistic shell model; 132Sn region; 208Pb region","6 pages, 4 figures, talk presented at ""Nuclear Physics and
  Astrophyisics: From Stable Beams to Exotic Nuclei"", June 25-30, 2008,
  Cappadocia, Turkey",,,,"nucl-th","http://arxiv.org/licenses/nonexclusive-distrib/1.0/","  We report on a study of exotic nuclei around doubly magic 132Sn in terms of
the shell model employing a realistic effective interaction derived from the
CD-Bonn nucleon-nucleon potential. The short-range repulsion of the latter is
renormalized by constructing a smooth low-momentum potential, V-low-k, that is
used directly as input for the calculation of the effective interaction. In
this paper, we focus attention on proton-neutron multiplets in the odd-odd
nuclei 134Sb, 136Sb. We show that the behavior of these multiplets is quite
similar to that of the analogous multiplets in the counterpart nuclei in the
208Pb region, 210Bi and 212Bi.
","[{""version"":""v1"",""created"":""Fri, 26 Sep 2008 13:02:30 GMT""}]","2008-09-29"
"0809.4615","Michele Tumminello","M. Tumminello, F. Lillo, R.N. Mantegna","Correlation, hierarchies, and networks in financial markets","37 pages, 9 figures, 3 tables","J. Econ. Behav. Organ. 75, pp. 40-58 (2010)","10.1016/j.jebo.2010.01.004",,"q-fin.ST physics.data-an physics.soc-ph q-fin.PM","http://arxiv.org/licenses/nonexclusive-distrib/1.0/","  We discuss some methods to quantitatively investigate the properties of
correlation matrices. Correlation matrices play an important role in portfolio
optimization and in several other quantitative descriptions of asset price
dynamics in financial markets. Specifically, we discuss how to define and
obtain hierarchical trees, correlation based trees and networks from a
correlation matrix. The hierarchical clustering and other procedures performed
on the correlation matrix to detect statistically reliable aspects of the
correlation matrix are seen as filtering procedures of the correlation matrix.
We also discuss a method to associate a hierarchically nested factor model to a
hierarchical tree obtained from a correlation matrix. The information retained
in filtering procedures and its stability with respect to statistical
fluctuations is quantified by using the Kullback-Leibler distance.
","[{""version"":""v1"",""created"":""Fri, 26 Sep 2008 13:03:14 GMT""}]","2010-08-25"
"0809.4616","Renato Moreira Angelo","R. M. Angelo","Low-resolution measurements induced classicality","12 pages, 2 figures",,,,"quant-ph","http://arxiv.org/licenses/nonexclusive-distrib/1.0/","  The classical limit of quantum mechanics is discussed for closed quantum
systems in terms of observational aspects. Initially, the failure of the limit
h->0 is explicitly demonstrated in a model of two quantum mechanically
interacting oscillators by showing that neither quantum expectations reduce to
Newtonian trajectories nor entanglement vanishes. This result suggests that the
quantum-to-classical transition occurs only at an approximative level, which is
regulated by the low accuracy of the measurements. In order to verify the
consistence of these ideas we take into account the experimental resolution of
physical measurements by introducing a discretized formulation for the quantum
structure of wave functions. As a result, in the low-resolution limit the
quasi-determinism is recovered and hence the quantum-to-classical transition is
shown to occur adequately. Other puzzling problems, such as the classical limit
of quantum superpositions and nonlocal correlations, are naturally address as
well.
","[{""version"":""v1"",""created"":""Fri, 26 Sep 2008 13:16:01 GMT""}]","2008-09-29"
"0809.4617","Bo Jakobsen","Bo Jakobsen, Niels Boye Olsen, and Tage Christensen","Frequency Dependent Specific Heat from Thermal Effusion in Spherical
  Geometry","17 pages, 15 figures, Substantially revised version","Physical Review E, 81, 061505, 2010","10.1103/PhysRevE.81.061505",,"cond-mat.soft","http://arxiv.org/licenses/nonexclusive-distrib/1.0/","  We present a novel method of measuring the frequency dependent specific heat
at the glass transition applied to 5-polyphenyl-4-ether. The method employs
thermal waves effusing radially out from the surface of a spherical thermistor
that acts as both a heat generator and thermometer. It is a merit of the method
compared to planar effusion methods that the influence of the mechanical
boundary conditions are analytically known. This implies that it is the
longitudinal rather than the isobaric specific heat that is measured. As
another merit the thermal conductivity and specific heat can be found
independently. The method has highest sensitivity at a frequency where the
thermal diffusion length is comparable to the radius of the heat generator.
This limits in practise the frequency range to 2-3 decades. An account of the
3omega-technique used including higher order terms in the temperature
dependency of the thermistor and in the power generated is furthermore given.
","[{""version"":""v1"",""created"":""Fri, 26 Sep 2008 13:07:47 GMT""},{""version"":""v2"",""created"":""Thu, 11 Mar 2010 13:48:19 GMT""}]","2010-06-30"
