"0809.4557","Karim Kellay","Omar El-Fallah, Karim Kellay (LATP), Thomas Ransford","On the Brown--Shields conjecture for cyclicity in the Dirichlet space",,,,,"math.CV math.FA","http://arxiv.org/licenses/nonexclusive-distrib/1.0/","  Let $\cD$ be the Dirichlet space, namely the space of holomorphic functions
on the unit disk whose derivative is square-integrable. We establish a new
sufficient condition for a function $f\in\cD$ to be {\em cyclic}, i.e. for
$\{pf: p\text{a polynomial}\}$ to be dense in $\cD$. This allows us to prove a
special case of the conjecture of Brown and Shields that a function is cyclic
in $\cD$ iff it is outer and its zero set (defined appropriately) is of
capacity zero.
","[{""version"":""v1"",""created"":""Fri, 26 Sep 2008 08:25:27 GMT""}]","2008-09-29"
"0809.4558","Bazanfare Mahaman","Bazanfare Mahaman (IRMAR, Universit\'E Abdou Moumouni)","Topology of Manifolds with Asymptotically Nonnegative Ricci Curvature","8 pages",,,,"math.DG","http://arxiv.org/licenses/nonexclusive-distrib/1.0/","  In this paper, we study the topology of complete noncompact Riemannian
manifolds with asymptotically nonnegative Ricci curvature. We show that a
complete noncompact manifold with asymptoticaly nonnegative Ricci curvature and
sectional curvature decay at most quadratically is diffeomorphic to a Euclidean
n-space R^n under some conditions on the density of rays starting from the base
point p or on the volume growth of geodesic balls in M.
","[{""version"":""v1"",""created"":""Fri, 26 Sep 2008 08:26:35 GMT""}]","2008-09-29"
"0809.4559","Cristodor Ionescu","Cristodor Ionescu","A note on smoothness and differential bases in positive characteristic","6 pages",,,,"math.AC","http://arxiv.org/licenses/nonexclusive-distrib/1.0/","  Let $u:A\to B$ be a morphism of noetherian local rings. We obtain smoothness
criteria for algebras with differential bases, in the case of rings containing
a field of characteristic $p>0.$ We also give smoothness criteria for reduced
morphisms.
","[{""version"":""v1"",""created"":""Fri, 26 Sep 2008 08:30:38 GMT""},{""version"":""v2"",""created"":""Tue, 19 May 2009 16:01:10 GMT""}]","2009-05-19"
"0809.4560","Enkelejd Hashorva","Enkelejd Hashorva","Boundary non-crossings of Brownian pillow","14 pages",,"10.1007/s10959-008-0191-5",,"math.PR math.ST stat.TH","http://arxiv.org/licenses/nonexclusive-distrib/1.0/","  Let B_0(s,t) be a Brownian pillow with continuous sample paths, and let
h,u:[0,1]^2\to R be two measurable functions. In this paper we derive upper and
lower bounds for the boundary non-crossing probability
\psi(u;h):=P{B_0(s,t)+h(s,t) \le u(s,t), \forall s,t\in [0,1]}. Further we
investigate the asymptotic behaviour of $\psi(u;\gamma h)$ with $\gamma$
tending to infinity, and solve a related minimisation problem.
","[{""version"":""v1"",""created"":""Fri, 26 Sep 2008 08:35:39 GMT""}]","2013-05-14"
"0809.4561","Hirotaka Tamanoi","Hirotaka Tamanoi","Stable string operations are trivial","33 pages, 3 figures",,,,"math.AT","http://arxiv.org/licenses/nonexclusive-distrib/1.0/","  We show that in closed string topology and in open-closed string topology
with one $D$-brane, higher genus stable string operations are trivial. This is
a consequence of Harer's stability theorem and related stability results on the
homology of mapping class groups of surfaces with boundaries. In fact, this
vanishing result is a special case of a general result which applies to all
homological conformal field theories with a property that in the associated
topological quantum field theories, the string operations associated to genus
one cobordisms with one or two boundaries vanish. In closed string topology,
the base manifold can be either finite dimensional, or infinite dimensional
with finite dimensional cohomology for its based loop space. The above
vanishing result is based on the triviality of string operations associated to
homology classes of mapping class groups which are in the image of stabilizing
maps.
","[{""version"":""v1"",""created"":""Fri, 26 Sep 2008 08:42:42 GMT""}]","2008-09-29"
"0809.4562","Christiane Helling","Christiane Helling","Cloud formation in substellar atmospheres","10 pages, 4 figures, 2 tables. to appear as review proceeding to
  ""Cools Stars, Stellar Systems and the Sun"", 15th Cambridge Workshop",,"10.1063/1.3099087",,"astro-ph astro-ph.EP astro-ph.SR","http://arxiv.org/licenses/nonexclusive-distrib/1.0/","  Clouds seem like an every-day experience. But -- do we know how clouds form
on brown dwarfs and extra-solar planets? How do they look like? Can we see
them? What are they composed of? Cloud formation is an old-fashioned but still
outstanding problem for the Earth atmosphere, and it has turned into a
challenge for the modelling of brown dwarf and exo-planetary atmospheres. Cloud
formation imposes strong feedbacks on the atmospheric structure, not only due
to the clouds own opacity, but also due to the depletion of the gas phase,
possibly leaving behind a dynamic and still supersaturated atmosphere. I
summarise the different approaches taken to model cloud formation in substellar
atmospheres and workout their differences. Focusing on the
phase-non-equilibrium approach to cloud formation, I demonstrate the inside we
gain from detailed micro-physical modelling on for instance the material
composition and grain size distribution inside the cloud layer on a Brown Dwarf
atmosphere. A comparison study on four different cloud approaches in Brown
Dwarf atmosphere simulations demonstrates possible uncertainties in
interpretation of observational data.
","[{""version"":""v1"",""created"":""Fri, 26 Sep 2008 09:12:13 GMT""}]","2014-11-17"
"0809.4563","Adriano Di  Giacomo","A. Di Giacomo, L. Lepori, F. Pucci","Monopoles and the 't Hooft tensor for generic gauge group","3 pages. Poster presented at the International Conference on High
  Energy Physics ICHEP08. To appear in the Proceedings",,,"IFUP-TH / 2008-30","hep-lat","http://arxiv.org/licenses/nonexclusive-distrib/1.0/","  We study monopoles and corresponding 't Hooft tensor in a generic gauge
theory. This issue is relevant to the understanding of color confinement.
","[{""version"":""v1"",""created"":""Fri, 26 Sep 2008 08:50:08 GMT""}]","2008-09-29"
"0809.4564","Julien Morin","J. Morin, J.-F. Donati, X. Delfosse, T. Forveille, M. M. Jardine","Large-scale magnetic topologies of M dwarfs","6 pages, proceedings of Cool Stars 15, St Andrews, July 2008, to be
  published in the Conference Proceedings Series of the AIP","AIP Conf. Proc.1094:140-145, 2009","10.1063/1.3099084",,"astro-ph","http://arxiv.org/licenses/nonexclusive-distrib/1.0/","  We present here the first results of a spectropolarimetric analysis of a
small sample (about 20) of active stars ranging from spectral type M0 to M8,
which are either fully-convective or possess a very small radiative core. This
study aims at providing new constraints on dynamo processes in fully-convective
stars.
  Results for stars with spectral types M0-M4 -- i.e. with masses above or just
below the full convection threshold (about 0.35Msun) -- are presented.
Tomographic imaging techniques allow us to reconstruct the surface magnetic
topologies from the rotationally modulated time-series of circularly polarised
profiles.
  We find strong differences between partly and fully convective stars
concerning magnetic field topology and characteristic scales, and differential
rotation. Our results suggest that magnetic field generation in fully
convective stars relies on different dynamo processes than those acting in the
Sun and other partly convective stars, in agreement with theoretical
expectations.
","[{""version"":""v1"",""created"":""Fri, 26 Sep 2008 08:52:25 GMT""}]","2014-11-18"
"0809.4565","Sandeep Sirothia","S. K. Sirothia, D. J. Saikia, C. H. Ishwara-Chandra and N. G.
  Kantharia (National Centre for Radio Astrophysics-TATA Institute of
  Fundamental Research, Pune)","Deep low-frequency observations with the Giant Metrewave Radio
  Telescope: a search for relic radio emission","7 figures and 2 tables, accepted for publication in MNRAS",,"10.1111/j.1365-2966.2008.14015.x",,"astro-ph","http://arxiv.org/licenses/nonexclusive-distrib/1.0/","  We present deep multifrequency observations using the Giant Metrewave Radio
Telescope at 153, 244, 610 and 1260 MHz of a field centered on J0916+6348, to
search for evidence of fossil radio lobes which could be due to an earlier
cycle of episodic activity of the parent galaxy, as well as halos and relics in
clusters of galaxies. We do not find any unambiguous evidence of episodic
activity in a list of 374 sources, suggesting that such activity is rare even
in relatively deep low-frequency observations. We examine the spectra of all
the sources by combining our observations with those from the Westerbork
Northern Sky Survey, NRAO VLA Sky Survey and the Faint Images of the Radio Sky
at Twenty-centimeters survey. Considering only those which have measurements at
a minimum of three different frequencies, we find that almost all sources are
consistent with a straight spectrum with a median spectral index,
$\alpha\sim$0.8 (S$(\nu)\propto\nu^{-\alpha}$), which appears steeper than
theoretical expectations of the injection spectral index. We identify 14 very
steep-spectrum sources with $\alpha\geq$1.3. We examine their optical fields
and discuss the nature of some of these sources.
","[{""version"":""v1"",""created"":""Fri, 26 Sep 2008 09:46:49 GMT""}]","2009-11-13"
"0809.4566","Peter Renton","Peter Renton","Global Electroweak Fits and the Higgs Boson Mass","ICHEP08",,,,"hep-ph","http://arxiv.org/licenses/nonexclusive-distrib/1.0/","  The current electroweak data and the constraints on the Higgs mass are
discussed. Within the context of the Standard Model the data prefer a
relatively light Higgs mass.
","[{""version"":""v1"",""created"":""Fri, 26 Sep 2008 09:06:33 GMT""}]","2008-09-29"
"0809.4567","Lo\""ic Markley","Lo\""ic Markley, George V. Eleftheriades","Two-dimensional subwavelength focusing using a slotted meta-screen","3 pages, 4 figures",,,,"physics.optics","http://arxiv.org/licenses/nonexclusive-distrib/1.0/","  A transmission screen with subwavelength slots is described which can focus
electromagnetic radiation to a two-dimensional subwavelength spot. Unlike
negative-refractive-index focusing implementations, this ""meta-screen"" does not
suffer from image degradation when losses are introduced and is easily scalable
from microwave to Terahertz frequencies and beyond. The slotted geometry is
designed using a theory of shifted beams to determine the necessary weighting
factors for each slot element, which are then converted to appropriate slot
dimensions. The screen was designed using a pair of rotated orthogonal focusing
axes to produce a spot on a focal plane located 0.25 \lambda away. Full-wave
simulations are corroborated by experimental measurements at 10 GHz reporting a
full-width half-maximum beam width of 0.27 \lambda along the x-axis and 0.38
\lambda along the z-axis.
","[{""version"":""v1"",""created"":""Fri, 26 Sep 2008 09:10:48 GMT""}]","2008-09-29"
"0809.4568","Yoshiro Nohara","S. Kobayashi, Y. Nohara, S. Yamamoto, and T. Fujiwara","GW approximation with LSDA+U method and applications to NiO, MnO, and
  V$_2$O$_3$","To appear in Phys. Rev. B","Phys. Rev. B 78, 155112 (2008)","10.1103/PhysRevB.78.155112",,"cond-mat.str-el","http://arxiv.org/licenses/nonexclusive-distrib/1.0/","  A GW approximation (GWA) method named U+GWA is proposed, where we can start
GWA with more localized wave functions obtained by the local spin-density
approximation (LSDA)+U method. Then GWA and U+GWA are applied to MnO, NiO, and
V$_2$O$_3$ in antiferromagnetic phase. The band gaps and energy spectra show an
excellent agreement with the experimentally observed results and are discussed
in details. The calculated width of d-bands of V$_2$O$_3$ is much narrower than
that of the observed one which may be a mixture of t$_{2g}^2$ multiplet and
single electron t$_{2g}$ level. GWA or U+GWA does not work also in the
paramagnetic phase of V$_2$O$_3$ and the reason for thois is clarified. The
method of the unique choice of on-site Coulomb interaction is discussed in
details. The criterion for whether we should adopt GWA or U+GWA is discussed
and is assessed with the help of the off-diagonal elements of the self-energy.
","[{""version"":""v1"",""created"":""Fri, 26 Sep 2008 09:14:23 GMT""},{""version"":""v2"",""created"":""Sat, 27 Sep 2008 04:46:29 GMT""}]","2008-10-18"
"0809.4569","L. G. Suttorp","L.G. Suttorp","Sum rules for correlation functions of ionic mixtures in arbitrary
  dimension $d\geq 2$","19 pages","Journal of Physics A 41 (2008)495001","10.1088/1751-8113/41/49/495001","ITFA-2008-37","cond-mat.stat-mech","http://arxiv.org/licenses/nonexclusive-distrib/1.0/","  The correlations in classical multi-component ionic mixtures with spatial
dimension $d\geq 2$ are studied by using a restricted grand-canonical ensemble
and the associated hierarchy equations for the correlation functions. Sum rules
for the first few moments of the two-particle correlation function are derived
and their dependence on $d$ is established. By varying $d$ continuously near
$d=2$ it is shown how the sum rules for the two-dimensional mixture are related
to those for mixtures at higher $d$.
","[{""version"":""v1"",""created"":""Fri, 26 Sep 2008 09:17:55 GMT""},{""version"":""v2"",""created"":""Tue, 4 Nov 2008 09:43:23 GMT""}]","2009-11-13"
"0809.4570","Sonia Bentes","Sonia R. Bentes, Rui Menezes, Diana A. Mendes","Stock market volatility: An approach based on Tsallis entropy","15 pages, 2 figures, 2 tables, presented at SigmaPhi2008 Conference",,,,"q-fin.ST physics.soc-ph","http://arxiv.org/licenses/nonexclusive-distrib/1.0/","  One of the major issues studied in finance that has always intrigued, both
scholars and practitioners, and to which no unified theory has yet been
discovered, is the reason why prices move over time. Since there are several
well-known traditional techniques in the literature to measure stock market
volatility, a central point in this debate that constitutes the actual scope of
this paper is to compare this common approach in which we discuss such popular
techniques as the standard deviation and an innovative methodology based on
Econophysics. In our study, we use the concept of Tsallis entropy to capture
the nature of volatility. More precisely, what we want to find out is if
Tsallis entropy is able to detect volatility in stock market indexes and to
compare its values with the ones obtained from the standard deviation. Also, we
shall mention that one of the advantages of this new methodology is its ability
to capture nonlinear dynamics. For our purpose, we shall basically focus on the
behaviour of stock market indexes and consider the CAC 40, MIB 30, NIKKEI 225,
PSI 20, IBEX 35, FTSE 100 and SP 500 for a comparative analysis between the
approaches mentioned above.
","[{""version"":""v1"",""created"":""Fri, 26 Sep 2008 09:19:13 GMT""}]","2008-12-02"
"0809.4571","Irina Markina","Ovidiu Calin, Der-Chen Chang, Irina Markina","SubRiemannian geometry on the sphere $\mathbb{S}^3$",,,,,"math.DG","http://arxiv.org/licenses/nonexclusive-distrib/1.0/","  The present paper starts with an introduction to quaternions and then defines
the 3-dimmensional sphere as the set of quaternions of length one. The
quaternion group induces on $\mathbb{S}^3$ a structure of noncommutative Lie
group. This group is compact and the results obtained in this case are very
different than those obtained in the case of the Heisenberg group, which is a
noncompact Lie group. Like in the Heisenberg group case, we introduce a
nonintegrable distribution on the sphere and a metric on it using two of the
noncommutative left invariant vector fields. This way $\mathbb{S}^3$ becomes a
subRiemannian manifold. It is known that the group $SU(2) $ is isomorphic with
the sphere $\mathbb{S}^3$ and represents an example of subRiemannian manifold
where the elements are matrices. The main issue here is to study the
connectivity by horizontal curves and its geodesics on this manifold. In this
paper, we are using Lagrangian method to study the connectivity theorem on
${\mathbb S}^3$ by horizontal curves with minimal arc-length. We show that for
any two points in ${\mathbb S}^3$, there exists such a geodesic joining these
two points.
","[{""version"":""v1"",""created"":""Fri, 26 Sep 2008 09:23:42 GMT""}]","2008-09-29"
"0809.4572","Sunandan Gangopadhyay","Sunandan Gangopadhyay","Anomalies, Horizons and Hawking radiation","minor corrections made, To appear in Euro. Phys. Letters","Europhys.Lett.85:10004,2009","10.1209/0295-5075/85/10004",,"hep-th","http://arxiv.org/licenses/nonexclusive-distrib/1.0/","  Hawking radiation is obtained from the Reissner-Nordstr\""{o}m blackhole with
a global monopole and the Garfinkle-Horowitz-Strominger blackhole falling in
the class of the most general spherically symmetric blackholes
$(\sqrt{-g}\neq1)$, using only chiral anomaly near the event horizon and
covariant boundary condition at the event horizon. The approach differs from
the anomaly cancellation approach since apart from the covariant boundary
condition, the chiral anomaly near the horizon is the only input to derive the
Hawking flux.
","[{""version"":""v1"",""created"":""Fri, 26 Sep 2008 09:24:45 GMT""},{""version"":""v2"",""created"":""Thu, 18 Dec 2008 08:33:47 GMT""}]","2009-03-20"
"0809.4573","John Peacock","J.A. Peacock","A diatribe on expanding space","4 pages, plain TeX. Not submitted to any journal",,,,"astro-ph physics.pop-ph","http://arxiv.org/licenses/nonexclusive-distrib/1.0/","  Some comments are made on the usefulness or otherwise of the concept of
`expanding space' in cosmology. These notes are an expanded version of material
first published in 2001 but not previously available online except at
www.roe.ac.uk/japwww. Since that personal webpage has been referred to in
published work, it seems sensible to give these notes a more permanent home.
","[{""version"":""v1"",""created"":""Fri, 26 Sep 2008 09:25:45 GMT""}]","2008-09-29"
"0809.4574","Andrea Lapi","L. Fan (1,2), A. Lapi (3,1), G. De Zotti (4,1), and L. Danese (1)
  (1-SISSA/ISAS, Trieste, Italy; 2-Univ. of Sc. and Tech. of China, China;
  3-Univ. ""Tor Vergata"", Roma, Italy; 4-INAF, Padova, Italy)","The dramatic size evolution of elliptical galaxies and the quasar
  feedback","4 pages, 2 figures, uses REVTeX4 + emulateapj.cls and apjfonts.sty.
  Accepted by ApJL","Astrophys.J. 689 (2008) L101","10.1086/595784",,"astro-ph","http://arxiv.org/licenses/nonexclusive-distrib/1.0/","  Observations have evidenced that passively evolving massive galaxies at high
redshift are much more compact than local galaxies with the same stellar mass.
We argue that the observed strong evolution in size is directly related to the
quasar feedback, which removes huge amounts of cold gas from the central
regions in a Salpeter time, inducing an expansion of the stellar distribution.
The new equilibrium configuration, with a size increased by a factor >~ 3, is
attained after ~ 40 dynamical times, corresponding to ~ 2 Gyr. This means that
massive galaxies observed at z >~ 1 will settle on the Fundamental Plane by z ~
0.8-1. In less massive galaxies (M_star <~ 2 10^10 M_sun), the nuclear feedback
is subdominant, and the mass loss is mainly due to stellar winds. In this case,
the mass loss timescale is longer than the dynamical time and results in
adiabatic expansion that may increase the effective radius by a factor of up to
~ 2 in 10 Gyr, although a growth by a factor of ~ 1.6 occurs within the first
0.5 Gyr. Since observations are focused on relatively old galaxies, with ages
>~ 1 Gyr, the evolution for smaller galaxies is more difficult to perceive.
Significant evolution of velocity dispersion is predicted for both small and
large galaxies.
","[{""version"":""v1"",""created"":""Fri, 26 Sep 2008 09:35:41 GMT""},{""version"":""v2"",""created"":""Tue, 21 Oct 2008 10:23:10 GMT""}]","2009-11-13"
"0809.4575","Giuseppe Vallone Dr.","A. Rossi, G. Vallone, A. Chiuri, F. De Martini, P. Mataloni","Multi-path entanglement of two photons","4 pages, 3 figures, revtex, revised version","Phys. Rev. Lett. 102, 153902 (2009)","10.1103/PhysRevLett.102.153902",,"quant-ph","http://arxiv.org/licenses/nonexclusive-distrib/1.0/","  We present a novel optical device based on an integrated system of
micro-lenses and single mode optical fibers. It allows to collect and direct
into many modes two photons generated by spontaneous parametric down
conversion. By this device multiqubit entangled states and/or multilevel
qu-$d$it states of two photons, encoded in the longitudinal momentum degree of
freedom, are created. The multi-path photon entanglement realized by this
device is expected to find important applications in modern quantum information
technology.
","[{""version"":""v1"",""created"":""Fri, 26 Sep 2008 09:54:34 GMT""},{""version"":""v2"",""created"":""Thu, 4 Dec 2008 08:46:46 GMT""},{""version"":""v3"",""created"":""Mon, 23 Feb 2009 13:43:16 GMT""}]","2009-04-27"
"0809.4576","Emmanuel Lochin","Jerome Lacan and Emmanuel Lochin","On-the-Fly Coding to Enable Full Reliability Without Retransmission","9 pages",,,,"cs.NI","http://arxiv.org/licenses/nonexclusive-distrib/1.0/","  This paper proposes a new reliability algorithm specifically useful when
retransmission is either problematic or not possible. In case of multimedia or
multicast communications and in the context of the Delay Tolerant Networking
(DTN), the classical retransmission schemes can be counterproductive in terms
of data transfer performance or not possible when the acknowledgment path is
not always available. Indeed, over long delay links, packets retransmission has
a meaning of cost and must be minimized.In this paper, we detail a novel
reliability mechanism with an implicit acknowledgment strategy that could be
used either within these new DTN proposals, for multimedia traffic or in the
context of multicast transport protocols. This proposal is based on a new
on-the-fly erasure coding concept specifically designed to operate efficient
reliable transfer over bi-directional links. This proposal, named Tetrys,
allows to unify a full reliability with an error correction scheme. In this
paper, we model the performance of this proposal and demonstrate with a
prototype, that we can achieve a full reliability without acknowledgment path
confirmation. Indeed, the main findings are that Tetrys is not sensitive to the
loss of acknowledgments while ensuring a faster data availability to the
application compared to other traditional acknowledgment schemes. Finally, we
pave the first step of the integration of such algorithm inside a congestion
controlled protocol.
","[{""version"":""v1"",""created"":""Fri, 26 Sep 2008 09:41:26 GMT""}]","2008-09-29"
"0809.4577","Jiajin Yu","Mordecai Golin, Xiaoming Xu and Jiajin Yu","A Generic Top-Down Dynamic-Programming Approach to Prefix-Free Coding",,,,,"cs.DS cs.IT math.IT","http://arxiv.org/licenses/nonexclusive-distrib/1.0/","  Given a probability distribution over a set of n words to be transmitted, the
Huffman Coding problem is to find a minimal-cost prefix free code for
transmitting those words. The basic Huffman coding problem can be solved in O(n
log n) time but variations are more difficult. One of the standard techniques
for solving these variations utilizes a top-down dynamic programming approach.
In this paper we show that this approach is amenable to dynamic programming
speedup techniques, permitting a speedup of an order of magnitude for many
algorithms in the literature for such variations as mixed radix, reserved
length and one-ended coding. These speedups are immediate implications of a
general structural property that permits batching together the calculation of
many DP entries.
","[{""version"":""v1"",""created"":""Fri, 26 Sep 2008 09:42:04 GMT""}]","2008-09-29"
"0809.4578","Reza Asgari","N. Abedpour, Ayoub Esmailpour, Reza Asgari, M. Reza Rahimi Tabar","Conductance of disordered graphene superlattice","10 pages, 7 figures. Final version, to appear in Phys. Rev. B (2009)","Phys. Rev. B 79, 165412 (2009)","10.1103/PhysRevB.79.165412",,"cond-mat.mes-hall cond-mat.dis-nn","http://creativecommons.org/licenses/by/3.0/","  We study the conductance of disordered graphene superlattices with
short-range structural correlations. The system consists of electron- and
hole-doped graphenes of various thicknesses, which fluctuate randomly around
their mean value. The effect of the randomness on the probability of
transmission through the system of various sizes is studied. We show that in a
disordered superlattice the quasiparticle that approaches the barrier interface
almost perpendicularly transmits through the system. The conductivity of the
finite-size system is computed and shown that the conductance vanishes when the
sample size becomes very large, whereas for some specific structures the
conductance tends to a nonzero value in the thermodynamics limit.
","[{""version"":""v1"",""created"":""Fri, 26 Sep 2008 09:46:04 GMT""},{""version"":""v2"",""created"":""Thu, 12 Mar 2009 14:07:32 GMT""}]","2015-05-13"
