"0805.0093","Steven Gratton","Steven Gratton","Prescription for Cosmic Information Extraction from Multiple Sky Maps","13 pages",,,,"astro-ph","http://arxiv.org/licenses/nonexclusive-distrib/1.0/","  This paper presents a prescription for distilling the information contained
in the cosmic microwave background radiation from multiple sky maps that also
contain both instrument noise and foreground contaminants. The prescription is
well-suited for cosmological parameter estimation and accounts for
uncertainties in the cosmic microwave background extraction scheme. The
technique is computationally viable at low resolution and may be considered a
natural and significant generalization of the ""Internal Linear Combination""
approach to foreground removal. An important potential application is the
analysis of the multi-frequency temperature and polarization data from the
forthcoming Planck satellite.
","[{""version"":""v1"",""created"":""Thu, 1 May 2008 16:36:55 GMT""}]","2008-05-02"
"0805.0095","Ashoke Sen","Ashoke Sen","Entropy Function and AdS(2)/CFT(1) Correspondence","LaTeX file, 13 pages; v2: expanded discussion, references added; v3:
  modified and expanded discussion, references added; v4: added extensive
  discussion on boundary conditions","JHEP 0811:075,2008","10.1088/1126-6708/2008/11/075",,"hep-th","http://arxiv.org/licenses/nonexclusive-distrib/1.0/","  Wald's formula for black hole entropy, applied to extremal black holes, leads
to the entropy function formalism. We manipulate the entropy computed this way
to express it as the logarithm of the ground state degeneracy of a dual quantum
mechanical system. This provides a natural definition of the extremal black
hole entropy in the full quantum theory. Our analysis also clarifies the
relationship between the entropy function formalism and the Euclidean action
formalism.
","[{""version"":""v1"",""created"":""Thu, 1 May 2008 17:36:03 GMT""},{""version"":""v2"",""created"":""Wed, 28 May 2008 02:16:32 GMT""},{""version"":""v3"",""created"":""Mon, 2 Jun 2008 16:16:24 GMT""},{""version"":""v4"",""created"":""Wed, 17 Sep 2008 17:28:24 GMT""}]","2009-09-15"
"0805.0104","Kohta Murase","Kohta Murase, Susumu Inoue, Shigehiro Nagataki","Cosmic Rays Above the Second Knee from Clusters of Galaxies and
  Associated High-Energy Neutrino Emission","4 pages, 2 figures, accepted for publication in APJL, references and
  discussions added, results unchanged","Astrophys.J. 689 (2008) L105","10.1086/595882","YITP-08-105","astro-ph hep-ph","http://arxiv.org/licenses/nonexclusive-distrib/1.0/","  Accretion and merger shocks in clusters of galaxies are potential
accelerators of high-energy protons, which can give rise to high-energy
neutrinos through pp interactions with the intracluster gas. We discuss the
possibility that protons from cluster shocks make a significant contribution to
the observed cosmic rays in the energy range between the second knee around
10^17.5 eV and the ankle around 10^18.5 eV. The accompanying cumulative
neutrino background above PeV may be detectable by upcoming neutrino telescopes
such as IceCube or KM3NeT, providing a test of this scenario as well as a probe
of cosmic-ray confinement properties in clusters.
","[{""version"":""v1"",""created"":""Thu, 1 May 2008 16:15:30 GMT""},{""version"":""v2"",""created"":""Tue, 28 Oct 2008 20:49:32 GMT""}]","2012-01-18"
"0805.0108","Xiaojun Tang","Xiaojun Tang, Ruoheng Liu, Predrag Spasojevic, H. Vincent Poor","The Gaussian Wiretap Channel with a Helping Interferer","Proceedings of the 2008 IEEE International Symposium on Information
  Theory, Toronto, ON, Canada, July 6 - 11, 2008",,,,"cs.IT cs.CR math.IT","http://arxiv.org/licenses/nonexclusive-distrib/1.0/","  Due to the broadcast nature of the wireless medium, wireless communication is
susceptible to adversarial eavesdropping. This paper describes how
eavesdropping can potentially be defeated by exploiting the superposition
nature of the wireless medium. A Gaussian wire-tap channel with a helping
interferer (WTC-HI) is considered in which a transmitter sends confidential
messages to its intended receiver in the presence of a passive eavesdropper and
with the help of an interferer. The interferer, which does not know the
confidential message assists the confidential message transmission by sending a
signal that is independent of the transmitted message. An achievable secrecy
rate and a Sato-type upper bound on the secrecy capacity are given for the
Gaussian WTC-HI. Through numerical analysis, it is found that the upper bound
is close to the achievable secrecy rate when the interference is weak for
symmetric interference channels, and under more general conditions for
asymmetric Gaussian interference channels.
","[{""version"":""v1"",""created"":""Thu, 1 May 2008 16:19:13 GMT""}]","2008-05-02"
"0805.0109","Laura L.M. Yang","Laura L.M. Yang","Generalizations of Han's Hook Length Identities","6 pages",,,,"math.CO","http://arxiv.org/licenses/nonexclusive-distrib/1.0/","  Han recently discovered new hook length identities for binary trees. In this
paper, we extend Han's identities to binomial families of trees. Moreover, we
present a bijective proof of one of the identities for the family of ordered
trees.
","[{""version"":""v1"",""created"":""Thu, 1 May 2008 16:46:03 GMT""},{""version"":""v2"",""created"":""Thu, 1 May 2008 20:57:51 GMT""}]","2008-05-02"
"0805.0110","Alex Arenas","Grigory Isaakovich Barenblatt","A mathematical model of turbulent drag reduction by
  high-molecular-weight polymeric additives in a shear flow","4 pages: 2 figures",,"10.1063/1.2979711",,"physics.flu-dyn physics.class-ph","http://arxiv.org/licenses/nonexclusive-distrib/1.0/","  Drag reduction, or, what is the same, mean velocity increase in a turbulent
flow at a fixed pressure drop through the addition of tiny amounts (several
parts per million) of high molecular weight polymers (Thoms effect), is known
already for more than sixty years. Rather long ago it was understood that this
effect is related to supramolecular structures formed in the flow. Recent
experiments by S. Chu, E.S.G. Shaqfeh and their associates, where the motion of
supramolecular structures was directly observed, made it possible to understand
and quantify the dynamic interaction of the polymeric structures with the
solvent (water) flow. These results lead to the construction of a mathematical
model of the Thoms effect, based on the Kolmogorov(1942)-Prandtl(1945)
semi-empirical theory of shear flow turbulence.
","[{""version"":""v1"",""created"":""Thu, 1 May 2008 16:54:49 GMT""}]","2009-11-13"
"0805.0111","Afsaneh Mehran","Afsaneh Mehran","Kummer surfaces associated to (1,2)-polarized abelian surfaces","13 pages, 1 figure",,,,"math.AG","http://arxiv.org/licenses/nonexclusive-distrib/1.0/","  The aim of this paper is to describe the geometry of the generic Kummer
surface associated to a $(1,2)$-polarized abelian surface. We show that it is
the double cover of a weak del Pezzo surface and that it inherits from the del
Pezzo surface an elliptic fibration with twelve singular fibers of type $I_2.$
","[{""version"":""v1"",""created"":""Thu, 1 May 2008 16:59:02 GMT""}]","2008-05-02"
"0805.0112","Grigorios Pavliotis","G.A. Pavliotis, A. Vogiannou","Diffusive Transport in Periodic Potentials: Underdamped Dynamics","21 PAGES, 1 FIGURE",,,,"cond-mat.stat-mech cond-mat.mtrl-sci","http://arxiv.org/licenses/nonexclusive-distrib/1.0/","  In this paper we present a systematic and rigorous method for calculating the
diffusion tensor for a Brownian particle moving in a periodic potential which
is valid in arbitrary dimensions and for all values of the dissipation. We use
this method to obtain an explicit formula for the diffusion coefficient in one
dimension which is valid in the underdamped limit, and we also obtain higher
order corrections to the Lifson-Jackson formula for the diffusion coefficient
in the overdamped limit. A numerical method for calculating the diffusion
coefficient is also developed and is shown to perform extremely well for all
values of the dissipation.
","[{""version"":""v1"",""created"":""Thu, 1 May 2008 17:00:38 GMT""},{""version"":""v2"",""created"":""Fri, 2 May 2008 16:55:02 GMT""}]","2008-05-02"
"0805.0113","Arkady Kholodenko L.","Arkady L.Kholodenko","New strings for old Veneziano amplitudes IV.Connections with spin chains
  and other stochastic systems","66 pages 4 figures",,,,"hep-th","http://arxiv.org/licenses/nonexclusive-distrib/1.0/","  In a series of published papers we reanalyzed treatments of the Veneziano
amplitudes and the models associated with them. In this work we demonstrate
that the already obtained partition function for these amplitudes can be
exactly mapped into that for the Polychronakos-Frahm spin chain which, in turn,
is obtainable from the Richardson-Gaudin XXX model. Reshetikhin and Varchenko
demonstrated that such a model is recoverable from their WKB-type analysis of
solutions of the Knizhnik-Zamolodchikov (K-Z) equations. The linear
independence of solutions of these equations is controlled by determinants
whose form (up to a constant) coincides with the Veneziano (or Veneziano-like)
amplitudes.In the simplest case, when the K-Z equations are reducible to the
Gauss hypergeometric equation, the determinantal conditions coincide with those
which were discovered by Kummer in 19th century. Kummer's results admit
physical interpretation crucial for providing needed justification associating
determinanatal formula(s) with Veneziano-like amplitudes. General results are
illustrated by many examples. These include but are not limited to only high
energy physics since all high energy physics scattering processes can be looked
upon from much broader sctochastic theory of random fragmentation and
coagulation processes recently undergoing active development in view of its
applications in disciplines ranging from ordering in spin glasses and
population genetics to computer science, linguistics and economics,etc. In this
theory Veneziano amplitudes play the universal role since they are the
Poisson-Dirichlet-type distributions for these processes (analogous to the more
familiar Maxwell distribution for gases)
","[{""version"":""v1"",""created"":""Thu, 1 May 2008 17:04:43 GMT""}]","2008-05-02"
"0805.0114","Riccardo Penco","Cristian Armendariz-Picon, Michele Fontanini, Riccardo Penco, Mark
  Trodden","Where does Cosmological Perturbation Theory Break Down?","25 pages, uses FeynMP","Class.Quant.Grav.26:185002,2009","10.1088/0264-9381/26/18/185002",,"hep-th astro-ph gr-qc","http://arxiv.org/licenses/nonexclusive-distrib/1.0/","  We apply the effective field theory approach to the coupled metric-inflaton
system, in order to investigate the impact of higher dimension operators on the
spectrum of scalar and tensor perturbations in the short-wavelength regime. In
both cases, effective corrections at tree-level become important when the
Hubble parameter is of the order of the Planck mass, or when the physical wave
number of a cosmological perturbation mode approaches the square of the Planck
mass divided by the Hubble constant. Thus, the cut-off length below which
conventional cosmological perturbation theory does not apply is likely to be
much smaller than the Planck length. This has implications for the
observability of ""trans-Planckian"" effects in the spectrum of primordial
perturbations.
","[{""version"":""v1"",""created"":""Thu, 1 May 2008 18:10:07 GMT""}]","2009-09-28"
"0805.0115","Christopher Adam Tout","C. A. Tout, D. T. Wickramasinghe, J. Liebert, L. Ferrario and J. E.
  Pringle","Binary Star Origin of High Field Magnetic White Dwarfs","6 pages, 1 figure, accepted by MNRAS",,"10.1111/j.1365-2966.2008.13291.x",,"astro-ph","http://arxiv.org/licenses/nonexclusive-distrib/1.0/","  White dwarfs with surface magnetic fields in excess of $1 $MG are found as
isolated single stars and relatively more often in magnetic cataclysmic
variables. Some 1,253 white dwarfs with a detached low-mass main-sequence
companion are identified in the Sloan Digital Sky Survey but none of these is
observed to show evidence for Zeeman splitting of hydrogen lines associated
with a magnetic field in excess of 1MG. If such high magnetic fields on white
dwarfs result from the isolated evolution of a single star then there should be
the same fraction of high field white dwarfs among this SDSS binary sample as
among single stars. Thus we deduce that the origin of such high magnetic fields
must be intimately tied to the formation of cataclysmic variables. CVs emerge
from common envelope evolution as very close but detached binary stars that are
then brought together by magnetic braking or gravitational radiation. We
propose that the smaller the orbital separation at the end of the common
envelope phase, the stronger the magnetic field. The magnetic cataclysmic
variables originate from those common envelope systems that almost merge. We
propose further that those common envelope systems that do merge are the
progenitors of the single high field white dwarfs. Thus all highly magnetic
white dwarfs, be they single stars or the components of MCVs, have a binary
origin. This hypothesis also accounts for the relative dearth of single white
dwarfs with fields of 10,000 - 1,000,000G. Such intermediate-field white dwarfs
are found preferentially in cataclysmic variables. In addition the bias towards
higher masses for highly magnetic white dwarfs is expected if a fraction of
these form when two degenerate cores merge in a common envelope. Similar
scenarios may account for very high field neutron stars.
","[{""version"":""v1"",""created"":""Thu, 1 May 2008 17:19:37 GMT""}]","2009-11-13"
"0805.0116","Henry Stapp","Henry P. Stapp","Philosophy of mind and the problem of free will in the light of quantum
  mechanics","29 Pages",,,"LBNL 162E","physics.gen-ph","http://arxiv.org/licenses/nonexclusive-distrib/1.0/","  Defects occasioned by the advent of quantum mechanics are described in detail
of recent arguments by John Searle and by Jaegwon Kim pertaining to the
question of the complete reducibility to the physical of the apparent capacity
of a person's conscious thoughts to affect the behaviour of that person's
physically described brain.
","[{""version"":""v1"",""created"":""Thu, 1 May 2008 17:30:23 GMT""}]","2008-05-02"
"0805.0117","Hee-Jong Seo","Hee-Jong Seo, Ethan R. Siegel, Daniel J. Eisenstein, Martin White","Non-linear structure formation and the acoustic scale","Accepted for publication in the ApJ, 14 emulated apj pages with 8
  figures and 6 tables, small changes to match the accepted version","Astrophys.J.636:13-24,2008","10.1086/589921",,"astro-ph","http://arxiv.org/licenses/nonexclusive-distrib/1.0/","  We present high signal-to-noise measurements of the acoustic scale in the
presence of nonlinear growth and redshift distortions using 320(Gpc/h)^3 of
cosmological PM simulations. Using simple fitting methods, we obtain robust
measurements of the acoustic scale with scatter close to that predicted by the
Fisher matrix. We detect and quantify the shift in the acoustic scale by
analyzing the power spectrum: we detect at greater than 5 sigma a decrease in
the acoustic scale in the real-space matter power spectrum of 0.2% at z=1.5,
growing to 0.45% at z=0.3. In redshift space, the shifts are about 25% larger:
we detect a decrease of 0.25% of at z=1.5 and 0.54% at z=0.3. Despite the
nonzero amounts, these shifts are highly predictable numerically, and hence
removable within the standard ruler analysis of clustering data. Moreover, we
show that a simple density-field reconstruction method substantially reduces
the scatter and nonlinear shifts of the acoustic scale measurements: the shifts
are reduced to less than 0.1% at z=0.3-1.5, even in the presence of
non-negligible shot noise. Finally, we show that the ratio of the cosmological
distance to the sound horizon that would be inferred from these fits is robust
to variations in the parameterization of the fitting method and reasonable
differences in the template cosmology.
","[{""version"":""v1"",""created"":""Thu, 1 May 2008 18:16:47 GMT""},{""version"":""v2"",""created"":""Thu, 7 Aug 2008 18:19:03 GMT""}]","2009-08-21"
"0805.0118","Alexey Jalnine","Alexey Yu. Jalnine, Sergey P. Kuznetsov","The effect of noise on a hyperbolic strange attractor in the system of
  two coupled van der Pol oscillators","14 pages, 7 figures",,,,"nlin.CD","http://arxiv.org/licenses/nonexclusive-distrib/1.0/","  We study the effect of noise for a physically realizable flow system with a
hyperbolic chaotic attractor of the Smale - Williams type in the Poincare
cross-section [S.P. Kuznetsov, Phys. Rev. Lett. 95, 2005, 144101]. It is shown
numerically that slightly varying the initial conditions on the attractor one
can obtain a uniform approximation of a noisy orbit by the trajectory of the
system without noise, that is called as the ""shadowing"" trajectory. We propose
an algorithm for locating the shadowing trajectories in the system under
consideration. Using this algorithm, we show that the mean distance between a
noisy orbit and the approximating one does not depend essentially on the length
of the time interval of observation, but only on the noise intensity. This
dependance is nearly linear in a wide interval of the intensities of noise. It
is found out that for weak noise the Lyapunov exponents do not depend
noticeably on the noise intensity. However, in the case of a strong noise the
largest Lyapunov exponent decreases and even becomes negative indicating the
suppression of chaos by the external noise.
","[{""version"":""v1"",""created"":""Thu, 1 May 2008 17:47:16 GMT""}]","2008-05-02"
"0805.0119","Mark Blunk","Mark Blunk","Del Pezzo Surfaces of degree 6 over an arbitrary field","24 pages",,,,"math.AG math.KT","http://arxiv.org/licenses/nonexclusive-distrib/1.0/","  We give a characterization of all del Pezzo surfaces of degree 6 over an
arbitrary field $F$. A surface is determined by a pair of separable algebras.
These algebras are used to compute the Quillen $K$-theory of the surface. As a
consequence, we obtain an index reduction formula for the function field of the
surface.
","[{""version"":""v1"",""created"":""Thu, 1 May 2008 17:47:23 GMT""},{""version"":""v2"",""created"":""Fri, 2 May 2008 00:33:33 GMT""}]","2008-05-02"
"0805.0120","Stephen Vavasis","Michael Biggs, Ali Ghodsi, Stephen Vavasis","Nonnegative Matrix Factorization via Rank-One Downdate",,,,,"cs.IR cs.NA","http://arxiv.org/licenses/nonexclusive-distrib/1.0/","  Nonnegative matrix factorization (NMF) was popularized as a tool for data
mining by Lee and Seung in 1999. NMF attempts to approximate a matrix with
nonnegative entries by a product of two low-rank matrices, also with
nonnegative entries. We propose an algorithm called rank-one downdate (R1D) for
computing a NMF that is partly motivated by singular value decomposition. This
algorithm computes the dominant singular values and vectors of adaptively
determined submatrices of a matrix. On each iteration, R1D extracts a rank-one
submatrix from the dataset according to an objective function. We establish a
theoretical result that maximizing this objective function corresponds to
correctly classifying articles in a nearly separable corpus. We also provide
computational experiments showing the success of this method in identifying
features in realistic datasets.
","[{""version"":""v1"",""created"":""Thu, 1 May 2008 17:59:44 GMT""}]","2008-05-02"
"0805.0121","Nicholas Licata","Nicholas A. Licata","Theory and modeling of particles with DNA-mediated interactions","PhD Thesis, 146 pages, 36 figures",,,,"cond-mat.soft cond-mat.mtrl-sci cond-mat.stat-mech","http://arxiv.org/licenses/nonexclusive-distrib/1.0/","  In recent years significant attention has been attracted to proposals which
utilize DNA for nanotechnological applications. Potential applications of these
ideas range from the programmable self-assembly of colloidal crystals, to
biosensors and nanoparticle based drug delivery platforms. In Chapter I we
introduce the system, which generically consists of colloidal particles
functionalized with specially designed DNA markers. The sequence of bases on
the DNA markers determines the particle type. Due to the hybridization between
complementary single-stranded DNA, specific, type-dependent interactions can be
introduced between particles by choosing the appropriate DNA marker sequences.
In Chapter II we develop a statistical mechanical description of the
aggregation and melting behavior of particles with DNA-mediated interactions.
In Chapter III a model is proposed to describe the dynamical departure and
diffusion of particles which form reversible key-lock connections. In Chapter
IV we propose a method to self-assemble nanoparticle clusters using DNA
scaffolds. A natural extension is discussed in Chapter V, the programmable
self-assembly of nanoparticle clusters where the desired cluster geometry is
encoded using DNA-mediated interactions. In Chapter VI we consider a
nanoparticle based drug delivery platform for targeted, cell specific
chemotherapy. In Chapter VII we present prospects for future research: the
connection between DNA-mediated colloidal crystallization and jamming, and the
inverse problem in self-assembly.
","[{""version"":""v1"",""created"":""Thu, 1 May 2008 18:27:10 GMT""}]","2008-05-02"
"0805.0122","Nanuli Lazrieva","N. Lazrieva, T. Toronjadze","Optimal Robust Mean-Variance Hedging in Incomplete Financial Markets",,,,,"q-fin.PM math.PR math.ST stat.AP stat.TH","http://arxiv.org/licenses/nonexclusive-distrib/1.0/","  Optimal B-robust estimate is constructed for multidimensional parameter in
drift coefficient of diffusion type process with small noise. Optimal
mean-variance robust (optimal V -robust) trading strategy is find to hedge in
mean-variance sense the contingent claim in incomplete financial market with
arbitrary information structure and misspecified volatility of asset price,
which is modelled by multidimensional continuous semimartingale. Obtained
results are applied to stochastic volatility model, where the model of latent
volatility process contains unknown multidimensional parameter in drift
coefficient and small parameter in diffusion term.
","[{""version"":""v1"",""created"":""Thu, 1 May 2008 18:06:05 GMT""}]","2008-12-10"
"0805.0123","Laura Patrizii","L. Patrizii (for the OPERA Collaboration)","Study of the effects induced by lead on the emulsion films of the OPERA
  experiment","19 pages, 11 figures","JINST 3:P07002,2008","10.1088/1748-0221/3/07/P07002",,"physics.ins-det","http://arxiv.org/licenses/nonexclusive-distrib/1.0/","  The OPERA neutrino oscillation experiment is based on the use of the Emulsion
Cloud Chamber (ECC). In the OPERA ECC, nuclear emulsion films acting as very
high precision tracking detectors are interleaved with lead plates providing a
massive target for neutrino interactions. We report on studies related to the
effects occurring from the contact between emulsion and lead. A low
radioactivity lead is required in order to minimize the number of background
tracks in emulsions and to achieve the required performance in the
reconstruction of neutrino events. It was observed that adding other chemical
elements to the lead, in order to improve the mechanical properties, may
significantly increase the level of radioactivity on the emulsions. A detailed
study was made in order to choose a lead alloy with good mechanical properties
and an appropriate packing technique so as to have a low enough effective
radioactivity.
","[{""version"":""v1"",""created"":""Thu, 1 May 2008 18:20:13 GMT""},{""version"":""v2"",""created"":""Fri, 2 May 2008 10:35:46 GMT""}]","2019-08-13"
"0805.0124","Anton Baushev N","A. N. Baushev","Dark matter annihilation in the gravitational field of a black hole","9 pages, 1 figure","International Journal of Modern Physics D, Volume: 18, Issue: 8
  (2009) pp. 1195-1203","10.1142/S0218271809014509",,"astro-ph","http://arxiv.org/licenses/nonexclusive-distrib/1.0/","  In this paper we consider dark matter particle annihilation in the
gravitational field of black holes. We obtain exact distribution function of
the infalling dark matter particles, and compute the resulting flux and spectra
of gamma rays coming from the objects. It is shown that the dark matter density
significantly increases near a black hole. Particle collision energy becomes
very high affecting relative cross-sections of various annihilation channels.
We also discuss possible experimental consequences of these effects.
","[{""version"":""v1"",""created"":""Thu, 1 May 2008 18:23:48 GMT""},{""version"":""v2"",""created"":""Thu, 8 Oct 2009 17:29:44 GMT""}]","2009-10-08"
