"0805.0203","Chethan Gowdigere","R. Fareghbal, C. N. Gowdigere, A.E. Mosaffa, and M. M. Sheikh-Jabbari","Nearing 11d Extremal Intersecting Giants and New Decoupled Sectors in D
  = 3,6 SCFT's","39 pages, v2: minor modification and clarifications","Phys.Rev.D81:046005,2010","10.1103/PhysRevD.81.046005","IPM/P-2008/015, SUT-P-08-2a, IC/2008/017","hep-th","http://arxiv.org/licenses/nonexclusive-distrib/1.0/","  We extend the analysis of arXiv:0801.4457 [hep-th] to charged black hole
solutions of four-dimensional $U(1)^4$ gauged supergravity which carry three
charges. There are two decoupling near-horizon limits, one over the near-BPS
black hole solution and the other over the near-extremal, but non-BPS geometry.
Taking the limit over the eleven dimensional uplift of these black hole
solutions, for both of these cases we obtain a geometry which has a piece
(conformal) to rotating BTZ $\times S^2$. We study the 4d, $11d$ and $5d, 3d$
black hole properties. Moreover, we show that the BTZ$\times S^2$ geometry
obtained after the near-BPS (near-extremal) limit is also a solution to
five-dimensional $U(1)^3$ un-gauged (gauged) STU supergravity. Based on these
decoupling limits we argue that there should be sectors of 3d CFT resulting
from low energy limit of theory on $N$ M2-branes ($N\to \infty)$, which are
decoupled from the rest of the theory and are effectively described by a 2d
CFT. The central charge of the 2d CFT in both near-BPS and near-extremal case
scales as $N$. The engineering dimension of the operators in these decoupled
sectors scales as $N^{4/3}$ (for near-BPS case) while as $N^{3/2}$ (for the
near-extremal case). Moreover, we discuss the description of the decoupled
sectors as certain deformations of $6d$ CFT residing on the intersecting
M5-brane giants.
","[{""version"":""v1"",""created"":""Fri, 2 May 2008 10:05:51 GMT""},{""version"":""v2"",""created"":""Fri, 18 Jul 2008 14:01:15 GMT""},{""version"":""v3"",""created"":""Tue, 15 Dec 2009 11:22:37 GMT""}]","2010-04-06"
"0805.0204","Mark Allen","Mark G. Allen (1), Brent A. Groves (2), Michael A. Dopita (3), Ralph
  S. Sutherland (3), and Lisa J. Kewley (4) ((1) Observatoire de Strasbourg,
  (2) Leiden University, (3) RSAA Australian National University, (4) Institute
  for Astronomy, University of Hawaii)","The MAPPINGS III Library of Fast Radiative Shock Models","39 pages, 34 figures, accepted for publication in ApJS, April 2008",,"10.1086/589652",,"astro-ph","http://arxiv.org/licenses/nonexclusive-distrib/1.0/","  We present a new library of fully-radiative shock models calculated with the
MAPPINGS III shock and photoionization code. The library consists of grids of
models with shock velocities in the range v=100-1000 km/s and magnetic
parameters B/sqrt(n) of 10^-4 - 10 muG cm^(3/2) for five different atomic
abundance sets, and for a pre-shock density of 1.0 cm^(-3). Additionally, Solar
abundance model grids have been calculated for densities of 0.01, 0.1, 10, 100,
and 1000 cm^(-3) with the same range in v and B/sqrt(n). Each model includes
components of both the radiative shock and its photoionized precursor, ionized
by the EUV and soft X-ray radiation generated in the radiative gas. We present
the details of the ionization structure, the column densities, and the
luminosities of the shock and its precursor. Emission line ratio predictions
are separately given for the shock and its precursor as well as for the
composite shock+precursor structure to facilitate comparison with observations
in cases where the shock and its precursor are not resolved. Emission line
ratio grids for shock and shock+precursor are presented on standard line ratio
diagnostic diagrams, and we compare these grids to observations of radio
galaxies and a sample of AGN and star forming galaxies from the Sloan Digital
Sky Survey. This library is available online, along with a suite of tools to
enable the analysis of the shocks and the easy creation of emission line ratio
diagnostic diagrams. These models represent a significant increase in parameter
space coverage over previously available models, and therefore provide a unique
tool in the diagnosis of emission by shocks.
","[{""version"":""v1"",""created"":""Fri, 2 May 2008 10:08:12 GMT""}]","2009-11-13"
"0805.0205","Nicola Visciglia","Luis Vega, Nicola Visciglia","On the equipartition of energy for critical NLW","to appear on Journal of Functional Analysis",,,,"math.AP","http://arxiv.org/licenses/nonexclusive-distrib/1.0/","  We study some qualitative properties of global solutions to the following
focusing and defocusing critical $NLW$: \begin{equation*} \Box u+ \lambda
u|u|^{2^*-2}=0, \hbox{} \lambda\in {\mathbf R} \end{equation*} $$\hspace{2cm}
u(0)=f\in \dot H^1({\mathbf R}^n), \partial_t u(0)=g\in L^2({\mathbf R}^n)$$ on
${\mathbf R}\times {\mathbf R}^n$ for $n\geq 3$, where $2^*\equiv
\frac{2n}{n-2}$. We will consider the global solutions of the defocusing $NLW$
whose existence and scattering property is shown in \cite{shst}, \cite{sb} and
\cite{bg}, without any restriction on the initial data $(f,g)\in \dot
H^1({\mathbf R}^n) \times L^2({\mathbf R}^n)$. As well as the solutions
constructed in \cite{pecher} to the focusing $NLW$ for small initial data and
to the ones obtained in \cite{mk}, where a sharp condition on the smallness of
the initial data is given. We prove that the solution $u(t, x)$ satisfies a
family of identities, that turn out to be a precised version of the classical
Morawetz estimates (see \cite{mor1}). As a by--product we deduce that any
global solution to critical $NLW$ belonging to a natural functional space
satisfies: $$\lim_{R\to \infty}\frac 1R \int_{\mathbf R} \int_{|x|<R}
|\nabla_{x} u(t,x)|^2 \hbox{} dxdt $$ $$=\lim_{R\to \infty} \frac 1{2R}
\int_{\mathbf R} \int_{|x|<R} (|\nabla_{t,x} u(t,x)|^2 + \frac{2 \lambda}{2^*}
|u(t,x)|^{2^*}) \hbox{} dxdt$$ $$=\int_{{\mathbf R}^n} (|\nabla_{t, x} u(0,
x)|^2+ \frac{2 \lambda}{2^*} |u(0, x)|^{2^*}) \hbox{} dx.$$
","[{""version"":""v1"",""created"":""Fri, 2 May 2008 10:21:09 GMT""}]","2008-05-05"
"0805.0206","Jose Natario","Jose Natario","Painleve-Gullstrand Coordinates for the Kerr Solution","6 pages; v2: new section, matches final published version; v3: sign
  error in the expression of the function delta corrected","Gen.Rel.Grav.41:2579-2586,2009","10.1007/s10714-009-0781-2",,"gr-qc","http://arxiv.org/licenses/nonexclusive-distrib/1.0/","  We construct a coordinate system for the Kerr solution, based on the zero
angular momentum observers dropped from infinity, which generalizes the
Painleve-Gullstrand coordinate system for the Schwarzschild solution. The Kerr
metric can then be interpreted as describing space flowing on a (curved)
Riemannian 3-manifold. The stationary limit arises as the set of points on this
manifold where the speed of the flow equals the speed of light, and the
horizons as the set of points where the radial speed equals the speed of light.
A deeper analysis of what is meant by the flow of space reveals that the
acceleration of free-falling objects is generally not in the direction of this
flow. Finally, we compare the new coordinate system with the closely related
Doran coordinate system.
","[{""version"":""v1"",""created"":""Fri, 2 May 2008 10:22:17 GMT""},{""version"":""v2"",""created"":""Tue, 10 Mar 2009 09:57:56 GMT""},{""version"":""v3"",""created"":""Tue, 4 Feb 2014 14:15:45 GMT""}]","2014-02-05"
"0805.0207","Michael Ratz","Takeshi Araki, Tatsuo Kobayashi, Jisuke Kubo, Saul Ramos-Sanchez,
  Michael Ratz, Patrick K.S. Vaudrevange","(Non-)Abelian discrete anomalies","32 pages, one figure; v2: matches version published in NPB","Nucl.Phys.B805:124-147,2008","10.1016/j.nuclphysb.2008.07.005","KANAZAWA-08-04; KUNS-2139; TUM-HEP-686/08","hep-th","http://arxiv.org/licenses/nonexclusive-distrib/1.0/","  We derive anomaly constraints for Abelian and non-Abelian discrete symmetries
using the path integral approach. We survey anomalies of discrete symmetries in
heterotic orbifolds and find a new relation between such anomalies and the
so-called `anomalous' U(1).
","[{""version"":""v1"",""created"":""Fri, 2 May 2008 10:33:54 GMT""},{""version"":""v2"",""created"":""Tue, 12 Aug 2008 08:23:52 GMT""}]","2008-11-26"
"0805.0208","Alok Laddha","Alok Laddha, Madhavan Varadarajan","Polymer Parametrised Field Theory","44 pages, no figures","Phys.Rev.D78:044008,2008","10.1103/PhysRevD.78.044008",,"gr-qc","http://arxiv.org/licenses/nonexclusive-distrib/1.0/","  Free scalar field theory on 2 dimensional flat spacetime, cast in
diffeomorphism invariant guise by treating the inertial coordinates of the
spacetime as dynamical variables, is quantized using LQG type `polymer'
representations for the matter field and the inertial variables. The quantum
constraints are solved via group averaging techniques and, analogous to the
case of spatial geometry in LQG, the smooth (flat) spacetime geometry is
replaced by a discrete quantum structure. An overcomplete set of Dirac
observables, consisting of (a) (exponentials of) the standard free scalar field
creation- annihilation modes and (b) canonical transformations corresponding to
conformal isometries, are represented as operators on the physical Hilbert
space. None of these constructions suffer from any of the `triangulation'
dependent choices which arise in treatments of LQG. In contrast to the standard
Fock quantization, the non- Fock nature of the representation ensures that the
algebra of conformal isometries as well as that of spacetime diffeomorphisms
are represented in an anomaly free manner. Semiclassical states can be analysed
at the gauge invariant level. It is shown that `physical weaves' necessarily
underly such states and that such states display semiclassicality with respect
to, at most, a countable subset of the (uncountably large) set of observables
of type (a). The model thus offers a fertile testing ground for proposed
definitions of quantum dynamics as well as semiclassical states in LQG.
","[{""version"":""v1"",""created"":""Fri, 2 May 2008 11:03:50 GMT""}]","2008-11-26"
"0805.0209","Victor Shulman","Victor S. Shulman and Yuri V. Turovskii","Application of topological radicals to calculation of joint spectral
  radii",,,,,"math.FA math.SP","http://arxiv.org/licenses/nonexclusive-distrib/1.0/","  It is shown that the joint spectral radius $\rho(M)$ of a precompact family
$M$ of operators on a Banach space $X$ is equal to the maximum of two numbers:
the joint spectral radius $\rho_{e}(M)$ of the image of $M$ in the Calkin
algebra and the Berger-Wang radius $r(M)$ defined by the formula \[
r(M)=\underset{n\to\infty}{\limsup}(\sup\left\{\rho(a):a\in M^{n}\right\}
^{1/n}) . \] Some more general Banach-algebraic results of this kind are also
proved. The proofs are based on the study of special radicals on the class of
Banach algebras.
","[{""version"":""v1"",""created"":""Fri, 2 May 2008 11:08:09 GMT""}]","2008-05-05"
"0805.0210","Tokuji Araya","Tokuji Araya","The Auslander-Reiten conjecture for Gorenstein rings","*** 4 pages, minor changes, to appear in Proc. Amer. Math. Soc",,,,"math.AC math.RA","http://arxiv.org/licenses/nonexclusive-distrib/1.0/","  The Nakayama conjecture is one of the most important conjectures in ring
theory. The Auslander-Reiten conjecture is closely related to it. The purpose
of this note is to show that if the Auslander-Reiten conjecture holds in
codimension one for a commutative Gorenstein ring $R$, then it holds for $R$.
","[{""version"":""v1"",""created"":""Fri, 2 May 2008 11:16:04 GMT""},{""version"":""v2"",""created"":""Mon, 1 Sep 2008 02:51:16 GMT""}]","2008-09-01"
"0805.0211","Nicholas Stephen Manton","Nicholas S. Manton","One-vortex moduli space and Ricci flow","20 pages","J.Geom.Phys.58:1772-1783,2008","10.1016/j.geomphys.2008.08.005","DAMTP-2008-32","hep-th","http://arxiv.org/licenses/nonexclusive-distrib/1.0/","  The metric on the moduli space of one abelian Higgs vortex on a surface has a
natural geometrical evolution as the Bradlow parameter, which determines the
vortex size, varies. It is shown by various arguments, and by calculations in
special cases, that this geometrical flow has many similarities to Ricci flow.
","[{""version"":""v1"",""created"":""Fri, 2 May 2008 11:19:47 GMT""}]","2008-11-26"
"0805.0212","Riad Shaltaf","R. Shaltaf, G.-M. Rignanese, X. Gonze, Feliciano Giustino, Alfredo
  Pasquarello","Band Offsets at the Si/SiO$_2$ Interface from Many-Body Perturbation
  Theory",,,"10.1103/PhysRevLett.100.186401",,"cond-mat.mtrl-sci","http://arxiv.org/licenses/nonexclusive-distrib/1.0/","  We use many-body perturbation theory, the state-of-the-art method for band
gap calculations, to compute the band offsets at the Si/SiO$_2$ interface. We
examine the adequacy of the usual approximations in this context. We show that
(i) the separate treatment of band-structure and potential lineup
contributions, the latter being evaluated within density-functional theory, is
justified, (ii) most plasmon-pole models lead to inaccuracies in the absolute
quasiparticle corrections, (iii) vertex corrections can be neglected, (iv)
eigenenergy self-consistency is adequate. Our theoretical offsets agree with
the experimental ones within 0.3 eV.
","[{""version"":""v1"",""created"":""Fri, 2 May 2008 11:32:34 GMT""}]","2009-01-06"
"0805.0213","Pasquini Barbara","B. Pasquini (Pavia U. & INFN, Pavia), D. Drechsel, and S. Scherer
  (Mainz U., Inst. Kernphys.)","The polarizability of the pion: no conflict between dispersion theory
  and chiral perturbation theory","30 pages, 8 figures, 6 tables","Phys.Rev.C77:065211,2008","10.1103/PhysRevC.77.065211",,"hep-ph nucl-ex nucl-th","http://arxiv.org/licenses/nonexclusive-distrib/1.0/","  Recent attempts to determine the pion polarizability by dispersion relations
yield values that disagree with the predictions of chiral perturbation theory.
These dispersion relations are based on specific forms for the absorptive part
of the Compton amplitudes. The analytic properties of these forms are examined,
and the strong enhancement of intermediate-meson contributions is shown to be
connected with spurious singularities. If the basic requirements of dispersion
relations are taken into account, the results of dispersion theory and
effective field theory are not inconsistent.
","[{""version"":""v1"",""created"":""Fri, 2 May 2008 11:52:18 GMT""}]","2008-11-26"
"0805.0214","Veer Awana Dr","V. P.S. Awana, Arpita Vajpayee, Monika Mudgel, Anuj Kumar, R.S. Meena,
  Rahul Tripathi, Shiva Kumar, R.K. Kotnala and Hari Kishan","One-step atmospheric pressure synthesis of the ground state of Fe based
  LaFeAsO1-d superconductor","7 pages (Text+2Figs): Comments welcome (awana@mail.nplindia.ernet.in)",,,,"cond-mat.supr-con cond-mat.str-el","http://arxiv.org/licenses/nonexclusive-distrib/1.0/","  We report an easy and versatile one-step route of synthesis for newly
discovered Fe based superconductor LaFeAsO1-d with d = 0.0 to 0.15. Instead of
widely used high-pressure-high-temperature (HPHT) synthesis, we applied the
normal atmosphere solid-state reaction route. The stoichiometric mixtures of
Fe, La2O3, La and As in ratio LaFeAsO1-d with d = 0.0 to 0.15 are sealed in an
evacuated quartz tube and further heated at 500, 850 and 1100 0C in Ar for 12,
12 and 33 hours respectively in a single step. The resulting compounds are
single phase LaFeAsO crystallized in tetragonal P4/nmm structure. These samples
showed the ground state spin density wave (SDW) like metallic behavior below
around 150 K. In conclusion the ground state of newly discovered Fe based
superconductor is synthesized via an easy one-step solid-state reaction route.
","[{""version"":""v1"",""created"":""Fri, 2 May 2008 12:02:47 GMT""}]","2008-05-05"
"0805.0215","Diego Garlaschelli","Guido Caldarelli, Andrea Capocci, Diego Garlaschelli","A Self-organized model for network evolution",,"European Physical Journal B 64, 585-591 (2008).","10.1140/epjb/e2008-00243-5",,"physics.soc-ph cond-mat.dis-nn cond-mat.stat-mech nlin.AO","http://arxiv.org/licenses/nonexclusive-distrib/1.0/","  Here we provide a detailed analysis, along with some extensions and additonal
investigations, of a recently proposed self-organised model for the evolution
of complex networks. Vertices of the network are characterised by a fitness
variable evolving through an extremal dynamics process, as in the Bak-Sneppen
model representing a prototype of Self-Organized Criticality. The network
topology is in turn shaped by the fitness variable itself, as in the fitness
network model. The system self-organizes to a nontrivial state, characterized
by a power-law decay of dynamical and topological quantities above a critical
threshold. The interplay between topology and dynamics in the system is the key
ingredient leading to an unexpected behaviour of these quantities.
","[{""version"":""v1"",""created"":""Fri, 2 May 2008 12:29:48 GMT""}]","2008-08-29"
"0805.0216","Davison E. Soper","Zoltan Nagy and Davison E. Soper","Parton showers with quantum interference: leading color, with spin","28 pages with 11 figures","JHEP0807:025,2008","10.1088/1126-6708/2008/07/025","CERN-PH-TH-2008-087","hep-ph","http://arxiv.org/licenses/nonexclusive-distrib/1.0/","  We have previously described a mathematical formulation for a parton shower
based on the approximation of strongly ordered virtualities of successive
parton splittings. Quantum interference, including interference among different
color and spin states, was included. A practical numerical implementation
strategy was left unspecified. In a subsequent paper, we showed that if we add
the further approximations of taking only the leading color limit and averaging
over spins, we obtain a shower evolution that can be implemented as a Markov
process. In this paper, we outline a strategy for including the correlations
induced by parton spins.
","[{""version"":""v1"",""created"":""Fri, 2 May 2008 12:16:56 GMT""}]","2008-11-26"
"0805.0217","John H. Field","J.H.Field","Why Einstein, Podolsky and Rosen did not prove that quantum mechanics is
  `incomplete'","11 pages. Improved and extended version of quant-ph/0702018",,,,"quant-ph","http://arxiv.org/licenses/nonexclusive-distrib/1.0/","  It is shown that the Einstein-Podolsky-Rosen conclusion concerning the
`incompleteness' of Quantum Mechanics is invalidated by two logical errors in
their argument. If it were possible to perform the proposed gedanken experiment
it would, in fact, show that Quantum Mechanics is `complete' for the
observables discussed. Because, however, of the non square-integrable nature of
the wave function, the proposed experiment gives vanishing probabilities for
measurements performed in finite intervals of configuration or momentum space.
Hence no conclusion as to the `completeness', or otherwise, of Quantum
Mechanics can be drawn from the experiment.
","[{""version"":""v1"",""created"":""Fri, 2 May 2008 12:33:14 GMT""}]","2008-05-05"
"0805.0218","Shunsuke Kirino","Shunsuke Kirino, Tatsuya Fujii, Jize Zhao and Kazuo Ueda","Time-dependent DMRG Study on Quantum Dot under a Finite Bias Voltage",,,"10.1143/JPSJ.77.084704",,"cond-mat.mes-hall cond-mat.str-el","http://arxiv.org/licenses/nonexclusive-distrib/1.0/","  Resonant tunneling through quantum dot under a finite bias voltage at zero
temperature is investigated by using the adaptive time-dependent density matrix
renormalization group(TdDMRG) method. Quantum dot is modeled by the Anderson
Hamiltonian with the 1-D nearest-neighbor tight-binding leads. Initially the
ground state wave function is calculated with the usual DMRG method. Then the
time evolution of the wave function due to the slowly changing bias voltage
between the two leads is calculated by using the TdDMRG technique. Even though
the system size is finite, the expectation values of current operator show
steady-like behavior for a finite time interval, in which the system is
expected to resemble the real nonequilibrium steady state of the infinitely
long system. We show that from the time intervals one can obtain quantitatively
correct results for differential conductance in a wide range of bias voltage.
Finally we observe an anomalous behavior in the expectation value of the double
occupation operator at the dot $<n_{\uparrow} n_{\downarrow}>$ as a function of
bias voltage.
","[{""version"":""v1"",""created"":""Fri, 2 May 2008 12:37:48 GMT""},{""version"":""v2"",""created"":""Thu, 10 Jul 2008 09:39:03 GMT""}]","2009-11-13"
"0805.0219","Igor Chilingarian","Igor Chilingarian, Veronique Cayatte, Florence Durret, Christophe
  Adami, Chantal Balkowski, Laurent Chemin, Tatiana Lagana, Philippe Prugniel","Kinematics and Stellar Populations of Low-Luminosity Early-Type Galaxies
  in the Abell 496 Cluster","Accepted to A&A, 48 pages, 62 figures, 3 tables. This version
  contains low-resolution figures. We encourage you to get the full-resolution
  PDF (16Mb) from http://voplus.obspm.fr/DataCollections/Abell0496/",,"10.1051/0004-6361:20078709",,"astro-ph","http://arxiv.org/licenses/nonexclusive-distrib/1.0/","  The morphology and stellar populations of low-luminosity early-type galaxies
in clusters have until now been limited to a few relatively nearby clusters
such as Virgo or Fornax. Scenarii for the formation and evolution of dwarf
galaxies in clusters are therefore not well constrained. We investigate here
the morphology and stellar populations of low-luminosity galaxies in the
relaxed cluster Abell 496 (z=0.0330). Deep multiband imaging obtained with the
CFHT Megacam allowed us to select a sample of faint galaxies (-18.8<M_B<-15.1
mag). We observed 118 galaxies spectroscopically with the ESO VLT
FLAMES/Giraffe spectrograph (R=6300). We present structural analysis and colour
maps for the 48 galaxies belonging to the cluster. We fit the spectra of 46
objects with PEGASE.HR synthetic spectra to estimate the ages, metallicities,
and velocity dispersions. We computed values of $\alpha$/Fe abundance ratios
from the measurements of Lick indices. High-precision estimates of stellar
population properties have been obtained for a large sample of faint galaxies
in a cluster, allowing for the extension of relations between stellar
populations and internal kinematics to the low-velocity dispersion regime. We
have revealed a peculiar population of elliptical galaxies in the core of the
cluster, resembling massive early-type galaxies by their stellar population
properties and velocity dispersions, but having luminosities of about 2 mag
fainter. External mechanisms of gas removal (ram pressure stripping and
gravitational harassment) are more likely to have occurred than internal
mechanisms such as supernova-driven winds. The violent tidal stripping of
intermediate-luminosity, early-type galaxies in the cluster core can explain
the properties of the peculiar elliptical galaxies surrounding the cD galaxy.
","[{""version"":""v1"",""created"":""Fri, 2 May 2008 12:39:47 GMT""}]","2009-11-13"
"0805.0220","Massimo Pica Ciamarra","Massimo Pica Ciamarra, Antonio Coniglio","Random very loose packs","Applet available at http://smcs.na.infn.it/rvlp/rvlp.html Enhanced
  version resulting from reviewer's comments","Phys. Rev. Lett. 101, 128001, (2008)","10.1103/PhysRevLett.101.128001",,"cond-mat.soft cond-mat.stat-mech","http://arxiv.org/licenses/nonexclusive-distrib/1.0/","  We measure the number Omega(phi) of mechanically stable states of volume
fraction phi of a granular assembly under gravity. The granular entropy S(phi)
= log Omega(phi) vanishes both at high density, at phi = phi_rcp, and a low
density, at phi = phi_rvlp, where phi_rvlp is a new lower bound we call random
very loose pack. phi_rlp is the volume fraction where the entropy is maximal.
These findings allow for a clear explanation of compaction experiments, and
provide the first first-principle definition of the random loose volume
fraction. In the context of the statistical mechanics approach to static
granular materials, states with phi < phi_rlp are characterized by a negative
temperature.
","[{""version"":""v1"",""created"":""Fri, 2 May 2008 15:45:30 GMT""},{""version"":""v2"",""created"":""Tue, 16 Sep 2008 08:23:25 GMT""}]","2013-05-29"
"0805.0221","Carsten Deibel","Carsten Deibel, Vladimir Dyakonov","Sonnenstrom aus Plastik","4 pages, in german","Physik Journal 7:5 (2008) 51",,"deibel2008review","cond-mat.mtrl-sci","http://arxiv.org/licenses/nonexclusive-distrib/1.0/","  Inspired by the success of organic light emitting diodes, organic solar cells
have the potential to establish interesting applications, complementing and
enhancing the application range of inorganic systems.
  -----
  Durch den Erfolg organischer Leuchtdioden befl\""ugelt, entwickeln sich auch
organische Solarzellen zu interessanten Anwendungen, welche das Potential
haben, die Anwendungsbereiche anorganischer Systeme zu erg\""anzen und
erweitern.
","[{""version"":""v1"",""created"":""Fri, 2 May 2008 12:40:58 GMT""}]","2008-05-05"
