"0805.1137","David Martinez-Delgado","David Martinez-Delgado (IAC, MPIA), Jorge Penarrubia (Univ. Victoria),
  R. Jay Gabany (Black Bird Observ.), Ignacio Trujillo (IAC), Steven R.
  Majewski (Univ. Virginia) and Michael Pohlen (Cardiff Univ.)","The ghost of a dwarf galaxy: fossils of the hierarchical formation of
  the nearby spiral galaxy NGC 5907","Accepted for publication in The Astrophysical Journal. High
  resolution version of the paper, full colour version of the NGC 5907 tidal
  stream image, movie of the N-body model and IAC press release can be found
  at: http://www.cosmotography.com/images/small_ring_ngc5907.html",,"10.1086/592555",,"astro-ph","http://arxiv.org/licenses/nonexclusive-distrib/1.0/","  We present an extragalactic perspective of an extended stellar tidal stream
wrapping around the edge-on, spiral galaxy NGC 5907. Our deep images reveal for
the first time a large scale complex of arcing loops that is an excellent
example of how a low-mass satellite accretion can produce an interwoven,
rosette-like structure of debris dispersed in the halo of its host galaxy. The
existence of this structure, which has probably formed and survived for several
Gigayears, confirms that halos of spiral galaxies in the Local Universe may
still contain a significant number of galactic fossils from their hierarchical
formation. To examine the validity of the external accretion scenario, we
present N-body simulations of the tidal disruption of a dwarf galaxy-like
system in a disk galaxy plus dark halo potential that demonstrate that most of
the observed tidal features observed in NGC 5907 can be explained by a single
accretion event. Unfortunately, with no kinematic data and only the projected
geometry of the stream as constraint, the parameters of our model are
considerably degenerate and, for now, must be considered illustrative only.
Interestingly, NGC 5907 has long been considered a prototypical example of a
warped spiral in relative isolation. The presence of an extended tidal stream
challenges this picture and suggests that the gravitational perturbations
induced by the stream progenitor may be the cause for the warp. The detection
of an old, complex tidal stream in a nearby galaxy with rather modest
instrumentation points to the viability of surveys to find extragalactic tidal
substructures around spiral galaxies in the Local Volume (< 15 Mpc) -- with the
prospect of obtaining a census with enough statistical significance to be
compared with cosmological simulations.
","[{""version"":""v1"",""created"":""Thu, 8 May 2008 11:22:26 GMT""},{""version"":""v2"",""created"":""Wed, 13 Aug 2008 08:16:52 GMT""}]","2009-11-13"
"0805.1138","Claudio Melioli","C. Melioli (1,2), F. Brighenti (1), A. D'Ercole (2) and E.M. de
  Gouveia Dal Pino (3) ((1) University of Bologna, (2) INAF-Osservatorio
  Astronomico Bologna, (3) IAG, University of S. Paulo)","Hydrodynamical simulations of Galactic fountains I: evolution of single
  fountains","16 pages, 13 figures, accepted for pubblication in MNRAS",,"10.1111/j.1365-2966.2008.13446.x",,"astro-ph","http://arxiv.org/licenses/nonexclusive-distrib/1.0/","  The ejection of the gas out of the disk in late-type galaxies is related to
star formation and is due mainly to Type II supernovae. In this paper we
studied in detail the development of the Galactic fountains in order to
understand their dynamical evolution and their influence in the redistribution
of the freshly delivered metals over the disk. To this aim, we performed a
number of 3D hydrodynamical radiative cooling simulations of the gas in the
Milky Way where the whole Galaxy structure, the Galactic differential rotation
and the supernovae explosions generated by a single OB association are
considered. A typical fountain powered by 100 Type II supernovae may eject
material up to $\sim 2$ kpc which than collapses back mostly in form of dense,
cold clouds and filaments. The majority of the gas lifted up by the fountains
falls back on the disk remaining within a radial distance $\Delta R=0.5$ kpc
from the place where the fountain originated. This localized circulation of
disk gas does not influence the radial chemical gradients on large scale, as
required by the chemical models of the Milky Way which reproduce the
metallicity distribution without invoking large fluxes of metals. Simulations
of multiple fountains fuelled by Type II supernovae of different OB
associations will be presented in a companion paper.
","[{""version"":""v1"",""created"":""Thu, 8 May 2008 11:21:28 GMT""}]","2009-11-13"
"0805.1139","Paul Siddons","Paul Siddons, Charles S. Adams, Chang Ge and Ifan G. Hughes","Absolute absorption on the rubidium D lines: comparison between theory
  and experiment","18 pages, 8 figures, submitted to Journal of Physics B","J. Phys. B: At. Mol. Opt. Phys. 41 155004 (2008)","10.1088/0953-4075/41/15/155004",,"physics.atom-ph","http://arxiv.org/licenses/nonexclusive-distrib/1.0/","  We study the Doppler-broadened absorption of a weak monochromatic probe beam
in a thermal rubidium vapour cell on the D lines. A detailed model of the
susceptibility is developed which takes into account the absolute linestrengths
of the allowed electric dipole transitions and the motion of the atoms parallel
to the probe beam. All transitions from both hyperfine levels of the ground
term of both isotopes are incorporated. The absorption and refractive index as
a function of frequency are expressed in terms of the complementary error
function. The absolute absorption profiles are compared with experiment, and
are found to be in excellent agreement provided a sufficiently weak probe beam
with an intensity under one thousandth of the saturation intensity is used. The
importance of hyperfine pumping for open transitions is discussed in the
context of achieving the weak-probe limit. Theory and experiment show excellent
agreement, with an rms error better than 0.2% for the D2 line at 16.5 degrees
C.
","[{""version"":""v1"",""created"":""Thu, 8 May 2008 11:12:13 GMT""}]","2009-03-04"
"0805.1140","Maite Grau","Maite Grau, Francesc Ma\~nosas and Jordi Villadelprat","A Chebyshev criterion for Abelian integrals","17 pages, 1 figure",,,,"math.DS","http://arxiv.org/licenses/nonexclusive-distrib/1.0/","  We present a criterion that provides an easy sufficient condition in order
that a collection of Abelian integrals has the Chebyshev property. This
condition involves the functions in the integrand of the Abelian integrals and
can be checked, in many cases, in a purely algebraic way. By using this
criterion, several known results are obtained in a shorter way and some new
results, which could not be tackled by the known standard methods, can also be
deduced.
","[{""version"":""v1"",""created"":""Thu, 8 May 2008 11:17:05 GMT""},{""version"":""v2"",""created"":""Fri, 9 May 2008 07:56:52 GMT""}]","2008-05-09"
"0805.1141","Julia Roman","Alexander P. Kuznetsov, Julia P. Roman","Properties of synchronization in the systems of non-identical coupled
  van der Pol and van der Pol - Duffing oscillators. Broadband synchronization","19 pages, 9 figures",,"10.1016/j.physd.2009.04.016",,"nlin.CD","http://arxiv.org/licenses/nonexclusive-distrib/1.0/","  The particular properties of dynamics are discussed for the dissipatively
coupled van der Pol oscillators, non-identical in values of parameters
controlling the Hopf bifurcation. Possibility of a special synchronization
regime in an infinitively long band between oscillation death and quasiperiodic
areas is shown for such system. Features of the bifurcation picture are
discussed for different values of the control parameters and for the case of
additional Duffing-type nonlinearity. Analysis of the abridged equations is
presented.
","[{""version"":""v1"",""created"":""Thu, 8 May 2008 11:19:13 GMT""}]","2013-07-01"
"0805.1142","Alberto Nigoche","A. Nigoche-Netro, A. Ruelas-Mayorga, and A. Franco Balderas","The Fundamental Plane for early-type galaxies. Dependence on the
  magnitude range","11 pages, 5 figures. MNRAS. Accepted",,"10.1111/j.1365-2966.2008.14145.x",,"astro-ph","http://arxiv.org/licenses/nonexclusive-distrib/1.0/","  Studying 3 samples of early-type galaxies, which include approximately 8800
galaxies and cover a relatively ample magnitude range ($<\Delta M>$ $\sim 5$
$mag$), we find that the coefficients as well as the intrinsic dispersion of
the Fundamental Plane depend on the width of the magnitude range within which
the galaxies are distributed. We analyse this dependence and the results show
that it could be due to the fact that the distribution of galaxies in the space
defined by the variables $\log (r_{e}), <\mu>_{e}, \log(\sigma)$ depends on the
luminosity.
","[{""version"":""v1"",""created"":""Thu, 8 May 2008 11:23:44 GMT""},{""version"":""v2"",""created"":""Wed, 14 May 2008 01:10:02 GMT""},{""version"":""v3"",""created"":""Thu, 23 Oct 2008 14:41:27 GMT""},{""version"":""v4"",""created"":""Mon, 27 Oct 2008 12:37:20 GMT""}]","2009-11-13"
"0805.1143","Maria-Rosa Cioni Dr.","M.-R.L. Cioni, M. Irwin, A.M.N. Ferguson, A. McConnachie, B.C. Conn,
  A. Huxor, R. Ibata, G. Lewis, N. Tanvir","AGB stars as tracers of metallicity and mean age across M33","18 pages, 18 figures, accepted by Astronomy & Astrophysics",,"10.1051/0004-6361:200809366",,"astro-ph","http://arxiv.org/licenses/nonexclusive-distrib/1.0/","  Wide-field JHKs near-infrared observations covering an area of 1.8x1.8 sq.
deg. centred on M33 were obtained using WFCAM at UKIRT. These data show a large
population of intermediate-age asymptotic giant branch stars (AGB). We have
used both C-type and M-type AGB stars to determine spatial variations in
metallicity and mean age across the galaxy. We distinguished between C-type and
M-type AGB stars from their location in the colour-magnitude diagram (J-Ks,
Ks). The distribution of these stars is supported by a cross-identification
between our sample and a catalogue of optically confirmed, long-period variable
stars, as well as with the list of sources detected by Spitzer in the
mid-infrared. We calculated the C/M ratio and the orientation of the galaxy in
the sky, and compared the Ks magnitude distribution with theoretical
distributions spanning a range of metallicities and star formation rates
(SFRs). The C/M ratio surface map confirms a metallicity gradient in the galaxy
corresponding to a spread in [Fe/H]=0.6 dex with substructures in the inner and
outer galaxy. Magnitude and colour variations suggest orientation and
extinction effects on the galaxy disc. Maps showing the distribution of mean
age and metallicity obtained from the Ks method suggest that: the outer galaxy
disc/halo is metal poorer than the nuclear region and metal-rich clumps in the
inner galaxy change location with time. The average outer ring and nuclear
stellar population is ~6 Gyr old while central regions are a few Gyr younger.
","[{""version"":""v1"",""created"":""Thu, 8 May 2008 11:24:04 GMT""}]","2009-11-13"
"0805.1144","Frank H. Lutz","Frank H. Lutz, Thom Sulanke, Ed Swartz","f-Vectors of 3-Manifolds","33 pages, 2 figures, 14 tables, reference updated, to appear in The
  Electronic Journal of Combinatorics",,,,"math.CO math.GT","http://arxiv.org/licenses/nonexclusive-distrib/1.0/","  In 1970, Walkup completely described the set of $f$-vectors for the four
3-manifolds $S^3$, $S^2 twist S^1$, $S^2 \times S^1$, and $RP^3$. We improve
one of Walkup's main restricting inequalities on the set of $f$-vectors of
3-manifolds. As a consequence of a bound by Novik and Swartz, we also derive a
new lower bound on the number of vertices that are needed for a combinatorial
$d$-manifold in terms of its $\beta_1$-coefficient, which partially settles a
conjecture of K\""uhnel. Enumerative results and a search for small
triangulations with bistellar flips allow us, in combination with the new
bounds, to completely determine the set of $f$-vectors for twenty further
3-manifolds, that is, for the connected sums of sphere bundles $(S^2 \times
S^1)^{# k}$ and twisted sphere bundles $(S^2 twist S^1)^{# k}$, where
$k=2,3,4,5,6,7,8,10,11,14$. For many more 3-manifolds of different geometric
types we provide small triangulations and a partial description of their set of
$f$-vectors. Moreover, we show that the 3-manifold $RP^3 # RP^3$ has (at least)
two different minimal $g$-vectors.
","[{""version"":""v1"",""created"":""Thu, 8 May 2008 11:24:31 GMT""},{""version"":""v2"",""created"":""Wed, 13 May 2009 12:45:22 GMT""},{""version"":""v3"",""created"":""Mon, 18 May 2009 20:40:10 GMT""}]","2009-05-18"
"0805.1145","Bianca Poggianti dr","Bianca M. Poggianti, Vandana Desai, Rose Finn, Steven Bamford,
  Gabriella De Lucia, Jesus Varela, Alfonso Aragon-Salamanca, Claire Halliday,
  Stefan Noll, Roberto Saglia, Dennis Zaritsky, Philip Best, Douglas Clowe, Bo
  Milvang-Jensen, Pascale Jablonka, Roser Pello, Gregory Rudnick, Luc Simard,
  Anja von der Linden, Simon White","The relation between star formation, morphology and local density in
  high redshift clusters and groups","21 pages, 14 figures, accepted for publication in ApJ",,"10.1086/589936",,"astro-ph","http://arxiv.org/licenses/nonexclusive-distrib/1.0/","  We investigate how the [OII] properties and the morphologies of galaxies in
clusters and groups at z=0.4-0.8 depend on projected local galaxy density, and
compare with the field at similar redshifts and clusters at low-z. In both
nearby and distant clusters, higher-density regions contain proportionally
fewer star-forming galaxies, and the average [OII] equivalent width of
star-forming galaxies is independent of local density. However, in distant
clusters the average current star formation rate (SFR) in star-forming galaxies
seems to peak at densities ~15-40 galaxies Mpc^{-2}. At odds with low-z
results, at high-z the relation between star-forming fraction and local density
varies from high- to low-mass clusters. Overall, our results suggest that at
high-z the current star formation (SF) activity in star-forming galaxies does
not depend strongly on global or local environment, though the possible SFR
peak seems at odds with this conclusion. We find that the cluster SFR
normalized by cluster mass anticorrelates with mass and correlates with the
star-forming fraction. These trends can be understood given a) that the average
star-forming galaxy forms about 1 Msun/yr in all clusters; b) that the total
number of galaxies scales with cluster mass and c) the dependence of
star-forming fraction on cluster mass. We present the morphology-density (MD)
relation for our z=0.4-0.8 clusters, and uncover that the decline of the spiral
fraction with density is entirely driven by galaxies of types Sc or later. For
galaxies of a given Hubble type, we see no evidence that SF properties depend
on local environment. In contrast with recent findings at low-z, in our distant
clusters the SF-density relation and the MD-relation are equivalent, suggesting
that neither of the two is more fundamental than the other.(abr.)
","[{""version"":""v1"",""created"":""Thu, 8 May 2008 11:40:01 GMT""}]","2009-11-13"
"0805.1146","Filip Dutka","F. Dutka, M. Napiorkowski, and S. Dietrich","Effective Hamiltonian for fluid membranes in the presence of long-ranged
  forces","12 pages, 1 figure","Phys. Rev. E 78, 021602 (2008)","10.1103/PhysRevE.78.021602",,"cond-mat.soft cond-mat.stat-mech","http://arxiv.org/licenses/nonexclusive-distrib/1.0/","  If the constituent particles of fluid phases interact via long-ranged van der
Waals forces, the effective Hamiltonian for \emph{interfaces} between such
fluid phases contains - in lateral Fourier space - non-analytic terms $ \sim
q^4 \ln q$. Similar non-analytic terms characterize the effective Hamiltonian
for two interacting interfaces which can emerge between the three possible
coexisting fluid phases in binary liquid mixtures. This is in contrast with the
structure of the phenomenological Helfrich Hamiltonian for membranes which does
not contain such non-analytic terms. We show that under favorable conditions
for the bulk densities characterizing a binary liquid mixture and for the
long-ranged interparticle interactions the corresponding effective Hamiltonian
for a model fluid \emph{membrane} does not exhibit such non-analytic
contributions. We discuss the properties of the resulting effective
Hamiltonian, with a particular emphasis on the influence of the long range of
the interactions on the coefficient of the bending rigidity.
","[{""version"":""v1"",""created"":""Thu, 8 May 2008 11:32:00 GMT""}]","2010-05-14"
"0805.1147","Kentaro Wada","Kentaro Wada","A cellular algebra with certain idempotent decomposition","37pages",,,,"math.RT","http://arxiv.org/licenses/nonexclusive-distrib/1.0/","  For a cellular algebra $\A$ with a cellular basis $\ZC$, we consider a
decomposition of the unit element $1_\A$ into orthogonal idempotents (not
necessary primitive) satisfying some conditions. By using this decomposition,
the cellular basis $\ZC$ can be partitioned into some pieces with good
properties. Then by using a certain map $\a$, we give a coarse partition of
$\ZC$ whose refinement is the original partition. We construct a Levi type
subalgebra $\aA$ of $\A$ and its quotient algebra $\oA$, and also construct a
parabolic type subalgebra $\tA$ of $\A$, which contains $\aA$ with respect to
the map $\a$. Then, we study the relation of standard modules, simple modules
and decomposition numbers among these algebras. Finally, we study the
relationship of blocks among these algebras.
","[{""version"":""v1"",""created"":""Thu, 8 May 2008 11:39:01 GMT""}]","2008-05-09"
"0805.1148","Chenggang Shu","Chenggang Shu, Binglu Zhou, Matthias Bartelmann, Julia M. Comerford,
  J.-S. Huang, Yannick Mellier","Comparisons between isothermal and NFW mass profiles for strong-lensing
  galaxy clusters","11 pages, 15 figures; accepted for publication in ApJ",,"10.1086/590049",,"astro-ph","http://arxiv.org/licenses/nonexclusive-distrib/1.0/","  While both isothermal and NFW-based mass models for galaxy clusters are
widely adopted in strong-lensing studies, they cannot easily be distinguished
based solely on observed positions of arcs and arclets. We compare the
magnifications predicted for giant arcs obtained from isothermal and NFW
profiles, taking axially-symmetric and asymmetric mass distributions into
account. We find that arc magnifications can differ strongly between the two
types of density profiles even if the image morphology is well reproduced.
Magnifications by lenses with NFW density profiles are usually larger than
those for lenses with singular or nearly singular isothermal density profiles,
unless the latter have large cores. Asymmetries play an important role. We
illustrate our results with the two well-studied clusters MS 2137 and A~370. We
confirm earlier results showing that both isothermal and NFW mass models can
very well reproduce the observed arcs, radial arcs and other arclets. While the
mass model for MS 2137 is not very well constrained, the two types of mass
models produce strongly differing critical curves and caustics for A~370. We
find that the NFW mass profile is preferred for A~370. We identify new arclet
candidates in the field of A~370. Redshift estimates allowed by the lens model
are consistent with results in the literature, where available. Three newly
found counter-images are suggested to arise from an active, dust-enshrouded
star-forming galaxy at $z\approx1.1$.
","[{""version"":""v1"",""created"":""Thu, 8 May 2008 11:59:41 GMT""}]","2009-11-13"
"0805.1149","Rubakov Valery","M.Osipov and V.Rubakov","Superluminality in the Fierz--Pauli massive gravity","11 pages, no figures","Class.Quant.Grav.25:235006,2008","10.1088/0264-9381/25/23/235006","INR-TH-05-08-08","hep-th gr-qc","http://arxiv.org/licenses/nonexclusive-distrib/1.0/","  We study the propagation of helicity-1 gravitons in the Fierz--Pauli massive
gravity in nearly Minkowski backgrounds. We show that, generically, there exist
backgrounds consistent with field equations, in which the propagation is
superluminal. The relevant distances are much longer than the ultraviolet
cutoff length inherent in the Fierz--Pauli gravity, so superluminality occurs
within the domain of validity of the effective low energy theory. There remains
a possibility that one may get rid of this property by imposing fine tuning
relations between the coefficients in the non-linear generalization of the
Fierz--Pauli mass term, order by order in non-linearity; however, these
relations are not protected by any obvious symmetry. Thus, among others,
superluminality is a problematic property to worry about when attempting to
construct infrared modifications of General Relativity.
","[{""version"":""v1"",""created"":""Thu, 8 May 2008 11:43:10 GMT""}]","2008-11-26"
"0805.1150","Mustafa Savci","T. M. Aliev (a), A. Bekmezci (b), M. Savci (a) (a) (Physics
  Department, Middle East Technical University-Ankara-Turkey) (b) (Physics
  Department, Mugla University, Mugla, Turkey)","Unparticle effects in rare (t -> c g g) decay","15 pages, 7 figures, LaTeX formatted","Phys.Rev.D78:057701,2008","10.1103/PhysRevD.78.057701","metu-phys-hep-015-08","hep-ph","http://arxiv.org/licenses/nonexclusive-distrib/1.0/","  Rare (t -> c g g) decay can only appear at loop level in the Standard Model
(SM), and naturally they are strongly suppressed. These flavor changing decays
induced by the mediation of spin-0 and spin-2 unparticles, can appear at tree
level in unparticle physics. In this work the virtual effects of unparticle
physics in the flavor-changing (t -> c g g) decay is studied. Using the SM
result for the branching ratio of the (t -> c g g) decay, the parameter space
of d_U and Lambda_U, where the branching ratio of this decay exceeds the one
predicted by the SM, is obtained. Measurement of the branching ratio larger
than 10^(-9) can give valuable information for establishing unparticle physics.
","[{""version"":""v1"",""created"":""Thu, 8 May 2008 11:52:18 GMT""}]","2009-01-09"
"0805.1151","Andreas Honecker","A. Honecker, J. Richter","Enhanced low-temperature entropy and flat-band ferromagnetism in the t-J
  model on the sawtooth lattice","2 pages including 2 figures, uses elsart style files; (proceedings of
  ICM 2006)","J. Magn. Magn. Mater. 310 (2007) 1331-1333","10.1016/j.jmmm.2006.10.357",,"cond-mat.str-el","http://arxiv.org/licenses/nonexclusive-distrib/1.0/","  Using the example of the sawtooth chain, we argue that the t-J model shares
important features with the Hubbard model on highly frustrated lattices. The
lowest single-fermion band is completely flat (for a specific choice of the
hopping parameters $t_{i,j}$ in the case of the sawtooth chain), giving rise to
single-particle excitations which can be localized in real space. These
localized excitations do not interact for sufficient spatial separations such
that exact many-electron states can also be constructed. Furthermore, all these
excitations acquire zero energy for a suitable choice of the chemical potential
$\mu$. This leads to: (i) a jump in the particle density at zero temperature,
(ii) a finite zero-temperature entropy, (iii) a ferromagnetic ground state with
a charge gap when the flat band is fully occupied and (iv) unusually large
temperature variations when $\mu$ is varied adiabatically at finite
temperature.
","[{""version"":""v1"",""created"":""Thu, 8 May 2008 11:55:30 GMT""}]","2008-05-09"
"0805.1152","Marcelo Cerminara","E. Catsigeras, M. Cerminara and H. Enrich","The real analytic Feigenbaum-Coullet-Tresser attractor in the disk",,"Dynamical Systems Vol. 25, No. 4, December 2010, 519-529","10.1080/14689361003785727",,"math.DS","http://arxiv.org/licenses/nonexclusive-distrib/1.0/","  We consider a real analytic diffeomorphism $\psi_0$ on a n-dimensional disk
D, n >= 2, exhibiting a Feigenbaum-Coullet-Tresser (F.C.T.) attractor, being
far, in the standard topology of the real analytic diffeomorphism space C(D),
from the standard F.C.T. map $\phi_0$ fixed by the double renormalization. We
prove that $\psi_0$ persists along a codimension-one manifold M \subset C(D),
and that it is the bifurcating map along any one-parameter family in $C(D)$
transversal to M, from diffeomorphisms attracted to sinks, to those which
exhibit chaos. The main tool in the proofs is a theorem of Functional Analysis,
which we state and prove in this paper, characterizing the existence of
codimension one submanifolds in any abstract functional Banach space.
","[{""version"":""v1"",""created"":""Thu, 8 May 2008 12:34:30 GMT""}]","2011-01-12"
"0805.1153","\^Hamed  \""Owladeghaffari","H.Owladeghaffari","Contact state analysis using NFIS and SOM","Proc. International Symposium on Computational Mechanics (ISCM2007),
  Yao ZH & Yuan MW (eds.), Beijing: Tsinghua University Press & Springer, July
  30-August 1, 2007, Beijing, China,",,,,"cs.NE cs.AI","http://arxiv.org/licenses/nonexclusive-distrib/1.0/","  This paper reports application of neuro- fuzzy inference system (NFIS) and
self organizing feature map neural networks (SOM) on detection of contact state
in a block system. In this manner, on a simple system, the evolution of contact
states, by parallelization of DDA, has been investigated. So, a comparison
between NFIS and SOM results has been presented. The results show applicability
of the proposed methods, by different accuracy, on detection of contact's
distribution.
","[{""version"":""v1"",""created"":""Thu, 8 May 2008 12:10:21 GMT""}]","2008-05-09"
