"0805.1079","Graeme Milton","Graeme W. Milton and Pierre Seppecher","Electromagnetic Circuits","33 pages, 11 figures. Two new sections have been added (section 4 and
  6). Two new figures, 4 and 8 have been added. Definitions have been
  clarified. An example is now given of a material with non-Maxwellian behavior",,,,"physics.class-ph physics.optics","http://arxiv.org/licenses/nonexclusive-distrib/1.0/","  The electromagnetic analog of an elastic spring-mass network is constructed.
These electromagnetic circuits offer the promise of manipulating
electromagnetic fields in new ways, and linear electrical circuits correspond
to a subclass of them. They consist of thin triangular magnetic components
joined at the edges by cylindrical dielectric components. (There are also dual
electromagnetic circuits consisting of thin triangular dielectric components
joined at the edges by cylindrical magnetic components.) Some of the edges can
be terminal edges to which electric fields are applied. The response is
measured in terms of the real or virtual free currents that are associated with
the terminal edges. The relation between the terminal electric fields and the
terminal free currents is governed by a symmetric complex matrix $\BW$. In the
case where all the terminal edges are disjoint, and the frequency is fixed, a
complete characterization is obtained of all possible response matrices $\BW$
both in the lossless and lossy cases. This is done by introducing a subclass of
electromagnetic circuits, called electromagnetic ladder networks. It is shown
that an electromagnetic ladder network, structured as a cubic network, can have
a macroscopic electromagnetic continuum response which is non-Maxwellian, and
novel.
","[{""version"":""v1"",""created"":""Thu, 8 May 2008 00:28:51 GMT""},{""version"":""v2"",""created"":""Fri, 1 Aug 2008 22:51:59 GMT""}]","2008-08-02"
"0805.1080","Chun-Yuan Gao","Chang-Qun Ma and Chun-Yuan Gao","Dynamical chiral symmetry breaking in strangelets at finite temperature","To appear in Proceedings for ""Compact stars in the QCD phase diagram
  II (CSQCD II), May 20-24, 2009, KIAA at Peking University, Beijing - P. R.
  China [http://vega.bac.pku.edu.cn/rxxu/csqcd.htm]",,,,"nucl-th","http://arxiv.org/licenses/nonexclusive-distrib/1.0/","  A model for strangelets at finite temperature is built, in which the quark
masses are dynamically generated. The dynamical chiral symmetry breaking inside
strangelets at finite temperature is investigated. It is found that the chiral
symmetry is going to break spontaneously inside the strangelets at some finite
temperature, and then the masses of strange quarks inside the strangelets
increase as the temperature rises. The phenomenon that strange quark mass
increases with temperature after the chiral symmetry breaks spontaneously is
illustrated by some typical numerical examples.
","[{""version"":""v1"",""created"":""Thu, 8 May 2008 00:38:25 GMT""},{""version"":""v2"",""created"":""Tue, 8 Dec 2009 07:50:33 GMT""}]","2009-12-08"
"0805.1081","Yanzhang He","Yanzhang He, Chengguang Bao","Periodic giant-persistent current in sharp pulses on a ring","5 pages, 5 figures","Can. J. Phys. 87 (2009) 967","10.1139/P09-088",,"cond-mat.other","http://arxiv.org/licenses/nonexclusive-distrib/1.0/","  We show here a mesoscopic device based on a narrow ring containing an
electron. In the device, an amount of energy is stored in advance. Similar to
the pendulum, an exact periodic motion of the electron is thereby initiated
afterward. The motion appears as a series of sharp pulses, and is in nature
different from the well known Aharonov-Bohm (A-B) oscillation. In particular,
the pulses of current can be tuned to be very strong (say, more than two orders
stronger than the usual A-B current). Related theory and numerical results are
presented.
","[{""version"":""v1"",""created"":""Thu, 8 May 2008 00:53:32 GMT""},{""version"":""v2"",""created"":""Sun, 10 Jan 2010 03:26:08 GMT""}]","2010-01-10"
"0805.1082","Peter Clark","Pete L. Clark","Elliptic Dedekind Domains Revisited","9 pages",,,,"math.AC math.NT","http://arxiv.org/licenses/nonexclusive-distrib/1.0/","  We give an affirmative answer to a 1976 question of M. Rosen: every abelian
group is isomorphic to the class group of an elliptic Dedekind domain R. We can
choose R to be the integral closure of a PID in a separable quadratic field
extension. In particular, this yields new and -- we feel -- simpler proofs of
theorems of L. Claborn and C.R. Leedham-Green.
","[{""version"":""v1"",""created"":""Thu, 8 May 2008 01:00:15 GMT""}]","2008-05-09"
"0805.1083","Michel Pioro-Ladri\`ere","M. Pioro-Ladriere, T. Obata, Y. Tokura, Y.-S. Shin, T. Kubo, K.
  Yoshida, T. Taniyama and S. Tarucha","Electrically driven single electron spin resonance in a slanting Zeeman
  field","25 pages, 6 figures",,"10.1038/nphys1053",,"cond-mat.mtrl-sci","http://arxiv.org/licenses/nonexclusive-distrib/1.0/","  The rapidly rising fields of spintronics and quantum information science have
led to a strong interest in developing the ability to coherently manipulate
electron spins. Electron spin resonance (ESR) is a powerful technique to
manipulate spins that is commonly achieved by applying an oscillating magnetic
field. However, the technique has proven very challenging when addressing
individual spins. In contrast, by mixing the spin and charge degrees of freedom
in a controlled way through engineered non-uniform magnetic fields, electron
spin can be manipulated electrically without the need of high-frequency
magnetic fields. Here we realize electrically-driven addressable spin rotations
on two individual electrons by integrating a micron-size ferromagnet to a
double quantum dot device. We find that the electrical control and spin
selectivity is enabled by the micro-magnet's stray magnetic field which can be
tailored to multi-dots architecture. Our results demonstrate the feasibility of
manipulating electron spins electrically in a scalable way.
","[{""version"":""v1"",""created"":""Thu, 8 May 2008 02:35:40 GMT""}]","2009-11-13"
"0805.1084","David Turner Dr.","David G. Turner, D. Forbes, D. English, P. J. T. Leonard, J. N.
  Scrimger, A. W. Wehlau, R. L. Phelps, L. N. Berdnikov, E. N. Pastukhova","Galactic clusters with associated Cepheid variables. VII. Berkeley 58
  and CG Cassiopeiae","Accepted for Publication (MNRAS)",,"10.1111/j.1365-2966.2008.13413.x",,"astro-ph","http://arxiv.org/licenses/nonexclusive-distrib/1.0/","  Photoelectric, photographic, and CCD UBV photometry, spectroscopic
observations, and star counts are presented for the open cluster Berkeley 58 to
examine a possible association with the 4.37d Cepheid CG Cas. The cluster is
difficult to separate from the early-type stars belonging to the Perseus spiral
arm, in which it is located, but has reasonably well-defined parameters: an
evolutionary age of ~10^8 years, a mean reddening of E(B-V)_(B0)=0.70+-0.03
s.e., and a distance of 3.03+-0.17 kpc (V_0-M_V=12.40+-0.12 s.d.). CG Cas is a
likely cluster coronal member on the basis of radial velocity, and its period
increase of +0.170+-0.014 s yr^(-1) and large light amplitude describe a
Cepheid in the third crossing of the instability strip lying slightly blueward
of strip centre. Its inferred reddening and luminosity are E(B-V)=0.64+-0.02
s.e. and <M_V> =-3.06+-0.12. A possible K supergiant may also be a cluster
member.
","[{""version"":""v1"",""created"":""Thu, 8 May 2008 01:07:06 GMT""}]","2009-11-13"
"0805.1085","Liaofu Luo","Liaofu Luo","On the Law of Directionality of Genome Evolution","18 pages",,,"Version 2-2011","q-bio.GN q-bio.CB","http://arxiv.org/licenses/nonexclusive-distrib/1.0/","  The problem of the directionality of genome evolution is studied from the
information-theoretic view. We propose that the function-coding information
quantity of a genome always grows in the course of evolution through sequence
duplication, expansion of code, and gene transfer between genomes. The
function-coding information quantity of a genome consists of two parts,
p-coding information quantity which encodes functional protein and n-coding
information quantity which encodes other functional elements except amino acid
sequence. The relation of the proposed law to the thermodynamic laws is
indicated. The evolutionary trends of DNA sequences revealed by bioinformatics
are investigated which afford further evidences on the evolutionary law. It is
argued that the directionality of genome evolution comes from species
competition adaptive to environment. An expression on the evolutionary rate of
genome is proposed that the rate is a function of Darwin temperature
(describing species competition) and fitness slope (describing adaptive
landscape). Finally, the problem of directly experimental test on the
evolutionary directionality is discussed briefly.
","[{""version"":""v1"",""created"":""Thu, 8 May 2008 01:13:20 GMT""},{""version"":""v2"",""created"":""Thu, 4 Aug 2011 01:01:54 GMT""}]","2011-08-05"
"0805.1086","Dionisio Bazeia","V.I. Afonso, D. Bazeia, M.A. Gonzalez Leon, L. Losano, J. Mateos
  Guilarte","Construction of topological defect networks with complex scalar fields","25 pages, 14 figures; new version to appear in NPB","Nucl.Phys.B810:427-459,2009","10.1016/j.nuclphysb.2008.09.026",,"hep-th cond-mat.stat-mech hep-ph","http://arxiv.org/licenses/nonexclusive-distrib/1.0/","  This work deals with the construction of networks of topological defects in
models described by a single complex scalar field. We take advantage of the
deformation procedure recently used to describe kinklike defects in order to
build networks of topological defects, which appear from complex field models
with potentials that engender a finite number of isolated minima, both in the
case where the minima present discrete symmetry, and in the non symmetric case.
We show that the presence of symmetry guide us to the construction of regular
networks, while the non symmetric case gives rise to irregular networks which
spread throughout the complex field space. We also discuss bifurcation, a
phenomenon that appear in the non symmetric case, but is washed out by the
deformation procedure used in the present work.
","[{""version"":""v1"",""created"":""Thu, 8 May 2008 01:15:32 GMT""},{""version"":""v2"",""created"":""Mon, 12 May 2008 13:55:37 GMT""},{""version"":""v3"",""created"":""Thu, 18 Sep 2008 01:00:00 GMT""}]","2009-01-29"
"0805.1088","MinJi Kim","MinJi Kim, Jay Kumar Sundararajan, Muriel Medard","Network Coding for Speedup in Switches","5 pages, 4 figures, IEEE ISIT 2007",,"10.1109/ISIT.2007.4557368",,"cs.NI cs.IT math.IT","http://arxiv.org/licenses/nonexclusive-distrib/1.0/","  We present a graph theoretic upper bound on speedup needed to achieve 100%
throughput in a multicast switch using network coding. By bounding speedup, we
show the equivalence between network coding and speedup in multicast switches -
i.e. network coding, which is usually implemented using software, can in many
cases substitute speedup, which is often achieved by adding extra switch
fabrics. This bound is based on an approach to network coding problems called
the ""enhanced conflict graph"". We show that the ""imperfection ratio"" of the
enhanced conflict graph gives an upper bound on speedup. In particular, we
apply this result to K-by-N switches with traffic patterns consisting of
unicasts and broadcasts only to obtain an upper bound of min{(2K-1)/K,
2N/(N+1)}.
","[{""version"":""v1"",""created"":""Thu, 8 May 2008 02:20:15 GMT""}]","2016-11-15"
"0805.1089","Giuliano Pignata","G. Pignata, S. Benetti, P. A. Mazzali, R. Kotak, F. Patat, P. Meikle,
  M. Stehle, B. Leibundgut, N. B. Suntzeff, L. M. Buson, E. Cappellaro, A.
  Clocchiatti, M. Hamuy, J. Maza, J. Mendez, P. Ruiz-Lapuente, M. Salvo, B. P.
  Schmidt, M. Turatto and W. Hillebrandt","Optical and IR observations of SN 2002dj: some possible common
  properties of fast expanding SNe Ia","Equations A4, A5 and A7 in the appendix section have been corrected.
  Part of text in the appendix has been removed",,"10.1111/j.1365-2966.2008.13434.x",,"astro-ph","http://arxiv.org/licenses/nonexclusive-distrib/1.0/","  As part of the European Supernova Collaboration we obtained extensive
photometry and spectroscopy of the type Ia SN 2002dj covering epochs from 11
days before to nearly two years after maximum. Detailed optical and
near-infrared observations show that this object belongs to the class of the
high-velocity gradient events as indicated by Si, S and Ca lines. The light
curve shape and velocity evolution of SN 2002dj appear to be nearly identical
to SN 2002bo. The only significant difference is observed in the optical to
near-IR colours and a reduced spectral emission beyond 6500 A. For
high-velocity gradient Type Ia supernovae, we tentatively identify a faster
rise to maximum, a more pronounced inflection in the V and R light curves after
maximum and a brighter, slower declining late-time B light curve as common
photometric properties of this class of objects. They also seem to be
characterized by a different colour and colour evolution with respect to
``normal'' SNe Ia. The usual light curve shape parameters do not distinguish
these events. Stronger, more blueshifted absorption features of
intermediate-mass elements and lower temperatures are the most prominent
spectroscopic features of Type Ia supernovae displaying high velocity
gradients. It appears that these events burn more intermediate-mass elements in
the outer layers. Possible connections to the metallicity of the progenitor
star are explored.
","[{""version"":""v1"",""created"":""Thu, 8 May 2008 02:07:25 GMT""},{""version"":""v2"",""created"":""Wed, 11 Jun 2008 16:33:57 GMT""}]","2009-11-13"
"0805.1090","Tzu-Chieh Wei","Tzu-Chieh Wei (IQC, University of Waterloo)","Relative entropy of entanglement for certain multipartite mixed states","Single column, 22 pages, 9 figures, comments welcome","Phys. Rev. A 78, 012327 (2008)","10.1103/PhysRevA.78.012327",,"quant-ph","http://arxiv.org/licenses/nonexclusive-distrib/1.0/","  We prove conjectures on the relative entropy of entanglement (REE) for two
families of multipartite qubit states. Thus, analytic expressions of REE for
these families of states can be given. The first family of states are composed
of mixture of some permutation-invariant multi-qubit states. The results
generalized to multi-qudit states are also shown to hold. The second family of
states contain D\""ur's bound entangled states. Along the way, we have discussed
the relation of REE to two other measures: robustness of entanglement and
geometric measure of entanglement, slightly extending previous results.
","[{""version"":""v1"",""created"":""Thu, 8 May 2008 02:17:51 GMT""}]","2008-10-15"
"0805.1091","Ryoji Enomoto","R.Enomoto, Y.Higashi, T.Yoshida, T.Tanimori, et al","CANGAROO-III Search for Gamma Rays from Kepler's Supernova Remnant","6 pages 6 figures, to appear in ApJ, August 20, 2008, v683n2","ApJ, 683 (2008) 383","10.1086/589912",,"astro-ph","http://arxiv.org/licenses/nonexclusive-distrib/1.0/","  Kepler's supernova, discovered in October 1604, produced a remnant that has
been well studied observationally in the radio, infrared, optical, and X-ray
bands, and theoretically. Some models have predicted a TeV gamma-ray flux that
is detectable with current Imaging Cherenkov Atmospheric Telescopes. We report
on observations carried out in 2005 April with the CANGAROO-III telescope. No
statistically significant excess was observed, and limitations on the allowed
parameter range in the model are discussed.
","[{""version"":""v1"",""created"":""Thu, 8 May 2008 02:31:42 GMT""}]","2009-11-13"
"0805.1092","Petr Plechac","Petr Plechac and Mathias Rousset","Exact and non-stiff sampling of highly oscillatory systems: an implicit
  mass-matrix penalization approach","32 pages, 5 figures",,,,"math.NA","http://arxiv.org/licenses/nonexclusive-distrib/1.0/","  We propose and analyze an implicit mass-matrix penalization (IMMP) technique
which enables efficient and exact sampling of the (Boltzmann/Gibbs) canonical
distribution associated to Hamiltonian systems with fast degrees of freedom
(fDOFs). The penalty parameters enable arbitrary tuning of the timescale for
the selected fDOFs, and the method is interpreted as an interpolation between
the exact Hamiltonian dynamics and the dynamics with infinitely slow fDOFs
(equivalent to geometrically corrected rigid constraints). This property
translates in the associated numerical methods into a tunable trade-off between
stability and dynamical modification. The penalization is based on an extended
Hamiltonian with artificial constraints associated with each fDOF. By
construction, the resulting dynamics is statistically exact with respect to the
canonical distribution in position variables.
  The algorithms can be easily implemented with standard geometric integrators
with algebraic constraints given by the expected fDOFs, and has no additional
complexity in terms of enforcing the constraint and force evaluations. The
method is demonstrated on a high dimensional system with non-convex
interactions. Prescribing the macroscopic dynamical timescale, it is shown that
the IMMP method increases the time-step stability region with a gain that grows
linearly with the size of the system. The latter property, as well as
consistency of the macroscopic dynamics of the IMMP method is proved rigorously
for linear interactions. Finally, when a large stiffness parameter is
introduced, the IMMP method can be tuned to be asymptotically stable,
converging towards the heuristically expected Markovian effective dynamics on
the slow manifold.
","[{""version"":""v1"",""created"":""Thu, 8 May 2008 02:54:46 GMT""},{""version"":""v2"",""created"":""Tue, 4 Nov 2008 03:49:32 GMT""}]","2008-11-04"
"0805.1093","Wei Liu","W. Liu and R. J. Fries","Heavy Quark Production from Jet Conversions in a Quark-Gluon Plasma","5 pages, 7 figures","Phys.Rev.C78:037902,2008","10.1103/PhysRevC.78.037902",,"nucl-th","http://arxiv.org/licenses/nonexclusive-distrib/1.0/","  Recently, it has been demonstrated that the chemical composition of jets in
heavy ion collisions is significantly altered compared to jets in the vacuum.
This signal can be used to probe the medium formed in nuclear collisions. In
this study we investigate the possibility that fast light quarks and gluons can
convert to heavy quarks when passing through a quark gluon plasma. We study the
rate of light to heavy jet conversions in a consistent Fokker-Planck framework
and investigate their impact on the production of high-$p_T$ charm and bottom
quarks at RHIC and LHC.
","[{""version"":""v1"",""created"":""Thu, 8 May 2008 02:54:18 GMT""}]","2008-11-26"
"0805.1094","Adria Updike Ms","Adria C. Updike, Joshua B. Haislip, Melissa C. Nysewander, Andrew S.
  Fruchter, D. Alexander Kann, Sylvio Klose, Peter A. Milne, G. Grant Williams,
  Weikang Zheng, Carl W. Hergenrother, Jason X. Prochaska, Jules P. Halpern,
  Nestor Mirabal, John R. Thorstensen, Alexander J. van der Horst, Rhaana L. C.
  Starling, Judith L. Racusin, David N. Burrows, N. P. M. Kuin, Peter W. A.
  Roming, Eric Bellm, Kevin Hurley, Weidong Li, Alexei V. Filippenko, Cullen
  Blake, Dan Starr, Emilio E. Falco, Warren R. Brown, Xinyu Dai, Jinsong Deng,
  Liping Xin, Yulei Qiu, Jianyan Wei, Yuji Urata, Domenico Nanni, Elisabetta
  Maiorano, Eliana Palazzi, Giuseppe Greco, Corrado Bartolini, Adriano
  Guarnieri, Adalberto Piccioni, Graziella Pizzichini, Federica Terra, Kuntal
  Misra, B. C. Bhatt, G. C. Anupama, X. Fan, L. Jiang, Ralph A. M. J. Wijers,
  Dan E. Reichart, Hala A. Eid, Ginger Bryngelson, Jason Puls, R. C.
  Goldthwaite, and Dieter H. Hartmann","The Rapidly Flaring Afterglow of the Very Bright and Energetic GRB
  070125","50 pages, 9 figures, 5 tables Accepted to the Astrophysical Journal",,"10.1086/590236",,"astro-ph","http://arxiv.org/licenses/nonexclusive-distrib/1.0/","  We report on multi-wavelength observations, ranging from the X-ray to radio
wave bands, of the IPN-localized gamma-ray burst GRB 070125. Spectroscopic
observations reveal the presence of absorption lines due to O I, Si II, and C
IV, implying a likely redshift of z = 1.547. The well-sampled light curves, in
particular from 0.5 to 4 days after the burst, suggest a jet break at 3.7 days,
corresponding to a jet opening angle of ~7.0 degrees, and implying an intrinsic
GRB energy in the 1 - 10,000 keV band of around E = (6.3 - 6.9)x 10^(51) erg
(based on the fluences measured by the gamma-ray detectors of the IPN network).
GRB 070125 is among the brightest afterglows observed to date. The spectral
energy distribution implies a host extinction of Av < 0.9 mag. Two
rebrightening episodes are observed, one with excellent time coverage, showing
an increase in flux of 56% in ~8000 seconds. The evolution of the afterglow
light curve is achromatic at all times. Late-time observations of the afterglow
do not show evidence for emission from an underlying host galaxy or supernova.
Any host galaxy would be subluminous, consistent with current GRB host-galaxy
samples. Evidence for strong Mg II absorption features is not found, which is
perhaps surprising in view of the relatively high redshift of this burst and
the high likelihood for such features along GRB-selected lines of sight.
","[{""version"":""v1"",""created"":""Thu, 8 May 2008 03:17:07 GMT""}]","2009-11-13"
"0805.1095","Kirill Bronnikov","K.A. Bronnikov, E. Elizalde, S.D. Odintsov, O.B. Zaslavskii","Horizons vs. singularities in spherically symmetric space-times","22 pages, 1 figure. Some comments added, misprints corrected. Final
  version appearing in PRD","Phys.Rev.D78:064049,2008","10.1103/PhysRevD.78.064049",,"gr-qc astro-ph hep-th","http://arxiv.org/licenses/nonexclusive-distrib/1.0/","  We discuss different kinds of Killing horizons possible in static,
spherically symmetric configurations and recently classified as ""usual"",
""naked"" and ""truly naked"" ones depending on the near-horizon behavior of
transverse tidal forces acting on an extended body. We obtain necessary
conditions for the metric to be extensible beyond a horizon in terms of an
arbitrary radial coordinate and show that all truly naked horizons, as well as
many of those previously characterized as naked and even usual ones, do not
admit an extension and therefore must be considered as singularities. Some
examples are given, showing which kinds of matter are able to create specific
space-times with different kinds of horizons, including truly naked ones. Among
them are fluids with negative pressure and scalar fields with a particular
behavior of the potential. We also discuss horizons and singularities in
Kantowski-Sachs spherically symmetric cosmologies and present horizon
regularity conditions in terms of an arbitrary time coordinate and proper
(synchronous) time. It turns out that horizons of orders 2 and higher occur in
infinite proper times in the past or future, but one-way communication with
regions beyond such horizons is still possible.
","[{""version"":""v1"",""created"":""Thu, 8 May 2008 03:51:16 GMT""},{""version"":""v2"",""created"":""Tue, 28 Oct 2008 18:00:03 GMT""}]","2009-02-23"
"0805.1096","Kaijun Wang Mr.","Kaijun Wang, Junying Zhang, Dan Li, Xinna Zhang and Tao Guo","Adaptive Affinity Propagation Clustering","an English version of original paper","K. Wang, J. Zhang, D. Li, X. Zhang and T. Guo. Adaptive Affinity
  Propagation Clustering. Acta Automatica Sinica, 33(12):1242-1246, 2007",,,"cs.AI","http://arxiv.org/licenses/nonexclusive-distrib/1.0/","  Affinity propagation clustering (AP) has two limitations: it is hard to know
what value of parameter 'preference' can yield an optimal clustering solution,
and oscillations cannot be eliminated automatically if occur. The adaptive AP
method is proposed to overcome these limitations, including adaptive scanning
of preferences to search space of the number of clusters for finding the
optimal clustering solution, adaptive adjustment of damping factors to
eliminate oscillations, and adaptive escaping from oscillations when the
damping adjustment technique fails. Experimental results on simulated and real
data sets show that the adaptive AP is effective and can outperform AP in
quality of clustering results.
","[{""version"":""v1"",""created"":""Thu, 8 May 2008 04:20:20 GMT""}]","2008-05-09"
"0805.1097","Dastgeer Shaikh","Dastgeer Shaikh, B. Dasgupta, Q. Hu and G. P. Zank","Minimum Dissipative Relaxed States Applied to Laboratory and Space
  Plasmas","Paper is accepted in JPP 2008",,,,"physics.space-ph physics.comp-ph","http://arxiv.org/licenses/nonexclusive-distrib/1.0/","  The usual theory of plasma relaxation, based on the selective decay of
magnetic energy over the (global) magnetic helicity, predicts a force-free
state for a plasma. Such a force-free state is inadequate to describe most
realistic plasma systems occurring in laboratory and space plasmas as it
produces a zero pressure gradient and cannot couple magnetic fields with flow.
A different theory of relaxation has been proposed by many authors, based on a
well-known principle of irreversible thermodynamics, the principle of minimum
entropy production rate which is equivalent to the minimum dissipation rate
(MDR) of energy. We demonstrate the applicability of minimum dissipative
relaxed states to various self-organized systems of magnetically confined
plasma in the laboratory and in the astrophysical context. Such relaxed states
are shown to produce a number of basic characteristics of laboratory plasma
confinement systems and solar arcade structure.
","[{""version"":""v1"",""created"":""Thu, 8 May 2008 04:39:09 GMT""}]","2008-05-09"
