"0805.1042","Alan Drew","A. J. Drew, F. L. Pratt, T. Lancaster, S. J. Blundell, P. J. Baker, R.
  H. Liu, G. Wu, X. H. Chen, I. Watanabe, V. K. Malik, A. Dubroka, K. W. Kim,
  M. Roessle, and C. Bernhard","Coexistence of magnetic fluctuations and superconductivity in the
  pnictide high temperature superconductor SmFeAsO$_{1-x}$F$_{x}$ measured by
  muon spin rotation","To appear in Physical Review Letters. Changes to title, figures 1 and
  4, references and (minor changes to) the text",,"10.1103/PhysRevLett.101.097010",,"cond-mat.supr-con","http://arxiv.org/licenses/nonexclusive-distrib/1.0/","  Muon-spin rotation experiments were performed on the pnictide high
temperature superconductor SmFeAsO$_{1-x}$F$_{x}$ with x=0.18 and 0.3. We
observed an unusual enhancement of slow spin fluctuations in the vicinity of
the superconducting which suggests that the spin fluctuations contribute to the
formation of an unconventional superconducting state. An estimate of the
in-plane penetration depth $\lambda_{ab}(0)=190(5)$\thinspace nm was obtained,
which confirms that the pnictide superconductors obey an Uemura-style
relationship between $T_{\mathrm{c}}$ and $\lambda_{ab}(0)^{-2}$.
","[{""version"":""v1"",""created"":""Wed, 7 May 2008 18:35:22 GMT""},{""version"":""v2"",""created"":""Tue, 29 Jul 2008 18:08:02 GMT""}]","2009-11-13"
"0805.1043","Peter Tingley","Peter Tingley","Some results on the crystal commutor and affine sl(n) crystals","UC Berkeley thesis. Contains material previously posted in
  arXiv:math/0610952, arXiv:math/0702062 and arXiv:0707.224. The introduction
  and Chapter 3.3 are new",,,,"math.QA","http://arxiv.org/licenses/nonexclusive-distrib/1.0/","  There are two parts to this work, which are largely independent.
  The first consists of a series of results concerning the crystal commutor of
Henriques and Kamnitzer. We first describe the relationship between the crystal
commutor and Drinfeld's unitarized R-matrix. We then give a new definition for
the crystal commutor, which makes sense for any symmetrizable Kac-Moody
algebra. We show that this new definition agrees with A. Henriques and J.
Kamnitzer's definition in the finite type case, but we cannot prove our
commutor remains a coboundary structure in other cases. Next, we extend these
ideas to give a new formula for the standard R-matrix.
  In the second part, we define three combinatorial models for affine sl(n)
crystals. These are parameterized by partitions, configurations of beads on an
""abacus"", and cylindric plane partitions, respectively. Our models are
reducible, but we can identify an irreducible subcrystal corresponding to any
dominant integral highest weight. Cylindric plane partitions actually
parameterize a basis for an irreducible representation of affine gl(n). This
allows us to calculate the partition function for a system of random cylindric
plane partitions first studied by A. Borodin. We also observe a form of
rank-level duality, originally due to I. Frenkel.
","[{""version"":""v1"",""created"":""Wed, 7 May 2008 18:57:29 GMT""}]","2008-05-08"
"0805.1044","Joanna Modlawska MSc","Joanna Modlawska and Andrzej Grudka","Increasing singlet fraction with entanglement swapping","5 pages, 4 figures","Phys. Rev. A 78, 032321 (2008)","10.1103/PhysRevA.78.032321",,"quant-ph","http://arxiv.org/licenses/nonexclusive-distrib/1.0/","  We consider entanglement swapping for certain mixed states. We assume that
the initial states have the same singlet fraction and show that the final state
can have singlet fraction greater than the initial states. We also consider two
quantum teleportations and show that entanglement swapping can increase
teleportation fidelity. Finally, we show how this effect can be demonstrated
with linear optics.
","[{""version"":""v1"",""created"":""Wed, 7 May 2008 19:22:32 GMT""},{""version"":""v2"",""created"":""Sun, 8 Jun 2008 18:17:04 GMT""},{""version"":""v3"",""created"":""Tue, 26 Aug 2008 11:56:55 GMT""}]","2008-09-18"
"0805.1045","Zhigang Han","Zhigang Han","A nonextension result on the spectral metric","10 pages",,,,"math.SG","http://arxiv.org/licenses/nonexclusive-distrib/1.0/","  The spectral metric, defined by Schwarz and Oh using Floer-theoretical
method, is a bi-invariant metric on the Hamiltonian diffeomorphism group. We
show in this note that for certain symplectic manifolds, this metric can not be
extended to a bi-invariant metric on the full group of symplectomorphisms. We
also study the bounded isometry conjecture of Lalonde and Polterovich in the
context of the spectral metric. In particular, we show that the conjecture
holds for the torus with all linear symplectic forms.
","[{""version"":""v1"",""created"":""Wed, 7 May 2008 19:02:50 GMT""}]","2008-05-08"
"0805.1046","Eric Carlen","Eric A. Carlen, Jeffrey S. Geronimo, Michael Loss","On the Markov sequence problem for Jacobi polynomials","The second version contains additional material and references. In
  particular, we discuss a product formula of Koornwider and Schwarz, and show
  how it may be proved using the methods developed here.",,,,"math.CA math.FA","http://arxiv.org/licenses/nonexclusive-distrib/1.0/","  We give a simple and entirely elementary proof of Gasper's theorem on the
Markov sequence problem for Jacobi polynomials. It is based on the spectral
analysis of an operator that arises in the study of a probabilistic model of
colliding molecules introduced by Marc Kac. In the process, we obtain some new
integral formulas for ratios of Jacobi polynomials that generalize Gasper's
product formula and a well known formula of Koornwinder.
","[{""version"":""v1"",""created"":""Wed, 7 May 2008 19:20:00 GMT""},{""version"":""v2"",""created"":""Wed, 10 Mar 2010 11:49:47 GMT""}]","2010-03-11"
"0805.1047","Dastgeer Shaikh","Dastgeer Shaikh and P. K. Shukla","Simulations of 2D magnetic electron drift vortex mode turbulence in
  plasmas","Paper is accepted in J Plasmas Physics",,"10.1017/S0022377808007411",,"physics.plasm-ph physics.comp-ph","http://arxiv.org/licenses/nonexclusive-distrib/1.0/","  Simulations are performed to investigate turbulent properties of nonlinearly
interacting two-dimensional (2D) magnetic electron drift vortex (MEDV) modes in
a nonuniform unmagnetized plasma. The relevant nonlinear equations governing
the dynamics of the MEDV modes are the wave magnetic field and electron
temperature perturbations in the presence of the equilibrium density and
temperature gradients. The important nonlinearities come from the advection of
the electron fluid velocity perturbation and the electron temperature, as well
as from the nonlinear electron Lorentz force. Computer simulations of the
governing equations for the nonlinear MEDV modes reveal the generation of
streamer-like electron flows, such that the corresponding gradients in the
direction of the inhomogeneities tend to flatten out. By contrast, the
gradients in an orthogonal direction vary rapidly. Consequently, the inertial
range energy spectrum in decaying MEDV mode turbulence exhibits a much steeper
anisotropic spectral index. The magnetic structures in the MEDV mode turbulence
produce nonthermal electron transport in our nonuniform plasma.
","[{""version"":""v1"",""created"":""Wed, 7 May 2008 19:19:55 GMT""}]","2015-05-13"
"0805.1048","Gilberto Santos Fo.","G. Santos, A. Foerster, I. Roditi, Z. V. T. Santos, A. P. Tonel","Exactly solvable models for triatomic-molecular Bose-Einstein
  Condensates","11 pages","Journal of Physics. A, Mathematical and Theoretical, v. 41,
  295003, 2008.","10.1088/1751-8113/41/29/295003",,"cond-mat.other hep-th","http://creativecommons.org/licenses/by-nc-sa/3.0/","  We construct a family of triatomic models for heteronuclear and homonuclear
molecular Bose-Einstein condensates. We show that these new generalized models
are exactly solvable through the algebraic Bethe ansatz method and derive their
corresponding Bethe ansatz equations and energies.
","[{""version"":""v1"",""created"":""Wed, 7 May 2008 19:20:11 GMT""}]","2014-12-30"
"0805.1049","Francesco Hautmann","F.Hautmann and H.Jung","Angular correlations in multi-jet final states from kt-dependent parton
  showers","25 pages. Discussion and references expanded; results unchanged.
  Additional calculations included","JHEP0810:113,2008","10.1088/1126-6708/2008/10/113",,"hep-ph","http://arxiv.org/licenses/nonexclusive-distrib/1.0/","  We investigate parton-branching methods based on transverse-momentum
dependent (TMD) parton distributions and matrix elements for the Monte Carlo
simulation of multi-particle final states at high-energy colliders. We observe
that recently measured angular correlations in ep final states with multiple
hadronic jets probe QCD coherence effects in the space-like branching,
associated with finite-angle gluon radiation from partons carrying small
longitudinal momenta, and not included in standard shower generators. We
present Monte Carlo calculations for azimuthal two-jet and three-jet
distributions, for jet multiplicities and for correlations in the
transverse-momentum imbalance between the leading jets. We discuss comparisons
with current experimental multi-jet data, and implications of corrections to
collinear-ordered showers for LHC final states.
","[{""version"":""v1"",""created"":""Wed, 7 May 2008 19:20:59 GMT""},{""version"":""v2"",""created"":""Mon, 2 Jun 2008 16:40:50 GMT""},{""version"":""v3"",""created"":""Wed, 24 Sep 2008 19:29:38 GMT""}]","2008-11-26"
"0805.1050","Ulrich Heber","Uli Heber, Heiko Hirsch, Heinz Edelmann, Ralf Napiwotzki, Simon
  O`Toole, Warren Brown and Martin Altmann","Hypervelocity Stars: Young and Heavy or Old and Light?","8 pages; Proceedings of the 3rd Meeting on Hot Subdwarf Stars and
  Related Objects, U. Heber, S. Jeffery, Napiwotzki eds. 2008, ASP Conference
  Series, 392, 167",,,,"astro-ph","http://arxiv.org/licenses/nonexclusive-distrib/1.0/","  The first three hyper-velocity stars (HVS) unbound to the Galaxy were
serendipitously discovered in 2005. The only suggested origin of hyper-velocity
stars is the Galactic Centre as it hosts a super-massive black hole capable of
accelerating stars to such high velocities. Only one HVS, the sdO star US 708,
is known to be an old low mass star, while HE 0437$-$5439 is an apparently
normal early-type B-star, too short-lived to originate from the Galactic
Centre, but could possibly come from the LMC. A systematic survey has led to
the discovery of seven new HVS of late B-type (similar to the prototype HVS1),
which can either be massive stars 3 M(sun) or horizontal branch stars,
sufficiently long-lived to have travelled from the Galactic Centre. We present
new spectral analyses of five known HVS as well as of a newly discovered
candidate. It is possible that the late B-type HVS are a mix of main sequence
and evolved BHB stars. In view of the time scale problem we revisit HE
0437$-$5439 and discuss a possible subluminous nature of this star.
","[{""version"":""v1"",""created"":""Wed, 7 May 2008 19:24:57 GMT""}]","2008-05-08"
"0805.1051","Eric Carlen","Eric A. Carlen, Jose A. Carrillo, Maria C. Carvalho","Strong Convergence towards homogeneous cooling states for dissipative
  Maxwell models","2 figures",,"10.1016/j.anihpc.2008.10.005",,"math-ph math.MP","http://arxiv.org/licenses/nonexclusive-distrib/1.0/","  We show the propagation of regularity, uniformly in time, for the scaled
solutions of the inelastic Maxwell model for small inelasticity. This result
together with the weak convergence towards the homogenous cooling state present
in the literature implies the strong convergence in Sobolev norms and in the
$L^1$ norm towards it depending on the regularity of the initial data. The
strategy of the proof is based on a precise control of the growth of the Fisher
information for the inelastic Boltzmann equation. Moreover, as an application
we obtain a bound in the $L^1$ distance between the homogeneous cooling state
and the corresponding Maxwellian distribution vanishing as the inelasticity
goes to zero.
","[{""version"":""v1"",""created"":""Wed, 7 May 2008 19:28:38 GMT""}]","2015-05-13"
"0805.1052","Konstantine Zelator","Konstantine ""Hermes"" Zelator","Two Theorems on the structure of Pythagorean triples and some
  diophantine consequences","11 pages",,,,"math.GM","http://creativecommons.org/licenses/by/3.0/","  Even though four theorems are actually proved in this paper, two are the main
ones,Teorems 1 and 3. In Theorem 1 we show that if a and be are odd squarefree
positive integers satisfying certain quadratic residue conditions; then there
exists no primitive Pythagorean triangle one of whose leglengths is equal to a
times an integer square, while the other leglength is equal to b times a
perfect square. The family of all such pairs (a,b) is slightly complicated in
its description. A subfamily of the said family consists of pairs (a,b), with a
being congruent to 1, while b being congruent to 5 modulo8; and also with both
a and b being primes, and with a being a quadratic nonresidue ofb(and so by the
quadratic reciprocity law, b also being a nonresidue of a). Theorem 3 is
similar in nature, but less complicated in its hypothesis. It states that if p
and q are primes, both congruent to 1 modulo4, and one of them being a
quadratic nonresidue of the other.Then the diophantine equation, p^2x^4 +
q^2y^4 = z^2, Has no solutions in positive integers x, y, and z, satisfying
(px, qy)=1.
","[{""version"":""v1"",""created"":""Wed, 7 May 2008 19:45:30 GMT""},{""version"":""v2"",""created"":""Thu, 8 May 2008 16:03:02 GMT""}]","2008-05-08"
"0805.1053","Xavier Tolsa","Xavier Tolsa","Uniform rectifiability, Calderon-Zygmund operators with odd kernel, and
  quasiorthogonality","34 pages",,"10.1112/plms/pdn035",,"math.CA math.FA","http://arxiv.org/licenses/nonexclusive-distrib/1.0/","  In this paper we study some questions in connection with uniform
rectifiability and the $L^2$ boundedness of Calderon-Zygmund operators. We show
that uniform rectifiability can be characterized in terms of some new
adimensional coefficients which are related to the Jones' $\beta$ numbers. We
also use these new coefficients to prove that n-dimensional Calderon-Zygmund
operators with odd kernel of type $C^2$ are bounded in $L^2(\mu)$ if $\mu$ is
an n-dimensional uniformly rectifiable measure.
","[{""version"":""v1"",""created"":""Wed, 7 May 2008 20:14:09 GMT""}]","2014-02-26"
"0805.1054","Stefano Profumo","Tesla E. Jeltema and Stefano Profumo","Searching for Dark Matter with X-ray Observations of Local Dwarf
  Galaxies","30 pages, 5 figures; accepted for publication in ApJ","Astrophys.J. 686 (2008) 1045","10.1086/591495",,"astro-ph hep-ph","http://arxiv.org/licenses/nonexclusive-distrib/1.0/","  A generic feature of weakly interacting massive particle (WIMP) dark matter
models is the emission of photons over a broad energy band resulting from the
stable yields of dark matter pair annihilation. Inverse Compton scattering off
cosmic microwave background photons of energetic electrons and positrons
produced in dark matter annihilation is expected to produce significant diffuse
X-ray emission. Dwarf galaxies are ideal targets for this type of dark matter
search technique, being nearby, dark matter dominated systems free of any
astrophysical diffuse X-ray background. In this paper, we present the first
systematic study of X-ray observations of local dwarf galaxies aimed at the
search for WIMP dark matter. We outline the optimal energy and angular ranges
for current telescopes, and analyze the systematic uncertainties connected to
electron/positron diffusion. We do not observe any significant X-ray excess,
and translate this null result into limits on the mass and pair annihilation
cross section for particle dark matter. Our results indicate that X-ray
observations of dwarf galaxies currently constrain dark matter models at the
same level or even more strongly than gamma-ray observations of the same
systems, although at the expenses of introducing additional assumptions and
related uncertainties in the modeling of diffusion and energy loss processes.
The limits we find constrain portions of the supersymmetric parameter space,
particularly if the effect of dark matter substructures is included. Finally,
we comment on the role of future X-ray satellites (e.g. Constellation-X, XEUS)
and on their complementarity with GLAST and other gamma-ray telescopes in the
quest for particle dark matter.
","[{""version"":""v1"",""created"":""Wed, 7 May 2008 20:00:03 GMT""},{""version"":""v2"",""created"":""Mon, 30 Jun 2008 21:14:46 GMT""}]","2009-11-13"
"0805.1055","Wei Liu","Wei Liu, Vahe Petrosian, Brian R. Dennis, and Gordon D. Holman","Conjugate Hard X-ray Footpoints in the 2003 October 29 X10 Flare:
  Unshearing Motions, Correlations, and Asymmetries","22 pages, 14 figures, 4 tables; ApJ 2009, in press","Astrophys.J.693:847-867,2009","10.1088/0004-637X/693/1/847",,"astro-ph","http://arxiv.org/licenses/nonexclusive-distrib/1.0/","  We present a detailed imaging and spectroscopic study of the conjugate hard
X-ray (HXR) footpoints (FPs) observed with RHESSI in the 2003 October 29 X10
flare. The double FPs first move toward and then away from each other, mainly
parallel and perpendicular to the magnetic neutral line, respectively. The
transition of these two phases of FP unshearing motions coincides with the
direction reversal of the motion of the loop-top (LT) source, and with the
minima of the estimated loop length and LT height. The FPs show temporal
correlations between HXR flux, spectral index, and magnetic field strength. The
HXR flux exponentially correlates with the magnetic field strength, which also
anti-correlates with the spectral index before the second HXR peak's maximum,
suggesting that particle acceleration sensitively depends on the magnetic field
strength and/or reconnection rate. Asymmetries are observed between the FPs: on
average, the eastern FP is 2.2 times brighter in HXR flux and 1.8 times weaker
in magnetic field strength, and moves 2.8 times faster away from the neutral
line than the western FP; the estimated coronal column density to the eastern
FP from the LT source is 1.7 times smaller. The two FPs have marginally
different spectral indexes. The eastern-to-western FP HXR flux ratio and
magnetic field strength ratio are anti-correlated only before the second HXR
peak's maximum. Neither magnetic mirroring nor column density alone can explain
the totality of these observations, but their combination, together with other
transport effects, might provide a full explanation. We have also developed
novel techniques to remove particle contamination from HXR counts and to
estimate effects of pulse pileup in imaging spectroscopy, which can be applied
to other RHESSI flares in similar circumstances.
","[{""version"":""v1"",""created"":""Wed, 7 May 2008 20:00:06 GMT""},{""version"":""v2"",""created"":""Mon, 4 Aug 2008 17:09:25 GMT""},{""version"":""v3"",""created"":""Mon, 17 Nov 2008 06:48:01 GMT""}]","2011-02-11"
"0805.1056","James E. Rhoads","James E. Rhoads, Sangeeta Malhotra, Norbert Pirzkal, Mark Dickinson,
  Seth Cohen, Norman Grogin, Nimish Hathi, Chun Xu, and the PEARS team","Spectroscopic Confirmation of Faint Lyman Break Galaxies at Redshifts
  Four and Five in the Hubble Ultra Deep Field","Submitted to The Astrophysical Journal. Reduced spectra from both
  GRAPES and PEARS are available from STScI, at
  http://www.stsci.edu/science/grapes/ and at
  http://archive.stsci.edu/prepds/pears/","Astrophys.J.697:942-949,2009","10.1088/0004-637X/697/1/942",,"astro-ph","http://arxiv.org/licenses/nonexclusive-distrib/1.0/","  We present the faintest spectroscopically confirmed sample of redshift four
and five Lyman break galaxies to date. The sample is based on slitless grism
spectra of the Hubble Ultra Deep Field region from the GRAPES (Grism ACS
Program for Extragalactic Science) and PEARS (Probing Evolution and
Reionization Spectroscopically) projects, using the G800L grism on the HST
Advanced Camera for Surveys. We report here confirmations of 39 galaxies,
pre-selected as candidate Lyman break galaxies using photometric selection
criteria. We compare a ""traditional"" V-dropout selection to a more liberal one
(with V-i > 0.9), and find that the traditional criteria are about 64% complete
and 81% reliable. We also study the Lyman alpha emission properties of our
sample. We find that Lyman alpha emission is detected in about 1/4 of the
sample, and that our broad-band color selected sample includes 55% of
previously published line-selected Lyman alpha sources. Finally, we examine our
stacked 2D spectra. We demonstrate that strong, spatially extended (arcsecond
scale) Lyman alpha emission is not a generic property of these Lyman break
galaxies, but that a modest extension of the Lyman alpha photosphere (compared
to the starlight) may be present in those galaxies with prominent Lyman alpha
emission.
","[{""version"":""v1"",""created"":""Wed, 7 May 2008 20:00:06 GMT""}]","2010-01-15"
"0805.1058","Chris Orban","Chris Orban, Oleg Y. Gnedin, Daniel R. Weisz, Evan D. Skillman, Andrew
  E. Dolphin, and John A. Holtzman","Delving Deeper into the Tumultuous Lives of Galactic Dwarfs: Modeling
  Star Formation Histories","17 pages, 7 figures, 8 tables; version accepted by ApJ; includes new
  subsection with results from a redshift-dependent minimum density threshold
  for star formation",,"10.1086/591496",,"astro-ph","http://arxiv.org/licenses/nonexclusive-distrib/1.0/","  The paucity of observed dwarf galaxies in the Local Group relative to the
abundance of predicted dark matter halos remains one of the greatest puzzles of
the LCDM paradigm. Solving this puzzle now requires not only matching the
numbers of objects but also understanding the details of their star formation
histories. We present a summary of such histories derived from the HST data
using the color-magnitude diagram fitting method. To reduce observational
uncertainties, we condense the data into five cumulative parameters -- the
fractions of stellar mass formed in the last 1, 2, 5, and 10 Gyr, and the mean
stellar age. We interpret the new data with a phenomenological model based on
the mass assembly histories of dark matter halos and the Schmidt law of star
formation. The model correctly predicts the radial distribution of the dwarfs
and the fractions of stars formed in the last 5 and 10 Gyr. However, in order
to be consistent with the observations, the model requires a significant amount
of recent star formation in the last 2 Gyr. Within the framework of our model,
this prolonged star formation can be achieved by adding a stochastic variation
in the density threshold of the star formation law. The model results are not
sensitive to late gas accretion, the slope of the Schmidt law, or the details
of cosmic reionization. A few discrepancies still remain: our model typically
predicts too large stellar masses, only a modest population of ultra-faint
dwarfs, and a small number of dwarfs with anomalously young stellar
populations. Nevertheless, the observed star formation histories of Local Group
dwarfs are generally consistent the expected star formation in cold dark matter
halos.
","[{""version"":""v1"",""created"":""Wed, 7 May 2008 20:02:06 GMT""},{""version"":""v2"",""created"":""Wed, 2 Jul 2008 19:01:00 GMT""}]","2009-11-13"
"0805.1059","Ansgar Reiners","Ansgar Reiners, Gibor Basri","Chromospheric Activity, Rotation, and Rotational Braking in M and L
  Dwarfs","19 pages, accepted for publication in ApJ",,"10.1086/590073",,"astro-ph","http://arxiv.org/licenses/nonexclusive-distrib/1.0/","  We present results from a high-resolution spectroscopic survey of 45 L
dwarfs, which includes both very low-mass stars and brown dwarfs. Our spectra
allow us to derive a significant number of new rotational velocities, and
discover a slowly rotating (in projected velocity) L dwarf that allows more
accurate measurement of spectroscopic rotations for these objects. We measure
chromospheric activity (and often its variability) through the H$\alpha$
emission line. Our primary new result is good evidence that magnetic braking
dominates the angular momentum evolution of even brown dwarfs, although
spindown times appear to increase as mass decreases. We confirm that activity
decreases as effective temperature decreases, though a larger fraction of L
dwarfs are active than has previously been reported. Essentially all active
objects are also variable. We confirm the lack of a rotation-activity
connection for L dwarfs. We find a minimum limit for rotational velocities that
increases with later spectral types, rising from near zero in older mid-M stars
to more than 20 km s$^{-1}$ for mid-L objects. There is strong evidence that
all L dwarfs are rapid rotators. We derive a braking law that can depend on
either temperature or mass which can explain all the rotational results and
provides an age dependence for the angular momentum evolution. It is clear that
angular momentum loss mechanisms in smaller and cooler objects become more
inefficient starting at the fully convective boundary.
","[{""version"":""v1"",""created"":""Wed, 7 May 2008 20:02:28 GMT""},{""version"":""v2"",""created"":""Wed, 4 Jun 2008 08:07:09 GMT""}]","2009-11-13"
