"0805.1766","Stepan Bulanov","Stepan S. Bulanov, Andrei Brantov, Valery Yu. Bychenkov, Vladimir
  Chvykov, Galina Kalinchenko, Takeshi Matsuoka, Pascal Rousseau, Stephen Reed,
  Victor Yanovsky, Karl Krushelnick, Dale William Litzenberg and Anatoly
  Maksimchuk","Accelerating Protons to Therapeutic Energies with Ultra-Intense
  Ultra-Clean and Ultra-Short Laser Pulses","26 pages, 6 figures","Med. Phys. 35 (5), 1770 (2008)","10.1118/1.2900112",,"physics.plasm-ph physics.med-ph","http://arxiv.org/licenses/nonexclusive-distrib/1.0/","  Proton acceleration by high-intensity laser pulses from ultra-thin foils for
hadron therapy is discussed. With the improvement of the laser intensity
contrast ratio to 10-11 achieved on Hercules laser at the University of
Michigan, it became possible to attain laser-solid interactions at intensities
up to 1022 W/cm2 that allows an efficient regime of laser-driven ion
acceleration from submicron foils. Particle-In-Cell (PIC) computer simulations
of proton acceleration in the Directed Coulomb explosion regime from ultra-thin
double-layer (heavy ions / light ions) foils of different thicknesses were
performed under the anticipated experimental conditions for Hercules laser with
pulse energies from 3 to 15 J, pulse duration of 30 fs at full width half
maximum (FWHM), focused to a spot size of 0.8 microns (FWHM). In this regime
heavy ions expand predominantly in the direction of laser pulse propagation
enhancing the longitudinal charge separation electric field that accelerates
light ions. The dependence of the maximum proton energy on the foil thickness
has been found and the laser pulse characteristics have been matched with the
thickness of the target to ensure the most efficient acceleration. Moreover the
proton spectrum demonstrates a peaked structure at high energies, which is
required for radiation therapy. 2D PIC simulations show that a 150-500 TW laser
pulse is able to accelerate protons up to 100-220 MeV energies.
","[{""version"":""v1"",""created"":""Tue, 13 May 2008 00:57:52 GMT""}]","2008-05-14"
"0805.1768","Chihwa Kao","Jushan Bai, Chihwa Kao, and Serena Ng","Panel Cointegration with Global Stochastic Trends",,,,,"math.ST stat.ME stat.TH","http://arxiv.org/licenses/nonexclusive-distrib/1.0/","  This paper studies estimation of panel cointegration models with
cross-sectional dependence generated by unobserved global stochastic trends.
The standard least squares estimator is, in general, inconsistent owing to the
spuriousness induced by the unobservable I(1) trends. We propose two iterative
procedures that jointly estimate the slope parameters and the stochastic
trends. The resulting estimators are referred to respectively as CupBC
(continuously-updated and bias-corrected) and the CupFM (continuously-updated
and fully-modified) estimators. We establish their consistency and derive their
limiting distributions. Both are asymptotically unbiased and asymptotically
mixed normal and permit inference to be conducted using standard test
statistics. The estimators are also valid when there are mixed stationary and
non-stationary factors, as well as when the factors are all stationary.
","[{""version"":""v1"",""created"":""Tue, 13 May 2008 01:18:28 GMT""}]","2008-05-14"
"0805.1769","Peter Jarvis","Sol H. Jacobsen and P.D. Jarvis","Regularised Tripartite Continuous Variable EPR-type States with Wigner
  Functions and CHSH Violations","17 pages, LaTeX, 4.eps figures. Changes made: new appendix added,
  typos corrected, references added, additional explanatory comments given","J. Phys. A: Math. and Theor. Vol.41 (36) 365301 (2008)","10.1088/1751-8113/41/36/365301","UTAS-PHYS-2008-09","quant-ph math-ph math.MP","http://arxiv.org/licenses/nonexclusive-distrib/1.0/","  We consider tripartite entangled states for continuous variable systems of
EPR type, which generalise the famous bipartite CV EPR states (eigenvectors of
conjugate choices X1 - X2, P1+ P2, of the systems' relative position and total
momentum variables). We give the regularised forms of such tripartite EPR
states in second-quantised formulation, and derive their Wigner functions. This
is directly compared with the established NOPA-like states from quantum optics.
Whereas the multipartite entangled states of NOPA type have singular Wigner
functions in the limit of large squeezing, r --> infinity, or tanh r --> 1^-
(approaching the EPR states in the bipartite case), our regularised tripartite
EPR states show singular behaviour not only in the approach to the EPR-type
region (s --> 1 in our notation), but also for an additional, auxiliary regime
of the regulator (s --> \sqrt{2}). While the s -->1 limit pertains to
tripartite CV states with singular eigenstates of the relative coordinates and
remaining squeezed in the total momentum, the s --> \sqrt{2} limit yields
singular eigenstates of the total momentum, but squeezed in the relative
coordinates. Regarded as expectation values of displaced parity measurements,
the tripartite Wigner functions provide the ingredients for generalised CHSH
inequalities. Violations of the tripartite CHSH bound (B3 \le 2) are
established, with B3 ~ 2.09 in the canonical regime (s -->1^+), as well as B3 ~
2.32 in the auxiliary regime (s --> \sqrt{2^+}).
","[{""version"":""v1"",""created"":""Tue, 13 May 2008 01:47:38 GMT""},{""version"":""v2"",""created"":""Mon, 14 Jul 2008 02:04:28 GMT""}]","2009-11-13"
"0805.1770","Murray Batchelor","M. T. Batchelor, X.-W. Guan and A. Kundu","One-dimensional anyons with competing $\delta$-function and derivative
  $\delta$-function potentials","9 pages, 2 figures, minor changes, references updated","J. Phys. A 41 (2008) 352002","10.1088/1751-8113/41/35/352002",,"cond-mat.stat-mech","http://arxiv.org/licenses/nonexclusive-distrib/1.0/","  We propose an exactly solvable model of one-dimensional anyons with competing
$\delta$-function and derivative $\delta$-function interaction potentials. The
Bethe ansatz equations are derived in terms of the $N$-particle sector for the
quantum anyonic field model of the generalized derivative nonlinear
Schr\""{o}dinger equation. This more general anyon model exhibits richer physics
than that of the recently studied one-dimensional model of $\delta$-function
interacting anyons. We show that the anyonic signature is inextricably related
to the velocities of the colliding particles and the pairwise dynamical
interaction between particles.
","[{""version"":""v1"",""created"":""Tue, 13 May 2008 02:19:46 GMT""},{""version"":""v2"",""created"":""Wed, 9 Jul 2008 05:13:42 GMT""}]","2009-06-20"
"0805.1771","Zhenhua Ni","Zhenhua Ni, Yingying Wang, Ting Yu, Yumeng You, and Zexiang Shen","Reduction of Fermi velocity in folded graphene observed by resonance
  Raman spectroscopy","18 pages, 4 figures, 2 tables, accepted by Phys. Rev. B","Phys. Rev. B 77, 235403 (2008)","10.1103/PhysRevB.77.235403",,"cond-mat.mtrl-sci","http://arxiv.org/licenses/nonexclusive-distrib/1.0/","  The 1+1 layer folded graphene sheets that deviate from AB stacking are
successfully fabricated and their electronic structures are investigated by
Raman spectroscopy. Significant blue shift of the 2D band of folded graphene
compared to that of single layer graphene (SLG) is observed. This is attributed
to SLG-like electronic structure of folded graphene but with slowing down of
Fermi velocity (as much as ~5.6%). Different amount of blue shift of 2D band is
observed for different folded graphenes, which may correspond to the different
twist angle and/or separation between the two layers, resulting in different
Fermi velocity of folded graphenes. Electronic structure of 1+1 folded graphene
samples with different stacking order (twist and separation between the two
layers, and in-plane shift of the two layers) can be investigated by Raman
spectroscopy.
","[{""version"":""v1"",""created"":""Tue, 13 May 2008 02:20:53 GMT""}]","2009-11-13"
"0805.1772","Dan Csontos","D. Csontos, U. Z\""ulicke, P. Brusheim, H. Q. Xu","Lande-like formula for the g factors of hole-nanowire subband edges","4 pages, 2 figures","Phys. Rev. B 78, 033307 (2008)","10.1103/PhysRevB.78.033307",,"cond-mat.mes-hall cond-mat.mtrl-sci","http://arxiv.org/licenses/nonexclusive-distrib/1.0/","  We have analyzed theoretically the Zeeman splitting of hole-quantum-wire
subband edges. As is typical for any bound state, their g factor depends on
both an intrinsic g factor of the material and an additional contribution
arising from a finite bound-state orbital angular momentum. We discuss the
quantum-confinement-induced interplay between bulk-material and orbital
effects, which is nontrivial due to the presence of strong spin-orbit coupling.
A compact analytical formula is provided that elucidates this interplay and can
be useful for predicting Zeeman splitting in generic hole-wire geometries.
","[{""version"":""v1"",""created"":""Tue, 13 May 2008 02:42:21 GMT""},{""version"":""v2"",""created"":""Tue, 1 Jul 2008 22:01:10 GMT""}]","2008-07-24"
"0805.1773","Mikhail Lifshits","A. I. Nazarov","Log-Level Comparison Principle for Small Ball Probabilities",,,,,"math.PR","http://creativecommons.org/licenses/by-nc-sa/3.0/","  We prove a new variant of comparison principle for logarithmic $L_2$-small
ball probabilities of Gaussian processes. As an application, we obtain
logarithmic small ball asymptotics for some well-known processes with smooth
covariances.
","[{""version"":""v1"",""created"":""Tue, 13 May 2008 03:36:07 GMT""}]","2008-05-14"
"0805.1774","Igor Shein","M.A. Gorbunova, I.R. Shein, Yu.N. Makurin, V.V. Ivanovskaya, V.S.
  Kijko, A.L. Ivanovskii","Electronic structure and magnetism in BeO nanotubes induced by boron,
  carbon and nitrogen impurities","13 pages, 3 figures",,,,"cond-mat.mtrl-sci","http://arxiv.org/licenses/nonexclusive-distrib/1.0/","  We have performed ab initio calculations to systematically investigate
electronic properties and magnetism of insulating non-magnetic beryllium
monoxide nanotubes induced by non-magnetic sp impurities: boron, carbon and
nitrogen. We found that in the presence of these sp impurities, which replace
oxygen atoms, the non-magnetic BeO NTs transform into magnetic semiconductors,
which acquire magnetization caused by spin splitting of (B,C,N) 2p states
located in the forbidden gap of a BeO tube. The magnetic moments of the
impurities vary from 0.65 to 1.60. On the contrary, when (B,C,N) dopants
substitute for Be atoms or in the presence of an oxygen vacancy, the
nonmagnetic state of the BeO tubes is retained.
","[{""version"":""v1"",""created"":""Tue, 13 May 2008 03:55:04 GMT""}]","2008-05-14"
"0805.1775","Philip Yock","Philip Yock","High magnification events by MOA in 2007","13 pages, 17 figures, Manchester Microlensing Conference, January
  2008. To be published in the proceedings",,,,"astro-ph","http://arxiv.org/licenses/nonexclusive-distrib/1.0/","  Gravitational microlensing events of high magnification provide exceptional
sensitivity to the presence of low-mass planets orbiting the lens star,
including planets with masses as low as that of Earth. The essential
requirement for the detection of such planets in these events is that the FWHM
of the light curve be monitored continuously, or as nearly continuously as
possible. The dependence of planet detectability on the magnification caused by
microlensing, on the planet mass and planet location, and on the size of the
source star, may be understood in terms of simple geometrical properties of
microlensing that have been known since 1964. Planetary signals of low-mass
planets are found to be approximately independent of the magnification caused
by microlensing. This implies that planets can be detected in events over a
wide range of magnifications, from moderately high values ~ 100 to very high
values ~ 1000. The former values are likely to yield more clear-cut separations
of the stellar and planetary features on the light curve, but they require
larger telescopes to obtain precision photometry. During 2007, twenty-four
events with magnification exceeding 50 were detected by the MOA collaboration,
of which about half were also detected by the OGLE collaboration. A quarter of
the events received essentially continuous coverage of their FWHMs by follow-up
collaborations, another quarter received partial coverage, and the remaining
half received little coverage. Final analysis of these events is still
underway, but casual inspection of the light curves reveals some possible
planetary detections amongst them. During 2008 it is hoped that fuller coverage
of events of high magnification will be obtained with the addition of further
telescopes to existing follow-up networks.
","[{""version"":""v1"",""created"":""Tue, 13 May 2008 04:07:02 GMT""}]","2008-05-14"
"0805.1776","Andrew Mugler","Andrew Mugler, Etay Ziv, Ilya Nemenman, Chris H. Wiggins","Serially-regulated biological networks fully realize a constrained set
  of functions","9 pages, 3 figures","IET Sys. Bio. 2 (2008) 313-322","10.1049/iet-syb:20080097",,"q-bio.MN","http://arxiv.org/licenses/nonexclusive-distrib/1.0/","  We show that biological networks with serial regulation (each node regulated
by at most one other node) are constrained to {\it direct functionality}, in
which the sign of the effect of an environmental input on a target species
depends only on the direct path from the input to the target, even when there
is a feedback loop allowing for multiple interaction pathways. Using a
stochastic model for a set of small transcriptional regulatory networks that
have been studied experimentally, we further find that all networks can achieve
all functions permitted by this constraint under reasonable settings of
biochemical parameters. This underscores the functional versatility of the
networks.
","[{""version"":""v1"",""created"":""Tue, 13 May 2008 05:00:26 GMT""}]","2009-11-30"
"0805.1777","Rastegin Alexey Eduardovich","A. E. Rastegin","Uncertainty relations for arbitrary measurement in terms of Renyi
  entropies","4 pages, no figures. Improved state-dependent entropic bounds are
  presented. The bibliography is extended. The supplementary material is
  contained in arXiv:0807.2691",,,,"quant-ph","http://arxiv.org/licenses/nonexclusive-distrib/1.0/","  Uncertainty relations for a pair of arbitrary measurements and for a single
measurement are posed in the form of inequalities using the Renyi entropies.
The formulation deals with discrete observables. Both the relations with
state-dependent and state-independent bounds are presented. The entropic bounds
are illustrated within the distinction between non-orthogonal states.
","[{""version"":""v1"",""created"":""Tue, 13 May 2008 05:11:24 GMT""},{""version"":""v2"",""created"":""Mon, 21 Jul 2008 04:40:11 GMT""}]","2008-07-21"
"0805.1778","Jorge Zanelli","Jorge Zanelli","Uses of Chern-Simons actions","17 pages, no figures. Ten Years of AdS/CFT conference, a workshop to
  celebrate the tenth anniversary of the Maldacena Conjecture. Buenos Aires,
  December 2007. Added references, corrected typos","AIP Conf.Proc.1031:115-129,2008","10.1063/1.2971999",,"hep-th","http://arxiv.org/licenses/nonexclusive-distrib/1.0/","  The role of Chern-Simons (CS) actions is reviewed, starting from the
observation that all classical actions in Hamiltonian form can be viewed as 0+1
CS systems, in the same class with the coupling between the electromagnetic
field and a point charge. Some suggestions are derived that could shed some
light on the quantization problem in D=2n-1>3 dimensions.
","[{""version"":""v1"",""created"":""Tue, 13 May 2008 05:28:02 GMT""},{""version"":""v2"",""created"":""Thu, 5 Jun 2008 02:45:45 GMT""}]","2009-12-04"
"0805.1779","Virendra Singh","Virendra Singh","Bohm's realist interpretation of Quantum mechanics","20 pages. To appear in a volume to be published by ICPR edited by P.
  Ghosh",,,,"quant-ph physics.hist-ph","http://arxiv.org/licenses/nonexclusive-distrib/1.0/","  A brief account of the world view of classical physics is given first. We
then recapitulate as to why the Copenhagen interpretation of the quantum
mechanics had to renounce most of the attractive features of the clasical world
view such as a causal description, locality, scientific realism and introduce a
fundamental distinction between system and apparatus. The crucial role is
played in this by the Bohr's insistence on the wavefunction providing the most
complete description possible for an even individual system. The alternative of
introducing extra dynamical variables, called hidden variables, in addition to
the wavefunction of the system so as to be able to retain at least some of the
desirable features of classical physics, is then explored. The first such
successful attempt was that of Bohm in 1952 who showed that a realistic
interpretation of the quantum mechanics can be given which maintains a causal
description as well as does not treat systems and measuring appeartus
differently. We begin with the construction of the Bohm's theory. He introduces
particle positions as the hidden variables. The particle positions play a
special role in Bohm theory. The particle trajectories are guided by the
wavefunction. The Bohm theory is deterministic. The probability enters through
a special assumption, ``quantum equilibrium'' hypothesis, for the initial
conditions on the ensemble of particle trajectories. The ``wave or particle''
dilemma is resolved by a ``wave and particle'' resolution. The measurements in
Bohm theory can be described without mysticism. Bohm's theory is however
nonlocal.
","[{""version"":""v1"",""created"":""Tue, 13 May 2008 05:40:04 GMT""}]","2008-05-16"
"0805.1780","Virendra Singh","Virendra Singh","Scientific Realism and Classical Physics","10 pages. To appear in a volume to be published by ICPR edited by P.
  Ghosh",,,,"physics.hist-ph quant-ph","http://arxiv.org/licenses/nonexclusive-distrib/1.0/","  We recount the successful long career of classical physics, from Newton to
Einstein, which was based on the philosophy of scientific realism. Special
emphasis is given to the changing status and number of ontological entitities
and arguments for their necessity at any time. Newton, initially, began with
(i) point particles, (ii) aether, (iii) absolute space and (iv) absolute time.
The electromagnetic theory of Maxwell and Faraday introduced `fields' as a new
ontological entity not reducible to earlier ones. Their work also unified
electricity, magnetism and optics. Repeated failure to observe the motion of
earth through aether led Einstein to modify the Newtonian absolute space and
time concepts to a fused Minkowski space-time and the removal of aether from
basic ontological entities in his special theory of relativity. Later Einstein
in his attempts to give a local theory of gravitation was led to further modify
flat Minkowski space-time to the curved Riemannian space time. This reduced
gravitational phenomenon to that of geometry of the space time. Space-time,
matter and fields all became dynamical. We also abstract some general features
of description of nature in classical physics and enquire whether these could
be features of any scientific description?
","[{""version"":""v1"",""created"":""Tue, 13 May 2008 05:47:59 GMT""}]","2008-05-16"
"0805.1781","Bixiang Wang","Bixiang Wang","Random Attractors for the Stochastic Benjamin-Bona-Mahony Equation on
  Unbounded Domains","37 pages",,,,"math.AP","http://arxiv.org/licenses/nonexclusive-distrib/1.0/","  We prove the existence of a compact random attractor for the stochastic
Benjamin-Bona-Mahony Equation defined on an unbounded domain. This random
attractor is invariant and attracts every pulled-back tempered random set under
the forward flow. The asymptotic compactness of the random dynamical system is
established by a tail-estimates method, which shows that the solutions are
uniformly asymptotically small when space and time variables approach infinity.
","[{""version"":""v1"",""created"":""Tue, 13 May 2008 05:53:30 GMT""}]","2008-05-14"
"0805.1782","Martin Cederwall","Viktor Bengtsson, Martin Cederwall","The B-model on the A-model NS5-brane","13 pp",,,,"hep-th","http://arxiv.org/licenses/nonexclusive-distrib/1.0/","  We formulate the dynamics for the NS5-brane of the A-model, via the 'maximal
form' method, which couples all background fields to the world-volume. This
procedure provides the extra one- and five-forms fields of the extended Hitchin
model. The generalised B-model emerges as the world-volume theory of this
brane. The starting point of the construction is an embedding of the brane in a
superspace geometry with 16 fermionic directions. The correspondence with
Hitchin's formulation in terms of pure spinors is explained.
","[{""version"":""v1"",""created"":""Tue, 13 May 2008 07:41:27 GMT""}]","2008-05-14"
"0805.1783","Mei Zhang","Mei Zhang and Natasha Flyer","The dependence of the helicity bound of force-free magnetic fields on
  boundary conditions","accepted by ApJ",,"10.1086/589993",,"astro-ph","http://arxiv.org/licenses/nonexclusive-distrib/1.0/","  This paper follows up on a previous study showing that in an open atmosphere
such as the solar corona the total magnetic helicity of a force-free field must
be bounded and the accumulation of magnetic helicity in excess of its upper
bound would initiate a non-equilibrium situation resulting in an expulsion such
as a coronal mass ejection (CME). In the current paper, we investigate the
dependence of the helicity bound on the boundary condition for several families
of nonlinear force-free fields. Our calculation shows that the magnitude of the
helicity upper bound of force-free fields is non-trivially dependent on the
boundary condition. Fields with a multipolar boundary condition can have a
helicity upper bound ten times smaller than those with a dipolar boundary
condition when helicity values are normalized by the square of their respective
surface poloidal fluxes. This suggests that a coronal magnetic field may erupt
into a CME when the applicable helicity bound falls below the already
accumulated helicity as the result of a slowly changing boundary condition. Our
calculation also shows that a monotonic accumulation of magnetic helicity can
lead to the formation of a magnetic flux rope applicable to kink instability.
This suggests that CME initiations by exceeding helicity bound and by kink
instability can both be the consequences of helicity accumulation in the
corona. Our study gives insights into the observed associations of CMEs with
the magnetic features at their solar surface origins.
","[{""version"":""v1"",""created"":""Tue, 13 May 2008 06:15:58 GMT""}]","2009-11-13"
"0805.1784","Angom Dilip Singh","S. A. Silotri, D. Angom, H. Mishra and Amruta Mishra","Pairing in spin polarized two-species fermionic mixtures with mass
  asymmetry","8 pages and 6 figures, few typos corrected, version to appear in EPJD","Euro. Phys. J. D 49, 383-390 (2008).","10.1140/epjd/e2008-00169-0",,"cond-mat.supr-con cond-mat.other physics.atom-ph","http://arxiv.org/licenses/nonexclusive-distrib/1.0/","  We discuss on the pairing mechanism of fermions with mismatch in their fermi
momenta due to a mass asymmetry. Using a variational ansatz for the ground
state we also discuss the BCS -BEC crossover of this system. It is shown that
the breached pairing solution with a single fermi surface is stable in the BEC
regime. We also include the temperatures effect on the fermion pairing within
an approximation that is valid for temperatures much below the critical
temperature.
","[{""version"":""v1"",""created"":""Tue, 13 May 2008 06:30:13 GMT""},{""version"":""v2"",""created"":""Mon, 4 Aug 2008 04:49:50 GMT""}]","2009-12-29"
"0805.1785","Michael Hilker","Michael Hilker","Distributed Self Management for Distributed Security Systems","12 pages, 3 figures","Proceedings of the 2nd International Conference on Bio-Inspired
  Computing: Theories and Applications (BIC-TA 2007), September 2007,
  Zhengzhou, China",,,"cs.MA cs.AI","http://arxiv.org/licenses/nonexclusive-distrib/1.0/","  Distributed system as e.g. artificial immune systems, complex adaptive
systems, or multi-agent systems are widely used in Computer Science, e.g. for
network security, optimisations, or simulations. In these systems, small
entities move through the network and perform certain tasks. At some time, the
entities move to another place and require therefore information where to move
is most profitable. Common used systems do not provide any information or use a
centralised approach where a center delegates the entities. This article
discusses whether small information about the neighbours enhances the
performance of the overall system or not. Therefore, two information-protocols
are introduced and analysed. In addition, the protocols are implemented and
tested using the artificial immune system SANA that protects a network against
intrusions.
","[{""version"":""v1"",""created"":""Tue, 13 May 2008 06:32:12 GMT""}]","2008-05-14"
