"0805.1706","Jitse Niesen","Veerle Ledoux, Simon J.A. Malham, Jitse Niesen, Vera Th\""ummler","Computing stability of multi-dimensional travelling waves","23 pages, 9 figures (some in colour). v2: added details and other
  changes to presentation after referees' comments, now 26 pages","SIAM J. Appl. Dynam. Systems, 8(1):480-507, 2009","10.1137/080724009",,"math.DS math.NA","http://arxiv.org/licenses/nonexclusive-distrib/1.0/","  We present a numerical method for computing the pure-point spectrum
associated with the linear stability of multi-dimensional travelling fronts to
parabolic nonlinear systems. Our method is based on the Evans function shooting
approach. Transverse to the direction of propagation we project the spectral
equations onto a finite Fourier basis. This generates a large, linear,
one-dimensional system of equations for the longitudinal Fourier coefficients.
We construct the stable and unstable solution subspaces associated with the
longitudinal far-field zero boundary conditions, retaining only the information
required for matching, by integrating the Riccati equations associated with the
underlying Grassmannian manifolds. The Evans function is then the matching
condition measuring the linear dependence of the stable and unstable subspaces
and thus determines eigenvalues. As a model application, we study the stability
of two-dimensional wrinkled front solutions to a cubic autocatalysis model
system. We compare our shooting approach with the continuous orthogonalization
method of Humpherys and Zumbrun. We then also compare these with standard
projection methods that directly project the spectral problem onto a finite
multi-dimensional basis satisfying the boundary conditions.
","[{""version"":""v1"",""created"":""Mon, 12 May 2008 18:20:11 GMT""},{""version"":""v2"",""created"":""Mon, 1 Dec 2008 11:40:02 GMT""}]","2009-03-17"
"0805.1707","Valenti Bosch-Ramon","V. Bosch-Ramon","The physics of non-thermal radiation in microquasars","20 pages, 4 figures, Lecture notes on microquasar non-thermal
  radiation physics for the First La Plata International School on Astronomy
  and Geophysics",,,,"astro-ph","http://arxiv.org/licenses/nonexclusive-distrib/1.0/","  Microquasars are binary systems that harbor a normal star and a compact
object (black-hole or neutron star), and show relativistic outflows (or jets).
The matter that forms these jets is of likely stellar origin, previously
expelled from the star and trapped in the potential well of the compact object.
This matter is accreted by the compact object, forming a disk due to its
angular momentum, and is eventually ejected in the form of a bipolar outflow
(the jets), which generates radio emission and could also be a very high-energy
emitter. To study and understand the radiation from microquasars, there is a
set of elements that can play a major role and are to be taken into account:
the photons and the expelled matter from the star in the case of high-mass
systems; the accreted matter radiation; the jet; the magnetic field carried by
the jet or filling the binary system; and the medium surrounding the
microquasar at large scales (~pc). In this lecture, we consider these elements
of the microquasar scenario and briefly describe the physical conditions and
processes involved in the production of non-thermal radiation from radio to
gamma-rays. The required energetics, particle acceleration and transport,
several radiative mechanisms, and the impact of different photon absorption
processes, are discussed.
","[{""version"":""v1"",""created"":""Mon, 12 May 2008 18:26:18 GMT""},{""version"":""v2"",""created"":""Fri, 16 May 2008 12:14:15 GMT""},{""version"":""v3"",""created"":""Mon, 27 Oct 2008 14:22:54 GMT""}]","2008-10-27"
"0805.1708","Kenneth S. Alexander","Kenneth S. Alexander, Nikos Zygouras","Quenched and Annealed Critical Points in Polymer Pinning Models","33 pages",,"10.1007/s00220-009-0882-5",,"math.PR math-ph math.MP","http://arxiv.org/licenses/nonexclusive-distrib/1.0/","  We consider a polymer with configuration modeled by the path of a Markov
chain, interacting with a potential $u+V_n$ which the chain encounters when it
visits a special state 0 at time $n$. The disorder $(V_n)$ is a fixed
realization of an i.i.d. sequence. The polymer is pinned, i.e. the chain spends
a positive fraction of its time at state 0, when $u$ exceeds a critical value.
We assume that for the Markov chain in the absence of the potential, the
probability of an excursion from 0 of length $n$ has the form $n^{-c}\phi(n)$
with $c \geq 1$ and $\phi$ slowly varying. Comparing to the corresponding
annealed system, in which the $V_n$ are effectively replaced by a constant, it
is known that the quenched and annealed critical points differ at all
temperatures for $3/2<c<2$ and $c>2$, but only at low temperatures for $c<3/2$.
For high temperatures and $3/2<c<2$ we establish the exact order of the gap
between critical points, as a function of temperature. For the borderline case
$c=3/2$ we show that the gap is positive provided $\phi(n) \to 0$ as $n \to
\infty$, and for $c >3/2$ with arbitrary temperature we provide a new proof
that the gap is positive, and extend it to $c=2$.
","[{""version"":""v1"",""created"":""Mon, 12 May 2008 18:41:56 GMT""}]","2015-05-13"
"0805.1709","Jesper Rasmussen","Jesper Rasmussen (1), Trevor J. Ponman (2), Lourdes Verdes-Montenegro
  (3), Min S. Yun (4), Sanchayeeta Borthakur (4) ((1) Carnegie Observatories,
  (2) U. Birmingham, (3) IAA-CSIC, (4) UMass Amherst)","Galaxy Evolution in Hickson Compact Groups: The Role of Ram Pressure
  Stripping and Strangulation","21 pages, 7 figures, MNRAS accepted. Fig. 1 reduced in quality",,"10.1111/j.1365-2966.2008.13451.x",,"astro-ph","http://arxiv.org/licenses/nonexclusive-distrib/1.0/","  Galaxies in compact groups tend to be deficient in neutral hydrogen compared
to isolated galaxies of similar optical properties. In order to investigate the
role played by a hot intragroup medium (IGM) for the removal and destruction of
HI in these systems, we have performed a Chandra and XMM-Newton study of eight
of the most HI deficient Hickson compact groups. Diffuse X-ray emission
associated with an IGM is detected in four of the groups, suggesting that
galaxy-IGM interactions are not the dominant mechanism driving cold gas out of
the group members. No clear evidence is seen for any of the members being
currently stripped of any hot gas, nor for galaxies to show enhanced nuclear
X-ray activity in the X-ray bright or most HI deficient groups. Combining the
inferred IGM distributions with analytical models of representative disc
galaxies orbiting within each group, we estimate the HI mass loss due to ram
pressure and viscous stripping. While these processes are generally
insufficient to explain observed HI deficiencies, they could still be important
for HI removal in the X-ray bright groups, potentially removing more than half
of the ISM in the X-ray bright HCG 97. Ram pressure may also have facilitated
strangulation through the removal of galactic coronal gas. In X-ray undetected
groups, tidal interactions could be playing a prominent role, but it remains an
open question whether they can fully account for the observed HI deficiencies.
","[{""version"":""v1"",""created"":""Mon, 12 May 2008 18:42:15 GMT""}]","2009-11-13"
"0805.1710","Yingdong Lu","Yingdong Lu","Approximating the Value Functions of Stochastic Knapsack Problems: A
  Homogeneous Monge-Amp\'ere Equation and Its Stochastic Counterparts",,,,,"math.OC","http://arxiv.org/licenses/nonexclusive-distrib/1.0/","  Stochastic knapsack problem originally was a versatile model for controls in
telecommunication networks. Recently, it draws attentions of revenue management
community by serving as a basic model for allocating resources over time. We
develop approximation schemes for knapsack problems in this paper, a system of
nonlinear but solvable partial differential equations and stochastic partial
differential equation are shown to be the limit of the process that following
the optimal solution of the stochastic knapsack problem.
","[{""version"":""v1"",""created"":""Mon, 12 May 2008 18:49:37 GMT""}]","2008-05-13"
"0805.1711","Enrique Moreno","P. Fernandez, E. F. Moreno, F. A. Schaposnik","Structure of the Vacuum in Deformed Supersymmetric Chiral Models","15 pages, minor corrections. Version to appear in JHEP","JHEP 0807:084,2008","10.1088/1126-6708/2008/07/084",,"hep-th","http://arxiv.org/licenses/nonexclusive-distrib/1.0/","  We analyze the vacuum structure of N=1/2 chiral supersymmetric theories in
deformed superspace. In particular we study O'Raifeartaigh models with
C-deformed superpotentials and canonical and non-canonical deformed Kahler
potentials. We find conditions under which the vacuum configurations are
affected by the deformations.
","[{""version"":""v1"",""created"":""Mon, 12 May 2008 18:55:32 GMT""},{""version"":""v2"",""created"":""Tue, 15 Jul 2008 16:51:26 GMT""}]","2009-12-04"
"0805.1712","Woo-Sung Jung","Keumsook Lee, Woo-Sung Jung, Jong Soo Park, M. Y. Choi","Statistical Analysis of the Metropolitan Seoul Subway System: Network
  Structure and Passenger Flows","10 pages, 4 figures",,"10.1016/j.physa.2008.06.035",,"physics.soc-ph","http://arxiv.org/licenses/nonexclusive-distrib/1.0/","  The Metropolitan Seoul Subway system, consisting of 380 stations, provides
the major transportation mode in the metropolitan Seoul area. Focusing on the
network structure, we analyze statistical properties and topological
consequences of the subway system. We further study the passenger flows on the
system, and find that the flow weight distribution exhibits a power-law
behavior. In addition, the degree distribution of the spanning tree of the
flows also follows a power law.
","[{""version"":""v1"",""created"":""Mon, 12 May 2008 18:56:55 GMT""}]","2009-11-13"
"0805.1713","Jailson Alcaniz","E.M. Barboza Jr., J.S. Alcaniz","A parametric model for dark energy","6 pages, 3 figures, LaTeX","Phys.Lett.B666:415-419,2008","10.1016/j.physletb.2008.08.012",,"astro-ph","http://arxiv.org/licenses/nonexclusive-distrib/1.0/","  Determining the mechanism behind the current cosmic acceleration constitutes
a major question nowadays in theoretical physics. If the dark energy route is
taken, this problem may potentially bring to light new insights not only in
Cosmology but also in high energy physics theories. Following this approach, we
explore in this paper some cosmological consequences of a new time-dependent
parameterization for the dark energy equation of state (EoS), which is a well
behaved function of the redshift $z$ over the entire cosmological evolution,
i.e., $z\in [-1,\infty)$. This parameterization allows us to divide the
parametric plane $(w_0,w_1)$ in defined regions associated to distinct classes
of dark energy models that can be confirmed or excluded from a confrontation
with current observational data. A statistical analysis involving the most
recent observations from type Ia supernovae, baryon acoustic oscillation peak,
Cosmic Microwave Background shift parameter and Hubble evolution $H(z)$ is
performed to check the observational viability of the EoS parameterization here
proposed.
","[{""version"":""v1"",""created"":""Mon, 12 May 2008 19:02:04 GMT""}]","2009-07-09"
"0805.1714","Mark D. Havey","I.M. Sokolov, M.D. Kupriyanova, D.V. Kupriyanov, M.D. Havey","Light scattering and localization in an ultracold and dense atomic
  system",,"Phys. Rev. A 79, 053405 (2009)","10.1103/PhysRevA.79.053405",,"quant-ph","http://arxiv.org/licenses/nonexclusive-distrib/1.0/","  The quantum optical response of high density ultracold atomic systems is
critical to a wide range of fundamentally and technically important physical
processes. These include quantum image storage, optically based quantum
repeaters and ultracold molecule formation. We present here a microscopic
analysis of the light scattering on such a system, and we compare it with a
corresponding description based on macroscopic Maxwell theory. Results are
discussed in the context of the spectral resonance structure, time-dependent
response, and the light localization problem.
","[{""version"":""v1"",""created"":""Mon, 12 May 2008 19:08:19 GMT""}]","2015-05-13"
"0805.1715","Robert Shour","Robert Shour","Isotropy, entropy, and energy scaling","v2 scaling focus; v3 isotropy focus; v4: revises a nat log thm; v5-8:
  isotropy and degrees of freedom focus with corrected proofreading; v9-10:
  rewrite of v5-8",,,,"cs.IT math.IT nlin.AO","http://arxiv.org/licenses/nonexclusive-distrib/1.0/","  Two principles explain emergence. First, in the Receipt's reference frame,
Deg(S) = 4/3 Deg(R), where Supply S is an isotropic radiative energy source,
Receipt R receives S's energy, and Deg is a system's degrees of freedom based
on its mean path length. S's 1/3 more degrees of freedom relative to R enables
R's growth and increasing complexity. Second, rho(R) = Deg(R) times rho(r),
where rho(R) represents the collective rate of R and rho(r) represents the rate
of an individual in R: as Deg(R) increases due to the first principle, the
multiplier effect of networking in R increases. A universe like ours with
isotropic energy distribution, in which both principles are operative, is
therefore predisposed to exhibit emergence, and, for reasons shown, a
ubiquitous role for the natural logarithm.
","[{""version"":""v1"",""created"":""Mon, 12 May 2008 19:24:11 GMT""},{""version"":""v10"",""created"":""Thu, 3 May 2012 17:59:07 GMT""},{""version"":""v2"",""created"":""Wed, 21 May 2008 19:08:39 GMT""},{""version"":""v3"",""created"":""Wed, 20 Aug 2008 19:43:55 GMT""},{""version"":""v4"",""created"":""Mon, 22 Dec 2008 14:10:42 GMT""},{""version"":""v5"",""created"":""Wed, 21 Dec 2011 22:40:43 GMT""},{""version"":""v6"",""created"":""Thu, 29 Dec 2011 19:26:20 GMT""},{""version"":""v7"",""created"":""Thu, 5 Jan 2012 17:57:11 GMT""},{""version"":""v8"",""created"":""Wed, 18 Jan 2012 17:07:42 GMT""},{""version"":""v9"",""created"":""Wed, 25 Apr 2012 15:47:34 GMT""}]","2012-05-04"
"0805.1716","Ioannis Deretzis","Ioannis Deretzis and Antonino La Magna","Bias-driven local density of states alterations and transport in
  ballistic molecular devices","10 pages, 7 figures","J. Chem. Phys. 128, 164706 (2008)","10.1063/1.2905216",,"cond-mat.mes-hall cond-mat.mtrl-sci","http://arxiv.org/licenses/nonexclusive-distrib/1.0/","  We study dynamic nonequilibrium electron charging phenomena in ballistic
molecular devices at room temperature that compromise their response to bias
and whose nature is evidently distinguishable from static Schottky-type
potential barriers. Using various metallic/semiconducting carbon nanotubes and
alkane dithiol molecules as active parts of a molecular bridge, we perform
self-consistent quantum transport calculations under the nonequilibrium Green's
function formalism coupled to a three-dimensional Poisson solver for a mutual
description of chemistry and electrostatics. Our results sketch a particular
tracking relationship between the device's local density of states and the
contact electrochemical potentials that can effectively condition the
conduction process by altering the electronic structure of the molecular
system. Such change is unassociated to electronic/phononic scattering effects
while its extent is highly correlated to the conducting character of the
system, giving rise to an increase of the intrinsic resistance of molecules
with a semiconducting character and a symmetric mass-center disposition.
","[{""version"":""v1"",""created"":""Mon, 12 May 2008 19:11:32 GMT""}]","2008-05-13"
"0805.1717","Giedrius Alkauskas","Giedrius Alkauskas","The Minkowski question mark function: explicit series for the dyadic
  period function and moments","39 pages, 1 figure (submitted). Note that the images of curves I_p
  are absent (they are contained in previous versions.) v4: Proofs in Section 3
  completed","Mathematics of Computation, 79 (2010), 383-418.","10.1090/S0025-5718-09-02263-7",,"math.NT math.CV","http://arxiv.org/licenses/nonexclusive-distrib/1.0/","  Previously, several natural integral transforms of the Minkowski question
mark function F(x) were introduced by the author. Each of them is uniquely
characterized by certain regularity conditions and the functional equation,
thus encoding intrinsic information about F(x). One of them - the dyadic period
function G(z) - was defined as a Stieltjes transform. In this paper we
introduce a family of ""distributions"" F_p(x) for Re p>=1, such that F_1(x) is
the question mark function and F_2(x) is a discrete distribution with support
on x=1. We prove that the generating function of moments of F_p(x) satisfies
the three term functional equation. This has an independent interest, though
our main concern is the information it provides about F(x). This approach
yields the following main result: we prove that the dyadic period function is a
sum of infinite series of rational functions with rational coefficients.
","[{""version"":""v1"",""created"":""Mon, 12 May 2008 19:27:51 GMT""},{""version"":""v2"",""created"":""Wed, 30 Jul 2008 13:30:57 GMT""},{""version"":""v3"",""created"":""Tue, 23 Sep 2008 11:11:45 GMT""},{""version"":""v4"",""created"":""Sat, 17 Jan 2009 14:19:12 GMT""}]","2009-09-23"
"0805.1718","Achim Franz","A Franz (for the PHENIX Collaboration)","Highlights from PHENIX - I","Contribution to the 2008 Quark Matter Conference, Jaipur India
  Sumbitted to Journal of Physics G: Nuclear and Particle Physics","J.Phys.G35:104002,2008","10.1088/0954-3899/35/10/104002",,"nucl-ex","http://arxiv.org/licenses/nonexclusive-distrib/1.0/","  This contribution highlights recent results from the PHENIX Collaboration at
RHIC. It covers global variables, flow and 2--particle correlations. A second
contribution in this issue, by T.C.Awes, covers PHENIX results on heavy quarks,
leptons and photons.
","[{""version"":""v1"",""created"":""Mon, 12 May 2008 19:21:46 GMT""}]","2019-08-13"
"0805.1719","Tomoi Koide","G.S.Denicol, T. Kodama, T. Koide, and Ph. Mota","Shock propagation and stability in causal dissipative hydrodynamics","14 pages, 16 figures","Phys.Rev.C78:034901,2008","10.1103/PhysRevC.78.034901",,"hep-ph cond-mat.stat-mech nucl-th","http://arxiv.org/licenses/nonexclusive-distrib/1.0/","  We studied the shock propagation and its stability with the causal
dissipative hydrodynamics in 1+1 dimensional systems. We show that the presence
of the usual viscosity is not enough to stabilize the solution. This problem is
solved by introducing an additional viscosity which is related to the
coarse-graining scale of the theory.
","[{""version"":""v1"",""created"":""Mon, 12 May 2008 19:50:42 GMT""}]","2008-11-26"
"0805.1720","Chris Cameron","C. Cameron, H. Saio, R. Kuschnig, G.A.H. Walker, J.M. Matthews, D.B.
  Guenther, A.F.J. Moffat, S.M. Rucinski, D. Sasselov, W.W. Weiss","MOST detects SPBe pulsations in HD 127756 & HD 217543: Asteroseismic
  rotation rates independent of vsini","36 pages, 16 figures, 3 tables, accepted for publication in ApJ",,"10.1086/590369",,"astro-ph","http://arxiv.org/licenses/nonexclusive-distrib/1.0/","  The MOST (Microvariability and Oscillations of Stars) satellite has
discovered SPBe (Slowly Pulsating Be) oscillations in the stars HD 127756
(B1/B2 Vne) and HD 217543 (B3 Vpe). For HD 127756, 30 significant frequencies
are identified from 31 days of nearly continuous photometry; for HD 217543, up
to 40 significant frequencies from 26 days of data. In both cases, the
oscillations fall into three distinct frequency ranges, consistent with models
of the stars. The variations are caused by nonradial g-modes (and possibly
r-modes) distorted by rapid rotation and excited by the opacity mechanism near
the iron opacity bump. A comparison of pulsation models and observed frequency
groups yields a rotation frequency for each star, independently of vsini. The
rotation rates of these stars, as well as those of the SPBe stars previously
discovered by MOST, HD 163868 and $\beta$ CMi, are all close to their critical
values.
","[{""version"":""v1"",""created"":""Mon, 12 May 2008 19:31:48 GMT""}]","2009-11-13"
"0805.1721","Hume A. Feldman","Hume A. Feldman (Kansas), Michael J. Hudson (Waterloo), Richard
  Watkins (Willamette)","Cosmic Flows on 100 Mpc/h scales","4 pages, 3 figures, Conference proceedings for the 43rd Rencontres de
  Moriond, La Thuile (Val d'Aosta, Italy) March 15 - 22, 2008. To be published
  in the proceedings",,,,"astro-ph","http://arxiv.org/licenses/nonexclusive-distrib/1.0/","  To study galactic motions on the largest available scales, we require bulk
flow moments whose window functions have as narrow a peak as possible and
having as small an amplitude as possible outside the peak. Typically the
moments found using the maximum likelihood estimate weights do not meet these
criteria. We present a new method for calculating weights for moments that
essentially allow us to ""design"" the moment's window function, subject, of
course, to the distribution and uncertainties of the available data.
","[{""version"":""v1"",""created"":""Mon, 12 May 2008 19:37:13 GMT""}]","2008-05-13"
"0805.1722","Andrew Powell","Andrew S. Powell","Towards Precision Measurements of $\gamma$: CLEO-c's Pivotal Role","5 pages, 1 figure. Presented at the Lake Louise Winter Institute,
  Alberta, Canada, 18th - 23rd February, 2008. To be published by World
  Scientific",,"10.1142/9789814280945_0045",,"hep-ex","http://arxiv.org/licenses/nonexclusive-distrib/1.0/","  Strategies that utilise the interference effects within $B^{\pm} \to
DK^{\pm}$ decays hold great potential for improving our sensitivity to the CKM
angle $\gamma$. However, in order to exploit fully this potential, detailed
knowledge of the D meson decay structure is required. This essential
information can be obtained from the quantum correlated $\psi(3770)$ datasets
at CLEO-c. Results of such analyses involving the decay mode $D \to
K\pi\pi\pi$, and their importance in the context of LHCb, will be presented.
","[{""version"":""v1"",""created"":""Mon, 12 May 2008 19:37:49 GMT""}]","2017-08-23"
"0805.1723","Nicolas Vuillerme","Nicolas Vuillerme (TIMC), Nicolas Pinsault (TIMC), Olivier Chenu
  (TIMC), Anthony Fleury (TIMC), Yohan Payan (TIMC), Jacques Demongeot (TIMC)","A Wireless Embedded Tongue Tactile Biofeedback System for Balance
  Control","Pervasive and Mobile Computing (2008) in press",,"10.1016/j.pmcj.2008.04.001",,"q-bio.NC","http://arxiv.org/licenses/nonexclusive-distrib/1.0/","  We describe the architecture of an original biofeedback system for balance
improvement for fall prevention and present results of a feasibility study. The
underlying principle of this biofeedback consists of providing supplementary
information related to foot sole pressure distribution through a wireless
embedded tongue-placed tactile output device. Twelve young healthy adults
voluntarily participated in this experiment. They were asked to stand as
immobile as possible with their eyes closed in two conditions of nobiofeedback
and biofeedback. Centre of foot pressure (CoP) displacements were recorded
using a force platform. Results showed reduced CoP displacements in the
biofeedback relative to the no-biofeedback condition. On the whole, the present
findings evidence the effectiveness of this system in improving postural
control on young healthy adults. Further investigations are needed to
strengthen the potential clinical value of this device.
","[{""version"":""v1"",""created"":""Mon, 12 May 2008 19:41:16 GMT""}]","2008-12-18"
"0805.1724","Aron Cohen","Aron J. Cohen, Paula Mori-S\'anchez and Weitao Yang","Fractional spins and static correlation error in density functional
  theory","6 pages, 4 figures",,"10.1063/1.2987202",,"cond-mat.other cond-mat.str-el","http://arxiv.org/licenses/nonexclusive-distrib/1.0/","  Electronic states with fractional spins arise in systems with large static
correlation (strongly correlated systems). Such fractional-spin states are
shown to be ensembles of degenerate ground states with normal spins. It is
proven here that the energy of the exact functional for fractional-spin states
is a constant, equal to the energy of the comprising degenerate pure spin
states. Dramatic deviations from this exact constancy condition exist with all
approximate functionals, leading to large static correlation errors for
strongly correlated systems, such as chemical bond dissociation and band
structure of Mott insulators. This is demonstrated with numerical calculations
for several molecular systems. Approximating the constancy behavior for
fractional spins should be a major aim in functional constructions and should
open the frontier for DFT to describe strongly correlated systems. The key
results are also shown to apply in reduced density-matrix functional theory.
","[{""version"":""v1"",""created"":""Mon, 12 May 2008 19:41:43 GMT""}]","2009-11-13"
"0805.1725","Henri-Claude Nataf","Henri-Claude Nataf (LGIT), Nad\`ege Gagni\`ere (LGIT)","On the peculiar nature of turbulence in planetary dynamos","in press in Compte Rendu de l'Academie des Sciences","Comptes Rendus Physique 9, 7 (2008) 702-710","10.1016/j.crhy.2008.07.009",,"physics.geo-ph physics.flu-dyn","http://arxiv.org/licenses/nonexclusive-distrib/1.0/","  Under the combined constraints of rapid rotation, sphericity, and magnetic
field, motions in planetary cores get organized in a peculiar way. Classical
hydrodynamic turbulence is not present, but turbulent motions can take place
under the action of the buoyancy and Laplace forces. Laboratory experiments,
such as the rotating spherical magnetic Couette DTS experiment in Grenoble,
help us understand what motions take place in planetary core conditions.
","[{""version"":""v1"",""created"":""Mon, 12 May 2008 19:43:34 GMT""},{""version"":""v2"",""created"":""Thu, 7 Aug 2008 16:17:16 GMT""}]","2008-11-14"
