"0805.1825","Thawatchai Mayteevarunyoo","Thawatchai Mayteevarunyoo and Boris A. Malomed","Gap solitons in grating superstructures","11 pages, 8 figures, Optics Express, in press",,"10.1364/OE.16.007767",,"nlin.PS physics.optics","http://creativecommons.org/licenses/by/3.0/","  We report results of the investigation of gap solitons (GSs) in the generic
model of a periodically modulated Bragg grating (BG), which includes periodic
modulation of the BG chirp or local refractive index, and periodic variation of
the local reflectivity. We demonstrate that, while the previously studied
reflectivity modulation strongly destabilizes all solitons, the periodic chirp
modulation, which is a novel feature, stabilizes a new family of double-peak
fundamental BGs in the side bandgap at negative frequencies (gap No. -1), and
keeps solitons stable in the central bandgap (No. 0). The two soliton families
demonstrate bistability, coexisting at equal values of energy. In addition,
stable 4-peak bound states are formed by pairs of fundamental GSs in bandgap
-1. Self-trapping and mobility of the solitons are studied too.
","[{""version"":""v1"",""created"":""Tue, 13 May 2008 11:18:30 GMT""}]","2009-11-13"
"0805.1826","Akira Ishida","Akira Ishida, Shunsuke Teraguchi","On the general action of boundary (super)string field theory","19 pages, minor corrections","JHEP 0807:020,2008","10.1088/1126-6708/2008/07/020",,"hep-th","http://arxiv.org/licenses/nonexclusive-distrib/1.0/","  We reconstruct boundary superstring field theory via boundary states. After a
minor modification of the fermionic two-form, all the equations needed for
Batalin-Vilkovisky formulation are simply represented by closed string
oscillators and the proof of gauge invariance is drastically simplified. The
general form of the action of boundary superstring field theory is also
obtained without any assumption and found to take exactly the same form as the
bosonic one. As a special case of this action, we revisit the conjecture that
the action is simply given by the disk partition function when matter and
ghosts are completely decoupled.
","[{""version"":""v1"",""created"":""Tue, 13 May 2008 12:09:07 GMT""},{""version"":""v2"",""created"":""Fri, 4 Jul 2008 12:19:26 GMT""}]","2009-12-04"
"0805.1827","Mireille Bossy","Mireille Bossy (INRIA Sophia Antipolis / INRIA Lorraine / IECN),
  Fran\c{c}oise Baude (INRIA Sophia Antipolis), Viet Dung Doan (INRIA Sophia
  Antipolis), Abhijeet Gaikwad (INRIA Sophia Antipolis), Ian Stokes-Rees (INRIA
  Sophia Antipolis)","Parallel Pricing Algorithms for Multi--Dimensional Bermudan/American
  Options using Monte Carlo methods",,"N&deg; RR-6530 (2008)","10.1016/j.matcom.2010.08.005","RR-6530","cs.DC cs.CE","http://arxiv.org/licenses/nonexclusive-distrib/1.0/","  In this paper we present two parallel Monte Carlo based algorithms for
pricing multi--dimensional Bermudan/American options. First approach relies on
computation of the optimal exercise boundary while the second relies on
classification of continuation and exercise values. We also evaluate the
performance of both the algorithms in a desktop grid environment. We show the
effectiveness of the proposed approaches in a heterogeneous computing
environment, and identify scalability constraints due to the algorithmic
structure.
","[{""version"":""v1"",""created"":""Tue, 13 May 2008 12:34:04 GMT""}]","2014-02-18"
"0805.1828","Kostya Trachenko","V.V. Brazhkin, Y. Katayama, K. Trachenko, O.B. Tsiok, A.G. Lyapin,
  Emilio Artacho, M. Dove, G. Ferlat, Y. Inamura and H. Saitoh","Nature of Structural Transformations in the B2O3 Glass under High
  Pressure",,"Physical Review Letters 101, 035702 (2008)",,,"cond-mat.dis-nn","http://arxiv.org/licenses/nonexclusive-distrib/1.0/","  We report the results of the X-ray diffraction study of B2O3 glass in the
pressure interval up to 10 GPa in the 300-700 K temperature range, the results
of in-situ volumetric measurements of the glass at pressures up to 9 GPa at
room temperature, and first-principles simulations data at pressures up to
250GPa. The behavior of B2O3 glass under pressure can be described as two broad
pressure-overlapping transitions. The first transition starts at P > 1 GPa and
proceeds without any changes in thecoordination number of the boron atoms; the
other one starts at P > 5 GPa and is accompanied by a gradual increase of
coordination number. The second transition is completely reversible; the
residual densification of the B2O3 glass after decompression is associated with
the incomplete reversibility of the first transformation. The fraction of boron
atoms transferred to the 4-coordination state in the glass at P < 10 GPa is
much smaller than was assumed from indirect experimental data [4], but is
considerably larger (by tens of times) than was previously suggested by the
classical molecular dynamics simulations [5,6]. The observed transformations
under both compression and decompression are quite broad, contrary to the
assumption in Ref. [7]. On the basis of ab-initio results, we also predict the
one more transformation under higher pressures to a super-dense phase, in which
B atoms become 5- and 6-fold coordinated.
","[{""version"":""v1"",""created"":""Tue, 13 May 2008 11:46:16 GMT""}]","2008-07-19"
"0805.1829","Hajime Tsuji","Hajime Tsuji","Canonical measures and the dynamical systems of Bergman kernels","Minor changes",,,,"math.AG math.DG","http://arxiv.org/licenses/nonexclusive-distrib/1.0/","  In this article, we construct the canonical semipositive current or the
canonical measure ($=$ the potential of the canonical semipositive current) on
a smooth projective variety of nonnegative Kodaira dimension in terms of a
dynamical system of Bergman kernels. This current is considered to be a
generalization of a K\""{a}hler-Einstein metric and coincides the one
constructed independently by J. Song and G. Tian. The major difference between
their work and the present article is that they found the canonical measure in
terms of K\""{a}her-Ricci flows, while I found the canonical measure in terms of
the dynamical system of Bergman kernels. Hence the present approach can be
viewed as the discrete version of the K\""{a}hler-Ricci flow.
","[{""version"":""v1"",""created"":""Tue, 13 May 2008 13:19:48 GMT""},{""version"":""v2"",""created"":""Mon, 23 Jun 2008 13:46:27 GMT""},{""version"":""v3"",""created"":""Thu, 26 Mar 2009 05:30:11 GMT""},{""version"":""v4"",""created"":""Mon, 7 Mar 2011 13:14:17 GMT""}]","2011-03-08"
"0805.1832","Amichay Vardi","Y. Khodorkovsky, G. Kurizki, A. Vardi","Bosonic amplification of noise-induced suppression of phase diffusion","5 pages, 4 figures","Phys. Rev. Lett. 100, 220403 (2008).","10.1103/PhysRevLett.100.220403",,"cond-mat.other","http://arxiv.org/licenses/nonexclusive-distrib/1.0/","  We study the effect of noise-induced dephasing on collisional phase-diffusion
in the two-site Bose-Hubbard model. Dephasing of the quasi-momentum modes may
slow down phase-diffusion in the quantum Zeno limit. Remarkably, the degree of
suppression is enhanced by a bosonic factor of order $N/\log{N}$ as the
particle number $N$ increases.
","[{""version"":""v1"",""created"":""Tue, 13 May 2008 12:28:48 GMT""}]","2009-11-13"
"0805.1833","Elisabeth Remm","Lucia Garcia-Vergnolle, Elisabeth Remm","Complex structures on quasi-filiform nilpotent Lie algebras","In French",,,,"math.RA math.DG","http://arxiv.org/licenses/nonexclusive-distrib/1.0/","  We present the classification of real nilpotent quasi-filiform Lie algebras
endowed with a complex structure. A nilpotent Lie algebra g is called
quasi-filiform is the nilindex is equal to dim(n)-2. We recall that the
filiform case (nilindex =dim(g)-1) has already been studied.
","[{""version"":""v1"",""created"":""Tue, 13 May 2008 12:21:50 GMT""}]","2008-05-14"
"0805.1834","Jaakko Vainio","Tuomas Multam\""aki, Jaakko Vainio and Iiro Vilja","Maximal symmetry and metric-affine f(R) gravity","7 pages","Class.Quant.Grav.26:075005,2009","10.1088/0264-9381/26/7/075005",,"gr-qc astro-ph","http://arxiv.org/licenses/nonexclusive-distrib/1.0/","  The affine connection in a space-time with a maximally symmetric spatial
subspace is derived using the properties of maximally symmetric tensors. The
number of degrees of freedom in metric-affine gravity is thereby considerably
reduced while the theory allows spatio-temporal torsion and remains non-metric.
The Ricci tensor and scalar are calculated in terms of the connection and the
field equations derived for the Einstein-Hilbert as wells as for f(R)
Lagrangians. By considering specific forms of f(R), we demonstrate that the
resulting Friedmann equations in Palatini formalism without torsion and
metric-affine formalism with maximal symmetry are in general different in the
presence of matter.
","[{""version"":""v1"",""created"":""Tue, 13 May 2008 12:39:20 GMT""}]","2009-03-20"
"0805.1835","Del Buono Luigi","Maurice Benayoun","Effects of the (rho, omega, phi) mixing on the dipion mass spectrum in
  e+ e- annihilation and tau decay","7 pages, Moriond 2008",,,,"hep-ph","http://arxiv.org/licenses/nonexclusive-distrib/1.0/","  A way to explain the puzzling difference between the pion form factor as
measured in e+ e- annihilations and in tau decays is discussed. We show that
isospin symmetry breaking, beside the already identified effects, produces also
a full mixing between the rho0, omega and phi mesons which generates an isospin
0 component inside the rho0 meson. This effect, not accounted for in current
treatments of the problem, seems able to account for the apparent mismatch
between e+ e- and tau data below the phi mass.
","[{""version"":""v1"",""created"":""Tue, 13 May 2008 12:36:29 GMT""}]","2008-05-14"
"0805.1836","Sarika Jalan","R. E. Amritkar and Sarika Jalan","Coupled Dynamics on Networks",,"Physica A, Vol. 346, 13 (2005)","10.1016/j.physa.2004.08.044",,"nlin.CD","http://arxiv.org/licenses/nonexclusive-distrib/1.0/","  We study the synchronization of coupled dynamical systems on a variety of
networks. The dynamics is governed by a local nonlinear map or flow for each
node of the network and couplings connecting different nodes via the links of
the network. For small coupling strengths nodes show turbulent behavior but
form synchronized clusters as coupling increases. When nodes show synchronized
behaviour, we observe two interesting phenomena. First, there are some nodes of
the floating type that show intermittent behaviour between getting attached to
some clusters and evolving independently. Secondly, we identify two different
ways of cluster formation, namely self-organized clusters which have mostly
intra-cluster couplings and driven clusters which have mostly inter-cluster
couplings.
","[{""version"":""v1"",""created"":""Tue, 13 May 2008 12:33:21 GMT""}]","2009-11-13"
"0805.1837","Sarika Jalan","Fatihcan M. Atay, Sarika Jalan and J\""urgen Jost","Symbolic dynamics and synchronization of coupled map networks with
  multiple delays","13 pages, 4 figures","Physics Letters A 375 (2010) 130-135","10.1016/j.physleta.2010.10.044",,"nlin.CD cond-mat.stat-mech","http://arxiv.org/licenses/nonexclusive-distrib/1.0/","  We use symbolic dynamics to study discrete-time dynamical systems with
multiple time delays. We exploit the concept of avoiding sets, which arise from
specific non-generating partitions of the phase space and restrict the
occurrence of certain symbol sequences related to the characteristics of the
dynamics. In particular, we show that the resulting forbidden sequences are
closely related to the time delays in the system. We present two applications
to coupled map lattices, namely (1) detecting synchronization and (2)
determining unknown values of the transmission delays in networks with possibly
directed and weighted connections and measurement noise. The method is
applicable to multi-dimensional as well as set-valued maps, and to networks
with time-varying delays and connection structure.
","[{""version"":""v1"",""created"":""Tue, 13 May 2008 12:39:27 GMT""},{""version"":""v2"",""created"":""Mon, 20 Dec 2010 12:07:48 GMT""}]","2010-12-21"
"0805.1838","Iv\'an Calvo","Ivan Calvo, Raul Sanchez, Benjamin A. Carreras","Fractional Levy motion through path integrals","9 pages, minor changes, published version","J. Phys. A: Math. Theor. 42 (2009) 055003","10.1088/1751-8113/42/5/055003",,"cond-mat.stat-mech","http://arxiv.org/licenses/nonexclusive-distrib/1.0/","  Fractional Levy motion (fLm) is the natural generalization of fractional
Brownian motion in the context of self-similar stochastic processes and stable
probability distributions. In this paper we give an explicit derivation of the
propagator of fLm by using path integral methods. The propagators of Brownian
motion and fractional Brownian motion are recovered as particular cases. The
fractional diffusion equation corresponding to fLm is also obtained.
","[{""version"":""v1"",""created"":""Tue, 13 May 2008 12:43:33 GMT""},{""version"":""v2"",""created"":""Thu, 5 Mar 2009 05:23:26 GMT""}]","2009-11-13"
"0805.1839","Fernando Metz","F. L. Metz and W. K. Theumann","Instability of frozen-in states in synchronous Hebbian neural networks","14 pages and 4 figures; accepted for publication in J. Phys. A: Math.
  Gen",,"10.1088/1751-8113/41/26/265001",,"cond-mat.dis-nn cond-mat.stat-mech","http://arxiv.org/licenses/nonexclusive-distrib/1.0/","  The full dynamics of a synchronous recurrent neural network model with Ising
binary units and a Hebbian learning rule with a finite self-interaction is
studied in order to determine the stability to synaptic and stochastic noise of
frozen-in states that appear in the absence of both kinds of noise. Both, the
numerical simulation procedure of Eissfeller and Opper and a new alternative
procedure that allows to follow the dynamics over larger time scales have been
used in this work. It is shown that synaptic noise destabilizes the frozen-in
states and yields either retrieval or paramagnetic states for not too large
stochastic noise. The indications are that the same results may follow in the
absence of synaptic noise, for low stochastic noise.
","[{""version"":""v1"",""created"":""Tue, 13 May 2008 12:48:53 GMT""}]","2009-11-13"
"0805.1840","Nikolaos Tetradis","Nikolaos Tetradis","Effective Field Theory with a Variable Ultraviolet Cutoff","minor corrections, additional references","J.Math.Phys.50:013522,2009","10.1063/1.3054272",,"hep-th","http://arxiv.org/licenses/nonexclusive-distrib/1.0/","  The properties of strongly gravitating systems suggest that field theory
overcounts the states of a system. Reducing the number of degrees of freedom,
without abandoning the notion of effective field theory, may be achieved
through a connection between the ultraviolet and infrared cutoffs. We provide
an implementation of this idea within the Wilsonian approach to the
renormalization group. We derive an exact flow equation that describes the
evolution of the effective action. We discuss the implications for the
existence of infrared fixed points and the running of couplings. We also give
an alternative derivation in the context of the perturbative renormalization
group.
","[{""version"":""v1"",""created"":""Tue, 13 May 2008 12:49:36 GMT""},{""version"":""v2"",""created"":""Sat, 27 Dec 2008 17:23:33 GMT""}]","2009-02-10"
"0805.1841","Giulia Rodighiero","Alberto Franceschini (1), Giulia Rodighiero (1), Mattia Vaccari (1)
  ((1) Astronomy Department, University of Padova)","The extragalactic optical-infrared background radiations, their time
  evolution and the cosmic photon-photon opacity","Accepted for publication in Astronomy and Astrophysics. The current
  paper has been corrected for a small error in eq.(13) appearing in the
  previous version","Astron.Astrophys.487:837,2008","10.1051/0004-6361:200809691",,"astro-ph","http://arxiv.org/licenses/nonexclusive-distrib/1.0/","  The background radiations in the optical and the infrared constitute a
relevant cause of energy loss in the propagation of high energy particles
through space. In particular, TeV observations with Cherenkov telescopes of
extragalactic sources are influenced by the opacity effects due to the
interaction of the very high-energy source photons with the background light.
With the aim of assessing with the best possible detail these opacity terms, we
have modelled the extragalactic optical and IR backgrounds using available
information on cosmic sources in the universe from far-UV to sub-mm wavelengths
over a wide range of cosmic epochs. We have exploited the relevant cosmological
survey data - including number counts, redshift distributions, luminosity
functions - from ground-based observatories in the optical, near-IR, and
sub-mm, as well as multi-wavelength information coming from space telescopes,
HST, ISO and Spitzer. Additional constraints have been used from direct
measurements or upper limits on the extragalactic backgrounds by dedicated
missions (COBE). All data were fitted and interpolated with a multi-wavelength
backward evolutionary model, allowing us to estimate the background photon
density and its redshift evolution. From the redshift-dependent background
spectrum, the photon-photon opacities for sources of high-energy emission at
any redshifts were then computed. The same results can also be used to compute
the optical depths for any kind of processes in the intergalactic space
involving interactions with background photons (like scattering of cosmic-ray
particles). We have applied our photon-photon opacity estimates to the analysis
of spectral data at TeV energies on a few BLAZARs of particular interest.
[abridged]
","[{""version"":""v1"",""created"":""Tue, 13 May 2008 12:58:49 GMT""},{""version"":""v2"",""created"":""Mon, 16 Jun 2008 13:04:58 GMT""}]","2011-09-01"
"0805.1842","Patrick Popescu-Pampu","Patrick Popescu-Pampu, Jose Seade","A finiteness theorem for dual graphs of surface singularities","10 pages","International Journal of Mathematics 20, no. 8 (2009), 1057-1068",,,"math.CV math.AG","http://arxiv.org/licenses/nonexclusive-distrib/1.0/","  Consider a fixed connected, finite graph $\Gamma$ and equip its vertices with
weights $p_i$ which are non-negative integers. We show that there is a finite
number of possibilities for the coefficients of the canonical cycle of a
numerically Gorenstein surface singularity having $\Gamma$ as the dual graph of
the minimal resolution, the weights $p_i$ of the vertices being the arithmetic
genera of the corresponding irreducible components. As a consequence we get
that if $\Gamma$ is not a cycle, then there is a finite number of possibilities
of self-intersection numbers which one can attach to the vertices which are of
valency $\geq 2$, such that one gets the dual graph of the minimal resolution
of a numerically Gorenstein surface singularity. Moreover, we describe
precisely the situations when there exists an infinite number of possibilities
for the self-intersections of the component corresponding to some fixed vertex
of $\Gamma$.
","[{""version"":""v1"",""created"":""Tue, 13 May 2008 12:55:52 GMT""},{""version"":""v2"",""created"":""Tue, 15 Sep 2009 11:54:01 GMT""}]","2009-09-15"
"0805.1843","Corsin Battaglia","Corsin Battaglia, Philipp Aebi, Steven C. Erwin","Stability and structure of atomic chains on Si(111)",,"Phys. Rev. B 78, 075409 (2008)","10.1103/PhysRevB.78.075409",,"cond-mat.other","http://arxiv.org/licenses/nonexclusive-distrib/1.0/","  We study the stability and structure of self-assembled atomic chains on
Si(111) induced by monovalent, divalent and trivalent adsorbates, using
first-principles total-energy calculations and scanning tunneling microscopy.
We find that only structures containing exclusively silicon honeycomb or
silicon Seiwatz chains are thermodynamically stable, while mixed
configurations, with both honeycomb and Seiwatz chains, may be kinetically
stable. The stability and structure of these atomic chains can be understood
using a surprisingly simple electron-counting rule.
","[{""version"":""v1"",""created"":""Tue, 13 May 2008 13:39:59 GMT""}]","2008-09-05"
"0805.1844","John Sidles","John A. Sidles, Joseph L. Garbini, Lee E. Harrell, Alfred O. Hero,
  Jonathan P. Jacky, Joseph R. Malcomb, Anthony G. Norman, Austin M. Williamson","Practical recipes for the model order reduction, dynamical simulation,
  and compressive sampling of large-scale open quantum systems","104 pages, 13 figures, 2 tables",,"10.1088/1367-2630/11/6/065002",,"quant-ph cs.IT math.IT math.NA","http://arxiv.org/licenses/nonexclusive-distrib/1.0/","  This article presents numerical recipes for simulating high-temperature and
non-equilibrium quantum spin systems that are continuously measured and
controlled. The notion of a spin system is broadly conceived, in order to
encompass macroscopic test masses as the limiting case of large-j spins. The
simulation technique has three stages: first the deliberate introduction of
noise into the simulation, then the conversion of that noise into an equivalent
continuous measurement and control process, and finally, projection of the
trajectory onto a state-space manifold having reduced dimensionality and
possessing a Kahler potential of multi-linear form. The resulting simulation
formalism is used to construct a positive P-representation for the thermal
density matrix. Single-spin detection by magnetic resonance force microscopy
(MRFM) is simulated, and the data statistics are shown to be those of a random
telegraph signal with additive white noise. Larger-scale spin-dust models are
simulated, having no spatial symmetry and no spatial ordering; the
high-fidelity projection of numerically computed quantum trajectories onto
low-dimensionality Kahler state-space manifolds is demonstrated. The
reconstruction of quantum trajectories from sparse random projections is
demonstrated, the onset of Donoho-Stodden breakdown at the Candes-Tao sparsity
limit is observed, a deterministic construction for sampling matrices is given,
and methods for quantum state optimization by Dantzig selection are given.
","[{""version"":""v1"",""created"":""Tue, 13 May 2008 14:39:57 GMT""}]","2015-05-13"
"0805.1845","Marc Troyanov","Vladimir Gol'dshtein, Marc Troyanov","On the $L_{q,p}$-cohomology of Riemannian Manifolds with Negative
  Curvature","10 pages",,,,"math.DG math.AP","http://arxiv.org/licenses/nonexclusive-distrib/1.0/","  We prove a non-vanishing result for the $L_{q,p}$-cohomology of complete
simply-connected Riemannian manifolds with pinched negative curvature.
","[{""version"":""v1"",""created"":""Tue, 13 May 2008 13:17:44 GMT""}]","2008-05-14"
"0805.1846","Manfried Faber","Manfried Faber, Jeff Greensite, Urs M. Heller, Roman H\""ollwieser,
  \v{S}tefan Olejn\'ik","Center Vortices and the Dirac Spectrum","some high temperature results and references added","Phys.Rev.D78:054508,2008","10.1103/PhysRevD.78.054508",,"hep-lat","http://arxiv.org/licenses/nonexclusive-distrib/1.0/","  We study correlations between center vortices and the low-lying eigenmodes of
the Dirac operator, in both the overlap and asqtad formulations. In particular
we address a puzzle raised some years ago by Gattnar et al. [Nucl. Phys. B 716,
105 (2005)], who noted that the low-lying Dirac eigenmodes required for chiral
symmetry breaking do not appear to be present in center-projected
configurations. We show that the low-lying modes are in fact present in the
staggered (asqtad) formulation, but not in the overlap and ``chirally
improved'' formulations, and suggest a reason for this difference. We also
confirm and extend the results of Kovalenko et al. [Phys. Lett. B 648, 383
(2007)], showing that there is a correlation between center vortex locations,
and the scalar density of low-lying Dirac eigenmodes derived from unprojected
configurations. This correlation is strongest at points which are associated,
in the vortex picture, with non-vanishing topological charge density, such as
vortex intersection and ``writhing'' points. We present supporting evidence
that the lowest Dirac eigenmodes, in both asqtad and overlap formulations, have
their largest concentrations in point-like regions, rather than on submanifolds
of higher dimensionality.
","[{""version"":""v1"",""created"":""Tue, 13 May 2008 13:36:49 GMT""},{""version"":""v2"",""created"":""Fri, 20 Jun 2008 12:11:56 GMT""}]","2010-05-12"
"0805.1847","Ahmed Youssef","Biswajit Chakraborty, Jean Pierre Gazeau, Ahmed Youssef","Coherent state quantization of angle, time, and more irregular functions
  and distributions","22 pages, 5 figures",,,,"quant-ph hep-th","http://arxiv.org/licenses/nonexclusive-distrib/1.0/","  The domain of application of quantization methods is traditionally restricted
to smooth classical observables. We show that the coherent states or
""anti-Wick"" quantization enables us to construct fairly reasonable quantum
versions of irregular observables living on the classical phase space, such as
the angle function, the time function of a free particle and even a large set
of distributions comprising the tempered distributions.
","[{""version"":""v1"",""created"":""Tue, 13 May 2008 13:27:58 GMT""},{""version"":""v2"",""created"":""Wed, 3 Dec 2008 18:29:46 GMT""}]","2008-12-03"
