"0806.1251","Oleg Kirillov","Oleg N. Kirillov, Uwe Guenther, Frank Stefani","Determining role of Krein signature for 3D Arnold tongues of oscillatory
  dynamos","4 pages, 3 figures, presented at the GAMM 2008, Bremen, Germany
  Introduction extended, refs added","Phys.Rev.E79:016205,2009","10.1103/PhysRevE.79.016205",,"math-ph astro-ph math.DS math.MP physics.geo-ph","http://arxiv.org/licenses/nonexclusive-distrib/1.0/","  Using a homotopic family of boundary eigenvalue problems for the mean-field
$\alpha^2$-dynamo with helical turbulence parameter
$\alpha(r)=\alpha_0+\gamma\Delta\alpha(r)$ and homotopy parameter $\beta \in
[0,1]$, we show that the underlying network of diabolical points for Dirichlet
(idealized, $\beta=0$) boundary conditions substantially determines the
choreography of eigenvalues and thus the character of the dynamo instability
for Robin (physically realistic, $\beta=1$) boundary conditions. In the
$(\alpha_0,\beta,\gamma)-$space the Arnold tongues of oscillatory solutions at
$\beta=1$ end up at the diabolical points for $\beta=0$. In the vicinity of the
diabolical points the space orientation of the 3D tongues, which are cones in
first-order approximation, is determined by the Krein signature of the modes
involved in the diabolical crossings at the apexes of the cones. The Krein
space induced geometry of the resonance zones explains the subtleties in
finding $\alpha$-profiles leading to spectral exceptional points, which are
important ingredients in recent theories of polarity reversals of the
geomagnetic field.
","[{""version"":""v1"",""created"":""Sat, 7 Jun 2008 08:54:20 GMT""},{""version"":""v2"",""created"":""Fri, 19 Dec 2008 23:10:57 GMT""}]","2009-03-04"
"0806.1252","Prof. Dr. M. W. Wu","K. Shen, M. Q. Weng, and M. W. Wu","$L$-valley electron $g$ factor in bulk GaAs and AlAs","4 pages, 1 figure, To be published in J. App. Phys. 104, 2008","J. Appl. Phys. 104, 063719 (2008).","10.1063/1.2986151",,"cond-mat.mtrl-sci","http://arxiv.org/licenses/nonexclusive-distrib/1.0/","  We study the Land\'e $g$-factor of conduction electrons in the $L$-valley of
bulk GaAs and AlAs by using a three-band $\mathbf{k}\cdot\mathbf{p}$ model
together with the tight-binding model. We find that the $L$-valley $g$-factor
is highly anisotropic, and can be characterized by two components, $g_{\perp}$
and $g_{\|}$. $g_{\perp}$ is close to the free electron Land\'e factor but
$g_{\|}$ is strongly affected by the remote bands. The contribution from remote
bands on $g_{\|}$ depends on how the remote bands are treated. However, when
the magnetic field is in the Voigt configuration, which is widely used in the
experiments, different models give almost identical $g$-factor.
","[{""version"":""v1"",""created"":""Sat, 7 Jun 2008 01:24:48 GMT""},{""version"":""v2"",""created"":""Tue, 19 Aug 2008 02:55:25 GMT""}]","2008-09-30"
"0806.1253","Humberto Belich","H. Belich, L.P. Colatto, T. Costa-Soares, J.A. Helay\""el-Neto, M.T.D.
  Orlando","Magnetic Moment Generation from non-minimal couplings in a scenario with
  Lorentz-Symmetry Violation","9 pages, revtex","Eur.Phys.J.C62:425-432,2009","10.1140/epjc/s10052-009-1017-z",,"hep-th","http://arxiv.org/licenses/nonexclusive-distrib/1.0/","  This paper deals with situations that illustrate how the violation of Lorentz
symmetry in the gauge sector may contribute to magnetic moment generation of
massive neutral particles with spin-1/2 and spin-1. The procedure we adopt here
is based on Relativistic Quantum Mechanics. We work out the non-relativistic
regime that follows from the wave equation corresponding to a certain particle
coupled to an external electromagnetic field and a background that accounts for
the Lorentz symmetry violation, and we read thereby the magnetic dipole moment
operator for the particle under consideration.We keep track of the parameters
that govern the non-minimal electromagnetic coupling and the breaking of
Lorentz symmetry in the expressions we get for the magnetic moments in the
different cases we contemplate. Our claim is that the tiny magnetic dipole
moment of truly elementary neutral particles might signal Lorentz symmetry
violation.
","[{""version"":""v1"",""created"":""Sat, 7 Jun 2008 01:42:13 GMT""},{""version"":""v2"",""created"":""Tue, 25 Nov 2008 16:50:04 GMT""}]","2009-07-24"
"0806.1254","Jun-Feng Sun","Junfeng Sun, Yueling Yang, Wenjie Du, Huilan Ma","Study of Bc -> BP,BV Decays with QCD Factorization","revtex4; Published Fri Jun 6, 2008","Phys.Rev.D77:114004,2008","10.1103/PhysRevD.77.114004",,"hep-ph","http://creativecommons.org/licenses/by/3.0/","  The Bc -> BP,BV decays are studied with the QCD factorization approach (where
P and V denote pseudoscalar and vector mesons, respectively). Considering the
contributions of both current-current and penguin operators, the amplitudes of
branching ratios are estimated at the leading approximation. We find that the
contributions of the penguin operators are very small due to the serious
suppression by the CKM elements. The most promising decay modes are Bc -> Bs
Pi, Bs rho, which might be easily detected at hadron colliders.
","[{""version"":""v1"",""created"":""Sat, 7 Jun 2008 01:42:46 GMT""}]","2008-11-26"
"0806.1255","Douglas Arnold","Douglas N. Arnold, Richard S. Falk, and Ragnar Winther","Geometric decompositions and local bases for spaces of finite element
  differential forms","25 pages, 2 figures, submitted to Computer Methods in Applied
  Mechanics and Engineering","Comput. Methods Appl. Mech. Engrg., 198:1660-1672, 2009","10.1016/j.cma.2008.12.017",,"math.NA","http://arxiv.org/licenses/nonexclusive-distrib/1.0/","  We study the two primary families of spaces of finite element differential
forms with respect to a simplicial mesh in any number of space dimensions.
These spaces are generalizations of the classical finite element spaces for
vector fields, frequently referred to as Raviart-Thomas, Brezzi-Douglas-Marini,
and Nedelec spaces. In the present paper, we derive geometric decompositions of
these spaces which lead directly to explicit local bases for them, generalizing
the Bernstein basis for ordinary Lagrange finite elements. The approach applies
to both families of finite element spaces, for arbitrary polynomial degree,
arbitrary order of the differential forms, and an arbitrary simplicial
triangulation in any number of space dimensions. A prominent role in the
construction is played by the notion of a consistent family of extension
operators, which expresses in an abstract framework a sufficient condition for
deriving a geometric decomposition of a finite element space leading to a local
basis.
","[{""version"":""v1"",""created"":""Sat, 7 Jun 2008 02:23:46 GMT""}]","2014-01-29"
"0806.1256","Marta Gonzalez","M.C. Gonzalez, C.A. Hidalgo, and A.-L. Barabasi","Understanding individual human mobility patterns","Supporting Webpage:
  http://www.nd.edu/~mgonza16/Marta'sHomepage_files/nature2008/research.html","Nature 453, 479-482 (2008)","10.1038/nature06958",,"physics.soc-ph cond-mat.stat-mech cs.CY physics.bio-ph","http://arxiv.org/licenses/nonexclusive-distrib/1.0/","  Despite their importance for urban planning, traffic forecasting, and the
spread of biological and mobile viruses, our understanding of the basic laws
governing human motion remains limited thanks to the lack of tools to monitor
the time resolved location of individuals. Here we study the trajectory of
100,000 anonymized mobile phone users whose position is tracked for a six month
period. We find that in contrast with the random trajectories predicted by the
prevailing Levy flight and random walk models, human trajectories show a high
degree of temporal and spatial regularity, each individual being characterized
by a time independent characteristic length scale and a significant probability
to return to a few highly frequented locations. After correcting for
differences in travel distances and the inherent anisotropy of each trajectory,
the individual travel patterns collapse into a single spatial probability
distribution, indicating that despite the diversity of their travel history,
humans follow simple reproducible patterns. This inherent similarity in travel
patterns could impact all phenomena driven by human mobility, from epidemic
prevention to emergency response, urban planning and agent based modeling.
","[{""version"":""v1"",""created"":""Sat, 7 Jun 2008 02:30:28 GMT""}]","2009-11-13"
"0806.1257","Avatar Tulsi","Avatar Tulsi","General framework for quantum search algorithms","revised version",,"10.1103/PhysRevA.86.042331",,"quant-ph","http://arxiv.org/licenses/nonexclusive-distrib/1.0/","  Grover's quantum search algorithm drives a quantum computer from a prepared
initial state to a desired final state by using selective transformations of
these states. Here, we analyze a framework when one of the selective
trasformations is replaced by a more general unitary transformation. Our
framework encapsulates several previous generalizations of the Grover's
algorithm. We show that the general quantum search algorithm can be improved by
controlling the transformations through an ancilla qubit. As a special case of
this improvement, we get a faster quantum algorithm for the two-dimensional
spatial search.
","[{""version"":""v1"",""created"":""Sat, 7 Jun 2008 03:41:24 GMT""},{""version"":""v2"",""created"":""Wed, 3 Jun 2009 13:48:24 GMT""},{""version"":""v3"",""created"":""Mon, 6 Jul 2009 14:13:56 GMT""}]","2013-05-30"
"0806.1258","Zhongzhi Zhang","Lichao Chen, Francesc Comellas, and Zhongzhi Zhang","Self-similar planar graphs as models for complex networks","10 pages, submitted to 19th International Workshop on Combinatorial
  Algorithms (IWOCA 2008)",,,,"physics.soc-ph cond-mat.stat-mech","http://arxiv.org/licenses/nonexclusive-distrib/1.0/","  In this paper we introduce a family of planar, modular and self-similar
graphs which have small-world and scale-free properties. The main parameters of
this family are comparable to those of networks associated to complex systems,
and therefore the graphs are of interest as mathematical models for these
systems. As the clustering coefficient of the graphs is zero, this family is an
explicit construction that does not match the usual characterization of
hierarchical modular networks, namely that vertices have clustering values
inversely proportional to their degrees.
","[{""version"":""v1"",""created"":""Sat, 7 Jun 2008 04:02:46 GMT""}]","2008-06-10"
"0806.1259","Andrey Sukhanovsky","Vladimir Batalov, Andrey Sukhanovsky and Peter Frick","Laboratory study of differential rotation in a convective rotating layer",,,,,"physics.flu-dyn physics.ao-ph","http://arxiv.org/licenses/nonexclusive-distrib/1.0/","  The evolution of a large-scale azimuthal velocity field in a rotating
cylindrical layer of fluid with meridional convective circulation was studied
experimentally. Two cases were considered: direct circulation provided by a rim
heater at the periphery and indirect circulation provided by a central heater.
The detailed 3D structure of the mean large-scale velocity field is
reconstructed using the PIV technique. Due to the action of the Coriolis force
the meridional flow results in differential rotation. Differential rotation is
characterized by the mean values of radial and vertical gradients of azimuthal
velocity. Strong negative mean radial gradient which grows with the Grasshoff
number is provided by direct circulation. In the case of indirect circulation a
pronounced negative gradient arises at moderate Grashoff number. The behavior
of the mean vertical gradient is quite different: a positive vertical gradient
grows logarithmically with Grasshoff number under direct circulation, whereas a
weak negative gradient characterizes the indirect circulation. This difference
follows from the structure of the flow -- the direct circulation provides a
large cyclonic area localized above the anticyclonic flow, while indirect
circulation leads to a strong separation of these two areas in the radial
direction (the central part is occupied by the cyclonic flow and the periphery
by the anticyclonic flow). Meridional circulation leads to substantial
variation of the integral angular momentum. Direct circulation results in the
growth of the integral angular momentum and indirect circulation causes it to
decrease. At the same heating power, the increase of angular momentum at direct
circulation is much stronger than its decrease at indirect circulation.
","[{""version"":""v1"",""created"":""Sat, 7 Jun 2008 04:27:04 GMT""}]","2008-06-10"
"0806.1260","Jun Kataoka Dr.","J.Kataoka, L.Stawarz, D.E.Harris, A.Siemiginowska, M.Ostrowski,
  M.R.Swain, M.J.Hardcastle, J.L.Goodger, K.Iwasawa, P.G.Edwards","Chandra Reveals Twin X-ray Jets in the Powerful FR-II Radio Galaxy 3C353","17 pages, 12 figures, accepted for publication in ApJ. Full
  resolution paper is available from
  http://www.hp.phys.titech.ac.jp/kataoka/paper/3C353_accepted.pdf",,"10.1086/591024",,"astro-ph","http://arxiv.org/licenses/nonexclusive-distrib/1.0/","  We report X-ray imaging of the powerful FR-II radio galaxy 3C353 using the
Chandra X-ray Observatory. 3C353's two 4""-wide and 2'-long jets allow us to
study in detail the internal structure of the large-scale relativistic outflows
at both radio and X-ray photon energies with the sub-arcsecond spatial
resolution. In a 90 ks Chandra observation, we have detected X-ray emission
from most radio structures in 3C353, including the nucleus, the jet and the
counterjet, the terminal jet regions (hotspots), and one radio lobe. We show
that the detection of the X-ray emission associated with the radio knots and
counterknots puts several crucial constraints on the X-ray emission mechanisms
in powerful large-scale jets of quasars and FR-II sources. In particular, we
show that this detection is inconsistent with the inverse-Compton model
proposed in the literature, and instead implies a synchrotron origin of the
X-ray jet photons. We also find that the width of the X-ray counterjet is
possibly narrower than that measured in radio bands, that the radio-to-X-ray
flux ratio decreases systematically downstream along the jets, and that there
are substantial (kpc-scale) offsets between the positions of the X-ray and
radio intensity maxima within each knot, whose magnitudes increase away from
the nucleus. We discuss all these findings in the wider context of the physics
of extragalactic jets, proposing some particular though not definitive
solutions or interpretations for each problem.
","[{""version"":""v1"",""created"":""Sat, 7 Jun 2008 15:35:56 GMT""}]","2009-11-13"
"0806.1261","Madeleine Jotz","Madeleine Jotz and Tudor Ratiu","Dirac structures, nonholonomic systems and reduction","39 pages",,,,"math.DG","http://arxiv.org/licenses/nonexclusive-distrib/1.0/","  The reduction of nonholonomic systems is formulated in terms of Dirac
reduction. An optimal reduction method for a class of nonholonomic systems is
formulated. Several examples are studied in detail.
","[{""version"":""v1"",""created"":""Sat, 7 Jun 2008 05:15:42 GMT""},{""version"":""v2"",""created"":""Tue, 9 Sep 2008 17:29:49 GMT""},{""version"":""v3"",""created"":""Sun, 8 May 2011 12:14:50 GMT""},{""version"":""v4"",""created"":""Fri, 14 Oct 2011 07:33:41 GMT""}]","2011-10-17"
"0806.1262","Sunil Kumar Mishra","Sunil Kumar Mishra and V. Subrahmanyam","Size-dependent magnetization fluctuations in NiO nanoparticles","19 pages, 8 figures, Accepted for publication in Int. J. Mod. Phys. B","Int. J. Mod. Phys. B 25 (2011) 2507-2524","10.1142/S0217979211100035",,"cond-mat.mes-hall cond-mat.mtrl-sci","http://arxiv.org/licenses/nonexclusive-distrib/1.0/","  The finite size and surface roughness effects on the magnetization of NiO
nanoparticles is investigated. A large magnetic moment arises for an
antiferromagnetic nanoparticle due to these effects. The magnetic moment
without the surface roughness has a non-monotonic and oscillatory dependence on
$R$, the size of the particles, with the amplitude of the fluctuations varying
linearly with $R$. The geometry of the particle also matters a lot in the
calculation of the net magnetic moment. An oblate spheroid shape particle shows
an increase in net magnetic moment by increasing oblateness of the particle.
However, the magnetic moment values thus calculated are very small compared to
the experimental values for various sizes, indicating that the bulk
antiferromagnetic structure may not hold near the surface. We incorporate the
surface roughness in two different ways; an ordered surface with surface spins
inside a surface roughness shell aligned due to an internal field, and a
disordered surface with randomly oriented spins inside surface roughness shell.
Taking a variational approach we find that the core interaction strength is
modified for nontrivial values of $\Delta$ which is a signature of
multi-sublattice ordering for nanoparticles. The surface roughness scale
$\Delta $ is also showing size dependent fluctuations, with an envelope decay
$\Delta\sim R^{-1/5}$. The net magnetic moment values calculated using
spheroidal shape and ordered surface are close to the experimental values for
different sizes.
","[{""version"":""v1"",""created"":""Sat, 7 Jun 2008 06:06:07 GMT""},{""version"":""v2"",""created"":""Thu, 24 Jul 2008 06:25:12 GMT""},{""version"":""v3"",""created"":""Fri, 15 May 2009 07:46:21 GMT""},{""version"":""v4"",""created"":""Wed, 14 Jul 2010 13:31:49 GMT""}]","2011-07-25"
"0806.1263","Carl Graham","Carl Graham (CMAP)","Semigroup inequalities, stochastic domination, Hardy's inequality, and
  strong ergodicity","There is a mathematical error in the first version of this paper. A
  new corrected version will be posted when the error is fixed, possibly with a
  modified title",,,,"math.PR","http://arxiv.org/licenses/nonexclusive-distrib/1.0/","  There is a mathematical error in the first version of this paper. A new
corrected version will be posted when the error is fixed, possibly with a
modified title.
","[{""version"":""v1"",""created"":""Sat, 7 Jun 2008 06:19:34 GMT""},{""version"":""v2"",""created"":""Wed, 7 Jan 2009 12:49:23 GMT""}]","2009-01-07"
"0806.1264","Nicolas Vuillerme","Nicolas Vuillerme (TIMC), Olivier Chenu (TIMC), Nicolas Pinsault
  (TIMC), Anthony Fleury (TIMC), Jacques Demongeot (TIMC), Yohan Payan (TIMC)","Can a Plantar Pressure-Based Tongue-Placed Electrotactile Biofeedback
  Improve Postural Control Under Altered Vestibular and Neck Proprioceptive
  Conditions?",,"Neuroscience / Neurosciences (2008)","10.1016/j.neuroscience.2008.05.018",,"q-bio.NC","http://arxiv.org/licenses/nonexclusive-distrib/1.0/","  We investigated the effects of a plantar pressure-based tongue-placed
electrotactile biofeedback on postural control during quiet standing under
normal and altered vestibular and neck proprioceptive conditions. To achieve
this goal, fourteen young healthy adults were asked to stand upright as
immobile as possible with their eyes closed in two Neutral and Extended head
postures and two conditions of No-biofeedback and Biofeedback. The underlying
principle of the biofeedback consisted of providing supplementary information
related to foot sole pressure distribution through a wireless embedded
tongue-placed tactile output device. Centre of foot pressure (CoP)
displacements were recorded using a plantar pressure data acquisition system.
Results showed that (1) the Extended head posture yielded increased CoP
displacements relative to the Neutral head posture in the No-biofeedback
condition, with a greater effect along the anteroposterior than mediolateral
axis, whereas (2) no significant difference between the two Neutral and
Extended head postures was observed in the Biofeedback condition. The present
findings suggested that the availability of the plantar pressure-based
tongue-placed electrotactile biofeedback allowed the subjects to suppress the
destabilizing effect induced by the disruption of vestibular and neck
proprioceptive inputs associated with the head extended posture. These results
are discussed according to the sensory re-weighting hypothesis, whereby the
central nervous system would dynamically and selectively adjust the relative
contributions of sensory inputs (i.e., the sensory weights) to maintain upright
stance depending on the sensory contexts and the neuromuscular constraints
acting on the subject.
","[{""version"":""v1"",""created"":""Sat, 7 Jun 2008 06:20:40 GMT""}]","2008-12-18"
"0806.1266","Ahmad El Soufi","Ahmad El Soufi (LMPT), Mustapha Jazar","Pseudo-radial solutions of semi-linear elliptic equations on symmetric
  domains",,"Differential and integral equations 21, 7-8 (2008) 601 -- 622",,,"math.AP","http://arxiv.org/licenses/nonexclusive-distrib/1.0/","  In this paper we investigate existence and characterization of non-radial
pseudo-radial (or separable) solutions of some semi-linear elliptic equations
on symmetric 2-dimensional domains. The problem reduces to the phase plane
analysis of a dynamical system. In particular, we give a full description of
the set of pseudo-radial solutions of equations of the form $\Delta u = \pm
a^2(|x|) u|u|^{q-1}$, with $q>0$, $q\neq 1$. We also study such equations over
spherical or hyperbolic symmetric domains.
","[{""version"":""v1"",""created"":""Sat, 7 Jun 2008 06:23:17 GMT""}]","2008-12-18"
"0806.1267","Francois Bonneton","Fran\c{c}ois Bonneton (CGMC), Dominique Zelus (LBMC), Thomas Iwema
  (CGMC), Marc Robinson-Rechavi (LBMC), Vincent Laudet (LBMC)","Rapid divergence of the ecdysone receptor in Diptera and Lepidoptera
  suggests coevolution between ECR and USP-RXR",,"Molecular Biology and Evolution 4, 20 (2003) 541-553",,,"q-bio.PE","http://arxiv.org/licenses/nonexclusive-distrib/1.0/","  Ecdysteroid hormones are major regulators in reproduction and development of
insects, including larval molts and metamorphosis. The functional ecdysone
receptor is a heterodimer of ECR (NR1H1) and USP-RXR (NR2B4), which is the
orthologue of vertebrate retinoid X receptors (RXR alpha, beta, gamma). Both
proteins belong to the superfamily of nuclear hormone receptors,
ligand-dependent transcription factors that share two conserved domains: the
DNA-binding domain (DBD) and the ligand-binding domain (LBD). In order to gain
further insight into the evolution of metamorphosis and gene regulation by
ecdysone in arthropods, we performed a phylogenetic analysis of both partners
of the heterodimer ECR/USP-RXR. Overall, 38 USP-RXR and 19 ECR protein
sequences, from 33 species, have been used for this analysis. Interestingly,
sequence alignments and structural comparisons reveal high divergence rates,
for both ECR and USP-RXR, specifically among Diptera and Lepidoptera. The most
impressive differences affect the ligand-binding domain of USP-RXR. In
addition, ECR sequences show variability in other domains, namely the
DNA-binding and the carboxy-terminal F domains. Our data provide the first
evidence that ECR and USP-RXR may have coevolved during holometabolous insect
diversification, leading to a functional divergence of the ecdysone receptor.
These results have general implications on fundamental aspects of insect
development, evolution of nuclear receptors, and the design of specific
insecticides.
","[{""version"":""v1"",""created"":""Sat, 7 Jun 2008 06:24:12 GMT""}]","2008-12-18"
"0806.1268","Akinori Nishino","Akinori Nishino and Tetsuo Deguchi","An algebraic derivation of the eigenspaces associated with an Ising-like
  spectrum of the superintegrable chiral Potts model","29 pages","J. Stat. Phys. 133 (2008) 587-615","10.1007/s10955-008-9624-x",,"nlin.SI cond-mat.stat-mech","http://arxiv.org/licenses/nonexclusive-distrib/1.0/","  In terms of the $\mathfrak{sl}_{2}$ loop algebra and the algebraic
Bethe-ansatz method, we derive the invariant subspace associated with a given
Ising-like spectrum consisting of $2^{r}$ eigenvalues of the
diagonal-to-diagonal transfer matrix of the superintegrable chiral Potts (SCP)
model with arbitrary inhomogeneous parameters. We show that every regular Bethe
eigenstate of the $\tau_2$-model leads to an Ising-like spectrum and is an
eigenvector of the SCP transfer matrix which is given by the product of two
diagonal-to-diagonal transfer matrices with a constraint on the spectral
parameters. We also show in a sector that the $\tau_2$-model commutes with the
$\mathfrak{sl}_{2}$ loop algebra, $L(\mathfrak{sl}_{2})$, and every regular
Bethe state of the $\tau_2$-model is of highest weight. Thus, from physical
assumptions such as the completeness of the Bethe ansatz, it follows in the
sector that every regular Bethe state of the $\tau_2$-model generates an
$L(\mathfrak{sl}_{2})$-degenerate eigenspace and it gives the invariant
subspace, i.e. the direct sum of the eigenspaces associated with the Ising-like
spectrum.
","[{""version"":""v1"",""created"":""Sat, 7 Jun 2008 06:59:52 GMT""},{""version"":""v2"",""created"":""Mon, 25 May 2009 07:05:16 GMT""}]","2009-11-13"
"0806.1270","Pantelis Damianou","M. A. Agrotis, P. A. Damianou, G. Marmo","A symplectic realization of the Volterra lattice","8 pages","J.Phys.A38:6327-6334,2005","10.1088/0305-4470/38/28/005",,"math-ph math.DS math.MP","http://arxiv.org/licenses/nonexclusive-distrib/1.0/","  We examine the multiple Hamiltonian structure and construct a symplectic
realization of the Volterra model. We rediscover the hierarchy of invariants,
Poisson brackets and master symmetries via the use of a recursion operator. The
rational Volterra bracket is obtained using a negative recursion operator.
","[{""version"":""v1"",""created"":""Sat, 7 Jun 2008 07:23:25 GMT""}]","2008-11-26"
