"0806.1208","Keith Olive","Keith A. Olive","Colliders and Cosmology","Expanded version of arXiv:0709.3303 [hep-ph], to be published in
  ""Supersymmetry on the Eve of the LHC"" a special volume of European Physical
  Journal C, Particles and Fields (EPJC) in memory of Julius Wess. 25 pages, 47
  figures","Eur.Phys.J.C59:269-295,2009","10.1140/epjc/s10052-008-0738-8","UMN-TH-2647/08, FTPI-MINN-08/16","hep-ph","http://arxiv.org/licenses/nonexclusive-distrib/1.0/","  Dark matter in variations of constrained minimal supersymmetric standard
models will be discussed. Particular attention will be given to the comparison
between accelerator and direct detection constraints.
","[{""version"":""v1"",""created"":""Fri, 6 Jun 2008 17:14:31 GMT""}]","2009-02-18"
"0806.1209","Nan Lin Wang","G. F. Chen, Z. Li, G. Li, W. Z. Hu, J. Dong, X. D. Zhang, P. Zheng, N.
  L. Wang, J. L. Luo","Superconductivity in hole-doped (Sr$_{1-x}$K$_x$)Fe$_2$As$_2$","3 pages, 3 figures","Chin. Phys. Lett. 25, 3403 (2008)",,,"cond-mat.supr-con","http://arxiv.org/licenses/nonexclusive-distrib/1.0/","  A series of layered (Sr$_{1-x}$K$_x$)Fe$_2$As$_2$ compounds with nominal x=0
to 0.40 are synthesized by solid state reaction method. Similar to other parent
compounds of iron-based pnictide superconductors, the pure SrFe$_2$As$_2$ shows
a strong resistivity anomaly near 210 K, which was ascribed to the
spin-density-wave instability. The anomaly temperature is much higher than
those observed in LaOFeAs and BaFe$_2$As$_2$, the two prototype parent
compounds with ZrCuSiAs- and ThCr$_2$Si$_2$-type structures. K-doping strongly
suppresses this anomaly and induces superconductivity. Like in the case of
K-doped BaFe$_2$As$_2$, sharp superconducting transitions at T$_c\sim$38 K was
observed. We performed the Hall coefficient measurement, and confirmed that the
dominant carriers are hole-type. The carrier density is enhanced by a factor of
3 in comparison to F-doped LaOFeAs superconductor.
","[{""version"":""v1"",""created"":""Fri, 6 Jun 2008 17:38:10 GMT""}]","2008-08-05"
"0806.1210","Francis Oger","Francis Oger","Paperfolding sequences, paperfolding curves and local isomorphism","39 pages containing 9 figures; to be read in pdf; minor changes to
  improve the readability, especially concerning the figures",,,,"math.CO","http://arxiv.org/licenses/nonexclusive-distrib/1.0/","  For each integer n, an n-folding curve is obtained by folding n times a strip
of paper in two, possibly up or down, and unfolding it with right angles.
Generalizing the usual notion of infinite folding curve, we define complete
folding curves as the curves without endpoint which are unions of increasing
sequences of n-folding curves for n integer. We prove that there exists a
standard way to extend any complete folding curve into a covering of the plane
by disjoint such curves, which satisfies the local isomorphism property
introduced to investigate aperiodic tiling systems. This covering contains at
most six curves.
","[{""version"":""v1"",""created"":""Fri, 6 Jun 2008 18:07:36 GMT""},{""version"":""v2"",""created"":""Fri, 20 Jun 2008 19:02:49 GMT""},{""version"":""v3"",""created"":""Tue, 23 Feb 2010 11:50:59 GMT""},{""version"":""v4"",""created"":""Tue, 29 Jun 2010 17:08:00 GMT""}]","2010-06-30"
"0806.1211","Florian Marquardt","Clemens Neuenhahn, Florian Marquardt","Universal dephasing in a chiral 1D interacting fermion system","5 pages, 3 figures; minor changes, version as published;","Physical Review Letters 102, 046806 (2009)","10.1103/PhysRevLett.102.046806",,"cond-mat.mes-hall","http://arxiv.org/licenses/nonexclusive-distrib/1.0/","  We consider dephasing by interactions in a one-dimensional chiral fermion
system (e.g. a Quantum Hall edge state). For finite-range interactions, we
calculate the spatial decay of the Green's function at fixed energy, which sets
the contrast in a Mach-Zehnder interferometer. Using a physically transparent
semiclassical ansatz, we find a power-law decay of the coherence at high
energies and zero temperature (T=0), with a universal asymptotic exponent of 1,
independent of the interaction strength. We obtain the dephasing rate at T>0
and the fluctuation spectrum acting on an electron.
","[{""version"":""v1"",""created"":""Fri, 6 Jun 2008 17:45:31 GMT""},{""version"":""v2"",""created"":""Tue, 17 Mar 2009 11:20:36 GMT""}]","2009-03-17"
"0806.1212","Gabriella B\""ohm","Gabriella B\""ohm and Claudia Menini","Pre-torsors and Galois comodules over mixed distributive laws","34 pages LaTeX file. v2: a few typos corrected","Appl. Categ. Structures 19 (2011), no. 3, 597-632","10.1007/s10485-008-9185-9",,"math.RA math.QA","http://arxiv.org/licenses/nonexclusive-distrib/1.0/","  We study comodule functors for comonads arising from mixed distributive laws.
Their Galois property is reformulated in terms of a (so-called) regular arrow
in Street's bicategory of comonads. Between categories possessing equalizers,
we introduce the notion of a regular adjunction. An equivalence is proven
between the category of pre-torsors over two regular adjunctions $(N_A,R_A)$
and $(N_B,R_B)$ on one hand, and the category of regular comonad arrows
$(R_A,\xi)$ from some equalizer preserving comonad ${\mathbb C}$ to $N_BR_B$ on
the other. This generalizes a known relationship between pre-torsors over equal
commutative rings and Galois objects of coalgebras.Developing a bi-Galois
theory of comonads, we show that a pre-torsor over regular adjunctions
determines also a second (equalizer preserving) comonad ${\mathbb D}$ and a
co-regular comonad arrow from ${\mathbb D}$ to $N_A R_A$, such that the
comodule categories of ${\mathbb C}$ and ${\mathbb D}$ are equivalent.
","[{""version"":""v1"",""created"":""Fri, 6 Jun 2008 17:49:07 GMT""},{""version"":""v2"",""created"":""Mon, 15 Dec 2008 14:43:54 GMT""}]","2012-01-27"
"0806.1213","Hossein Movasati","Hossein Movasati, Stefan Reiter","Painlev\'e VI equations with algebraic solutions and family of curves","15 pages",,,,"math.AG math.CA","http://arxiv.org/licenses/nonexclusive-distrib/1.0/","  In families of Painlev\'e VI differential equations having common algebraic
solutions we classify all the members which come from geometry, i.e. the
corresponding linear differential equations which are Picard-Fuchs associated
to families of algebraic varieties. In our case, we have one family with zero
dimensional fibers and all others are families of curves. We use the
classification of families of elliptic curves with four singular fibers done by
Herfurtner in 1992 and generalize the results of Doran in 2001 and Ben Hamed
and Gavrilov in 2005.
","[{""version"":""v1"",""created"":""Fri, 6 Jun 2008 17:55:49 GMT""}]","2008-06-09"
"0806.1214","Gowri Navada K","M.G. Nadkarni and K. Gowri Navada","On the number of extreme measures with fixed marginals","11 pages",,,,"math.GM math.CO","http://arxiv.org/licenses/nonexclusive-distrib/1.0/","  In this paper we give an improved upper bound, as compared to the one given
in [3] for the number of extreme points of the convex set of all G-invariant
probability measures on X*Y with given marginals of full support.
","[{""version"":""v1"",""created"":""Fri, 6 Jun 2008 18:11:44 GMT""},{""version"":""v2"",""created"":""Tue, 16 Mar 2010 07:40:33 GMT""}]","2010-03-17"
"0806.1215","Lav Varshney","Lav R. Varshney","Performance of LDPC Codes Under Faulty Iterative Decoding","Revised in May 2010 in response to reviewer comments",,,,"cs.IT math.IT","http://arxiv.org/licenses/nonexclusive-distrib/1.0/","  Departing from traditional communication theory where decoding algorithms are
assumed to perform without error, a system where noise perturbs both
computational devices and communication channels is considered here. This paper
studies limits in processing noisy signals with noisy circuits by investigating
the effect of noise on standard iterative decoders for low-density parity-check
codes. Concentration of decoding performance around its average is shown to
hold when noise is introduced into message-passing and local computation.
Density evolution equations for simple faulty iterative decoders are derived.
In one model, computing nonlinear estimation thresholds shows that performance
degrades smoothly as decoder noise increases, but arbitrarily small probability
of error is not achievable. Probability of error may be driven to zero in
another system model; the decoding threshold again decreases smoothly with
decoder noise. As an application of the methods developed, an achievability
result for reliable memory systems constructed from unreliable components is
provided.
","[{""version"":""v1"",""created"":""Fri, 6 Jun 2008 18:32:08 GMT""},{""version"":""v2"",""created"":""Sun, 23 Aug 2009 15:36:42 GMT""},{""version"":""v3"",""created"":""Fri, 28 May 2010 18:13:54 GMT""}]","2010-05-31"
"0806.1216","Malcolm Mac Gregor","Malcolm H. Mac Gregor","The experimental lifetime alpha-quantization of the 36 metastable
  elementary particle lifetimes","48 pages, 19 figures, 8 tables",,,,"physics.gen-ph","http://arxiv.org/licenses/nonexclusive-distrib/1.0/","  The fine structure constant alpha ~ 1/137 appears as a lifetime scaling
factor for the 36 metastable (t > 10^-21 sec) elementary particles -- 34
hadrons and the mu and tau leptons. The hadrons divide into 24 long-lived
unpaired-quark (UQ) and 3 short-lived paired-quark (PQ) ground states (the
lowest-mass states for each u, d, s, c, b quark flavor combination), plus 7
excited states. The lifetime ratios include six factors of alpha, six factors
of alpha^4, and one factor of alpha^3 (the leptons). This experimental lifetime
alpha-quantization has seven salient features, where (1)-(3) show powers of
alpha and (4)-(7) show smaller scaling effects): (1) A low-mass (m < 1 Gev)
particle alpha-chain of linked alpha and alpha^4 lifetime ratios that extends
from the neutron to the eta' meson and spans 11 powers of alpha. (2) Four
unpaired-quark lifetime clusters (UQ)(pi, s, b, c) that contain 23 ground
states which are sorted by the quark priorities c > b > s. (3) Four
paired-quark clusters (PQ)(pi, s, b, c), and four alpha^4 pairing gaps between
the fast PQ decays (which conserve flavor) and the slow UQ decays (which do
not). (4) IR integer-ratio scaling inside UQ clusters, with integer lifetime
ratios of 2, 3, or 4. (5) RP random perturbations that produce ~10% deviations
from exact IR scaling. (6) Hadronic BC-scaling, which reflects the empirical BC
= t(b)/t(c) ~ 3 lifetime ratios that occur between unpaired b-quark states and
corresponding unpaired c-quark states. (7) Leptonic BC-scaling, shown in the
lifetime equation (t(tau) x BC) / t(mu) = alpha^3, which is accurate to 2% for
BC = 3.0, and which utilizes an alpha^3 scaling factor. The UQ and PQ lifetime
clusters clearly reflect their u, d, s, c, b quark substructures
","[{""version"":""v1"",""created"":""Fri, 6 Jun 2008 18:32:43 GMT""}]","2008-06-09"
"0806.1217","Alexander D. Hernandez","Alexander D. Hern\'andez, Arturo L\'opez","Variational approach to vortex penetration and vortex interaction","11 pages, 8 figures","Physical Review B 77, 144506 (2008)","10.1103/PhysRevB.77.144506",,"cond-mat.supr-con","http://arxiv.org/licenses/nonexclusive-distrib/1.0/","  A variational calculation for vortex penetration is presented. Variational
trial functions for the Meissner state are combined with variational functions
for a vortex near the surface. The latter is based on Clem's trial solutions
for a vortex in bulk, which were adapted to include surface effects through
consideration of an image vortex. Three variational parameters are considered,
corresponding to the effective coherence length of the vortex, the effective
penetration length for the Meissner currents, and the value of the order
parameter at the surface. The results show that the last two variational
parameters are independent of vortex position. Explicit calculations are
presented for several $\kappa$ values. The energy barrier for vortex
penetration is shown to be in good agreement with full numerical calculations
of the Ginzburg--Landau equations. We consider the variation of the magnetic
flux carried by a vortex as it gets inside the superconductor and agreement
with known experimental and theoretical results is obtained. The model was
extended to calculate the force between two vortices, and the results show that
the force goes to zero as the pair comes close to the surface. This result can
be of interest for the study of the melting of the vortex lattice and for
vortices confined in mesoscopic superconductors. The variational approach can
be very helpful for intermediate $\kappa$ values when numerical calculations
become computationally demanding because it provides manageable expressions for
all physically relevant quantities.
","[{""version"":""v1"",""created"":""Fri, 6 Jun 2008 19:18:47 GMT""}]","2008-06-09"
"0806.1218","Juan Maldacena","Ofer Aharony, Oren Bergman, Daniel Louis Jafferis and Juan Maldacena","N=6 superconformal Chern-Simons-matter theories, M2-branes and their
  gravity duals","41 pages, 4 figures. v3: minor corrections, added references. v4:
  added reference, minor changes, JHEP version","JHEP 0810:091,2008","10.1088/1126-6708/2008/10/091","WIS/12/08-JUN-DPP","hep-th","http://arxiv.org/licenses/nonexclusive-distrib/1.0/","  We construct three dimensional Chern-Simons-matter theories with gauge groups
U(N)xU(N) and SU(N)xSU(N) which have explicit N=6 superconformal symmetry.
Using brane constructions we argue that the U(N)xU(N) theory at level k
describes the low energy limit of N M2-branes probing a C^4/Z_k singularity. At
large N the theory is then dual to M theory on AdS_4xS^7/Z_k. The theory also
has a 't Hooft limit (of large N with a fixed ratio N/k) which is dual to type
IIA string theory on AdS_4xCP^3. For k=1 the theory is conjectured to describe
N M2-branes in flat space, although our construction realizes explicitly only
six of the eight supersymmetries. We give some evidence for this conjecture,
which is similar to the evidence for mirror symmetry in d=3 gauge theories.
When the gauge group is SU(2)xSU(2) our theory has extra symmetries and becomes
identical to the Bagger-Lambert theory.
","[{""version"":""v1"",""created"":""Fri, 6 Jun 2008 19:43:48 GMT""},{""version"":""v2"",""created"":""Sun, 8 Jun 2008 18:52:12 GMT""},{""version"":""v3"",""created"":""Tue, 22 Jul 2008 12:11:00 GMT""},{""version"":""v4"",""created"":""Thu, 23 Oct 2008 12:37:24 GMT""}]","2009-07-09"
"0806.1219","Federico Rom\'a","F. Roma, D. Dominguez","Nonequilibrium critical dynamics of the three-dimensional gauge glass","7 pages, 4 figures. Manuscript accpeted for publication in PRB",,"10.1103/PhysRevB.78.184431",,"cond-mat.stat-mech cond-mat.dis-nn","http://arxiv.org/licenses/nonexclusive-distrib/1.0/","  We study the non-equilibrium aging behavior of the gauge glass model in three
dimensions at the critical temperature. We perform Monte Carlo simulations with
a Metropolis update, and correlation and response functions are calculated for
different waiting times. We obtain a multiplicative aging scaling of the
correlation and response functions, calculating the aging exponent $b$ and the
nonequilibrium autocorrelation decay exponent $\lambda_c/z_c$. We also analyze
the fluctuation-dissipation relationship at the critical temperature, obtaining
the critical fluctuation-dissipation ratio $X_\infty$. By comparing our results
with the aging scaling reported previously for a model of interacting flux
lines in the vortex glass regime, we found that the exponents for both models
are very different.
","[{""version"":""v1"",""created"":""Fri, 6 Jun 2008 19:54:06 GMT""},{""version"":""v2"",""created"":""Wed, 5 Nov 2008 14:20:25 GMT""}]","2009-11-13"
"0806.1220","Xiaoling Cui","Xiaoling Cui, Yupeng Wang and Fei Zhou","Quantum-Fluctuation-Driven Coherent Spin Dynamics in Small Condensates","4 pages, 3 figures","Phy. Rev. A 78,050701(R) (2008)","10.1103/PhysRevA.78.050701",,"cond-mat.other","http://creativecommons.org/licenses/by/3.0/","  We have studied quantum spin dynamics of small condensates of cold sodium
atoms. For a condensate initially prepared in a mean field ground state, we
show that coherent spin dynamics are {\em purely} driven by quantum
fluctuations of collective spin coordinates and can be tuned by quadratic
Zeeman coupling and magnetization. These dynamics in small condensates can be
probed in a high-finesse optical cavity where temporal behaviors of excitation
spectra of a coupled condensate-photon system reveal the time evolution of
populations of atoms at different hyperfine spin states.
","[{""version"":""v1"",""created"":""Fri, 6 Jun 2008 19:59:48 GMT""}]","2009-11-13"
"0806.1221","Alexandre Roman-Lopes","A. Roman-Lopes, Z. Abraham, R. Ortiz, A. Rodrigues-Ardila","GEMINI near-infrared spectroscopic observations of young massive stars
  embedded in molecular clouds","This is the version that will be published by the Montly Notices of
  the Royal Astronomical Society",,"10.1111/j.1365-2966.2008.14319.x",,"astro-ph","http://arxiv.org/licenses/nonexclusive-distrib/1.0/","  K-band spectra of young stellar candidates in four southern hemisphere
clusters have been obtained with the near-infrared spectrograph GNIRS in Gemini
South. The clusters are associated with IRAS sources that have colours
characteristic of ultracompact HII regions. Spectral types were obtained by
comparison of the observed spectra with those of a NIR library; the results
include the spectral classification of nine massive stars and seven objects
confirmed as background late-type stars. Two of the studied sources have K-band
spectra compatible with those characteristic of very hot stars, as inferred
from the presence of Civ, Niii, and Nv emission lines at 2.078 micron, 2.116
micron, and 2.100 micron respectively. One of them, I16177 IRS1, has a K-band
spectrum similar to that of Cyg OB2 7, an O3If* supergiant star. The nebular
K-band spectrum of the associated UC Hii region shows the s-process [Kriii] and
[Seiv] high excitation emission lines, previously identified only in planetary
nebula. One young stellar object (YSO) was found in each cluster, associated
with either the main IRAS source or a nearby resolved MSX component, confirming
the results obtained from previous NIR photometric surveys. The distances to
the stars were derived from their spectral types and previously determined JHK
magnitudes; they agree well with the values obtained from the kinematic method,
except in the case of IRAS15408-5356, for which the spectroscopic distance is
about a factor two smaller than the kinematic value.
","[{""version"":""v1"",""created"":""Fri, 6 Jun 2008 20:01:39 GMT""},{""version"":""v2"",""created"":""Wed, 3 Dec 2008 14:21:41 GMT""}]","2009-11-13"
"0806.1223","Pasquale Blasi","Elena Amato (1) and Pasquale Blasi (1,2) ((1) INAF/Arcetri, (2)
  Fermilab)","A kinetic approach to cosmic ray induced streaming instability at
  supernova shocks","Accepted for publication in MNRAS",,"10.1111/j.1365-2966.2008.14200.x","Fermilab Preprint number: PUB-08-156-A","astro-ph","http://arxiv.org/licenses/nonexclusive-distrib/1.0/","  We show that a purely kinetic approach to the excitation of waves by cosmic
rays in the vicinity of a shock front leads to predict the appearance of a
non-alfv\'enic fastly growing mode which has the same dispersion relation as
that previously found by \cite{bell04} by treating the plasma in the MHD
approximation. The kinetic approach allows us to investigate the dependence of
the dispersion relation of these waves on the microphysics of the current which
compensates the cosmic ray flow. We also show that a resonant and a
non-resonant mode may appear at the same time and one of the two may become
dominant on the other depending on the conditions in the acceleration region.
We discuss the role of the unstable modes for magnetic field amplification and
particle acceleration in supernova remnants at different stages of the remnant
evolution.
","[{""version"":""v1"",""created"":""Fri, 6 Jun 2008 20:04:30 GMT""},{""version"":""v2"",""created"":""Wed, 5 Nov 2008 09:53:05 GMT""}]","2009-11-13"
"0806.1224","Alexander Petersen","Alexander M. Petersen, Woo-Sung Jung, Jae-Suk Yang, H. Eugene Stanley","Quantitative and empirical demonstration of the Matthew effect in a
  study of career longevity","13 pages, 7 figures, 4 Tables; Revisions in response to critique and
  suggestions of referees","Proceedings of the National Academy of Sciences USA 108, 18-23
  (2011)","10.1073/pnas.1016733108",,"physics.pop-ph physics.data-an physics.soc-ph","http://arxiv.org/licenses/nonexclusive-distrib/1.0/","  The Matthew effect refers to the adage written some two-thousand years ago in
the Gospel of St. Matthew: ""For to all those who have, more will be given.""
Even two millennia later, this idiom is used by sociologists to qualitatively
describe the dynamics of individual progress and the interplay between status
and reward. Quantitative studies of professional careers are traditionally
limited by the difficulty in measuring progress and the lack of data on
individual careers. However, in some professions, there are well-defined
metrics that quantify career longevity, success, and prowess, which together
contribute to the overall success rating for an individual employee. Here we
demonstrate testable evidence of the age-old Matthew ""rich get richer"" effect,
wherein the longevity and past success of an individual lead to a cumulative
advantage in further developing his/her career. We develop an exactly solvable
stochastic career progress model that quantitatively incorporates the Matthew
effect, and validate our model predictions for several competitive professions.
We test our model on the careers of 400,000 scientists using data from six
high-impact journals, and further confirm our findings by testing the model on
the careers of more than 20,000 athletes in four sports leagues. Our model
highlights the importance of early career development, showing that many
careers are stunted by the relative disadvantage associated with inexperience.
","[{""version"":""v1"",""created"":""Fri, 6 Jun 2008 20:25:12 GMT""},{""version"":""v2"",""created"":""Thu, 23 Oct 2008 19:35:58 GMT""},{""version"":""v3"",""created"":""Sat, 7 Mar 2009 00:15:30 GMT""},{""version"":""v4"",""created"":""Fri, 6 Nov 2009 19:23:38 GMT""},{""version"":""v5"",""created"":""Wed, 16 Mar 2011 01:08:39 GMT""}]","2011-03-17"
"0806.1225","Jiangyong Jia","Jiangyong Jia and Roy Lacey","Influence of quenched jets on di-hadron correlations","5 pages, four figures (replaced with the published version)","Phys.Rev.C79:011901,2009","10.1103/PhysRevC.79.011901",,"nucl-th hep-ph","http://arxiv.org/licenses/nonexclusive-distrib/1.0/","  A simple jet absorption model is used to study the influence of hadron pairs
produced by quenched jets, on di-hadron angular correlations at intermediate
transverse momentum ($p_T$). We demonstrate that such pairs can dominate both
the yield and the shape of angular correlations, and may account for the
similar properties between the near-side ""ridge"" and the away-side
""double-humped"" structure seen in recent data. These hadron pairs also show
azimuthal anisotropy which is sensitive to the emission angle of hadrons
relative to that of the jet. Measurement of this anisotropy may provide a
constraint for elucidating the production mechanism for near- and away-side
hadron pairs at intermediate $p_T$.
","[{""version"":""v1"",""created"":""Sat, 7 Jun 2008 04:12:55 GMT""},{""version"":""v2"",""created"":""Tue, 10 Jun 2008 20:42:10 GMT""},{""version"":""v3"",""created"":""Mon, 19 Jan 2009 19:37:44 GMT""}]","2009-02-18"
"0806.1226","Rodolfo Barniol Duran","R. Barniol Duran, P. Kumar","Adiabatic expansion, early x-ray data and the central engine in GRBs","8 pages, 2 figures, MNRAS in press. Corrections on sec. 3, but
  conclusion unchanged. Appendices added","MNRAS 395 (2009) 955-961","10.1111/j.1365-2966.2009.14584.x",,"astro-ph","http://arxiv.org/licenses/nonexclusive-distrib/1.0/","  The Swift satellite early x-ray data shows a very steep decay in most of the
Gamma-Ray Bursts light curves. This decay is either produced by the rapidly
declining continuation of the central engine activity or by some left-over
radiation starting right after the central engine shuts off. The latter
scenario consists of the emission from an ""ember"" that cools via adiabatic
expansion and, if the jet angle is larger than the inverse of the source
Lorentz factor, the large angle emission. In this work, we calculate the
temporal and spectral properties of the emission from such a cooling ember,
providing a new treatment for the micro-physics of the adiabatic expansion. We
use the adiabatic invariance of p_{\perp}^2/B (p_{\perp} is the component of
the electrons' momentum normal to the magnetic field, B) to calculate the
electrons' Lorentz factor during the adiabatic expansion; the electron momentum
becomes more and more aligned with the local magnetic field as the expansion
develops. We compare the theoretical expectations of the adiabatic expansion
(and the large angle emission) with the current observations of the early x-ray
data and find that only about 20% of our sample of 107 bursts is potentially
consistent with this model. This leads us to believe that, for most bursts, the
central engine does not turn off completely during the steep decay of the x-ray
light curve; therefore, this phase is produced by the continued rapidly
declining activity of the central engine.
","[{""version"":""v1"",""created"":""Fri, 6 Jun 2008 20:07:33 GMT""},{""version"":""v2"",""created"":""Mon, 2 Mar 2009 19:16:02 GMT""}]","2009-11-17"
