"0806.1227","John M. Yelton","Q.He, et al","First Observation of Exclusive chi_cJ Decays to Two Charged and Two
  Neutral Hadrons","Available through http://www.lns.cornell.edu/public/CLNS/, submitted
  to Phys. Rev. D","Phys.Rev.D78:092004,2008","10.1103/PhysRevD.78.092004","CLNS 07/2007 CLEO 07-12","hep-ex","http://arxiv.org/licenses/nonexclusive-distrib/1.0/","  We study exclusive chi_c0, chi_c1 and chi_c2 decays to four-hadron final
states involving two charged and two neutral mesons: pi^+pi^-pi^0pi^0,
K^+K^-pi^0pi^0, pppi^0pi^0, K^+K^-etapi^0, and K^+-pi^-+K^0pi^0o. The chi_c
states are produced in radiative decays of 3.08 million psi-prime resonance
decays and observed in the CLEO detector. We also measure the largest
substructure contributions to the modes pi^+pi^-pi^0pi^0 and K^+-pi^-+K^0pi^0.
","[{""version"":""v1"",""created"":""Fri, 6 Jun 2008 20:12:04 GMT""}]","2010-04-08"
"0806.1229","Rodrigo D\'iaz Mr.","Rodrigo F. D\'iaz (1), Patricio Rojo (2), Mario Melita (1), Sergio
  Hoyer (2), Dante Minniti (3,4), Pablo J.D. Mauas (1), Mar\'ia Teresa Ru\'iz
  (2) ((1) Instituto de Astronom\'ia y F\'isica del Espacio, Buenos Aires,
  Argentina; (2) Department of Astronomy, Universidad de Chile, Santiago,
  Chile; (3) Department of Astronomy, Pontificia Universidad Cat\'olica,
  Santiago, Chile; (4) Specola Vaticana, Citta del Vaticano, Italy.)","Detection of period variations in extrasolar transiting planet
  OGLE-TR-111b","Corrected central times, minor changes in the analysis of the data,
  and text. Accepted for publication in ApJ Letters","ApJ 682 (2008) L49-L52","10.1086/590907",,"astro-ph","http://arxiv.org/licenses/nonexclusive-distrib/1.0/","  Two consecutive transits of planetary companion OGLE-TR-111b were observed in
the I band. Combining these observations with data from the literature, we find
that the timing of the transits cannot be explained by a constant period, and
that the observed variations cannot be originated by the presence of a
satellite. However, a perturbing planet with the mass of the Earth in an
exterior orbit could explain the observations if the orbit of OGLE-TR-111b is
eccentric. We also show that the eccentricity needed to explain the
observations is not ruled out by the radial velocity data found in the
literature.
","[{""version"":""v1"",""created"":""Fri, 6 Jun 2008 20:38:30 GMT""},{""version"":""v2"",""created"":""Wed, 11 Jun 2008 19:51:25 GMT""},{""version"":""v3"",""created"":""Wed, 18 Jun 2008 23:10:15 GMT""}]","2009-11-13"
"0806.1231","Francisco Assis","F. M. Assis, P. Mateus, Y. Omar","Improving Classical Authentication with Quantum Communication","New improved version, with several clarifications in the text and new
  figures",,,,"cs.IT cs.CR math.IT","http://arxiv.org/licenses/nonexclusive-distrib/1.0/","  We propose a quantum-enhanced protocol to authenticate classical messages,
with improved security with respect to the classical scheme introduced by
Brassard in 1983. In that protocol, the shared key is the seed of a
pseudo-random generator (PRG) and a hash function is used to create the
authentication tag of a public message. We show that a quantum encoding of
secret bits offers more security than the classical XOR function introduced by
Brassard. Furthermore, we establish the relationship between the bias of a PRG
and the amount of information about the key that the attacker can retrieve from
a block of authenticated messages. Finally, we prove that quantum resources can
improve both the secrecy of the key generated by the PRG and the secrecy of the
tag obtained with a hidden hash function.
","[{""version"":""v1"",""created"":""Fri, 6 Jun 2008 20:37:15 GMT""},{""version"":""v2"",""created"":""Thu, 11 Feb 2010 23:43:03 GMT""}]","2010-02-12"
"0806.1232","Mihai Cara","Mihai Cara and Matthew L. Lister","Avoiding spurious breaks in binned luminosity functions","7 pages and 7 figures. Accepted for publication in ApJ",,"10.1086/590902",,"astro-ph","http://arxiv.org/licenses/nonexclusive-distrib/1.0/","  We show that using either the method of Page & Carrera or the well-known
$1/V_a$ method to construct the binned luminosity function (LF) of a flux
limited sample of Active Galactic Nuclei (AGN) can produce an artificial
flattening (or steepening in the case of negative evolution) of the binned LF
for bins intersected by the flux cutoff of the sample. This effect is more
pronounced for samples with steep and strongly evolving parent LFs but is still
present even for non-evolving LFs. As a result of this distortion of the true
LF, fitting a model LF to binned data may lead to errors in the estimation of
the parameters and may even prompt the erroneous use of broken power law
functions. We compute the expected positions of apparent breaks in the binned
LF. We show that these spurious breaks in the binned LFs can be avoided if the
binning is done in the flux--redshift plane instead of the typically used
luminosity--redshift plane. Binning in the flux--redshift plane can be used in
conjunction with the binning in the luminosity--redshift plane to test for real
breaks in the binned LFs and to identify the features that are the result of
binning biases. We illustrate this effect for most typical forms of luminosity
dependence and redshift evolution and show how the proposed method helps
address this problem. We also apply this method to the MOJAVE AGN sample and
show that it eliminates an apparent break in the binned LF.
","[{""version"":""v1"",""created"":""Fri, 6 Jun 2008 21:11:27 GMT""}]","2009-11-13"
"0806.1233","Theodora Leventouri","Th. Leventouri, A. Antonakos, A. Kyriacou, R. Venturelli, E.
  Liarokapis, V. Perdikatsis","Crystal Structure Studies of Human Dental Apatite as a Function of Age","17 pages",,,,"cond-mat.other cond-mat.mtrl-sci","http://arxiv.org/licenses/nonexclusive-distrib/1.0/","  Studies of the average crystal structure properties of human dental apatite
as a function of the tooth-age in the range of 5-87 years are reported. The
crystallinity of the dental hydroxyapatite decreases with the tooth-age. The
a-lattice constant that is associated with the carbonate content in carbonate
apatite decreases with the tooth-age in a systematic way, whereas the c-lattice
constant does not change significantly. Thermogravimetric measurements
demonstrate an increase of the carbonate content with the tooth-age. FTIR
spectroscopy reveals both, B and A-type carbonate substitutions with the B-type
greater than the A-type substitution by a factor up to ~5. An increase of the
carbonate content as a function of the tooth-age can be deduced from the ratio
of the v2 CO3 to the v1 PO4 IR modes.
","[{""version"":""v1"",""created"":""Fri, 6 Jun 2008 20:50:36 GMT""},{""version"":""v2"",""created"":""Thu, 19 Jun 2008 17:34:43 GMT""}]","2008-06-19"
"0806.1234","Mitchell Feigenbaum","Mitchell J. Feigenbaum","The Theory of Relativity - Galileo's Child",,,,,"physics.class-ph physics.ed-ph physics.hist-ph","http://arxiv.org/licenses/nonexclusive-distrib/1.0/","  We determine the Lorentz transformations and the kinematic content and
dynamical framework of special relativity as purely an extension of Galileo's
thoughts. No reference to light is ever required: The theories of relativity
are logically independent of any properties of light. The thoughts of Galileo
are fully realized in a system of Lorentz transformations with a parameter
1/c^2, some undetermined, universal constant of nature; and are realizable in
no other. Isotropy of space plays a deep and pivotal role in all of this, since
here three-dimensional space appears at first blush, and persists until the
conclusion: Relativity can never correctly be fully developed in just one
spatial dimension.
","[{""version"":""v1"",""created"":""Fri, 6 Jun 2008 20:55:01 GMT""}]","2008-06-10"
"0806.1235","Markus A. Luty","Markus A. Luty","Strong Conformal Dynamics at the LHC and on the Lattice","v2: Generalized discussion of lattice measurement of hadron masses,
  references added, minor clarifications v3: references added, minor changes","JHEP 0904:050,2009","10.1088/1126-6708/2009/04/050",,"hep-ph hep-lat","http://arxiv.org/licenses/nonexclusive-distrib/1.0/","  Conformal technicolor is a paradigm for new physics at LHC that may solve the
problems of strong electroweak symmetry breaking for quark masses and precision
electroweak data. We give explicit examples of conformal technicolor theories
based on a QCD-like sector. We suggest a practical method to test the conformal
dynamics of these theories on the lattice.
","[{""version"":""v1"",""created"":""Fri, 6 Jun 2008 21:08:53 GMT""},{""version"":""v2"",""created"":""Tue, 17 Feb 2009 18:48:55 GMT""},{""version"":""v3"",""created"":""Fri, 27 Mar 2009 16:47:57 GMT""}]","2009-04-17"
"0806.1236","Richard Kenyon","Alan Hammond and Richard Kenyon","Monotone loop models and rational resonance","22 pages, 3 figures",,,,"math.PR","http://arxiv.org/licenses/nonexclusive-distrib/1.0/","  Let $T_{n,m}=\mathbb Z_n\times\mathbb Z_m$, and define a random mapping
$\phi\colon T_{n,m}\to T_{n,m}$ by $\phi(x,y)=(x+1,y)$ or $(x,y+1)$
independently over $x$ and $y$ and with equal probability. We study the orbit
structure of such ``quenched random walks'' $\phi$ in the limit $m,n\to\infty$,
and show how it depends sensitively on the ratio $m/n$. For $m/n$ near a
rational $p/q$, we show that there are likely to be on the order of $\sqrt{n}$
cycles, each of length O(n), whereas for $m/n$ far from any rational with small
denominator, there are a bounded number of cycles, and for typical $m/n$ each
cycle has length on the order of $n^{4/3}$.
","[{""version"":""v1"",""created"":""Fri, 6 Jun 2008 21:09:52 GMT""}]","2008-06-10"
"0806.1237","Renato Pessoa","R. Pessoa, M. de Koning and S. A. Vitiello","Influence of Anharmonic Effects on the Zero-point Vacancy Concentration
  in Solid 4He",,,,,"cond-mat.other","http://arxiv.org/licenses/nonexclusive-distrib/1.0/","  We conduct a theoretical study in which we determine the zero-point vacancy
concentration in solid 4He at T=0 K. To this end, we employ the
quantum-classical isomorphism, by which the quantum-mechanical probability
density function of a system composed of bosons at T=0K can be interpreted in
terms of a Boltzmann factor of a classical system at finite temperature. By
using this classical isomorph we apply the methods of classical statistical
mechanics to compute the vacancy formation free energy and the vacancy
concentration in the associated quantum system at T=0. In this context, we
focus specifically on the role of anharmonic effects that are expected to be
non-negligible due to the significant zero-point motion. For this purpose, we
compute the formation free energies using both the harmonic approximation (HA)
as well as reversible-work (RW) method, in which all anharmonic effects are
taken into account. The results suggest that anharmonic effects indeed play a
significant role, lowering the classical formation free energy by ~25% and
increasing the zero-point vacancy concentration by more than an order of
magnitude compared to the HA.
","[{""version"":""v1"",""created"":""Fri, 6 Jun 2008 21:10:55 GMT""}]","2008-06-10"
"0806.1239","Xingbo Zhao","Xingbo Zhao, Ralf Rapp","Charmonium Production at High $p_t$ at RHIC","6 pages, 8 figures, proceeding for 24th Winter Workshop on Nuclear
  Dynamics",,,,"nucl-th","http://arxiv.org/licenses/nonexclusive-distrib/1.0/","  We calculate transverse-momentum ($p_t$) spectra and elliptic flow of
$J/\psi$'s in $Au$-$Au$ and $Cu$-$Cu$ collisions at RHIC. We employ an earlier
constructed 2-component approach for direct and regenerated charmonia which is
fairly consistent with the centrality dependence of inclusive $J/\psi$ yields
at SPS and RHIC. Discrepancies with high-$p_t$ data in $Cu$-$Cu$ collisions are
addressed by implementing effects of a finite formation time and an estimate of
$B$ meson feeddown, which largely resolve the problem. The sensitivity of the
spectra to the Cronin effect and different in-medium dissociation rates is
studied. The predicted elliptic flow in semicentral $Au$-$Au$ collisions is
rather small, $\sim$2-3%.
","[{""version"":""v1"",""created"":""Fri, 6 Jun 2008 21:37:03 GMT""}]","2008-06-10"
"0806.1240","Jui-Yu Chiu","Jui-yu Chiu, Randall Kelley, and Aneesh V. Manohar","Electroweak Corrections using Effective Field Theory: Applications to
  the LHC","Additional details added on exponentiation, and the form of the
  Sudakov series. Figures darkened to print better. 40 pages, 40 figures","Phys.Rev.D78:073006,2008","10.1103/PhysRevD.78.073006",,"hep-ph","http://arxiv.org/licenses/nonexclusive-distrib/1.0/","  Electroweak Sudakov logarithms at high energy, of the form alpha/sin^2
theta_W^n log^m s/M_{Z,W}^2, are summed using effective theory (EFT) methods.
The exponentiation of Sudakov logarithms and factorization is discussed in the
EFT formalism. Radiative corrections are computed to scattering processes in
the standard model involving an arbitrary number of external particles. The
computations include non-zero particle masses such as the t-quark mass,
electroweak mixing effects which lead to unequal W and Z masses and a massless
photon, and Higgs corrections proportional to the top quark Yukawa coupling.
The structure of the radiative corrections, and which terms are summed by the
EFT renormalization group is discussed in detail. The omitted terms are smaller
than 1%. We give numerical results for the corrections to dijet production,
dilepton production, t-\bar t production, and squark pair production. The
purely electroweak corrections are significant -- about 15% at 1 TeV,
increasing to 30% at 5 TeV, and they change both the scattering rate and
angular distribution. The QCD corrections (which are well-known) are also
computed with the EFT. They are much larger -- about a factor of four at 1 TeV,
increasing to a factor of thirty at 5 TeV. Mass effects are also significant;
the q \bar q -> t \bar t rate is enchanced relative to the light-quark
production rate by 40%.
","[{""version"":""v1"",""created"":""Fri, 6 Jun 2008 21:41:44 GMT""},{""version"":""v2"",""created"":""Wed, 30 Jul 2008 17:40:43 GMT""}]","2008-11-26"
"0806.1241","Antonio Siber","Antonio Siber and Rudolf Podgornik","Scaling relations in the collapse of elastic icosadeltahedral shells
  under uniform external pressure","submitted",,,,"physics.bio-ph physics.class-ph","http://arxiv.org/licenses/nonexclusive-distrib/1.0/","  We discuss collapse of icosadeltahedral shells subjected to uniform external
pressure. We demonstrate that there is a universal collapse pressure curve. The
parameter that uniquely determines the collapse pressure is shown to be the
Foppl-von Karman number of the non-pressurized shells. Numerical results are
interpreted in terms of buckling instabilities of spheres and cylinders under
hydrostatic pressure.
","[{""version"":""v1"",""created"":""Fri, 6 Jun 2008 21:51:08 GMT""}]","2008-06-10"
"0806.1242","Simon Spacapan","Bojan Mohar and Simon Spacapan","Degenerate and star colorings of graphs on surfaces","16 pages, 2 figures",,,,"math.CO","http://arxiv.org/licenses/nonexclusive-distrib/1.0/","  We study the degenerate, the star and the degenerate star chromatic numbers
and their relation to the genus of graphs. As a tool we prove the following
strengthening of a result of Fertin et al.: If $G$ is a graph of maximum degree
$\Delta$, then $G$ admits a degenerate star coloring using $O(\Delta^{3/2})$
colors. We use this result to prove that every graph of genus $g$ admits a
degenerate star coloring with $O(g^{3/5})$ colors. It is also shown that these
results are sharp up to a logarithmic factor.
","[{""version"":""v1"",""created"":""Fri, 6 Jun 2008 21:53:25 GMT""}]","2008-06-10"
"0806.1243","Scott Nollet","John Brevik and Scott Nollet","Noether-Lefschetz theorem with base locus","18 pages, amsart","Int. Math. Res. Not. IMRN 2011, no. 6, 1220-1244","10.1093/imrn/rnq106",,"math.AG","http://arxiv.org/licenses/nonexclusive-distrib/1.0/","  We compute the class groups of very general normal surfaces in complex
projective three-space containing an arbitrary base locus $Z$, thereby
extending the classic Noether-Lefschetz theorem (the case when $Z$ is empty).
Our method is an adaptation of Griffiths and Harris' degeneration proof,
simplified by a cohomology and base change argument. We give applications to
computing Picard groups, which generalize several known results.
","[{""version"":""v1"",""created"":""Fri, 6 Jun 2008 22:21:02 GMT""},{""version"":""v2"",""created"":""Sun, 15 Mar 2009 04:43:01 GMT""},{""version"":""v3"",""created"":""Tue, 3 Nov 2009 01:48:12 GMT""}]","2012-11-21"
"0806.1244","Michael Leitch","M.J. Leitch, et al. (for the PHENIX Collaboration)","Progress Towards Understanding Quarkonia at PHENIX","6 pages, 7 figures, proceedings for the 24th Winter Workshop on
  Nuclear Dynamics (2008)",,,"LA-UR-08-03667","nucl-ex","http://creativecommons.org/licenses/publicdomain/","  Quarkonia (J/psi, psi', chi_C, Upsilon) production provides a sensitive probe
of gluon distributions and their modification in nuclei; and is a leading probe
of the hot-dense (deconfined) matter created in high-energy collisions of heavy
ions. We will discuss the physics of quarkonia production in the context of
recent p+p measurements at PHENIX. We next discuss Cold-Nuclear Matter (CNM)
effects as seen in our measurements in $d+Au$ collisions - both for intrinsic
physics such as gluon saturation and final-state dissociation, and as a
baseline for studies in nucleus-nucleus collisions. Then we review the latest
nucleus-nucleus results in the light of the expected CNM effects, and discuss
two leading scenarios for the observed suppression patterns. Finally we show
the latest data from PHENIX, including new d+Au data from the 2007-2008 run;
and then look into the future.
","[{""version"":""v1"",""created"":""Fri, 6 Jun 2008 22:23:16 GMT""}]","2019-08-13"
"0806.1245","Jean-Luc Lehners","Jean-Luc Lehners","Ekpyrotic and Cyclic Cosmology","79 pages, 12 figures, invited review to be published in Phys. Rept.
  Non-gaussianity section updated and generalized","Phys.Rept.465:223-263,2008","10.1016/j.physrep.2008.06.001",,"astro-ph gr-qc hep-th","http://arxiv.org/licenses/nonexclusive-distrib/1.0/","  Ekpyrotic and cyclic cosmologies provide theories of the very early and of
the very late universe. In these models, the big bang is described as a
collision of branes - and thus the big bang is not the beginning of time.
Before the big bang, there is an ekpyrotic phase with equation of state w=P/rho
>> 1 (where P is the average pressure and rho the average energy density)
during which the universe slowly contracts. This phase resolves the standard
cosmological puzzles and generates a nearly scale-invariant spectrum of
cosmological perturbations containing a significant non-gaussian component. At
the same time it produces small-amplitude gravitational waves with a blue
spectrum. The dark energy dominating the present-day cosmological evolution is
reinterpreted as a small attractive force between our brane and a parallel one.
This force eventually induces a new ekpyrotic phase and a new brane collision,
leading to the idea of a cyclic universe. This review discusses the detailed
properties of these models, their embedding in M-theory and their viability,
with an emphasis on open issues and observational signatures.
","[{""version"":""v1"",""created"":""Fri, 6 Jun 2008 22:31:47 GMT""},{""version"":""v2"",""created"":""Tue, 2 Jun 2009 15:32:38 GMT""}]","2011-03-10"
"0806.1246","Rodrigo Torrens","Rodrigo Torrens, Luis A. Nunez and Raisa Urribarri","ICT, Community Memory and Technological Appropriation","15 pages, 2 figures",,,,"cs.DL cs.CY","http://arxiv.org/licenses/nonexclusive-distrib/1.0/","  The core mission of universities and higher education institutions is to make
public the results of their work and to preserve the collective memory of the
institution. This includes the effective use of information and communication
technologies (ICT) to systematically compile academic and research achievements
as well as disseminate effectively this accumulated knowledge to society at
large. Current efforts in Latin America and Venezuela in particular, are
limited but provide some valuable insights to pave the road to this important
goal. The institutional repository of Universidad de Los Andes (ULA) in
Venezuela (www.saber.ula.ve) is such an example of ICT usage to store, manage
and disseminate digital material produced by our University. In this paper we
elaborate on the overall process of promoting a culture of content creation,
publishing and preservation within ULA.
","[{""version"":""v1"",""created"":""Fri, 6 Jun 2008 22:37:43 GMT""}]","2008-06-10"
"0806.1247","Mohammad Javaheri","Mohammad Javaheri","O-segments on topological measure spaces","10 pages",,,,"math.FA","http://arxiv.org/licenses/nonexclusive-distrib/1.0/","  Let $X$ be a topological space and $\mu$ be a nonatomic finite measure on a
$\sigma$-algebra $\Sigma$ containing the Borel $\sigma$-algebra of $X$. We say
$\mu$ is weakly outer regular, if for every $A \in \Sigma$ and $\epsilon>0$,
there exists an open set $O$ such that $\mu(A \backslash O)=0$ and $\mu(O
\backslash A)<\epsilon$. The main result of this paper is to show that if $f,g
\in L^1(X,\Sigma, \mu)$ with $\int_X f d\mu=\int_X g d\mu=1$, then there exists
an increasing family of open sets $u(t)$, $t\in [0,1]$, such that
$u(0)=\emptyset$, $u(1)=X$, and $\int_{u(t)} f d\mu=\int_{u(t)} g d\mu=t$ for
all $t\in [0,1]$. We also study a similar problem for a finite collection of
integrable functions on general finite and $\sigma$-finite nonatomic measure
spaces.
","[{""version"":""v1"",""created"":""Fri, 6 Jun 2008 22:48:18 GMT""}]","2008-06-10"
"0806.1248","Wellington G. Dantas","W.G. Dantas, M.J. de Oliveira and J.F. Stilck","Simulational study for the crossover in the generalized contact process
  with diffusion","9 pages and 5 figures",,,,"cond-mat.stat-mech","http://arxiv.org/licenses/nonexclusive-distrib/1.0/","  In a recent work, Dantas and Stilck studied a model that generalizes the
contact process model with diffusion. Our approach, based on the supercritical
expansion, showed that for a weak diffusion regime the crossover exponent
between the directed percolation and compact directed percolation universality
classes was $\phi\approx 2$. However this approach did not work for reduced
diffusion rates higher than $D\approx 0.3$, where $0\leq D\leq 1$ and D=1
corresponds to an infinite diffusion rate. Thus, in the present work we
estimate this crossover exponent for higher diffusion rates using a numerical
simulation approach.
","[{""version"":""v1"",""created"":""Fri, 6 Jun 2008 22:44:33 GMT""}]","2008-06-10"
"0806.1249","John F. Dawson","Fred Cooper, John F. Dawson, and Bogdan Mihaila","Real time particle production in QED and QCD from strong fields and the
  Back-Reaction problem","29 pages, 7 figures, talk given by Fred Cooper at KITP conference on
  nonequilibrium phenomena, February, 2008",,,,"hep-ph","http://arxiv.org/licenses/nonexclusive-distrib/1.0/","  We review the history of analytical approaches to particle production from
external strong fields in QED and QCD, and numerical studies of the back
reaction problem for the electric field in QED. We discuss the formulation of
the backreaction problem for the chromoelectric field in QCD both in leading
and next to leading order in flavor large-N QCD.
","[{""version"":""v1"",""created"":""Fri, 6 Jun 2008 22:45:50 GMT""}]","2008-06-10"
"0806.1250","Thomas Prellberg","A. L. Owczarek and T. Prellberg","Scaling of the atmosphere of self-avoiding walks",,,"10.1088/1751-8113/41/37/375004",,"cond-mat.stat-mech math-ph math.CO math.MP","http://arxiv.org/licenses/nonexclusive-distrib/1.0/","  The number of free sites next to the end of a self-avoiding walk is known as
the atmosphere. The average atmosphere can be related to the number of
configurations. Here we study the distribution of atmospheres as a function of
length and how the number of walks of fixed atmosphere scale. Certain bounds on
these numbers can be proved. We use Monte Carlo estimates to verify our
conjectures. Of particular interest are walks that have zero atmosphere, which
are known as trapped. We demonstrate that these walks scale in the same way as
the full set of self-avoiding walks, barring an overall constant factor.
","[{""version"":""v1"",""created"":""Fri, 6 Jun 2008 23:31:47 GMT""}]","2009-11-13"
