"0801.2742","Neil Drummond","A. Ma, M. D. Towler, N. D. Drummond, and R. J. Needs","Scheme for adding electron-nucleus cusps to Gaussian orbitals",,"A. Ma et al., J. Chem. Phys. 122, 224322 (2005)","10.1063/1.1940588",,"physics.comp-ph",,"  A simple scheme is described for introducing the correct cusps at nuclei into
orbitals obtained from Gaussian basis set electronic structure calculations.
The scheme is tested with all-electron variational quantum Monte Carlo (VMC)
and diffusion quantum Monte Carlo (DMC) methods for the Ne atom, the H2
molecule, and 55 molecules from a standard benchmark set. It greatly reduces
the variance of the local energy in all cases and slightly improves the
variational energy. This scheme yields a general improvement in the efficiency
of all-electron VMC and DMC calculations using Gaussian basis sets.
","[{""version"":""v1"",""created"":""Thu, 17 Jan 2008 18:18:55 GMT""}]","2008-01-18"
"0801.2743","Arnoldas Deltuva","A. Deltuva, A.C. Fonseca, P.U. Sauer","Four-nucleon system with $\Delta$-isobar excitation","11 figures, to be published in Phys. Lett. B","Phys.Lett.B660:471-477,2008","10.1016/j.physletb.2007.12.058",,"nucl-th",,"  The four-nucleon bound state and scattering below three-body breakup
threshold are described based on the realistic coupled-channel potential CD
Bonn + $\Delta$ which allows the excitation of a single nucleon to a $\Delta$
isobar. The Coulomb repulsion between protons is included. In the four-nucleon
system the two-baryon coupled-channel potential yields effective two-, three-
and four-nucleon forces, mediated by the $\Delta$ isobar and consistent with
each other and with the underlying two-nucleon force. The effect of the
four-nucleon force on the studied observables is much smaller than the effect
of the three-nucleon force. The inclusion of the $\Delta$ isobar is unable to
resolve the existing discrepancies with the experimental data.
","[{""version"":""v1"",""created"":""Thu, 17 Jan 2008 18:21:12 GMT""}]","2008-11-26"
"0801.2744","Claire Berger","Jakub Kedzierski, Pei-Lan Hsu, Paul Healey, Peter Wyatt, Craig Keast,
  Mike Sprinkle, Claire Berger, Walt de Heer","Epitaxial graphene transistors on SiC substrates",,"IEEE /Transactions on Electron Devices 55, 2078 (2008).","10.1109/TED.2008.926593",,"cond-mat.mtrl-sci",,"  This paper describes the behavior of top gated transistors fabricated using
carbon, particularly epitaxial graphene on SiC, as the active material. In the
past decade research has identified carbon-based electronics as a possible
alternative to silicon-based electronics. This enthusiasm was spurred by high
carbon nanotube carrier mobilities. However, nanotube production, placement,
and control are all serious issues. Graphene, a thin sheet of graphitic carbon,
can overcome some of these problems and therefore is a promising new electronic
material. Although graphene devices have been built before, in this work we
provide the first demonstration and systematic evaluation of arrays of a large
number of transistors entirely produced using standard microelectronics
methods. Graphene devices presented feature high-k dielectric, mobilities up to
5000 cm2/Vs and, Ion/Ioff ratios of up to 7, and are methodically analyzed to
provide insight into the substrate properties. Typical of graphene, these
micron-scale devices have negligible band gaps and therefore large leakage
currents.
","[{""version"":""v1"",""created"":""Thu, 17 Jan 2008 18:26:58 GMT""}]","2009-11-13"
"0801.2745","Gabriel Zarnauskas","M. R. Robilotta and G. R. S. Zarnauskas","Scalar form factors and nuclear interactions","Talk given at the 20EFB, Pisa, Italy, September 2007. 3 pages and 4
  figures","Few Body Syst.44:121-124,2008","10.1007/s00601-008-0271-1",,"nucl-th",,"  The scalar-isoscalar term in the two-pion exchange $NN$ potential is
abnormally large and does not respect the hierarchy of effects predicted by
chiral perturbation theory. We argue that this anomaly is associated with
non-perturbative effects, which are also present in the $\pi N$ scalar form
factor.
","[{""version"":""v1"",""created"":""Thu, 17 Jan 2008 18:27:19 GMT""}]","2009-01-16"
"0801.2746","Serge Koutchmy","Serge Koutchmy, Vladimir Slemzin, Boris Filippov, Jacques-Clair Noens,
  David Romeuf and Leon Golub","Analysis and interpretation of a fast limb CME with eruptive prominence,
  C-flare and EUV dimming","11 pages, 9 figures",,"10.1051/0004-6361:20078311",,"astro-ph",,"  Coronal Mass ejections or CMEs are large dynamical solar-corona events. The
mass balance and kinematics of a fast limb CME, including its prominence
progenitor and the associated flare, will be compared with computed magnetic
structures to look for their origin and effect.
  Multi-wavelength ground-based and space-borne observations are used to study
a fast W-limb CME event of December 2, 2003, taking into account both on and
off disk observations. Its erupting prominence is measured at high cadence with
the Pic du Midi full H-alpha line-flux imaging coronagraph. EUV images from
space instruments are processed including difference imaging. SOHO/LASCO images
are used to study the mass excess and motions. A fast bright expanding coronal
loop is identified in the region recorded slightly later by GOES as a C7.2
flare, followed by a brightening and an acceleration phase of the erupting
material with both cool and hot components. The total coronal radiative flux
dropped by 5 percent in the EUV channels, revealing a large dimming effect at
and above the limb. The typical 3-part structure observed 1 hour later shows a
core shaped similarly to the eruptive filament/prominence. The total measured
mass of the escaping CME (1.5x10to16 g from C2 LASCO observations) definitely
exceeds the estimated mass of the escaping cool prominence material although
assumptions made to analyse the Ha erupting prominence, as well as the
corresponding EUV darkening of the filament observed several days before, made
this evaluation uncertain by a factor of 2. From the current free extrapolation
we discuss the shape of the magnetic neutral surface and a possible scenario
leading to an instability, including the small scale dynamics inside and around
the filament.
","[{""version"":""v1"",""created"":""Thu, 17 Jan 2008 18:30:29 GMT""}]","2009-11-13"
"0801.2747","Javier von Stecher","J. von Stecher, Chris H. Greene, D. Blume","Energetics and Structural Properties of Trapped Two-Component Fermi
  Gases","22 pages, 21 figures",,"10.1103/PhysRevA.77.043619",,"cond-mat.other",,"  Using two different numerical methods, we study the behavior of two-component
Fermi gases interacting through short-range s-wave interactions in a harmonic
trap. A correlated Gaussian basis-set expansion technique is used to determine
the energies and structural properties, i.e., the radial one-body densities and
pair distribution functions, for small systems with either even or odd $N$, as
functions of the s-wave scattering length and the mass ratio $\kappa$ of the
two species. Particular emphasis is put on a discussion of the angular momentum
of the system in the BEC-BCS crossover regime. At unitarity, the excitation
spectrum of the four-particle system with total angular momentum L=0 is
calculated as a function of the mass ratio $\kappa$. The results are analyzed
from a hyperspherical perspective, which offers new insights into the problem.
Additionally, fixed-node diffusion Monte Carlo calculations are performed for
equal-mass Fermi gases with up to N=30 atoms. We focus on the odd-even
oscillations of the ground state energy of the equal-mass unitary system having
up to N=30 particles, which are related to the excitation gap of the system.
Furthermore, we present a detailed analysis of the structural properties of
these systems.
","[{""version"":""v1"",""created"":""Thu, 17 Jan 2008 18:36:49 GMT""}]","2009-11-13"
"0801.2748","Mark Kliger","Ami Wiesel, Mark Kliger and Alfred O. Hero III","A greedy approach to sparse canonical correlation analysis","5 pages, 3 pages",,,,"stat.CO stat.ME",,"  We consider the problem of sparse canonical correlation analysis (CCA), i.e.,
the search for two linear combinations, one for each multivariate, that yield
maximum correlation using a specified number of variables. We propose an
efficient numerical approximation based on a direct greedy approach which
bounds the correlation at each stage. The method is specifically designed to
cope with large data sets and its computational complexity depends only on the
sparsity levels. We analyze the algorithm's performance through the tradeoff
between correlation and parsimony. The results of numerical simulation suggest
that a significant portion of the correlation may be captured using a
relatively small number of variables. In addition, we examine the use of sparse
CCA as a regularization method when the number of available samples is small
compared to the dimensions of the multivariates.
","[{""version"":""v1"",""created"":""Thu, 17 Jan 2008 18:53:07 GMT""}]","2008-01-18"
"0801.2749","B. Glenn Piner","B. Glenn Piner, Niraj Pant, and Philip G. Edwards","The Parsec-Scale Jets of the TeV Blazars H 1426+428, 1ES 1959+650, and
  PKS 2155-304: 2001-2004","16 pages, Astrophysical Journal, in press",,"10.1086/533521",,"astro-ph",,"  We present Very Long Baseline Array (VLBA) observations of the TeV blazars H
1426+428, 1ES 1959+650, and PKS 2155-304 obtained during the years 2001 through
2004. We observed H 1426+428 at four epochs at 8 GHz, and found that its
parsec-scale structure consisted of a ~17 mJy core and a single ~3 mJy jet
component with an apparent speed of 2.09 +/- 0.53c. The blazar 1ES 1959+650 was
observed at three epochs at frequencies of 15 and 22 GHz. Spectral index
information from these dual-frequency observations was used to definitively
identify the core of the parsec-scale structure. PKS 2155-304 was observed at a
single epoch at 15 GHz with dual-circular polarization, and we present the
first VLBI polarimetry image of this source. For 1ES 1959+650 and PKS 2155-304,
the current observations are combined with the VLBA observations from our
earlier paper to yield improved apparent speed measurements for these sources
with greatly reduced measurement errors. The new apparent speed measured for
component C2 in 1ES 1959+650 is 0.00 +/- 0.04c (stationary), and the new
apparent speed measured for component C1 in PKS 2155-304 is 0.93 +/- 0.31c. We
combine the new apparent speed measurements from this paper with the apparent
speeds measured in TeV blazar jets from our earlier papers to form a current
set of apparent speed measurements in TeV HBLs. The mean peak apparent pattern
speed in the jets of the TeV HBLs is about 1c. We conclude the paper with a
detailed discussion of the interpretation of the collected VLBA data on TeV
blazars in the context of current theoretical models for the parsec-scale
structure of TeV blazar jets.
","[{""version"":""v1"",""created"":""Thu, 17 Jan 2008 19:34:02 GMT""}]","2009-11-13"
"0801.2750","Hiroyuki Nakano","Hiroyuki Nakano, Carlos O. Lousto (RIT)","New method to integrate 2+1 wave equations with Dirac's delta functions
  as sources","4 pages, 1 figure, prepared for the proceedings of the 17th workshop
  on general relativity and gravitation, Nagoya, Japan, Dec.3 - Dec.7, 2007",,,,"gr-qc",,"  Gravitational perturbations in a Kerr black hole background can not be
decomposed into simple tensor harmonics in the time domain. Here, we make the
mode decomposition only in the azimuthal direction and discuss the resulting
(2+1)-dimensional Klein-Gordon differential equation for scalar perturbations
with a two dimensional Dirac's $\delta$-function as a source representing a
point particle orbiting a much larger black hole. To make this equation
amenable for numerical integrations we explicitly remove analytically the
singular behavior of the source and compute a global effective source for the
corresponding waveform.
","[{""version"":""v1"",""created"":""Thu, 17 Jan 2008 19:15:07 GMT""}]","2008-01-18"
"0801.2751","Joseph Najnudel","Joseph Najnudel","Construction of an Edwards' probability measure on
  $\mathcal{C}(\mathbb{R}_+,\mathbb{R})$","Published in at http://dx.doi.org/10.1214/10-AOP540 the Annals of
  Probability (http://www.imstat.org/aop/) by the Institute of Mathematical
  Statistics (http://www.imstat.org)","Annals of Probability 2010, Vol. 38, No. 6, 2295-2321","10.1214/10-AOP540","IMS-AOP-AOP540","math.PR","http://arxiv.org/licenses/nonexclusive-distrib/1.0/","  In this article, we prove that the measures $\mathbb{Q}_T$ associated to the
one-dimensional Edwards' model on the interval $[0,T]$ converge to a limit
measure $\mathbb{Q}$ when $T$ goes to infinity, in the following sense: for all
$s\geq0$ and for all events $\Lambda_s$ depending on the canonical process only
up to time $s$, $\mathbb{Q}_T(\Lambda_s)\rightarrow\mathbb{Q}(\Lambda_s)$.
Moreover, we prove that, if $\mathbb{P}$ is Wiener measure, there exists a
martingale $(D_s)_{s\in\mathbb{R}_+}$ such that $\mathbb{Q}(\Lambda_s)
=\mathbb{E}_{\mathbb{P}}(\mathbh{1}_{\Lambda_s}D_s)$, and we give an explicit
expression for this martingale.
","[{""version"":""v1"",""created"":""Thu, 17 Jan 2008 19:27:53 GMT""},{""version"":""v2"",""created"":""Sat, 20 Feb 2010 00:35:04 GMT""},{""version"":""v3"",""created"":""Wed, 24 Nov 2010 06:34:07 GMT""}]","2010-11-25"
"0801.2752","Henri Lehn","Georges Lochak (AFBL)","The Equation of a Light Leptonic Magnetic Monopole and its Experimental
  Aspects",,"Z.Naturforsch..A62:231-246,2007",,,"quant-ph",,"  The present theory is closely related to Dirac's equation of the electron,
but not to his magnetic monopole theory, except for his relation between
electric and magnetic charge. The theory is based on the fact, that the
massless Dirac equation admits a second electromagnetic coupling, deduced from
a pseudo-scalar gauge invariance. The equation thus obtained has the symmetry
laws of a massless leptonic, magnetic monopole, able to interact weakly. We
give a more precise form of the Dirac relation between electric and magnetic
charges and a quantum form of the Poincare first integral. In the Weyl
representation our equation splits into P-conjugated monopole and antimonopole
equations with the correct electromagnetic coupling and opposite chiralities,
predicted by P. Curie. Charge-conjugated monopoles are symmetric in space and
not in time (contrary to the electric particles), an important fact for the
vacuum polarization. Our monopoles are magnetically excited neutrinos, which
leads to experimental consequences. These monopoles are assumed to be produced
by electromagnetic pulses or arcs, leading to nuclear transmutations and, for
beta radioactive elements, a shortening of the life time and the emission of
monopoles instead of neutrinos in a magnetic field. A corresponding discussion
is given.
","[{""version"":""v1"",""created"":""Thu, 17 Jan 2008 19:51:31 GMT""}]","2008-11-26"
"0801.2753","Nadine Guillotin-Plantard","Cl\'ement Dombry (LMA), Nadine Guillotin-Plantard (ICJ)","Discrete approximation of a stable self-similar stationary increments
  process","31 pages",,,,"math.PR",,"  The aim of this paper is to present a result of discrete approximation of
some class of stable self-similar stationary increments processes. The
properties of such processes were intensively investigated, but little is known
on the context in which such processes can arise. To our knowledge,
discretisation and convergence theorems are available only in the case of
stable L\'evy motions and fractional Brownian motions. This paper yields new
results in this direction. Our main result is the convergence of the random
rewards schema, which was firstly introduced by Cohen and Samorodnitsky, and
that we consider in a more general setting. Strong relationships with Kesten
and Spitzer's random walk in random sceneries are evidenced. Finally, we study
some path properties of the limit process.
","[{""version"":""v1"",""created"":""Thu, 17 Jan 2008 19:42:00 GMT""}]","2008-01-18"
"0801.2754","Patrice Bacchin","Benjamin Espinasse (LGC), Patrice Bacchin (LGC), Pierre Aimar (LGC)","Filtration method characterizing the reversibility of colloidal fouling
  layers at a membrane surface: analysis through critical flux and osmotic
  pressure","Journal of Colloid and Interface Science (2008) to be published",,"10.1016/j.jcis.2008.01.023",,"cond-mat.soft",,"  A filtration procedure was developed to measure the reversibility of fouling
during cross-flow filtration based on the square wave of applied pressure. The
principle of this method, the apparatus required, and the associated
mathematical relationships are detailed. This method allows for differentiating
the reversible accumulation of matter on, and the irreversible fouling of, a
membrane surface. Distinguishing these two forms of attachment to a membrane
surface provides a means by which the critical flux may be determined. To
validate this method, experiments were performed with a latex suspension at
different degrees of destabilization (obtained by the addition of salt to the
suspension) and at different cross-flow velocities. The dependence of the
critical flux on these conditions is discussed and analysed through the osmotic
pressure of the colloidal dispersion.
","[{""version"":""v1"",""created"":""Thu, 17 Jan 2008 19:44:50 GMT""}]","2008-01-18"
"0801.2755","Ludovic Dan Lemle","Ludovic Dan Lemle (ICJ)","$L^\infty$-Uniqueness of Generalized SCHR\""Odinger Operators",,,,,"math-ph math.MP",,"  The main purpose of this paper is to show that the generalized Schr\""odinger
operator ${\cal A}^Vf={1/2}\Delta f+b\nabla f-Vf$, $f\in C_0^\infty(\R^d)$, is
a pre-generator for which we can prove its $L^\infty(\R^d,dx)$-uniqueness.
Moreover, we prove the $L^1(\R^d,dx)$-uniqueness of weak solutions for the
Fokker-Planck equation associated with this pre-generator.
","[{""version"":""v1"",""created"":""Thu, 17 Jan 2008 19:45:49 GMT""}]","2008-01-18"
"0801.2756","Giampaolo Cristadoro","Giampaolo Cristadoro, Roland Ketzmerick","On universality of algebraic decays in Hamiltonian systems","4 pages, 3 figures","Phys. Rev. Lett. 100, 184101 (2008)","10.1103/PhysRevLett.100.184101",,"nlin.CD",,"  Hamiltonian systems with a mixed phase space typically exhibit an algebraic
decay of correlations and of Poincare' recurrences, with numerical experiments
over finite times showing system-dependent power-law exponents. We conjecture
the existence of a universal asymptotic decay based on results for a Markov
tree model with random scaling factors for the transition probabilities.
Numerical simulations for different Hamiltonian systems support this conjecture
and permit the determination of the universal exponent.
","[{""version"":""v1"",""created"":""Thu, 17 Jan 2008 19:46:03 GMT""}]","2008-10-06"
"0801.2757","Martin Houde","Hua-bai Li (1) and Martin Houde (2) (1- Harvard-Smithsonian Center for
  Astrophysics, 2- The University of Western Ontario)","Probing the Turbulence Dissipation Range and Magnetic Field Strengths in
  Molecular Clouds","15 pages, 3 figures, accepted for publication in The Astrophysical
  Journal",,"10.1086/529581",,"astro-ph",,"  We study the turbulent velocity dispersion spectra of the coexistent HCN and
HCO+ molecular species as a function of length scale in the M17 star-forming
molecular cloud. We show that the observed downward shift of the ion's spectrum
relative to that of the neutral is readily explained by the existence of an
ambipolar diffusion range within which ion and neutral turbulent energies
dissipate differently. We use these observations to evaluate this decoupling
scale and show how to estimate the strength of the plane-of-the-sky component
of the embedded magnetic field in a completely novel way.
","[{""version"":""v1"",""created"":""Thu, 17 Jan 2008 19:49:19 GMT""}]","2009-11-13"
"0801.2758","Werner Krauth","Markus Holzmann, Maguelonne Chevallier, Werner Krauth","Semiclassical theory of the quasi two-dimensional trapped Bose gas","5 pages, 3 figures","Europhysics Letters 82, 30001 (2008)","10.1209/0295-5075/82/30001",,"cond-mat.stat-mech",,"  We discuss the quasi two-dimensional trapped Bose gas where the thermal
occupation of excited states in the tightly confined direction is small but
remains finite in the thermodynamic limit. We show that the semiclassical
theory describes very accurately the density profile obtained by Quantum Monte
Carlo calculations in the normal phase above the Kosterlitz--Thouless
temperature T_KT, but differs strongly from the predictions of strictly
two-dimensional mean-field theory, even at relatively high temperature. We
discuss the relevance of our findings for analyzing ultra-cold-atom experiments
in quasi two-dimensional traps.
","[{""version"":""v1"",""created"":""Thu, 17 Jan 2008 20:20:33 GMT""}]","2009-11-13"
"0801.2759","Rachel Dudik Ms.","S. Satyapal, D. Vega, R. P. Dudik, N. P. Abel, T. Heckman","Spitzer Uncovers Active Galactic Nuclei Missed by Optical Surveys in 7
  Late-type Galaxies","8 figures, 17 pages, astro-ph\0801.2766 (Abel & Satyapal 2008; ApJ
  accepted) and this posting designed to form a two-part investigation",,"10.1086/529014",,"astro-ph",,"  We report the discovery using Spitzers high resolution spectrograph of 7
Active Galactic Nuclei (AGN) in a sample of 32 late-type galaxies that show no
definitive signatures of AGN in their optical spectra. Our observations suggest
that the AGN detection rate in late-type galaxies is possibly 4 times larger
than what optical spectroscopic observations alone suggest. We demonstrate
using photoionization models with an input AGN and an extreme EUV-bright
starburst ionizing radiation field that the observed mid-infrared line ratios
cannot be replicated unless an AGN contribution, in some cases as little as 10%
of the total galaxy luminosity, is included. These models show that when the
fraction of the total luminosity due to the AGN is low, optical diagnostics are
insensitive to the presence of the AGN. In this regime of parameter space, the
mid-infrared diagnostics offer a powerful tool for uncovering AGN missed by
optical spectroscopy. The AGN bolometric luminosities in our sample range from
~3 X 10^41 - ~2 X 10^43 ergs s^-1, which, based on the Eddington limit,
corresponds to a lower mass limit for the black hole that ranges from ~3 X
10^3Mdot to as high as ~1.5 X 10^5Mdot. These lower mass limits however do not
put a strain on the well-known relationship between the black hole mass and the
host galaxy's stellar velocity dispersion established in predominantly
early-type galaxies. Our findings add to the growing evidence that black holes
do form and grow in low-bulge environments and that they are significantly more
common than optical studies indicate.
","[{""version"":""v1"",""created"":""Thu, 17 Jan 2008 20:34:05 GMT""},{""version"":""v2"",""created"":""Fri, 18 Jan 2008 16:59:43 GMT""}]","2009-11-13"
"0801.2760","John Dudley","John. M. Dudley, Goery Genty and Benjamin J. Eggleton","Harnessing and control of optical rogue waves in supercontinuum
  generation","Submitted for Publication (2008)",,"10.1364/OE.16.003644",,"physics.optics",,"  We present a numerical study of the evolution dynamics of ``optical rogue
waves'', statistically-rare extreme red-shifted soliton pulses arising from
supercontinuum generation in photonic crystal fiber [D. R. Solli et al. Nature
Vol. 450, 1054-1058 (2007)]. Our specific aim is to use nonlinear Schrodinger
equation simulations to identify ways in which the rogue wave dynamics can be
actively controlled, and we demonstrate that rogue wave generation can be
enhanced by an order of magnitude through a small modulation across the input
pulse envelope and effectively suppressed through the use of a sliding
frequency filter.
","[{""version"":""v1"",""created"":""Thu, 17 Jan 2008 20:41:15 GMT""}]","2009-11-13"
"0801.2761","Lev Vaidman","L. Vaidman","Protective Measurements","An entry in the Compendium of Quantum Physics: Concepts, Experiments,
  History and Philosophy, ed. F. Weinert, K. Hentschel, D. Greenberger and B.
  Falkenburg",,,,"quant-ph",,"  A review of protective measurements. Protective measurement is a method for
measuring an expectation value of an observable on a single quantum system. The
quantum state of the system can be protected by a potential, when the state is
a nondegenerate energy eigenstate with a known gap to neighboring states, or
via Zeno effect by frequent projection measurements.
","[{""version"":""v1"",""created"":""Thu, 17 Jan 2008 20:41:37 GMT""}]","2008-01-18"
