"0801.3111","Martin Pelikan","Martin Pelikan","Analysis of Estimation of Distribution Algorithms and Genetic Algorithms
  on NK Landscapes","Also available at the MEDAL web site, http://medal.cs.umsl.edu/","Proceedings of the Genetic and Evolutionary Computation Conference
  (GECCO-2008), ACM Press, 1033-1040",,"MEDAL Report No. 2008001","cs.NE cs.AI",,"  This study analyzes performance of several genetic and evolutionary
algorithms on randomly generated NK fitness landscapes with various values of n
and k. A large number of NK problem instances are first generated for each n
and k, and the global optimum of each instance is obtained using the
branch-and-bound algorithm. Next, the hierarchical Bayesian optimization
algorithm (hBOA), the univariate marginal distribution algorithm (UMDA), and
the simple genetic algorithm (GA) with uniform and two-point crossover
operators are applied to all generated instances. Performance of all algorithms
is then analyzed and compared, and the results are discussed.
","[{""version"":""v1"",""created"":""Mon, 21 Jan 2008 00:20:50 GMT""}]","2008-07-30"
"0801.3112","Vinod Prabhakaran","Adnan Raja, Vinod M. Prabhakaran, and Pramod Viswanath","The Two User Gaussian Compound Interference Channel",,,,,"cs.IT math.IT",,"  We introduce the two user finite state compound Gaussian interference channel
and characterize its capacity region to within one bit. The main contributions
involve both novel inner and outer bounds. The inner bound is multilevel
superposition coding, but the decoding of the levels is opportunistic,
depending on the channel state. The genie aided outer bound is motivated by the
typical error events of the achievable scheme.
","[{""version"":""v1"",""created"":""Mon, 21 Jan 2008 00:15:18 GMT""},{""version"":""v2"",""created"":""Thu, 6 Mar 2008 16:14:32 GMT""},{""version"":""v3"",""created"":""Thu, 1 May 2008 00:17:44 GMT""}]","2008-05-01"
"0801.3113","Martin Pelikan","Martin Pelikan, Kumara Sastry, and David E. Goldberg","iBOA: The Incremental Bayesian Optimization Algorithm","Also available at the MEDAL web site, http://medal.cs.umsl.edu/","Proceedings of the Genetic and Evolutionary Computation Conference
  (GECCO-2008), ACM Press, 455-462",,"MEDAL Report No. 2008002","cs.NE cs.AI",,"  This paper proposes the incremental Bayesian optimization algorithm (iBOA),
which modifies standard BOA by removing the population of solutions and using
incremental updates of the Bayesian network. iBOA is shown to be able to learn
and exploit unrestricted Bayesian networks using incremental techniques for
updating both the structure as well as the parameters of the probabilistic
model. This represents an important step toward the design of competent
incremental estimation of distribution algorithms that can solve difficult
nearly decomposable problems scalably and reliably.
","[{""version"":""v1"",""created"":""Mon, 21 Jan 2008 00:34:55 GMT""}]","2008-07-30"
"0801.3114","Grenville Croll","Raymond R. Panko","Thinking is Bad: Implications of Human Error Research for Spreadsheet
  Research and Practice","12 pages including references","Proc. European Spreadsheet Risks Int. Grp. 2007 69-80 ISBN
  978-905617-58-6",,,"cs.HC",,"  In the spreadsheet error community, both academics and practitioners
generally have ignored the rich findings produced by a century of human error
research. These findings can suggest ways to reduce errors; we can then test
these suggestions empirically. In addition, research on human error seems to
suggest that several common prescriptions and expectations for reducing errors
are likely to be incorrect. Among the key conclusions from human error research
are that thinking is bad, that spreadsheets are not the cause of spreadsheet
errors, and that reducing errors is extremely difficult.
","[{""version"":""v1"",""created"":""Mon, 21 Jan 2008 00:33:15 GMT""}]","2008-03-10"
"0801.3115","Stephen Tegler","S.C. Tegler, W.M. Grundy, F. Vilas, W. Romanishin, D. Cornelison, G.J.
  Consolmagno","Evidence of N2-Ice On the Surface of the Icy Dwarf Planet 136472 (2005
  FY9)","The paper will appear in Icarus. It has 33 pages, 2 tables, and 7
  figures. Replaced version fixed typo in abstract","Icarus 195:844-850,2008","10.1016/j.icarus.2007.12.015",,"astro-ph",,"  We present high signal precision optical reflectance spectra of 2005 FY9
taken with the Red Channel Spectrograph and the 6.5-m MMT telescope on 2006
March 4 UT (5000 - 9500 A; 6.33 A pixel-1) and 2007 February 12 UT (6600 - 8500
A; 1.93 A pixel-1). From cross correlation experiments between the 2006 March 4
spectrum and a pure CH4-ice Hapke model, we find the CH4-ice bands in the MMT
spectrum are blueshifted by 3 +/- 4 A relative to bands in the pure CH4-ice
Hapke spectrum. The higher resolution MMT spectrum of 2007 February 12 UT
enabled us to measure shifts of individual CH4-ice bands. We find the 7296 A,
7862 A, and 7993 A CH4-ice bands are blueshifted by 4 +/- 2 A, 4 +/- 4 A, and 6
+/- 5 A. From four measurements we report here and one of our previously
published measurements, we find the CH4-ice bands are shifted by 4 +/- 1 A.
This small shift is important because it suggest the presence of another ice
component on the surface of 2005 FY9. Laboratory experiments show that CH4-ice
bands in spectra of CH4 mixed with other ices are blueshifted relative to bands
in spectra of pure CH4-ice. A likely candidate for the other component is
N2-ice because its weak 2.15 micron band and blueshifted CH4 bands are seen in
spectra of Triton and Pluto. Assuming the shift is due to the presence of N2,
spectra taken on two consecutive nights show no difference in CH4/N2. In
addition, we find no measureable difference in CH4/N2 at different depths into
the surface of 2005 FY9.
","[{""version"":""v1"",""created"":""Mon, 21 Jan 2008 01:02:50 GMT""}]","2014-11-18"
"0801.3116","Grenville Croll","Ralph Baxter","Enterprise Spreadsheet Management: A Necessary Good","8 pages, includes references","Proc. European Spreadsheet Risks Int. Grp. 2007 7-13 ISBN
  978-905617-58-6",,,"cs.CY",,"  This paper presents the arguments and supporting business metrics for
Enterprise Spreadsheet Management to be seen as a necessary good. These
arguments are divided into a summary of external business drivers that make it
necessary and the good that may be delivered to business spreadsheet users
involved in repetitive manual processes.
","[{""version"":""v1"",""created"":""Mon, 21 Jan 2008 00:41:18 GMT""}]","2008-03-13"
"0801.3117","Yongzhi Cao","Yongzhi Cao","A hierarchy of behavioral equivalences in the $\pi$-calculus with noisy
  channels","30 pages, 2 figures","Comput. J., vol. 53, no. 1, pp. 3-20, 2010",,,"cs.LO",,"  The $\pi$-calculus is a process algebra where agents interact by sending
communication links to each other via noiseless communication channels. Taking
into account the reality of noisy channels, an extension of the $\pi$-calculus,
called the $\pi_N$-calculus, has been introduced recently. In this paper, we
present an early transitional semantics of the $\pi_N$-calculus, which is not a
directly translated version of the late semantics of $\pi_N$, and then extend
six kinds of behavioral equivalences consisting of reduction bisimilarity,
barbed bisimilarity, barbed equivalence, barbed congruence, bisimilarity, and
full bisimilarity into the $\pi_N$-calculus. Such behavioral equivalences are
cast in a hierarchy, which is helpful to verify behavioral equivalence of two
agents. In particular, we show that due to the noisy nature of channels, the
coincidence of bisimilarity and barbed equivalence, as well as the coincidence
of full bisimilarity and barbed congruence, in the $\pi$-calculus does not hold
in $\pi_N$.
","[{""version"":""v1"",""created"":""Mon, 21 Jan 2008 00:42:52 GMT""}]","2011-10-04"
"0801.3118","Grenville Croll","Simon Murphy","Spreadsheet Hell","6 pages","Proc. European Spreadsheet Risks Int. Grp. 2007 15-20 ISBN
  978-905617-58-6",,,"cs.CY",,"  This management paper looks at the real world issues faced by practitioners
managing spreadsheets through the production phase of their life cycle. It
draws on the commercial experience of several developers working with large
corporations, either as employees or consultants or contractors. It provides
commercial examples of some of the practicalities involved with spreadsheet use
around the enterprise.
","[{""version"":""v1"",""created"":""Mon, 21 Jan 2008 00:51:12 GMT""}]","2008-03-10"
"0801.3119","Grenville Croll","Mukul Madahar, Pat Cleary, David Ball","Categorisation of Spreadsheet Use within Organisations, Incorporating
  Risk: A Progress Report","10 pages","Proc. European Spreadsheet Risks Int. Grp. 2007 37-45 ISBN
  978-905617-58-6",,,"cs.CY cs.HC",,"  There has been a significant amount of research into spreadsheets over the
last two decades. Errors in spreadsheets are well documented. Once used mainly
for simple functions such as logging, tracking and totalling information,
spreadsheets with enhanced formulas are being used for complex calculative
models. There are many software packages and tools which assist in detecting
errors within spreadsheets. There has been very little evidence of
investigation into the spreadsheet risks associated with the main stream
operations within an organisation. This study is a part of the investigation
into the means of mitigating risks associated with spreadsheet use within
organisations. In this paper the authors present and analyse three proposed
models for categorisation of spreadsheet use and the level of risks involved.
The models are analysed in the light of current knowledge and the general risks
associated with organisations.
","[{""version"":""v1"",""created"":""Mon, 21 Jan 2008 00:57:31 GMT""}]","2008-03-10"
"0801.3120","Svetlana Varchenko","E.Mukhin, V.Tarasov, A.Varchenko","Spaces of quasi-exponentials and representations of gl_N","Latex, 29 pages",,"10.1088/1751-8113/41/19/194017",,"math.QA math-ph math.AG math.MP",,"  We consider the action of the Bethe algebra B_K on (\otimes_{s=1}^k
L_{\lambda^{(s)}})_\lambda, the weight subspace of weight $\lambda$ of the
tensor product of k polynomial irreducible gl_N-modules with highest weights
\lambda^{(1)},...,\lambda^{(k)}, respectively. The Bethe algebra depends on N
complex numbers K=(K_1,...,K_N). Under the assumption that K_1,...,K_N are
distinct, we prove that the image of B_K in the endomorphisms of
(\otimes_{s=1}^k L_{\lambda^{(s)}})_\lambda is isomorphic to the algebra of
functions on the intersection of k suitable Schubert cycles in the Grassmannian
of N-dimensional spaces of quasi-exponentials with exponents K. We also prove
that the B_K-module (\otimes_{s=1}^k L_{\lambda^{(s)}})_\lambda is isomorphic
to the coregular representation of that algebra of functions. We present a
Bethe ansatz construction identifying the eigenvectors of the Bethe algebra
with points of that intersection of Schubert cycles.
","[{""version"":""v1"",""created"":""Mon, 21 Jan 2008 01:04:16 GMT""}]","2009-11-13"
"0801.3121","Kentaro Nomura","Kentaro Nomura, Shinsei Ryu, Mikito Koshino, Christopher Mudry, Akira
  Furusaki","Quantum Hall Effect of Massless Dirac Fermions in a Vanishing Magnetic
  Field","5 pages, 4 figures","Phys. Rev. Lett. 100, 246806 (2008)","10.1103/PhysRevLett.100.246806",,"cond-mat.mes-hall",,"  The effect of strong long-range disorder on the quantization of the Hall
conductivity $\sigma_{xy}$ in graphene is studied numerically. It is shown that
increasing Landau-level mixing progressively destroys all plateaus in
$\sigma_{xy}$ except the plateaus at $\sigma_{xy}=\mp e^2/2h$ (per valley and
per spin). The critical state at the charge-neutral Dirac point is robust to
strong disorder and belongs to the universality class of the conventional
plateau transitions in the integer quantum Hall effect. We propose that the
breaking of time-reversal symmetry by ripples in graphene can realize this
quantum critical point in a vanishing magnetic field.
","[{""version"":""v1"",""created"":""Mon, 21 Jan 2008 01:56:05 GMT""},{""version"":""v2"",""created"":""Mon, 12 May 2008 13:55:06 GMT""}]","2008-06-30"
"0801.3122","Patrick Coles","Patrick J. Coles","Helicity asymmetry of optically-pumped NMR spectra in GaAs","4 pages, 3 figures, added thermometry data",,"10.1103/PhysRevB.78.033201",,"cond-mat.mes-hall cond-mat.mtrl-sci",,"  The origin of helicity asymmetries in the optically-pumped NMR signal and
hyperfine shift in GaAs is derived analytically and tested experimentally. The
ratio of the optically-pumped to the equilibrium electron polarizations is a
key parameter in determining both asymmetries. Variations in asymmetry with
photon energy and laser power reflect variations in the local temperature and
the electron spin polarization, and these two quantities are extracted from the
asymmetry through a simple methodology. Other contributions to the asymmetry
are considered.
","[{""version"":""v1"",""created"":""Mon, 21 Jan 2008 03:23:27 GMT""},{""version"":""v2"",""created"":""Mon, 17 Mar 2008 06:47:38 GMT""},{""version"":""v3"",""created"":""Fri, 9 May 2008 08:50:26 GMT""}]","2009-11-13"
"0801.3123","Cai-Dian Lu","Wei Wang, Yu-Ming Wang, De-Shan Yang and Cai-Dian Lu","Charmless Two-body $B(B_s)\to VP$ decays In
  Soft-Collinear-Effective-Theory","34 pages, revtex, 2 figures, published at PRD","Phys.Rev.D78:034011,2008","10.1103/PhysRevD.78.034011",,"hep-ph","http://arxiv.org/licenses/nonexclusive-distrib/1.0/","  We provide the analysis of charmless two-body $B\to VP$ decays under the
framework of the soft-collinear-effective-theory (SCET), where $V(P)$ denotes a
light vector (pseudoscalar) meson. Besides the leading power contributions,
some power corrections (chiraly enhanced penguins) are also taken into account.
Using the current available $B\to PP$ and $B\to VP$ experimental data on
branching fractions and CP asymmetry variables, we find two kinds of solutions
in $\chi^2$ fit for the 16 non-perturbative inputs which are essential in the
87 $B\to PP$ and $B\to VP$ decay channels. Chiraly enhanced penguins can change
several charming penguins sizably, since they share the same topology. However,
most of the other non-perturbative inputs and predictions on branching ratios
and CP asymmetries are not changed too much. With the two sets of inputs, we
predict the branching fractions and CP asymmetries of other modes especially
$B_s\to VP$ decays. The agreements and differences with results in QCD
factorization and perturbative QCD approach are analyzed. We also study the
time-dependent CP asymmetries in channels with CP eigenstates in the final
states and some other channels such as $\bar B^0/B^0\to\pi^\pm\rho^\mp$ and
$\bar B_s^0/B_s^0\to K^\pm K^{*\mp}$. In the perturbative QCD approach, the
$(S-P)(S+P)$ penguins in annihilation diagrams play an important role. Although
they have the same topology with charming penguins in SCET, there are many
differences between the two objects in weak phases, magnitudes, strong phases
and factorization properties.
","[{""version"":""v1"",""created"":""Mon, 21 Jan 2008 03:59:22 GMT""},{""version"":""v2"",""created"":""Fri, 15 Aug 2008 08:28:42 GMT""}]","2008-11-26"
"0801.3124","Yutaka Tobita","Kenzo Ishikawa, Yutaka Tobita","Coherence length of cosmic background radiation enlarges the attenuation
  length of the ultra-high energy proton","8 pages, 2 figures,study about the second coherence length has been
  added",,,"EPHOU-08-001","hep-ph","http://arxiv.org/licenses/nonexclusive-distrib/1.0/","  It is pointed out that an agreement of the one particle energy spectrum of
the cosmic background radiation (CMBR) with Plank distribution of 2.725 [K]
does not give a strong constraint on the coherence length of CMBR if the mean
free path of CMBR is very long. The coherence length in this situation is
estimated as a few times of $k_BT$. Due to this finite coherence length, the
attenuation length of ultra-high energy cosmic rays (UHECR) is reduced in the
$\Delta $ resonance region,i.e., around $10^{20}$ [eV]. The small attenuation
length makes the suppression of the flux of cosmic rays in this energy region
less prominent than the naive estimation
","[{""version"":""v1"",""created"":""Mon, 21 Jan 2008 04:54:50 GMT""},{""version"":""v2"",""created"":""Thu, 18 Jun 2009 16:28:19 GMT""},{""version"":""v3"",""created"":""Tue, 9 Mar 2010 10:14:26 GMT""}]","2010-03-10"
"0801.3125","Sankarasubramanian Kasiviswanathan","K. Sankarasubramanian, T. Rimmele","High Resolution Observations using Adaptive Optics: Achievements and
  Future Needs",,,"10.1007/s12036-008-0043-9",,"astro-ph",,"  Over the last few years, several interesting observations were obtained with
the help of solar Adaptive Optics (AO). In this paper, few observations made
using the solar AO are enlightened and briefly discussed. A list of
disadvantages with the current AO system are presented. With telescopes larger
than 1.5m are expected during the next decade, there is a need to develop the
existing AO technologies for large aperture telescopes. Some aspects of this
development are highlighted. Finally, the recent AO developments in India are
also presented.
","[{""version"":""v1"",""created"":""Mon, 21 Jan 2008 05:27:11 GMT""}]","2009-11-13"
"0801.3126","Pankaj Jain","Pankaj Jain, Satish D. Joglekar and Subhadip Mitra","Two Photon Exchange Contributions to Elastic e + p --> e + p Process in
  a Nonlocal Field Formalism","10 pages 7 figures","Eur.Phys.J.C57:671-680,2008","10.1140/epjc/s10052-008-0710-7",,"hep-ph nucl-ex nucl-th",,"  We compute the two photon exchange contributions to elastic scattering of
polarized electrons from target protons. We use a nonlocal field theory
formalism for this calculation. The formalism maintains gauge invariance and
provides a systematic procedure for making this calculation. The results depend
on one unknown parameter \bar b. We compute the two photon exchange correction
to the ratio of electric to magnetic form factors extracted using the
polarization transfer experiments. The correction is found to be small if \bar
b ~ 1. However for larger values of \bar b>3, the correction can be quite
significant. The correction to the polarization transfer results goes in the
right direction to explain their difference with the ratio measured by
Rosenbluth separation method. We find that the difference between the two
experimental results can be explained for a wide range of values of the
parameter \bar b. We also find that the corrections due to two photon exchange
depend on the photon longitudinal polarization epsilon. Hence we predict an
epsilon dependence of the form factor ratio extracted using the polarization
transfer technique. Finally we obtain a limit on \bar b by requiring that the
non-linearity in epsilon dependence of the unpolarized reduced cross section is
within experimental errors.
","[{""version"":""v1"",""created"":""Mon, 21 Jan 2008 05:30:14 GMT""}]","2008-12-18"
"0801.3127","Lianyi He","Lianyi He and Pengfei Zhuang","Phase Diagram of Cold Polarized Fermi Gas in Two Dimensions","V3: extended version according to referee's comment. 12 pages, 6
  figures. Analytical results of density profile in trapped system are
  reported; V4: Version accepted by Physical Review A","Phys.Rev.A78:033613,2008","10.1103/PhysRevA.78.033613",,"cond-mat.supr-con cond-mat.other cond-mat.str-el hep-ph nucl-th physics.atom-ph","http://arxiv.org/licenses/nonexclusive-distrib/1.0/","  The superfluid phase diagrams of a two-dimensional cold polarized Fermi gas
in the BCS-BEC crossover are systematically and analytically investigated. In
the BCS-Leggett mean field theory, the transition from unpolarized superfluid
phase to normal phase is always of first order. For a homogeneous system, the
two critical Zeeman fields and the critical population imbalance are
analytically determined in the whole coupling parameter region, and the
superfluid-normal mixed phase is shown to be the ground state between the two
critical fields. The density profile in the presence of a harmonic trap
calculated in the local density approximation exhibits a shell structure, a
superfluid core at the center and a normal shell outside. For weak interaction,
the normal shell contains a partially polarized cloud with constant density
difference surrounded by a fully polarized state. For strong interaction, the
normal shell is totally in fully polarized state with a density profile
depending only on the global population imbalance. The di-fermion bound states
can survive in the whole highly imbalanced normal phase.
","[{""version"":""v1"",""created"":""Mon, 21 Jan 2008 05:37:43 GMT""},{""version"":""v2"",""created"":""Sun, 13 Apr 2008 07:50:57 GMT""},{""version"":""v3"",""created"":""Sun, 18 May 2008 11:10:02 GMT""},{""version"":""v4"",""created"":""Sat, 6 Sep 2008 04:52:45 GMT""}]","2016-09-08"
"0801.3128","Nagaraju K","K. Nagaraju, K. Sankarasubramanian, and K. E. Rangarajan","On the Weakening of Chromospheric Magnetic Field in Active Regions","accepted for publication in ApJ",,"10.1086/533433",,"astro-ph",,"  Simultaneous measurement of line-of-sight (LOS) magnetic and velocity fields
at the photosphere and chromosphere are presented. Fe I line at $\lambda6569$
and $H_{\alpha}$ at $\lambda6563$ are used respectively for deriving the
physical parameters at photospheric and chromospheric heights. The LOS magnetic
field obtained through the center-of-gravity method show a linear relation
between photospheric and chromospheric field for field strengths less than 700
G. But in strong field regions, the LOS magnetic field values derived from
$H_{\alpha}$ are much weaker than what one gets from the linear relationship
and also from those expected from the extrapolation of the photospheric
magnetic field. We discuss in detail the properties of magnetic field observed
in $H_{\alpha}$ from the point of view of observed velocity gradients. The
bisector analysis of $H_{\alpha}$ Stokes $I$ profiles show larger velocity
gradients in those places where strong photospheric magnetic fields are
observed. These observations may support the view that the stronger fields
diverge faster with height compared to weaker fields.
","[{""version"":""v1"",""created"":""Mon, 21 Jan 2008 05:37:11 GMT""}]","2009-11-13"
"0801.3129","Iftikhar Ahmad","Iftikhar Ahmad, Yun-Song Piao, Cong-Feng Qiao","Spectrum of Curvature Perturbation of Multi-field Inflation with
  Small-Field Potential","8 pages, no figure, to publish in JCAP","JCAP 0802:002,2008","10.1088/1475-7516/2008/02/002",,"astro-ph",,"  In this paper, we have studied the spectrum of curvature perturbation of
multi-field inflation with general small-field potential. We assume that the
isocurvature perturbation may be neglected, and by using the Sasaki-Stewart
formalism, we found that the spectrum may be redder or bluer than of its
corresponding single field. The result depends upon the values of fields and
their effective masses at the horizon-crossing time. We discuss the relevant
cases.
","[{""version"":""v1"",""created"":""Mon, 21 Jan 2008 05:44:25 GMT""}]","2009-06-23"
"0801.3130","Marek Rogatko","Gary W.Gibbons and Marek Rogatko","The Decay of Dirac Hair around a Dilaton Black Hole","RevTex, 8 pages, to be published in Phys.Rev.D15","Phys.Rev.D77:044034,2008","10.1103/PhysRevD.77.044034",,"hep-th gr-qc",,"  The intermediate and late-time behaviour of a massive Dirac field in the
background of static spherically symmetric black hole solutions is
investigated. The intermediate asymptotic behaviour of a massive Dirac field
depends on the mass parameter as well as the wave number of the mode, while the
late time behaviour has a power law decay rate independent of both.
","[{""version"":""v1"",""created"":""Mon, 21 Jan 2008 05:48:01 GMT""}]","2008-11-26"
"0801.3131","Yasuro Funaki","Y. Funaki, H. Horiuchi, G. R\""opke, P. Schuck, A. Tohsaki, T. Yamada","Density-induced suppression of the alpha-particle condensate in nuclear
  matter and the structure of alpha cluster states in nuclei","7 pages, 3 figure, submitted to Phys. Rev. C","Phys.Rev.C77:064312,2008","10.1103/PhysRevC.77.064312",,"nucl-th",,"  At low densities, with decreasing temperatures, in symmetric nuclear matter
alpha-particles are formed, which eventually give raise to a quantum condensate
with four-nucleon alpha-like correlations (quartetting). Starting with a model
of alpha-matter, where undistorted alpha particles interact via an effective
interaction such as the Ali-Bodmer potential, the suppression of the condensate
fraction at zero temperature with increasing density is considered. Using a
Jastrow-Feenberg approach, it is found that the condensate fraction vanishes
near saturation density. Additionally, the modification of the internal state
of the alpha particle due to medium effects will further reduce the condensate.
  In finite systems, an enhancement of the S state wave function of the c.o.m.
orbital of alpha particle motion is considered as the correspondence to the
condensate. Wave functions have been constructed for self-conjugate 4n nuclei
which describe the condensate state, but are fully antisymmetrized on the
nucleonic level. These condensate-like cluster wave functions have been
successfully applied to describe properties of low-density states near the n
alpha threshold. Comparison with OCM calculations in 12C and 16O shows strong
enhancement of the occupation of the S-state c.o.m. orbital of the
alpha-particles. This enhancement is decreasing if the baryon density
increases, similar to the density-induced suppression of the condensate
fraction in alpha matter. The ground states of 12C and 16O show no enhancement
at all, thus a quartetting condensate cannot be formed at saturation densities.
","[{""version"":""v1"",""created"":""Mon, 21 Jan 2008 06:15:57 GMT""}]","2008-11-26"
