"0801.2992","Yuki Yayama","Yuki Yayama","Dimensions of compact invariant sets of some expanding maps",,,,,"math.DS",,"  We study the Hausdorff dimension and measures of full Hausdorff dimension for
a compact invariant set of an expanding nonconformal map on the torus given by
an integer-valued diagonal matrix. The Hausdorff dimension of a ""general
Sierpinski carpet"" was found by McMullen and Bedford and the uniqueness of the
measure of full Hausdorff dimension in some cases was proved by Kenyon and
Peres. We extend these results by using compensation functions to study a
general Sierpinski carpet represented by a shift of finite type. We give some
conditions under which a general Sierpinski carpet has a unique measure of full
Hausdorff dimension, and study the properties of the unique measure.
","[{""version"":""v1"",""created"":""Sun, 20 Jan 2008 17:13:30 GMT""},{""version"":""v2"",""created"":""Wed, 2 Apr 2008 19:20:28 GMT""}]","2008-04-02"
"0801.2997","Martin Pelikan","Martin Pelikan, Helmut G. Katzgraber and Sigismund Kobe","Finding Ground States of Sherrington-Kirkpatrick Spin Glasses with
  Hierarchical BOA and Genetic Algorithms","Also available at the MEDAL web site, http://medal.cs.umsl.edu/","Proceedings of the Genetic and Evolutionary Computation Conference
  (GECCO-2008), ACM Press, 447-454.","10.1145/1389095.1389176","MEDAL Report No. 2008004","cond-mat.dis-nn",,"  This study focuses on the problem of finding ground states of random
instances of the Sherrington-Kirkpatrick (SK) spin-glass model with Gaussian
couplings. While the ground states of SK spin-glass instances can be obtained
with branch and bound, the computational complexity of branch and bound yields
instances of not more than about 90 spins. We describe several approaches based
on the hierarchical Bayesian optimization algorithm (hBOA) to reliably
identifying ground states of SK instances intractable with branch and bound,
and present a broad range of empirical results on such problem instances. We
argue that the proposed methodology holds a big promise for reliably solving
large SK spin-glass instances to optimality with practical time complexity. The
proposed approaches to identifying global optima reliably can also be applied
to other problems and they can be used with many other evolutionary algorithms.
Performance of hBOA is compared to that of the genetic algorithm with two
common crossover operators.
","[{""version"":""v1"",""created"":""Mon, 21 Jan 2008 00:19:26 GMT""}]","2009-07-29"
"0801.3008","Alexander Berkovich","Alexander Berkovich","The tri-pentagonal number theorem and related identities","13 pages",,,,"math.NT math.CO",,"  I revisit an automated proof of Andrews' pentagonal number theorem found by
Riese. I uncover a simple polynomial identity hidden behind his proof. I
explain how to use this identity to prove Andrews' result along with a variety
of new formulas of similar type. I reveal an interesting relation between the
tri-pentagonal theorem and items (19), (20), (94), (98) on the celebrated
Slater list. Finally, I establish a new infinite family of multiple series
identities.
","[{""version"":""v1"",""created"":""Sun, 20 Jan 2008 23:55:43 GMT""}]","2008-01-22"
"0801.3028","Veniamin Berezinsky","V. Berezinsky","Astroparticle Physics: Puzzles and Discoveries","Invited talk at TAUP 2007 conference, September 2007, Sendai, Japan","J.Phys.Conf.Ser.120:012001,2008","10.1088/1742-6596/120/1/012001",,"astro-ph",,"  Puzzles often give birth to the great discoveries, the false discoveries
sometimes stimulate the exiting ideas in theoretical physics. The historical
examples of both are described in Introduction and in section ``Cosmological
Puzzles''. From existing puzzles most attention is given to Ultra High Energy
Cosmic Ray (UHECR) puzzle and to cosmological constant problem. The 40-years
old UHECR problem consisted in absence of the sharp steepening in spectrum of
extragalactic cosmic rays caused by interaction with CMB radiation. This
steepening is known as Greisen-Zatsepin-Kuzmin (GZK) cutoff. It is demonstrated
here that the features of interaction of cosmic ray protons with CMB are seen
now in the spectrum in the form of the dip and beginning of the GZK cutoff. The
most serious cosmological problem is caused by large vacuum energy of the known
elementary-particle fields which exceeds at least by 45 orders of magnitude the
cosmological vacuum energy. The various ideas put forward to solve this problem
during last 40 years, have weaknesses and cannot be accepted as the final
solution of this puzzle. The anthropic approach is discussed.
","[{""version"":""v1"",""created"":""Mon, 21 Jan 2008 11:23:57 GMT""}]","2009-06-23"
"0801.3031","Oren Tal","O. Tal (1), M. Krieger (1 and 2), B. Leerink (1), and J. M. van
  Ruitenbeek (1) ((1) Leiden University, The Netherlands (2) University of
  Erlangen-Nuernberg, Germany)","Electron-vibration interaction in single-molecule junctions: from
  contact to tunneling regime","4 pages, 1 table, 4 figures","Phys. Rev. Lett, 100, 196804 (2008)","10.1103/PhysRevLett.100.196804",,"cond-mat.mes-hall cond-mat.other",,"  Point contact spectroscopy on a H2O molecule bridging Pt electrodes reveals a
clear crossover between enhancement and reduction of the conductance due to
electron-vibration interaction. As single channel models predict such a
crossover at transmission probability of t=0.5, we used shot noise measurements
to analyze the transmission and observed at least two channels across the
junction where the dominant channel has t=0.51+/-0.01 transmission probability
at the crossover conductance, which is consistent with the predictions for
single-channel models.
","[{""version"":""v1"",""created"":""Mon, 21 Jan 2008 13:58:09 GMT""}]","2008-05-23"
"0801.3087","Hiroyuki Kawamura","Hiroyuki Kawamura, Jiro Kodaira, Kazuhiro Tanaka","Soft gluon resummation in Drell-Yan dilepton production at small
  transverse momentum: spin asymmetry and a novel asymptotic formula","6 pages, 2 figures, to appear in the proceedings of RADCOR2007,
  Florence, Italy, 1-5 Oct 2007","PoSRADCOR2007:040,2007",,,"hep-ph",,"  We discuss the double-spin asymmetry \aqt in the transversely polarized
Drell-Yan process at small transverse-momentum Q_T of the produced dilepton.
The soft gluon corrections relevant for small Q_T are resummed to all orders in
\alpha_s, up to the next-to-leading logarithmic accuracy. We show that the soft
gluon corrections largely cancel in the spin asymmetry, but the significant
corrections still remain.The asymmetries \aqt are calculated for pp collision
at RHIC and J-PARC, and for p\bar{p} collision at GSI. A novel asymptotic
formula for \aqt at small Q_T is presented, which provides a new approach to
extract the transversity \delta q(x) from the experimental data.
","[{""version"":""v1"",""created"":""Mon, 21 Jan 2008 03:34:16 GMT""}]","2008-11-26"
"0801.3094","Martin Hildebrand","Martin Hildebrand","A lower bound for the Chung-Diaconis-Graham random process","10 pages; this version makes a small change on p. 6",,,,"math.PR",,"  Chung, Diaconis, and Graham considered random processes of the form
X_{n+1}=a_n X_n+b_n (mod p) where p is odd, X_0=0, a_n=2 always, and b_n are
i.i.d. for n=0,1,2,... . In this paper, we show that if
P(b_n=-1)=P{b_n=0)=P(b_n=1)=1/3, then there exists a constant c>1 such that c
log_2 p steps are not enough to make X_n get close to uniformly distributed on
the integers mod p.
","[{""version"":""v1"",""created"":""Sun, 20 Jan 2008 16:38:59 GMT""},{""version"":""v2"",""created"":""Fri, 30 May 2008 17:26:19 GMT""}]","2008-05-30"
"0801.3095","Yshai Avishai","Yshai Avishai (BGU and RTRA), Konstantin Kikoin (TAU)","Tunneling through Quantum Dots with Discrete Symmetries","Short review (22 pages) prepared for ""Encyclopedia of Complexity""
  (Springer, 2008)",,,,"cond-mat.str-el cond-mat.mes-hall",,"  We describe in this short review the influence of discrete symmetries in
complex quantum dots on the Kondo co-tunneling through these nano-objects.
These discrete symmetries stem from the geometrical structure of the tunneling
devices (e.g spatial symmetry of multivalley quantum dot in a tunneling contact
with leads). They affect the dynamical symmetry of spin multiplets
characterizing the ground state and excitations in quantum dots with definite
electron number occupation. The influence of external electric and magnetic
fields on these symmetries is examined, and analogies with the physics of
quantum tunneling through molecular complexes are discussed.
","[{""version"":""v1"",""created"":""Sun, 20 Jan 2008 17:15:10 GMT""}]","2008-01-22"
"0801.3096","Leonid Parnovski","Leonid Parnovski","Bethe-Sommerfeld Conjecture","59 pages, 10 figures; to appear in Annales Henri Poincare",,"10.1007/s00023-008-0364-x",,"math.SP",,"  We consider Schroedinger operator $-\Delta+V$ in $R^d$ ($d\ge 2$) with smooth
periodic potential $V$ and prove that there are only finitely many gaps in its
spectrum.
","[{""version"":""v1"",""created"":""Sun, 20 Jan 2008 17:24:39 GMT""}]","2009-11-13"
"0801.3097","Zhu Han","Jianwei Huang, Zhu Han, Mung Chiang, H. Vincent Poor","Auction-based Resource Allocation for Multi-relay Asynchronous
  Cooperative Networks","To appear in the Proceedings of the 2008 IEEE International
  Conference on Acoustics, Speech and Signal Processing, Las Vegas, NV, March
  30 to April 4, 2008",,"10.1109/ICASSP.2008.4518870",,"cs.IT math.IT",,"  Resource allocation is considered for cooperative transmissions in
multiple-relay wireless networks. Two auction mechanisms, SNR auctions and
power auctions, are proposed to distributively coordinate the allocation of
power among multiple relays. In the SNR auction, a user chooses the relay with
the lowest weighted price. In the power auction, a user may choose to use
multiple relays simultaneously, depending on the network topology and the
relays' prices. Sufficient conditions for the existence (in both auctions) and
uniqueness (in the SNR auction) of the Nash equilibrium are given. The fairness
of the SNR auction and efficiency of the power auction are further discussed.
It is also proven that users can achieve the unique Nash equilibrium
distributively via best response updates in a completely asynchronous manner.
","[{""version"":""v1"",""created"":""Sun, 20 Jan 2008 17:25:56 GMT""}]","2016-11-15"
"0801.3098","Laurence Marks","L. D. Marks and D. R. Luke","Robust Mixing for Ab-Initio Quantum Mechanical Calculations","32 Pages, 4 figures",,"10.1103/PhysRevB.78.075114",,"cond-mat.mtrl-sci cond-mat.str-el",,"  We study the general problem of mixing for ab-initio quantum-mechanical
problems. Guided by general mathematical principles and the underlying physics,
we propose a multisecant form of Broydens second method for solving the
self-consistent field equations of Kohn-Sham density functional theory. The
algorithm is robust, requires relatively little finetuning and appears to
outperform the current state of the art, converging for cases that defeat many
other methods. We compare our technique to the conventional methods for
problems ranging from simple to nearly pathological.
","[{""version"":""v1"",""created"":""Sun, 20 Jan 2008 17:57:25 GMT""}]","2009-11-13"
"0801.3099","Andrew Knyazev","Andrew V. Knyazev and Klaus Neymeyr","Gradient flow approach to geometric convergence analysis of
  preconditioned eigensolvers","8 pages, 2 figures. Accepted to SIAM J. Matrix Anal. (SIMAX)","SIAM. J. Matrix Anal. & Appl. Volume 31, Issue 2, pp. 621-628
  (2009)","10.1137/080727567","CUD CCM 263","math.NA math.OC","http://creativecommons.org/licenses/publicdomain/","  Preconditioned eigenvalue solvers (eigensolvers) are gaining popularity, but
their convergence theory remains sparse and complex. We consider the simplest
preconditioned eigensolver--the gradient iterative method with a fixed step
size--for symmetric generalized eigenvalue problems, where we use the gradient
of the Rayleigh quotient as an optimization direction. A sharp convergence rate
bound for this method has been obtained in 2001--2003. It still remains the
only known such bound for any of the methods in this class. While the bound is
short and simple, its proof is not. We extend the bound to Hermitian matrices
in the complex space and present a new self-contained and significantly shorter
proof using novel geometric ideas.
","[{""version"":""v1"",""created"":""Sun, 20 Jan 2008 18:25:57 GMT""},{""version"":""v2"",""created"":""Mon, 16 Jun 2008 18:47:37 GMT""},{""version"":""v3"",""created"":""Mon, 16 Mar 2009 16:56:29 GMT""}]","2010-06-02"
"0801.3100","Mohamad Ali Jafarizadeh","M. A. Jafarizadeh, M. Mahdian, A. Heshmati, K. Aghayari","Detecting three-qubit bound MUB diagonal entangled states via Nonlinear
  optimal entanglement witnesses","34 pages 11 figures",,"10.1140/epjd/e2008-00200-6",,"quant-ph",,"  One of the important approaches to detect quantum entanglement is using
linear entanglement witnesses EWs. In this paper, by determining the envelope
of the boundary hyper-planes defined by a family of linear EWs, a set of
powerful nonlinear optimal EWs is manipulated. These EWs enable us to detect
some three qubits bound MUB (mutually unbiased bases) diagonal entangled
states, i.e., the PPT (positive partial transpose) entangled states. Also, in
some particular cases, the introduced nonlinear optimal EWs are powerful enough
to separate the bound entangled regions from the separable ones. Finally, we
present numerical examples to demonstrate the practical accessibility of this
approach.
  Keywords :nonlinear optimal entanglement witnesses, mutually unbiased bases,
MUB diagonal states
","[{""version"":""v1"",""created"":""Sun, 20 Jan 2008 18:27:36 GMT""}]","2009-11-13"
"0801.3101","Michela Artebani","Michela Artebani and Alessandra Sarti","Non-symplectic automorphisms of order 3 on K3 surfaces","17 pages",,,,"math.AG",,"  In this paper we study K3 surfaces with a non-symplectic automorphism of
order 3. In particular, we classify the topological structure of the fixed
locus of such automorphisms and we show that it determines the action on
cohomology. This allows us to describe the structure of the moduli space and to
show that it has three irreducible components.
","[{""version"":""v1"",""created"":""Sun, 20 Jan 2008 18:37:31 GMT""}]","2008-01-22"
"0801.3102","Eloisa Bentivegna","Mark Wenstrom, Eloisa Bentivegna and Ali Hurson (Pennsylvania State
  University)","Balancing transparency, efficiency and security in pervasive systems","52 pages, to be published in Advances in Computers",,,,"cs.HC cs.IR",,"  This chapter will survey pervasive computing with a look at how its
constraint for transparency affects issues of resource management and security.
The goal of pervasive computing is to render computing transparent, such that
computing resources are ubiquitously offered to the user and services are
proactively performed for a user without his or her intervention. The task of
integrating computing infrastructure into everyday life without making it
excessively invasive brings about tradeoffs between flexibility and robustness,
efficiency and effectiveness, as well as autonomy and reliability. As the
feasibility of ubiquitous computing and its real potential for mass
applications are still a matter of controversy, this chapter will look into the
underlying issues of resource management and authentication to discover how
these can be handled in a least invasive fashion. The discussion will be closed
by an overview of the solutions proposed by current pervasive computing
efforts, both in the area of generic platforms and for dedicated applications
such as pervasive education and healthcare.
","[{""version"":""v1"",""created"":""Sun, 20 Jan 2008 19:15:50 GMT""}]","2008-01-22"
"0801.3103","Bernhard Keller","Bernhard Keller","Categorification of acyclic cluster algebras: an introduction","15 pages, references updated",,,,"math.RT math.CO","http://arxiv.org/licenses/nonexclusive-distrib/1.0/","  This is a concise introduction to Fomin-Zelevinsky's cluster algebras and
their links with the representation theory of quivers in the acyclic case. We
review the definition of cluster algebras (geometric, without coefficients),
construct the cluster category and present the bijection between cluster
variables and rigid indecomposable objects of the cluster category.
","[{""version"":""v1"",""created"":""Sun, 20 Jan 2008 19:40:40 GMT""},{""version"":""v2"",""created"":""Sat, 9 Oct 2010 17:29:27 GMT""}]","2010-10-12"
"0801.3104","Fergal Mullally","F. Mullally, D. E. Winget, Steven Degennaro, Elizabeth Jeffery, S. E.
  Thompson, Dean Chandler","Limits on Planets Around White Dwarf Stars","19 pages, accepted for publication in ApJ",,,,"astro-ph",,"  We present limits on planetary companions to pulsating white dwarf stars. A
subset of these stars exhibit extreme stability in the period and phase of some
of their pulsation modes; a planet can be detected around such a star by
searching for periodic variations in the arrival time of these pulsations. We
present limits on companions greater than a few Jupiter masses around a sample
of 15 white dwarf stars as part of an on-going survey. One star shows a
variation in arrival time consistent with a 2 M_J planet in a 4.5 year orbit.
We discuss other possible explanations for the observed signal and conclude
that a planet is the most plausible explanation based on the data available.
","[{""version"":""v1"",""created"":""Sun, 20 Jan 2008 20:06:03 GMT""}]","2008-01-22"
"0801.3105","Anton Leykin","Anton Leykin","Numerical primary decomposition","16 pages, minor changes made, references added",,,,"math.AG math.NA",,"  Consider an ideal $I \subset R = \bC[x_1,...,x_n]$ defining a complex affine
variety $X \subset \bC^n$. We describe the components associated to $I$ by
means of {\em numerical primary decomposition} (NPD).
  The method is based on the construction of {\em deflation ideal} $I^{(d)}$
that defines the {\em deflated variety} $\dXd$ in a complex space of higher
dimension. For every embedded component there exists $d$ and an isolated
component $\dYd$ of $\dId$ projecting onto $Y$. In turn, $\dYd$ can be
discovered by existing methods for prime decomposition, in particular, the {\em
numerical irreducible decomposition}, applied to $\dXd$.
  The concept of NPD gives a full description of the scheme $\Spec(R/I)$ by
representing each component with a {\em witness set}. We propose an algorithm
to produce a collection of witness sets that contains a NPD and that can be
used to solve the {\em ideal membership problem} for $I$.
","[{""version"":""v1"",""created"":""Sun, 20 Jan 2008 20:25:17 GMT""},{""version"":""v2"",""created"":""Thu, 29 May 2008 21:23:50 GMT""}]","2008-05-30"
"0801.3106","Javad Shabani","J. Shabani, M. Shayegan and R. Winkler","Strain-induced Fermi contour anisotropy of GaAs 2D holes","Accepted for publication in Phys. Rev. Lett","Phys. Rev. Lett. 100, 096803 (2008)","10.1103/PhysRevLett.100.096803",,"cond-mat.mes-hall",,"  We report measurements of magneto-resistance commensurability peaks, induced
by a square array of anti-dots, in GaAs (311)A two-dimensional holes as a
function of applied in-plane strain. The data directly probe the shapes of the
Fermi contours of the two spin subbands that are split thanks to the spin-orbit
interaction and strain. The experimental results are in quantitative agreement
with the predictions of accurate energy band calculations, and reveal that the
majority spin-subband has a severely distorted Fermi contour whose anisotropy
can be tuned with strain.
","[{""version"":""v1"",""created"":""Sun, 20 Jan 2008 21:35:55 GMT""}]","2009-11-13"
"0801.3107","Vesko Valov","Taras Banakh and Vesko Valov","Approximation by light maps and parametric Lelek maps","34 pages",,,,"math.GT math.GN",,"  The class of metrizable spaces $M$ with the following approximation property
is introduced and investigated: $M\in AP(n,0)$ if for every $\e>0$ and a map
$g\colon\I^n\to M$ there exists a 0-dimensional map $g'\colon\I^n\to M$ which
is $\e$-homotopic to $g$. It is shown that this class has very nice properties.
For example, if $M_i\in AP(n_i,0)$, $i=1,2$, then $M_1\times M_2\in
AP(n_1+n_2,0)$. Moreover, $M\in AP(n,0)$ if and only if each point of $M$ has a
local base of neighborhoods $U$ with $U\in AP(n,0)$. Using the properties of
AP(n,0)-spaces, we generalize some results of Levin and Kato-Matsuhashi
concerning the existence of residual sets of $n$-dimensional Lelek maps.
","[{""version"":""v1"",""created"":""Sun, 20 Jan 2008 22:11:52 GMT""}]","2008-01-22"
"0801.3108","Svjetlana Terzic","Victor M. Buchstaber, Svjetlana Terzic","Equivariant complex structures on homogeneous spaces and their cobordism
  classes","30 pages; this is the extension of arXiv:0708.2054v2 [math.AT] with
  an application to some new problems",,,,"math.AT math.AG",,"  We consider compact homogeneous spaces G/H, where G is a compact connected
Lie group and H is its closed connected subgroup of maximal rank. The aim of
this paper is to provide an effective computation of the universal toric genus
for the complex, almost complex and stable complex structures which are
invariant under the canonical left action of the maximal torus T^k on G/H. As
it is known, on G/H we may have many such structures and the computations of
their toric genus in terms of fixed points for the same torus action give the
constraints on possible collections of weights for the corresponding
representations of T^k in the tangent spaces at the fixed points, as well as on
the signs at these points. In that context, the effectiveness is also
approached due to an explicit description of the relations between the weights
and signs for an arbitrary couple of such structures. Special attention is
devoted to the structures which are invariant under the canonical action of the
group G. Using classical results, we obtain an explicit description of the
weights and signs in this case. We consequently obtain an expression for the
cobordism classes of such structures in terms of coefficients of the formal
group law in cobordisms, as well as in terms of Chern numbers in cohomology.
These computations require no information on the cohomology ring of the
manifold G/H, but, on their own, give important relations in this ring. As an
application we provide an explicit formula for the cobordism classes and
characteristic numbers of the flag manifolds U(n)/T^n, Grassmann manifolds
G_{n,k}=U(n)/(U(k)\times U(n-k)) and some particular interesting examples.
","[{""version"":""v1"",""created"":""Sun, 20 Jan 2008 23:23:46 GMT""}]","2008-01-22"
"0801.3109","Pietro Peterlongo","Stefano Galatolo, Pietro Peterlongo","Long hitting time, slow decay of correlations and arithmetical
  properties","19 pages, in the new version some misprint and small errors are
  corrected",,,,"math.DS math.NT","http://arxiv.org/licenses/nonexclusive-distrib/1.0/","  Let $\tau_r(x,x_0)$ be the time needed for a point $x$ to enter for the first
time in a ball $B_r(x_0)$ centered in $x_0$, with small radius $r$. We
construct a class of translations on the two torus having particular arithmetic
properties (Liouville components with intertwined denominators of convergents)
not satisfying a logarithm law, i.e. such that for generic $x,x_0$
\liminf_{r\to 0} \frac{\log \tau_r(x,x_0)}{-\log r} = \infty.
  By considering a suitable reparametrization of the flow generated by a
suspension of this translation, using a previous construction by Fayad, we show
the existence of a mixing system on three torus having the same properties. The
speed of mixing of this example must be subpolynomial, because we also show
that: in a system having polynomial decay of correlations the above ratio of
logarithms (which is also called the lower hitting time indicator) is bounded
(it is a function of the local dimension and the speed of correlation decay).
  More generally, this shows that reparametrizations of torus translations
having a Liouville component cannot be polynomially mixing.
","[{""version"":""v1"",""created"":""Sun, 20 Jan 2008 23:58:35 GMT""},{""version"":""v2"",""created"":""Sun, 30 Mar 2008 14:41:51 GMT""},{""version"":""v3"",""created"":""Wed, 11 Mar 2009 21:08:55 GMT""},{""version"":""v4"",""created"":""Mon, 23 Mar 2009 10:52:15 GMT""},{""version"":""v5"",""created"":""Tue, 14 Jul 2009 14:07:39 GMT""}]","2009-07-14"
"0801.3110","Daniela Henzlova","D. Henzlova, K.-H. Schmidt, M. V. Ricciardi, A. Kelic, V. Henzl, P.
  Napolitani, L. Audouin, J. Benlliure, A. Boudard, E. Casarejos, J. E. Ducret,
  T. Enqvist, A. Heinz, A. Junghans, B. Jurado, A. Krasa, T. Kurtukian, S.
  Leray, M. F. Ordonez, J. Pereira, R. Pleskac, F. Rejmund, C. Schmitt, C.
  Stephan, L. Tassan-Got, C. Villagrasa, C. Volant, A. Wagner and O. Yordanov","Experimental investigation of the residues produced in the 136Xe+Pb and
  124Xe+Pb fragmentation reactions at 1 A GeV","31 pages, 9 figures, 1 table, background information on
  http://www.gsi.de/charms",,"10.1103/PhysRevC.78.044616",,"nucl-ex",,"  This paper presents the nuclide cross sections and the longitudinal velocity
distributions of residues produced in the reactions of 136Xe and 124Xe at 1 A
GeV in a lead target, measured at the high-resolution magnetic spectrometer,
the Fragment Separator (FRS) of GSI. The data cover a broad range of isotopes
of the elements between Z = 3 and Z = 56 for 136Xe and between Z = 5 and Z = 55
for 124Xe, reaching down to cross sections of a few microbarns. The velocity
distributions exhibit a Gaussian shape for masses above A = 20, while more
complex behaviour is observed for lighter masses. The isotopic distributions
for both reactions preserve a memory on the projectile N/Z ratio over the whole
residue mass range.
","[{""version"":""v1"",""created"":""Mon, 21 Jan 2008 15:24:04 GMT""}]","2009-11-13"
