"0801.3174","Kavita Ramanan","Kavita Ramanan, Martin I. Reiman","The heavy traffic limit of an unbalanced generalized processor sharing
  model","Published in at http://dx.doi.org/10.1214/07-AAP438 the Annals of
  Applied Probability (http://www.imstat.org/aap/) by the Institute of
  Mathematical Statistics (http://www.imstat.org)","Annals of Applied Probability 2008, Vol. 18, No. 1, 22-58","10.1214/07-AAP438","IMS-AAP-AAP438","math.PR",,"  This work considers a server that processes $J$ classes using the generalized
processor sharing discipline with base weight vector $\alpha=(\alpha
_1,...,\alpha_J)$ and redistribution weight vector
$\beta=(\beta_1,...,\beta_J)$. The invariant manifold $\mathcal{M}$ of the
so-called fluid limit associated with this model is shown to have the form
$\mathcal{M}=\{x\in\mathbb{R}_+^J:x_j=0 for j\in\mathcal{S}\}$, where
$\mathcal{S}$ is the set of strictly subcritical classes, which is identified
explicitly in terms of the vectors $\alpha$ and $\beta$ and the long-run
average work arrival rates $\gamma_j$ of each class $j$. In addition, under
general assumptions, it is shown that when the heavy traffic condition
$\sum_{j=1}^J\gamma_j=\sum_{j=1}^J\alpha_j$ holds, the functional central limit
of the scaled unfinished work process is a reflected diffusion process that
lies in $\mathcal{M}$. The reflected diffusion limit is characterized by the
so-called extended Skorokhod map and may fail to be a semimartingale. This
generalizes earlier results obtained for the simpler, balanced case where
$\gamma_j=\alpha_j$ for $j=1,...,J$, in which case $\mathcal{M}=\mathbb{R}_+^J$
and there is no state-space collapse. Standard techniques for obtaining
diffusion approximations cannot be applied in the unbalanced case due to the
particular structure of the GPS model. Along the way, this work also
establishes a comparison principle for solutions to the extended Skorokhod map
associated with this model, which may be of independent interest.
","[{""version"":""v1"",""created"":""Mon, 21 Jan 2008 11:13:40 GMT""}]","2008-01-28"
"0801.3175","Antonino Paolo Milone dr","Giampaolo Piotto","Multiple Stellar Populations in Galactic GCs: Observational Evidence","Invited talk given at the Cefalu' 2007 Workshop ""XXI Century
  Challenges for Stellar Evolution"". To appear in Memorie della Societa'
  Astronomica Italiana, vol. 79/2, eds. S. Cassisi & M. Salaris",,,,"astro-ph",,"  An increasing number of photometric observations of multiple stellar
populations in Galactic globular clusters is seriously challenging the paradigm
of GCs hosting single, simple stellar populations. These multiple populations
manifest themselves in a split of some evolutionary sequences of the cluster
color-magnitude diagrams. In this paper we will summarize the observational
scenario.
","[{""version"":""v1"",""created"":""Mon, 21 Jan 2008 11:53:32 GMT""}]","2008-01-22"
"0801.3176","David Loeffler","David Loeffler","Explicit calculations of automorphic forms for definite unitary groups","This version fixes an error pointed out by my PhD examiners -- the
  previous version cited a form of Ramanujan's conjecture which is in fact
  false. Accompanying computer programs available from
  http://www.ma.ic.ac.uk/~dl505/","LMS J. Comput. Math 11 (2008), 326-342","10.1112/S1461157000000620",,"math.NT","http://arxiv.org/licenses/nonexclusive-distrib/1.0/","  I give an algorithm for computing the full space of automorphic forms for
definite unitary groups over Q, and apply this to calculate the automorphic
forms of level $G(Z-hat)$ and various small weights for an example of a rank 3
unitary group. This leads to some examples of various types of endoscopic
lifting from automorphic forms for U_1 x U_1 x U_1 and U_1 x U_2, and to an
example of a non-endoscopic form of weight (3,3) corresponding to a family of
3-dimensional irreducible l-adic Galois representations. I also compute the
2-adic slopes of some automorphic forms with level structure at 2, giving
evidence for the local constancy of the slopes.
","[{""version"":""v1"",""created"":""Mon, 21 Jan 2008 11:56:43 GMT""},{""version"":""v2"",""created"":""Tue, 12 Aug 2008 16:25:12 GMT""},{""version"":""v3"",""created"":""Mon, 3 Nov 2008 17:08:04 GMT""}]","2011-04-19"
"0801.3177","Antonino Paolo Milone dr","A. P. Milone, G. Piotto, L. R. Bedin, and A. Sarajedini","Photometric binaries in fifty Globular Clusters","Contribution talk given at the Cefalu' 2007 Workshop ""XXI Century
  Challenges for Stellar Evolution"". To appear in Memorie della Societa'
  Astronomica Italiana, vol. 79/2, eds. S. Cassisi & M. Salaris",,,,"astro-ph",,"  The HST/ACS Survey of Galactic globular clusters (GGCs) is a HST Treasury
project aimed at obtaining high precision photometry in a large sample of
globular clusters. The homogeneous photometric catalogs that has been obtained
from these data by Anderson et al. (2008) represents a golden mine for a lot of
astrophysical studies.
  In this paper we used the catalog to analyse the properties of MS-MS binary
systems from a sample of fifty GGCs. We measured the fraction of binaries
(divided in different groups), studied their radial distribution and
constrained the mass ratio distribution. We investigated possible relations
between the fraction of binaries and the main parameters of their host GGCs.
  We found a significant anti-correlation between the binary fraction in a
cluster and its absolute luminosity (mass).
","[{""version"":""v1"",""created"":""Mon, 21 Jan 2008 12:26:35 GMT""}]","2008-01-22"
"0801.3178","Anton Evseev","Anton Evseev","Conjugacy classes in parabolic subgroups of general linear groups","with an appendix by Anton Evseev and George Wellen; 30 pages",,,,"math.GR",,"  We prove a formula connecting the number of unipotent conjugacy classes in a
maximal parabolic subgroup of a finite general linear group with the numbers of
unipotent conjugacy classes in various parabolic subgroups in smaller
dimensions. We generalise this formula and deduce a number of corollaries; in
particular, we express the number of conjugacy classes of unitriangular
matrices over a finite field in terms of the numbers of unipotent conjugacy
classes in maximal parabolic subgroups over the same field. We show how the
numbers of unipotent conjugacy classes in parabolic subgroups of small
dimensions may be calculated.
","[{""version"":""v1"",""created"":""Mon, 21 Jan 2008 12:42:55 GMT""}]","2008-01-22"
"0801.3179","Sergei Sakovich","Sergei Sakovich","On integrability of the vector short pulse equation","10 pages","J. Phys. Soc. Jpn. 77 (2008) 123001 (4 pages)","10.1143/JPSJ.77.123001",,"nlin.SI math-ph math.AP math.MP physics.optics","http://arxiv.org/licenses/nonexclusive-distrib/1.0/","  Using the Painleve analysis preceded by appropriate transformations of
nonlinear systems under investigation, we discover two new cases in which the
Pietrzyk-Kanattsikov-Bandelow vector short pulse equation must be integrable
due to the results of the Painleve test. Those cases are technologically
important because they correspond to the propagation of polarized ultra-short
light pulses in usual isotropic silica optical fibers.
","[{""version"":""v1"",""created"":""Mon, 21 Jan 2008 12:53:41 GMT""},{""version"":""v2"",""created"":""Fri, 8 Aug 2008 09:02:57 GMT""}]","2008-11-25"
"0801.3180","A. K. Chaudhuri","A. K. Chaudhuri","Viscous fluid dynamics in Au+Au collisions at RHIC","40 pages, 31 figures. In the revised version two figures (Fig.8 and
  9) are added showing that Israel-Stewart's relaxation equation is a good
  approximation of the kinetic theory relaxation equation",,,,"nucl-th","http://arxiv.org/licenses/nonexclusive-distrib/1.0/","  We have studied the space-time evolution of minimally viscous
($\frac{\eta}{s}$=0.08) QGP fluid, undergoing boost-invariant longitudinal
motion and arbitrary transverse expansion. Relaxation equations for the shear
stress tensor components, derived from the phenomenological Israel-Stewart's
theory of dissipative relativistic fluid, are solved simultaneously with the
energy-momentum conservation equations. Comparison of evolution of ideal and
viscous fluid, both initialized under the similar conditions, e.g. same
equilibration time, energy density and velocity profile, indicate that in
viscous fluid, energy density or temperature of the fluid evolve slowly than in
an ideal fluid. Transverse expansion is also more in viscous evolution. We have
also studied particle production in viscous dynamics. Compared to ideal
dynamics, in viscous dynamics, particle yield at high $p_T$ is increased.
Elliptic flow on the other hand decreases. Minimally viscous QGP fluid,
initialized at entropy density $s_{ini}$=110 $fm^{-3}$ at the initial time
$\tau_i$=0.6 fm, if freeze-out at temperature $T_F$=130 MeV, explains the
centrality dependence of $p_T$ spectra of identified particles. Experimental
$p_T$ spectra of $\pi^-$, $K^+$ and protons in 0-5%, 5-10%, 10-20%, 20-30%,
30-40% and 40-50% Au+Au collisions are well reproduced through out the
experimental $p_T$ range. This is in contrast to ideal dynamics, where, the
spectra are reproduced only up to $p_T\approx$1.5 GeV. Minimally viscous QGP
fluid, also explain the elliptic flow in mid-central (10-20%, 16-23%, 20-30%)
collisions. The minimum bias elliptic flow is also explained. However, the
model under-predict/over-predict the elliptic flow in very central/peripheral
collisions.
","[{""version"":""v1"",""created"":""Mon, 21 Jan 2008 12:57:21 GMT""},{""version"":""v2"",""created"":""Wed, 18 Jun 2008 09:14:06 GMT""}]","2008-06-18"
"0801.3181","Boaz Tsaban","Boaz Tsaban","SPM Bulletin 23",,,,,"math.GN math.CO math.LO",,"  A surprising number of new results in ""core"" SPM in the last quarter of 2007,
and some other beautiful fundamental results are announced.
","[{""version"":""v1"",""created"":""Mon, 21 Jan 2008 12:59:51 GMT""}]","2008-12-31"
"0801.3182","Ralf Klessen","Ralf S. Klessen (Zentrum fuer Astronomie Heidelberg), Paul C. Clark
  (Zentrum fuer Astronomie Heidelberg), Simon C. O. Glover (Astrophysikalisches
  Institut Potsdam)","Formation of Stellar Clusters and the Importance of Thermodynamics for
  Fragmentation","10 pages, invited review, to appear in Dynamical Evolution of Dense
  Stellar Systems, Proceed. of the IAU Symp. 246 (Capri, Sept. 2007), eds.
  E.Vesperini, M. Giersz, and A. Sills",,"10.1017/S1743921308015196",,"astro-ph",,"  We discuss results from numerical simulations of star cluster formation in
the turbulent interstellar medium (ISM). The thermodynamic behavior of the
star-forming gas plays a crucial role in fragmentation and determines the
stellar mass function as well as the dynamic properties of the nascent stellar
cluster. This holds for star formation in molecular clouds in the solar
neighborhood as well as for the formation of the very first stars in the early
universe. The thermodynamic state of the ISM is a result of the balance between
heating and cooling processes, which in turn are determined by atomic and
molecular physics and by chemical abundances. Features in the effective
equation of state of the gas, such as a transition from a cooling to a heating
regime, define a characteristic mass scale for fragmentation and so set the
peak of the initial mass function of stars (IMF). As it is based on fundamental
physical quantities and constants, this is an attractive approach to explain
the apparent universality of the IMF in the solar neighborhood as well as the
transition from purely primordial high-mass star formation to the more normal
low-mass mode observed today.
","[{""version"":""v1"",""created"":""Mon, 21 Jan 2008 13:02:56 GMT""}]","2015-05-13"
"0801.3183","Shay M Rappaport","S.M. Rappaport, S. Medalion and Y. Rabin","Curvature Distribution of Worm-like Chains in Two and Three Dimensions",,,,,"cond-mat.soft",,"  Bending of worm-like polymers carries an energy penalty which results in the
appearance of a persistence length l such that the polymer is straight on
length scales smaller than l and bends only on length scales larger than this
length. Intuitively, this leads us to expect that the most probable value of
the local curvature of a worm-like polymer undergoing thermal fluctuations in a
solvent, is zero. We use simple geometric arguments and Monte Carlo simulations
to show that while this expectation is indeed true for polymers on surfaces (in
two dimensions), in three dimensions the probability of observing zero
curvature anywhere along the worm-like chain, vanishes.
","[{""version"":""v1"",""created"":""Mon, 21 Jan 2008 13:10:48 GMT""}]","2008-01-22"
"0801.3184","Aidan Sudbury","Aidan Sudbury","The expected duration of random sequential adsorption","Published in at http://dx.doi.org/10.1214/07-AAP445 the Annals of
  Applied Probability (http://www.imstat.org/aap/) by the Institute of
  Mathematical Statistics (http://www.imstat.org)","Annals of Applied Probability 2008, Vol. 18, No. 1, 100-108","10.1214/07-AAP445","IMS-AAP-AAP445","math.PR",,"  When gas molecules bind to a surface they may do so in such a way that the
adsorption of one molecule inhibits the arrival of others. We consider random
sequential adsorption in which the empty sites of a graph are irreversibly
occupied in random order by a variety of types of ``particles.'' In a finite
region the process terminates when no more particles can arrive. A universal
asymptotic formula for the mean duration is given.
","[{""version"":""v1"",""created"":""Mon, 21 Jan 2008 13:14:02 GMT""}]","2009-09-29"
"0801.3185","Emre Tuna","S. Emre Tuna","Synchronizing continuous-time neutrally stable linear systems via
  partial-state coupling","15 pages",,,,"math.OC math.DS",,"  Synchronization of coupled continuous-time linear systems is studied in a
general setting. For identical neutrally-stable linear systems that are
detectable from their outputs, it is shown that a linear output feedback law
exists under which the coupled systems globally asymptotically synchronize
under all fixed (directed) connected network topologies. An algorithm is
provided to compute one such feedback law based on individual system
parameters. The dual case, where individual systems are neutrally stable and
stabilizable from their inputs, is also considered and parallel results are
established.
","[{""version"":""v1"",""created"":""Mon, 21 Jan 2008 13:18:26 GMT""}]","2008-01-22"
"0801.3186","Chang Hyun Baek","Chang Hyun Baek (1, 2), Takahiro Kudoh (2,3) and Kohji Tomisaka (2,3)
  ((1) Astrophysical Research Center for the Structure and Evolution of the
  Cosmos (ARCSEC), Sejong University (2) National Astronomical Observatory of
  Japan, (3) Department of Astronomical Science, The Graduate University for
  Advanced Studies (SOKENDAI))","How was the mushroom-shaped GW 123.4--1.5 formed in the Galactic disk?","Revised the manuscript and added references, 23 pages with 9 figures","Astrophys.J. 682 (2008) 434-444","10.1086/589556",,"astro-ph","http://arxiv.org/licenses/nonexclusive-distrib/1.0/","  The unusual mushroom-shaped HI cloud, GW 123.4--1.5, is hundreds of parsecs
in size but does not show any correlations to HI shells or chimney structures.
To investigate the origin and velocity structure of GW 123.4--1.5, we perform
three-dimensional hydrodynamical simulations of the collision of a
high-velocity cloud with the Galactic disk. We also perform a parameter study
of the density, radius, and incident angle of the impact cloud. The numerical
experiments indicate that we reproduce the mushroom-shaped structure which
resembles GW 123.4--1.5 in shape, size, position-velocity across the cap of the
mushroom, and the density ratio between the mushroom and surrounding gas. GW
123.4--1.5 is expected to be formed by the almost head-on collision of a HVC
with velocity $\sim 100 \kms$ and mass $\sim 10^5 \Msun$ about $5 \times 10^7
\yr$ ago. A mushroom-shaped structure like GW 123.4--1.5 must be infrequent on
the Galactic plane, because the head-on collision which explains the mushroom
structure seems rare for observed HVCs. HVC-disk collision explains not only
the origin of the mushroom-shaped structure but also the formation of a variety
of structures like shells, loops, and vertical structures in our Galaxy.
","[{""version"":""v1"",""created"":""Mon, 21 Jan 2008 13:56:34 GMT""},{""version"":""v2"",""created"":""Mon, 21 Jul 2008 12:25:27 GMT""}]","2008-07-21"
"0801.3187","Thomas Wiegelmann","T. Wiegelmann, K. Schindler, T. Neukirch","Helmet Streamers with Triple Structures: Simulations of resistive
  dynamics","17 pages, 6 figures","Solar Phys.191:391-407,2000","10.1023/A:1005226213819",,"astro-ph",,"  Recent observations of the solar corona with the LASCO coronagraph on board
of the SOHO spacecraft have revealed the occurrence of triple helmet streamers
even during solar minimum, which occasionally go unstable and give rise to
large coronal mass ejections. There are also indications that the slow solar
wind is either a combination of a quasi-stationary flow and a highly
fluctuating component or may even be caused completely by many small eruptions
or instabilities. As a first step we recently presented an analytical method to
calculate simple two-dimensional stationary models of triple helmet streamer
configurations. In the present contribution we use the equations of time-
dependent resistive magnetohydrodynamics to investigate the stability and the
dynamical behaviour of these configurations. We particularly focus on the
possible differences between the dynamics of single isolated streamers and
triple streamers and on the way in which magnetic reconnection initiates both
small scale and large scale dynamical behaviour of the streamers. Our results
indicate that small eruptions at the helmet streamer cusp may incessantly
accelerate small amounts of plasma without significant changes of the
equilibrium configuration and might thus contribute to the non-stationary slow
solar wind. On larger time and length scales, large coronal eruptions can occur
as a consequence of large scale magnetic reconnection events inside the
streamer configuration. Our results also show that triple streamers are usually
more stable than a single streamer.
","[{""version"":""v1"",""created"":""Mon, 21 Jan 2008 13:40:44 GMT""}]","2015-05-13"
"0801.3188","O-Kab Kwon","Akira Ishida, Yoonbai Kim, Chanju Kim, O-Kab Kwon","Lower Dimensional Branes in Boundary Conformal Field Theory","5 pages","J.KoreanPhys.Soc.50:S36-S40,2007",,,"hep-th",,"  In the presence of constant background electromagnetic fields, we discuss
three types of exactly marginal boundary tachyon operators for static kinks in
boundary conformal field theory. Functional forms of three operators are
hyperbolic sine, hyperbolic cosine, and exponential types, and they describe
codimension-one solitons when the transverse electric field has overcritical
value. The energy-momentum tensor and the source for antisymmetric tensor field
are computed in the path integral approach for the exponential-type tachyon
vertex operator.
","[{""version"":""v1"",""created"":""Mon, 21 Jan 2008 15:33:21 GMT""}]","2008-11-26"
"0801.3189","Christian Jansson","Christian Jansson","A classical interpretation of quantum mechanics and the measurement
  problem",,,,,"quant-ph",,"  In this paper a didactic approach is described which immediately leads to an
understanding of those postulates of quantum mechanics used most frequently in
quantum computation. Moreover, an interpretation of quantum mechanics is
presented which is motivated by retaining the point of view of classical
mechanics as much as possible, and which is consistent with relativity theory.
Everything can be written down in terms of well-known mathematical formulations
that can be found in every textbook about quantum mechanics. Therefore, in this
version, almost no formulas are used.
","[{""version"":""v1"",""created"":""Mon, 21 Jan 2008 13:42:16 GMT""}]","2008-01-22"
"0801.3190","Raul de Diego","R. de Diego, E. Garrido, A.S. Jensen and D.V. Fedorov","Cluster sum rules for three-body systems with angular-momentum dependent
  interactions","11 pages, 3 figures, 2 tables","Phys.Rev.C77:024001,2008","10.1103/PhysRevC.77.024001",,"nucl-th",,"  We derive general expressions for non-energy weighted and energy-weighted
cluster sum rules for systems of three charged particles. The interferences
between pairs of particles are found to play a substantial role. The
energy-weighted sum rule is usually determined by the kinetic energy operator,
but we demonstrate that it has similar additional contributions from the
angular momentum and parity dependence of two- and three-body potentials
frequently used in three-body calculations. The importance of the different
contributions is illustrated with the dipole excitations in $^6$He. The results
are compared with the available experimental data.
","[{""version"":""v1"",""created"":""Mon, 21 Jan 2008 13:47:09 GMT""}]","2008-11-26"
"0801.3191","Xin Guo","Xin Guo, Yan Zeng","Intensity process and compensator: A new filtration expansion approach
  and the Jeulin--Yor theorem","Published in at http://dx.doi.org/10.1214/07-AAP447 the Annals of
  Applied Probability (http://www.imstat.org/aap/) by the Institute of
  Mathematical Statistics (http://www.imstat.org)","Annals of Applied Probability 2008, Vol. 18, No. 1, 120-142","10.1214/07-AAP447","IMS-AAP-AAP447","math.PR q-fin.RM",,"  Let $(X_t)_{t\ge0}$ be a continuous-time, time-homogeneous strong Markov
process with possible jumps and let $\tau$ be its first hitting time of a Borel
subset of the state space. Suppose $X$ is sampled at random times and suppose
also that $X$ has not hit the Borel set by time $t$. What is the intensity
process of $\tau$ based on this information? This question from credit risk
encompasses basic mathematical problems concerning the existence of an
intensity process and filtration expansions, as well as some conceptual issues
for credit risk. By revisiting and extending the famous Jeulin--Yor [Lecture
Notes in Math. 649 (1978) 78--97] result regarding compensators under a general
filtration expansion framework, a novel computation methodology for the
intensity process of a stopping time is proposed. En route, an analogous
characterization result for martingales of Jacod and Skorohod [Lecture Notes in
Math. 1583 (1994) 21--35] under local jumping filtration is derived.
","[{""version"":""v1"",""created"":""Mon, 21 Jan 2008 14:59:08 GMT""}]","2008-12-02"
"0801.3192","J. Miguel Mas-Hesse","J. M. Mas-Hesse, H. Oti-Floranes and M. Cervi\~no","Soft X-ray to Far Infrared luminosities ratio in star-forming galaxies","8 pages, 6 figures. Accepted by Astronomy and Astrophysics. New
  version including language style revision and 3 new references",,,,"astro-ph",,"  A good correlation has been found in star-forming galaxies between the soft
X-ray and the far infrared or radio luminosities. In this work we analyze the
relation between the soft X-ray and far infrared luminosities as predicted by
evolutionary population synthesis models, aiming first to test the validity of
the soft X-ray luminosity as a star formation rate estimator, using the already
known calibration of the FIR luminosity as a proxy, and second proposing a
calibration based on the predictions of evolutionary synthesis models. We have
computed the soft X-ray and far infrared luminosities expected for a massive
starburst as a function of evolutionary state, efficiency of the conversion of
mechanical energy into soft X-ray luminosity, star formation regime
(instantaneous or extended) and dust abundance, and have compared the
predictions with observational values for a sample of 62 star-forming galaxies
taken from the literature. The observational Lsoftx/Lfir ratios are consistent
with the predictions by the models under realistic assumptions (young
starbursts, efficiency in the re-processing of mechanical energy of few
percent), confirming the direct relation of the diffuse soft X-ray emission
with the star formation episode. The soft X-ray emission of the diffuse,
extended gas surrounding massive star forming regions can be used as a Star
Formation Rate estimator. The empirical calibrations presented in the
literature are supported by the predictions of evolutionary synthesis models
and by the analysis of a larger sample of star-forming galaxies, but it is
biased towards galaxies dominated by relatively unevolved starbursts.
","[{""version"":""v1"",""created"":""Mon, 21 Jan 2008 15:00:00 GMT""},{""version"":""v2"",""created"":""Thu, 13 Mar 2008 16:19:55 GMT""}]","2008-03-13"
"0801.3193","Nicola Zurlo","N.Zurlo, M.Amoretti, C.Amsler, G.Bonomi, C.Carraro, C.L.Cesar,
  M.Charlton, M.Doser, A.Fontana, R.Funakoshi, P.Genova, R.S.Hayano,
  L.V.Jorgensen, A.Kellerbauer, V.Lagomarsino, R.Landua, E.Lodi Rizzini,
  M.Macri', N.Madsen, G.Manuzio, D.Mitchard, P.Montagna, L.G.Posada, H.Pruys,
  C.Regenfus, A.Rotondi, G.Testera, D.P.Van der Werf, A.Variola, L.Venturelli
  and Y.Yamazaki","Production of Slow Protonium in Vacuum","9 pages with 5 figures and 1 table. Proceedings of the 4th
  International Conference on Trapped Charged Particles and Fundamental Physics
  (TCP 06), published in Hyperfine Interactions","Hyperfine Interact.172:97-105,2006","10.1007/s10751-007-9529-0",,"hep-ex",,"  We describe how protonium, the quasi-stable antiproton-proton bound system,
has been synthesized following the interaction of antiprotons with the
molecular ion H$_2^+$ in a nested Penning trap environment. From a careful
analysis of the spatial distributions of antiproton annihilation events in the
ATHENA experiment, evidence is presented for protonium production with sub-eV
kinetic energies in states around $n$ = 70, with low angular momenta. This work
provides a new 2-body system for study using laser spectroscopic techniques.
","[{""version"":""v1"",""created"":""Mon, 21 Jan 2008 14:45:38 GMT""}]","2010-01-28"
