"0801.3132","Changzheng Yuan","Yuan Chang-Zheng","Study of Charmonium(-like) States via ISR at Belle","Talk given at the BES-Belle-CLEO-BaBar Joint Workshop on Charm
  Physics, Beijing, Chnia, November 26-27, 2007",,,,"hep-ex",,"  The cross sections for e+e- to pi+pi-J/psi, pi+pi-psi(2S), K+K-J/psi, DDbar,
DDbar pi, D*Dbar, and D*D*bar are measured using data sample collected on or
near the Upsilon(4S) resonance with the Belle detector at KEKB. A peak near
4.25 GeV/c^2, corresponding to the so called Y(4260), is observed in
pi+pi-J/psi final state. In addition, there is another cluster of events at
around 4.05 GeV/c^2. Two resonant structures are observed in the pi+pi-psi(2S)
invariant mass distribution, one at 4361+-9+-9 MeV/c^2 with a width of
74+-15+-10 MeV/c^2, and another at 4664+-11+-5 MeV/c^2 with a width of
48+-15+-3 MeV/c^2. The rich structures observed in all these final states
indicate that our understanding of the vector charmonium states above the open
charm threshold is still poor, let alone the other possible dynamics such as
charmonium hybrids or final state re-scattering and so on.
","[{""version"":""v1"",""created"":""Mon, 21 Jan 2008 06:16:59 GMT""}]","2008-01-22"
"0801.3133","Mordehai Milgrom","Mordehai Milgrom (Weizmann Institute)","The MOND paradigm","26 pages, 8 figures. Talk presented at the XIX Rencontres de Blois
  ""Matter and energy in the Universe: from nucleosynthesis to cosmology"", May
  2007",,,,"astro-ph gr-qc hep-ph",,"  I review briefly different aspects of the MOND paradigm, with emphasis on
phenomenology, epitomized here by many MOND laws of galactic motion--analogous
to Kepler's laws of planetary motion. I then comment on the possible roots of
MOND in cosmology, possibly the deepest and most far reaching aspect of MOND.
This is followed by a succinct account of existing underlying theories. I also
reflect on the implications of MOND's successes for the dark matter (DM)
paradigm: MOND predictions imply that baryons alone accurately determine the
full field of each and every individual galactic object. This conflicts with
the expectations in the DM paradigm because of the haphazard formation and
evolution of galactic objects and the very different influences that baryons
and DM are subject to during the evolution, as evidenced, e.g., by the very
small baryon-to-DM fraction in galaxies (compared with the cosmic value). All
this should disabuse DM advocates of the thought that DM will someday be able
to reproduce MOND: It is inconceivable that the modicum of baryons left over in
galaxies can be made to determine everything if a much heavier DM component is
present.
","[{""version"":""v1"",""created"":""Mon, 21 Jan 2008 06:20:23 GMT""},{""version"":""v2"",""created"":""Mon, 3 Mar 2008 10:42:26 GMT""}]","2008-03-10"
"0801.3134","Subir Ghosh","Subir Ghosh (Indian Statistical Institute, India)","Comment on Magnetic Monopole Excitations in Spin Ice","4 pages, laTex",,,,"cond-mat.str-el hep-th quant-ph",,"  It has been proposed recently \cite{son} that excitations in Spin Ice can be
of the form of magnetic monopoles that does not obey the Dirac Quantization
Condition. It is also well known \cite{rj} that the above scenario leads to
non-associativity among translation generators. It will be interesting to see
how the monopole picture in Spin Ice survives in the light of the latter
observation.
","[{""version"":""v1"",""created"":""Mon, 21 Jan 2008 06:36:10 GMT""}]","2008-01-24"
"0801.3135","Shuai Wang","Shuai Wang, Yuan Xu, Ke Xia","First principles study on the spin transfer torques","10 pages,10 figures",,,,"cond-mat.mes-hall cond-mat.mtrl-sci",,"  An efficient first principles method was developed to calculate spin transfer
torques in layered system with noncollinear magnetization. The complete
scattering wave function is determined by matching the wave function in the
scattering region with the Bloch states in the leads. The spin transfer torques
are obtained with aid of the scattering wave function. We applied our method to
the ferromagnetic spin valve and found that the material (Co, Ni and Ni80Fe20)
dependence of the spin transfer torques could be well understood by the Fermi
surface. Ni has much longer spin injection penetration length than Co.
Interfacial disorder is also considered. It is found that the spin transfer
torques could be enhanced by the interfacial disorder in some system.
","[{""version"":""v1"",""created"":""Mon, 21 Jan 2008 06:45:52 GMT""}]","2008-01-22"
"0801.3136","Murat Cetinbas","Murat Cetinbas and Joshua Wilkie","Manifold algorithmic errors in quantum computers with static internal
  imperfections",,"J. Phys. A: Math. Theor. 41 (2008) 065302","10.1088/1751-8113/41/6/065302",,"quant-ph",,"  The inevitable existence of static internal imperfections and residual
interactions in some quantum computer architectures result in internal
decoherence, dissipation, and destructive unitary shifts of active algorithms.
By exact numerical simulations we determine the relative importance and origin
of these errors for a Josephson charge qubit quantum computer. In particular we
determine that the dynamics of a CNOT gate interacting with its idle
neighboring qubits via native residual coupling behaves much like a perturbed
kicked top in the exponential decay regime, where fidelity decay is only weakly
dependent on perturbation strength. This means that retroactive removal of gate
errors (whether unitary or non-unitary) may not be possible, and that effective
error correction schemes must operate concurrently with the implementation of
subcomponents of the gate.
","[{""version"":""v1"",""created"":""Mon, 21 Jan 2008 06:42:39 GMT""}]","2009-11-13"
"0801.3137","Yusuke Nakamura","Y.Nakamura, M.Mine, M.Okumura, and Y.Yamanaka","Condition for emergence of complex eigenvalues in the Bogoliubov-de
  Gennes equations","7pages","Phys. Rev. A 77, 043601 (2008)","10.1103/PhysRevA.77.043601",,"cond-mat.other",,"  The condition for the appearance of dynamical instability of the
Bose-condensed system, characterized by the emergence of complex eigenvalues in
the Bogoliubov-de Gennes equations, is studied analytically. We perturbatively
expand both the Gross-Pitaevskii and Bogoliubov-de Gennes equations with
respect to the coupling constant. It is concluded that the degeneracy between a
positive-norm eigenmode and a negative-norm one is essential for the emergence
of complex modes. Based on the conclusion, we justify the two-mode
approximation applied in our previous work [E. Fukuyama \textit{et al}., Phys.
Rev. A {\bf 76}, 043608 (2007)], in which we analytically studied the condition
for the existence of complex modes when the condensate has a highly quantized
vortex.
","[{""version"":""v1"",""created"":""Mon, 21 Jan 2008 07:10:52 GMT""},{""version"":""v2"",""created"":""Fri, 4 Apr 2008 05:44:12 GMT""}]","2008-04-04"
"0801.3138","Masanori Sato","Masanori Sato","Single photon Michelson-Morley experiment via de Broglie-Bohm picture:
  An interpretation based on the hypothesis of frame dragging","9 pages, 6 figures",,,,"physics.gen-ph",,"  The Michelson-Morley experiment is considered via a single photon
interferometer and a hypothesis of the dragging of the permittivity of free
space and permeability of free space. The Michelson-Morley experimental results
can be interpreted using de Broglie-Bohm picture. In the global positioning
system (GPS) experiment, isotropic constancy of the speed of light, c, was
confirmed by direct one way measurement. That is, Michelson-Morley experiments
without interference are confirmed every day; therefore the hypothesis of frame
dragging is a suitable explanation of the Michelson-Morley experimental
results.
","[{""version"":""v1"",""created"":""Mon, 21 Jan 2008 07:11:23 GMT""},{""version"":""v2"",""created"":""Thu, 28 Feb 2008 08:35:36 GMT""}]","2008-02-28"
"0801.3139","Refik Inanc Baykur","R. Inanc Baykur","Existence of broken Lefschetz fibrations","11 pages, 5 figures. Remark 3.4 is updated, and an example of a
  broken Lefschetz fibration on the complex projective plane is added",,,,"math.GT math.SG",,"  We prove that every closed oriented smooth 4-manifold X admits a broken
Lefschetz fibration (aka singular Lefschetz fibration) over the 2-sphere. Given
any closed orientable surface F of square zero in X, we can choose the
fibration so that F is a fiber. Moreover, we can arrange it so that there is
only one Lefschetz critical point when the Euler characteristic e(X) is odd,
and none when e(X) is even. We make use of topological modifications of smooth
maps with fold and cusp singularities due to Saeki and Levine, and thus we get
alternative proofs of previous existence results. Also shown is the existence
of broken Lefschetz pencils with connected fibers on any near-symplectic
4-manifold.
","[{""version"":""v1"",""created"":""Mon, 21 Jan 2008 07:13:06 GMT""},{""version"":""v2"",""created"":""Tue, 12 Feb 2008 01:31:41 GMT""}]","2008-02-12"
"0801.3140","Martin Veselsky","M. Veselsky, A.L. Keksis, G.A. Souliotis, K. Wang, E. Bell, D.V.
  Shetty, M. Jandel, S.J. Yennello, Y.G. Ma","Statistical and dynamical aspects in the decay of hot neutron-rich
  nuclei","LaTeX, article expanded, 2 figures added, 17 pages, 7 figures","Nucl.Phys.A837:163-175,2010; Int.J.Mod.Phys.E19:1559-1569,2010","10.1016/j.nuclphysa.2010.02.013 10.1142/S0218301310015965",,"nucl-ex","http://arxiv.org/licenses/nonexclusive-distrib/1.0/","  The signal of isospin-asymmetric phase transition in the evolution of the
chemical potential was observed for hot quasi-projectiles produced in the
reactions 40,48Ca + 27Al confirming an analogous observation in the lighter
system 28Si + 112,124Sn. With increasing mass, the properties of hot
quasi-projectiles become increasingly influenced by the secondary emission.
Thermodynamical observables exhibit no sensitivity to the different number of
missing neutrons in the two reactions 40,48Ca + 27Al, thus providing a signal
of dynamical emission of neutrons, which can be related to formation of a very
neutron-rich low-density region (neck) between the projectile and target.
","[{""version"":""v1"",""created"":""Mon, 21 Jan 2008 09:10:13 GMT""},{""version"":""v2"",""created"":""Tue, 29 Jul 2008 10:19:31 GMT""}]","2014-11-18"
"0801.3141","Mark Wilde","Mark M. Wilde and Bart Kosko","Quantum Forbidden-Interval Theorems for Stochastic Resonance","13 pages, 2 figures","Journal of Physics A: Mathematical and Theoretical 42, 465309
  (2009).","10.1088/1751-8113/42/46/465309",,"quant-ph nlin.CD",,"  We extend the classical forbidden-interval theorems for a
stochastic-resonance noise benefit in a nonlinear system to a quantum-optical
communication model and a continuous-variable quantum key distribution model.
Each quantum forbidden-interval theorem gives a necessary and sufficient
condition that determines whether stochastic resonance occurs in quantum
communication of classical messages. The quantum theorems apply to any quantum
noise source that has finite variance or that comes from the family of
infinite-variance alpha-stable probability densities. Simulations show the
noise benefits for the basic quantum communication model and the
continuous-variable quantum key distribution model.
","[{""version"":""v1"",""created"":""Mon, 21 Jan 2008 07:21:56 GMT""}]","2009-10-29"
"0801.3142","Michael Holst","Burak Aksoylu, David Bernstein, Stephen Bond, Michael Holst","Generating Initial Data in General Relativity using Adaptive Finite
  Element Methods","54 pages, 15 figures. Published as LSU CCT Technical Report 2008-09",,,"LSU Center for Computation and Technology (CCT) Technical Report
  2008-09","gr-qc","http://arxiv.org/licenses/nonexclusive-distrib/1.0/","  The conformal formulation of the Einstein constraint equations is first
reviewed, and we then consider the design, analysis, and implementation of
adaptive multilevel finite element-type numerical methods for the resulting
coupled nonlinear elliptic system. We derive weak formulations of the coupled
constraints, and review some new developments in the solution theory for the
constraints in the cases of constant mean extrinsic curvature (CMC) data,
near-CMC data, and arbitrarily prescribed mean extrinsic curvature data. We
then outline some recent results on a priori and a posteriori error estimates
for a broad class of Galerkin-type approximation methods for this system which
includes techniques such as finite element, wavelet, and spectral methods. We
then use these estimates to construct an adaptive finite element method (AFEM)
for solving this system numerically, and outline some new convergence and
optimality results. We then describe in some detail an implementation of the
methods using the FETK software package, which is an adaptive multilevel finite
element code designed to solve nonlinear elliptic and parabolic systems on
Riemannian manifolds. We finish by describing a simplex mesh generation
algorithm for compact binary objects, and then look at a detailed example
showing the use of FETK for numerical solution of the constraints.
","[{""version"":""v1"",""created"":""Mon, 21 Jan 2008 07:23:52 GMT""},{""version"":""v2"",""created"":""Mon, 4 Feb 2008 22:28:01 GMT""},{""version"":""v3"",""created"":""Tue, 7 Apr 2009 14:22:04 GMT""}]","2009-04-07"
"0801.3143","Gregor Pardella","Gregor Pardella and Frauke Liers","Exact Ground States of Large Two-Dimensional Planar Ising Spin Glasses","11 pages, 5 figures; shortened introduction, extended results; to
  appear in Physical Review E 78",,"10.1103/PhysRevE.78.056705",,"cond-mat.dis-nn","http://arxiv.org/licenses/nonexclusive-distrib/1.0/","  Studying spin-glass physics through analyzing their ground-state properties
has a long history. Although there exist polynomial-time algorithms for the
two-dimensional planar case, where the problem of finding ground states is
transformed to a minimum-weight perfect matching problem, the reachable system
sizes have been limited both by the needed CPU time and by memory requirements.
In this work, we present an algorithm for the calculation of exact ground
states for two-dimensional Ising spin glasses with free boundary conditions in
at least one direction. The algorithmic foundations of the method date back to
the work of Kasteleyn from the 1960s for computing the complete partition
function of the Ising model. Using Kasteleyn cities, we calculate exact ground
states for huge two-dimensional planar Ising spin-glass lattices (up to
3000x3000 spins) within reasonable time. According to our knowledge, these are
the largest sizes currently available. Kasteleyn cities were recently also used
by Thomas and Middleton in the context of extended ground states on the torus.
Moreover, they show that the method can also be used for computing ground
states of planar graphs. Furthermore, we point out that the correctness of
heuristically computed ground states can easily be verified. Finally, we
evaluate the solution quality of heuristic variants of the Bieche et al.
approach.
","[{""version"":""v1"",""created"":""Mon, 21 Jan 2008 07:45:49 GMT""},{""version"":""v2"",""created"":""Thu, 31 Jan 2008 13:14:32 GMT""},{""version"":""v3"",""created"":""Tue, 4 Nov 2008 14:39:37 GMT""}]","2009-11-13"
"0801.3144","Tian De Cao","Tian De Cao","Prerequisite for superconductivity: appropriate spin-charge correlations","7pages","Solid State Communications 147 (2008) 4","10.1016/j.ssc.2008.04.033",,"cond-mat.supr-con","http://arxiv.org/licenses/nonexclusive-distrib/1.0/","  This work investigates the relation between superconductivity and
correlations. A simple calculation shows that the appropriate spin-charge
correlation is the key role to any superconductivity, and this calculation is
consistent with the analyses of unusual properties of superconductors. (Note:
the Tc of this model is not given clearly in this work, but we have advanced
this mechanism to a t-x model which includes various superconductivities and
magnetisms (please see arXiv:0707.3660 and following works).)
","[{""version"":""v1"",""created"":""Mon, 21 Jan 2008 07:49:54 GMT""},{""version"":""v2"",""created"":""Mon, 22 Sep 2008 12:57:42 GMT""}]","2015-05-13"
"0801.3145","Conrad J. Burden","Conrad J. Burden, Miriam R. Kantorovitz, Susan R. Wilson","Approximate word matches between two random sequences","Published in at http://dx.doi.org/10.1214/07-AAP452 the Annals of
  Applied Probability (http://www.imstat.org/aap/) by the Institute of
  Mathematical Statistics (http://www.imstat.org)","Annals of Applied Probability 2008, Vol. 18, No. 1, 1-21","10.1214/07-AAP452","IMS-AAP-AAP452","math.PR",,"  Given two sequences over a finite alphabet $\mathcal{L}$, the $D_2$ statistic
is the number of $m$-letter word matches between the two sequences. This
statistic is used in bioinformatics for expressed sequence tag database
searches. Here we study a generalization of the $D_2$ statistic in the context
of DNA sequences, under the assumption of strand symmetric Bernoulli text. For
$k<m$, we look at the count of $m$-letter word matches with up to $k$
mismatches. For this statistic, we compute the expectation, give upper and
lower bounds for the variance and prove its distribution is asymptotically
normal.
","[{""version"":""v1"",""created"":""Mon, 21 Jan 2008 07:58:24 GMT""}]","2009-09-29"
"0801.3146","H. Panagopoulos","A. Skouroupathis, M. Constantinou and H. Panagopoulos","Two-loop additive mass renormalization with clover fermions and Symanzik
  improved gluons","20 pages, 8 figures, 14 tables. Phys. Rev. D77, Number 1 (2008)","Phys.Rev.D77:014513,2008","10.1103/PhysRevD.77.014513",,"hep-lat",,"  We calculate the critical value of the hopping parameter, $\kappa_c$, in
Lattice QCD, up to two loops in perturbation theory. We employ the
Sheikholeslami-Wohlert (clover) improved action for fermions and the Symanzik
improved gluon action with 4- and 6-link loops.
  The quantity which we study is a typical case of a vacuum expectation value
resulting in an additive renormalization; as such, it is characterized by a
power (linear) divergence in the lattice spacing, and its calculation lies at
the limits of applicability of perturbation theory.
  Our results are polynomial in $c_{SW}$ (clover parameter) and cover a wide
range of values for the Symanzik coefficients $c_i$. The dependence on the
number of colors N and the number of fermion flavors $N_f$ is shown explicitly.
In order to compare our results to non perturbative evaluations of $\kappa_c$
coming from Monte Carlo simulations, we employ an improved perturbation theory
method for improved actions.
","[{""version"":""v1"",""created"":""Mon, 21 Jan 2008 10:48:28 GMT""}]","2008-11-26"
"0801.3147","Ke Xu","Liang Li, Xin Li, Tian Liu, Ke Xu","From k-SAT to k-CSP: Two Generalized Algorithms",,,,,"cs.DS cs.AI cs.CC",,"  Constraint satisfaction problems (CSPs) models many important intractable
NP-hard problems such as propositional satisfiability problem (SAT). Algorithms
with non-trivial upper bounds on running time for restricted SAT with bounded
clause length k (k-SAT) can be classified into three styles: DPLL-like,
PPSZ-like and Local Search, with local search algorithms having already been
generalized to CSP with bounded constraint arity k (k-CSP). We generalize a
DPLL-like algorithm in its simplest form and a PPSZ-like algorithm from k-SAT
to k-CSP. As far as we know, this is the first attempt to use PPSZ-like
strategy to solve k-CSP, and before little work has been focused on the
DPLL-like or PPSZ-like strategies for k-CSP.
","[{""version"":""v1"",""created"":""Mon, 21 Jan 2008 08:07:33 GMT""}]","2008-01-22"
"0801.3148","Wanjing Wang","Wan-Jing Wang, Kai-Wei Yang, Xue-Bang Wu, Yu-Bing Wang, and Zhen-Gang
  Zhu","Structural transition of force chains observed by mechanical
  spectroscopy",,,,,"cond-mat.soft cond-mat.other",,"  The dissipation properties of a fine sand system are investigated by a
low-frequency mechanical spectroscopy. The experiments show many interesting
profiles of the relative energy dissipation, which imply that some structural
transition of force chains in dense granular media has occurred. The following
data and discussion indicate that the transition of force chains will lead to
the small deformation of arrangement in the granular system, which is
responsible for the historical effects. We hope this research can improve our
knowledge of the microstructure of the granular materials.
","[{""version"":""v1"",""created"":""Mon, 21 Jan 2008 08:26:27 GMT""}]","2008-01-22"
"0801.3149","Aleksandar Gjurchinovski","Aleksandar Gjurchinovski","Is the phase of plane waves a frame-independent quantity?","4 pages, 5 figures, REVTeX",,,,"physics.optics physics.class-ph",,"  The invariance of the phase of plane waves among inertial frames is
investigated in some details. The reason that eventually led the author of a
recent EPL letter [EPL \textbf{79}, 1006 (2007)] to a spurious conclusion of
the non-invariance of the phase of waves has been identified -- it is the
ignorance of the effect of relativistically-induced optical anisotropy in the
analysis of the problem. It is argued that the Lorentz-invariant expression for
the phase of waves should be taken in the form $\Phi=\mathbf{k\cdot
r}-\mathbf{k\cdot u}/c$, instead of the widely-used expression
$\Phi=\mathbf{k\cdot r}-\omega t$ which has a limited validity.
","[{""version"":""v1"",""created"":""Mon, 21 Jan 2008 08:44:34 GMT""},{""version"":""v2"",""created"":""Fri, 25 Jan 2008 08:58:05 GMT""}]","2011-11-10"
"0801.3150","Miguel-Angel Perez-Torres","MAGIC Collaboration: J. Albert, et al","Multi-wavelength (radio, X-ray and gamma-ray) observations of the
  gamma-ray binary LS I +61 303","Accepted for publication in The Astrophysical Journal, Part 1; 8
  pages, 7 figures","Astrophys.J.684:1351-1358,2008","10.1086/590332",,"astro-ph",,"  We present the results of the first multiwavelength observing campaign on the
high-mass X-ray binary LS I +61 303 comprising observations at the TeV regime
with the MAGIC telescope, along with X-ray observations with Chandra, and radio
interferometric observations with the MERLIN, EVN and VLBA arrays, in October
and November 2006. From our MERLIN observations, we can exclude the existence
of large scale (~100 mas) persistent radio-jets. Our 5.0 GHz VLBA observations
display morphological similarities to previous 8.4 GHz VLBA observations
carried out at the same orbital phase, suggesting a high level of periodicity
and stability of the processes behind the radio emission. This makes it
unlikely that variability of the radio emission is due to the interaction of an
outflow with variable wind clumps. If the radio emission is produced by a
milliarcsecond scale jet, it should also show a stable, periodic behavior. It
is then difficult to reconcile the absence of a large scale jet (~100 mas) in
our observations with the evidence of a persistent relativistic jet reported
previously. We find a possible hint of temporal correlation between the X-ray
and TeV emissions and evidence for radio/TeV non-correlation, which points to
the existence of one population of particles producing the radio emission and a
different one producing the X-ray and TeV emissions. Finally, we present a
quasi-simultaneous energy spectrum including radio, X-ray and TeV bands.
","[{""version"":""v1"",""created"":""Mon, 21 Jan 2008 11:50:07 GMT""},{""version"":""v2"",""created"":""Wed, 21 May 2008 14:25:51 GMT""}]","2010-11-11"
"0801.3151","Tatjana Zivkovic","Tatjana Zivkovic and Kristoffer Rypdal","Evidence of low-dimensional chaos in magnetized plasma turbulence",,,"10.1140/epjst/e2008-00841-5",,"physics.plasm-ph",,"  We analyze probe data obtained from a toroidal magnetized plasma
configuration suitable for studies of low-frequency gradient-driven
instabilities. These instabilities give rise to field-aligned convection rolls
analogous to Rayleigh-Benard cells in neutral fluids, and may theoretically
develop similar routes to chaos. When using mean-field dimension analysis, we
observe low dimensionality, but this could originate from either
low-dimensional chaos, periodicity or quasi-periodicity. Therefore, we apply
recurrence plot analysis as well as estimation of the largest Lyapunov
exponent. These analyses provide evidence of low-dimensional chaos, in
agreement with theoretical predictions.
","[{""version"":""v1"",""created"":""Mon, 21 Jan 2008 09:27:52 GMT""},{""version"":""v2"",""created"":""Mon, 10 Mar 2008 08:41:35 GMT""}]","2009-11-13"
"0801.3152","Klaus Doll","K. Doll","Electronic structure of GdN, and the influence of exact exchange","to appear in J. Phys.: Condensed Matter",,"10.1088/0953-8984/20/7/075214",,"cond-mat.mtrl-sci",,"  GdN bulk is studied with the local density approximation, on the Hartree-Fock
level, and on the level of the hybrid functional B3LYP. A local basis set
formalism is used, as implemented in the present CRYSTAL06 release. It is
demonstrated that the code is technically capable of treating this system with
its 4f electrons explicitly, i.e. out of the core. The band structure at the
level of the local density approximation is in good agreement with earlier
calculations and is found to be half-metallic. The Hartree-Fock band structure
is insulating with a large gap. Interestingly, three solutions were found at
the B3LYP level. The lowest of them is insulating for majority spin, and the
Fermi surface for minority spin consists only of points, resulting in a very
low density of states around the Fermi level.
","[{""version"":""v1"",""created"":""Mon, 21 Jan 2008 09:29:14 GMT""}]","2009-11-13"
